conversations,source,score,split
"[{""from"": ""human"", ""value"": ""What is the primary purpose of Stimulus as described in the document?""}, {""from"": ""gpt"", ""value"": ""The primary purpose of Stimulus, as described in the document, is to augment server-side rendered HTML with progressive behavior, allowing developers to add interactivity and responsive features without creating full-fledged JavaScript applications. Stimulus is designed to apply behavior to existing HTML in a way that is simple, maintainable, and enhances the overall user experience by manipulating rather than creating DOM elements.""}]",knowledge/js/stimulus_docs/handbook,1.0,train
"[{""from"": ""human"", ""value"": ""How does Basecamp employ JavaScript in relation to their applications?""}, {""from"": ""gpt"", ""value"": ""Basecamp employs JavaScript not to create standalone \""JavaScript applications,\"" but rather to add small enhancements to server-side rendered HTML. This approach ensures that the core of their applications remains robust and manageable while allowing for smooth interactions using JavaScript to make the user interface more appealing. The use of a single set of Ruby on Rails controllers, views, and models across different platforms is crucial for the productivity of Basecamp's small team.""}]",knowledge/js/stimulus_docs/handbook,1.0,train
"[{""from"": ""human"", ""value"": ""What is the significance of Turbo in the Stimulus framework?""}, {""from"": ""gpt"", ""value"": ""Turbo plays a significant role in the Stimulus framework by handling page transitions efficiently. It maintains a persistent process that intercepts link clicks and loads new pages using Ajax, which reduces the perception of loading times associated with full-page refreshes. This results in significantly faster page-to-page transitions (up to ~3x faster for Basecamp). Combined with Stimulus, Turbo provides a fluid, responsive experience similar to single-page applications, while retaining the benefits of server-side rendering.""}]",knowledge/js/stimulus_docs/handbook,1.0,train
"[{""from"": ""human"", ""value"": ""Can you explain the three core concepts of Stimulus?""}, {""from"": ""gpt"", ""value"": ""The three core concepts of Stimulus are Controllers, Actions, and Targets. \n- **Controllers**: These are the JavaScript classes that handle specific behaviors for elements. They act as middlemen between the user interface and the application's logic.\n- **Actions**: These define the user events (like clicks) that trigger behaviors defined in Controllers. Actions are declared in the HTML using data attributes.\n- **Targets**: Targets are specific elements within a Controller's scope that the Controller will interact with. They allow the Controller to manipulate parts of the DOM directly.""}]",knowledge/js/stimulus_docs/handbook,1.0,train
"[{""from"": ""human"", ""value"": ""How does Stimulus differ from other contemporary JavaScript frameworks?""}, {""from"": ""gpt"", ""value"": ""Stimulus differs from contemporary JavaScript frameworks primarily in its approach to HTML and state management. Instead of focusing on turning JSON into DOM elements and managing application state with JavaScript objects, Stimulus emphasizes manipulating existing HTML elements while storing state directly within the HTML. This results in fewer complexities and allows Controllers to be discarded between page changes while retaining their initial setup when caching is used. This unique approach fosters simplicity and ease of use, appealing to developers who may find mainstream frameworks overly complicated.""}]",knowledge/js/stimulus_docs/handbook,1.0,train
"[{""from"": ""human"", ""value"": ""What specific kind of interactivity does Stimulus facilitate?""}, {""from"": ""gpt"", ""value"": ""Stimulus facilitates a range of interactivity through the manipulation of existing HTML. This includes features like showing and hiding elements, copying content to the clipboard, adding items to lists, and altering the properties of DOM elements (such as CSS classes). Designed as a small framework, it encourages clarity and maintainability, allowing developers to easily read and understand how the behavior applies to a given HTML structure, significantly aiding in the development process.""}]",knowledge/js/stimulus_docs/handbook,1.0,train
"[{""from"": ""human"", ""value"": ""How can HTML elements be enhanced using Stimulus as shown in the example?""}, {""from"": ""gpt"", ""value"": ""HTML elements can be enhanced using Stimulus by adding specific data attributes that define behaviors and controllers. In the given example:\n```html\n<div data-controller=\""clipboard\"">\n  PIN: <input data-clipboard-target=\""source\"" type=\""text\"" value=\""1234\"" readonly>\n  <button data-action=\""clipboard#copy\"">Copy to Clipboard</button>\n</div>\n```\nThis snippet declares a `clipboard` controller that handles copying the PIN value from the input field to the clipboard when the button is clicked. The `data-clipboard-target=\""source\""` attribute designates the input field as a target for the controller, making it easy for developers to see which parts of the HTML are affected by specific JavaScript behavior.""}]",knowledge/js/stimulus_docs/handbook,1.0,train
"[{""from"": ""human"", ""value"": ""What did Basecamp use prior to implementing Stimulus, and what issues did they face?""}, {""from"": ""gpt"", ""value"": ""Before implementing Stimulus, Basecamp employed a mix of different JavaScript styles and patterns, including jQuery and vanilla JavaScript, to add interactivity to their web applications. However, this led to several issues: \n1. **Inconsistency** in the coding style made it hard for new developers to adopt a unified approach.\n2. The lack of a comprehensive solution resulted in a proliferation of in-house patterns, making code reuse challenging.\n3. The associative nature of the code became harder to manage as multiple overlapping styles coexisted. This inconsistency impeded productivity and clarity, leading to the development of Stimulus to streamline their approach.""}]",knowledge/js/stimulus_docs/handbook,1.0,train
"[{""from"": ""human"", ""value"": ""What are the advantages of using Turbo and Stimulus together?""}, {""from"": ""gpt"", ""value"": ""Using Turbo and Stimulus together provides several advantages: \n1. **Improved Performance**: Turbo enhances application speed by reducing loading times during navigation, while Stimulus boosts interactivity without complicating the HTML structure.\n2. **Simplified Development**: The combination allows developers to work within a familiar request-response paradigm, making it easier to manage interactions in a straightforward manner.\n3. **Scalability**: Using Turbo for general app performance and Stimulus for handling interactivity means that developers can scale their applications efficiently without overcomplicating code for every interaction.\n4. **Flexible Integration**: They can also work alongside heavier frameworks when necessary, allowing teams to choose the best tools for different parts of their application.""}]",knowledge/js/stimulus_docs/handbook,1.0,train
"[{""from"": ""human"", ""value"": ""How does Stimulus contribute to avoiding heavy lifting in development?""}, {""from"": ""gpt"", ""value"": ""Stimulus contributes to avoiding heavy lifting in development by promoting a minimalist approach that focuses on enhancing existing HTML with behavior, rather than reinventing how web applications are structured. This involves:\n1. **Minimal Code Overhead**: Stimulus allows developers to use clean, declarative syntax in HTML, reducing the need to write complex JavaScript logic.\n2. **Enhanced Readability**: By associating behavior directly with DOM elements, the intent becomes clearer, making it easier for developers to comprehend and maintain the code.\n3. **Reduced Complexity**: Stimulus does not require developers to manage extensive state within JavaScript; instead, it encourages managing state directly within the HTML, simplifying overall architecture.\nThus, it allows small teams to work effectively without the high demands of larger frameworks.""}]",knowledge/js/stimulus_docs/handbook,1.0,train
"[{""from"": ""human"", ""value"": ""In what ways can Stimulus be seen as a toolkit for small teams?""}, {""from"": ""gpt"", ""value"": ""Stimulus can be viewed as a toolkit for small teams because it simplifies the development process by emphasizing a clear, lightweight approach to adding interactivity to applications. Key aspects include:\n1. **Ease of Use**: The straightforward syntax and structure make it accessible for developers to pick up quickly, encouraging rapid development cycles.\n2. **Efficiency**: By focusing on manipulating existing markup rather than creating new elements from scratch, developers can create rich UIs without extensive coding.\n3. **Maintainability**: With its clear idiosyncrasies in coding style, it makes projects easier to manage and scale without convoluted dependencies or patterns.\n4. **Collaboration Friendly**: Rather than requiring deep knowledge of frameworks, team members can contribute effectively without facing a steep learning curve, fostering better collaboration across the team.""}]",knowledge/js/stimulus_docs/handbook,1.0,train
"[{""from"": ""human"", ""value"": ""What benefits does server-side rendering provide according to the document?""}, {""from"": ""gpt"", ""value"": ""According to the document, server-side rendering provides several benefits, including:\n1. **Faster Initial Load**: Server-side rendering allows for quicker page load times since the HTML is generated on the server and delivered to the client as complete documents, improving the experience for users.\n2. **SEO Optimization**: Pages that are server-side rendered tend to perform better in search engine optimization because search engines can index the fully formed HTML content without needing to execute JavaScript to render the page.\n3. **Simplified Application Architecture**: By focusing on server-rendered views, applications can avoid the complexity associated with managing client-side state and rendering, which can lead to reduced maintenance overhead and cleaner separation of concerns.""}]",knowledge/js/stimulus_docs/handbook,1.0,train
"[{""from"": ""human"", ""value"": ""How do Turbo and Stimulus complement each other in enhancing user experience?""}, {""from"": ""gpt"", ""value"": ""Turbo and Stimulus complement each other in enhancing user experience through a collaborative effort in managing performance and interaction:\n1. **Turbo**: Turbo focuses on making navigation between pages feel seamless by loading new content asynchronously, thus cutting down the full-page reloads that typically slow down web applications. Users experience remarkably faster transitions from one page to another.\n2. **Stimulus**: Stimulus enriches individual page interactions by responding to user actions directly within the page context. It allows for behaviors such as copying text, showing/hiding elements, or modifying content without requiring a full page refresh.\nTogether, they create an application that feels fast, intuitive, and engaging, closely mimicking the fluidity of single-page applications while maintaining the simplicity and structure of traditional server-rendered applications.""}]",knowledge/js/stimulus_docs/handbook,1.0,train
"[{""from"": ""human"", ""value"": ""What are the implications of maintaining state in HTML as opposed to JavaScript?""}, {""from"": ""gpt"", ""value"": ""Maintaining state in HTML, as opposed to JavaScript, has several implications:\n1. **Reduced Complexity**: By storing state within the HTML, developers avoid the intricacies of managing the lifecycle of JavaScript objects that hold state, simplifying the overall architecture.\n2. **Enhanced Stability**: HTML-based state management allows controllers (containing behavior logic) to be independently discarded and reinitialized upon page changes, ensuring that the interface remains consistent without the risk of losing the state due to interactions occurring throughout the application.\n3. **Performance Benefits**: Unlike JavaScript-based state management that might lead to excessive memory use or stale data due to object retention, HTML-based management leverages the browser's inherent optimizations for rendering content. This results in faster, more reliable interactions.""}]",knowledge/js/stimulus_docs/handbook,1.0,train
"[{""from"": ""human"", ""value"": ""What are the challenges faced with the mainstream JavaScript application development paradigms?""}, {""from"": ""gpt"", ""value"": ""The mainstream JavaScript application development paradigms pose several challenges:\n1. **Complexity**: Using frameworks like React in conjunction with state management libraries like Redux can result in convoluted architectures that require many layers of abstraction, leading to long learning curves for new developers.\n2. **State Management**: Maintaining complex states across various components often results in uncertain behaviors and can introduce bugs, making debugging more labor-intensive and time-consuming.\n3. **Performance Issues**: Single-page applications that rely heavily on client-side rendering may face performance degradation, especially when transitioning between views that require substantial re-renders.\n4. **Decoupling**: While striving for a solution that decouples components and promotes reusability, developers may find themselves creating redundant complexities that inadvertently lead back to tightly coupled code structures. This journey towards optimal architecture can waste resources and slow down development.""}]",knowledge/js/stimulus_docs/handbook,1.0,train
"[{""from"": ""human"", ""value"": ""Can you give an example of how Turbo reduces the perceptual loading time?""}, {""from"": ""gpt"", ""value"": ""Turbo reduces perceptual loading time by intercepting user actions, such as clicks on links, and loading new content asynchronously using Ajax instead of relying on full-page refreshes. For instance, when a user clicks a link to navigate to a new page, Turbo fetches the new HTML in the background and updates the existing document without requiring a full reload. \nThis approach minimizes the amount of time users perceive waiting, as the previous page remains visually consistent until the new page is fully ready to be displayed. As a result, users experience a smooth transition that significantly enhances their overall sense of speed and responsiveness when navigating the application.""}]",knowledge/js/stimulus_docs/handbook,1.0,train
"[{""from"": ""human"", ""value"": ""What does the phrase 'majestic monolith' refer to in the context of the document?""}, {""from"": ""gpt"", ""value"": ""In the context of the document, the phrase 'majestic monolith' refers to Basecamp's architectural philosophy of building applications that are cohesive and unified, utilizing a single codebase and set of technologies (specifically Ruby on Rails) across multiple platforms. This approach promotes simplicity and efficiency, making it easier for small teams to manage and develop code while reducing complexity. The majestic monolith contrasts with modern trends that favor microservices or extensive client-side JavaScript frameworks, emphasizing a streamlined development process over unnecessary fragmentation.""}]",knowledge/js/stimulus_docs/handbook,1.0,train
"[{""from"": ""human"", ""value"": ""What value does a single set of controllers, views, and models provide for Basecamp?""}, {""from"": ""gpt"", ""value"": ""Having a single set of controllers, views, and models provides immense value for Basecamp by ensuring consistency and facilitating easier maintenance and updates across their applications. It allows the Basecamp team to work on different platforms\u2014like web and mobile\u2014using the same foundational code, which enhances productivity and accelerates development cycles. This approach removes duplication of efforts and helps maintain a clear structure, ultimately leading to a more organized and efficient workflow that can adapt to changes or feature additions quickly.""}]",knowledge/js/stimulus_docs/handbook,1.0,train
"[{""from"": ""human"", ""value"": ""What is the overall philosophy behind the creation of Stimulus?""}, {""from"": ""gpt"", ""value"": ""The overall philosophy behind the creation of Stimulus is to create a modest, yet powerful framework that simplifies the way developers add interactivity to server-rendered HTML. It aims to address the complexity and overhead often associated with modern JavaScript frameworks by embracing a simpler, more intuitive model that focuses on manipulating existing HTML elements rather than creating them from scratch. This philosophy is rooted in the desire for greater productivity, maintainability, and ease of collaboration for small development teams, allowing them to deliver high-quality web applications without the extreme complexity of contemporary approaches.""}]",knowledge/js/stimulus_docs/handbook,1.0,train
"[{""from"": ""human"", ""value"": ""How does Stimulus maintain the separation of concerns in web development?""}, {""from"": ""gpt"", ""value"": ""Stimulus maintains the separation of concerns in web development by clearly delineating the roles of HTML, CSS, and JavaScript. The framework relies on server-rendered HTML for structure, allowing it to focus on adding behavior through JavaScript without getting involved in generating HTML content itself. By associating behavior directly with HTML elements using data attributes, developers can easily identify which scripts affect specific components of the UI, preserving the clarity of their code and promoting a clean separation between the markup, style, and functionality.""}]",knowledge/js/stimulus_docs/handbook,1.0,train
"[{""from"": ""human"", ""value"": ""What does the document suggest as a potential future direction for Stimulus?""}, {""from"": ""gpt"", ""value"": ""The document suggests that a potential future direction for Stimulus could involve introducing additional features or 'sugar' to further streamline the creation of new DOM elements through its controllers. While current usage revolves around manipulating existing HTML, the enhancement in building elements could expand the framework's capabilities. Overall, any future development would aim to retain the framework\u2019s core principles of simplicity and maintainability, aligning with the ethos that has driven the creation of Stimulus.""}]",knowledge/js/stimulus_docs/handbook,1.0,train
"[{""from"": ""human"", ""value"": ""In what way does the document imply that using various frameworks could be beneficial?""}, {""from"": ""gpt"", ""value"": ""The document implies that using various frameworks could be beneficial by allowing developers to leverage the strengths of different tools based on the needs of specific portions of their applications. For example, while Stimulus and Turbo handle the core interactions and page transitions effectively, developers might opt for other, more complex frameworks for parts of their application that require detailed client-side rendering or sophisticated state management. This flexibility enables teams to strike a balance between simplicity and power, ensuring that the architecture aligns with the specific demands of each feature or page.""}]",knowledge/js/stimulus_docs/handbook,1.0,train
"[{""from"": ""human"", ""value"": ""How are the ideas behind Stimulus informed by Basecamp's experiences with previous versions of the application?""}, {""from"": ""gpt"", ""value"": ""The ideas behind Stimulus are informed by Basecamp's experiences with previous versions of their applications by reflecting on the need for a consistent, manageable development approach that enhances productivity. Over time, as they encountered various complexities and challenges in evolving their applications with disparate methods, the decision emerged to consolidate and simplify their front-end JavaScript interactions into a cohesive framework. By drawing on the lessons learned from using a variety of practices and tools over the years, the developers at Basecamp were inspired to create Stimulus, fostering efficiency and clarity in their code.""}]",knowledge/js/stimulus_docs/handbook,1.0,train
"[{""from"": ""human"", ""value"": ""What challenge does the document point out regarding the adoption of modern paradigms?""}, {""from"": ""gpt"", ""value"": ""The document points out that a significant challenge regarding the adoption of modern paradigms, particularly in web development, is the increased complexity and maintenance overhead associated with frameworks like React or Angular. While these frameworks provide powerful tools for building applications, they also introduce intricate architectures that may overwhelm developers, particularly those who are new to the ecosystem. This complexity can create barriers to entry, leading to a preference for simpler, more straightforward approaches like Turbo and Stimulus for certain applications, especially when their feature sets do not warrant such extensive tooling.""}]",knowledge/js/stimulus_docs/handbook,1.0,train
"[{""from"": ""human"", ""value"": ""Why might experienced JavaScript developers find Stimulus' approach unappealing?""}, {""from"": ""gpt"", ""value"": ""Experienced JavaScript developers might find Stimulus' approach unappealing because they are accustomed to the established paradigms of modern frameworks that emphasize object-oriented programming, state management, and a more dynamic interaction model. Developers used to working with tools like React or Vue may perceive Stimulus as lacking in the depth and flexibility of those frameworks and may scoff at its focus on simplicity and direct HTML manipulation. For those who thrive on the complexity and rich functionalities of larger frameworks, Stimulus may come across as too simplistic and not well-suited for high-performance applications, given their preferences for abstraction and separation of concerns.""}]",knowledge/js/stimulus_docs/handbook,1.0,train
"[{""from"": ""human"", ""value"": ""What does the document imply about the future of web development practices?""}, {""from"": ""gpt"", ""value"": ""The document implies that the future of web development practices may be shifting towards simpler, more streamlined approaches that prioritize clarity, maintainability, and performance without the convoluted architectures often associated with mainstream tools. As developers become increasingly aware of the trade-offs involved in adopting complex frameworks, there may be a growing inclination towards leveraging lightweight solutions like Stimulus and Turbo, particularly for applications where simplicity is paramount. This evolution reflects a desire to return to a more direct, intuitive way of building web applications, emphasizing the value of elegance and efficiency in development.""}]",knowledge/js/stimulus_docs/handbook,1.0,train
"[{""from"": ""human"", ""value"": ""How does the document reflect Basecamp's philosophy regarding software development?""}, {""from"": ""gpt"", ""value"": ""The document reflects Basecamp's philosophy regarding software development by emphasizing an approach that values simplicity, productivity, and clarity over complexity. Basecamp believes in creating robust applications using a cohesive, unified codebase that allows for agility and ease of maintenance. Their history of building applications and their choice to adopt frameworks like Stimulus and Turbo underline a commitment to avoiding unnecessary complications, aligning with their overall mission to empower small teams to achieve high-quality results without relying on heavyweight solutions that can bog down development cycles.""}]",knowledge/js/stimulus_docs/handbook,1.0,train
"[{""from"": ""human"", ""value"": ""What is the significance of the statement 'Give it a go' at the end of the document?""}, {""from"": ""gpt"", ""value"": ""The statement 'Give it a go' at the end of the document signifies an invitation for developers to try out Stimulus and Turbo in their own projects. It encourages exploration and experimentation without the fear of committing to a complex framework. This aligns with Basecamp's philosophy of promoting simpler and efficient tools for web development, suggesting that developers should take the opportunity to experience the benefits of this approach firsthand and see if it aligns with their own development needs and philosophies.""}]",knowledge/js/stimulus_docs/handbook,1.0,train
"[{""from"": ""human"", ""value"": ""What kind of applications does Basecamp identify as not needing extensive tooling?""}, {""from"": ""gpt"", ""value"": ""Basecamp identifies applications that primarily rely on straightforward interactions, such as form submissions, UI updates, and other typical web functionalities, as not needing extensive tooling. Applications with clear, request-response cycles and minimal client-side complexity are well-suited for approaches like Stimulus and Turbo. The philosophy behind this observation is to encourage developers to apply the right level of complexity based on the application's requirements rather than defaulting to heavier, more intricate frameworks that might not add proportional value to simpler use cases.""}]",knowledge/js/stimulus_docs/handbook,1.0,train
