conversations,source,score,split
"[{""from"": ""human"", ""value"": ""How does the document articulate the balance between light and heavy frameworks?""}, {""from"": ""gpt"", ""value"": ""The document articulates the balance between light and heavy frameworks by emphasizing that developers should choose tools based on the specific needs of their applications. While lightweight frameworks like Stimulus and Turbo are ideal for handling core interactions and providing responsiveness without undue complexity, there are instances where heavier frameworks are warranted\u2014such as with complex client-side functionalities that demand high fidelity. This balanced approach allows developers to use each tool's strengths appropriately, ensuring that applications are efficient and maintainable without unnecessary overhead.""}]",knowledge/js/stimulus_docs/handbook,1.0,train
"[{""from"": ""human"", ""value"": ""Can you summarize the key insights gained from Basecamp's approach to web application development as presented in the document?""}, {""from"": ""gpt"", ""value"": ""Key insights gained from Basecamp's approach to web application development as presented in the document include the following:\n1. **Simplicity Over Convoluted Architectures**: Emphasizing lightweight frameworks for interactions enhances productivity and reduces complexity.\n2. **Server-Side Rendering with Progressive Enhancement**: Retaining server-rendered HTML while adding interactive elements via Stimulus simplifies development while maximizing performance.\n3. **Cohesive Code Management**: Using a single set of controllers, views, and models accelerates iteration and fosters maintainability. \n4. **Flexibility in Choosing Tools**: Combining light frameworks with heavier tools as necessary allows developers to cater to the varying needs of their applications effectively.\n5. **Greater Readability and Clarity**: By connecting behaviors within HTML through clear data attributes, developers can create more maintainable and understandable codebases, paving the way for effective collaboration.""}]",knowledge/js/stimulus_docs/handbook,1.0,train
"[{""from"": ""human"", ""value"": ""How does the concept of 'request-response paradigm' influence Basecamp's development strategy?""}, {""from"": ""gpt"", ""value"": ""The concept of the 'request-response paradigm' influences Basecamp's development strategy by guiding the focus towards maintaining a simple, efficient interaction model where each user action results in a clear request to the server and a response that updates the web application state without overwhelming complexities. This approach encourages developers to minimize client-side rendering and heavy state management, preserving clarity and performance. By adhering to this paradigm, Basecamp is able to deliver web applications that feel responsive and fluid while keeping the underlying architecture straightforward and easy to maintain.""}]",knowledge/js/stimulus_docs/handbook,1.0,train
"[{""from"": ""human"", ""value"": ""What does the document suggest regarding the complexity of modern JavaScript frameworks?""}, {""from"": ""gpt"", ""value"": ""The document suggests that modern JavaScript frameworks often introduce unnecessary complexity, resulting in convoluted architecture that hampers development speed and agility. This complexity can lead to steep learning curves for newcomers and increased maintenance burdens for existing developers. Frameworks that prioritize heavy state management and elaborate client-side rendering can detract from the simplicity desired in many applications. Basecamp's perspective advocates for a return to simpler techniques that provide sufficient interactivity without overwhelming developers with intricate demands.""}]",knowledge/js/stimulus_docs/handbook,1.0,train
"[{""from"": ""human"", ""value"": ""What role does community feedback play in the development of Stimulus as discussed in the document?""}, {""from"": ""gpt"", ""value"": ""The document implies that community feedback plays a critical role in the development of Stimulus by allowing Basecamp to learn from user experiences and adapt to the needs of developers. By observing how teams utilize Stimulus in real-world applications, Basecamp can identify areas where the framework can be improved, ensuring its evolution aligns with practical use cases. Listening to community input fosters a collaborative approach to development, enhancing Stimulus's utility and relevance while maintaining its core philosophy of simplicity and effectiveness.""}]",knowledge/js/stimulus_docs/handbook,1.0,train
"[{""from"": ""human"", ""value"": ""What challenges does Basecamp foresee in the adoption of Stimulus?""}, {""from"": ""gpt"", ""value"": ""Basecamp foresees several challenges in the adoption of Stimulus:\n1. **Resistance to Change**: Developers accustomed to complex frameworks might resist transitioning to a simpler paradigm, perceiving it as limiting.\n2. **Loss of Familiarity**: The departure from mainstream frameworks may lead to a loss of familiarity for developers who are comfortable within established environments.\n3. **Bridging Knowledge Gaps**: New developers may face challenges in comprehending Stimulus's unique approach, necessitating adequate documentation and resources to ensure proper onboarding.\n4. **Perceptions of Capability**: Some may dismiss Stimulus as not capable enough for advanced applications, potentially overlooking its strengths in fostering maintainable and efficient development.""}]",knowledge/js/stimulus_docs/handbook,1.0,train
"[{""from"": ""human"", ""value"": ""How does Stimulus utilize existing HTML to reduce development effort?""}, {""from"": ""gpt"", ""value"": ""Stimulus utilizes existing HTML to reduce development effort by applying behavior directly to elements through data attributes rather than requiring developers to create new DOM elements from scratch. This allows developers to enhance interactivity without rewriting HTML or complex JavaScript logic each time. By manipulating the underlying markup, Stimulus ensures that behaviors are closely tied to the existing structure, promoting reuse of code and simplifying maintenance. As a result, development becomes more efficient and clear, contributing to faster iteration cycles.""}]",knowledge/js/stimulus_docs/handbook,1.0,train
"[{""from"": ""human"", ""value"": ""What perspective does Basecamp hold regarding the evolution of web applications?""}, {""from"": ""gpt"", ""value"": ""Basecamp holds a perspective that values the evolution of web applications towards greater simplicity and efficiency. They believe that modern web applications should not succumb to the excessive complexity often associated with contemporary frameworks but instead embrace a model that allows developers to innovate and enhance applications with minimal overhead. This view reflects a return to more straightforward, robust architectures that allow small teams to compete effectively, producing high-quality results without the burden of convoluted tooling.""}]",knowledge/js/stimulus_docs/handbook,1.0,train
"[{""from"": ""human"", ""value"": ""How does the document address the similarities between Ruby on Rails and Stimulus?""}, {""from"": ""gpt"", ""value"": ""The document addresses the similarities between Ruby on Rails and Stimulus by highlighting that both approaches stem from a desire for simplicity and efficiency in web development. Just as Ruby on Rails was aimed at streamlining the process of building web applications with clear conventions and structures, Stimulus seeks to enhance server-rendered HTML with straightforward behaviors, minimizing the need for complex frameworks. Both frameworks promote productivity and maintainability, allowing developers to create high-quality applications with less friction.""}]",knowledge/js/stimulus_docs/handbook,1.0,train
"[{""from"": ""human"", ""value"": ""What insight into software evolution can be drawn from Basecamp's approach as shared in the document?""}, {""from"": ""gpt"", ""value"": ""An insight into software evolution drawn from Basecamp's approach, as shared in the document, is that the landscape of web development has cycles of complexity and simplicity. Despite the trends toward increasingly intricate frameworks, Basecamp emphasizes the enduring value of return to straightforward methodologies that prioritize maintainability and user experience. Their approach reflects the understanding that as technology evolves, the effectiveness of development practices can often benefit from a reduction in unnecessary complexity, enabling teams to innovate and iterate at a faster pace.""}]",knowledge/js/stimulus_docs/handbook,1.0,train
"[{""from"": ""human"", ""value"": ""How does the document reflect upon the implications of JavaScript frameworks in relation to productivity?""}, {""from"": ""gpt"", ""value"": ""The document reflects upon the implications of JavaScript frameworks in relation to productivity by suggesting that many contemporary frameworks introduce complexities that can slow down development cycles and hinder agility. Basecamp's viewpoint is that productivity is enhanced when developers can focus on building features without getting bogged down in intricate architectures and unnecessary abstractions. By leveraging lightweight solutions such as Stimulus and Turbo, developers are empowered to maintain a higher level of productivity, delivering value effectively and efficiently.""}]",knowledge/js/stimulus_docs/handbook,1.0,train
"[{""from"": ""human"", ""value"": ""What does Basecamp's experience suggest about choosing the right tools for software projects?""}, {""from"": ""gpt"", ""value"": ""Basecamp's experience suggests that choosing the right tools for software projects involves evaluating the specific needs of the application and selecting frameworks that align with those requirements. Rather than automatically opting for more complex solutions, developers should consider whether lightweight frameworks like Stimulus and Turbo can effectively address their needs without introducing excessive overhead or complexity. This approach advocates for a careful assessment of tool interactions, aiming to strike a balance between functionality and manageability, ultimately enhancing the overall development experience.""}]",knowledge/js/stimulus_docs/handbook,1.0,train
"[{""from"": ""human"", ""value"": ""What conclusion might be drawn about the future landscape of web development based on the document's insights?""}, {""from"": ""gpt"", ""value"": ""Based on the document's insights, a conclusion that might be drawn about the future landscape of web development is that there may be a trend towards embracing simpler, more cohesive approaches that prioritize user experience, maintainability, and developer productivity. As teams recognize the need to balance complexity with efficiency, frameworks that streamline interactions like Stimulus and Turbo could gain traction for their ability to deliver responsive applications without the weight of overwhelmingly intricate toolsets. This evolution indicates a movement towards practical, effective solutions that cater to diverse application requirements.""}]",knowledge/js/stimulus_docs/handbook,1.0,train
"[{""from"": ""human"", ""value"": ""How might developers balance the need for interactivity with minimal complex coding in web applications?""}, {""from"": ""gpt"", ""value"": ""Developers can balance the need for interactivity with minimal complex coding in web applications by utilizing frameworks like Stimulus that allow for clear, simple enhancements to existing HTML. Through the use of data attributes, developers can easily connect JavaScript interactions to specific DOM elements without extensive boilerplate code or complex state management. By focusing on manipulating the existing structure rather than creating new elements, they can achieve desired interactive features rapidly and efficiently. This approach not only maintains code clarity but also enhances the user experience without the burden of over-engineering.""}]",knowledge/js/stimulus_docs/handbook,1.0,train
"[{""from"": ""human"", ""value"": ""What does the document suggest about the future of tools aimed at web development?""}, {""from"": ""gpt"", ""value"": ""The document suggests that the future of tools aimed at web development may increasingly favor those that enable simplicity, efficiency, and gratification without overwhelming complexity. This reflects evolving developer preferences for frameworks that allow for agile development without bogging down projects in intricate dependencies. As the demand grows for tools that enhance productivity and deliver meaningful experiences without rapid obsolescence, there may be a shift in focus towards solutions that can reliably serve various applications while adhering to the principles of maintainability and clarity.""}]",knowledge/js/stimulus_docs/handbook,1.0,train
"[{""from"": ""human"", ""value"": ""What are the potential outcomes of adopting the Stimulus framework in a web project?""}, {""from"": ""gpt"", ""value"": ""The potential outcomes of adopting the Stimulus framework in a web project include:\n1. **Increased Developer Productivity**: Developers may experience quicker development cycles as Stimulus enables straightforward integration of behavior and simplifies the coding process for interactivity.\n2. **Enhanced Maintainability**: Projects may benefit from cleaner code structures that are easier to understand and manage, promoting better collaboration among team members.\n3. **Improved User Experience**: Users may enjoy a more responsive and engaging interface as Stimulus allows for efficient manipulation of DOM elements, enhancing usability without the need for heavy frameworks.\n4. **Reduced Complexity**: Projects are likely to have lower levels of complexity, making onboarding new developers easier and ensuring that maintainability is preserved over time.""}]",knowledge/js/stimulus_docs/handbook,1.0,train
"[{""from"": ""human"", ""value"": ""How might a shift towards simplicity in web development tools affect team dynamics?""}, {""from"": ""gpt"", ""value"": ""A shift towards simplicity in web development tools might positively affect team dynamics by fostering collaboration and reducing friction in the development process. When teams use tools like Stimulus that promote maintainability and clarity, developers can more easily share knowledge and onboard new members, leading to a more cohesive working environment. Simplified tools can also encourage more contribution from team members who may have been intimidated by complex frameworks, allowing for a more inclusive approach to development and potentially sparking greater innovation as team members feel empowered to share and implement ideas.""}]",knowledge/js/stimulus_docs/handbook,1.0,train
