conversations,source,score,split
"[{""from"": ""human"", ""value"": ""What is the purpose of extending value resolution in Symfony's Argument Resolver?""}, {""from"": ""gpt"", ""value"": ""Extending value resolution in Symfony's Argument Resolver allows developers to create custom behaviors for resolving dependencies in controller methods. When a controller action requires certain arguments, the framework uses registered value resolvers to provide these values. By creating custom resolvers, developers can define how specific types of data should be retrieved from requests, enhancing the controller\u2019s ability to handle various data types and improving code organization. This flexibility facilitates easier management of complex dependencies, enhances reusability, and allows for cleaner, more maintainable code.""}]",knowledge/php/symfony-docs-7.1,1.0,train
"[{""from"": ""human"", ""value"": ""What are some built-in value resolvers that Symfony provides?""}, {""from"": ""gpt"", ""value"": ""Symfony provides several built-in value resolvers that help manage common request arguments in controllers. Some of these include:\n1. **BackedEnumValueResolver**: Resolves backed enum cases from route parameters.\n2. **RequestPayloadValueResolver**: Maps request payloads to type-hinted objects.\n3. **RequestAttributeValueResolver**: Searches for request attributes matching argument names.\n4. **DateTimeValueResolver**: Finds date-time compatible request attributes and injects a DateTimeInterface object.\n5. **RequestValueResolver**: Injects the current Request object.\n6. **ServiceValueResolver**: Injects services based on type-hinting.\n7. **SessionValueResolver**: Provides session data.\n8. **DefaultValueResolver**: Sets defaults for optional arguments.\n9. **UidValueResolver**: Converts UID route parameters into UID objects.\n10. **VariadicValueResolver**: Gathers array input into variadic arguments.\nThese resolvers enable Symfony developers to easily inject various data types into controller methods without requiring extensive controller logic.""}]",knowledge/php/symfony-docs-7.1,1.0,train
"[{""from"": ""human"", ""value"": ""How does the BackedEnumValueResolver work in Symfony?""}, {""from"": ""gpt"", ""value"": ""The `BackedEnumValueResolver` in Symfony is designed to resolve backed enum cases from route parameters of the current request. This resolver will extract the named route parameter, check if it corresponds to a backing value of the specified enum class, and if valid, inject the enum case into the controller action as an argument. If the provided value does not match any valid backing values in the enum, the resolver will trigger a 404 Not Found response.\n\nFor instance, consider a backed enum called `Suit`, defined as follows:\n```php\nnamespace App\\Model;\nenum Suit: string\n{\n    case Hearts = 'H';\n    case Diamonds = 'D';\n    case Clubs = 'C';\n    case Spades = 'S';\n}\n```\nIn a controller, you might define a route:\n```php\nclass CardController\n{\n    #[Route('/cards/{suit}')]\n    public function list(Suit $suit): Response\n    {\n        // Handle the suit logic\n    }\n}\n```\nHere, the URL `/cards/H` would successfully resolve to `Suit::Hearts`, while an invalid request would lead to a 404 response. This makes argument resolution for routes cleaner and provides strong typing benefits.""}]",knowledge/php/symfony-docs-7.1,1.0,train
"[{""from"": ""human"", ""value"": ""What is the `RequestPayloadValueResolver`, and when should you use it?""}, {""from"": ""gpt"", ""value"": ""The `RequestPayloadValueResolver` is a built-in Symfony resolver that maps the request payload or query string into type-hinted objects in controller methods. It is especially useful when your controller expects to receive complex data structures from a POST request or from query parameters where the shape of the input data corresponds directly to a class.\n\nTo use this resolver, your controller method should be annotated with either the `MapRequestPayload` or the `MapQueryString` attribute, indicating that the incoming request data should be mapped to the specified object.\n\nFor example, if you have a DTO class for handling user registration:\n```php\nclass UserRegistrationData\n{\n    public string $username;\n    public string $email;\n    public string $password;\n}\n```\nYou can have a controller method like:\n```php\nuse Symfony\\Component\\HttpFoundation\\Response;\nuse Symfony\\Component\\Routing\\Attribute\\Route;\n\nclass UserController\n{\n    #[Route('/register')]\n    public function register(#[MapRequestPayload] UserRegistrationData $data): Response\n    {\n        // handle registration using $data\n    }\n}\n```\nThis allows you to easily group and manipulate multiple parameters received in the request, leading to cleaner and more maintainable code in your controllers.""}]",knowledge/php/symfony-docs-7.1,1.0,train
"[{""from"": ""human"", ""value"": ""Can you explain the `ServiceValueResolver` and how to use it in a Symfony controller?""}, {""from"": ""gpt"", ""value"": ""The `ServiceValueResolver` is a built-in Symfony resolver that allows for automatic injection of services into controller actions based on type-hinting. It follows the principles of autowiring, allowing developers to leverage Symfony\u2019s dependency injection container to resolve and inject service dependencies directly into controller methods.\n\nTo use the `ServiceValueResolver`, you simply type-hint the desired service in your controller method's argument. Symfony will automatically resolve and provide the correct instance of the service when the action is called. This helps keep controller actions clean, and promotes reusability and testability by minimizing the need for manual service instantiation.\n\nFor example, imagine you have a `UserService` class:\n```php\nnamespace App\\Service;\n\nclass UserService\n{\n    public function getUserById(int $id)\n    {\n        // logic to retrieve a user\n    }\n}\n```\nIn your controller, you can define an action like this:\n```php\nnamespace App\\Controller;\n\nuse App\\Service\\UserService;\nuse Symfony\\Component\\HttpFoundation\\Response;\nuse Symfony\\Component\\Routing\\Attribute\\Route;\n\nclass UserController\n{\n    #[Route('/user/{id}')]  \n    public function view(UserService $userService, int $id): Response\n    {\n        $user = $userService->getUserById($id);\n        // render user view\n    }\n}\n```\nHere, `UserService` will be automatically injected into the `view` method, allowing you to call `getUserById` without manual initialization. This approach promotes a clean separation of concerns and easier testing, as mocks can be injected when unit testing.""}]",knowledge/php/symfony-docs-7.1,1.0,train
"[{""from"": ""human"", ""value"": ""What requirements must a custom value resolver satisfy in Symfony?""}, {""from"": ""gpt"", ""value"": ""To create a custom value resolver in Symfony, the resolver must satisfy certain requirements:\n1. **Implement the ValueResolverInterface**: Your custom class must implement the `Symfony\\Component\\HttpKernel\\Controller\\ValueResolverInterface`. This interface mandates the implementation of the `resolve()` method, which the framework will call to resolve controller arguments.\n\n2. **Define the resolve() Method**: The `resolve()` method must accept two parameters: the current `Request` object and the `ArgumentMetadata` instance. It should return an iterable containing the resolved values for the argument or an empty array if it cannot resolve the argument.\n\n3. **Set Up as a Service**: Once the value resolver is implemented, you need to register it as a service in the dependency injection container. This involves defining the service in your configuration files (such as `services.yaml`) with appropriate tags to enable Symfony to recognize it as an argument value resolver.\n\n4. **(Optional) Set Priority and Name**: Although not strictly required, it is common practice to set a priority and possibly a specific name for your resolver when registering it. This ensures the resolver is called at the appropriate time in the lifecycle of dependency resolution, and it may help avoid conflicts with other resolvers.\n\n5. **Match Expected Types**: The custom resolver should implement logic to verify whether it can resolve specific data types, often by checking the type-hint of the controller method\u2019s argument against expected constraints (e.g., class interfaces or types).\n\nFor example, a minimal custom value resolver may look like this:\n```php\nnamespace App\\ValueResolver;\n\nuse Symfony\\Component\\HttpFoundation\\Request;\nuse Symfony\\Component\\HttpKernel\\Controller\\ValueResolverInterface;\nuse Symfony\\Component\\HttpKernel\\ControllerMetadata\\ArgumentMetadata;\n\nclass CustomValueResolver implements ValueResolverInterface\n{\n    public function resolve(Request $request, ArgumentMetadata $argument): iterable\n    {\n        // Logic for resolving values\n    }\n}\n```\nBy adhering to these requirements, you will be able to properly integrate a custom value resolver into Symfony's action argument resolution workflow.""}]",knowledge/php/symfony-docs-7.1,1.0,train
"[{""from"": ""human"", ""value"": ""How can you configure a custom value resolver's service in Symfony?""}, {""from"": ""gpt"", ""value"": ""To configure a custom value resolver's service in Symfony, you need to follow these steps:\n1. **Define the Service**: In your Symfony project, you need to define your custom value resolver as a service in your configuration files. This can be done in `services.yaml`, `services.xml`, or within a PHP service configuration file.\n\n2. **Use the Appropriate Tags**: While defining the service, ensure it is tagged with `controller.argument_value_resolver`. This tag tells Symfony that the service should be treated as a value resolver for controller arguments.\n\n3. **Optional: Specify Priority**: You can also define the `priority` attribute in the service tag if you want to control the order of resolver execution. A higher priority number means the resolver will be called earlier.\n\n4. **Custom Name (if necessary)**: If you want your resolver to be targetable via the `ValueResolver` attribute in controllers, you can assign it a custom name in the service tag.\n\nAn example configuration in `services.yaml` can look like this:\n```yaml\nservices:\n    _defaults:\n        autowire: true\n        autoconfigure: true\n\n    App\\ValueResolver\\CustomValueResolver:\n        tags:\n            - { name: 'controller.argument_value_resolver', priority: 100 }  \n``` \nAlternatively, in `services.php`:\n```php\nnamespace Symfony\\Component\\DependencyInjection\\Loader\\Configurator;\n\nuse App\\ValueResolver\\CustomValueResolver;\n\nreturn static function (ContainerConfigurator $containerConfigurator): void {\n    $services = $containerConfigurator->services();\n\n    $services->set(CustomValueResolver::class)\n        ->tag('controller.argument_value_resolver', ['priority' => 100]);\n};\n```\nThis configuration ensures that Symfony will recognize your custom resolver and manage its lifecycle according to the defined settings.""}]",knowledge/php/symfony-docs-7.1,1.0,train
"[{""from"": ""human"", ""value"": ""What is the purpose of using a custom priority when defining a value resolver in Symfony?""}, {""from"": ""gpt"", ""value"": ""Using a custom priority when defining a value resolver in Symfony allows developers to control the order in which the resolvers are executed during the argument resolution process. Each resolver is called in the order defined by their priority values. A higher priority means the resolver is checked earlier. This is particularly useful when multiple resolvers might be eligible to resolve the same argument.\n\nFor example, if you have a custom resolver that is designed to handle certain types of arguments but cannot handle others, you can set its priority lower than the built-in resolvers that can handle those types. This way, when Symfony processes the request, it will first try the higher-priority ones and only fall back to your custom resolver if none of the higher-priority resolvers can provide a value.\n\nSetting appropriate priorities not only optimizes the resolution process by avoiding unnecessary checks but also prevents conflicts, ensuring that the intended logic is executed first. For instance, if a `SessionValueResolver` has a higher priority than a `DefaultValueResolver`, it allows controllers to check for an existing session before applying default values to arguments, which is a common need in applications.""}]",knowledge/php/symfony-docs-7.1,1.0,train
"[{""from"": ""human"", ""value"": ""How do you target a specific value resolver in your Symfony controller?""}, {""from"": ""gpt"", ""value"": ""To target a specific value resolver in your Symfony controller, you can use the `ValueResolver` attribute, which allows you to explicitly specify which resolver should handle a specific argument when the controller action is invoked. This is useful for situations where multiple resolvers could potentially resolve the same argument, giving you control over the resolver's execution order.\n\nHere\u2019s how to use it:\n1. **Import the ValueResolver Attribute**: Ensure that you import the `ValueResolver` attribute in your controller file.\n\n2. **Annotate the Argument**: Apply the `ValueResolver` attribute to the argument you want to resolve using a specific resolver. Pass the fully qualified class name (FQCN) of the resolver class as the attribute's argument.\n\nFor example:\n```php\nnamespace App\\Controller;\n\nuse App\\ValueResolver\\CustomValueResolver;\nuse Symfony\\Component\\HttpFoundation\\Response;\nuse Symfony\\Component\\Routing\\Attribute\\Route;\nuse Symfony\\Component\\HttpKernel\\Attribute\\ValueResolver;\n\nclass SomeController\n{\n    #[Route('/some-route')]\n    public function action(#[ValueResolver(CustomValueResolver::class)] $param): Response\n    {\n        // Handle the action\n    }\n}\n```\nIn this example, the action method uses the `CustomValueResolver` to resolve the `param` argument. When a request is processed, Symfony will directly call this specified resolver for that particular argument, ensuring the desired logic is executed.""}]",knowledge/php/symfony-docs-7.1,1.0,train
"[{""from"": ""human"", ""value"": ""What steps are needed to implement a custom value resolver to inject an ID value object?""}, {""from"": ""gpt"", ""value"": ""To implement a custom value resolver in Symfony that injects an ID value object (such as a `BookingId`), follow these steps:\n\n1. **Create the Value Object**: Define a simple class representing your ID value. This class should implement a static method for creating instances from string values:\n```php\nnamespace App\\Reservation;\n\nclass BookingId\n{\n    public static function fromString(string $id): self\n    {\n        $obj = new self();\n        // Additional logic if necessary\n        return $obj;\n    }\n}\n```\n\n2. **Define the Value Resolver Class**: Create the resolver class implementing the `ValueResolverInterface`. Within the `resolve()` method, write the logic to check if the argument can be resolved, extract the relevant ID from the request, and return it as an instance of the value object:\n```php\nnamespace App\\ValueResolver;\n\nuse App\\Reservation\\BookingId;\nuse Symfony\\Component\\HttpFoundation\\Request;\nuse Symfony\\Component\\HttpKernel\\Controller\\ValueResolverInterface;\nuse Symfony\\Component\\HttpKernel\\ControllerMetadata\\ArgumentMetadata;\n\nclass BookingIdValueResolver implements ValueResolverInterface\n{\n    public function resolve(Request $request, ArgumentMetadata $argument): iterable\n    {\n        $argumentType = $argument->getType();\n        if (!is_subclass_of($argumentType, BookingId::class, true)) {\n            return [];\n        }\n\n        $value = $request->attributes->get($argument->getName());\n        if (!is_string($value)) {\n            return [];\n        }\n\n        return [BookingId::fromString($value)];\n    }\n}\n```\n\n3. **Register the Resolver as a Service**: Open your service configuration file (e.g., `services.yaml`) and register the resolver class as a service, adding the appropriate tag:\n```yaml\nservices:\n    App\\ValueResolver\\BookingIdValueResolver:\n        tags:\n            - { name: 'controller.argument_value_resolver', priority: 100 }\n```\n\n4. **Use the Value Object in a Controller**: Finally, use the `BookingId` in a controller method, type-hinting it as a parameter:\n```php\nnamespace App\\Controller;\n\nuse App\\Reservation\\BookingId;\nuse Symfony\\Component\\HttpFoundation\\Response;\nuse Symfony\\Component\\Routing\\Attribute\\Route;\n\nclass BookingController\n{\n    #[Route('/booking/{id}')]  \n    public function index(BookingId $id): Response\n    {\n        // Use the $id object\n    }\n}\n```\n\nBy following these steps, you will have a fully functional custom value resolver that injects the ID value object into your controller action based on the route.""}]",knowledge/php/symfony-docs-7.1,1.0,train
