conversations,source,score,split
"[{""from"": ""human"", ""value"": ""How to sanitize user inputs in Symfony applications?""}, {""from"": ""gpt"", ""value"": ""To sanitize user inputs in Symfony applications, you can use built-in validation and sanitization features provided by the framework. Utilize Symfony's Validator component to define rules and constraints. Additionally, always escape output when rendering templates to prevent XSS attacks. Here's an example of using validation:\n\n```php\nuse Symfony\\Component\\Validator\\Validation;\nuse Symfony\\Component\\Validator\\Constraints as Assert;\n\n$validator = Validation::createValidator();\n$input = \""<script>alert('xss');</script>\"";\n$constraint = new Assert\\Regex(['pattern' => '/^[\\w\\s]+$/']);\n$violations = $validator->validate($input, $constraint);\nif (count($violations) > 0) {\n    // Handle validation errors\n}\n```""}]",knowledge/php/symfony-docs-7.1,1.0,train
"[{""from"": ""human"", ""value"": ""What is the purpose of the Symfony console commands?""}, {""from"": ""gpt"", ""value"": ""Symfony console commands provide a powerful way to automate tasks and actions within a Symfony application. They allow developers to run scripts for tasks like database migrations, cache clearing, and generating code. This facilitates better maintenance and management of the application lifecycle. To create a console command, you usually extend the `Command` class and define the necessary functionality within it.""}]",knowledge/php/symfony-docs-7.1,1.0,train
"[{""from"": ""human"", ""value"": ""How can you create a custom Symfony console command?""}, {""from"": ""gpt"", ""value"": ""Creating a custom Symfony console command involves the following steps:\n1. Define a class that extends `Symfony\\Component\\Console\\Command\\Command`.\n2. Configure the command name and description using the `configure()` method.\n3. Implement the logic in the `execute()` method.\n\nHere is an example of a simple console command:\n\n```php\nnamespace App\\Command;\n\nuse Symfony\\Component\\Console\\Command\\Command;\nuse Symfony\\Component\\Console\\Input\\InputInterface;\nuse Symfony\\Component\\Console\\Output\\OutputInterface;\n\nclass MyCustomCommand extends Command\n{\n    protected static $defaultName = 'app:my-custom-command';\n\n    protected function configure(): void\n    {\n        $this\n            ->setDescription('Description of my custom command')\n            ->setHelp('Help message goes here');\n    }\n\n    protected function execute(InputInterface $input, OutputInterface $output): int\n    {\n        // Your command logic here\n        $output->writeln('Hello from my custom command!');\n        return Command::SUCCESS;\n    }\n}\n```""}]",knowledge/php/symfony-docs-7.1,1.0,train
"[{""from"": ""human"", ""value"": ""What is the significance of overriding Symfony's default behavior?""}, {""from"": ""gpt"", ""value"": ""Overriding Symfony's default behavior allows developers to customize and extend the framework's functionality to better suit application needs. This can involve modifying service definitions, customizing event listeners, or overriding templates. It provides flexibility to implement specific business logic or integrate third-party services without losing the benefits of the structured architecture provided by Symfony.""}]",knowledge/php/symfony-docs-7.1,1.0,train
"[{""from"": ""human"", ""value"": ""How can you ensure compatibility with different PHP versions in Symfony applications?""}, {""from"": ""gpt"", ""value"": ""To ensure compatibility with different PHP versions in Symfony applications, it's essential to define your application's PHP version in composer.json. Use the `platform` configuration to specify the desired PHP version,\n\nHere is an example:\n```json\n{\n    \""config\"": {\n        \""platform\"": {\n            \""php\"": \""8.3.0\""\n        }\n    }\n}\n```\nThis ensures that your application dependencies are consistent with the specified PHP version and helps during installation or updates.""}]",knowledge/php/symfony-docs-7.1,1.0,train
"[{""from"": ""human"", ""value"": ""What are the best practices for testing Symfony applications?""}, {""from"": ""gpt"", ""value"": ""Best practices for testing Symfony applications include:\n1. **Use a well-defined structure** for tests, organizing them by feature or functionality.\n2. **Leverage the Symfony testing tools** like `Symfony\\Component\\Validator\\Tests\\ConstraintValidatorTestCase` to create unit and functional tests that take advantage of Symfony's mocking capabilities.\n3. **Create integration tests** to validate how the application interacts with external services or databases.\n4. **Run tests automatically** in CI/CD pipelines to ensure code integrity during deployments.""}]",knowledge/php/symfony-docs-7.1,1.0,train
"[{""from"": ""human"", ""value"": ""How can you automate deployments for Symfony applications?""}, {""from"": ""gpt"", ""value"": ""Automating deployments for Symfony applications can be accomplished using CI/CD tools like GitHub Actions, Jenkins, or GitLab CI. This typically involves:\n1. Defining deployment steps in a pipeline script (such as testing, building, and deploying).\n2. Using deployment tools like Deployer or Ansible for PHP to streamline and manage deployments.\n3. Ensuring the application is tested in staging before moving to production.\n4. Keeping environment variables secure and properly configured for each environment.""}]",knowledge/php/symfony-docs-7.1,1.0,train
"[{""from"": ""human"", ""value"": ""What are the common pitfalls in Symfony application development?""}, {""from"": ""gpt"", ""value"": ""Common pitfalls in Symfony application development include:\n1. **Not following best practices** for directory structure and service definitions, which can lead to maintenance issues.\n2. **Neglecting security practices**, such as improperly configuring access to sensitive files, which can lead to vulnerabilities.\n3. **Ignoring performance optimizations** like caching and database indexing, which can degrade application responsiveness.\n4. **Failing to write proper tests**, which increases the risk of regressions as the application evolves.""}]",knowledge/php/symfony-docs-7.1,1.0,train
"[{""from"": ""human"", ""value"": ""How can you effectively manage Symfony dependencies?""}, {""from"": ""gpt"", ""value"": ""To effectively manage Symfony dependencies, use Composer as the dependency manager. Key actions include:\n1. **Regularly updating dependencies** with the `composer update` command to incorporate the latest features and security patches.\n2. **Using version constraints** in the `composer.json` file to ensure compatibility while allowing for flexibility in version upgrades.\n3. **Auditing dependencies** for vulnerabilities using tools like `composer audit`.\n4. **Locking versions** with `composer.lock` to maintain consistency across environments.""}]",knowledge/php/symfony-docs-7.1,1.0,train
"[{""from"": ""human"", ""value"": ""What is the role of service containers in Symfony applications?""}, {""from"": ""gpt"", ""value"": ""Service containers in Symfony applications provide a powerful method for dependency injection, allowing different services to be registered and instantiated at runtime. This promotes decoupling of the application components, enabling better testing, maintenance, and configuration management. You can define services (like controllers, repositories) in configuration files or directly through annotations.""}]",knowledge/php/symfony-docs-7.1,1.0,train
"[{""from"": ""human"", ""value"": ""How does Symfony implement routing, and what is its significance?""}, {""from"": ""gpt"", ""value"": ""Symfony implements routing using a flexible routing component which maps requests to the appropriate controller actions based on a defined set of routes. This routing system is significant for defining how URLs are handled within the application, allowing clean, SEO-friendly URLs, and facilitating REST API creation. The routes can be defined in YAML, XML, or PHP files, or even directly in annotations in controller classes.""}]",knowledge/php/symfony-docs-7.1,1.0,train
"[{""from"": ""human"", ""value"": ""What are command-line arguments and options in Symfony and how are they used?""}, {""from"": ""gpt"", ""value"": ""In Symfony, command-line arguments and options allow users to pass data when executing console commands. Arguments are required inputs, while options are optional and generally defined in the command's `configure()` method. They enhance the flexibility of commands, enabling different behaviors based on user input. Here's a simple example of defining an option:\n\n```php\nprotected function configure(): void\n{\n    $this\n        ->addOption('verbose', null, InputOption::VALUE_NONE, 'If set, the task will run in verbose mode');\n}\n```""}]",knowledge/php/symfony-docs-7.1,1.0,train
"[{""from"": ""human"", ""value"": ""Explain middleware in the context of Symfony applications.""}, {""from"": ""gpt"", ""value"": ""Middleware in Symfony applications acts as a layer that sits between the request and response cycle. It's used for handling tasks that need to be performed before or after the application processes a request, such as authentication, logging, and modifying requests or responses. Symfony enables middleware-like behavior through event subscribers or custom kernel events that can intercept requests and responses.""}]",knowledge/php/symfony-docs-7.1,1.0,train
"[{""from"": ""human"", ""value"": ""Could you describe the Symfony Event Dispatcher component?""}, {""from"": ""gpt"", ""value"": ""The Symfony Event Dispatcher component allows for a publish-subscribe pattern within your Symfony application. It enables different parts of an application to communicate with each other through events, promoting loose coupling. Components can dispatch events and other components can listen and respond to these events, allowing for actions to occur upon specific triggers without tightly integrating the components.""}]",knowledge/php/symfony-docs-7.1,1.0,train
"[{""from"": ""human"", ""value"": ""What are the different types of Symfony events?""}, {""from"": ""gpt"", ""value"": ""The different types of Symfony events include:\n1. **Kernel Events**: Such as `kernel.request`, `kernel.response`, which are triggered during the request/response lifecycle.\n2. **Console Events**: Like `console.command`, these events are triggered during console command execution.\n3. **Doctrine Events**: For example, `postPersist`, which are fired during entity lifecycle operations.\n4. **Custom Events**: User-defined events that can be dispatched based on application-specific logic.""}]",knowledge/php/symfony-docs-7.1,1.0,train
"[{""from"": ""human"", ""value"": ""How do you create and dispatch a custom event in Symfony?""}, {""from"": ""gpt"", ""value"": ""To create and dispatch a custom event in Symfony, you can follow these steps:\n1. **Create an Event Class**: Define an event class, extending Symfony's `Event` base class.\n2. **Dispatch the Event**: Use the event dispatcher service to dispatch your custom event.\n3. **Listen for the Event**: Create an event subscriber or listener that reacts when your event is dispatched.\n\nExample of a custom event:\n\n```php\nnamespace App\\Event;\n\nuse Symfony\\Component\\EventDispatcher\\Event;\n\nclass MyCustomEvent extends Event\n{\n    public const NAME = 'my.custom.event';\n}\n```\n\nDispatching the event can be done within a service:\n```php\n$event = new MyCustomEvent();\n$this->eventDispatcher->dispatch($event, MyCustomEvent::NAME);\n```""}]",knowledge/php/symfony-docs-7.1,1.0,train
"[{""from"": ""human"", ""value"": ""What are the benefits of using Symfony\u2019s Validation component?""}, {""from"": ""gpt"", ""value"": ""Symfony's Validation component provides several benefits, including:\n1. **Consistency**: Allows for defining validation rules in one place and reusing them across the application.\n2. **Customization**: You can create your custom validation logic with ease.\n3. **Integration**: It integrates seamlessly with Symfony forms, making data validation straightforward when processing user input.\n4. **Enhanced Error Reporting**: Provides comprehensive feedback on validation errors, allowing proper handling and display to users.""}]",knowledge/php/symfony-docs-7.1,1.0,train
"[{""from"": ""human"", ""value"": ""How can Symfony\u2019s Messenger component improve application performance?""}, {""from"": ""gpt"", ""value"": ""Symfony's Messenger component improves application performance by facilitating asynchronous message handling and background processing. It allows developers to offload heavy tasks such as sending emails, processing uploads, or running complex background jobs to be handled separately. This enhances responsiveness of the main application, keeping it fast and efficient. By utilizing message queues, you can ensure that time-consuming operations do not block user interactions.""}]",knowledge/php/symfony-docs-7.1,1.0,train
"[{""from"": ""human"", ""value"": ""What are the steps to implement a simple REST API in Symfony?""}, {""from"": ""gpt"", ""value"": ""To implement a simple REST API in Symfony, follow these steps:\n1. **Define Routes**: Use annotations or configuration files to set up routes for your API endpoints.\n2. **Create Controllers**: Implement controller methods that handle incoming requests and return JSON responses.\n3. **Use Serializers**: Use Symfony's Serializer component to convert objects to JSON format.\n4. **Implement Error Handling**: Ensure proper error responses are sent back to clients in case of issues.""}]",knowledge/php/symfony-docs-7.1,1.0,train
"[{""from"": ""human"", ""value"": ""What are the roles of services and repositories in Symfony applications?""}, {""from"": ""gpt"", ""value"": ""In Symfony applications, **services** are used for encapsulating business logic, providing reusable functionalities across an application. They can handle various tasks like sending emails, fetching data, etc. **Repositories**, on the other hand, are specifically designed to handle data persistence operations. They interact with the database to perform CRUD operations on entities, abstracting database complexities for better management.""}]",knowledge/php/symfony-docs-7.1,1.0,train
"[{""from"": ""human"", ""value"": ""How do Symfony's forms manage data validation?""}, {""from"": ""gpt"", ""value"": ""Symfony's forms manage data validation through the form component that allows defining constraints directly in the form classes. When the form is submitted, Symfony automatically validates the data against these defined constraints. If the validation fails, errors are generated and can be displayed to users. Here's an example of adding constraints:\n\n```php\nuse Symfony\\Component\\Form\\AbstractType;\nuse Symfony\\Component\\Form\\FormBuilderInterface;\nuse Symfony\\Component\\Validator\\Constraints\\NotBlank;\n\nclass MyFormType extends AbstractType\n{\n    public function buildForm(FormBuilderInterface $builder, array $options): void\n    {\n        $builder\n            ->add('name', TextType::class, [\n                'constraints' => [\n                    new NotBlank(),\n                ],\n            ]);\n    }\n}\n```""}]",knowledge/php/symfony-docs-7.1,1.0,train
"[{""from"": ""human"", ""value"": ""What are the rules for creating Symfony entities?""}, {""from"": ""gpt"", ""value"": ""When creating Symfony entities, follow these rules:\n1. **Use PHP Class**: Define entities as PHP classes with properties representing the database fields.\n2. **Annotations or YAML**: Use annotations or YAML to define mapping information for Doctrine ORM.\n3. **Getters and Setters**: Implement getter and setter methods for each property to encapsulate the access to entity data.\n4. **Doctrine Lifecycle Callbacks**: Optionally, use Doctrine lifecycle callbacks to handle specific events during the entity's lifecycle.""}]",knowledge/php/symfony-docs-7.1,1.0,train
"[{""from"": ""human"", ""value"": ""How do Symfony commands facilitate application management?""}, {""from"": ""gpt"", ""value"": ""Symfony commands facilitate application management by providing a CLI tool to perform various tasks such as cache clearing, database migrations, and running tests. This command-line interface allows developers to automate repetitive tasks, making the development and deployment processes more efficient. Commands can be reused, scheduled in cron jobs, and made easily accessible.""}]",knowledge/php/symfony-docs-7.1,1.0,train
"[{""from"": ""human"", ""value"": ""What are the benefits of using Symfony's profilers?""}, {""from"": ""gpt"", ""value"": ""Symfony's profilers are beneficial for debugging and performance monitoring. They provide insights into requests, responses, database queries, and service utilization. By examining profiler data, developers can identify slow parts of the application, optimize resource usage, and gain a deeper understanding of how components interact, ultimately leading to improved application quality and performance.""}]",knowledge/php/symfony-docs-7.1,1.0,train
"[{""from"": ""human"", ""value"": ""What considerations should be taken when configuring HTTPS for Symfony applications?""}, {""from"": ""gpt"", ""value"": ""When configuring HTTPS for Symfony applications, consider the following:\n1. **Obtain a Valid SSL Certificate**: Use a certificate authority to get a valid SSL certificate, and ensure it is properly installed on the server.\n2. **Redirect HTTP to HTTPS**: Implement server rules to redirect all traffic from HTTP to HTTPS to ensure secure communication.\n3. **Security Headers**: Set security headers like HSTS to further improve security posture.\n4. **Test SSL Configuration**: After configuring, use tools to test the SSL setup for vulnerabilities and correct functionalities.""}]",knowledge/php/symfony-docs-7.1,1.0,train
"[{""from"": ""human"", ""value"": ""What strategies can be implemented for Symfony application internationalization?""}, {""from"": ""gpt"", ""value"": ""For Symfony application internationalization, consider these strategies:\n1. **Translation Files**: Use translation files in `messages.{locale}.yml` format to store translations for different languages.\n2. **Locale Management**: Implement locale detection logic using Symfony's `LocaleListener` or custom logic based on user preferences or browser settings.\n3. **Twig Extensions**: Use Twig translation filters to dynamically translate content in templates.\n4. **Basic Formatting**: Ensure that dates, currencies, and numbers are formatted according to the user's locale preferences.""}]",knowledge/php/symfony-docs-7.1,1.0,train
"[{""from"": ""human"", ""value"": ""How to retrieve user input safely in Symfony controllers?""}, {""from"": ""gpt"", ""value"": ""To retrieve user input safely in Symfony controllers, use the Request object to access request data. Always validate and sanitize user inputs before processing or storing them. Here's an example of retrieving and validating an input in a controller:\n\n```php\nuse Symfony\\Component\\HttpFoundation\\Request;\n\npublic function submitForm(Request $request): Response\n{\n    $input = $request->request->get('input_name');\n    // Validate and sanitize input here\n}\n```""}]",knowledge/php/symfony-docs-7.1,1.0,train
"[{""from"": ""human"", ""value"": ""How can Symfony applications utilize caching effectively?""}, {""from"": ""gpt"", ""value"": ""Symfony applications can utilize caching effectively through its caching component, which supports various caching backends (e.g., Redis, Memcached). Implement caching for:\n1. **Responses**: Cache HTTP responses to reduce server load and improve response times.\n2. **Data**: Cache database query results or compiled templates to minimize processing.\n3. **Configuration**: Utilize configuration caching to boost performance by storing application configurations in cache.""}]",knowledge/php/symfony-docs-7.1,1.0,train
"[{""from"": ""human"", ""value"": ""What is the purpose of Symfony's Dependency Injection component?""}, {""from"": ""gpt"", ""value"": ""The purpose of Symfony's Dependency Injection component is to manage the instantiation and configuration of services in a Symfony application. It facilitates the decoupling of components, allowing each service to depend on abstractions rather than concrete implementations. This improves testing, as services can be easily mocked, and enhances maintainability, enabling easier refactoring and updates.""}]",knowledge/php/symfony-docs-7.1,1.0,train
"[{""from"": ""human"", ""value"": ""What convention should you follow when naming services in Symfony?""}, {""from"": ""gpt"", ""value"": ""When naming services in Symfony, follow the convention of using the service's class name or purpose as the identifier, usually in lowercase with dots or underscores to separate words. For example, use `app.mailer` for a mailer service, or `app.user_repository` for a user repository. This systematic approach enhances clarity and maintainability, making it easier to understand the role of each service within the application.""}]",knowledge/php/symfony-docs-7.1,1.0,train
"[{""from"": ""human"", ""value"": ""What is the role of Symfony's routing component?""}, {""from"": ""gpt"", ""value"": ""The role of Symfony's routing component is to map HTTP requests to specific controller actions based on defined routes. It enables developers to create readable URLs and manage request handling efficiently. Routes can be defined using annotations in controllers or in separate routing configuration files and can include dynamic placeholders for variable parts of URLs, allowing for flexible URL structures.""}]",knowledge/php/symfony-docs-7.1,1.0,train
"[{""from"": ""human"", ""value"": ""How can you test Symfony applications effectively?""}, {""from"": ""gpt"", ""value"": ""To test Symfony applications effectively, you can leverage PHPUnit along with Symfony's built-in testing tools. Use the following best practices:\n1. **Organize Tests**: Group tests by feature or functionality and follow a clear directory structure.\n2. **Use Mocks**: Utilize mocking frameworks for external service dependency isolation.\n3. **Run Tests Automatically**: Integrate testing into CI/CD pipelines to ensure code stability with each change.\n4. **Test Coverage**: Monitor test coverage and aim for higher coverage to ensure application robustness.""}]",knowledge/php/symfony-docs-7.1,1.0,train
"[{""from"": ""human"", ""value"": ""What options does Symfony give for form handling?""}, {""from"": ""gpt"", ""value"": ""Symfony provides various options for form handling, including:\n1. **Form Classes**: Define forms using specific classes to abstract the logic\n2. **Built-in Validation**: Integrate Symfony's Validator component for form data validation automatically.\n3. **Templates**: Use Twig templates to render forms easily and customize their appearance.\n4. **Manual Processing**: Optionally handle form processing manually for more complex scenarios.""}]",knowledge/php/symfony-docs-7.1,1.0,train
"[{""from"": ""human"", ""value"": ""How does Symfony\u2019s Security component manage authentication?""}, {""from"": ""gpt"", ""value"": ""Symfony\u2019s Security component manages authentication through an authentication system that supports multiple authentication providers (like form login, HTTP Basic, and OAuth). It allows configuration of user providers, firewalls, and access control lists (ACLs) to enhance security. The system integrates seamlessly with Symfony's routing component, ensuring that secured routes require proper authentication before granting access.""}]",knowledge/php/symfony-docs-7.1,1.0,train
"[{""from"": ""human"", ""value"": ""What is the significance of Symfony\u2019s Logger component?""}, {""from"": ""gpt"", ""value"": ""Symfony\u2019s Logger component provides a systematic way to log information in applications, which is critical for debugging and monitoring. It supports different log levels (e.g., DEBUG, INFO, WARNING, ERROR), enabling developers to distinguish the severity of log messages. This helps identify issues quickly and track application behavior in production environments, leading to more reliable applications.""}]",knowledge/php/symfony-docs-7.1,1.0,train
"[{""from"": ""human"", ""value"": ""What functionality does the Twig component provide in Symfony?""}, {""from"": ""gpt"", ""value"": ""The Twig component in Symfony provides a powerful templating engine that allows developers to separate application logic from presentation. It offers functionality such as:\n1. **Template Inheritance**: Facilitates reusable layouts and child templates.\n2. **Filters**: Enables data formatting and transformation directly within templates.\n3. **Control Structures**: Provides if statements and loops for dynamic content generation.\n4. **Extensibility**: Allows the creation of custom filters/tags to adapt to specific application requirements.""}]",knowledge/php/symfony-docs-7.1,1.0,train
"[{""from"": ""human"", ""value"": ""How to create a data transformer in Symfony forms?""}, {""from"": ""gpt"", ""value"": ""To create a data transformer in Symfony forms, you can define a class implementing the `DataTransformerInterface`. This class will convert data from the model format to the view format and vice versa. For example:\n\n```php\nuse Symfony\\Component\\Form\\Extension\\Core\\DataTransformer\\DataTransformerInterface;\n\nclass MyDataTransformer implements DataTransformerInterface\n{\n    public function transform($value)\n    {\n        // Logic for transforming the model to the view\n    }\n\n    public function reverseTransform($value)\n    {\n        // Logic for transforming the view back to the model\n    }\n}\n```""}]",knowledge/php/symfony-docs-7.1,1.0,train
