conversations,source,score,split
"[{""from"": ""human"", ""value"": ""What are the differences between arguments and options in Symfony Console commands?""}, {""from"": ""gpt"", ""value"": ""In Symfony Console commands, the key differences between arguments and options are:\n\n1. **Order**: Arguments are ordered and must be provided in a specific sequence. Options, however, are not ordered, meaning they can be specified in any order before or after the command name.\n2. **Syntax**: Arguments are specified directly after the command name, while options start with two dashes (e.g., `--option`).\n3. **Required/Optional**: Arguments can be required or optional, and command execution can fail if a required argument is missing. Options are always optional, and their absence will not cause command failure.\n4. **Value Handling**: Arguments can be required to accept a single value or a list of values (array), whereas options can accept values either as required, optional, or not at all (e.g., boolean flags). \n\nExample:\n\n```php\n// Adding command arguments\n\\$this->addArgument('name', InputArgument::REQUIRED, 'Your name');\n\n// Adding command options\n\\$this->addOption('iterations', null, InputOption::VALUE_REQUIRED, 'How many times to repeat?');\n```""}]",knowledge/php/symfony-docs-7.1,1.0,train
"[{""from"": ""human"", ""value"": ""How can you define a command with both required and optional arguments in Symfony?""}, {""from"": ""gpt"", ""value"": ""To define a command with both required and optional arguments in Symfony, you use the `addArgument` method of your command class. You specify the argument's name, its type (REQUIRED or OPTIONAL), and its description. Here's a complete example:\n\n```php\nuse Symfony\\Component\\Console\\Command\\Command;\nuse Symfony\\Component\\Console\\Input\\InputArgument;\nuse Symfony\\Component\\Console\\Input\\InputInterface;\nuse Symfony\\Component\\Console\\Output\\OutputInterface;\n\nclass GreetCommand extends Command\n{\n    protected static \\$defaultName = 'app:greet';\n\n    protected function configure(): void\n    {\n        \\$this\n            ->addArgument('name', InputArgument::REQUIRED, 'Who do you want to greet?')\n            ->addArgument('last_name', InputArgument::OPTIONAL, 'Your last name?');\n    }\n\n    protected function execute(InputInterface \\$input, OutputInterface \\$output): int\n    {\n        \\$text = 'Hi ' . \\$input->getArgument('name');\n\n        \\$lastName = \\$input->getArgument('last_name');\n        if (\\$lastName) {\n            \\$text .= ' ' . \\$lastName;\n        }\n\n        \\$output->writeln(\\$text . '!');\n\n        return Command::SUCCESS;\n    }\n}\n```\nIn this example, the `name` argument is required, while `last_name` is optional.""}]",knowledge/php/symfony-docs-7.1,1.0,train
"[{""from"": ""human"", ""value"": ""Can you explain how to handle an argument that can take multiple values in Symfony?""}, {""from"": ""gpt"", ""value"": ""To handle an argument that can take multiple values in Symfony, you can set the argument type to `InputArgument::IS_ARRAY`. This allows you to receive all values as an array. Here\u2019s a detailed example of how to do this:\n\n```php\nuse Symfony\\Component\\Console\\Command\\Command;\nuse Symfony\\Component\\Console\\Input\\InputArgument;\nuse Symfony\\Component\\Console\\Input\\InputInterface;\nuse Symfony\\Component\\Console\\Output\\OutputInterface;\n\nclass GreetCommand extends Command\n{\n    protected static \\$defaultName = 'app:greet';\n\n    protected function configure(): void\n    {\n        \\$this\n            ->addArgument(\n                'names',\n                InputArgument::IS_ARRAY,\n                'Who do you want to greet (separate multiple names with a space)?'\n            );\n    }\n\n    protected function execute(InputInterface \\$input, OutputInterface \\$output): int\n    {\n        \\$names = \\$input->getArgument('names');\n        \\$text = 'Hi';\n\n        if (count(\\$names) > 0) {\n            \\$text .= ' ' . implode(', ', \\$names);\n        }\n\n        \\$output->writeln(\\$text . '!');\n\n        return Command::SUCCESS;\n    }\n}\n```\n\nIn this example, you can invoke the command with multiple names, such as:\n```\n$ php bin/console app:greet Fabien Ryan Bernhard\n```\n\nAnd the output will be:\n```\nHi Fabien, Ryan, Bernhard!\n```""}]",knowledge/php/symfony-docs-7.1,1.0,train
"[{""from"": ""human"", ""value"": ""What is the process to define a command option in Symfony, and how does it differ from defining an argument?""}, {""from"": ""gpt"", ""value"": ""Defining a command option in Symfony involves using the `addOption` method instead of `addArgument`. Options are always optional and can accept a value or act as boolean flags. Here\u2019s how you do it:\n\n1. **Use `addOption` Method**: You define the name of the option and specify whether it requires a value or not.\n\n2. **Option Flags**: Options are identified with a `--` prefix, while arguments are not.\n\n3. **Flexibility**: Options can be specified in any order relative to arguments, making them flexible.\n\nHere\u2019s a complete example of defining an option:\n\n```php\nuse Symfony\\Component\\Console\\Command\\Command;\nuse Symfony\\Component\\Console\\Input\\InputInterface;\nuse Symfony\\Component\\Console\\Input\\InputOption;\nuse Symfony\\Component\\Console\\Output\\OutputInterface;\n\nclass GreetCommand extends Command\n{\n    protected static \\$defaultName = 'app:greet';\n\n    protected function configure(): void\n    {\n        \\$this\n            ->addOption(\n                'iterations',\n                null,\n                InputOption::VALUE_REQUIRED,\n                'How many times should the message be printed?',\n                1\n            );\n    }\n\n    protected function execute(InputInterface \\$input, OutputInterface \\$output): int\n    {\n        \\$text = 'Hi Fabien!';\n\n        for (\\$i = 0; \\$i < \\$input->getOption('iterations'); \\$i++) {\n            \\$output->writeln(\\$text);\n        }\n\n        return Command::SUCCESS;\n    }\n}\n```\n\nWith this command, you can run:\n```\n$ php bin/console app:greet --iterations=5\n```\n\nThe output will repeat the greeting five times. This flexibility is what differentiates options from arguments.""}]",knowledge/php/symfony-docs-7.1,1.0,train
"[{""from"": ""human"", ""value"": ""How does one handle an option that accepts an optional value in Symfony?""}, {""from"": ""gpt"", ""value"": ""To handle an option that accepts an optional value in Symfony, you use `InputOption::VALUE_OPTIONAL`. This means that the option may or may not include a value. Here\u2019s an example illustrating this:\n\n```php\nuse Symfony\\Component\\Console\\Communicate\\Command;\nuse Symfony\\Component\\Console\\Input\\InputInterface;\nuse Symfony\\Component\\Console\\Input\\InputOption;\nuse Symfony\\Component\\Console\\Output\\OutputInterface;\n\nclass GreetCommand extends Command\n{\n    protected static \\$defaultName = 'app:greet';\n\n    protected function configure(): void\n    {\n        \\$this\n            ->addOption(\n                'greet',\n                null,\n                InputOption::VALUE_OPTIONAL,\n                'Should I yell while greeting?',\n                false // Setting default to false\n            );\n    }\n\n    protected function execute(InputInterface \\$input, OutputInterface \\$output): int\n    {\n        \\$greetOption = \\$input->getOption('greet');\n\n        if (\\$greetOption === false) {\n            \\$yell = false;\n        } elseif (\\$greetOption === null) {\n            \\$yell = true;\n        } else {\n            \\$yell = true;\n            \\$customGreet = \\$greetOption;\n        }\n\n        \\$output->writeln('Hi ' . (\\$yell ? 'loudly' : '') . ' Fabien!');\n\n        return Command::SUCCESS;\n    }\n}\n```\n\nYou can run this command in three different ways:\n```\n$ php bin/console app:greet\n$ php bin/console app:greet --greet=louder\n$ php bin/console app:greet --greet\n```\n\nThe second form allows you to provide a custom greeting, while the first does not. The third form signifies that you want a yell without specifying the intensity.""}]",knowledge/php/symfony-docs-7.1,1.0,train
"[{""from"": ""human"", ""value"": ""What method can be used to retrieve raw command input in Symfony Console?""}, {""from"": ""gpt"", ""value"": ""In Symfony Console, you can retrieve raw command input using the `getRawTokens()` method from the `Symfony\\Component\\Console\\Input\\ArgvInput` class. This method allows you to access the entire command input, including the command name and all its arguments and options, which is useful for parsing or passing the input to another command. Here\u2019s an example:\n\n```php\nuse Symfony\\Component\\Console\\Command\\Command;\nuse Symfony\\Component\\Console\\Input\\InputInterface;\nuse Symfony\\Component\\Console\\Output\\OutputInterface;\nuse Symfony\\Component\\Console\\Input\\ArgvInput;\nuse Symfony\\Component\\Process\\Process;\n\nclass MyCommand extends Command\n{\n    protected function execute(InputInterface \\$input, OutputInterface \\$output): int\n    {\n        // Get the raw tokens (the full command input)\n        \\$tokens = \\$input->getRawTokens();\n        // Example: Run another command with raw tokens\n        \\$process = new Process(['another-command', ...\\$tokens]);\n        \\$process->mustRun();\n\n        return Command::SUCCESS;\n    }\n}\n```\n\nThis command retrieves all input tokens and potentially passes them to another command executable in Symfony or the operating system.""}]",knowledge/php/symfony-docs-7.1,1.0,train
"[{""from"": ""human"", ""value"": ""Can you provide an example of implementing command value auto-completion in Symfony?""}, {""from"": ""gpt"", ""value"": ""Sure! Implementing command value auto-completion in Symfony involves using the fifth argument of the `addArgument()` or `addOption()` methods, where you provide a callback function to suggest possible completions. Here\u2019s an example:\n\n```php\nuse Symfony\\Component\\Console\\Command\\Command;\nuse Symfony\\Component\\Console\\Input\\InputArgument;\nuse Symfony\\Component\\Console\\Completion\\CompletionInput;\nuse Symfony\\Component\\Console\\Completion\\CompletionSuggestions;\n\nclass GreetCommand extends Command\n{\n    protected function configure(): void\n    {\n        \\$this\n            ->addArgument(\n                'names',\n                InputArgument::IS_ARRAY,\n                'Who do you want to greet?',\n                null,\n                function (CompletionInput \\$input): array {\n                    \\$currentValue = \\$input->getCompletionValue();\n                    // Simulate fetching usernames from a data source\n                    \\$availableUsernames = ['Fabien', 'Fabrice', 'Wouter'];\n                    // Filter based on current value (for demonstration, we use direct matching)\n                    return array_filter(\\$availableUsernames, function(\\$name) use (\\$currentValue) {\n                        return str_starts_with(\\$name, \\$currentValue);\n                    });\n                }\n            );\n    }\n}\n```\nIn this example, if the user starts typing `app:greet Fa` and then presses Tab, the available suggestions would be filtered based on existing input, suggesting names like `Fabien` and `Fabrice`. This provides an enhanced user interaction while typing command inputs.""}]",knowledge/php/symfony-docs-7.1,1.0,train
"[{""from"": ""human"", ""value"": ""What are some globally available options in Symfony Console commands?""}, {""from"": ""gpt"", ""value"": ""Symfony Console commands come with several predefined global options that enhance the user experience and provide additional control. Here are some of the globally available options:\n\n1. **`--verbose`**: Sets the verbosity level of the command output, which can be specified with `-v`, `-vv`, or `-vvv`.\n2. **`--quiet`**: Disables all output and interaction with the user.\n3. **`--no-interaction`**: Disables any interactive prompts, useful when running commands automatically.\n4. **`--version`**: Outputs the current version number of the console application.\n5. **`--help`**: Displays the help message for the command, including its options and arguments.\n6. **`--ansi` or `--no-ansi`**: Controls whether to force color output or disable it entirely.\n\nWhen using the `FrameworkBundle`, additional options may include:\n- **`--env`**: Sets the environment for the Kernel, defaulting to the APP_ENV variable.\n- **`--no-debug`**: Disables debugging for the Kernel, defaulting to APP_DEBUG.\n\nThese options can be used across various custom commands to provide consistent behavior and interaction.""}]",knowledge/php/symfony-docs-7.1,1.0,train
"[{""from"": ""human"", ""value"": ""What considerations should be made when using optional arguments and options in Symfony?""}, {""from"": ""gpt"", ""value"": ""When using optional arguments and options in Symfony Console commands, several important considerations should be made:\n\n1. **Clarity of Use**: Ensure it is clear to the user whether an argument is optional. Provide adequate help descriptions to assist them in understanding how to utilize optional inputs.\n\n2. **Default Values**: Set sensible default values for optional arguments and options so that the command behaves predictably even when the user does not provide them.\n\n3. **Ambiguity Avoidance**: Be cautious with options that accept an optional value. It can lead to ambiguity; you should set defaults to differentiate between a missing argument and an unprovided value.\n   Example handling of optional values:\n   ```php\n   ->addOption('yell', null, InputOption::VALUE_OPTIONAL, 'Should I yell while greeting?', false);\n   ```\n\n4. **Provide Feedback**: When the command executes, provide feedback to the user about which inputs were recognized and how they affected the outcome. This transparency can enhance user experience.\n\n5. **Test for Edge Cases**: It is important to test commands for edge cases where optional inputs could lead to unexpected behavior. Unit tests can help catch these issues before deployment.\n\n6. **Command Structure**: Organizing commands to handle optional inputs cleanly can enhance maintainability and readability. Use well-structured logic to handle the presence or absence of optional arguments and options.""}]",knowledge/php/symfony-docs-7.1,1.0,train
"[{""from"": ""human"", ""value"": ""How do you use the `CommandCompletionTester` to test command completion logic?""}, {""from"": ""gpt"", ""value"": ""To test command completion logic in Symfony, you can use the `CommandCompletionTester` class. This enables you to simulate completion scenarios and assert expected outcomes. Here\u2019s how to implement it:\n\n1. **Create a Test Class**: Define a test class for the command that includes the logic for completion.\n\n2. **Setup the Application**: Instantiate the command and add it to the Symfony application.\n\n3. **Use the `complete` Method**: Call the `complete` method of `CommandCompletionTester`, providing user input to receive suggestions.\n\nHere\u2019s a code example:\n\n```php\nuse Symfony\\Component\\Console\\Application;\nuse Symfony\\Component\\Console\\Tester\\CommandCompletionTester;\nuse PHPUnit\\Framework\\TestCase;\n\nclass GreetCommandTest extends TestCase\n{\n    public function testComplete(): void\n    {\n        \\$application = new Application();\n        \\$application->add(new GreetCommand());\n\n        // create a tester instance with the greet command\n        \\$tester = new CommandCompletionTester(\\$application->get('app:greet'));\n\n        // complete the input without any existing input\n        \\$suggestions = \\$tester->complete(['']);\n        \\$this->assertSame(['Fabien', 'Fabrice', 'Wouter'], \\$suggestions);\n\n        // filter based on existing input\n        \\$suggestions = \\$tester->complete(['Fa']);\n        \\$this->assertSame(['Fabien', 'Fabrice'], \\$suggestions);\n    }\n}\n```\n\nThis example tests the completion logic of the GreetCommand by asserting that the correct suggestions are returned based on different inputs.""}]",knowledge/php/symfony-docs-7.1,1.0,train
"[{""from"": ""human"", ""value"": ""What is the importance of the method `getRawTokens()` in command input handling?""}, {""from"": ""gpt"", ""value"": ""The `getRawTokens()` method in Symfony command input handling is important for several reasons:\n\n1. **Access to Full Input**: It provides access to the entire raw command input, including the command name, arguments, and options. This is particularly useful for advanced parsing scenarios.\n\n2. **Flexible Input Handling**: It allows developers to process the command input more flexibly, including cases where a command may pass its arguments or options directly to another command or system process.\n\n3. **Debugging Utility**: During debugging, having access to the unmodified command input aids in understanding how different user inputs map to command behavior.\n\nExample usage:\n```php\n\\$tokens = \\$input->getRawTokens();\n``` \nThis retrieves all input components, making it easy to work with them programmatically, such as when running another command.""}]",knowledge/php/symfony-docs-7.1,1.0,train
"[{""from"": ""human"", ""value"": ""Why should optional arguments have default values in Symfony Commands?""}, {""from"": ""gpt"", ""value"": ""Optional arguments should have default values in Symfony commands because:\n\n1. **Predictability**: Default values ensure that the command behaves predictably even when the user does not provide optional arguments. This can improve the overall user experience as they will know what to expect.\n\n2. **Ease of Integration**: When writing scripts or integrating with other systems, using commands with defined defaults can streamline processes. Users can rely on consistent values being applied when they do not specify alternatives.\n\n3. **Error Reduction**: By establishing defaults, you minimize the risks associated with missing arguments. This can prevent potential errors that would arise from unhandled inputs in the command logic.\n\n4. **User-Friendly**: Default values can provide a way to optimize command usage. Users do not need to fill in every detail; they can execute commands quickly, relying on the defaults where appropriate.\n\nExample of defining a default value:\n```php\n->addOption('output', null, InputOption::VALUE_OPTIONAL, 'Define output level', 'normal');\n```\nIn this case, if the user does not provide the `--output` option, it will default to `'normal'.""}]",knowledge/php/symfony-docs-7.1,1.0,train
"[{""from"": ""human"", ""value"": ""What are the global options you can use with Symfony Console commands?""}, {""from"": ""gpt"", ""value"": ""Global options that can be used with Symfony Console commands enhance functionality and provide additional control over command execution. The standard global options include:\n\n1. **`--verbose`**: Adjusts the verbosity level of the command output (can be specified with `-v`, `-vv`, or `-vvv`).\n\n2. **`--quiet`**: Suppresses all output, useful for running commands without displaying anything on the terminal.\n\n3. **`--no-interaction`**: Disables interactive prompts, this is helpful during automated execution (e.g., running scripts).\n\n4. **`--version`**: Displays the version number of the console application.\n\n5. **`--help`**: Shows help content for the command, including usage instructions and available options.\n\n6. **`--ansi`** / **`--no-ansi`**: Forcing or disabling colored output in the terminal.\n\nWhen using the `FrameworkBundle`, additional options might include:\n- **`--env`**: Sets the environment configuration for the application (defaults to APP_ENV).\n- **`--no-debug`**: Disables debug mode (defaults to APP_DEBUG).\n\nThese options are usable in any custom command, providing common functionality that is anticipated by end users.""}]",knowledge/php/symfony-docs-7.1,1.0,train
"[{""from"": ""human"", ""value"": ""What is the role of `--help` option in Symfony Console applications?""}, {""from"": ""gpt"", ""value"": ""The `--help` option in Symfony Console applications serves a vital role in enhancing user interaction and experience. Its main functions include:\n\n1. **Providing Command Usage Information**: When a user appends `--help` to a command, it displays detailed information about the command, including its arguments, options, and descriptions, making it easier for users to understand how to use the command.\n\n2. **Improved Discoverability**: By providing help documentation directly in the console, users can discover available features without needing to consult external documentation or resources.\n\n3. **User Guidance**: It helps new users and even experienced ones to clarify usage, especially when commands have multiple options or when the user might not remember all flags.\n\nExample usage:\n```\n$ php bin/console app:greet --help\n```\nThis command will generate an output listing all aspects of the `greet` command, enhancing clarity and usability for users.""}]",knowledge/php/symfony-docs-7.1,1.0,train
