conversations,source,score,split
"[{""from"": ""human"", ""value"": ""What is the preferred way to develop Symfony applications?""}, {""from"": ""gpt"", ""value"": ""The preferred way to develop Symfony applications is to utilize the Symfony Local Web Server. This local server provides an easy development environment where you can test your applications before deploying them to production.""}]",knowledge/php/symfony-docs-7.1,1.0,train
"[{""from"": ""human"", ""value"": ""Which directory serves as the document root for Symfony applications?""}, {""from"": ""gpt"", ""value"": ""The public directory serves as the document root for Symfony applications. This directory contains all of the application's public and static files, including images, stylesheets, and JavaScript files. Specifically, it houses the front controller `index.php`, which is essential for routing requests.""}]",knowledge/php/symfony-docs-7.1,1.0,train
"[{""from"": ""human"", ""value"": ""What should you do if your hosting provider requires a different public directory?""}, {""from"": ""gpt"", ""value"": ""If your hosting provider requires you to change the public directory to another location (e.g., `public_html/`), you must ensure to override the default location in your Symfony configuration. This includes updating the web server's document root settings to point to the new public directory.""}]",knowledge/php/symfony-docs-7.1,1.0,train
"[{""from"": ""human"", ""value"": ""How do you configure PHP-FPM pools in a Symfony application?""}, {""from"": ""gpt"", ""value"": ""To configure PHP-FPM pools in a Symfony application, you need to edit the PHP-FPM configuration file, typically located at `/etc/php/{version}/fpm/pool.d/www.conf`. You can set various options for the pool, such as user and group under which it runs, and specify whether to listen on a UNIX socket or a TCP connection. Here is an example configuration:\n\n```ini\n; /etc/php/8.3/fpm/pool.d/www.conf\n\n; a pool called www\n[www]\nuser = www-data\ngroup = www-data\n\n; use a unix domain socket\nlisten = /var/run/php/php8.3-fpm.sock\n\n; or listen on a TCP connection\n; listen = 127.0.0.1:9000\n```""}]",knowledge/php/symfony-docs-7.1,1.0,train
"[{""from"": ""human"", ""value"": ""How can Apache be configured to work with PHP-FPM?""}, {""from"": ""gpt"", ""value"": ""To configure Apache to work with PHP-FPM on version 2.4 and above, you need to use the `mod_proxy_fcgi` module. You must first install the Apache2 FastCGI module (like `libapache2-mod-fastcgi` on Debian), then enable `mod_proxy` and `mod_proxy_fcgi` in your Apache configuration. Subsequently, you would set the `SetHandler` directive inside the `<FilesMatch>` section to direct PHP requests. A sample configuration is shown here:\n\n```apache\n# /etc/apache2/conf.d/example.com.conf\n<VirtualHost *:80>\n    ServerName example.com\n    ServerAlias www.example.com\n\n    <FilesMatch \\.php$>\n        # when using PHP-FPM as a unix socket\n        SetHandler proxy:unix:/var/run/php/php8.3-fpm.sock|fcgi://dummy\n\n        # when PHP-FPM is configured to use TCP\n        # SetHandler proxy:fcgi://127.0.0.1:9000\n    </FilesMatch>\n\n    DocumentRoot /var/www/project/public\n    <Directory /var/www/project/public>\n        AllowOverride None\n        Require all granted\n        FallbackResource /index.php\n    </Directory>\n\n    ErrorLog /var/log/apache2/project_error.log\n    CustomLog /var/log/apache2/project_access.log combined\n</VirtualHost>\n```""}]",knowledge/php/symfony-docs-7.1,1.0,train
"[{""from"": ""human"", ""value"": ""What should be included in the minimum Nginx configuration for Symfony?""}, {""from"": ""gpt"", ""value"": ""The minimum configuration required to run a Symfony application under Nginx includes setting the server name, root directory, and defining locations for handling PHP requests. Here is a basic configuration:\n\n```nginx\n# /etc/nginx/conf.d/example.com.conf\nserver {\n    server_name example.com www.example.com;\n    root /var/www/project/public;\n\n    location / {\n        # try to serve file directly, fallback to index.php\n        try_files $uri /index.php$is_args$args;\n    }\n\n    location ~ ^/index\\.php(/|$) {\n        fastcgi_pass unix:/var/run/php/php8.3-fpm.sock;\n        fastcgi_split_path_info ^(.+\\.php)(/.*)$;\n        include fastcgi_params;\n        fastcgi_param SCRIPT_FILENAME $realpath_root$fastcgi_script_name;\n        fastcgi_param DOCUMENT_ROOT $realpath_root;\n        internal;\n    }\n\n    # return 404 for all other php files not matching the front controller\n    location ~ \\.php$ {\n        return 404;\n    }\n\n    error_log /var/log/nginx/project_error.log;\n    access_log /var/log/nginx/project_access.log;\n}\n```""}]",knowledge/php/symfony-docs-7.1,1.0,train
"[{""from"": ""human"", ""value"": ""What considerations should be made when configuring Caddy for a Symfony application?""}, {""from"": ""gpt"", ""value"": ""When configuring Caddy for a Symfony application, key considerations include specifying the root directory, ensuring that files can be served directly if available, and configuring PHP-FPM appropriately. The configuration should look something like this:\n\n```text\n# /etc/caddy/Caddyfile\nexample.com, www.example.com {\n    root * /var/www/project/public\n\n    encode zstd gzip\n    file_server\n\n    php_fastcgi unix//var/run/php/php8.3-fpm.sock {\n        resolve_root_symlink\n    }\n\n    @phpFile {\n        path *.php*\n    }\n    error @phpFile \""Not found\"" 404\n}\n```\n\nThis setup allows Caddy to serve static assets directly and process PHP requests through PHP-FPM, while also handling access control to prevent execution of other PHP files not designated for public access.""}]",knowledge/php/symfony-docs-7.1,1.0,train
"[{""from"": ""human"", ""value"": ""What happens if you deploy a Symfony application and can still access index.php?""}, {""from"": ""gpt"", ""value"": ""If you deploy a Symfony application and can still access `index.php` directly via the URL (like `http://example.com/index.php`), it presents a significant security risk. The `index.php` file serves as the frontend for the application, and direct access can expose vulnerabilities or lead to unintended behavior. Therefore, ensure that server configurations prevent direct access to `index.php` by returning a 404 error instead.""}]",knowledge/php/symfony-docs-7.1,1.0,train
"[{""from"": ""human"", ""value"": ""What should you do if you have other PHP files in your public directory that need to be executed?""}, {""from"": ""gpt"", ""value"": ""If you have other PHP files in your public directory that need to be executed beyond the `index.php` file, you should include them in the `location` block of your Nginx or Caddy configuration. Doing so enables PHP-FPM to process these scripts appropriately. In Nginx, this can be accomplished by adjusting the `location ~ ^/index\\.php(/|$)` block to allow these scripts to execute.""}]",knowledge/php/symfony-docs-7.1,1.0,train
"[{""from"": ""human"", ""value"": ""What are the tips for advanced Nginx configurations regarding Symfony applications?""}, {""from"": ""gpt"", ""value"": ""For advanced Nginx configurations relating to Symfony applications, refer to the official Nginx documentation to explore various options such as caching strategies, tuning file serving for performance, and adjusting SSL configurations. Always aim to optimize the request handling and resource management for improved application responsiveness.""}]",knowledge/php/symfony-docs-7.1,1.0,train
"[{""from"": ""human"", ""value"": ""How do you handle environment variables in a Caddy configuration for Symfony?""}, {""from"": ""gpt"", ""value"": ""In a Caddy configuration for Symfony, you can set environment variables such as `APP_ENV`, `APP_SECRET`, and `DATABASE_URL` within the `php_fastcgi` block by using `env`. For example:\n\n```caddy\nphp_fastcgi unix//var/run/php/php8.3-fpm.sock {\n    env APP_ENV \""prod\""\n    env APP_SECRET \""<app-secret-id>\""\n    env DATABASE_URL \""mysql://db_user:db_pass@host:3306/db_name\""\n}\n```\n\nThis practice ensures that your application has access to these necessary configuration parameters.""}]",knowledge/php/symfony-docs-7.1,1.0,train
"[{""from"": ""human"", ""value"": ""What is the role of the `fastcgi_param` directive in the Nginx configuration?""}, {""from"": ""gpt"", ""value"": ""In the Nginx configuration, the `fastcgi_param` directive is used to pass additional parameters to the FastCGI server (here, PHP-FPM). These parameters can include environment variables and configurations necessary for the PHP application to run correctly. For example, `fastcgi_param SCRIPT_FILENAME` indicates the script that should be executed, while `fastcgi_param DOCUMENT_ROOT` provides the document root context for the application.""}]",knowledge/php/symfony-docs-7.1,1.0,train
"[{""from"": ""human"", ""value"": ""Why do you need to set `fastcgi_split_path_info` in your Nginx configuration?""}, {""from"": ""gpt"", ""value"": ""The `fastcgi_split_path_info` directive in Nginx is crucial because it splits the URI into two components: the script (such as `index.php`) and the additional path information that follows it. This is essential for Symfony to correctly handle routing. Without this split, Symfony might not be able to determine the actual path to the requested resources, adversely affecting its routing mechanisms.""}]",knowledge/php/symfony-docs-7.1,1.0,train
"[{""from"": ""human"", ""value"": ""What is the significance of using a Unix socket for PHP-FPM?""}, {""from"": ""gpt"", ""value"": ""Using a Unix socket for PHP-FPM connections can significantly enhance performance because it reduces the overhead associated with TCP communication. Unix sockets allow for faster local communications between your web server and PHP-FPM, leading to quicker request processing. However, using a TCP socket may be necessary if the PHP-FPM and web server are on different machines.""}]",knowledge/php/symfony-docs-7.1,1.0,train
"[{""from"": ""human"", ""value"": ""Describe how to change the default socket path in a PHP-FPM configuration.""}, {""from"": ""gpt"", ""value"": ""To change the default socket path in a PHP-FPM configuration, you need to edit the pool configuration file (e.g., `/etc/php/8.3/fpm/pool.d/www.conf`) and update the `listen` directive. For instance, if you want to change the socket from the default to another path, update the configuration as follows:\n\n```ini\nlisten = /var/run/php/php8.3-fpm-new.sock\n```\n\nAfter making such changes, remember to restart the PHP-FPM service to apply the new configuration.""}]",knowledge/php/symfony-docs-7.1,1.0,train
"[{""from"": ""human"", ""value"": ""What is the necessary directive to allow URL rewriting in Apache for Symfony applications?""}, {""from"": ""gpt"", ""value"": ""To enable URL rewriting in Apache for Symfony applications, you need to use the `AllowOverride` directive set to `All` in your configuration and ensure that `mod_rewrite` is enabled. This allows the `.htaccess` files in your public directory to override the default configurations and handle URL rewrites effectively.""}]",knowledge/php/symfony-docs-7.1,1.0,train
"[{""from"": ""human"", ""value"": ""What are some common error log locations for Symfony applications?""}, {""from"": ""gpt"", ""value"": ""Common error log locations for Symfony applications vary by web server. For Apache, it typically is located at:\n`/var/log/apache2/project_error.log`. For Nginx, it\u2019s commonly found at:\n`/var/log/nginx/project_error.log`. These logs can help diagnose issues that arise during application execution.""}]",knowledge/php/symfony-docs-7.1,1.0,train
"[{""from"": ""human"", ""value"": ""What logging configuration can be helpful for tracking access in Symfony applications?""}, {""from"": ""gpt"", ""value"": ""For tracking access in Symfony applications, a logging configuration in Apache could look like the following:\n`CustomLog /var/log/apache2/project_access.log combined`.\nIn the case of Nginx, it might be configured as:\n`access_log /var/log/nginx/project_access.log;`. These log files provide insights into incoming requests and help in monitoring the application traffic.""}]",knowledge/php/symfony-docs-7.1,1.0,train
"[{""from"": ""human"", ""value"": ""How to enable detailed error reporting for PHP in a Symfony application?""}, {""from"": ""gpt"", ""value"": ""To enable detailed error reporting in a Symfony application running on PHP, you can adjust the PHP configuration settings in the `php.ini` file. Set the following directives:\n\n```ini\ndisplay_errors = On\ndisplay_startup_errors = On\nerror_reporting = E_ALL\n```\n\nThis will ensure that all errors, warnings, and notices are displayed during application execution, which is especially useful during development.""}]",knowledge/php/symfony-docs-7.1,1.0,train
"[{""from"": ""human"", ""value"": ""What security considerations should be made for deploying Symfony applications?""}, {""from"": ""gpt"", ""value"": ""When deploying Symfony applications, it is crucial to ensure that no unnecessary files or scripts are publicly accessible. This means:\n1. Ensure that the `index.php` file is not directly accessible via the web.\n2. Use server configurations to limit access to sensitive directories.\n3. Regularly review file permissions to ensure they do not expose vulnerabilities.\n4. Stay updated on Symfony security advisories and apply patches promptly.""}]",knowledge/php/symfony-docs-7.1,1.0,train
"[{""from"": ""human"", ""value"": ""How can Symfony applications optimize performance when deployed?""}, {""from"": ""gpt"", ""value"": ""To optimize performance when deploying Symfony applications, consider the following strategies:\n1. Enable caching mechanisms using Symfony\u2019s built-in cache component.\n2. Leverage Opcode caching (like OPcache) to reduce PHP code compilation overhead.\n3. Minimize HTTP requests by combining and minifying assets such as JavaScript and CSS files.\n4. Optimize database queries and use profiling to identify bottlenecks.""}]",knowledge/php/symfony-docs-7.1,1.0,train
"[{""from"": ""human"", ""value"": ""What is the role of the `fallback_resource` directive in Apache configuration?""}, {""from"": ""gpt"", ""value"": ""The `FallbackResource` directive in Apache configuration is set to define a default resource that will handle requests when no file matches the request URI. For Symfony applications, this is typically set to `index.php`, which ensures that all non-existent routes are forwarded to the front controller for processing. This is crucial for the Symfony routing system to function properly.""}]",knowledge/php/symfony-docs-7.1,1.0,train
"[{""from"": ""human"", ""value"": ""How should you handle static assets in Symfony applications when configuring your web server?""}, {""from"": ""gpt"", ""value"": ""When configuring a web server for Symfony applications, static assets should be served directly without being processed by PHP whenever possible. Ensure that your server is set to handle requests for images, stylesheets, and JavaScript files directly to improve performance. This can be done using specific location rules in Nginx or Apache configuration.""}]",knowledge/php/symfony-docs-7.1,1.0,train
"[{""from"": ""human"", ""value"": ""Explain the significance of proper directory permissions in a Symfony application.""}, {""from"": ""gpt"", ""value"": ""Proper directory permissions are essential in a Symfony application as they help prevent unauthorized access and execution of sensitive files. Typically, directories like `var/cache`, `var/log`, and `var/sessions` should be writable by the web server user. However, public directories such as `public/` should have restricted access, preventing the execution of any non-public files.""}]",knowledge/php/symfony-docs-7.1,1.0,train
"[{""from"": ""human"", ""value"": ""What is the impact of environment variables on Symfony application configurations?""}, {""from"": ""gpt"", ""value"": ""Environment variables play a critical role in Symfony application configurations by allowing developers to set up different environments (such as development, testing, and production) without changing the code. They can provide sensitive information like database credentials and API keys without hardcoding them into the application, enhancing security and flexibility.""}]",knowledge/php/symfony-docs-7.1,1.0,train
"[{""from"": ""human"", ""value"": ""What are the recommended practices when using FastCGI with PHP-FPM?""}, {""from"": ""gpt"", ""value"": ""When using FastCGI with PHP-FPM, recommended practices include:\n1. Configuring multiple pools if necessary, each optimized for different applications or settings.\n2. Utilizing Unix sockets for performance improvements over TCP connections when applicable.\n3. Establishing appropriate limits on resource usage (e.g., max children, number of requests) in the PHP-FPM pool settings to prevent overload.\n4. Monitoring and logging PHP-FPM performance and request metrics to detect and resolve bottlenecks.""}]",knowledge/php/symfony-docs-7.1,1.0,train
"[{""from"": ""human"", ""value"": ""How can you ensure that error reporting is directed to the correct log files in a Symfony application?""}, {""from"": ""gpt"", ""value"": ""To ensure that error reporting in a Symfony application is directed to the correct log files, configure the logging handlers in Symfony's `monolog` settings. Define log files and levels effectively to capture error messages:\n\n```yaml\n# config/packages/prod/monolog.yaml\nmonolog:\n    handlers:\n        main:\n            type: stream\n            path: '%kernel.logs_dir%/%kernel.environment%.log'\n            level: error\n```""}]",knowledge/php/symfony-docs-7.1,1.0,train
"[{""from"": ""human"", ""value"": ""What are the potential security risks of misconfiguring a web server for Symfony applications?""}, {""from"": ""gpt"", ""value"": ""Misconfiguring a web server for Symfony applications can lead to several security risks, including:\n1. Exposure of sensitive files (like `.env`, `config`, and private directories) that should not be web-accessible.\n2. Direct access to `index.php`, allowing attackers to probe application logic.\n3. Improper permissions leading to unauthorized file access or modification.\n4. Lack of HTTPS potentially exposing transmitted data to man-in-the-middle attacks. Regularly reviewing configurations and implementing best practices for security can mitigate these risks.""}]",knowledge/php/symfony-docs-7.1,1.0,train
"[{""from"": ""human"", ""value"": ""How should you handle custom configuration settings for different environments in a Symfony application?""}, {""from"": ""gpt"", ""value"": ""In Symfony applications, custom configuration settings for different environments (development, testing, production) can be handled effectively using the `.env` files for sensitive variables, or configuration files specific to each environment located in the `config/packages/{env}` directory. This allows the application to load different settings based on the current environment automatically, ensuring that environment-specific requirements are met without hardcoding them.""}]",knowledge/php/symfony-docs-7.1,1.0,train
"[{""from"": ""human"", ""value"": ""How to handle symlinks in an Apache or Nginx configuration for Symfony applications?""}, {""from"": ""gpt"", ""value"": ""In Symfony applications, to handle symlinks in your Apache or Nginx configuration, make sure to enable the appropriate directives to follow symlinks. For Apache, you can use:\n\n```apache\n<Directory /var/www/project>\n    Options FollowSymlinks\n</Directory>\n```\n\nAnd in Nginx, ensure that the correct root path is defined and accessible, as well as making sure PHP requests consider the real path instead of symlink targets to avoid issues with caching.""}]",knowledge/php/symfony-docs-7.1,1.0,train
"[{""from"": ""human"", ""value"": ""What is the main benefit of using FastCGI over traditional CGI in PHP?""}, {""from"": ""gpt"", ""value"": ""The main benefit of using FastCGI over traditional CGI in PHP is performance. FastCGI maintains persistent processes, reducing the overhead of starting and stopping separate CGI processes for every request. This leads to faster request handling, better resource utilization, and reduced latency, making it more suitable for applications with high traffic.""}]",knowledge/php/symfony-docs-7.1,1.0,train
"[{""from"": ""human"", ""value"": ""How can you achieve cleaner URL structures in a Symfony application?""}, {""from"": ""gpt"", ""value"": ""Achieving cleaner URL structures in a Symfony application involves configuring the web server to handle URL routing efficiently without exposing file names. For Apache, this can be done using the `RewriteRule` directive in a `.htaccess` file or server configuration, while for Nginx, the `try_files` directive can be employed. Implementing these rules allows for more user-friendly and SEO-optimized URLs.""}]",knowledge/php/symfony-docs-7.1,1.0,train
"[{""from"": ""human"", ""value"": ""What is the purpose of the `try_files` directive in Nginx configuration?""}, {""from"": ""gpt"", ""value"": ""The `try_files` directive in Nginx configuration serves to check for the existence of a file before passing the request to the PHP processor. If the requested file is found, Nginx serves it directly; if not, it can fall back to other resources, such as `index.php`, which handles the request. This enhances performance by minimizing unnecessary PHP processing for static files.""}]",knowledge/php/symfony-docs-7.1,1.0,train
"[{""from"": ""human"", ""value"": ""What primary configuration change is needed to switch from TCP to Unix socket for PHP-FPM?""}, {""from"": ""gpt"", ""value"": ""To switch from TCP to a Unix socket for PHP-FPM, you need to change the `listen` directive in the PHP-FPM pool configuration from an IP:port combination to a socket path. For example, change:\n\n```ini\nlisten = 127.0.0.1:9000\n```\nto:\n```ini\nlisten = /var/run/php/php8.3-fpm.sock\n```\nThen restart the PHP-FPM service to apply the changes.""}]",knowledge/php/symfony-docs-7.1,1.0,train
"[{""from"": ""human"", ""value"": ""When using proxies with Apache, what headers might need special handling?""}, {""from"": ""gpt"", ""value"": ""When using proxies with Apache, headers that may need special handling include the `Authorization` header, as it is required for authentication mechanisms under PHP-FPM and FastCGI. This can be accomplished with the following line in your configuration:\n\n```apache\nSetEnvIfNoCase ^Authorization$ \""(.+)\"" HTTP_AUTHORIZATION=$1\n```""}]",knowledge/php/symfony-docs-7.1,1.0,train
"[{""from"": ""human"", ""value"": ""What are some advantages of using Caddy as a web server for Symfony applications?""}, {""from"": ""gpt"", ""value"": ""Caddy offers several advantages as a web server for Symfony applications, including:\n1. Automatic HTTPS provisioning using Let's Encrypt, simplifying the process of securing applications.\n2. Easy-to-use configuration syntax in its `Caddyfile` format.\n3. Built-in support to handle static files and reverse proxying to PHP-FPM efficiently.\n4. A powerful plugin architecture that allows for extending the server's capabilities easily.""}]",knowledge/php/symfony-docs-7.1,1.0,train
"[{""from"": ""human"", ""value"": ""What should be included in the PHP configuration for performance optimization?""}, {""from"": ""gpt"", ""value"": ""To optimize PHP performance in a Symfony application, the following settings should be considered in the `php.ini` file:\n1. Enable OPcache:\n```ini\nopcache.enable=1\nopcache.memory_consumption=128\nopcache.interned_strings_buffer=8\nopcache.max_accelerated_files=10000\nopcache.revalidate_freq=2\n```\n2. Increase memory limits and adjust execution time if necessary to provide adequate resources for your application workload.""}]",knowledge/php/symfony-docs-7.1,1.0,train
"[{""from"": ""human"", ""value"": ""How does improper caching configurations affect Symfony applications?""}, {""from"": ""gpt"", ""value"": ""Improper caching configurations can adversely affect Symfony applications by either leading to stale data being served to users or causing unnecessary load on the server due to frequent cache misses. This can result in degraded performance, slower response times, and ultimately a poor user experience. It is vital to implement sound caching strategies and regularly review cache settings.""}]",knowledge/php/symfony-docs-7.1,1.0,train
"[{""from"": ""human"", ""value"": ""What are some key considerations when deploying Symfony applications in a cloud environment?""}, {""from"": ""gpt"", ""value"": ""When deploying Symfony applications in a cloud environment, key considerations include:\n1. Configuring load balancing to distribute incoming traffic efficiently.\n2. Utilizing cloud storage solutions for asset management and scalable file storage.\n3. Implementing environment variable management tools to handle configurations securely.\n4. Monitoring application performance using cloud-native tools to ensure optimal operations.""}]",knowledge/php/symfony-docs-7.1,1.0,train
