conversations,source,score,split
"[{""from"": ""human"", ""value"": ""What is the main function of the HttpFoundation component in Symfony?""}, {""from"": ""gpt"", ""value"": ""The HttpFoundation component in Symfony provides an object-oriented layer for working with HTTP requests and responses. It replaces PHP's global variables and functions with objects that can handle request and response data in a more structured manner, enabling easier management of HTTP-related information.""}]",knowledge/php/symfony-docs-7.1,1.0,train
"[{""from"": ""human"", ""value"": ""How do you install the HttpFoundation component?""}, {""from"": ""gpt"", ""value"": ""To install the HttpFoundation component in your PHP application, you can use Composer. The command to execute is:\n```bash\n$ composer require symfony/http-foundation\n``` \nThis will add the HttpFoundation component to your project, allowing you to utilize its features.""}]",knowledge/php/symfony-docs-7.1,1.0,train
"[{""from"": ""human"", ""value"": ""How can you create a Request object based on PHP global variables?""}, {""from"": ""gpt"", ""value"": ""To create a Request object based on PHP global variables, you can use the `Request::createFromGlobals` method. Here is an example:\n```php\nuse Symfony\\Component\\HttpFoundation\\Request;\n\n$request = Request::createFromGlobals();\n``` \nThis method captures all the current request data based on the PHP superglobals.""}]",knowledge/php/symfony-docs-7.1,1.0,train
"[{""from"": ""human"", ""value"": ""Can you explain how to access the request data using the Request object?""}, {""from"": ""gpt"", ""value"": ""You can access various parts of the request data through properties of the Request object. Here\u2019s how:\n- **Accessing POST data**: Use `$request->request->get('name')` (equivalent to `$_POST`).\n- **Accessing GET data**: Use `$request->query->get('name')` (equivalent to `$_GET`).\n- **Accessing cookies**: Use `$request->cookies->get('name')` (equivalent to `$_COOKIE`).\n- **Accessing uploaded files**: Use `$request->files->get('file')` (equivalent to `$_FILES`).\n- **Accessing server variables**: Use `$request->server->get('SERVER_NAME')` (equivalent to `$_SERVER`).\n- **Accessing headers**: Use `$request->headers->get('User-Agent')` to retrieve specific headers.""}]",knowledge/php/symfony-docs-7.1,1.0,train
"[{""from"": ""human"", ""value"": ""What methods are available in the ParameterBag class for managing request data?""}, {""from"": ""gpt"", ""value"": ""In the ParameterBag class, which is employed by the Request object to manage parameters, several methods are available:\n- `all()`: Returns all parameters.\n- `keys()`: Returns the keys of the parameters.\n- `replace(array $parameters)`: Replaces the current parameters with a new set.\n- `add(array $parameters)`: Adds new parameters to the existing set.\n- `get($key, $default = null)`: Returns a parameter by name, with an optional default value.\n- `set($key, $value)`: Sets a parameter by name.\n- `has($key)`: Checks if a parameter is defined.\n- `remove($key)`: Removes a parameter from the bag.""}]",knowledge/php/symfony-docs-7.1,1.0,train
"[{""from"": ""human"", ""value"": ""What is the purpose of the attributes property in the Request object?""}, {""from"": ""gpt"", ""value"": ""The `attributes` property in the Request object serves as a holder for additional data that can be associated with the request. Unlike the predefined properties (like request, query, cookies), which correspond to PHP global variables, attributes can store any custom data that may be needed during processing. This makes the `attributes` property useful for passing information between middleware or controllers during the request handling lifecycle.""}]",knowledge/php/symfony-docs-7.1,1.0,train
"[{""from"": ""human"", ""value"": ""How can a raw data from the request body be accessed in Symfony?""}, {""from"": ""gpt"", ""value"": ""You can access the raw data sent with the request body via the `getContent()` method of the Request object:\n```php\n$content = $request->getContent();\n``` \nIf the request body contains JSON, it can be processed directly with the `toArray()` method:\n```php\ndata = $request->toArray();\n``` \nThis method decodes JSON input into an associative array.""}]",knowledge/php/symfony-docs-7.1,1.0,train
"[{""from"": ""human"", ""value"": ""How would you simulate a GET request with parameters using the Request class?""}, {""from"": ""gpt"", ""value"": ""To simulate a GET request with parameters using the Request class, you can create a Request object with the `create` method. Here\u2019s an example:\n```php\nuse Symfony\\Component\\HttpFoundation\\Request;\n\n$request = Request::create('/hello-world', 'GET', ['name' => 'Fabien']);\n``` \nThis code will create a request for the `/hello-world` URI using the GET method and includes a query parameter named `name` with the value `Fabien`.""}]",knowledge/php/symfony-docs-7.1,1.0,train
"[{""from"": ""human"", ""value"": ""What is the difference between the send() and prepare() methods in the Response class?""}, {""from"": ""gpt"", ""value"": ""The `send()` method of the Response class is responsible for sending the HTTP response to the client. It outputs the response content, sets the appropriate headers, and can optionally flush buffers based on the given flush argument.\n\nThe `prepare()` method, on the other hand, is used to modify the response to ensure its compatibility with HTTP specifications, such as correcting the Content-Type header if needed. It is beneficial to call `prepare()` before the `send()` method to ensure that everything is correctly formatted to avoid any issues with the response.""}]",knowledge/php/symfony-docs-7.1,1.0,train
"[{""from"": ""human"", ""value"": ""Describe how to manage cookies in the Response object.""}, {""from"": ""gpt"", ""value"": ""To manage cookies in the Response object, you can use the `headers` property which is a `ResponseHeaderBag`. You can add a cookie by calling the `setCookie()` method:\n\n```php\nuse Symfony\\Component\\HttpFoundation\\Cookie;\n\n$response->headers->setCookie(Cookie::create('foo', 'bar'));\n```\nYou can also clear a cookie using the `clearCookie()` method:\n```php\n$response->headers->clearCookie('foo');\n``` \nAdditionally, you can create cookies with specific parameters, such as expiration or secure flags, using the `with*()` methods.""}]",knowledge/php/symfony-docs-7.1,1.0,train
"[{""from"": ""human"", ""value"": ""Explain how to create a JSON response in Symfony with an example.""}, {""from"": ""gpt"", ""value"": ""To create a JSON response in Symfony, you can utilize the `JsonResponse` class which simplifies the process of returning JSON data. Here\u2019s an example:\n```php\nuse Symfony\\Component\\HttpFoundation\\JsonResponse;\n\n$data = ['data' => 123];\n$response = new JsonResponse($data);\n// You can also custom configure.\n$response->setEncodingOptions(JsonResponse::DEFAULT_ENCODING_OPTIONS | JSON_PRETTY_PRINT);\n$response->send();\n``` \nThe `JsonResponse` class automatically sets the correct `Content-Type` header to `application/json` and encodes the data to JSON format when it is created.""}]",knowledge/php/symfony-docs-7.1,1.0,train
"[{""from"": ""human"", ""value"": ""How do you access the session from the Request object?""}, {""from"": ""gpt"", ""value"": ""To access the session from the Request object, you can utilize the `getSession()` method. This allows you to retrieve the session associated with the request, enabling you to read or modify session data. Here\u2019s an example:\n```php\n$session = $request->getSession();\n$session->set('key', 'value');\n$value = $session->get('key');\n``` \nAdditionally, you can check if the request has a previous session started with the `hasPreviousSession()` method.""}]",knowledge/php/symfony-docs-7.1,1.0,train
"[{""from"": ""human"", ""value"": ""What utility does the HeaderUtils class provide in Symfony?""}, {""from"": ""gpt"", ""value"": ""The `HeaderUtils` class in Symfony helps manage HTTP headers, addressing issues such as parsing, combining, and encoding headers. For example, you can split a header string into an array of its components using the `split()` method:\n```php\n$parts = HeaderUtils::split('da, en-gb;q=0.8', ',;');\n``` \nYou can also combine an array of arrays into a single associative array with `combine()`, or encode a string to make it suitable for header use with the `toString()` method.""}]",knowledge/php/symfony-docs-7.1,1.0,train
"[{""from"": ""human"", ""value"": ""How can you anonymize IP addresses in Symfony, and why is it important?""}, {""from"": ""gpt"", ""value"": ""In Symfony, IP addresses can be anonymized using the `anonymize()` method from the `IpUtils` class. Anonymizing IP addresses is important to comply with user protection regulations such as GDPR. It helps protect user privacy by removing identifiable details from log files. Here\u2019s an example of anonymizing IPv4:\n```php\nuse Symfony\\Component\\HttpFoundation\\IpUtils;\n\n$ipv4 = '123.234.235.236';\n$anonymousIpv4 = IpUtils::anonymize($ipv4);\n// $anonymousIpv4 = '123.234.235.0';\n```""}]",knowledge/php/symfony-docs-7.1,1.0,train
"[{""from"": ""human"", ""value"": ""What patterns can be used to match requests in the HttpFoundation component?""}, {""from"": ""gpt"", ""value"": ""The HttpFoundation component provides various matcher classes for checking if a request conforms to specific conditions. Some of these classes include:\n- `AttributesRequestMatcher`\n- `ExpressionRequestMatcher`\n- `HeaderRequestMatcher`\n- `HostRequestMatcher`\n- `IpsRequestMatcher`\n- `IsJsonRequestMatcher`\n- `MethodRequestMatcher`\n- `PathRequestMatcher`\n- `PortRequestMatcher`\n- `QueryParameterRequestMatcher`\n- `SchemeRequestMatcher`\n\nYou can use these individually or combine them using `ChainRequestMatcher` to create complex match conditions for incoming requests.""}]",knowledge/php/symfony-docs-7.1,1.0,train
"[{""from"": ""human"", ""value"": ""Can you show an example of using the Response class to redirect a user to another URL?""}, {""from"": ""gpt"", ""value"": ""Certainly! You can redirect a user to another URL using the `RedirectResponse` class in Symfony. Here\u2019s an example:\n```php\nuse Symfony\\Component\\HttpFoundation\\RedirectResponse;\n\n$response = new RedirectResponse('http://example.com/');\n$response->send();\n``` \nThis code creates a response that redirects the client to `http://example.com/` when executed.""}]",knowledge/php/symfony-docs-7.1,1.0,train
"[{""from"": ""human"", ""value"": ""What is the function of the BinaryFileResponse class?""}, {""from"": ""gpt"", ""value"": ""The `BinaryFileResponse` class in Symfony is designed to simplify the process of sending files to the client. It handles files and automatically manages headers related to file downloads, such as `Content-Disposition`, and also supports features like handling `Range` requests and `X-Sendfile`. Here\u2019s an example of using it:\n```php\nuse Symfony\\Component\\HttpFoundation\\BinaryFileResponse;\n\n$file = 'path/to/file.txt';\n$response = new BinaryFileResponse($file);\n$response->send();\n``` \nThis will send the specified file to the client appropriately.""}]",knowledge/php/symfony-docs-7.1,1.0,train
"[{""from"": ""human"", ""value"": ""How can you create a streamed response in Symfony?""}, {""from"": ""gpt"", ""value"": ""To create a streamed response in Symfony, you can utilize the `StreamedResponse` class. Here's an example:\n```php\nuse Symfony\\Component\\HttpFoundation\\StreamedResponse;\n\n$response = new StreamedResponse();\n$response->setCallback(function () {\n    echo 'Hello World';\n    flush();\n    sleep(2);\n    echo 'Another Hello World';\n    flush();\n});\n$response->send();\n``` \nThis code sets content to be sent over time using a callback function, which is particularly useful for long processes or large datasets.""}]",knowledge/php/symfony-docs-7.1,1.0,train
"[{""from"": ""human"", ""value"": ""What is the safe content preference feature in Symfony?""}, {""from"": ""gpt"", ""value"": ""The safe content preference feature in Symfony allows a server to detect whether the user agent requests 'safe' content, as defined by RFC 8674. This feature is implemented through methods in the Request and Response classes:\n- **Request**: `preferSafeContent()` checks if the user agent prefers safe content.\n- **Response**: `setContentSafe()` indicates that the server respects the user agent's preference.\nUsing this feature, applications can tailor content delivery to align with user preferences regarding potentially objectionable material.""}]",knowledge/php/symfony-docs-7.1,1.0,train
"[{""from"": ""human"", ""value"": ""Can you provide an example of generating absolute URLs using UrlHelper in Symfony?""}, {""from"": ""gpt"", ""value"": ""Certainly! The `UrlHelper` class in Symfony is used to generate absolute URLs for a given path. You can inject it as a service into your classes. Here\u2019s an example of using it in a normalizer class:\n```php\nnamespace App\\Normalizer;\n\nuse Symfony\\Component\\HttpFoundation\\UrlHelper;\n\nclass UserApiNormalizer\n{\n    public function __construct(private UrlHelper $urlHelper) {}\n\n    public function normalize($user): array\n    {\n        return [\n            'avatar' => $this->urlHelper->getAbsoluteUrl($user->avatar()->path()),\n        ];\n    }\n}\n``` \nIn this example, the `getAbsoluteUrl()` method is used to convert a relative path into an absolute URL.""}]",knowledge/php/symfony-docs-7.1,1.0,train
