conversations,source,score,split
"[{""from"": ""human"", ""value"": ""What is the significance of implementing the HttpKernelInterface in a Symfony framework?""}, {""from"": ""gpt"", ""value"": ""Implementing the `HttpKernelInterface` in a Symfony framework is significant because it ensures interoperability among various frameworks and applications that utilize Symfony components. By adhering to this interface, any framework that implements it can seamlessly integrate with other systems, allowing them to share functionalities and communicate effectively. Furthermore, this integration unlocks powerful features like HTTP caching, which can considerably enhance the performance of web applications, leading them to respond faster to user requests without additional overhead.""}]",knowledge/php/symfony-docs-7.1,1.0,train
"[{""from"": ""human"", ""value"": ""How can a Symfony framework implement the HttpKernelInterface?""}, {""from"": ""gpt"", ""value"": ""To implement the `HttpKernelInterface` in a Symfony framework, you need to define a class that implements this interface and properly define its methods. Below is an example of how this can be achieved:\n\n```php\n// example.com/src/Framework.php\n\nnamespace App;\n\nuse Symfony\\Component\\HttpKernel\\HttpKernelInterface;\nuse Symfony\\Component\\HttpFoundation\\Request;\nuse Symfony\\Component\\HttpFoundation\\Response;\n\nclass Framework implements HttpKernelInterface\n{\n    public function handle(\n        Request $request,\n        int $type = HttpKernelInterface::MAIN_REQUEST,\n        bool $catch = true\n    ): Response {\n        // Handle the request here and return a Response\n    }\n}\n```\n\nIn this example, the `Framework` class uses the `HttpKernelInterface`, providing a method `handle` to process incoming `Request` objects and return a `Response`. This forms the backbone for any custom processing logic needed for the application.""}]",knowledge/php/symfony-docs-7.1,1.0,train
"[{""from"": ""human"", ""value"": ""What are the advantages of using the HttpCache class in Symfony?""}, {""from"": ""gpt"", ""value"": ""The `HttpCache` class in Symfony offers several advantages, including:\n1. **Performance Improvement**: By acting as a reverse proxy, it caches HTTP responses, reducing the load on backend services and speeding up response times.\n2. **Easy Integration**: It works seamlessly with the `HttpKernelInterface`, allowing developers to add caching support without major re-architecting of existing frameworks.\n3. **Flexible Cache Control**: It supports HTTP cache headers which allow fine-tuning of caching strategies, enabling developers to specify expiration times and validation rules using methods like `setTtl()` and `setCache()`.\n4. **Support for ESI**: The `HttpCache` class can process Edge Side Includes (ESI), allowing parts of web pages to be cached separately, which is useful for content that updates frequently while other content remains static.\n5. **Debugging Features**: With debug mode, developers can see detailed cache-related information in response headers, assisting in troubleshooting issues with caching behavior.\nOverall, using `HttpCache` makes applications scalable and responsive, providing a better end-user experience.""}]",knowledge/php/symfony-docs-7.1,1.0,train
"[{""from"": ""human"", ""value"": ""Can you provide a code example of how to set up a basic Symfony framework with HttpCache?""}, {""from"": ""gpt"", ""value"": ""Certainly! Here's an example of setting up a basic Symfony framework with the `HttpCache` component:\n\n```php\n// example.com/web/front.php\n\nuse Symfony\\Component\\HttpKernel\\HttpCache\\HttpCache;\nuse Symfony\\Component\\HttpKernel\\HttpCache\\Store;\nuse Symfony\\Component\\HttpFoundation\\Request;\nuse App\\Framework;\n\n$request = Request::createFromGlobals();\n$framework = new Framework(); // your custom framework that implements HttpKernelInterface\n\n// Set up HTTP caching\n$httpCache = new HttpCache($framework, new Store(__DIR__.'/../cache'));\n\n// Handle the incoming request\n$response = $httpCache->handle($request);\n$response->send();\n```\n\nIn this code:\n1. We create a `Request` instance from global PHP variables.\n2. A new instance of `Framework`, which is our custom framework implementing `HttpKernelInterface`, is created.\n3. An `HttpCache` instance is initialized wrapping our framework with a specified cache store directory.\n4. Finally, we handle the request through the `HttpCache`, and the response is sent back to the client. This setup allows the application to take advantage of the HTTP caching feature provided by Symfony.""}]",knowledge/php/symfony-docs-7.1,1.0,train
"[{""from"": ""human"", ""value"": ""What method can be used to set a time-to-live (TTL) for cached responses in Symfony?""}, {""from"": ""gpt"", ""value"": ""In Symfony, the `Response` class provides a method called `setTtl()` that can be used to set the time-to-live (TTL) for cached responses. The TTL defines how long, in seconds, the response can be stored in the cache before it is considered stale.\n\nFor example, here is how you can set a TTL for a response in a controller:\n\n```php\n// example.com/src/Calendar/Controller/LeapYearController.php\n\nnamespace App\\Controller;\n\nuse Symfony\\Component\\HttpFoundation\\Request;\nuse Symfony\\Component\\HttpFoundation\\Response;\nuse Symfony\\Bundle\\FrameworkBundle\\Controller\\AbstractController;\n\nclass LeapYearController extends AbstractController\n{\n    public function index(Request $request, int $year): Response\n    {\n        $response = new Response();\n        if ($year % 4 === 0 && ($year % 100 !== 0 || $year % 400 === 0)) {\n            $response->setContent('Yep, this is a leap year!');\n        } else {\n            $response->setContent('Nope, this is not a leap year.');\n        }\n        // Set time-to-live for caching\n        $response->setTtl(10);\n        return $response;\n    }\n}\n```\n\nIn this snippet, the `setTtl(10)` method call specifies that the response is cacheable for 10 seconds. After this period, the cached response will expire, and a new request will trigger the generation of a fresh response.""}]",knowledge/php/symfony-docs-7.1,1.0,train
"[{""from"": ""human"", ""value"": ""How does the Response class allow for configuring HTTP cache methods?""}, {""from"": ""gpt"", ""value"": ""The `Response` class in Symfony provides a variety of methods that can be used to configure HTTP cache behavior for responses. Some of the key methods for cache configuration include:\n1. **setCache()**: This method abstracts several caching strategies and allows the developer to configure various cache settings using an associative array. For example:\n    ```php\n    $response->setCache([\n        'public' => true,\n        'max_age' => 600,\n        's_maxage' => 600\n    ]);\n    ```\n2. **setTtl()**: Defines the time-to-live for the response, which specifies how long the response is considered fresh.\n3. **setPublic()** and **setPrivate()**: These methods allow you to specify if the response can be cached by any cache (public) or only by the user's browser (private).\n4. **setLastModified()**: Used to set the last modified time of the response, helping in validating the cache:\n    ```php\n    $response->setLastModified(new \\DateTime());\n    ```\n5. **setETag()**: Assigns an entity tag (ETag) to the response which is a unique identifier for the content, useful for cache validation.\n6. **isNotModified()**: This method is used to check if the cached version of the response is still valid based on the request's `If-None-Match` header.\n\nBy using these methods effectively, developers can finely tune the caching strategies of their applications, allowing better performance and efficient resource management.""}]",knowledge/php/symfony-docs-7.1,1.0,train
"[{""from"": ""human"", ""value"": ""How can you enable debugging in HttpCache for Symfony applications?""}, {""from"": ""gpt"", ""value"": ""To enable debugging in `HttpCache` for Symfony applications, you can pass a configuration option when creating the `HttpCache` instance. The debug mode adds an HTTP header (`X-Symfony-Cache`) to each response, which provides insights into the cache's behavior.\n\nHere\u2019s an example of how to enable debugging:\n\n```php\n$httpCache = new HttpCache(\n    $framework,\n    new Store(__DIR__.'/../cache'),\n    new Esi(),\n    ['debug' => true] // Enable debugging\n);\n```\n\nIn this code, the last parameter is an array where you specify `'debug' => true`. This activation allows developers to review detailed caching actions in the headers of the HTTP responses.\n\nFor example, the response headers might include:\n```\nX-Symfony-Cache:  GET /is_leap_year/2012: stale, invalid, store\n```\nSuch detailed information can greatly assist developers in understanding caching behavior and troubleshooting any issues that arise during the caching process.""}]",knowledge/php/symfony-docs-7.1,1.0,train
"[{""from"": ""human"", ""value"": ""What are Edge Side Includes (ESI) and how do they relate to Symfony's HttpCache?""}, {""from"": ""gpt"", ""value"": ""Edge Side Includes (ESI) are a markup language that allows web developers to define fragments of web pages that can be cached and assembled on the fly by the server. In the context of Symfony's `HttpCache`, ESI enables partial caching of dynamic content, allowing for more flexible caching strategies.\n\nIn Symfony, when using the `HttpCache` component, ESI tags can be placed within HTML content to mark specific areas that should be fetched as sub-requests and rendered separately. Here is how it works:\n\n```html\n<!-- Example HTML with ESI tags -->\nThis is the content of your page\n\n<esi:include src=\""/leapyear/2012\""/>\n\nSome other content\n```\n\nIn this example, the `<esi:include>` tag indicates that the content for the URL `/leapyear/2012` should be included as a sub-request. To enable ESI support in your framework, you need to pass an instance of the `Esi` class when creating your `HttpCache` instance:\n\n```php\n$httpCache = new HttpCache(\n    $framework,\n    new Store(__DIR__.'/../cache'),\n    new Esi()\n);\n```\n\nThis allows the `HttpCache` component to recognize ESI tags and handle them appropriately, making it possible to cache entire pages while allowing specific fragments to be dynamically generated or updated. This capability is particularly beneficial for applications where certain parts of a page need to be frequently refreshed while others remain static.""}]",knowledge/php/symfony-docs-7.1,1.0,train
"[{""from"": ""human"", ""value"": ""What features does HttpCache support regarding cache control extensions?""}, {""from"": ""gpt"", ""value"": ""The `HttpCache` component in Symfony supports several advanced features related to cache control extensions as defined in RFC 5861. Some of the notable features include:\n1. **stale-while-revalidate**: This extension allows stale responses to be served while a background revalidation occurs to refresh the cache. This means that users can receive content quickly even if it is slightly outdated, enhancing user experience.\n2. **stale-if-error**: This feature lets the cache serve a stale response if there is an error during revalidation or fetching fresh content from the origin server. This guarantees that the user still receives a response even if the system encounters issues, effectively enhancing reliability.\n\nExample usage of these features would typically be defined within HTTP response headers set by the Symfony `Response` class, guiding the caching behavior without extensive custom logic.\n\nOverall, these extensions improve the robustness and responsiveness of web applications by providing intelligent caching strategies that cater to varying user scenarios.""}]",knowledge/php/symfony-docs-7.1,1.0,train
"[{""from"": ""human"", ""value"": ""In Symfony, how can you check if a response is not modified to leverage caching effectively?""}, {""from"": ""gpt"", ""value"": ""In Symfony, to leverage caching effectively, you can use the `isNotModified()` method of the `Response` class. This method checks if the current request matches the ETag or Last-Modified value of a cached response, allowing you to determine whether a fresh response is necessary.\n\nHere\u2019s how it can be implemented:\n\n```php\n$response->setETag('some_unique_identifier');\n\nif ($response->isNotModified($request)) {\n    return $response; // Serve the cached response\n}\n\n$response->setContent('The computed content of the response');\nreturn $response; // Serve the newly generated content\n```\n\nIn this example, an ETag is set for the response, and the `isNotModified()` method checks against the incoming request. If the request indicates that the cached response is still valid, it is returned directly, thereby skipping unnecessary processing and improving performance. This is particularly useful for reducing server load and ensuring faster response times for end-users.""}]",knowledge/php/symfony-docs-7.1,1.0,train
"[{""from"": ""human"", ""value"": ""What would you recommend for managing application cache in production environments?""}, {""from"": ""gpt"", ""value"": ""For managing application cache in production environments, I recommend the following best practices:\n1. **Use Symfony Reverse Proxy**: Continue utilizing Symfony's implementation of `HttpCache` as it works well, especially for shared hosting scenarios. It provides built-in features for effective caching.\n2. **Consider Varnish**: For even better performance and advanced caching capabilities, consider switching to a dedicated reverse proxy like Varnish. Varnish is open-source and designed specifically for high traffic web applications, enabling efficient caching and quick response times.\n3. **Tune Cache Settings**: Utilize HTTP cache headers effectively to manage your caching strategy. Using methods like `setCache()`, `setTtl()`, and others allows you to define specific behavior for different types of responses.\n4. **Monitor Performance**: Implement monitoring to regularly observe cache hit rates, response times, and any potential bottlenecks in your caching layer. This will help you adjust settings as needed.\n5. **Debugging in Production**: Avoid leaving debug mode enabled in production environments as it can expose sensitive information through headers. Ensure it is turned off to maintain application security.\nBy following these practices, you can create a robust caching strategy that enhances the performance and efficiency of your Symfony applications in a production setting.""}]",knowledge/php/symfony-docs-7.1,1.0,train
"[{""from"": ""human"", ""value"": ""How can Symfony applications utilize caching strategies outlined in the HTTP specification?""}, {""from"": ""gpt"", ""value"": ""Symfony applications can utilize caching strategies outlined in the HTTP specification through careful implementation of the `Response` class methods and appropriate use of HTTP headers. Here\u2019s how:\n\n1. **Setting Cache-Control Headers**: Using methods like `setCache()` and setting various directives such as `max-age`, `s-maxage`, and `must-revalidate` to define how responses should be cached by browsers and intermediary caches.\n\n   ```php\n   $response->setCache([\n       'max_age' => 3600,\n       's_maxage' => 3600,\n       'must_revalidate' => true\n   ]);\n   ```\n\n2. **Using ETags for Validation**: The use of ETags helps in validating cached responses. Setting an ETag allows clients to make conditional requests using `If-None-Match` headers to check if the cached response is still valid.\n\n   ```php\n   $response->setETag('some_etag_value');\n   if ($response->isNotModified($request)) {\n       return $response; // Serve cached response\n   }\n   ```\n\n3. **Last-Modified Header**: Additionally, `setLastModified()` can be used to inform clients about the last time the content was modified, enabling them to determine whether to fetch a new version or use the one they have in their cache.\n\n4. **Control Over Expiration**: Response expiration can be precisely controlled with methods like `setTtl()`, providing the flexibility to specify how long each unique response should be considered fresh.\n\nThese capabilities allow Symfony applications to effectively manage caching as per the HTTP specifications, improving client-side performance and reducing unnecessary server load.""}]",knowledge/php/symfony-docs-7.1,1.0,train
