conversations,source,score,split
"[{""from"": ""human"", ""value"": ""What is the purpose of the access_control feature in Symfony's security system?""}, {""from"": ""gpt"", ""value"": ""The `access_control` feature in Symfony's security system is designed to manage and enforce access restrictions for incoming requests based on specific criteria such as URI paths, user roles, IP addresses, request methods, and other parameters. It allows developers to define rules that determine whether a user should be granted access to specific parts of the application. When a request is received, Symfony checks the defined `access_control` entries in the order they are presented and applies the first match it finds, which simplifies authorization management and enhances security.""}]",knowledge/php/symfony-docs-7.1,1.0,train
"[{""from"": ""human"", ""value"": ""How does Symfony determine which access_control rule to apply?""}, {""from"": ""gpt"", ""value"": ""Symfony determines which `access_control` rule to apply by evaluating each entry against the incoming request's attributes, including the URI path, client's IP address, HTTP request method, and other specified conditions. The first `access_control` rule that matches the request is the one that gets enforced. This means that as soon as Symfony finds a matching entry, it stops looking for further matches. The configuration allows developers to set criteria like regex patterns for paths, arrays of allowed IP addresses, or required user roles, thus providing fine-grained control over access to various parts of the application.""}]",knowledge/php/symfony-docs-7.1,1.0,train
"[{""from"": ""human"", ""value"": ""What options can be configured within an access_control entry?""}, {""from"": ""gpt"", ""value"": ""An `access_control` entry in Symfony can be configured with several options that specify the conditions under which it should apply. These options include:\n- `path`: A regex pattern defining the URI that will be matched.\n- `ip` or `ips`: Specifies allowed IP addresses, supporting both single addresses and netmasks.\n- `port`: An integer specifying the port that must match the request.\n- `host`: A regex pattern for the host header of the request.\n- `methods`: One or more HTTP methods that should match (e.g., GET, POST).\n- `request_matcher`: A service implementing the `RequestMatcherInterface` for custom matching logic.\n- `attributes`: An array of request attributes that must match exactly.\n- `route`: A named route that is required for the rule to match.\n\nThese options provide flexibility in defining security rules that can adapt to various application needs.""}]",knowledge/php/symfony-docs-7.1,1.0,train
"[{""from"": ""human"", ""value"": ""What is an example of an access_control entry using roles in Symfony?""}, {""from"": ""gpt"", ""value"": ""An example of an `access_control` entry using roles in Symfony would be:\n\n```yaml\nsecurity:\n    access_control:\n        - { path: '^/admin', roles: ['ROLE_ADMIN'] }\n```\n\nIn this configuration, any access to paths matching the regex `^/admin` will be restricted to users who possess the `ROLE_ADMIN` role. If a user attempting to access the `/admin` path does not have this role, they will be denied access.""}]",knowledge/php/symfony-docs-7.1,1.0,train
"[{""from"": ""human"", ""value"": ""How can IP address restrictions be implemented in Symfony's access_control?""}, {""from"": ""gpt"", ""value"": ""IP address restrictions can be implemented in Symfony's `access_control` feature by specifying the `ip` or `ips` options within an access rule. For example:\n\n```yaml\nsecurity:\n    access_control:\n        - { path: '^/internal', roles: 'ROLE_USER', ips: ['127.0.0.1', '192.168.1.0/24'] }\n```\n\nIn this configuration, access to any URI matching the `^/internal` path is restricted to requests originating from the IP address `127.0.0.1` or any IP in the `192.168.1.0/24` subnet. If a request comes from an IP address not specified, Symfony will check other access rules until it finds a match or exhausts the list of rules.""}]",knowledge/php/symfony-docs-7.1,1.0,train
"[{""from"": ""human"", ""value"": ""Describe how to define a role condition with a custom expression using allow_if.""}, {""from"": ""gpt"", ""value"": ""To define a role condition with a custom expression using `allow_if`, you can specify an expression that evaluates to true or false based on the request or user attributes. Here is an example:\n\n```yaml\nsecurity:\n    access_control:\n        -\n            path: '^/secure'\n            roles: ['ROLE_ADMIN']\n            allow_if: \""request.getClientIp() == '127.0.0.1'\""\n```\n\nIn this example, access is granted to the `/secure` path if the user has the `ROLE_ADMIN` role *or* if the request comes from the IP address `127.0.0.1`. If the IP does not match, but the user has the role, access will still be granted. The expression allows for complex logic, enabling conditional access based on various request variables.""}]",knowledge/php/symfony-docs-7.1,1.0,train
"[{""from"": ""human"", ""value"": ""Can custom request matchers be used in the access_control configuration?""}, {""from"": ""gpt"", ""value"": ""Yes, custom request matchers can be utilized in the Symfony `access_control` configuration. You can achieve this by defining a service that implements the `RequestMatcherInterface` and referencing it in your configuration. For instance, you might have a rule like this:\n\n```yaml\nsecurity:\n    access_control:\n        - { path: '^/custom', roles: ROLE_USER, request_matcher: App\\Security\\RequestMatcher\\MyRequestMatcher }\n```\n\nIn this setup, Symfony will use the `MyRequestMatcher` service to determine if the current request satisfies the defined conditions. This allows for flexibility beyond the default matching options, enabling tailored access control logic.""}]",knowledge/php/symfony-docs-7.1,1.0,train
"[{""from"": ""human"", ""value"": ""How should multiple access_control rules be prioritized in Symfony?""}, {""from"": ""gpt"", ""value"": ""In Symfony, multiple `access_control` rules are prioritized based on their order in the configuration. The framework evaluates these rules sequentially from top to bottom. The first rule that matches the incoming request will be the one that is applied, and Symfony will ignore any subsequent rules following the match. Therefore, when defining access control rules, it's important to carefully consider the order of these rules to ensure that more specific rules come before less specific ones. For instance:\n\n```yaml\nsecurity:\n    access_control:\n        - { path: '^/admin', roles: ROLE_USER }\n        - { path: '^/admin/settings', roles: ROLE_ADMIN }\n```\n\nIn this example, requests to `/admin/settings` will only allow users with the `ROLE_ADMIN`, reflecting higher specificity over the more general `ROLE_USER` rule.""}]",knowledge/php/symfony-docs-7.1,1.0,train
"[{""from"": ""human"", ""value"": ""What security considerations should be made when using the allow_if option?""}, {""from"": ""gpt"", ""value"": ""When using the `allow_if` option in Symfony's `access_control`, several security considerations should be taken into account:\n1. **Expression Safety**: Ensure that expressions are safe and do not expose sensitive data or logic. Avoid using untrusted inputs directly in the expressions.\n2. **Performance**: Complex expressions can introduce performance overhead. Limit the complexity to ensure that access control checks remain efficient.\n3. **Role Validation**: The presence of the `allow_if` option can interact with role checks. If both `roles` and `allow_if` are defined, consider how access will be granted based on the default access decision strategy.\n4. **Testing Expressions**: Thoroughly test the expressions defined in `allow_if` to ensure they behave as expected, particularly under various scenarios, to avoid inadvertently granting or denying access.\n5. **Readability**: Keep expressions clear and readable so that other developers can easily understand the intended access logic.""}]",knowledge/php/symfony-docs-7.1,1.0,train
"[{""from"": ""human"", ""value"": ""What happens if no access_control rules match a request?""}, {""from"": ""gpt"", ""value"": ""If no `access_control` rules match a request in Symfony, the request will proceed to the next stage of processing, which typically involves executing the controller associated with the request. Depending on the routing configuration and application logic, the request may either be handled normally or may reach an endpoint that is configured to disallow access. If defaults are not set, fallback behavior may lead to access being allowed, potentially exposing sensitive routes. Therefore, it is important to always define `access_control` rules thoughtfully to ensure that they cover all applicable routes and that unprotected paths do not inadvertently allow unauthorized access.""}]",knowledge/php/symfony-docs-7.1,1.0,train
"[{""from"": ""human"", ""value"": ""How can access_control be configured to require SSL for specific routes?""}, {""from"": ""gpt"", ""value"": ""To configure `access_control` to require SSL for specific routes in Symfony, use the `requires_channel` option in your security configuration. Here's an example:\n\n```yaml\nsecurity:\n    access_control:\n        - { path: '^/secure', roles: PUBLIC_ACCESS, requires_channel: https }\n```\n\nIn this example, any access to the `/secure` path must occur over HTTPS. If a request to this path uses HTTP, Symfony will automatically redirect the user to the HTTPS version of the URL, ensuring secure access.""}]",knowledge/php/symfony-docs-7.1,1.0,train
"[{""from"": ""human"", ""value"": ""Can the access_control rules manage different HTTP methods in Symfony?""}, {""from"": ""gpt"", ""value"": ""Yes, `access_control` rules in Symfony can manage different HTTP methods by using the `methods` option. This allows you to specify one or more HTTP methods that must match in order for the rule to apply. For example:\n\n```yaml\nsecurity:\n    access_control:\n        - { path: '^/api', roles: ROLE_API_USER, methods: ['GET', 'POST'] }\n```\n\nIn this configuration, access to any path starting with `/api` will only be granted to requests that use the specified HTTP methods, namely GET and POST. This approach helps in restricting access to endpoints based on the type of operation (such as read or write) being enforced on that endpoint.""}]",knowledge/php/symfony-docs-7.1,1.0,train
"[{""from"": ""human"", ""value"": ""What is the purpose of the roles option in an access_control entry?""}, {""from"": ""gpt"", ""value"": ""The `roles` option in an `access_control` entry specifies the user roles required to access the corresponding path. If a user attempting to access a restricted resource does not possess any of the specified roles, the request will be denied access, and typically an `AccessDeniedException` will be thrown. This mechanism is a fundamental part of access management and helps enforce authorization logic within an application. By assigning roles to users, the application can safeguard sensitive areas by ensuring that only users with the necessary permissions can interact with those routes.""}]",knowledge/php/symfony-docs-7.1,1.0,train
"[{""from"": ""human"", ""value"": ""How does access_control work with Symfony's roles hierarchy?""}, {""from"": ""gpt"", ""value"": ""`access_control` in Symfony respects the roles hierarchy, meaning that if a user has a role that is higher in the hierarchy than the role specified in an `access_control` entry, they will be granted access. For instance, if `ROLE_ADMIN` is defined as a higher privilege than `ROLE_USER`, and an `access_control` entry requires `ROLE_USER`, an authenticated user with `ROLE_ADMIN` will still have access to that path. This hierarchy simplifies role management and allows for a more layered security approach where broader roles can encompass more specific duties.""}]",knowledge/php/symfony-docs-7.1,1.0,train
"[{""from"": ""human"", ""value"": ""How can you restrict access based on a specific port in access_control?""}, {""from"": ""gpt"", ""value"": ""You can restrict access based on a specific port in Symfony's `access_control` configuration by using the `port` option. For example:\n\n```yaml\nsecurity:\n    access_control:\n        - { path: '^/checkout', roles: PUBLIC_ACCESS, port: 8080 }\n```\n\nIn this configuration, only requests to the `/checkout` path that are made on port `8080` will be allowed, effectively limiting access to that specific port. This feature can be particularly useful for applications that require operation on defined ports, such as locally hosted services during development.""}]",knowledge/php/symfony-docs-7.1,1.0,train
"[{""from"": ""human"", ""value"": ""What does the allow_if option enable in the access_control system?""}, {""from"": ""gpt"", ""value"": ""The `allow_if` option in Symfony's `access_control` system enables developers to apply complex logic for granting access that goes beyond simple role checks. By defining an expression within `allow_if`, access can depend on various factors such as request attributes or conditions that are evaluated during runtime. For example:\n\n```yaml\nsecurity:\n    access_control:\n        -\n            path: ^/secure\n            roles: ROLE_USER\n            allow_if: \""request.getClientIp() == '192.168.1.100'\""\n```\n\nHere, access to the `/secure` path is granted if the user has the `ROLE_USER`, and the request must also originate from the specific IP address `192.168.1.100`. This allows for sophisticated security requirements based on multiple attributes.""}]",knowledge/php/symfony-docs-7.1,1.0,train
"[{""from"": ""human"", ""value"": ""What steps should be followed to define a custom request matcher in Symfony?""}, {""from"": ""gpt"", ""value"": ""To define a custom request matcher in Symfony, follow these steps:\n1. **Create a Class**: Create a new class that implements the `RequestMatcherInterface` provided by Symfony.\n   ```php\n   namespace App\\Security\\RequestMatcher;\n   use Symfony\\Component\\HttpFoundation\\Request;\n   use Symfony\\Component\\HttpFoundation\\RequestMatcherInterface;\n\n   class CustomRequestMatcher implements RequestMatcherInterface {\n       public function matches(Request $request): bool {\n           // Custom matching logic goes here\n           return $request->attributes->get('_role') === 'ROLE_ADMIN';\n       }\n   }\n   ```\n2. **Register the Matcher as a Service**: Define this class as a service in your service configuration (services.yaml).\n3. **Use in access_control**: Reference your custom matcher in the `access_control` entries:\n   ```yaml\n   security:\n       access_control:\n           - { path: '^/custom', roles: ROLE_USER, request_matcher: App\\Security\\RequestMatcher\\CustomRequestMatcher }\n   ```\n4. **Test Your Matcher**: Make sure to test your custom matching logic to verify it works as intended.""}]",knowledge/php/symfony-docs-7.1,1.0,train
"[{""from"": ""human"", ""value"": ""Explain how the expression in allow_if interacts with the roles in access_control.""}, {""from"": ""gpt"", ""value"": ""The expression defined in `allow_if` interacts with the `roles` specified in `access_control` by functioning like an OR condition in terms of access grant decisions. When a request matches an access entry that includes both a `roles` and an `allow_if` expression, access is allowed if either the user possesses the specified role(s) or the expression evaluates to true. For instance:\n```yaml\nsecurity:\n    access_control:\n        -\n            path: ^/sensitive\n            roles: ['ROLE_USER']\n            allow_if: \""request.headers.has('X-Special-Access')\""\n```\nIn this scenario, a user would gain access to the `/sensitive` path if they have the `ROLE_USER` or if the request contains a special header named `X-Special-Access`. This makes it possible to implement flexible access rules that can adapt based on varying conditions beyond just user roles.""}]",knowledge/php/symfony-docs-7.1,1.0,train
"[{""from"": ""human"", ""value"": ""How does Symfony enforce access restrictions once a matching access_control rule is found?""}, {""from"": ""gpt"", ""value"": ""Once Symfony identifies a matching `access_control` rule for a request, it enforces access restrictions based on the parameters defined in that rule. The key components for enforcing access include:\n1. **Roles**: If the `roles` option includes roles that the user must have, Symfony checks the user's roles against this list. An `AccessDeniedException` is thrown if the user lacks any of the required roles.\n2. **allow_if**: If this option is present, Symfony evaluates the provided expression. Access is denied if the expression returns false.\n3. **requires_channel**: This parameter checks the request's channel (HTTP or HTTPS). If the request does not meet the required channel, the user is redirected appropriately.\nIn summary, Symfony combines these mechanisms to thoroughly assess whether access should be granted or denied based on the specified criteria.""}]",knowledge/php/symfony-docs-7.1,1.0,train
"[{""from"": ""human"", ""value"": ""What should developers be aware of when using the IP matching options in access_control?""}, {""from"": ""gpt"", ""value"": ""When using the IP matching options in `access_control`, developers should keep several important considerations in mind:\n1. **Precision of Matching**: The `ips` option specifies exact IP addresses or subnets, which means any mismatch will result in the rule not being applied. Make sure to test these carefully for accuracy.\n2. **Potential for Whitelisting**: Be cautious when using `ips`; matched IPs may access resources that should be restricted, potentially creating security vulnerabilities if not designed carefully.\n3. **Overlapping Rules**: Define access rules in a clear order, as overlapping rules may lead to unexpected behaviors depending on their placement in the configuration.\n4. **Logging and Auditing**: Consider logging access attempts for monitoring IP-based access control, which can help diagnose security issues or unauthorized access attempts.\nBy adhering to these practices, developers can effectively utilize IP matching while maintaining robust application security.""}]",knowledge/php/symfony-docs-7.1,1.0,train
"[{""from"": ""human"", ""value"": ""How can Symfony help in managing user authentication alongside access_control?""}, {""from"": ""gpt"", ""value"": ""Symfony aids in managing user authentication alongside `access_control` through its integrated security system which ties authentication mechanisms (like firewalls, providers, and user entity management) with the access control rules defined. When access is denied based on `access_control`, Symfony can redirect users to login forms or trigger authentication processes based on the security configuration. This holistic management allows seamless transitions between unauthenticated and authenticated states, ensuring that access control checks enforce restrictions properly while also providing pathways for users to authenticate and gain access to restricted resources. This synergy is crucial for building secure web applications.""}]",knowledge/php/symfony-docs-7.1,1.0,train
"[{""from"": ""human"", ""value"": ""Can you illustrate how to load environment variables in access_control configuration in Symfony?""}, {""from"": ""gpt"", ""value"": ""Certainly! In Symfony, environment variables can be loaded into the `access_control` configuration using the `env` function. Here\u2019s how to do this:\n\n```yaml\nsecurity:\n    access_control:\n        - { path: '^/admin', roles: ROLE_USER, ips: '%env(TRUSTED_IPS)%' }\n```\n\nIn the above example, the `%env(TRUSTED_IPS)%` placeholder is utilized to fetch trusted IP addresses defined in the `.env` file or environment configurations. This approach allows you to maintain sensitive information such as IP ranges in environment variables, promoting better security practices by keeping them out of version control.""}]",knowledge/php/symfony-docs-7.1,1.0,train
"[{""from"": ""human"", ""value"": ""How does Symfony decide the correct access_control rule to use if multiple rules potentially match?""}, {""from"": ""gpt"", ""value"": ""Symfony decides on the correct `access_control` rule to apply by evaluating the rules in the order they are defined in the configuration file. It checks each rule sequentially based on the criteria specified (like path, IP address, etc.) and applies the first rule that matches the incoming request. This top-down processing ensures specificity is prioritized; for example, a more refined match for a specific route will be applied before a broader rule that applies to multiple routes. Therefore, careful consideration should be given to the order of rules to achieve the desired access control behavior.""}]",knowledge/php/symfony-docs-7.1,1.0,train
"[{""from"": ""human"", ""value"": ""Explain what issues could arise when defining overlapping access_control rules.""}, {""from"": ""gpt"", ""value"": ""Defining overlapping `access_control` rules can lead to several issues, such as:\n1. **Ambiguity in Matching**: If two or more rules could potentially match a request, it can confuse which rule should be enforced. This might result in unintentional access being granted or denied.\n2. **Maintenance Complexity**: Overlapping rules can complicate maintenance as developers may need to continuously evaluate and remember the precedence of rules, which may lead to errors as the application evolves.\n3. **Security Risks**: Improperly managed overlapping rules could inadvertently expose sensitive parts of an application, allowing unauthorized access if higher-prefixed rules are less restrictive.\n4. **Performance Impact**: Assessing multiple matching rules may introduce a performance overhead, especially in applications with extensive `access_control` configurations.\nTo mitigate these issues, it is recommended to define rules explicitly and avoid unnecessary overlaps by thoroughly planning the access controls based on the application requirements.""}]",knowledge/php/symfony-docs-7.1,1.0,train
"[{""from"": ""human"", ""value"": ""What structure should the security configuration file follow in Symfony?""}, {""from"": ""gpt"", ""value"": ""The structure of the security configuration file in Symfony typically follows a specific YAML format. A standard layout would include the definition of security parameters, firewalls, encoders, user providers, and access control rules. Below is an example outline:\n\n```yaml\n# config/packages/security.yaml\nsecurity:\n    encoders:\n        App\\Entity\\User:\n            algorithm: auto\n    providers:\n        app_user_provider:\n            entity:\n                class: App\\Entity\\User\n                property: username\n    firewalls:\n        main:\n            anonymous: true\n            http_basic: ~\n    access_control:\n        - { path: '^/admin', roles: ROLE_ADMIN }\n        - { path: '^/profile', roles: ROLE_USER }\n```\n\nIn this example, key settings include encoders for user passwords, a user provider for retrieving user details, firewall configurations for anonymous access, and the `access_control` section detailing which paths require which roles.""}]",knowledge/php/symfony-docs-7.1,1.0,train
