conversations,source,score,split
"[{""from"": ""human"", ""value"": ""What is the purpose of custom route loaders in Symfony?""}, {""from"": ""gpt"", ""value"": ""Custom route loaders in Symfony allow developers to define routing configurations based on custom conventions, patterns, or integrations that may not fit the standard route loading methods. This is particularly useful when working with libraries or components that generate routes dynamically or based on specific criteria. For example, using a custom route loader can integrate OpenAPI specifications or handle routes in a way that aligns with the requirements of specific bundles like SonataAdminBundle.""}]",knowledge/php/symfony-docs-7.1,1.0,train
"[{""from"": ""human"", ""value"": ""How can you implement a custom route loader in Symfony?""}, {""from"": ""gpt"", ""value"": ""To implement a custom route loader in Symfony, you need to create a class that implements the `Symfony\\Component\\Config\\Loader\\LoaderInterface`. Here\u2019s a basic example:\n\n```php\n// src/Routing/CustomLoader.php\nnamespace App\\Routing;\n\nuse Symfony\\Component\\Config\\Loader\\Loader;\nuse Symfony\\Component\\Routing\\Route;\nuse Symfony\\Component\\Routing\\RouteCollection;\n\nclass CustomLoader extends Loader\n{\n    public function load($resource, ?string $type = null): RouteCollection\n    {\n        $routes = new RouteCollection();\n\n        $route = new Route('/custom', ['_controller' => 'App\\Controller\\CustomController::index']);\n        $routes->add('custom_route', $route);\n\n        return $routes;\n    }\n\n    public function supports($resource, ?string $type = null): bool\n    {\n        return 'custom' === $type;\n    }\n}\n```\nIn this example, the `CustomLoader` provides a simple route that maps a URL path to a controller. The `supports` method checks if the loader can handle a particular resource type.""}]",knowledge/php/symfony-docs-7.1,1.0,train
"[{""from"": ""human"", ""value"": ""What are the built-in route loaders available in Symfony?""}, {""from"": ""gpt"", ""value"": ""Symfony comes with several built-in route loaders suitable for various use cases. These include:\n\n1. **File Loader**: Loads routes from YAML files stored in a bundle.\n   Example:\n   ```yaml\n   resource: '@AcmeBundle/Resources/config/routing.yaml'\n   ```\n\n2. **PSR-4 Loader**: Loads routes from PHP attributes in controllers found in a specified PSR-4 namespace directory.\n   Example:\n   ```yaml\n   resource:\n       path: '../src/Controller/'\n       namespace: App\\Controller\n   type: attribute\n   ```\n\n3. **Attribute Loader**: Loads routes directly from PHP attributes in specified controller paths.\n   Example:\n   ```yaml\n   resource: '../src/Controller/'\n   type: attribute\n   ```\n\n4. **Directory Loader**: Loads routes from YAML, XML, or PHP files within a specified directory.\n   Example:\n   ```yaml\n   resource: '../legacy/routing/'\n   type: directory\n   ```\n\n5. **Bundle Directory Loader**: Loads routes from a specified bundle directory.\n   Example:\n   ```yaml\n   resource: '@AcmeOtherBundle/Resources/config/routing/'\n   type: directory\n   ```\n6. **Service Loader**: Loads routes by calling a method on a service that returns a route collection.""}]",knowledge/php/symfony-docs-7.1,1.0,train
"[{""from"": ""human"", ""value"": ""What is the significance of the 'type' key when defining routes?""}, {""from"": ""gpt"", ""value"": ""The 'type' key in route definitions indicates the format or method by which the routes should be loaded. The value assigned to 'type' determines the loader that Symfony will use to interpret and process the resource defined in the route configuration. For instance:\n- If the type is 'attribute', Symfony looks for routes defined using PHP attributes in specified controller classes.\n- If the type is 'yaml', it expects the resource to be a YAML file containing route definitions.\n- Custom loaders can also define their own types, allowing for even further flexibility in how routes are registered. This helps Symfony efficiently delegate the loading process to the appropriate loader based on the type specified.""}]",knowledge/php/symfony-docs-7.1,1.0,train
"[{""from"": ""human"", ""value"": ""How does the DelegatingLoader function in Symfony?""}, {""from"": ""gpt"", ""value"": ""The `DelegatingLoader` in Symfony acts as a central hub for loading routes from various resources. This loader relies on several delegate loaders which are registered to handle different types of routing resources such as YAML files, XML files, or PHP attributes. The process begins when the main loader queries registered loaders using their `supports` method to determine if they can handle the given resource and type. \n\nWhen a loader indicates that it can support the provided resource, the `load` method of that loader is called which returns a `RouteCollection` filled with `Route` objects. This abstraction allows the main routing system to remain flexible and extensible, enabling developers to introduce custom loaders without modifying existing routing configurations. Ultimately, this ensures a consistent and organized approach to registering routes in Symfony applications.""}]",knowledge/php/symfony-docs-7.1,1.0,train
"[{""from"": ""human"", ""value"": ""Can you provide an example of a custom route loader configuration in Symfony?""}, {""from"": ""gpt"", ""value"": ""Sure! Below is an example of how to configure a custom route loader in Symfony using YAML:\n\n```yaml\n# config/routes.yaml\napp_custom_routes:\n    resource: .\n    type: custom\n```\nIn this configuration, `app_custom_routes` is the unique identifier for the route collection being defined. The `resource` key is set to `.` which is a convention to indicate the current directory, but it is insignificant for the custom loader's behavior. The `type` key specifies 'custom', which tells Symfony to use the custom loader we defined, and this loader must implement the `supports` method to recognize 'custom' as a supported type.""}]",knowledge/php/symfony-docs-7.1,1.0,train
"[{""from"": ""human"", ""value"": ""What should not be included in the key of a route definition?""}, {""from"": ""gpt"", ""value"": ""In the key of a route definition in Symfony, it is important to avoid duplicating the same identifier across different route files. Each route key (like `app_file`, `app_psr4`, or `app_attributes`) must be unique within the same routing configuration file. Duplicates can lead to route override issues, where the last defined route with a duplicated key will replace any previous ones, causing unintended behavior and routing conflicts in the application.""}]",knowledge/php/symfony-docs-7.1,1.0,train
"[{""from"": ""human"", ""value"": ""Describe the steps to create a custom route loader.""}, {""from"": ""gpt"", ""value"": ""Here are the steps to create a custom route loader in Symfony:\n\n1. **Create the Loader Class**: Define a new PHP class that extends `Symfony\\Component\\Config\\Loader\\Loader` or implements the `LoaderInterface` directly. Implement the `load` method to return a `RouteCollection` and the `supports` method to identify the types that this loader can handle.\n    ```php\n    class CustomLoader extends Loader\n    {\n        public function load($resource, ?string $type = null): RouteCollection\n        {\n            // Create routes\n        }\n\n        public function supports($resource, ?string $type = null): bool\n        {\n            return 'custom' === $type;\n        }\n    }\n    ```\n2. **Define the Service**: Register the loader in your service configuration file (services.yaml or services.xml) and tag it appropriately, e.g., `routing.loader`.\n    ```yaml\n    App\\Routing\\CustomLoader:\n        tags: [routing.loader]\n    ```\n3. **Configure Routes**: In your routing configuration file (routes.yaml, routes.xml, or routes.php), define a route collection that utilizes your custom loader by specifying its type.\n    ```yaml\n    custom_routes:\n        resource: .\n        type: custom\n    ```\n4. **Usage**: Once configured, Symfony's routing system will call your custom loader whenever it encounters the specified type during the route importing process.""}]",knowledge/php/symfony-docs-7.1,1.0,train
"[{""from"": ""human"", ""value"": ""What happens to routes defined using custom route loaders?""}, {""from"": ""gpt"", ""value"": ""Routes defined using custom route loaders will be automatically cached by Symfony's routing framework, just like routes defined using built-in formats such as YAML, XML, or PHP files. This caching allows for improved performance as the routing system does not need to re-parse the route definitions on every request. It is important to note, however, that whenever the implementation details of a custom loader change, developers should clear the application cache to ensure that the new definitions are loaded correctly.""}]",knowledge/php/symfony-docs-7.1,1.0,train
"[{""from"": ""human"", ""value"": ""Explain how to handle dependencies within a custom route loader.""}, {""from"": ""gpt"", ""value"": ""When creating a custom route loader in Symfony, you can handle dependencies by injecting required services through the constructor of your loader class. By implementing the `__construct` method, you can add any dependencies that your loader needs, such as services provided by the Symfony service container. For instance:\n```php\nclass CustomLoader extends Loader\n{\n    public function __construct(private SomeNecessaryService $service) {}  \n\n    public function load($resource, ?string $type = null): RouteCollection\n    {\n        // Use $this->service as needed\n    }\n}\n```\nIn this example, the `SomeNecessaryService` is injected into the loader. Ensure that this service is defined in your `services.yaml`, enabling Symfony to manage its lifecycle appropriately, including passing it to the custom loader when instantiated.""}]",knowledge/php/symfony-docs-7.1,1.0,train
"[{""from"": ""human"", ""value"": ""How do you ensure that a custom loader is registered in Symfony?""}, {""from"": ""gpt"", ""value"": ""To ensure that a custom loader is registered in Symfony, you must tag your loader service with the `routing.loader` tag in your service definition. This tells Symfony's routing system to recognize your loader as a valid route loader that can handle custom types. Here\u2019s a basic example:\n```yaml\nservices:\n    App\\Routing\\CustomLoader:\n        tags: [routing.loader]\n```\nOnce tagged appropriately, Symfony will include the custom loader in its `DelegatingLoader`, allowing it to be called when routes of the defined type are processed.""}]",knowledge/php/symfony-docs-7.1,1.0,train
"[{""from"": ""human"", ""value"": ""Could you provide an example of a custom service method for loading routes?""}, {""from"": ""gpt"", ""value"": ""Certainly! Here\u2019s an example of how you could define a `loadRoutes` method within a service that serves as a custom route loader. This method should return a `RouteCollection`:\n\n```php\nnamespace App\\Service;\n\nuse Symfony\\Component\\Routing\\Route;\nuse Symfony\\Component\\Routing\\RouteCollection;\n\nclass AdminRouteLoader\n{\n    public function loadRoutes(): RouteCollection\n    {\n        $routes = new RouteCollection();\n\n        $route = new Route('/admin', ['_controller' => 'App\\Controller\\AdminController::index']);\n        $routes->add('admin_route', $route);\n\n        return $routes;\n    }\n}\n```\nIn this example, the `AdminRouteLoader` is a service with a method `loadRoutes` that creates a new route for an admin dashboard and adds it to the collection. To use this in routing configuration, you would specify it as follows:\n\n```yaml\nadmin_routes:\n    resource: 'admin_route_loader::loadRoutes'\n    type: service\n```""}]",knowledge/php/symfony-docs-7.1,1.0,train
"[{""from"": ""human"", ""value"": ""What considerations should be made when defining a custom route loader?""}, {""from"": ""gpt"", ""value"": ""When defining a custom route loader in Symfony, there are several considerations to keep in mind:\n1. **Type Uniqueness**: Ensure that the type you define in your loader does not conflict with existing types being utilized by built-in loaders. This will prevent unwanted behavior and ensure proper routing.\n2. **Performance**: The `load` method should be efficient, particularly if it will load many routes or be called frequently. Caching considerations should be accounted for, and developers should clear the system cache if the loader's implementation changes.\n3. **Dependency Management**: Plan how your loader will handle dependencies, either by injecting services directly into the loader or using service locators to fetch dependencies as needed.\n4. **Error Handling**: Implement error handling within the loader methods. For example, prevent loading the same routes multiple times or handle cases where the expected resources are missing.\n5. **Testing**: Create tests for the loader to ensure it behaves correctly under various conditions and integrates well with the rest of the Symfony routing system. This might include verifying that routes are added correctly and that the loader correctly responds to unsupported types.""}]",knowledge/php/symfony-docs-7.1,1.0,train
"[{""from"": ""human"", ""value"": ""What are some potential pitfalls when using custom route loaders?""}, {""from"": ""gpt"", ""value"": ""Some potential pitfalls when using custom route loaders in Symfony include:\n1. **Caching Issues**: If changes are made to the loader, failing to clear the cache may lead to the application using outdated routing information and not reflecting recent changes.\n2. **Overlapping Types**: If multiple loaders support the same resource type, it may create conflicts or confusion about which loader is responsible for a given resource.\n3. **Error Propagation**: Proper error handling is crucial because exceptions thrown in the loader can propagate into the routing system, potentially breaking route registration or application behavior.\n4. **Performance Pitfalls**: Inefficiencies in how routes are loaded (e.g., loading routes repeatedly, rather than once and caching the results) can hinder performance and lead to excessive resource consumption.""}]",knowledge/php/symfony-docs-7.1,1.0,train
"[{""from"": ""human"", ""value"": ""How do you create a route using attributes in Symfony?""}, {""from"": ""gpt"", ""value"": ""To create routes using attributes in Symfony, you can annotate your controller methods with the `#[Route]` attribute from the `Symfony\\Component\\Routing\\Annotation\\Route` namespace. For example:\n\n```php\nnamespace App\\Controller;\n\nuse Symfony\\Bundle\\FrameworkBundle\\Controller\\AbstractController;\nuse Symfony\\Component\\Routing\\Annotation\\Route;\nuse Symfony\\Component\\HttpFoundation\\Response;\n\nclass MyController extends AbstractController\n{\n    #[Route('/hello', name: 'hello')]\n    public function hello(): Response\n    {\n        return new Response('Hello World!');\n    }\n}\n```\nIn this example, the `hello` method is defined with the route path `/hello` and is accessible via the route name `hello`. When Symfony loads routes, it automatically picks up this attribute if the proper route loader is configured to handle attributes.""}]",knowledge/php/symfony-docs-7.1,1.0,train
"[{""from"": ""human"", ""value"": ""What is the role of the service definition in implementing a custom route loader?""}, {""from"": ""gpt"", ""value"": ""The service definition is crucial for a custom route loader because it tells Symfony's Dependency Injection container how to instantiate the loader, its dependencies, and how to recognize it as a potential route loader. By defining the service in a configuration file (like `services.yaml` or `services.xml`), you specify the class to be loaded, which services it depends on, and you tag it with `routing.loader` to ensure that Symfony understands that this service should be included in the routing system's delegation. For instance:\n```yaml\nservices:\n    App\\Routing\\CustomLoader:\n        tags: [routing.loader]\n```\nThis tells Symfony to treat `CustomLoader` as a route loader, and it will be called when routing configurations utilizing the supported type are processed.""}]",knowledge/php/symfony-docs-7.1,1.0,train
"[{""from"": ""human"", ""value"": ""Can you explain the structure of a YAML route definition in Symfony?""}, {""from"": ""gpt"", ""value"": ""In Symfony, a YAML route definition consists of a collection of key-value pairs structured to inform Symfony how to handle incoming requests for specific paths. Each route can be defined with a unique key corresponding to the route identifier, followed by settings such as resource paths and types. Here is a basic example:\n\n```yaml\nhome:\n    path: /home\n    controller: App\\Controller\\HomeController::index\n\nabout:\n    path: /about\n    controller: App\\Controller\\AboutController::about\n    methods: [GET]\n```\nIn this example:\n- `home` and `about` are the unique identifiers for the routes.\n- The `path` specifies the URL that maps to the controller action.\n- The `controller` specifies which controller and action to invoke when the route is accessed.\n- Additionally, you can define HTTP methods that the routes should respond to using the `methods` option.""}]",knowledge/php/symfony-docs-7.1,1.0,train
"[{""from"": ""human"", ""value"": ""What is the significance of the tag `routing.loader` in Symfony service definition?""}, {""from"": ""gpt"", ""value"": ""The tag `routing.loader` in a Symfony service definition plays a vital role in registering custom route loaders within the Symfony routing system. When a service is tagged with `routing.loader`, it informs Symfony's Dependency Injection container that this service can be utilized to load routes. This allows it to be included in the `DelegatingLoader`, enabling Symfony to call it when processing routing configurations of matching types. Without this tag, Symfony would not recognize the service as a route loader, and it would not be invoked during the routing process. Hence, it is crucial for extending and customizing the route loading functionality effectively.""}]",knowledge/php/symfony-docs-7.1,1.0,train
"[{""from"": ""human"", ""value"": ""How does the `load` method of a custom loader work?""}, {""from"": ""gpt"", ""value"": ""The `load` method of a custom loader in Symfony is responsible for defining how routes should be created and returned as a `RouteCollection`. This method accepts two parameters: the `$resource`, which indicates the source of route definitions, and an optional `$type`, which identifies the type of loading mechanism being applied. Here\u2019s a breakdown of how to implement it:\n1. **Create a New RouteCollection**: Begin by instantiating a new `RouteCollection` object which will hold your routes.\n2. **Add Routes**: Define your routes using the `Route` class and add them to the `RouteCollection`. \n3. **Return the Collection**: Finally, return the populated `RouteCollection` at the end of the method.\nExample implementation:\n```php\npublic function load($resource, ?string $type = null): RouteCollection\n{\n    $routes = new RouteCollection();\n    $route = new Route('/custom', ['_controller' => 'App\\Controller\\CustomController::index']);\n    $routes->add('custom_route', $route);\n    return $routes;\n}\n```\nIn this example, the method creates a single custom route and returns it in a route collection.""}]",knowledge/php/symfony-docs-7.1,1.0,train
"[{""from"": ""human"", ""value"": ""In what scenarios would you consider implementing a custom route loader over built-in options?""}, {""from"": ""gpt"", ""value"": ""You would consider implementing a custom route loader over built-in options in scenarios where:\n1. **Specific Routing Conventions**: You have custom routing rules or guidelines that do not match the standard formats supported by Symfony, such as specific patterns or attributes unique to your application.\n2. **Generating Routes from External Sources**: When routes need to be generated from an external service, configuration files, or runtime data that is not fully compatible with YAML, XML, or PHP formats.\n3. **Dynamic Route Management**: If your application allows for dynamic management of routes based on user input or settings that change at runtime.\n4. **Integration with Other Libraries**: When integrating with external libraries or frameworks that handle routes differently than Symfony\u2019s typical approach, a custom loader may be necessary to bridge that gap.\n5. **Complex Logic for Route Handling**: Scenarios that require complex logic or specific business rules before registering a route to ensure certain conditions are met before the route is created.""}]",knowledge/php/symfony-docs-7.1,1.0,train
"[{""from"": ""human"", ""value"": ""What is required for a service method that loads routes in Symfony?""}, {""from"": ""gpt"", ""value"": ""For a service method that loads routes in Symfony, the following requirements need to be fulfilled:\n1. **Return Type**: The method must return an instance of `Symfony\\Component\\Routing\\RouteCollection`, which contains the defined routes.\n2. **Resource Parameter**: The method should be able to accept parameters (usually a resource identifier), which may determine where or how to load the routes. However, this can vary depending on how you've structured your loader logic.\n3. **Service Registration**: This method should be part of a service registered in Symfony's service container, which includes proper tagging to ensure it is recognized as a route loader.\n4. **Optional Parameters**: It can also accept an optional `$type` parameter to specify the type of route loading, allowing for more dynamic route handling.\nExample Method:\n```php\npublic function loadRoutes(): RouteCollection\n{\n    // Define and return routes\n}\n```""}]",knowledge/php/symfony-docs-7.1,1.0,train
"[{""from"": ""human"", ""value"": ""What are some advanced uses of custom route loaders?""}, {""from"": ""gpt"", ""value"": ""Some advanced uses of custom route loaders in Symfony include:\n1. **Chain Loaders**: Implementing a chain loader that delegates route loading to multiple loaders, leveraging different strategies for different resources or types while maintaining a unified routing system.\n2. **Dynamic Route Generation**: Creating routes at runtime based on external configurations, user-generated content, or settings that can change with user interactions or application state changes.\n3. **Conditional Routing Logic**: Designing loaders that can include or exclude routes based on application logic, user permissions, or feature toggles.\n4. **Extending Route Parameters**: Allowing routes to handle more complex parameter structures, including multi-parameter routes or hierarchy-based parameter evaluation.\n5. **Integration with Non-standard Formats**: Supporting custom formats for defining routes, such as routes defined within databases or through remote APIs, allowing for seamless integration of different routing strategies.""}]",knowledge/php/symfony-docs-7.1,1.0,train
"[{""from"": ""human"", ""value"": ""What configurations are needed for an advanced loader that uses secondary resources?""}, {""from"": ""gpt"", ""value"": ""For an advanced loader that utilizes secondary resources in Symfony, you need to implement the following configurations:\n1. **Resource Management**: The loader should manage multiple resources and their corresponding types effectively. This includes recognizing when to call secondary loaders appropriately and integrating their results into the primary route collection.\n2. **Load Method Implementation**: Implement the `load` method to handle the importing of secondary resources by utilizing the `import` method, which allows you to include routes from YAML, XML, or other source types defined within the same system.\n3. **Supports Method**: Ensure that the `supports` method is broad enough to accommodate the primary loader's type, as well as any additional types referenced through secondary resource imports.\n4. **Caching Considerations**: Since loading from secondary sources can increase operations, ensure that any routes generated are cached similarly to primary routes to maintain performance.\n5. **Error Handling and Fallbacks**: Implement error handling for cases where secondary resources are missing or misconfigured. You may want to define fallback behavior so that the basic routing still functions in the event of a secondary resource load failure.""}]",knowledge/php/symfony-docs-7.1,1.0,train
