conversations,source,score,split
"[{""from"": ""human"", ""value"": ""What is the purpose of Symfony's architecture?""}, {""from"": ""gpt"", ""value"": ""Symfony's architecture is designed to provide a robust framework that supports the development of web applications by separating concerns, encouraging reusable components, and simplifying tasks such as logging, autowiring, and service management. This architecture allows developers to focus on coding features without being bogged down by underlying complexities, enhancing both speed and quality in building applications. Symfony's architecture stands out because it streamlines many standard processes, automating common tasks through features like autowiring, which reduces boilerplate code and improves maintainability.""}]",knowledge/php/symfony-docs-7.1,1.0,train
"[{""from"": ""human"", ""value"": ""How do you add logging to a Symfony application?""}, {""from"": ""gpt"", ""value"": ""To add logging to a Symfony application, you can utilize the Monolog library by running the following command:  \n\n```terminal\n$ composer require logger\n```  \nThis command installs and configures Monolog automatically via a recipe. You can then use the logger in your controller by type-hinting the `LoggerInterface`. Below is an example:\n\n```php\n// src/Controller/DefaultController.php\nnamespace App\\Controller;\n\nuse Psr\\Log\\LoggerInterface;\nuse Symfony\\Bundle\\FrameworkBundle\\Controller\\AbstractController;\nuse Symfony\\Component\\HttpFoundation\\Response;\nuse Symfony\\Component\\Routing\\Attribute\\Route;\n\nclass DefaultController extends AbstractController\n{\n    #[Route('/hello/{name}', methods: ['GET'])]\n    public function index(string $name, LoggerInterface $logger): Response\n    {\n        $logger->info(\""Saying hello to $name!\"");\n        \n        // ...\n    }\n}\n```\n\nIn this example, when the index method is called, it logs a message containing the name provided in the route, and the log message is saved in `var/log/dev.log`. You can configure the log file path or logging methods in the configuration files created by the recipe.""}]",knowledge/php/symfony-docs-7.1,1.0,train
"[{""from"": ""human"", ""value"": ""Explain the concept of autowiring in Symfony.""}, {""from"": ""gpt"", ""value"": ""Autowiring in Symfony is a feature that allows the framework to automatically inject dependencies into services based on type hints provided in the constructor or method signatures. When a service is defined in Symfony, if any of its dependencies are type-hinted, Symfony reads these hints and resolves the appropriate service to inject. This minimizes the need for explicit service configuration and boilerplate code in service definitions, making it easier to manage dependencies in your application. For instance, if a service requires a `LoggerInterface` in its constructor, Symfony automatically provides an appropriate logger instance when the service is instantiated.\n\nTo see what services are available for autowiring, you can run:\n\n```terminal\n$ php bin/console debug:autowiring\n```\n\nThis will show you all the services available for autowiring, simplifying the exploration of possible dependencies you can use within your Symfony application.""}]",knowledge/php/symfony-docs-7.1,1.0,train
"[{""from"": ""human"", ""value"": ""Provide an example of creating a custom service in Symfony.""}, {""from"": ""gpt"", ""value"": ""Creating a custom service in Symfony is straightforward. Here\u2019s a step-by-step example where we create a service that generates random greetings. \n\n1. **Create the Greeting Service**: First, create a new class that serves as the service:\n   \n   ```php\n   // src/GreetingGenerator.php\n   namespace App;\n   \n   class GreetingGenerator\n   {\n       public function getRandomGreeting(): string\n       {\n           $greetings = ['Hey', 'Yo', 'Aloha'];\n           $greeting = $greetings[array_rand($greetings)];\n           \n           return $greeting;\n       }\n   }\n   ```\n\n2. **Use the Service in a Controller**: In your controller, you can now use this service by type-hinting it as a dependency:\n   \n   ```php\n   // src/Controller/DefaultController.php\n   namespace App\\Controller;\n   \n   use App\\GreetingGenerator;\n   use Psr\\Log\\LoggerInterface;\n   use Symfony\\Bundle\\FrameworkBundle\\Controller\\AbstractController;\n   use Symfony\\Component\\HttpFoundation\\Response;\n   use Symfony\\Component\\Routing\\Attribute\\Route;\n   \n   class DefaultController extends AbstractController\n   {\n       #[Route('/hello/{name}', methods: ['GET'])]\n       public function index(string $name, LoggerInterface $logger, GreetingGenerator $generator): Response\n       {\n           $greeting = $generator->getRandomGreeting();\n           $logger->info(\""Saying $greeting to $name!\"");\n           \n           // ...\n       }\n   }\n   ```\n   \nIn this example, you create a `GreetingGenerator` service that can be easily injected into your controller, demonstrating how you can build reusable and organized code in your Symfony application.""}]",knowledge/php/symfony-docs-7.1,1.0,train
"[{""from"": ""human"", ""value"": ""What is the importance of Symfony's cached container?""}, {""from"": ""gpt"", ""value"": ""The cached container in Symfony significantly enhances the performance of the application. When you first load a page in a Symfony application, all service definitions and configurations are compiled and cached, creating an efficient way to manage dependencies and service instances without recalculating them each time the application runs. \n\nThis caching mechanism not only speeds up the application by reducing overhead from autowiring and autoconfiguration processes, but it also enables Symfony to provide robust error handling. Symfony can validate and inspect all configurations and dependencies during the container building phase, which means it can catch errors early in a development cycle. \n\nWhen updates are made to the service definitions, Symfony is smart enough to rebuild the cache on the next request, maintaining a balance between performance and developer experience. Thus, the cached container is crucial in ensuring that Symfony applications run quickly and reliably, regardless of their complexity.""}]",knowledge/php/symfony-docs-7.1,1.0,train
"[{""from"": ""human"", ""value"": ""How does Symfony differentiate between development and production environments?""}, {""from"": ""gpt"", ""value"": ""Symfony differentiates between development and production environments through its environment system, which allows developers to specify configurations that apply to different stages of application lifecycle. In Symfony, the primary environments are 'dev', 'prod', and 'test'. Each environment can have distinct configurations that optimize performance or facilitate debugging:\n\n1. **Development Mode**: In the 'dev' environment, Symfony provides extensive debugging tools, such as detailed error messages and the web debug toolbar, which helps developers identify issues easily. The configuration may include less strict rules to facilitate development.\n\n2. **Production Mode**: In the 'prod' environment, configurations are optimized for speed and security. Debugging tools are hidden, and error reporting is minimized to avoid exposing sensitive information to the users. For instance, you might configure caching to ensure maximum efficiency.\n\nYou can define options specific to environments in configuration files using the `when@` syntax. For example:\n\n```yaml\n# config/packages/routing.yaml\nframework:\n    router:\n        utf8: true\n\nwhen@prod:\n    framework:\n        router:\n            strict_requirements: null\n```\n\nThus, changing an application's environment involves altering the `APP_ENV` variable in the `.env` file, enabling you to switch between these configurations seamlessly.""}]",knowledge/php/symfony-docs-7.1,1.0,train
"[{""from"": ""human"", ""value"": ""What is the purpose of using environment variables in Symfony?""}, {""from"": ""gpt"", ""value"": ""Environment variables in Symfony serve as a secure and flexible way to store application settings that may vary across different environments or deployments. This practice follows industry best practices by allowing sensitive information, such as database credentials, API keys, and other configuration options, to be unrepresented in the codebase, thereby reducing the risk of accidentally exposing sensitive data. \n\nUsing environment variables helps Symfony applications work well with various deployment systems, including PaaS platforms and Docker containers, making the applications more portable and easier to manage. \n\nWhen developing locally, Symfony loads a `.env` file by default, which contains the necessary configurations that can be easily customized based on the local development environment. As the application grows in complexity, it can dynamically add variables to this file as needed, maintaining simplicity and security. For example, when installing a package like Doctrine ORM, environment variables like `DATABASE_URL` are automatically added to ensure proper configuration:\n\n```bash\n# .env\nDATABASE_URL=mysql://db_user:db_password@127.0.0.1:3306/db_name\n```  \nThis allows developers to focus on coding without worrying about hardcoded configurations.""}]",knowledge/php/symfony-docs-7.1,1.0,train
"[{""from"": ""human"", ""value"": ""What is involved in creating a Twig extension in Symfony?""}, {""from"": ""gpt"", ""value"": ""Creating a Twig extension in Symfony involves defining a class that extends Symfony's `AbstractExtension` and implementing the desired filters or functions. Here are the steps to create a simple Twig extension that adds a 'greet' filter:\n\n1. **Create the Extension Class**:\n   - Create a class that extends `AbstractExtension`:\n   \n   ```php\n   // src/Twig/GreetExtension.php\n   namespace App\\Twig;\n   \n   use App\\GreetingGenerator;\n   use Twig\\Extension\\AbstractExtension;\n   use Twig\\TwigFilter;\n   \n   class GreetExtension extends AbstractExtension\n   {\n       public function __construct(\n           private GreetingGenerator $greetingGenerator,\n       ) {\n       }\n   \n       public function getFilters(): array\n       {\n           return [\n               new TwigFilter('greet', [$this, 'greetUser']),\n           ];\n       }\n   \n       public function greetUser(string $name): string\n       {\n           $greeting =  $this->greetingGenerator->getRandomGreeting();\n           \n           return \""$greeting $name!\"";\n       }\n   }\n   ```\n\n2. **Register the Extension Automatically**:\n   - Symfony uses autoconfiguration to automatically register the extension when it is created, so you don't need to manually configure it in service definitions.\n\n3. **Use the Filter in Twig Templates**:\n   - Now, you can utilize the `greet` filter in your Twig templates, like so:\n   \n   ```twig\n   {# templates/default/index.html.twig #}\n   <h1>{{ name|greet }}</h1>\n   ```\n\n  In this example, when the extension is used in a Twig template, Symfony automatically passes the necessary service dependencies, allowing developers to extend Twig functionality effortlessly.""}]",knowledge/php/symfony-docs-7.1,1.0,train
"[{""from"": ""human"", ""value"": ""How do you configure environment-specific settings in Symfony?""}, {""from"": ""gpt"", ""value"": ""To configure environment-specific settings in Symfony, you can utilize the built-in environment system that allows you to specify different configurations based on the application's environment (dev, prod, test). Each environment can be configured to suit its needs by applying different settings in the configuration files.\n\nHere are several methods to set up environment-specific configurations:\n\n1. **YAML Configuration**: You can define environment settings using the `when@` syntax in YAML files. For example:\n   \n   ```yaml\n   # config/packages/routing.yaml\n   framework:\n       router:\n           utf8: true\n\n   when@prod:\n       framework:\n           router:\n               strict_requirements: null\n   ```\n\n2. **XML Configuration**: Similar to YAML, you can specify configurations in XML files:\n   \n   ```xml\n   <!-- config/packages/framework.xml -->\n   <?xml version=\""1.0\"" encoding=\""UTF-8\"" ?>\n   <container xmlns=\""http://symfony.com/schema/dic/services\""\n       xmlns:xsi=\""http://www.w3.org/2001/XMLSchema-instance\""\n       xmlns:framework=\""http://symfony.com/schema/dic/symfony\""\n       xsi:schemaLocation=\""http://symfony.com/schema/dic/services\n           https://symfony.com/schema/dic/services/services-1.0.xsd\n           http://symfony.com/schema/dic/symfony\n           https://symfony.com/schema/dic/symfony/symfony-1.0.xsd\"">\n       <framework:config>\n           <framework:router utf8=\""true\""/>\n       </framework:config>\n       <when env=\""prod\"">\n           <framework:config>\n               <framework:router strict-requirements=\""null\""/>\n           </framework:config>\n       </when>\n   </container>\n   ```\n\n3. **PHP Configuration**: You can also configure settings in PHP files:\n   \n   ```php\n   // config/packages/framework.php\n   namespace Symfony\\Component\\DependencyInjection\\Loader\\Configurator;\n   use Symfony\\Config\\FrameworkConfig;\n   \n   return static function (FrameworkConfig $framework, ContainerConfigurator $container): void {\n       $framework->router()\n           ->utf8(true);\n   \n       if ('prod' === $container->env()) {\n           $framework->router()\n               ->strictRequirements(null);\n       }\n   };\n   ```\n\nIn summary, by using the `when@` syntax and setting specific configurations for each environment, Symfony allows you to create highly customizable setups for your production, development, and testing environments.""}]",knowledge/php/symfony-docs-7.1,1.0,train
"[{""from"": ""human"", ""value"": ""In what ways can Symfony be extended beyond custom services?""}, {""from"": ""gpt"", ""value"": ""Symfony can be extended in various ways beyond custom services, allowing developers to build additional functionality and tailor the framework to meet specific application requirements. Some of the key methods to extend Symfony include:\n\n1. **Creating Custom Command Line Commands**: Developers can define their console commands to automate tasks or provide custom interactive scripts for administrators or developers.\n   ```php\n   // src/Command/MyCustomCommand.php\n   namespace App\\Command;\n   \n   use Symfony\\Component\\Console\\Command\\Command;\n   use Symfony\\Component\\Console\\Input\\InputInterface;\n   use Symfony\\Component\\Console\\Output\\OutputInterface;\n   \n   class MyCustomCommand extends Command\n   {\n       protected static $defaultName = 'app:custom-command';\n       \n       protected function execute(InputInterface $input, OutputInterface $output)\n       {\n           $output->writeln('Hello Symfony!');\n           return Command::SUCCESS;\n       }\n   }\n   ```\n\n2. **Event Subscribers/Listeners**: Symfony's event dispatching system allows you to create custom listeners or subscribers to respond to various events that occur within the application lifecycle.\n   ```php\n   // src/EventSubscriber/MyEventSubscriber.php\n   namespace App\\EventSubscriber;\n   \n   use Symfony\\Component\\EventDispatcher\\EventSubscriberInterface;\n   use Symfony\\Component\\HttpKernel\\Event\\ResponseEvent;\n   \n   class MyEventSubscriber implements EventSubscriberInterface\n   {\n       public static function getSubscribedEvents()\n       {\n           return [\n               ResponseEvent::class => 'onResponse',\n           ];\n       }\n   \n       public function onResponse(ResponseEvent $event)\n       {\n           // Modify the response\n       }\n   }\n   ```\n\n3. **Custom Twig Functions/Filters**: As discussed earlier, developers can create custom Twig extensions to add new filters or functions, enabling them to manipulate templates more flexibly, such as creating formatting tools or calculations.""}]",knowledge/php/symfony-docs-7.1,1.0,train
"[{""from"": ""human"", ""value"": ""What advantages does Symfony provide for managing configurations?""}, {""from"": ""gpt"", ""value"": ""Symfony offers a number of advantages for managing configurations within applications, making it approachable for both developers and operations teams. Key benefits include:\n\n1. **Environment Specific Configurations**: Symfony supports defining different configurations based on the current environment (dev, prod, test) using special syntax for varying settings at build time, allowing tailored configurations based on deployment needs.\n   \n2. **Separation of Concerns**: Configuration files are organized and separated across different formats (YAML, XML, PHP), promoting a clean and manageable structure that adheres to best practices. Each format offers unique features, allowing developers to choose according to their preferences.\n\n3. **Automatic Cache Management**: Symfony handles the caching of configuration files, improving performance upon first load, while validating settings to ensure they are correct and consistent across different application states.\n\n4. **Environment Variables Usage**: Symfony leverages environment variables to keep sensitive data and environment-specific settings out of your source code, promoting security and flexibility. This approach also integrates well with infrastructure as code practices.\n\n5. **Dynamic Configuration Updates**: The ability to alter configurations dynamically based on service definitions during container operations allows for a high degree of flexibility and optimization in response to changing application requirements.""}]",knowledge/php/symfony-docs-7.1,1.0,train
