conversations,source,score,split
"[{""from"": ""human"", ""value"": ""What is the purpose of embedding forms in Symfony?""}, {""from"": ""gpt"", ""value"": ""The purpose of embedding forms in Symfony is to enable the construction of complex forms that can include fields from various objects, allowing for more sophisticated data interactions in applications. For instance, a registration form might combine data fields from a `User` object and multiple `Address` objects. This capability enhances the user experience by providing a seamless interface where multiple related entities are managed together.""}]",knowledge/php/symfony-docs-7.1,1.0,train
"[{""from"": ""human"", ""value"": ""How can you embed a single object in a Symfony form?""}, {""from"": ""gpt"", ""value"": ""To embed a single object in a Symfony form, you first need to have your object class defined (e.g., `Category`). Here are the steps you would follow:\n1. **Create the Object Class**: Define the object class that you wish to embed. Ensure you have any necessary validation constraints.\n   ```php\n   // src/Entity/Category.php\n   namespace App\\Entity;\n\n   use Symfony\\Component\\Validator\\Constraints as Assert;\n\n   class Category\n   {\n       #[Assert\\NotBlank]\n       public string $name;\n   }\n   ```\n\n2. **Update the Parent Object**: Modify the parent object (e.g., `Task`) to include a property of the type of the embedded object.\n   ```php\n   // src/Entity/Task.php\n   namespace App\\Entity;\n\n   use Symfony\\Component\\Validator\\Constraints as Assert;\n\n   class Task\n   {\n       #[Assert\\Type(type: Category::class)]\n       #[Assert\\Valid]\n       protected ?Category $category = null;\n\n       public function getCategory(): ?Category\n       {\n           return $this->category;\n       }\n\n       public function setCategory(?Category $category): void\n       {\n           $this->category = $category;\n       }\n   }\n   ```\n\n3. **Create a Form Type for the Embedded Object**: Define a form type class that represents the embedded object.\n   ```php\n   // src/Form/CategoryType.php\n   namespace App\\Form;\n\n   use App\\Entity\\Category;\n   use Symfony\\Component\\Form\\AbstractType;\n   use Symfony\\Component\\Form\\FormBuilderInterface;\n   use Symfony\\Component\\OptionsResolver\\OptionsResolver;\n\n   class CategoryType extends AbstractType\n   {\n       public function buildForm(FormBuilderInterface $builder, array $options): void\n       {\n           $builder->add('name');\n       }\n\n       public function configureOptions(OptionsResolver $resolver): void\n       {\n           $resolver->setDefaults([\n               'data_class' => Category::class,\n           ]);\n       }\n   }\n   ```\n\n4. **Add the Form to the Parent Form Type**: Update the form type of the parent object (e.g., `TaskType`) to include the embedded form.\n   ```php\n   use App\\Form\\CategoryType;\n\n   class TaskType extends AbstractType\n   {\n       public function buildForm(FormBuilderInterface $builder, array $options): void\n       {\n           $builder->add('category', CategoryType::class);\n       }\n   }\n   ```\n\n5. **Render the Form Fields**: The fields from the embedded object can be rendered alongside those of the parent.\n   ```twig\n   <h3>Category</h3>\n   <div class=\""category\"">\n       {{ form_row(form.category.name) }}\n   </div>\n   ```\n\nThis will allow modifications to the `Category` directly within the form for `Task`.""}]",knowledge/php/symfony-docs-7.1,1.0,train
"[{""from"": ""human"", ""value"": ""What does the `#[Assert\\Valid]` constraint do in Symfony forms?""}, {""from"": ""gpt"", ""value"": ""The `#[Assert\\Valid]` constraint in Symfony forms is used to enable validation for a related embedded object. When this constraint is applied to a property (e.g., a property that holds an instance of a `Category` in a `Task`), it tells Symfony's validation system to validate the associated object whenever the parent object is validated. In essence, it cascades validation to the embedded entity, ensuring that any constraints defined in the child class (e.g., `Category`) are enforced when the parent class (e.g., `Task`) is being submitted and validated.""}]",knowledge/php/symfony-docs-7.1,1.0,train
"[{""from"": ""human"", ""value"": ""Can you provide an example of how to render the embedded fields in a twig template?""}, {""from"": ""gpt"", ""value"": ""Certainly! To render the embedded fields in a Twig template when creating a form for a parent object that includes an embedded form, you follow these steps. Assuming you have a form for a `Task` that includes a `Category` type, you would do the following in your template:\n\n```twig\n{# task_form.html.twig #}\n{{ form_start(form) }}\n    <h3>Task</h3>\n    {# Render other fields of Task here #}\n\n    <h3>Category</h3>\n    <div class=\""category\"">\n        {{ form_row(form.category.name) }}\n    </div>\n\n    {# Add submit button, etc #}\n    <button type=\""submit\"">Submit</button>\n{{ form_end(form) }}\n```\n\nIn this example, `form.category.name` refers to the name field of the embedded `Category` form. The `form_row` function will generate the complete form field markup, including any associated labels, errors, and the input element itself.""}]",knowledge/php/symfony-docs-7.1,1.0,train
"[{""from"": ""human"", ""value"": ""What is the `collection` field type in Symfony forms, and when would it be used?""}, {""from"": ""gpt"", ""value"": ""The `collection` field type in Symfony forms allows you to embed multiple instances of a form type, making it suitable for creating forms that handle arrays or collections of objects. For instance, if you have a `Category` form which can contain many associated `Product` sub-forms, you would use the `collection` field type.\n\nHere\u2019s when you would use the `collection` field type:\n1. **Handling Multiple Entities**: When the user needs to manage multiple items of a type, such as adding or editing multiple products within a category.\n2. **Dynamic Element Management**: Often you can add or remove forms dynamically through JavaScript, providing a better user experience.\n3. **Batch Operations**: It allows users to perform operations on multiple instances at once, such as creating multiple related entities.\n\nExample usage in a form could look as follows:\n```php\nuse Symfony\\Component\\Form\\Extension\\Core\\Type\\CollectionType;\n\npublic function buildForm(FormBuilderInterface $builder, array $options): void\n{\n    $builder->add('products', CollectionType::class, [\n        'entry_type' => ProductType::class,\n        'allow_add' => true,\n        'allow_delete' => true,\n    ]);\n}\n```\nThis allows each `ProductType` form to be rendered as part of the `Category` form, making managing multiple products straightforward.""}]",knowledge/php/symfony-docs-7.1,1.0,train
"[{""from"": ""human"", ""value"": ""How do you handle data submitted from an embedded form when the form is submitted?""}, {""from"": ""gpt"", ""value"": ""When a form is submitted that contains an embedded form in Symfony, the data from the embedded fields are automatically mapped to the associated object instances. Here\u2019s how to handle the data after submission:\n\n1. **Form Creation**: Create the form and associate it with the parent object (e.g., `Task`).\n   ```php\n   // Inside your controller:\n   $task = new Task();\n   $form = $this->createForm(TaskType::class, $task);\n   ```\n\n2. **Handle Request**: When the form is submitted, handle the request to populate the form data.\n   ```php\n   $form->handleRequest($request);\n   ```\n\n3. **Check Submission and Validation**: Check if the form is valid after submission.\n   ```php\n   if ($form->isSubmitted() && $form->isValid()) {\n       // The $task object now contains the submitted data\n       $entityManager->persist($task);\n       $entityManager->flush();\n\n       // Redirect or return response as necessary\n   }\n   ```\n\n4. **Access Embedded Data**: You can access the embedded `Category` instance directly from the `Task` object.\n   ```php\n   // Fetch the category from the task\n   $category = $task->getCategory();\n   ```\n\nBy following these steps, the submitted data for the `Category` fields is utilized to instantiate a new `Category`, which is then set on the `Task` instance and can be persisted to the database or processed as needed.""}]",knowledge/php/symfony-docs-7.1,1.0,train
"[{""from"": ""human"", ""value"": ""What additional resources are recommended for learning about collection types in Symfony forms?""}, {""from"": ""gpt"", ""value"": ""To learn more about collection types in Symfony forms, the following resources are highly recommended:\n1. **Symfony Documentation**: The official Symfony documentation provides comprehensive guides on all form types including collections. \n   - [Form Collections](https://symfony.com/doc/current/forms.html#form-collections)\n   - [CollectionType Reference](https://symfony.com/doc/current/reference/forms/types/collection.html)\n   \n2. **SymfonyCasts**: Offers video tutorials on Symfony framework, including forms and how to work with complex form types.\n3. **Books on Symfony**: There are many books, such as 'Symfony 5: The Fast Track' by Fabien Potencier that cover forms extensively.\n4. **Community Forums and Discord**: Engaging with the Symfony community on forums or Discord channels can provide insights and support from experienced developers.\n\nThese resources can help deepen your understanding and provide practical examples of using collection types in Symfony forms.""}]",knowledge/php/symfony-docs-7.1,1.0,train
"[{""from"": ""human"", ""value"": ""What are some common issues developers encounter when working with embedded forms and how can they be resolved?""}, {""from"": ""gpt"", ""value"": ""When working with embedded forms in Symfony, developers may encounter several common issues. Here are some of them along with potential resolutions:\n\n1. **Validation Not Triggering**: If the `#[Assert\\Valid]` constraint is omitted, the embedded object's validation will not be triggered. Ensure that this constraint is set correctly on the property holding the embedded object.\n\n2. **Data Not Persisting**: If the embedded form data is not being saved, check that the form is properly bound to the parent entity and that you persist the parent entity correctly using the Entity Manager.\n\n3. **Incorrect Form Mapping**: Ensure that the form types are properly set up in the parent form. Any mismatch in field names can lead to the submission data not being mapped correctly to the entity properties.\n\n4. **JavaScript Handling of Dynamic Fields**: If you are adding/removing embedded forms dynamically with JavaScript, you must ensure that the forms are submitted with the correct names so that Symfony can rehydrate the objects correctly.\n\n5. **Using the Wrong Form Type**: Double-check that the correct Form Type is being used when adding an embedded form. Using an incorrect type can lead to unexpected behavior.\n\n6. **Handling Collections**: When dealing with collections, ensure that `allow_add` and `allow_delete` are configured if you need to dynamically add or remove items. \n\nBy frequently revisiting these aspects and maintaining clear documentation of your forms\u2019 structure, many of these issues can be preemptively addressed.""}]",knowledge/php/symfony-docs-7.1,1.0,train
"[{""from"": ""human"", ""value"": ""How can performance be impacted by using embedded forms and what practices can be applied to mitigate any issues?""}, {""from"": ""gpt"", ""value"": ""Performance can be impacted by using embedded forms in Symfony due to several reasons such as increased complexity and data processing overhead. Here are some potential issues and practices to mitigate them:\n\n1. **Increased Data Load**: When forms contain many embedded fields or collections, the volume of data can slow down form rendering and processing. **Mitigation**: Limit the number of embedded forms loaded at once. Implement pagination or load items dynamically as needed.\n\n2. **Validation Time**: Validating large hierarchical data structures can lead to longer processing times. **Mitigation**: Optimize validation rules and ensure that you are validating only what's necessary. You may consider using the `groups` feature in Symfony to chunk validation into smaller parts.\n\n3. **Database Transactions**: Persisting a complex data structure often involves multiple database operations. **Mitigation**: Group database operations into a single transaction when persisting data or batch processing where applicable, reducing the number of separate database calls.\n\n4. **Form Building Time**: Creating the form object and building it can also take time, especially for large forms. **Mitigation**: Pre-build and cache form objects wherever possible, or consider using a form builder service to optimize form generation.\n\n5. **Memory Usage**: Complex forms with embedded collections can lead to increased memory usage. **Mitigation**: Monitor memory usage and optimize data fetching strategies (e.g., using Doctrine\u2019s lazy loading) to ensure that you're not loading unnecessary data into memory.\n\nBy being aware of these impacts and implementing best practices, you can maintain effective performance while utilizing embedded forms in Symfony.""}]",knowledge/php/symfony-docs-7.1,1.0,train
"[{""from"": ""human"", ""value"": ""What role does the `OptionsResolver` play in Symfony form types?""}, {""from"": ""gpt"", ""value"": ""The `OptionsResolver` in Symfony form types plays a crucial role in configuring the options for a form type. Its primary responsibilities include:\n\n1. **Define Default Options**: It allows you to set default values for various options that can be passed to the form type. This ensures that the form behaves consistently even when no specific options are provided by the user.\n\n2. **Validation**: It enables type and value validation for the options provided to the form type. This means you can define expected types for options (e.g., 'data_class', 'empty_data', etc.) and if the user passes mismatched types, an exception will be raised.\n\n3. **Dynamic Configuration**: You can dynamically configure options based on the context of the form instance. For example, certain fields might be conditionally displayed depending on provided options.\n\n4. **Defaults for Fields**: Allows configuring defaults for individual fields by setting field specific options while still maintaining consistency across instances of that form type.\n\nHere\u2019s an example of using `OptionsResolver` in a form type:\n```php\nuse Symfony\\Component\\OptionsResolver\\OptionsResolver;\n\npublic function configureOptions(OptionsResolver $resolver): void\n{\n    $resolver->setDefaults([\n        'data_class' => Category::class,\n        'csrf_protection' => true,\n    ]);\n\n    $resolver->setAllowedTypes('csrf_protection', 'bool'); // Validate option type\n}\n```\nIn this example, `OptionsResolver` is used to set the default data class and specify that the `csrf_protection` option must be of type boolean. This ensures that the form type will remain valid and functional.""}]",knowledge/php/symfony-docs-7.1,1.0,train
"[{""from"": ""human"", ""value"": ""What is the importance of rendering form fields correctly in a Symfony application?""}, {""from"": ""gpt"", ""value"": ""Rendering form fields correctly in a Symfony application is crucial for several reasons:\n\n1. **User Experience**: Proper rendering ensures that users can easily understand and interact with the form. Clear labels, appropriate input types, and error messages enhance the usability of the application.\n\n2. **Data Integrity**: If forms and fields are not rendered properly, it could lead to incorrect data submissions or failures in validation. For instance, not displaying all necessary fields could result in partial submissions that don't fulfill the expected structure.\n\n3. **Validation Feedback**: Correctly rendered forms can provide immediate feedback to users, such as highlighting errors and providing related messages. This leads to a smoother data entry process and ultimately improves data quality.\n\n4. **Visual Consistency**: Proper rendering maintains a consistent look and feel throughout the application. This is vital for brand integrity and overall acceptance of the application by users.\n\n5. **Dynamic Abilities**: If form fields are rendered by utilizing Symfony's form helpers, it allows developers to easily enhance the functionality of forms, such as adding dynamic field behaviors or conditionally displaying fields based on user inputs.\n\nOverall, proper rendering of form fields contributes directly to the overall effectiveness and success of forms within a Symfony application.""}]",knowledge/php/symfony-docs-7.1,1.0,train
"[{""from"": ""human"", ""value"": ""Can you explain how Symfony's form components can aid in complex object hydration from submitted forms?""}, {""from"": ""gpt"", ""value"": ""Symfony's form components greatly assist in hydrating complex objects from submitted forms through a feature-rich and flexible approach. Here\u2019s how it works:\n\n1. **Mapping Submitted Data**: When a form is submitted, Symfony automatically maps the submitted data to the properties of the form-backed object, allowing for straightforward hydration. This is done through the use of the `data_class` option in the form builder, which links the form to a specific object, such as an entity.\n\n2. **Nested Objects**: Symfony forms can handle nested objects seamlessly. When embedding forms (like a `Category` form within a `Task` form), Symfony ensures that the data for each nested object is correctly populated into the respective instances when the parent form is processed. The use of the `#[Assert\\Valid]` constraint ensures that all nested validations are executed.\n\n3. **Handling Collections**: By utilizing collection types, Symfony allows you to manage multiple instances of objects (e.g., a collection of `Product` entities associated with a `Category`). Symfony can hydrate these collections automatically based on the submitted data, which is especially useful for complex relationships.\n\n4. **Form Structure**: The form structure mirrors the underlying data model, allowing developers to use familiar patterns while working on both sides of the form: the HTML front-end and the underlying data model. \n\n5. **Validation and Error Handling**: Symfony\u2019s form component ensures that data invalidation leads to proper feedback during the hydration process. If any part of the submitted data does not conform to the expected validation rules, errors will be reported back through the form object, improving the robustness of the application's data handling.\n\nIn conclusion, Symfony's form components simplify the object hydration process by providing out-of-the-box features that manage data binding, validation, and structured representation, making it easy to transform user inputs into well-defined object instances.""}]",knowledge/php/symfony-docs-7.1,1.0,train
"[{""from"": ""human"", ""value"": ""What are the benefits of using Symfony's Form Builder interface?""}, {""from"": ""gpt"", ""value"": ""Symfony's Form Builder Interface offers several benefits that enhance the development process for forms:\n\n1. **Fluent API**: The Form Builder provides a fluent interface for constructing forms, allowing developers to chain method calls to configure the form easily. This results in clear and concise code, improving readability.\n\n2. **Flexible Configuration**: It allows for easy configuration of form fields, including types, constraints, and options, in a straightforward manner. Developers can quickly adjust forms to meet requirements without needing extensive configuration.\n\n3. **Custom Field Types**: Developers can create custom field types that are reusable across different forms, promoting DRY (Don\u2019t Repeat Yourself) principles. This encourages modular design, making it easier to manage forms.\n\n4. **Integration with Validation**: The Form Builder integrates seamlessly with Symfony\u2019s validation component, allowing validation constraints to be set directly when defining the form. This ensures data integrity with minimal extra effort.\n\n5. **Support for Nested and Embedded Forms**: The Form Builder interface simplifies the creation of forms with nested or embedded structures, where one form type can contain another. This feature promotes organization and proper management of complex data structures.\n\n6. **Dynamic Form Handling**: It makes handling dynamic forms (e.g., adding/removing fields based on user interaction) more manageable through specific options like `allow_add` and `allow_delete`, enhancing user experience.\n\nIn summary, the Symfony Form Builder Interface provides a powerful yet intuitive way to create and manage forms, saving development time and reducing errors while following best practices.""}]",knowledge/php/symfony-docs-7.1,1.0,train
"[{""from"": ""human"", ""value"": ""How do you customize form templates in Symfony, and why might you want to do this?""}, {""from"": ""gpt"", ""value"": ""Customizing form templates in Symfony is essential for tailoring forms to fit the design and user experience requirements of an application. To customize form templates, you generally follow these steps and practices:\n\n1. **Override Default Templates**: Symfony allows you to override the default form templates by creating your own Twig template files. For instance, you can create a custom template for a specific form type:\n   ```twig\n   {# templates/form/custom_form_theme.html.twig #}\n   {% block widget_container %}\n       <div class=\""custom-container\"">\n           {{ block('widget') }}\n       </div>\n   {% endblock %}\n   ```\n\n2. **Using Custom Themes**: You can define a custom Twig theme that can be applied to specific forms or to all forms across your application. To do this, include the new theme in your Twig configuration:\n   ```twig\n   {# app/Resources/views/base.html.twig #}\n   {% form_theme form 'form/custom_form_theme.html.twig' %}\n   ```\n\n3. **Customizing Individual Fields**: You can also customize specific fields when rendering forms by passing field-specific blocks in your custom templates:\n   ```twig\n   {{ form_row(form.fieldName, {'attr': {'class': 'custom-class'}}) }}\n   ```\n\n4. **Creating Complex Structures**: You can define how multiple fields and their labels group visually, improving the layout of forms and making them more intuitive to users.\n\n5. **Consistency with UI Design**: Custom templates allow you to adhere to your application's unique styling requirements or branding, ensuring that forms integrate well with the overall interface and provide a seamless experience.\n\nIt's worthwhile to customize form templates to improve UX, maintain branding consistency, and ensure that complex forms reflect logical groupings and make data entry more straightforward for users.""}]",knowledge/php/symfony-docs-7.1,1.0,train
"[{""from"": ""human"", ""value"": ""What tips would you give to ensure forms are user-friendly in Symfony?""}, {""from"": ""gpt"", ""value"": ""To ensure forms are user-friendly in Symfony, consider the following tips:\n\n1. **Clear Labels and Placeholders**: Use descriptive labels and placeholders to guide users about what information is required. This helps reduce confusion during form completion.\n\n2. **Grouping Related Fields**: Organize fields that relate to each other in logical groups and use headers to define sections. This makes the form easier to scan and fill out.\n\n3. **Error Handling and Messages**: Implement immediate feedback on validation errors and display relevant error messages next to the fields that have issues. Consider summarizing errors at the top of the form as well.\n\n4. **Progressive Disclosure**: For complex forms, only show fields that are necessary initially. Use JavaScript to reveal additional fields based on user selections.\n\n5. **Consistent Styling**: Ensure that form styling aligns with the rest of your application. Consistency in button styles, font sizes, and colors helps users feel more comfortable.\n\n6. **Accessibility Considerations**: Make your forms accessible by ensuring they are navigable via keyboard, assistive technologies correctly interpret form elements, and use ARIA labels as necessary to make forms compliant with accessibility standards.\n\n7. **Responsive Design**: Make sure forms are responsive and mobile-friendly. Use CSS frameworks like Bootstrap or Tailwind to achieve seamless usability across different devices.\n\n8. **Use of Field Types**: Leverage appropriate field types (e.g., select boxes, checkboxes, radio buttons) to provide better user interactions, ensuring ease of selection.\n\n9. **User Guidance**: Add tooltips or helper text to explain field requirements when necessary, especially for complex data inputs.\n\n10. **Test with Real Users**: Conduct usability testing to identify friction points in the form completion process and iterate based on feedback for continuous improvement.\n\nFollowing these tips can greatly enhance user experience, reduce friction during form completion, and ultimately lead to higher submission rates.""}]",knowledge/php/symfony-docs-7.1,1.0,train
