conversations,source,score,split
"[{""from"": ""human"", ""value"": ""What is the purpose of user impersonation in a web application?""}, {""from"": ""gpt"", ""value"": ""User impersonation allows administrators or developers to switch from one user to another account without logging out and logging in again. This is particularly useful for debugging issues that a user may encounter, as it enables the admin to experience exactly what the user sees within the application.\n\nImpersonation can be beneficial in support situations, where understanding the user's experience is necessary to properly assist them. It provides efficient means to troubleshoot and replicate user-specific scenarios without the cumbersome process of changing user credentials.""}]",knowledge/php/symfony-docs-7.1,1.0,train
"[{""from"": ""human"", ""value"": ""What are the potential security implications of using user impersonation?""}, {""from"": ""gpt"", ""value"": ""Using user impersonation can introduce security risks if not properly controlled. Here are some potential implications:\n\n1. **Unauthorized Access**: If impersonation is not restricted to certain roles, users could gain access to sensitive information or functionalities that should be restricted.\n2. **Role Misuse**: Users impersonating others could misuse the privileges of the impersonated account, leading to data leaks or unauthorized actions.\n3. **Logging Concerns**: Impersonation might complicate audit logs because actions taken by an impersonator will not directly reflect their own identity, potentially making it harder to track malicious activities.\n\nTo mitigate these risks, it's essential to restrict the impersonation feature with proper roles and maintain a detailed logging system to audit user actions.""}]",knowledge/php/symfony-docs-7.1,1.0,train
"[{""from"": ""human"", ""value"": ""How can user impersonation be activated in Symfony security configuration?""}, {""from"": ""gpt"", ""value"": ""User impersonation in Symfony can be activated by enabling the `switch_user` listener in the security configuration. This can be done in several formats:\n\n**YAML Configuration**:\n```yaml\n# config/packages/security.yaml\nsecurity:\n    firewalls:\n        main:\n            switch_user: true\n```  \n**XML Configuration**:\n```xml\n<!-- config/packages/security.xml -->\n<?xml version=\""1.0\"" encoding=\""UTF-8\"" ?>\n<srv:container xmlns=\""http://symfony.com/schema/dic/security\""\n    xmlns:xsi=\""http://www.w3.org/2001/XMLSchema-instance\""\n    xmlns:srv=\""http://symfony.com/schema/dic/services\""\n    xsi:schemaLocation=\""http://symfony.com/schema/dic/services\n        https://symfony.com/schema/dic/services/services-1.0.xsd\n        http://symfony.com/schema/dic/security\n        https://symfony.com/schema/dic/security/security-1.0.xsd\"">\n    <config>\n        <firewall name=\""main\"">\n            <switch-user/>\n        </firewall>\n    </config>\n</srv:container>\n```\n**PHP Configuration**:\n```php\n// config/packages/security.php\nuse Symfony\\Config\\SecurityConfig;\nreturn static function (SecurityConfig $security): void {\n    $security->firewall('main')->switchUser();\n};\n```  \nEnabling this listener allows you to specify a user to impersonate by passing a specific query string parameter or through custom HTTP headers.""}]",knowledge/php/symfony-docs-7.1,1.0,train
"[{""from"": ""human"", ""value"": ""What query string should be added to the URL to switch to another user?""}, {""from"": ""gpt"", ""value"": ""To switch to another user, you would add the `_switch_user` query string to the current URL alongside the username of the user you wish to impersonate. For example:\n\n```text\nhttp://example.com/somewhere?_switch_user=thomas\n```\nThis instructs the application to switch the context to user 'thomas'. Furthermore, Symfony allows you to utilize the Twig function `impersonation_path('thomas')` as a more elegant way to generate this path dynamically.""}]",knowledge/php/symfony-docs-7.1,1.0,train
"[{""from"": ""human"", ""value"": ""How can a developer specify a custom HTTP header for user impersonation?""}, {""from"": ""gpt"", ""value"": ""To specify a custom HTTP header for user impersonation, you can modify the `switch_user` listener configuration to accept a custom parameter.\n\nFor instance, to use the `X-Switch-User` header instead of a query string, you would configure it as follows:\n\n**YAML Configuration**:\n```yaml\n# config/packages/security.yaml\nsecurity:\n    firewalls:\n        main:\n            switch_user: { parameter: X-Switch-User }\n```\n**XML Configuration**:\n```xml\n<!-- config/packages/security.xml -->\n<?xml version=\""1.0\"" encoding=\""UTF-8\"" ?>\n<srv:container xmlns=\""http://symfony.com/schema/dic/security\""\n    xmlns:xsi=\""http://www.w3.org/2001/XMLSchema-instance\""\n    xmlns:srv=\""http://symfony.com/schema/dic/services\""\n    xsi:schemaLocation=\""http://symfony.com/schema/dic/services\n        https://symfony.com/schema/dic/services/services-1.0.xsd\n        http://symfony.com/schema/dic/security\n        https://symfony.com/schema/dic/security/security-1.0.xsd\"">\n    <config>\n        <firewall name=\""main\"">\n            <switch-user parameter=\""X-Switch-User\""/>\n        </firewall>\n    </config>\n</srv:container>\n```\n**PHP Configuration**:\n```php\n// config/packages/security.php\nuse Symfony\\Config\\SecurityConfig;\nreturn static function (SecurityConfig $security): void {\n    $security->firewall('main')->switchUser()->parameter('X-Switch-User');\n};\n```\nWith this configuration, you can then set the header in your HTTP request to switch users accordingly.""}]",knowledge/php/symfony-docs-7.1,1.0,train
"[{""from"": ""human"", ""value"": ""What role is required to use the impersonation feature?""}, {""from"": ""gpt"", ""value"": ""To use the impersonation feature in Symfony, users must have the special role `ROLE_ALLOWED_TO_SWITCH`. This role ensures that only authorized users can switch between accounts. \n\nBy utilizing role hierarchies, you can assign this role to users who need it, allowing for fine-grained access control over who can use the impersonation functionality. This is important to maintain security and prevent unauthorized access.""}]",knowledge/php/symfony-docs-7.1,1.0,train
"[{""from"": ""human"", ""value"": ""How do you check if impersonation is active during a session?""}, {""from"": ""gpt"", ""value"": ""You can check if user impersonation is active in a session by utilizing the special attribute `IS_IMPERSONATOR`. This attribute can be checked using Symfony's authorization methods to conditionally render elements in your templates. \n\nFor example, if you want to display a link allowing users to exit impersonation, you could use the following Twig syntax:\n```twig\n{% if is_granted('IS_IMPERSONATOR') %}\n    <a href=\""{{ impersonation_exit_path(path('homepage')) }}\"">Exit impersonation</a>\n{% endif %}\n```  \nThis will only render the link if impersonation is currently active for the user.""}]",knowledge/php/symfony-docs-7.1,1.0,train
"[{""from"": ""human"", ""value"": ""How can you find the object representing the user who originally logged in when impersonation is active?""}, {""from"": ""gpt"", ""value"": ""When a user is impersonated, the token stored in the token storage is an instance of `SwitchUserToken`. You can use this instance to access the original token, which provides the user object of the impersonator. Here\u2019s a code snippet demonstrating how to achieve this:\n\n```php\n// src/Service/SomeService.php\nnamespace App\\Service;\n\nuse Symfony\\Bundle\\SecurityBundle\\Security;\nuse Symfony\\Component\\Security\\Core\\Authentication\\Token\\SwitchUserToken;\n\nclass SomeService\n{\n    public function __construct(private Security $security) {}\n\n    public function someMethod(): void\n    {\n        $token = $this->security->getToken();\n        if ($token instanceof SwitchUserToken) {\n            $impersonatorUser = $token->getOriginalToken()->getUser();\n            // Use the $impersonatorUser as needed\n        }\n    }\n}\n```  \nIn this example, the `someMethod()` checks if the current token is a `SwitchUserToken` and retrieves the original user from the original token.""}]",knowledge/php/symfony-docs-7.1,1.0,train
"[{""from"": ""human"", ""value"": ""How can you control the ability to switch users in Symfony?""}, {""from"": ""gpt"", ""value"": ""The ability to switch users can be controlled using a custom security voter. First, you configure the `switch_user` listener to check against a new attribute or role (not prefixed with `ROLE_`) that your voter will respond to. For example:\n\n**YAML Configuration**:\n```yaml\n# config/packages/security.yaml\nsecurity:\n    firewalls:\n        main:\n            switch_user: { role: CAN_SWITCH_USER }\n```\nThen, create a voter class that implements logic to determine who can switch users based on your specified criteria:\n\n```php\n// src/Security/Voter/SwitchToCustomerVoter.php\nnamespace App\\Security\\Voter;\n\nuse Symfony\\Bundle\\SecurityBundle\\Security;\nuse Symfony\\Component\\Security\\Core\\Authentication\\Token\\TokenInterface;\nuse Symfony\\Component\\Security\\Core\\Authorization\\Voter\\Voter;\nuse Symfony\\Component\\Security\\Core\\User\\UserInterface;\n\nclass SwitchToCustomerVoter extends Voter\n{\n    public function __construct(private Security $security) {}\n\n    protected function supports($attribute, $subject): bool\n    {\n        return in_array($attribute, ['CAN_SWITCH_USER']) && $subject instanceof UserInterface;\n    }\n\n    protected function voteOnAttribute($attribute, $subject, TokenInterface $token): bool\n    {\n        $user = $token->getUser();\n        if (!$user instanceof UserInterface || !$subject instanceof UserInterface) {\n            return false;\n        }\n        // Additional checks can be performed here\n        return $this->security->isGranted('ROLE_ALLOWED_TO_SWITCH') || $this->security->isGranted('ROLE_TECH_SUPPORT');\n    }\n}\n```  \nThis sets up a flexible mechanism for determining if the user has permissions to switch, allowing for a robust security model.""}]",knowledge/php/symfony-docs-7.1,1.0,train
"[{""from"": ""human"", ""value"": ""How can events be utilized in user impersonation in Symfony?""}, {""from"": ""gpt"", ""value"": ""In Symfony, the `security.switch_user` event is dispatched right before user impersonation is fully executed and also just before exiting impersonation. This enables you to hook into these moments using event listeners or subscribers.\n\nHere's a basic implementation of an event subscriber to manage locale changes when switching users:\n\n```php\n// src/EventListener/SwitchUserSubscriber.php\nnamespace App\\EventListener;\n\nuse Symfony\\Component\\EventDispatcher\\EventSubscriberInterface;\nuse Symfony\\Component\\Security\\Http\\Event\\SwitchUserEvent;\nuse Symfony\\Component\\Security\\Http\\SecurityEvents;\n\nclass SwitchUserSubscriber implements EventSubscriberInterface\n{\n    public function onSwitchUser(SwitchUserEvent $event): void\n    {\n        $request = $event->getRequest();\n        if ($request->hasSession() && ($session = $request->getSession())) {\n            $session->set('_locale', $event->getTargetUser()->getLocale());\n        }\n    }\n\n    public static function getSubscribedEvents(): array\n    {\n        return [SecurityEvents::SWITCH_USER => 'onSwitchUser'];\n    }\n}\n```  \nThis subscriber listens for the switch user event and updates the session's locale based on the target user's locale, ensuring the application context remains appropriate for the impersonated user.""}]",knowledge/php/symfony-docs-7.1,1.0,train
"[{""from"": ""human"", ""value"": ""What happens if a user needs to switch back to their original account?""}, {""from"": ""gpt"", ""value"": ""To switch back to the original account, you can use the special `_exit` username. This can be done by adding the following query string to the current URL:\n\n```text\nhttp://example.com/somewhere?_switch_user=_exit\n```\nThis action will return the session back to the user that was originally logged in before the impersonation occurred. Similarly, you can leverage the Twig function `impersonation_exit_path('/somewhere')` to dynamically create the exit path.""}]",knowledge/php/symfony-docs-7.1,1.0,train
"[{""from"": ""human"", ""value"": ""What is the significance of the `switch_user` listener in Symfony security?""}, {""from"": ""gpt"", ""value"": ""The `switch_user` listener in Symfony security configuration is significantly important because it facilitates the functionality of impersonating a user. It allows system administrators or support personnel to assume the identity of other users without the need for their credentials. The listener manages this process by intercepting requests, determining if user switching is permitted, and applying the appropriate roles and parameters.\n\nThis feature is valuable in a variety of situations, including debugging, understanding user issues, and managing accounts efficiently while ensuring security protocols are upheld. By properly configuring this listener, you can maintain control over who can impersonate whom based on roles defined in your application.""}]",knowledge/php/symfony-docs-7.1,1.0,train
"[{""from"": ""human"", ""value"": ""How can specific routes be defined for redirection after switching users?""}, {""from"": ""gpt"", ""value"": ""You can specify redirection routes after switching users by using the `target_route` parameter in the `switch_user` configuration. This feature is applicable only in a stateful firewall. \n\n**YAML Configuration**:\n```yaml\n# config/packages/security.yaml\nsecurity:\n    firewalls:\n        main:\n            switch_user: { target_route: app_user_dashboard }\n```\n**XML Configuration**:\n```xml\n<!-- config/packages/security.xml -->\n<?xml version=\""1.0\"" encoding=\""UTF-8\"" ?>\n<srv:container xmlns=\""http://symfony.com/schema/dic/security\""\n    xmlns:xsi=\""http://www.w3.org/2001/XMLSchema-instance\""\n    xmlns:srv=\""http://symfony.com/schema/dic/services\""\n    xsi:schemaLocation=\""http://symfony.com/schema/dic/services\n        https://symfony.com/schema/dic/services/services-1.0.xsd\n        http://symfony.com/schema/dic/security\n        https://symfony.com/schema/dic/security/security-1.0.xsd\"">\n    <config>\n        <firewall name=\""main\"">\n            <switch-user target-route=\""app_user_dashboard\""/>\n        </firewall>\n    </config>\n</srv:container>\n```\n**PHP Configuration**:\n```php\n// config/packages/security.php\nuse Symfony\\Config\\SecurityConfig;\nreturn static function (SecurityConfig $security): void {\n    $security->firewall('main')->switchUser()->targetRoute('app_user_dashboard');\n};\n```  \nOnce set, after successfully impersonating a user, the application will redirect to the specified target route. This aids in creating a seamless experience for users following authentication transitions.""}]",knowledge/php/symfony-docs-7.1,1.0,train
"[{""from"": ""human"", ""value"": ""Can access to user switching be limited using a custom voter?""}, {""from"": ""gpt"", ""value"": ""Yes, access to user switching can be limited using a custom voter in Symfony. By establishing specific roles or attributes that must be satisfied before allowing a user to switch identities, you can create a tailored security policy. The following steps achieve this:\n1. **Configure the `switch_user` Listener**: In your security configuration, add a role or custom attribute that your voter will respond to, such as `CAN_SWITCH_USER`.\n\n   **YAML Configuration**:\n   ```yaml\n   # config/packages/security.yaml\n   security:\n       firewalls:\n           main:\n               switch_user: { role: CAN_SWITCH_USER }\n   ```\n\n2. **Implement a Voter Class**: Create a custom voter class that includes the logic you desire.\n\n   ```php\n   // src/Security/Voter/SwitchToCustomerVoter.php\n   namespace App\\Security\\Voter;\n\n   use Symfony\\Bundle\\SecurityBundle\\Security;\n   use Symfony\\Component\\Security\\Core\\Authentication\\Token\\TokenInterface;\n   use Symfony\\Component\\Security\\Core\\Authorization\\Voter\\Voter;\n   use Symfony\\Component\\Security\\Core\\User\\UserInterface;\n\n   class SwitchToCustomerVoter extends Voter\n   {\n       public function __construct(private Security $security) {}\n\n       protected function supports($attribute, $subject): bool\n       {\n           return in_array($attribute, ['CAN_SWITCH_USER']) && $subject instanceof UserInterface;\n       }\n\n       protected function voteOnAttribute($attribute, $subject, TokenInterface $token): bool\n       {\n           $user = $token->getUser();\n           // Custom logic here to determine access\n           return $this->security->isGranted('ROLE_ALLOWED_TO_SWITCH') || $this->security->isGranted('ROLE_TECH_SUPPORT');\n       }\n   }\n   ```\n\nWith this setup, the voter will control whether or not a user can perform impersonation, allowing for comprehensive access management in your Symfony application.""}]",knowledge/php/symfony-docs-7.1,1.0,train
"[{""from"": ""human"", ""value"": ""What types of configurations can be provided for the `switch_user` feature?""}, {""from"": ""gpt"", ""value"": ""The `switch_user` feature in Symfony can be configured in various ways to tailor its functionality to meet application needs. Here are some key configurable options:\n\n1. **Role Restriction**: Specify which role(s) are allowed to switch users.\n   ```yaml\n   switch_user: { role: ROLE_ALLOWED_TO_SWITCH }\n   ```\n\n2. **Parameter Name**: Change the default query parameter name that is used to switch users (e.g., `_switch_user`).\n   ```yaml\n   switch_user: { parameter: _want_to_be_this_user }\n   ```\n\n3. **Custom HTTP Header**: Instead of using a query parameter, you can pass the username in a custom HTTP header.\n   ```yaml\n   switch_user: { parameter: X-Switch-User }\n   ```\n\n4. **Target Route**: Define where to redirect users after they switch.\n   ```yaml\n   switch_user: { target_route: app_user_dashboard }\n   ```\n\n5. **Limiting Actions**: Use a custom voter to dictate whether users can impersonate others based on more complex criteria.\n\nBy configuring these options, developers can control the flow of impersonation in their applications effectively while adhering to security best practices.""}]",knowledge/php/symfony-docs-7.1,1.0,train
"[{""from"": ""human"", ""value"": ""Can you provide a complete example of Symfony configuration for user impersonation including various options?""}, {""from"": ""gpt"", ""value"": ""Certainly! Here's a complete example of Symfony security configuration that includes multiple options for user impersonation:\n\n```yaml\n# config/packages/security.yaml\nsecurity:\n    role_hierarchy:\n        ROLE_ADMIN: [ROLE_ALLOWED_TO_SWITCH]\n\n    firewalls:\n        main:\n            anonymous: true\n            switch_user:\n                role: ROLE_ALLOWED_TO_SWITCH\n                parameter: X-Switch-User\n                target_route: app_user_dashboard\n\n    access_control:\n        - { path: ^/some_protected_area, roles: ROLE_ADMIN }\n```\n\nIn this configuration:\n- Users have access to the impersonation feature if they have the `ROLE_ALLOWED_TO_SWITCH` role.\n- Instead of using a query string, the example utilizes a custom header `X-Switch-User` to indicate which user to switch to.\n- After switching, users are redirected to the `app_user_dashboard` route.\n- Access control is set up to restrict certain paths based on user roles.\n\nThis configuration allows for a secure and flexible impersonation system within your Symfony application.""}]",knowledge/php/symfony-docs-7.1,1.0,train
