conversations,source,score,split
"[{""from"": ""human"", ""value"": ""What is the current way to access services within a Symfony form?""}, {""from"": ""gpt"", ""value"": ""As of current Symfony versions, form classes are treated as services by default. This means that you can directly inject other services into your form classes using the service autowiring feature. This built-in functionality simplifies managing dependencies and enhances code organization.""}]",knowledge/php/symfony-docs-7.1,1.0,train
"[{""from"": ""human"", ""value"": ""What is service autowiring in Symfony?""}, {""from"": ""gpt"", ""value"": ""Service autowiring in Symfony is a feature that allows the automatic resolution of dependencies for services in the service container. When you type-hint a class in a service's constructor, Symfony automatically looks for an instance of that class in the service container and injects it. This reduces boilerplate code and simplifies the process of managing service dependencies.""}]",knowledge/php/symfony-docs-7.1,1.0,train
"[{""from"": ""human"", ""value"": ""Can you provide an example of injecting a service into a Symfony form?""}, {""from"": ""gpt"", ""value"": ""Certainly! Here is an example demonstrating how to inject the database service into a custom form type in Symfony:\n\n```php\n// src/Form/CustomFormType.php\nnamespace App\\Form;\n\nuse App\\Entity\\YourEntity;\nuse Doctrine\\ORM\\EntityManagerInterface;\nuse Symfony\\Component\\Form\\AbstractType;\nuse Symfony\\Component\\Form\\FormBuilderInterface;\nuse Symfony\\Component\\OptionsResolver\\OptionsResolver;\n\nclass CustomFormType extends AbstractType\n{\n    private EntityManagerInterface $entityManager;\n\n    // Constructor injection\n    public function __construct(EntityManagerInterface $entityManager)\n    {\n        $this->entityManager = $entityManager;\n    }\n\n    public function buildForm(FormBuilderInterface $builder, array $options)\n    {\n        // Here you can use $this->entityManager as needed\n        $builder->add('fieldName'); // Example form field\n    }\n\n    public function configureOptions(OptionsResolver $resolver)\n    {\n        $resolver->setDefaults([\n            'data_class' => YourEntity::class,\n        ]);\n    }\n}\n```\n\nIn this example, the `CustomFormType` class injects the `EntityManagerInterface` through its constructor. This allows the form to access database services and perform necessary operations.""}]",knowledge/php/symfony-docs-7.1,1.0,train
"[{""from"": ""human"", ""value"": ""What are the advantages of using form services in Symfony?""}, {""from"": ""gpt"", ""value"": ""The advantages of using form services in Symfony include:\n1. **Dependency Injection**: Form types can easily access other services, such as entity managers or custom services, improving the organization and modularization of code.\n2. **Reusability**: Form types as services can be reused across different controllers or services, promoting DRY (Don't Repeat Yourself) principles.\n3. **Configuration Flexibility**: You can configure form types easily through service configuration in YAML or annotations, allowing for quick adjustments without modifying the form classes directly.\n4. **Testability**: Having forms as services makes them easier to test since dependencies can be mocked or replaced.""}]",knowledge/php/symfony-docs-7.1,1.0,train
"[{""from"": ""human"", ""value"": ""What is the significance of the article on custom form types in Symfony?""}, {""from"": ""gpt"", ""value"": ""The article on creating custom form types in Symfony is crucial for understanding how to extend the default form functionality provided by Symfony. It explains:\n1. **Injection of Services**: How to inject various services into form types to utilize more complex business logic or database interactions.\n2. **Configuration Options**: Details on available configuration options for custom form types, enabling developers to pass necessary parameters and settings to their forms.\n3. **Best Practices**: Guidelines on how to maintain clean and manageable code when dealing with forms, encouraging developers to adopt consistent patterns in their applications.""}]",knowledge/php/symfony-docs-7.1,1.0,train
"[{""from"": ""human"", ""value"": ""How has Symfony changed the way forms are handled with the introduction of service autowiring?""}, {""from"": ""gpt"", ""value"": ""With the introduction of service autowiring in Symfony, handling forms has become more streamlined and efficient:\n1. **Automatic Dependency Resolution**: Developers no longer need to manually define and configure dependencies, as Symfony will automatically resolve services based on type-hints in form constructors.\n2. **Enhanced Readability**: Code readability is improved as the constructor signatures directly show which services are required, making it clear what dependencies a form type relies on.\n3. **Less Boilerplate Code**: This change reduces the amount of boilerplate code required to set up forms, allowing developers to focus on implementing the form logic itself rather than managing dependencies.\nOverall, service autowiring simplifies the development process and leads to cleaner code architecture.""}]",knowledge/php/symfony-docs-7.1,1.0,train
"[{""from"": ""human"", ""value"": ""What is the role of the service container regarding forms in Symfony?""}, {""from"": ""gpt"", ""value"": ""In Symfony, the service container is a central part of the Dependency Injection framework. For forms, the role of the service container includes:\n1. **Managing Services**: It holds all the services (including form types) and their corresponding configurations, making it easy to retrieve and manage them throughout the application.\n2. **Dependency Injection**: The container facilitates the automatic injection of dependencies into form types when they are instantiated, ensuring that necessary services are available without cumbersome manual setup.\n3. **Configuration Management**: It allows developers to define custom configurations for form types, defining how they should behave and which dependencies they need.\nBy utilizing the service container, Symfony improves the lifecycle management of forms, ensuring they are instantiated with the correct dependencies and configurations.""}]",knowledge/php/symfony-docs-7.1,1.0,train
"[{""from"": ""human"", ""value"": ""What would you find in the configuration options for form types?""}, {""from"": ""gpt"", ""value"": ""In the configuration options for form types in Symfony, you can typically find:\n1. **Data Class**: Specifies the class that the form should be bound to, allowing for automatic data transformation.\n2. **Validation Groups**: Defines which validation rules should apply to the form when it is submitted.\n3. **Custom Options**: You can define custom options for the form to enable specialized behavior or integration with your application logic.\n4. **Row Options**: Allows passing specific options for the form rows, such as CSS classes or attributes for rendering.\n5. **Empty Data**: Specifies what value should be returned when the form is submitted empty.\nThese options enable developers to customize forms flexibly and ensure that they meet the application's needs.""}]",knowledge/php/symfony-docs-7.1,1.0,train
"[{""from"": ""human"", ""value"": ""Why might an article about form services become obsolete over time?""}, {""from"": ""gpt"", ""value"": ""An article about form services in Symfony might become obsolete over time due to:\n1. **Framework Updates**: Symfony regularly releases updates that can change how features are implemented or introduce new best practices.\n2. **Deprecation of Features**: Older methods of handling forms may be deprecated or replaced with more efficient ways, making older articles less applicable.\n3. **Evolving Best Practices**: As the community learns and grows, the best practices around form handling might evolve, making previous information outdated or incorrect.\n4. **Documentation Changes**: Official documentation might be updated to reflect new features or improvements, leading to the obsolescence of previously relevant articles.\nMaintaining up-to-date resources is essential for developers to ensure they are following the most current and effective practices.""}]",knowledge/php/symfony-docs-7.1,1.0,train
