conversations,source,score,split
"[{""from"": ""human"", ""value"": ""What is included in the reference documents?""}, {""from"": ""gpt"", ""value"": ""The reference documents include additional materials related to the main document, specifically loading or referencing a file named 'map.rst.inc'. This suggests that the documents may contain supplementary information, diagrams, or mapping details that are pertinent to the understanding of the main subject matter.""}]",knowledge/php/symfony-docs-7.1,1.0,train
"[{""from"": ""human"", ""value"": ""How can the inclusion directive in reStructuredText be utilized?""}, {""from"": ""gpt"", ""value"": ""The inclusion directive in reStructuredText (reST) allows you to embed the contents of another file directly into your reST document. This is useful for maintaining modular documentation where multiple files can be included in a single document without duplicating content. The directive is written as follows:\n\n```\n.. include:: /path/to/file.rst\n```\n\nIn your case, the directive `.. include:: /reference/map.rst.inc` indicates that the content of 'map.rst.inc' located in the 'reference' directory will be included in the final rendered output. This practice helps in organizing documentation while ensuring that changes in included files are reflected automatically in the document where they are referenced.""}]",knowledge/php/symfony-docs-7.1,1.0,train
"[{""from"": ""human"", ""value"": ""What are some best practices for managing reference documents in technical writing?""}, {""from"": ""gpt"", ""value"": ""Managing reference documents in technical writing involves several best practices:\n\n1. **Modularity**: Break down large documents into smaller, manageable sections or files. This allows for more straightforward updates and easier navigation.\n\n2. **Consistent Naming Conventions**: Use clear and consistent naming conventions for your files so that it is easy to identify their contents and purpose.\n\n3. **Version Control**: Implement version control to track changes in your reference documents. This enables collaboration and maintains a history of modifications.\n\n4. **Regular Updates**: Establish a routine for reviewing and updating your reference materials to ensure they remain accurate and relevant to the main document.\n\n5. **Documentation Structure**: Use a coherent structure for reference documents that mirrors the main document\u2019s organization. This allows readers to easily follow and understand the additional materials provided.\n\n6. **Cross-referencing**: Include links or references to related documents or sections to enhance the usability of the documents.\n\n7. **Clear Indication of Sources**: If reference documents include data or quotes from other sources, clearly indicate these original sources to maintain credibility and allow readers to follow up on the material.""}]",knowledge/php/symfony-docs-7.1,1.0,train
"[{""from"": ""human"", ""value"": ""What is reStructuredText and what are its typical uses?""}, {""from"": ""gpt"", ""value"": ""reStructuredText (reST) is a lightweight markup language that is primarily used for writing technical documentation. Some of its typical uses include:\n\n1. **Documentation Generation**: It is commonly used to generate documentation in several formats, such as HTML and PDF, particularly in Python projects via tools like Sphinx.\n\n2. **Readability**: The syntax is designed to be easily readable even in its raw form, making it a good choice for collaborative documentation processes.\n\n3. **Structured Content**: reST allows for structured content, including sections, subsections, lists, tables, and figures, providing a framework for organizing complex documents.\n\n4. **Cross-referencing**: It provides built-in features for cross-referencing other documents, sections, or even code components, facilitating navigation within extensive documentation.\n\n5. **Integration with Code**: Developers often use reST to write documentation that accompanies source code, ensuring that both code and documentation evolve simultaneously.\n\nOverall, reStructuredText is valued for its simplicity and flexibility in creating high-quality documentation.""}]",knowledge/php/symfony-docs-7.1,1.0,train
"[{""from"": ""human"", ""value"": ""What is the role of the 'map.rst.inc' file in the context of this document?""}, {""from"": ""gpt"", ""value"": ""The 'map.rst.inc' file, referenced in the document, serves as an included reference material that likely contains additional information, diagrams, or structured content that supports or complements the main document. The purpose of including 'map.rst.inc' through the `.. include::` directive is to enhance the context and understanding of the main topics being discussed. By separating supplementary content into this file, it allows for easier updates and management of information that may need to change without altering the main document's structure.""}]",knowledge/php/symfony-docs-7.1,1.0,train
"[{""from"": ""human"", ""value"": ""How does modular documentation benefit technical writing?""}, {""from"": ""gpt"", ""value"": ""Modular documentation offers several benefits in technical writing:\n\n1. **Easier Updates**: By having documentation broken down into smaller modules or files, you can update specific sections without having to rewrite or reformat the entire document. This is particularly useful in agile environments where information can frequently change.\n\n2. **Improved Collaboration**: Multiple authors can work on different parts of the documentation simultaneously without causing conflicts, making collaboration more efficient.\n\n3. **Enhanced Organization**: Modular documentation allows for a better-organized structure, where related topics can be grouped together, aiding readers in navigating through the material more intuitively.\n\n4. **Reusability**: Components of modular documentation can often be reused in different contexts or projects, saving time and effort in content creation.\n\n5. **Simplified Navigation**: Readers can easily navigate to specific sections of interest rather than wading through a large document. This can greatly improve the user experience.\n\n6. **Focused Writing**: Writers can concentrate on one aspect of the content without the distraction of surrounding information, leading to clearer and more concise writing.""}]",knowledge/php/symfony-docs-7.1,1.0,train
"[{""from"": ""human"", ""value"": ""What tools can be used to render reStructuredText documents?""}, {""from"": ""gpt"", ""value"": ""Several tools can render reStructuredText documents into various formats:\n\n1. **Sphinx**: A popular documentation generator often used for Python projects, Sphinx can convert reST documents to HTML, PDF, and other formats, taking advantage of extensions for added functionality.\n\n2. **Docutils**: It is the core library that provides the tools to parse and transform reStructuredText into different output formats such as HTML, XML, and LaTeX.\n\n3. **rst2html**: This is a script provided by Docutils to directly convert reST files to HTML format, making it a simple option for web documentation.\n\n4. **rst2pdf**: Another script that converts reStructuredText to PDF, allowing users to obtain printable documentation easily.\n\n5. **Pandoc**: A universal document converter that can convert reST to other markup formats, making it versatile for users who need to switch between document types.\n\nBy using these tools, developers and writers can effectively generate structured documentation in the required formats while leveraging the ease of writing in reStructuredText.""}]",knowledge/php/symfony-docs-7.1,1.0,train
"[{""from"": ""human"", ""value"": ""What highlights the importance of including a file like 'map.rst.inc'?""}, {""from"": ""gpt"", ""value"": ""Including a file like 'map.rst.inc' is important for several reasons:\n\n1. **Clarity**: It helps provide additional context or information that may not fit well within the main document's flow, clarifying complex subjects.\n\n2. **Segmentation**: By keeping related yet distinct information in separate files, the documentation remains cleaner and allows for targeted information retrieval.\n\n3. **Consistency**: Any updates made in the 'map.rst.inc' file will automatically reflect in all documents that include it, maintaining consistency across the documentation set.\n\n4. **Maintenance**: Modular inclusion of reference files simplifies maintenance, as changes only need to be made in one place rather than in multiple documents.\n\n5. **Dynamic Updates**: If a reference file is continually evolving (for instance, maps or API references), including it ensures that all referencing documents remain up to date without additional effort.\n\nThese factors highlight the strategic importance of using the inclusion directive effectively in documentation.""}]",knowledge/php/symfony-docs-7.1,1.0,train
"[{""from"": ""human"", ""value"": ""What should be considered when creating an '.inc' file for inclusion?""}, {""from"": ""gpt"", ""value"": ""When creating an '.inc' file for inclusion in a reStructuredText document, consider the following:\n\n1. **Content Clarity**: Ensure the content is clear and directly relevant to enhance understanding when included. Avoid overloading the file with unnecessary information.\n\n2. **Formatting**: Maintain consistent formatting with the main document to ensure that the included content blends seamlessly when rendered. Use similar styles and headers to retain a cohesive look.\n\n3. **Scope**: Keep the scope of the included file focused and relevant. It should complement the main document without diverging too much into other topics, which could confuse the reader.\n\n4. **Dependencies**: Be aware of any dependencies or references within the include file. If it relies on definitions or contexts established in the main document, make those clear.\n\n5. **Update Considerations**: Choose a naming convention and organizational strategy that allows for easy updates. As the content evolves, it's essential to manage revisions effectively.\n\n6. **Accessibility**: Ensure that the included file is accessible and properly referenced in the main document so that readers can easily locate it.\n\nBy considering these factors, the usefulness and clarity of the included file can be maximized.""}]",knowledge/php/symfony-docs-7.1,1.0,train
"[{""from"": ""human"", ""value"": ""How does the use of the '.inc' extension signify its purpose?""}, {""from"": ""gpt"", ""value"": ""The use of the '.inc' extension typically signifies that the file is intended to be included or imported into another document or module, rather than being a standalone document. This convention indicates that:\n\n1. **Supplementary Content**: The file contains supplementary content that enriches or provides additional context to another file.\n\n2. **Not Standalone**: Its primary purpose is to be included in other documents, implying it can't be viewed in isolation as a complete document.\n\n3. **Special Usage**: It connotes that the file may contain reusable code snippets, configurations, or similar content that should be treated as an extension of the main writing.\n\nThis helps both authors and readers understand the role of the file in a larger documentation structure, promoting better organization.""}]",knowledge/php/symfony-docs-7.1,1.0,train
"[{""from"": ""human"", ""value"": ""What potential challenges arise from including external files in documentation?""}, {""from"": ""gpt"", ""value"": ""Including external files in documentation can lead to several challenges such as:\n\n1. **Version Mismatch**: If the included files aren't properly version-controlled or updated when the main document changes, this could result in inconsistencies between the files.\n\n2. **File Path Issues**: Incorrect file paths could lead to inclusion errors, preventing the content from rendering correctly.\n\n3. **Dependency Confusion**: Readers might face difficulties understanding dependencies if the content in the included file references items in the main document that are not immediately connected.\n\n4. **Overload of Information**: Including too many external files can lead to information overload for readers, diluting the key points of the main document.\n\n5. **Complexity in Maintenance**: Managing multiple files can complicate the review and update processes, especially if files are frequently revised or require synchronization.\n\nBy being aware of these challenges, writers can take steps to mitigate them, ensuring that the inclusion of external files enhances rather than hinders the clarity and effectiveness of the documentation.""}]",knowledge/php/symfony-docs-7.1,1.0,train
"[{""from"": ""human"", ""value"": ""Can you explain how to structure a reStructuredText document?""}, {""from"": ""gpt"", ""value"": ""Structuring a reStructuredText document typically follows this hierarchy:\n\n1. **Document Title**: Start with the title of the document, which should be clear and descriptive. Use a line of equal signs or hyphens beneath it.\n   \n   ```\n   Document Title\n   ===============\n   ```\n\n2. **Sections and Subsections**: Organize the content using headings, typically marked with '=', '-', or '~' for different heading levels. For example:\n   \n   ```\n   Section Title\n   ================\n   \n   Subsection Title\n   ------------------\n   ```\n\n3. **Paragraphs**: Separate paragraphs with blank lines, making sure they are clear and focused.\n\n4. **Lists**: Use bullet points or numbered lists for clarity. Lists start with asterisk, plus, or hyphen for unordered lists, and numbers for ordered lists.\n   \n   ```\n   - Item 1\n   - Item 2\n   ```\n\n5. **Code Blocks**: For any code snippets, use the `::` notation on a line before the code block to indicate that what follows is a code example:\n   \n   ```\n   Here is an example:\n\n   ::\n   \n       print('Hello, World!')\n   ```\n\n6. **Figures and Images**: Include images and figures with appropriate directives, e.g., `.. image:: image_path`.\n\n7. **References**: Use the built-in cross-referencing capability to link to other sections or documents by using `:ref:` or similar markup.\n\nBy adhering to this structure, you ensure your reStructuredText documents are well-organized, readable, and maintainable.""}]",knowledge/php/symfony-docs-7.1,1.0,train
"[{""from"": ""human"", ""value"": ""What is the significance of the document formatting in reStructuredText?""}, {""from"": ""gpt"", ""value"": ""The significance of document formatting in reStructuredText lies in:\n\n1. **Clarity and Readability**: Proper formatting ensures that the content is easy to read and understand, which is crucial for effective communication, especially in technical documentation.\n\n2. **Structured Hierarchy**: Formatting establishes a clear hierarchy, which allows readers to navigate through sections and subsections logically and intuitively.\n\n3. **Output Quality**: Correct use of formatting helps achieve high-quality output in the generated formats, whether it be HTML, PDF, or others. It influences how the final document appears.\n\n4. **Semantic Meaning**: Different formatting elements (like headings, lists, and code blocks) provide semantic meaning to the content, enhancing comprehension and context for the reader.\n\n5. **Cross-referencing and Linking**: Properly structured formats enable efficient cross-referencing, making it easier to refer to related content and improve the overall user experience in navigating documentation.\n\n6. **Maintenance Ease**: Adhering to clear formatting conventions simplifies maintenance and updates because it enables better organization and understanding of file structure.\n\nIn summary, the document formatting in reStructuredText plays a crucial role in facilitating effective communication, ensuring document quality, and supporting document maintenance.""}]",knowledge/php/symfony-docs-7.1,1.0,train
"[{""from"": ""human"", ""value"": ""How can one effectively manage multiple reference documents in a project?""}, {""from"": ""gpt"", ""value"": ""To effectively manage multiple reference documents in a project, consider the following strategies:\n\n1. **Centralized Repository**: Use a centralized repository (like Git) to manage all reference documents, ensuring version control and easy access for all team members.\n\n2. **Clear Organization**: Arrange documents in a systematic folder structure based on topics, maintaining clarity on where to find specific documents.\n\n3. **Consistent Naming Conventions**: Implement consistent naming conventions across all documents to facilitate easy identification and retrieval.\n\n4. **Regular Reviews**: Schedule regular reviews of reference documents to ensure they remain accurate and up to date. This can avoid confusion over outdated information.\n\n5. **Collaboration Tools**: Utilize collaboration tools for teams to discuss and manage references, ensuring that everyone is aligned on changes and updates.\n\n6. **Documentation Style Guide**: Maintain a style guide for writing and formatting reference documents to ensure consistency in presentation and language.\n\n7. **Periodic Training**: Provide teams with training on effective documentation practices, helping to reinforce the importance of well-managed reference materials.\n\nBy implementing these strategies, organizations can maintain organized, accessible, and up-to-date reference documentation that supports effective project communications.""}]",knowledge/php/symfony-docs-7.1,1.0,train
"[{""from"": ""human"", ""value"": ""What tools can help in the automation of reference document management?""}, {""from"": ""gpt"", ""value"": ""Several tools can help automate the management of reference documents:\n\n1. **Version Control Systems**: Tools like Git allow for version control of documents, enabling tracking of changes, collaborative updates, and branch management for concurrent developments.\n\n2. **Content Management Systems (CMS)**: Platforms like Confluence or SharePoint help manage documentation with features like version history, accessibility controls, and collaborative editing.\n\n3. **Documentation Generators**: Tools like Sphinx or Doxygen automate the generation of documentation from annotated source code, pulling in references and content efficiently.\n\n4. **Automation Scripts**: Custom scripts can facilitate the movement and organization of documents based on changes in content or structure.\n\n5. **Project Management Tools**: Platforms like Trello or Asana can assist in tracking the review status of reference documents, mostly when assigned to players in the project.\n\n6. **Continuous Integration/Continuous Deployment (CI/CD) Tools**: Tools such as Jenkins can automate the building and deployment of documentation updates, ensuring that changes are reflected in the live service seamlessly.\n\nBy utilizing these tools, teams can streamline their management processes, minimize manual errors, and ensure that documentation remains consistently updated and maintained.""}]",knowledge/php/symfony-docs-7.1,1.0,train
"[{""from"": ""human"", ""value"": ""What practices enhance the collaboration among team members managing reference documents?""}, {""from"": ""gpt"", ""value"": ""Enhancing collaboration among team members managing reference documents can be achieved through several best practices:\n\n1. **Shared Repositories**: Use shared repositories (like Git) for all team members to easily access, update, and track changes to reference documents.\n\n2. **Regular Meetings**: Hold regular sync meetings to ensure everyone is aware of updates and changes, discuss challenges, and align on document management strategies.\n\n3. **Clear Responsibilities**: Clarify roles and responsibilities regarding who is in charge of specific documents or sections to avoid confusion and gaps.\n\n4. **Feedback Mechanisms**: Implement feedback loops where team members can provide insights or suggest updates to reference documents, fostering an inclusive environment.\n\n5. **Standard Operating Procedures (SOPs)**: Create SOPs for managing, updating, and reviewing reference documents, ensuring everyone follows the same guidelines.\n\n6. **Collaborative Editing Tools**: Use real-time collaborative tools (like Google Docs or Confluence) for document editing, allowing multiple authors to contribute simultaneously and reduce merge conflicts.\n\n7. **Documentation Style Guides**: Develop a style guide to ensure consistency across reference documents, making it easier for team members to collaborate effectively.\n\nBy fostering an environment with these practices, teams can improve their collaboration efforts, ensuring efficient management of reference documents.""}]",knowledge/php/symfony-docs-7.1,1.0,train
