conversations,source,score,split
"[{""from"": ""human"", ""value"": ""What are the main configuration options available in Symfony's `config/packages/*.yaml` files?""}, {""from"": ""gpt"", ""value"": ""The main configuration options available in Symfony's `config/packages/*.yaml` files are organized under various keys which represent different areas of the framework. Here are some of the key configuration options:\n\n1. **framework**: This section includes configurations related to various Symfony components like session management, HTTP caching, templating, and more. It's the core of Symfony's framework configuration.\n   - Reference: :doc:`framework </reference/configuration/framework>`\n\n2. **doctrine**: This section pertains to the Doctrine ORM configurations, managing database connections and entity mappings.\n   - Reference: :doc:`doctrine </reference/configuration/doctrine>`\n\n3. **security**: Here, you define your security settings, including user authentication and role-based access control.\n   - Reference: :doc:`security </reference/configuration/security>`\n\n4. **twig**: This key is for configuring Twig templating options, including custom paths for templates and specific features you wish to activate.\n   - Reference: :doc:`twig </reference/configuration/twig>`\n\n5. **monolog**: Configuration options for logging via Monolog can be set in this section, allowing customization of log formats and handling.\n   - Reference: :doc:`monolog </reference/configuration/monolog>`\n\n6. **web_profiler**: Settings related to the web profiler, a tool for debugging and profiling web applications, can also be configured here.\n   - Reference: :doc:`web_profiler </reference/configuration/web_profiler>`\n\n7. **debug**: Here you can set up debug level parameters that aid in error handling and logging within your application.\n   - Reference: :doc:`debug </reference/configuration/debug>`\n\nThese sections allow developers to tailor Symfony's behavior to meet the specific needs of their applications.""}]",knowledge/php/symfony-docs-7.1,1.0,train
"[{""from"": ""human"", ""value"": ""What is the purpose of the validation constraints reference in Symfony?""}, {""from"": ""gpt"", ""value"": ""The validation constraints reference in Symfony provides developers with a set of pre-defined rules to validate data input in their applications. This is essential for ensuring that the data entered by users meets specific criteria before processing it further.\n\n1. **Why Use Validation Constraints?**: Validation constraints help enforce data integrity and application logic by rejecting invalid data early in the processing cycle. For example, if a user is required to input an email address, a validation constraint can ensure that the entered value conforms to standard email formatting.\n\n2. **Common Constraints**: Some common validation constraints include:\n   - **NotBlank**: Ensures the value is not empty.\n   - **Email**: Validates the format of email addresses.\n   - **Length**: Checks that the value falls within a specified length range.\n   - **Unique**: Validates that a given value is unique within a given set, common in databases.\n\n3. **Implementation**: You can apply these constraints by using annotations in your entity classes or by defining them in configuration files. For example:\n   ```php\n   use Symfony\\Component\\Validator\\Constraints as Assert;\n   \n   class User {\n       /**\n        * @Assert\\NotBlank()\n        * @Assert\\Email()\n        */\n       private $email;\n   }\n   ```\n4. **Validation Groups**: Symfony also supports validation groups which allow you to group specific constraints together and execute them conditionally based on the context of the operation (like creating vs. updating an entity).\n\nIn conclusion, the validation constraints reference is crucial for ensuring that data meets the expected formats and validation requirements, thus enhancing the application's reliability and user experience.""}]",knowledge/php/symfony-docs-7.1,1.0,train
"[{""from"": ""human"", ""value"": ""How can you configure Twig extensions in Symfony?""}, {""from"": ""gpt"", ""value"": ""Configuring Twig extensions in Symfony involves a few straightforward steps to enable additional functionality in your Twig templates, such as filters, tags, and functions. Here\u2019s how to do it:\n\n1. **Install Twig Extensions**: You may need to first install any specific Twig extensions through Composer if they are not included by default. For example:\n   ```bash\n   composer require twig/extensions\n   ```\n\n2. **Configure Bundles**: If you're using a third-party bundle that provides additional Twig extensions, ensure the bundle is registered in your application. In `config/bundles.php`, check that the bundle is listed:\n   ```php\n   return [\n       // ... other bundles\n       \\App\\Twig\\AppExtension::class => ['all' => true],\n   ];\n   ```\n\n3. **Create Your Twig Extension**: You can create your own Twig extension by creating a class that extends `\\Twig\\Extension\\AbstractExtension`. In this class, you define custom functions, filters, or tests. Example:\n   ```php\n   namespace App\\Twig;\n   \n   use Twig\\Extension\\AbstractExtension;\n   use Twig\\TwigFunction;\n   \n   class AppExtension extends AbstractExtension\n   {\n       public function getFunctions(): array\n       {\n           return [\n               new TwigFunction('custom_function', [$this, 'customFunction']),\n           ];\n       }\n\n       public function customFunction($value)\n       {\n           // Custom logic\n           return strtoupper($value);\n       }\n   }\n   ```\n\n4. **Using the Twig Extension**: After defining and registering the extension, you can use the new functions or filters directly in your Twig templates:\n   ```twig\n   {{ custom_function('hello world') }}\n   ```\n\n5. **Configuration Parameters**: You can also configure certain parameters in the `twig.yaml` file located in `config/packages/` to enable or adjust existing functionalities.\n   ```yaml\n   twig:\n       debug: '%kernel.debug%'\n       strict_variables: true\n   ```\n\nIn summary, configuring Twig extensions enhances the functionality of Twig templates, allowing for more reusable and organized code in Symfony applications.""}]",knowledge/php/symfony-docs-7.1,1.0,train
"[{""from"": ""human"", ""value"": ""What key specifications are associated with YAML in Symfony?""}, {""from"": ""gpt"", ""value"": ""YAML (YAML Ain't Markup Language) is a human-readable data serialization standard that is widely used in Symfony for configuration files. Here are some key specifications associated with YAML in Symfony:\n\n1. **Structure**: YAML uses indentation to denote structure without requiring braces or commas, making it visually clean and easy to read. For example:\n   ```yaml\n   framework:\n       session:\n           handler_id: ~\n   ```\n\n2. **Data Types**: YAML supports various data types, including scalars (strings, numbers, booleans), sequences (lists), and mappings (key-value pairs). Example:\n   ```yaml\n   services:\n       - name: Symfony\\Bundle\\FrameworkBundle\\Controller\\Controller\n         args: [@service_id]\n   ```\n\n3. **Comments**: Comments in YAML are marked with the `#` symbol, allowing for inline documentation of configuration settings which can be beneficial for maintaining large configuration files.\n  \n4. **Multiline Strings**: YAML allows for multiline strings using the pipe (`|`) or greater-than (`>`) symbols. For example:\n   ```yaml\n   description: |\n       This is a long description that\n       spans multiple lines.\n   ```\n\n5. **References and Anchors**: YAML supports references and anchors to avoid duplication of data. For example:\n   ```yaml\n   defaults: &defaults\n       adapter: default\n       charset: UTF-8\n   production:\n       <<: *defaults\n       debug: false\n   ```\n\n6. **Symfony-Specific Features**: Symfony extends standard YAML capabilities with its own conventions, allowing for more robust configuration management within the framework. For example, Symfony may leverage YAML for service definitions, routing configurations, and more.\n\nIn conclusion, YAML's specifications and its integration within Symfony facilitate straightforward configuration management, enhancing developer productivity and maintainability.""}]",knowledge/php/symfony-docs-7.1,1.0,train
"[{""from"": ""human"", ""value"": ""What role does the Symfony Kernel play in the configuration of an application?""}, {""from"": ""gpt"", ""value"": ""The Symfony Kernel is a central component in the Symfony framework that manages the application's lifecycle and orchestrates the request-response cycle. It plays a crucial role in the configuration of an application in several ways:\n\n1. **Bootstrapping**: The Kernel is responsible for loading the application configuration files during the boot process which includes reading configurations specified in the `config/packages/*.yaml` and other relevant files. This ensures that all components are properly configured before handling requests.\n\n2. **Handling Environment**: The Kernel determines the appropriate environment (e.g., dev, prod) based on configuration and context, allowing for environment-specific settings to be applied automatically.\n\n3. **Service Management**: It facilitates the initialization and management of services defined in the Dependency Injection container. The Kernel registers services and makes them available throughout the application by relying on service definitions detailed in configuration files.\n\n4. **Event Dispatching**: The Kernel dispatches events during the application lifecycle (e.g., kernel.request, kernel.response), allowing for hooks to modify or extend functionality. This mechanism is widely used in Symfony to implement custom logic or behavior at various stages of the request lifecycle.\n\n5. **Configuration Sources**: It allows you to influence the configuration by providing mechanisms for bundles to register additional configuration files or merge their settings dynamically.\n\n6. **Performance Management**: The Kernel also handles performance-related settings, such as caching configurations that can enhance application speed and responsiveness by storing state and minimizing overhead for repeated requests.\n\nIn summary, the Symfony Kernel is essential for initiating and managing the application configuration, ensuring that all components are properly set up and operate effectively throughout the application's lifecycle.""}]",knowledge/php/symfony-docs-7.1,1.0,train
"[{""from"": ""human"", ""value"": ""What types of format specifications are listed under specifications in Symfony?""}, {""from"": ""gpt"", ""value"": ""The following format specifications are essential in Symfony, each serving specific purposes in managing data or configurations:\n\n1. **YAML**: Used for configuration files due to its human-readable format. YAML files are structured without requiring brackets or significant punctuation, allowing for clean and straightforward configuration management.\n   - Reference: :doc:`YAML </reference/formats/yaml>`\n\n2. **XLIFF**: The XML Localization Interchange File Format is primarily used for translation purposes in Symfony applications. It facilitates the localization of strings, making it easier to manage translations in a standardized way.\n   - Reference: :doc:`XLIFF </reference/formats/xliff>`\n\n3. **ICU MessageFormat**: Used for internationalization and localization, this format allows for complex string interpolation by enabling placeholders and pluralization in translation strings.\n   - Reference: :doc:`ICU MessageFormat </reference/formats/message_format>`\n\n4. **Expression Language**: This format is utilized to evaluate expressions in Symfony configurations, useful for dynamic configuration and rules. It enables developers to define expressions that evaluate contextually at runtime.\n   - Reference: :doc:`Expression Language </reference/formats/expression_language>`\n\nIn summary, these format specifications facilitate effective data management, localization, and dynamic behavior in Symfony applications.""}]",knowledge/php/symfony-docs-7.1,1.0,train
"[{""from"": ""human"", ""value"": ""Can you explain the use of Twig Template Functions in Symfony?""}, {""from"": ""gpt"", ""value"": ""Twig Template Functions are predefined functions available within the Twig templating engine in Symfony that enhance the flexibility and capabilities of your templates. Here\u2019s an overview of their usage:\n\n1. **Purpose**: Template functions allow for complex logic and reusable components within your Twig templates, making them dynamic and easier to maintain. For example, you can leverage Twig functions to format dates, manipulate strings, or generate URLs.\n\n2. **Built-in Functions**: Twig comes with a set of built-in functions that you can use out-of-the-box, such as:\n   - `date()`: Formats date and time values.\n   - `url()`: Generates a URL to a specific route in the application.\n   - `asset()`: Retrieves the path of an asset, typically for styling or images.\n\n3. **Custom Functions**: You can also create custom Twig functions by defining them in a Twig extension. This is useful when you need specialized functionality that isn't met by built-in functions. For example:\n   ```php\n   namespace App\\Twig;\n   \n   use Twig\\Extension\\AbstractExtension;\n   use Twig\\TwigFunction;\n   \n   class AppExtension extends AbstractExtension\n   {\n       public function getFunctions(): array\n       {\n           return [\n               new TwigFunction('capitalize', 'strtoupper'),\n           ];\n       }\n   }\n   ```\n   This registers a custom Twig function named `capitalize` that transforms input strings to uppercase.\n\n4. **Using Functions in Templates**: You can directly use both built-in and custom functions in your Twig templates. Example:\n   ```twig\n   <p>{{ capitalize('hello world') }}</p>\n   <p>The date today is: {{ date('now') }}</p>\n   ```\n\n5. **Performance Considerations**: Overuse of functions within templates can impact rendering performance, so it\u2019s recommended to limit their usage for essential operations and rely on template inheritance and caching where possible.\n\nIn summary, Twig Template Functions significantly enhance template versatility in Symfony, allowing for both standard and custom operations to effectively manage rendered content.""}]",knowledge/php/symfony-docs-7.1,1.0,train
