conversations,source,score,split
"[{""from"": ""human"", ""value"": ""What types of localization data are essential for creating multilingual applications?""}, {""from"": ""gpt"", ""value"": ""Essential types of localization data for creating multilingual applications include:\n1. **Language Names**: Proper representations of the languages supported.\n2. **Country Names**: Localized names of countries as users from different regions expect to see names in their language.\n3. **Currencies**: Accurate representation of currency names and symbols as per user preferences.\n4. **Timezones**: Correct timezone data to present relevant local times to users.\n5. **Locales**: Comprehensive support of locales to appropriately format dates, times, and other information.""}]",knowledge/php/symfony-docs-7.1,1.0,train
"[{""from"": ""human"", ""value"": ""What common pitfalls should be avoided while using the Symfony Intl component?""}, {""from"": ""gpt"", ""value"": ""Common pitfalls to avoid while using the Symfony Intl component include:\n1. **Hardcoding Values**: Instead of hardcoding language or country names, always use the Intl component to fetch the correct names for the active locale.\n2. **Ignoring Exceptions**: Failing to catch or handle `MissingResourceException` can lead to application crashes when invalid codes are used.\n3. **Not Validating Inputs**: Omitting validation for codes before accessing them can result in errors during runtime.""}]",knowledge/php/symfony-docs-7.1,1.0,train
"[{""from"": ""human"", ""value"": ""Can you suggest a way to minimize the size of the Intl component in a deployed application?""}, {""from"": ""gpt"", ""value"": ""To minimize the size of the Intl component in a deployed application, you can run the following compression command after installing via composer:\n```terminal\nphp ./vendor/symfony/intl/Resources/bin/compress\n```\nThis compresses the internal data files, making deployment size more manageable.""}]",knowledge/php/symfony-docs-7.1,1.0,train
"[{""from"": ""human"", ""value"": ""What is a practical scenario for using the Symfony Intl component's currency functions?""}, {""from"": ""gpt"", ""value"": ""A practical scenario for using the currency functions in the Symfony Intl component is in an e-commerce application where you need to display product prices in various currencies based on user location. The component allows you to retrieve currency symbols, names, and proper formatting for users, ensuring a consistent and user-friendly experience.""}]",knowledge/php/symfony-docs-7.1,1.0,train
"[{""from"": ""human"", ""value"": ""How would you utilize the Symfony Intl component to enhance a web application aimed at a global audience?""}, {""from"": ""gpt"", ""value"": ""To enhance a web application aimed at a global audience using the Symfony Intl component, you can:\n1. Implement different locale settings based on user preferences or browser language.\n2. Use the Intl component to fetch language, country, and currency data dynamically to cater to various geographical markets.\n3. Ensure formatting for dates, times, and numbers aligns with local customs.\n4. Add support for emojis and their translations, making the application more engaging.""}]",knowledge/php/symfony-docs-7.1,1.0,train
"[{""from"": ""human"", ""value"": ""What approach should be taken when handling localization data updates?""}, {""from"": ""gpt"", ""value"": ""When handling localization data updates, it is essential to:\n1. **Automate Updates**: Regularly review and update localization data to reflect changes in language, currency, or country information.\n2. **Version Control**: Maintain versioned backups of localization files to quickly revert changes if necessary.\n3. **Test Thoroughly**: Ensure that updates do not disrupt user experience by testing updates against various scenarios before deploying change.""}]",knowledge/php/symfony-docs-7.1,1.0,train
"[{""from"": ""human"", ""value"": ""Can you elaborate on the significance of best practices in managing localization?""}, {""from"": ""gpt"", ""value"": ""Best practices in managing localization are significant because they ensure standardized processes that streamline application development and maintenance. They help to:\n1. **Ensure Consistency**: Consistent management of localization data leads to a unified user experience across different languages and regions.\n2. **Reduce Errors**: Following best practices reduces the chances of errors in data representation and formatting, leading to fewer bugs.\n3. **Enhance User Experience**: By adhering to best practices, developers can provide a seamless experience that resonates with users from diverse backgrounds.""}]",knowledge/php/symfony-docs-7.1,1.0,train
"[{""from"": ""human"", ""value"": ""What are the implications of using multiple locales in an application?""}, {""from"": ""gpt"", ""value"": ""Using multiple locales in an application has several implications:\n1. **Increased Complexity**: Managing multiple language versions increases the complexity of the application, requiring comprehensive localization strategies.\n2. **Testing Requirements**: Each locale may require separate testing to confirm the user interface displays correctly because translation issues can arise.\n3. **Content Management**: There will be a requirement for rigorous content management protocols to ensure updates are reflected accurately across all locales.""}]",knowledge/php/symfony-docs-7.1,1.0,train
"[{""from"": ""human"", ""value"": ""How can tracking localization requirements benefit an application development process?""}, {""from"": ""gpt"", ""value"": ""Tracking localization requirements benefits the application development process by:\n1. **Identifying Patterns**: Recognizing frequent localization changes or requirements helps inform development priorities and resource allocation.\n2. **Enhancing User Satisfaction**: Understanding user preferences through tracking can improve personalization, leading to higher user satisfaction.\n3. **Planning for Growth**: Forecasting localization needs aligns with strategic business growth, enabling developers to plan for language expansion or market penetration.""}]",knowledge/php/symfony-docs-7.1,1.0,train
"[{""from"": ""human"", ""value"": ""How might cultural considerations impact the deployment of localization data?""}, {""from"": ""gpt"", ""value"": ""Cultural considerations significantly impact the deployment of localization data as they inform:\n1. **Content Sensitivity**: Certain phrases, symbols, or representations may resonate differently across cultures, necessitating careful tailoring of content to avoid misunderstandings.\n2. **Visual Design**: Colors, icons, and layouts may need to be adjusted based on regional cultural significance and norms.\n3. **User Interactions**: Understanding local customs and etiquette influences user interfaces, such that interactions align with familiar practices.""}]",knowledge/php/symfony-docs-7.1,1.0,train
"[{""from"": ""human"", ""value"": ""Can you summarize how the Symfony Intl component supports cultural diversity?""}, {""from"": ""gpt"", ""value"": ""The Symfony Intl component supports cultural diversity by providing tools that allow developers to:\n1. **Localize Applications**: Access to localization data supports the creation of applications that cater to users from varied cultural backgrounds.\n2. **Respect Language Variations**: It handles multiple language codes and provides correct representation according to cultural preferences.\n3. **Include Currency Differences**: By managing currency information, it helps applications account for different economic practices across regions.\nThrough these functionalities, Symfony Intl enhances user engagement through culturally informed representations.""}]",knowledge/php/symfony-docs-7.1,1.0,train
