conversations,source,score,split
"[{""from"": ""human"", ""value"": ""What are verbosity levels in Symfony Console commands?""}, {""from"": ""gpt"", ""value"": ""Verbosity levels in Symfony Console commands determine the amount and type of messages that are displayed during command execution. By default, commands show only essential output messages to provide users with the most relevant information. However, they can modify how much detail they receive through command line options: \n- **`-q` or `--quiet`**: Suppresses all output, including results.\n- **No option**: Displays only useful messages.\n- **`-v`**: Increases verbosity, showing more messages.\n- **`-vv`**: Displays informative, non-essential messages.\n- **`-vvv`**: Shows all messages, useful for debugging issues.""}]",knowledge/php/symfony-docs-7.1,1.0,train
"[{""from"": ""human"", ""value"": ""How can I control the verbosity of Symfony commands globally?""}, {""from"": ""gpt"", ""value"": ""You can control the verbosity of Symfony commands globally by setting the `SHELL_VERBOSITY` environment variable. This variable allows you to define a default verbosity level, applicable to all commands, however, the command-specific options (`-q` and `-v`) will take precedence over this global setting. The following mappings are possible:\n- `-q` or `--quiet` corresponds to a verbosity level of `-1`, meaning no messages will be shown.\n- No option corresponds to verbosity level `0` for normal messages.\n- `-v` corresponds to level `1`, `-vv` to level `2`, and `-vvv` to level `3`, which enables verbose, very verbose, and debug levels respectively.""}]",knowledge/php/symfony-docs-7.1,1.0,train
"[{""from"": ""human"", ""value"": ""Can you provide a code snippet demonstrating how to use verbosity in a Symfony command?""}, {""from"": ""gpt"", ""value"": ""Certainly! Below is an example code snippet that demonstrates how to utilize verbosity levels in a Symfony command. This example illustrates how to print messages based on the verbosity level:\n\n```php\n// src/Command/CreateUserCommand.php\nnamespace App\\Command;\n\nuse Symfony\\Component\\Console\\Command\\Command;\nuse Symfony\\Component\\Console\\Input\\InputInterface;\nuse Symfony\\Component\\Console\\Output\\OutputInterface;\n\nclass CreateUserCommand extends Command\n{\n    protected static $defaultName = 'app:create-user';\n\n    protected function configure(): void\n    {\n        $this->setDescription('Creates a new user.');\n    }\n\n    public function execute(InputInterface $input, OutputInterface $output): int\n    {\n        $user = new User(...);\n\n        $output->writeln([\n            'Username: '.$input->getArgument('username'),\n            'Password: '.$input->getArgument('password'),\n        ]);\n\n        // Check verbosity level\n        if ($output->isVerbose()) {\n            $output->writeln('User class: '.get_class($user));\n        }\n\n        // Print message only in verbose mode or higher\n        $output->writeln(\n            'Will only be printed in verbose mode or higher',\n            OutputInterface::VERBOSITY_VERBOSE\n        );\n\n        return Command::SUCCESS;\n    }\n}\n``` \nIn this command, messages can be conditionally displayed based on the verbosity level set by the user. The command's output is more informative when using the verbose options, demonstrating effective message control.""}]",knowledge/php/symfony-docs-7.1,1.0,train
"[{""from"": ""human"", ""value"": ""What happens when the quiet verbosity level is applied in a Symfony command?""}, {""from"": ""gpt"", ""value"": ""When the quiet verbosity level (`-q` or `--quiet`) is applied in a Symfony command, all output is suppressed. This includes not only the detailed output but also the command results. Essentially, the output methods, such as `write` or `writeln`, do not print anything to the console as they return early. This is useful for scenarios where the user does not want any messages displayed, effectively allowing the command to execute silently without feedback to the console.""}]",knowledge/php/symfony-docs-7.1,1.0,train
"[{""from"": ""human"", ""value"": ""How can developers integrate messaging capabilities with Monolog in Symfony Console?""}, {""from"": ""gpt"", ""value"": ""Developers can integrate messaging capabilities with Monolog in Symfony Console applications using the `Symfony\\Bridge\\Monolog\\Handler\\ConsoleHandler`. This handler provides a cleaner approach to display log messages in the console instead of wrapping outputs in verbosity checks. Here's how you can do this:\n\n1. **Setup Monolog**: Ensure that your application has Monolog configured in its services.\n2. **Configure the ConsoleHandler**: Add a `ConsoleHandler` to your Monolog logger configuration.\n\nExample configuration in `services.yaml`:\n```yaml\nservices:\n    Monolog\\Logger:\n        handlers:\n            console:\n                type:  console\n                channels: ['!event']\n```\n\n3. **Usage in Command**: Now, in your Symfony Command, you can use the Monolog Logger to log messages based on the configured verbosity levels:\n```php\nuse Psr\\Log\\LoggerInterface;\n\nclass CreateUserCommand extends Command\n{\n    public function __construct(private LoggerInterface $logger) {\n        parent::__construct();\n    }\n\n    public function execute(InputInterface $input, OutputInterface $output): int\n    {\n        $this->logger->info('User creation started.');\n        //... \n        return Command::SUCCESS;\n    }\n}\n```\nThis approach allows for a more seamless logging experience, where messages can be sent to the console without needing to manage verbosity checks manually.""}]",knowledge/php/symfony-docs-7.1,1.0,train
"[{""from"": ""human"", ""value"": ""What are the PHP constant equivalents of Symfony verbosity levels?""}, {""from"": ""gpt"", ""value"": ""In Symfony, the different verbosity levels corresponding to the command options have specific PHP constant equivalents defined in `OutputInterface`. Here are the mappings:\n- **`-q` or `--quiet`**: This corresponds to the value `-1`, represented by the constant `OutputInterface::VERBOSITY_QUIET`.\n- **No option**: By default corresponds to the value `0`, represented by `OutputInterface::VERBOSITY_NORMAL`.\n- **`-v`**: This is equivalent to the value `1`, which is `OutputInterface::VERBOSITY_VERBOSE`.\n- **`-vv`**: Equivalent to `2`, represented by `OutputInterface::VERBOSITY_VERY_VERBOSE`.\n- **`-vvv`**: This corresponds to the value `3` which is represented by `OutputInterface::VERBOSITY_DEBUG`. These constants allow developers to reference verbosity levels in a more readable and maintainable way.""}]",knowledge/php/symfony-docs-7.1,1.0,train
"[{""from"": ""human"", ""value"": ""When is the full exception stack trace printed in Symfony Console commands?""}, {""from"": ""gpt"", ""value"": ""In Symfony Console commands, the full exception stack trace is printed when the verbosity level is set to `VERBOSITY_VERBOSE` or higher. This typically happens when the command is executed with options `-vv` for very verbose output or `-vvv` for debug-level output. Enabling these verbosity levels provides developers with detailed error information that can be extremely useful for diagnosing issues, as it reveals where the error occurred and the path leading up to it.""}]",knowledge/php/symfony-docs-7.1,1.0,train
"[{""from"": ""human"", ""value"": ""How can output messages vary based on the command's verbosity in Symfony?""}, {""from"": ""gpt"", ""value"": ""Output messages in Symfony commands can vary based on the set verbosity level by using conditional logic to check the verbosity state. Developers can use methods like `isQuiet()`, `isVerbose()`, `isVeryVerbose()`, and `isDebug()` on the `OutputInterface` instance:\n\n- **`isQuiet()`**: Check if the command is run in quiet mode; if so, skip all output.\n- **`isVerbose()`**: Offer additional informational messages that are only relevant in verbose mode.\n- **`isVeryVerbose()`**: This can display in-depth detail that is useful for developers and not typically needed by end-users.\n- **`isDebug()`**: This is used to output debug-specific information that should logically be omitted in a normal situation, providing insights into internal workings.\n\nBy iterating over these checks, developers can tailor their command output according to user preferences, greatly improving usability and clarity.""}]",knowledge/php/symfony-docs-7.1,1.0,train
"[{""from"": ""human"", ""value"": ""What is the significance of -vv and -vvv verbosity levels in Symfony?""}, {""from"": ""gpt"", ""value"": ""The `-vv` and `-vvv` verbosity levels in Symfony are significant for providing detailed output during the execution of console commands, which is particularly useful for debugging and tracing the command's processes:\n- **`-vv` (Very Verbose)**: This level displays informative messages beyond basic output. It's often used when developers need to see more context about what is occurring during command execution without showing every single detail or debug information.\n- **`-vvv` (Debug)**: This level provides the most extensive detail, including all messages, which is crucial for developers who need to troubleshoot issues or understand the inner workings of their commands. It may include variable states, execution order, and any other information that could help identify problems.\n\nUsing these verbosity levels appropriately can significantly enhance the debugging and fine-tuning of commands.""}]",knowledge/php/symfony-docs-7.1,1.0,train
"[{""from"": ""human"", ""value"": ""What is the default behavior of Symfony commands regarding message output?""}, {""from"": ""gpt"", ""value"": ""The default behavior of Symfony commands regarding message output is to display only the most useful messages for the user. This typically includes essential information required for understanding the command's result and any important notifications regarding its execution. Unless specifically altered with verbosity options, such as `-q` for quiet mode or `-v` for increased verbosity, commands will not present additional details, keeping the output concise and relevant for the user.""}]",knowledge/php/symfony-docs-7.1,1.0,train
"[{""from"": ""human"", ""value"": ""Can you summarize how a Symfony command can print messages based on verbosity level?""}, {""from"": ""gpt"", ""value"": ""Certainly! In a Symfony command, developers can print messages based on the verbosity level by utilizing methods available in the `OutputInterface`. Here's a summary of the process:\n1. **Check Verbosity Level**: Use methods like `isQuiet()`, `isVerbose()`, `isVeryVerbose()`, and `isDebug()` on the `OutputInterface` instance to check the current verbosity setting of the command.\n2. **Conditional Output**: Based on the verbosity check, conditionally write messages that are relevant for that level. For example, display detailed information only if `isVerbose()` is true or ensure that crucial information is not suppressed by checking if `isQuiet()` is false.\n3. **Use PHP Constants**: Developers can invoke specific verbosity constants directly with methods like `writeln()` to ensure certain messages appear only under verbose conditions.\nThis level of control allows for effective and intentional output management within Symfony commands, enabling developers to tailor the user experience.""}]",knowledge/php/symfony-docs-7.1,1.0,train
