conversations,source,score,split
"[{""from"": ""human"", ""value"": ""How does Symfony handle versioning for its components?""}, {""from"": ""gpt"", ""value"": ""Symfony handles versioning using semantic versioning principles (SemVer), where each version number is composed of three parts: Major, Minor, and Patch (e.g., 5.3.2). Major versions introduce backward-incompatible changes, minor versions add new features without breaking existing functionality, and patches fix bugs while maintaining compatibility. This allows developers to manage dependencies while ensuring stability.""}]",knowledge/php/symfony-docs-7.1,1.0,train
"[{""from"": ""human"", ""value"": ""What are the roles of encoders and decoders in Symfony?""}, {""from"": ""gpt"", ""value"": ""Encoders and decoders in Symfony are responsible for transforming data between different formats and representations. Commonly used for handling data formats like JSON, XML, and CSV, encoders convert native PHP data types into these formats, while decoders do the opposite, allowing for seamless data interchange across different systems and services.""}]",knowledge/php/symfony-docs-7.1,1.0,train
"[{""from"": ""human"", ""value"": ""In what scenarios would you use Doctrine ORM in Symfony?""}, {""from"": ""gpt"", ""value"": ""Doctrine ORM would be used in a Symfony application when you need to manage database interactions elegantly and efficiently. Specifically, it is beneficial for:\n1. **Complex Associations**: Handling relationships between various database entities.\n2. **Data Mapping**: Simplifying object-relational mapping (ORM) to interact with databases using PHP objects.\n3. **Migrations**: Managing changes to the database schema through migration scripts with ease.""}]",knowledge/php/symfony-docs-7.1,1.0,train
"[{""from"": ""human"", ""value"": ""What are the advantages of using environment variables in Symfony applications?""}, {""from"": ""gpt"", ""value"": ""The advantages of using environment variables in Symfony applications include:\n1. **Security**: Sensitive information (like credentials) is not hardcoded in the codebase, reducing exposure risk.\n2. **Configuration Management**: Easily switch between different environments (development, production) without altering application code.\n3. **Simplicity**: Environment variables can be easily set and overridden during deployments, allowing for dynamic configuration.""}]",knowledge/php/symfony-docs-7.1,1.0,train
"[{""from"": ""human"", ""value"": ""How can you efficiently handle large datasets in Symfony?""}, {""from"": ""gpt"", ""value"": ""To efficiently handle large datasets in Symfony, consider:\n1. **Pagination**: Implement pagination to load and display manageable chunks of data at a time.\n2. **Batch Processing**: Use batch processing techniques to avoid memory exhaustion when dealing with extensive operations (e.g., bulk database inserts).\n3. **Streaming**: Utilize data streaming methods, like generators, to process large results from queries incrementally.""}]",knowledge/php/symfony-docs-7.1,1.0,train
"[{""from"": ""human"", ""value"": ""How does Symfony handle CSRF protection in forms?""}, {""from"": ""gpt"", ""value"": ""Symfony handles CSRF protection in forms automatically through its form component. By including a CSRF token field in forms, Symfony ensures that each submitted form can be verified for authenticity, mitigating the risk of CSRF attacks. The token is generated upon form creation and validated upon form submission. Here's an example of including a CSRF token:\n\n```php\nuse Symfony\\Component\\Form\\FormBuilderInterface;\n\n$builder->add('_token', HiddenType::class, [\n    'data' => $form->getConfig()->getToken()\n]);\n```""}]",knowledge/php/symfony-docs-7.1,1.0,train
"[{""from"": ""human"", ""value"": ""What steps should you take to secure Symfony applications?""}, {""from"": ""gpt"", ""value"": ""To secure Symfony applications, take the following steps:\n1. **Use HTTPS**: Ensure all traffic is encrypted using SSL/TLS.\n2. **Implement Authentication and Authorization**: Protect sensitive data and routes using Symfony's Security component to manage user access.\n3. **Validate User Inputs**: Always sanitize and validate inputs to prevent injection attacks.\n4. **Keep Dependencies Updated**: Regularly update Composer dependencies to incorporate the latest security fixes.""}]",knowledge/php/symfony-docs-7.1,1.0,train
"[{""from"": ""human"", ""value"": ""How can Symfony applications integrate with third-party APIs?""}, {""from"": ""gpt"", ""value"": ""Symfony applications can integrate with third-party APIs through HTTP clients such as `Symfony\\Component\\HttpClient\\HttpClient`. You can make synchronous or asynchronous HTTP requests to external services, handle JSON responses, and manage any necessary authentication. For example:\n\n```php\nuse Symfony\\Component\\HttpClient\\HttpClient;\n\n$client = HttpClient::create();\n$response = $client->request('GET', 'https://api.example.com/data');\n$responseData = $response->toArray();\n```""}]",knowledge/php/symfony-docs-7.1,1.0,train
"[{""from"": ""human"", ""value"": ""What is the importance of using composer.json in Symfony applications?""}, {""from"": ""gpt"", ""value"": ""The `composer.json` file is important in Symfony applications as it defines the project dependencies, required PHP versions, scripts for operations, and configurations necessary for the application to function correctly. By using Composer, developers can manage library dependencies effectively and ensure version compatibility throughout the application, simplifying the installation and update processes.""}]",knowledge/php/symfony-docs-7.1,1.0,train
"[{""from"": ""human"", ""value"": ""What is the primary role of the `symfony/*` packages in Symfony?""}, {""from"": ""gpt"", ""value"": ""The primary role of the `symfony/*` packages in Symfony is to provide modular and reusable components, each serving specific functionalities within the Symfony framework. This architecture allows developers to include only the required components for their application, promoting efficiency in resource usage and application performance.""}]",knowledge/php/symfony-docs-7.1,1.0,train
