conversations,source,score,split
"[{""from"": ""human"", ""value"": ""What is the purpose of registering custom DQL functions in Symfony?""}, {""from"": ""gpt"", ""value"": ""Registering custom DQL (Doctrine Query Language) functions in Symfony allows developers to extend the functionality of the DQL with their own logic and behavior. This is particularly useful when you need specific database operations that are not provided out-of-the-box. By creating custom DQL functions, you can execute complex queries or computations directly within your DQL statements, making your data access layer more powerful and expressive.""}]",knowledge/php/symfony-docs-7.1,1.0,train
"[{""from"": ""human"", ""value"": ""How do you register custom DQL functions in Symfony's configuration files?""}, {""from"": ""gpt"", ""value"": ""To register custom DQL functions in Symfony, you can do it either through YAML, XML, or PHP configuration files. Below, I provide examples for each method:\n\n1. **Using YAML Configuration**:\n```yaml\n# config/packages/doctrine.yaml\ndoctrine:\n    orm:\n        dql:\n            string_functions:\n                test_string: App\\DQL\\StringFunction\n                second_string: App\\DQL\\SecondStringFunction\n            numeric_functions:\n                test_numeric: App\\DQL\\NumericFunction\n            datetime_functions:\n                test_datetime: App\\DQL\\DatetimeFunction\n```\n\n2. **Using XML Configuration**:\n```xml\n<!-- config/packages/doctrine.xml -->\n<container xmlns=\""http://symfony.com/schema/dic/services\""\n    xmlns:xsi=\""http://www.w3.org/2001/XMLSchema-instance\""\n    xmlns:doctrine=\""http://symfony.com/schema/dic/doctrine\""\n    xsi:schemaLocation=\""http://symfony.com/schema/dic/services\n        https://symfony.com/schema/dic/services/services-1.0.xsd\n        http://symfony.com/schema/dic/doctrine\n        https://symfony.com/schema/dic/doctrine/doctrine-1.0.xsd\"">\n    <doctrine:config>\n        <doctrine:orm>\n            <doctrine:dql>\n                <doctrine:string-function name=\""test_string\"">App\\DQL\\StringFunction</doctrine:string-function>\n                <doctrine:string-function name=\""second_string\"">App\\DQL\\SecondStringFunction</doctrine:string-function>\n                <doctrine:numeric-function name=\""test_numeric\"">App\\DQL\\NumericFunction</doctrine:numeric-function>\n                <doctrine:datetime-function name=\""test_datetime\"">App\\DQL\\DatetimeFunction</doctrine:datetime-function>\n            </doctrine:dql>\n        </doctrine:orm>\n    </doctrine:config>\n</container>\n```\n\n3. **Using PHP Configuration**:\n```php\n// config/packages/doctrine.php\nuse App\\DQL\\DatetimeFunction;\nuse App\\DQL\\NumericFunction;\nuse App\\DQL\\SecondStringFunction;\nuse App\\DQL\\StringFunction;\nuse Symfony\\Config\\DoctrineConfig;\n\nreturn static function (DoctrineConfig $doctrine): void {\n    $defaultDql = $doctrine->orm()\n        ->entityManager('default')\n            ->dql();\n\n    $defaultDql->stringFunction('test_string', StringFunction::class);\n    $defaultDql->stringFunction('second_string', SecondStringFunction::class);\n    $defaultDql->numericFunction('test_numeric', NumericFunction::class);\n    $defaultDql->datetimeFunction('test_datetime', DatetimeFunction::class);\n};\n```\nThis allows Symfony to use the custom functions within your DQL queries.""}]",knowledge/php/symfony-docs-7.1,1.0,train
"[{""from"": ""human"", ""value"": ""What should you keep in mind about entity managers when configuring DQL functions?""}, {""from"": ""gpt"", ""value"": ""When configuring DQL functions for specific entity managers in Symfony, you must ensure that the `dql` configuration block is defined under the named entity manager. This is crucial because if the entity managers are explicitly named, attempting to configure DQL functions directly under the `orm` will lead to an exception with the message \""Unrecognized option 'dql' under 'doctrine.orm'\"". Here\u2019s how you can define it properly:\n\n- **YAML Example**:\n```yaml\n# config/packages/doctrine.yaml\ndoctrine:\n    orm:\n        entity_managers:\n            example_manager:\n                dql:\n                    datetime_functions:\n                        test_datetime: App\\DQL\\DatetimeFunction\n```\n\n- **XML Example**:\n```xml\n<!-- config/packages/doctrine.xml -->\n<doctrine:entity-manager name=\""example_manager\"">\n    <doctrine:dql>\n        <doctrine:datetime-function name=\""test_datetime\"">\n            App\\DQL\\DatetimeFunction\n        </doctrine:datetime-function>\n    </doctrine:dql>\n</doctrine:entity-manager>\n```\n\n- **PHP Example**:\n```php\n// config/packages/doctrine.php\n$doctrine->orm()\n    ->entityManager('example_manager')\n        ->dql()\n            ->datetimeFunction('test_datetime', DatetimeFunction::class);\n```\nBy adhering to this structure, you ensure the correct functioning of DQL functions for the specified entity manager.""}]",knowledge/php/symfony-docs-7.1,1.0,train
"[{""from"": ""human"", ""value"": ""Can custom DQL functions access services or parameters? Why or why not?""}, {""from"": ""gpt"", ""value"": ""No, custom DQL functions cannot access services or parameters in Symfony. This limitation exists because DQL functions are instantiated by Doctrine outside of the Symfony service container. As a result, they do not have access to the dependency injection mechanism that Symfony provides. Consequently, it is important to structure your custom DQL functions in such a way that they do not require any external services or parameters for their logic, relying strictly on the input they receive during execution.""}]",knowledge/php/symfony-docs-7.1,1.0,train
"[{""from"": ""human"", ""value"": ""Could you provide a simple example of a custom DQL function in Symfony?""}, {""from"": ""gpt"", ""value"": ""Sure! Below is a simple implementation of a custom DQL function in Symfony. This example will create a DQL function called `my_custom_function` that concatenates a string with another string:\n\n1. **Create the Function Class**:\n```php\n// src/DQL/MyCustomFunction.php\nnamespace App\\DQL;\n\nuse Doctrine\\ORM\\Query\\Lexer;\nuse Doctrine\\ORM\\Query\\AST\\Functions\\FunctionNode;\nuse Doctrine\\ORM\\Query\\AST\\Node;\nuse Doctrine\\ORM\\Query\\Parser;\nuse Doctrine\\ORM\\Query\\SqlWalker;\n\nclass MyCustomFunction extends FunctionNode\n{\n    public Node \\$firstString = null;\n    public Node \\$secondString = null;\n\n    public function parse(Parser \\$parser): void\n    {\n        \\$parser->match(Lexer::T_IDENTIFIER);\n        \\$parser->match(Lexer::T_OPEN_PARENTHESIS);\n        \\$this->firstString = \\$parser->ArithmeticExpression();\n        \\$parser->match(Lexer::T_COMMA);\n        \\$this->secondString = \\$parser->ArithmeticExpression();\n        \\$parser->match(Lexer::T_CLOSE_PARENTHESIS);\n    }\n\n    public function dispatch(SqlWalker \\$sqlWalker)\n    {\n        return 'CONCAT(' .\n            \\$this->firstString->dispatch(\\$sqlWalker) . ', ' .\n            \\$this->secondString->dispatch(\\$sqlWalker) . '\\)';\n    }\n}\n```\n\n2. **Register the Function**:\nYou would register this function using one of the methods mentioned above, for example in YAML:\n```yaml\n# config/packages/doctrine.yaml\ndoctrine:\n    orm:\n        dql:\n            string_functions:\n                my_custom_function: App\\DQL\\MyCustomFunction\n```\n\n3. **Using the Custom DQL Function**:\nNow you can use this function in your DQL queries like this:\n```php\n$query = $entityManager->createQuery('SELECT my_custom_function(e.firstName, e.lastName) FROM App\\Entity\\Employee e');\n```\nThis will result in a query that combines the `firstName` and `lastName` fields into a single string.""}]",knowledge/php/symfony-docs-7.1,1.0,train
"[{""from"": ""human"", ""value"": ""What considerations should be taken into account when debugging custom DQL functions?""}, {""from"": ""gpt"", ""value"": ""When debugging custom DQL functions, several considerations should be taken into account:\n1. **Error Handling**: Ensure that your custom function gracefully handles inputs that may lead to exceptions or errors, such as null values or incorrect types.\n2. **Testing Queries**: Test your DQL queries in isolation. Use the Doctrine query builder or raw SQL to verify the expected behavior of your custom function.\n3. **Logging**: Implement logging within your custom function to trace the execution flow and variables, which can be useful in identifying where issues occur.\n4. **Doctrine Compatibility**: Make sure your function adheres to the DQL syntax and Doctrine's expectations, as syntax errors can lead to misleading error messages.\n5. **Symfony Logs**: Check Symfony\u2019s logs for any errors or warnings that may indicate issues with the configuration or execution of your custom DQL functions.""}]",knowledge/php/symfony-docs-7.1,1.0,train
"[{""from"": ""human"", ""value"": ""How do you handle exceptions when using custom DQL functions?""}, {""from"": ""gpt"", ""value"": ""Since custom DQL functions are executed at the database level during query execution, exceptions related to them may not be caught in the same way as in regular PHP code. Here are some strategies to handle exceptions:\n1. **Database Level Exception Handling**: Catch exceptions at the database query execution level using Doctrine\u2019s `QueryException` or a broader exception class when you execute the query. For example:\n```php\ntry {\n    $query = $entityManager->createQuery('SELECT my_custom_function(e.firstName, e.lastName) FROM App\\Entity\\Employee e');\n    $results = $query->getResult();\n} catch (Doctrine\\ORM\\Query\\QueryException $e) {\n    // Handle query-specific errors here\n    echo 'Query error: ' . $e->getMessage();\n}\n```\n2. **Validate Inputs**: Before passing any inputs to the custom DQL function, validate them in your application logic to ensure they conform to expected formats. This helps avoid exceptions stemming from invalid data.\n3. **Graceful Fallback**: Consider providing a fallback or default value in your custom DQL function in case of errors or unexpected input, preventing the entire query from failing.""}]",knowledge/php/symfony-docs-7.1,1.0,train
"[{""from"": ""human"", ""value"": ""What might be some potential performance issues when using custom DQL functions?""}, {""from"": ""gpt"", ""value"": ""Potential performance issues when using custom DQL functions can arise from several factors:\n1. **Complexity of Logic**: If your DQL function contains complex logic or operations, it may lead to slower query execution times. Always aim for efficiency in the implementation of your function.\n2. **Database Load**: Excessive use of custom functions can increase the load on the database server, especially if they\u2019re called frequently within large datasets.\n3. **Non-Optimized Queries**: If the queries utilizing custom functions are not optimized, they can result in long execution times. Use profiling and analyze query performance often.\n4. **Lack of Caching**: If your custom function does not leverage caching (e.g., for results of certain computations), you may end up querying the database repeatedly for the same data, leading to performance bottlenecks.\nTo mitigate these issues, profiling your queries, optimizing function logic, and ensuring proper indexing in the database are key strategies.""}]",knowledge/php/symfony-docs-7.1,1.0,train
"[{""from"": ""human"", ""value"": ""Can you explain the structure of a DQL function in Symfony?""}, {""from"": ""gpt"", ""value"": ""The structure of a DQL function in Symfony is defined mainly within a PHP class that extends the `FunctionNode` class from Doctrine. Here's how the structure typically looks:\n1. **Namespace Declaration**: Your function class should be contained within a proper namespace, for example, `App\\DQL`.\n2. **Class Declaration**: Extend the `FunctionNode` class from Doctrine's ORM and implement required methods like `parse()` and `dispatch()`.\n3. **Parsing Logic**: In the `parse()` method, handle the parsing of incoming arguments from the DQL query. For instance, this method should retrieve and store the arguments passed by the user.\n4. **Dispatch Logic**: In the `dispatch()` method, define how the arguments will be processed and converted into SQL, as this is where the transformation to actual SQL syntax occurs.\nHere\u2019s a simple example:\n```php\nclass MyFunction extends FunctionNode\n{\n    public Node \\$firstArgument = null;\n    public Node \\$secondArgument = null;\n\n    public function parse(Parser \\$parser): void\n    {\n        // Parsing logic here\n    }\n\n    public function dispatch(SqlWalker \\$sqlWalker)\n    {\n        // Dispatching logic here\n    }\n}\n```""}]",knowledge/php/symfony-docs-7.1,1.0,train
"[{""from"": ""human"", ""value"": ""What will happen if you try to register DQL functions improperly?""}, {""from"": ""gpt"", ""value"": ""If you attempt to register DQL functions improperly, Symfony will throw an exception indicating that the configuration is incorrect. For example, if you fail to specify the `dql` configuration block under the appropriate entity manager name in your YAML or XML configuration, you'll encounter the error \""Unrecognized option 'dql' under 'doctrine.orm'\"". This means that Symfony does not recognize the provided configuration and cannot process the DQL functions as expected. Proper configuration is crucial for the functioning of custom DQL functions, so it is essential to follow the outlined structures in Symfony documentation to avoid such errors.""}]",knowledge/php/symfony-docs-7.1,1.0,train
"[{""from"": ""human"", ""value"": ""What is the relationship between DQL functions and Doctrine Query Language?""}, {""from"": ""gpt"", ""value"": ""The relationship between DQL functions and Doctrine Query Language (DQL) lies in the fact that DQL functions are essentially extensions of DQL, allowing developers to define new functions that can be used in DQL queries. DQL itself is designed for querying databases using an object-oriented syntax that closely resembles SQL but is tailored to work with Doctrine's ORM. By creating custom DQL functions, developers can expand the capabilities of DQL, implementing domain-specific logic directly in queries that the ORM can understand. This integration enhances the expressiveness of queries and allows for more complex operations to be performed seamlessly within the ORM's context.""}]",knowledge/php/symfony-docs-7.1,1.0,train
"[{""from"": ""human"", ""value"": ""What best practices should be followed when creating custom DQL functions?""}, {""from"": ""gpt"", ""value"": ""When creating custom DQL functions in Symfony, the following best practices should be adhered to:\n1. **Keep Functions Simple**: Ensure that your custom DQL functions are straightforward and well-defined. Complex functions can lead to maintenance challenges and potential performance issues.\n2. **Validate Inputs**: Implement validation logic within your function to handle invalid inputs gracefully, preventing runtime errors and unexpected behavior.\n3. **Follow Naming Conventions**: Use clear and consistent naming conventions for your DQL functions to ensure that they are easily recognizable and their purpose is understood.\n4. **Proper Logging**: Consider implementing logging to track usage and identify any issues that arise during execution, which can be invaluable for debugging.\n5. **Document Your Functions**: Write documentation for each custom DQL function explaining its purpose, parameters, return values, and any edge cases that need to be considered to aid future developers.\nBy following these guidelines, you help ensure that your custom DQL functions are robust and maintainable.""}]",knowledge/php/symfony-docs-7.1,1.0,train
"[{""from"": ""human"", ""value"": ""Can custom DQL functions be used for database migrations? Why or why not?""}, {""from"": ""gpt"", ""value"": ""Custom DQL functions should not be used in database migrations. Migrations typically depend on the lower-level SQL syntax directly, and introducing DQL functions can complicate the migration process, as DQL is an abstraction over the underlying SQL dialect. Moreover, since DQL queries are executed at runtime and might not be recognized by the database during migration, it may lead to unexpected behavior or errors. Therefore, it's best to rely on standard SQL statements or available database functions during migrations to ensure compatibility and reliability.""}]",knowledge/php/symfony-docs-7.1,1.0,train
"[{""from"": ""human"", ""value"": ""What are the implications of using DQL functions in criteria queries?""}, {""from"": ""gpt"", ""value"": ""Using DQL functions in criteria queries can have several implications:\n1. **Performance Consideration**: Since criteria queries are transformed into DQL and then into SQL, using custom DQL functions can potentially affect performance based on how the underlying SQL is generated and executed.\n2. **Query Complexity**: Integrating DQL functions can make queries more complex and harder to read or understand, especially for anyone unfamiliar with the custom logic you\u2019ve implemented.\n3. **Limitations of Criteria API**: The Criteria API is primarily intended for creating simpler queries using object-oriented syntax. When DQL functions are incorporated, it might require additional handling which could defeat the purpose of using the Criteria API in the first place.\n4. **Testing and Debugging**: Debugging criteria queries involving DQL functions can become trickier, making it necessary to ensure that both the function itself and the criteria logic are functioning as expected.""}]",knowledge/php/symfony-docs-7.1,1.0,train
"[{""from"": ""human"", ""value"": ""Can DQL functions be used in conjunction with the QueryBuilder? How?""}, {""from"": ""gpt"", ""value"": ""Yes, DQL functions can be used in conjunction with Doctrine's QueryBuilder. Quilder allows you to build complex queries programmatically using an object-oriented approach. You can easily integrate custom DQL functions within the QueryBuilder like this:\n\n1. **Using Custom DQL Functions with QueryBuilder**:\n```php\n$queryBuilder = $entityManager->createQueryBuilder();\n$queryBuilder->select('e')\n    ->from('App\\Entity\\Employee', 'e')\n    ->where('my_custom_function(e.firstName, e.lastName) = :fullName')\n    ->setParameter('fullName', 'John Doe');\n$result = $queryBuilder->getQuery()->getResult();\n```\n\nIn this example, `my_custom_function` is called within the `where` clause of the query, demonstrating how you can leverage the custom function directly within the QueryBuilder's fluent interface. This allows for more dynamic and expressive query creation.""}]",knowledge/php/symfony-docs-7.1,1.0,train
