conversations,source,score,split
"[{""from"": ""human"", ""value"": ""What is the main advantage of using autowiring in Symfony?""}, {""from"": ""gpt"", ""value"": ""The main advantage of using autowiring in Symfony is that it simplifies service management by automatically injecting dependencies based on type-hints. This minimizes configuration overhead, allowing developers to focus on coding rather than configuration. With autowiring, services can be used immediately without requiring explicit service definitions in configuration files, thus streamlining the development process. Moreover, Symfony's compiled container ensures that there is no runtime overhead when using autowiring, making it both efficient and predictable.""}]",knowledge/php/symfony-docs-7.1,1.0,train
"[{""from"": ""human"", ""value"": ""Can you provide an example of how to implement autowiring with a custom class in Symfony?""}, {""from"": ""gpt"", ""value"": ""Certainly! Below is a step-by-step example showing how to implement autowiring with a custom class in Symfony using the `Rot13Transformer` and `TwitterClient` classes. \n\nFirst, create the `Rot13Transformer` class that will handle the ROT13 transformation:\n```php\n// src/Util/Rot13Transformer.php\nnamespace App\\Util;\n\nclass Rot13Transformer\n{\n    public function transform(string $value): string\n    {\n        return str_rot13($value);\n    }\n}\n```\nNext, create the `TwitterClient` class that uses the transformer:\n```php\n// src/Service/TwitterClient.php\nnamespace App\\Service;\n\nuse App\\Util\\Rot13Transformer;\n\nclass TwitterClient\n{\n    public function __construct(private Rot13Transformer $transformer) {}\n\n    public function tweet(User $user, string $key, string $status): void\n    {\n        $transformedStatus = $this->transformer->transform($status);\n        // ... logic to send the tweet\n    }\n}\n```\nWith autowiring configured (the default in Symfony), both classes automatically become services. You can immediately use the `TwitterClient` in a controller like this:\n```php\n// src/Controller/DefaultController.php\nnamespace App\\Controller;\n\nuse App\\Service\\TwitterClient;\nuse Symfony\\Bundle\\FrameworkBundle\\Controller\\AbstractController;\nuse Symfony\\Component\\HttpFoundation\\Request;\nuse Symfony\\Component\\HttpFoundation\\Response;\nuse Symfony\\Component\\Routing\\Annotation\\Route;\n\nclass DefaultController extends AbstractController\n{\n    #[Route('/tweet')]\n    public function tweet(TwitterClient $twitterClient, Request $request): Response\n    {\n        // Assume $user, $key, and $status are fetched from the request\n        $twitterClient->tweet($user, $key, $status);\n        // Return a response after tweeting\n    }\n}\n```\nThis example illustrates how simple it is to set up and utilize services within Symfony using autowiring.""}]",knowledge/php/symfony-docs-7.1,1.0,train
"[{""from"": ""human"", ""value"": ""What should you do if you have multiple implementations of the same interface when using autowiring?""}, {""from"": ""gpt"", ""value"": ""When you have multiple implementations of the same interface, Symfony's autowiring cannot decide which implementation to use, as it looks for a service whose ID matches the type-hint. To resolve this ambiguity, you should configure an alias for the interface that points to one of the implementations you want to use by default. Additionally, you can create named autowiring aliases for specific cases where you need to specify a different implementation. \n\nFor example, suppose you have the following two transformers implementing the same interface `TransformerInterface`:\n```php\n// src/Util/Rot13Transformer.php\nnamespace App\\Util;\n\nclass Rot13Transformer implements TransformerInterface\n{\n    public function transform(string $value): string\n    {\n        return str_rot13($value);\n    }\n}\n\n// src/Util/UppercaseTransformer.php\nnamespace App\\Util;\n\nclass UppercaseTransformer implements TransformerInterface\n{\n    public function transform(string $value): string\n    {\n        return strtoupper($value);\n    }\n}\n```\nYou can configure your services as follows in `services.yaml`:\n```yaml\nservices:\n    App\\Util\\Rot13Transformer: ~\n    App\\Util\\UppercaseTransformer: ~\n\n    App\\Util\\TransformerInterface: '@App\\Util\\Rot13Transformer'\n    App\\Util\\TransformerInterface $shoutyTransformer: '@App\\Util\\UppercaseTransformer'\n```\nIn this configuration, the `Rot13Transformer` will be injected wherever `TransformerInterface` is type-hinted, and for any argument named `$shoutyTransformer`, the `UppercaseTransformer` will be injected instead. This way, you can control which implementation is used in specific contexts, facilitating flexibility within your codebase.""}]",knowledge/php/symfony-docs-7.1,1.0,train
"[{""from"": ""human"", ""value"": ""How does Symfony ensure that autowiring works correctly in different service definitions?""}, {""from"": ""gpt"", ""value"": ""Symfony ensures that autowiring works correctly by relying on is ID matching the class name or its alias. When a service is registered in Symfony's service container, the ID of the service typically matches its class name. This allows the autowiring system to look for a service whose ID exactly matches the type-hint provided in the constructor or method parameter. If the match is found, Symfony automatically injects the corresponding service without any additional configuration required.\n\nFor example, consider the following classes:\n```php\n// src/Service/TwitterClient.php\nnamespace App\\Service;\nuse App\\Util\\Rot13Transformer;\n\nclass TwitterClient\n{\n    public function __construct(private Rot13Transformer $transformer) {}\n}\n```\nIn this code, Symfony finds that `Rot13Transformer` matches the constructor parameter type-hint. If the container is configured properly to have `App\\Util\\Rot13Transformer` registered as a service, Symfony can seamlessly autowire the dependency.\n\nIf a specific implementation is not found for the type-hint, Symfony throws a clear exception, indicating that it cannot resolve the dependency. This predictable behavior reinforces the notion that Symfony's autowiring does not involve any magic\u2014it's purely based on matching class names to their IDs in the service container, leading to straightforward debugging if things go wrong.""}]",knowledge/php/symfony-docs-7.1,1.0,train
"[{""from"": ""human"", ""value"": ""Explain how you would manually wire a scalar argument in a Symfony service.""}, {""from"": ""gpt"", ""value"": ""In Symfony, manual wiring is necessary when you want to inject scalar arguments (such as strings, integers, or booleans) into a service constructor since autowiring only works with object types (services). \n\nTo manually wire a scalar argument, you can specify the arguments explicitly in your service configuration using the `arguments` key. Here's an example:\n\n```php\n// src/Service/MessageGenerator.php\nnamespace App\\Service;\n\nclass MessageGenerator\n{\n    public function __construct(private string $dataDir) {}\n}\n```\n\nIf you want to inject a directory path as `dataDir` in your service, you would configure the service in a configuration file as follows:\n\n```yaml\n# config/services.yaml\nservices:\n    App\\Service\\MessageGenerator:\n        arguments:\n            $dataDir: '%kernel.project_dir%/data'\n```\n\nIn this example:\n- We define the `MessageGenerator` service in `services.yaml` and specify that the `$dataDir` parameter should be set to the value of the `kernel.project_dir` parameter concatenated with `/data`.\n- This way, the scalar argument is explicitly wired, allowing Symfony to successfully instantiate the service without autowiring.""}]",knowledge/php/symfony-docs-7.1,1.0,train
"[{""from"": ""human"", ""value"": ""What should you consider when using autowiring in public and reusable Symfony bundles?""}, {""from"": ""gpt"", ""value"": ""When using autowiring in public and reusable Symfony bundles, it's essential to consider the following:\n1. **Explicit Configuration**: Public bundles should avoid relying heavily on autowiring. Instead, it\u2019s advisable to explicitly configure services within the bundle. This ensures compatibility with different applications that might use your bundle, as they may have varying configurations and services.\n\n2. **Service Availability**: Since public bundles cannot control the service container configurations of the host application, relying on autowiring could lead to issues if the required services are not registered in the host application's container. Therefore, ensure that all dependencies are clear and that fallback mechanisms are in place if dependencies are not met.\n\n3. **Documentation**: Provide comprehensive documentation for the end-users regarding which services are available, how to configure them, and any necessary alternatives if autowiring does not suit the use case. This aids the developers using the bundle to set up their applications correctly.\n\n4. **Testing**: Validate the bundle's functionality thoroughly in different Symfony application environments to ensure that services autowire as expected and that there are no hidden dependencies or configuration issues.\n\n5. **Custom Configuration**: Allow users of the bundle to publish configuration files and override default values where possible to enhance flexibility and adaptability to various project needs.\n\nBy considering these factors, you can create a public and reusable Symfony bundle that is robust, flexible, and easy to integrate into different applications.""}]",knowledge/php/symfony-docs-7.1,1.0,train
"[{""from"": ""human"", ""value"": ""Can you describe how to use the #[Autowire] attribute for non-object constructor arguments in Symfony?""}, {""from"": ""gpt"", ""value"": ""In Symfony, the `#[Autowire]` attribute can be utilized to specify non-object constructor arguments such as strings, booleans, or integers. This allows for a more elegant configuration while using the autowiring system. Here\u2019s a breakdown of how to implement this:\n\n1. **Basic Constructor Setup**: Create a service class where you want to inject non-object parameters.\n\n```php\n// src/Service/MessageGenerator.php\nnamespace App\\Service;\n\nclass MessageGenerator\n{\n    public function __construct(\n        #[Autowire('%kernel.project_dir%/data')]...\n    ) {}\n}\n```\n\nIn this example, we want to inject `kernel.project_dir/data` as a string (scalar) into the constructor. \n\n2. **Auto-Wire with Parameters**: With `#[Autowire]`, you define which parameter is injected by specifying its value or the configuration key.\n\n```php\nnamespace App\\Service;\n\nuse Symfony\\Component\\DependencyInjection\\Attribute\\Autowire;\n\nclass MessageGenerator\n{\n    public function __construct(\n        #[Autowire('%kernel.project_dir%/data')] string $dataDir\n    ) {}\n}\n```\n\n3. **Injecting Other Non-Objects**: You can also inject other non-object types in the same way. For example, if you want to inject an integer from the parameters:\n\n```php\nnamespace App\\Service;\n\nclass MessageGenerator\n{\n    public function __construct(\n        #[Autowire(param: 'kernel.debug')] bool $debugMode\n    ) {}\n}\n```\n\nThis enables Symfony to resolve the value provided for parameters dynamically, making the setup cleaner and allowing developers to leverage the powerful configuration that Symfony provides by using `#[Autowire]` on scalar arguments.""}]",knowledge/php/symfony-docs-7.1,1.0,train
"[{""from"": ""human"", ""value"": ""How does Symfony's autowiring handle the scenario where there are no matching services for a type-hinted class?""}, {""from"": ""gpt"", ""value"": ""When Symfony's autowiring encounters a type-hinted class for which there is no matching service, it results in a clear exception being thrown. This behavior ensures that developers are immediately notified of the missing dependency, allowing them to address the issue without ambiguity.\n\nFor example, suppose you have a class with a constructor type-hint that does not correspond to any service in the container:\n```php\n// src/Service/UnavailableService.php\nnamespace App\\Service;\n\nclass UnavailableService {}\n\n// src/Service/ExampleClient.php\nnamespace App\\Service;\n\nclass ExampleClient\n{\n    public function __construct(private UnavailableService $unavailableService) {}\n}\n```\n\nWhen Symfony attempts to autowire `ExampleClient`, it will search for a service ID matching `UnavailableService`. Since there is none, Symfony will throw a `Symfony\\Component\\DependencyInjection\\Exception\\ServiceNotFoundException`. This exception will provide information about the missing service, indicating to the developer that `UnavailableService` must either be registered or the type-hint changed.""}]",knowledge/php/symfony-docs-7.1,1.0,train
"[{""from"": ""human"", ""value"": ""Illustrate how to create a named autowiring alias for a service in Symfony.""}, {""from"": ""gpt"", ""value"": ""Creating a named autowiring alias in Symfony allows you to specify which service implementation to use for a particular constructor argument based on naming conventions. Here\u2019s how you can establish a named autowiring alias:\n\n1. **Create the Services**: Assume you have two implementations of the same interface:\n```php\n// src/Util/Rot13Transformer.php\nnamespace App\\Util;\n\nclass Rot13Transformer implements TransformerInterface\n{\n    public function transform(string $value): string\n    {\n        return str_rot13($value);\n    }\n}\n\n// src/Util/UppercaseTransformer.php\nnamespace App\\Util;\n\nclass UppercaseTransformer implements TransformerInterface\n{\n    public function transform(string $value): string\n    {\n        return strtoupper($value);\n    }\n}\n```\n\n2. **Configure the Services**: Use the services configuration file (`services.yaml`) to register services and create aliases:\n```yaml\nservices:\n    App\\Util\\Rot13Transformer: ~\n    App\\Util\\UppercaseTransformer: ~\n\n    # Named autowiring alias for a specific argument\n    App\\Util\\TransformerInterface $shoutyTransformer: '@App\\Util\\UppercaseTransformer'\n    App\\Util\\TransformerInterface: '@App\\Util\\Rot13Transformer'\n```\n\nHere, the `$shoutyTransformer` argument in any service requiring `TransformerInterface` will be resolved to `UppercaseTransformer`, while other instances requiring `TransformerInterface` will get the `Rot13Transformer` as the default implementation.\n\n3. **Usage in a Service**: Use the `TransformerInterface` in another service:\n```php\n// src/Service/MastodonClient.php\nnamespace App\\Service;\n\nuse App\\Util\\TransformerInterface;\n\nclass MastodonClient\n{\n    public function __construct(private TransformerInterface $shoutyTransformer) {}\n}\n```\n\nWith this setup, Symfony knows to inject the `UppercaseTransformer` whenever a `$shoutyTransformer` argument is encountered, while maintaining the flexibility to use multiple implementations of the same interface.""}]",knowledge/php/symfony-docs-7.1,1.0,train
"[{""from"": ""human"", ""value"": ""What are the benefits of using the `#[Target]` autowiring attribute in Symfony?""}, {""from"": ""gpt"", ""value"": ""The `#[Target]` attribute in Symfony's autowiring system offers several benefits, particularly in managing dependencies that may implement interfaces or depend on specific service aliases. Here are some of the key advantages of utilizing this attribute:\n\n1. **Fine-Grained Control**: By using the `#[Target]` attribute, developers can specify exactly which service to inject, regardless of the constructor argument name. This allows for more explicit service definition within the codebase where multiple implementations of an interface exist.\n\n2. **Decoupling from Implementation Names**: It allows developers to avoid coupling the class properties to a specific implementation name. This enables easier refactoring and improved code maintainability, as changing the underlying implementation does not necessitate changing the host service's constructor signature.\n\n3. **Clarity**: When reading the code, it is immediately evident which service will be injected for a given property. This leads to better readability and understanding of the dependencies that are being utilized.\n\n4. **Support for Multiple Implementations**: The `#[Target]` attribute facilitates scenarios involving interface-based design where multiple implementations exist. Developers can utilize this attribute to clearly specify which implementation should be instantiated for each property.\n\n5. **Integration with Attributes**: This feature is part of Symfony's attribute-based configuration approach, allowing developers to leverage the simplicity of PHP attributes while working closely with the service container.""}]",knowledge/php/symfony-docs-7.1,1.0,train
"[{""from"": ""human"", ""value"": ""What is the role of the `#[AutowireCallable]` attribute in Symfony, and how is it used?""}, {""from"": ""gpt"", ""value"": ""The `#[AutowireCallable]` attribute in Symfony serves the purpose of allowing the injection of a closure that matches the signature of a specific method of a service. This enables developers to create closures for long-lived services where the same instance is reused for repeated calls, and provides a mechanism to lazily load dependencies. Here is how it is used:\n\n1. **Defining the Service**: Create a service class that has a method which you want to call via closure.\n\n```php\n// src/Service/Remote/MessageFormatter.php\nnamespace App\\Service\\Remote;\n\nclass MessageFormatter\n{\n    public function format(string $message): string\n    {\n        return \""Formatted message: \"" . $message;\n    }\n}\n```\n\n2. **Using AutowireCallable**: Inject the callable into another service using the `#[AutowireCallable]` attribute. It allows the closure to be invoked with the same parameters as the original service method:\n\n```php\n// src/Service/MessageGenerator.php\nnamespace App\\Service;\n\nuse App\\Service\\Remote\\MessageFormatter;\nuse Symfony\\Component\\DependencyInjection\\Attribute\\AutowireCallable;\n\nclass MessageGenerator\n{\n    public function __construct(\n        #[AutowireCallable(service: 'third_party.remote_message_formatter', method: 'format')] private \\Closure $formatCallable,\n    ) {}\n\n    public function generate(string $message): void\n    {\n        $formattedMessage = ($this->formatCallable)($message);\n        // ... logic using the formatted message\n    }\n}\n```\n\nIn this example, the `MessageGenerator` class can leverage the `format` method of `MessageFormatter` by calling the injected closure, thereby reducing the coupling between the two classes and enabling easier mock testing and maintenance. The closure can be called multiple times, reusing the same instance of the `MessageFormatter` service.""}]",knowledge/php/symfony-docs-7.1,1.0,train
"[{""from"": ""human"", ""value"": ""Explain how to configure Symfony services for lazy loading.""}, {""from"": ""gpt"", ""value"": ""To configure Symfony services for lazy loading, you typically utilize:\n\n1. **Service Definitions**: Services can be defined as lazy-loaded in the configuration files. You can use the `lazy` attribute within the service definition. Here is how it can be done in YAML:\n```yaml\n# config/services.yaml\nservices:\n    App\\Service\\SomeService:\n        lazy: true\n```\nThis would ensure that `SomeService` is not instantiated until it's needed (i.e., when it is used for the first time).\n\n2. **Lazy Services by Default**: If you want to make all services lazy by default, you can set it globally. You can do this by specifying the `default` settings in `services.yaml`:\n```yaml\n# config/services.yaml\nservices:\n    _defaults:\n        lazy: true\n```\n3. **Usage of Lazy Autowiring**: When autowiring services that might incur performance costs or delay service instantiation, you can mark them as lazy. This reduces the initial overhead and speeds up the application bootstrapping.\n\n4. **Lazy Initialization**: If a service is dependent on heavy resources, you can wrap its instantiation logic in a closure using the `#[AutowireServiceClosure]` attribute, which returns an instance of a service when called. This allows for even more granular control over when resources are allocated.\n\nExample of wrapping a service for lazy initialization:\n```php\n// src/Service/SomeService.php\nnamespace App\\Service;\n\nuse Symfony\\Component\\DependencyInjection\\Attribute\\AutowireServiceClosure;\n\nclass SomeService\n{\n    public function __construct(\n        #[AutowireServiceClosure('some.lazy.service')]\n        private \\Closure $serviceClosure,\n    ) {}\n}\n\n// src/SomeController.php\n// Usage\n$service = ($this->serviceClosure)();\n```\nBy leveraging these techniques, you can significantly improve the performance of your Symfony applications through efficient resource management with lazy loading.""}]",knowledge/php/symfony-docs-7.1,1.0,train
