conversations,source,score,split
"[{""from"": ""human"", ""value"": ""What is the purpose of a service configurator in a PHP application?""}, {""from"": ""gpt"", ""value"": ""A service configurator in a PHP application is used to allow a callable function to configure a service after its instantiation. This is particularly useful for services requiring complex setup or settings coming from multiple sources. By utilizing a configurator, the service's implementation remains clean and decoupled from the objects that provide the necessary configuration. This abstraction makes it easier to manage and change configurations independently of the service itself.""}]",knowledge/php/symfony-docs-7.1,1.0,train
"[{""from"": ""human"", ""value"": ""How does the service configurator enhance code quality?""}, {""from"": ""gpt"", ""value"": ""The service configurator enhances code quality by adhering to the single responsibility principle, which states that a class should have one reason to change. By separating the configuration logic from the service itself, the service can focus on its primary responsibilities, thus minimizing dependencies on configuration details. This decoupling improves maintainability, testability, and readability of the code.""}]",knowledge/php/symfony-docs-7.1,1.0,train
"[{""from"": ""human"", ""value"": ""Can you provide an example of a service configurator implementation in Symfony?""}, {""from"": ""gpt"", ""value"": ""Certainly! In Symfony, you can implement a service configurator by creating a dedicated class that handles the configuration. For instance, consider the following classes for email management:\n\n1. The `EmailFormatterManager` class provides the enabled formatters.\n2. The `EmailConfigurator` class serves as a service configurator to set formatters into the email managers.\n\nHere's an example based on the document:\n\n```php\n// src/Mail/EmailConfigurator.php\nnamespace App\\Mail;\n\nclass EmailConfigurator\n{\n    public function __construct(\n        private EmailFormatterManager $formatterManager,\n    ) {\n    }\n\n    public function configure(EmailFormatterAwareInterface $emailManager): void\n    {\n        $emailManager->setEnabledFormatters(\n            $this->formatterManager->getEnabledFormatters()\n        );\n    }\n}\n```\nIn your service configuration (e.g., services.yaml), you can specify the configurator like this:\n\n```yaml\nApp\\Mail\\NewsletterManager:\n    configurator: ['@App\\Mail\\EmailConfigurator', 'configure']\n\nApp\\Mail\\GreetingCardManager:\n    configurator: ['@App\\Mail\\EmailConfigurator', 'configure']\n```\nWhen either `NewsletterManager` or `GreetingCardManager` is instantiated, it will automatically be configured by the `EmailConfigurator`.""}]",knowledge/php/symfony-docs-7.1,1.0,train
"[{""from"": ""human"", ""value"": ""What are the considerations when using class methods versus callable functions in configurators?""}, {""from"": ""gpt"", ""value"": ""When using class methods versus callable functions in service configurators, consider the following factors:\n1. **Complexity**: Class methods can encapsulate more complex logic and maintain state, while functions are generally better for simpler, stateless configurations.\n2. **Reusability**: If the configuration logic is meant to be reused across different services, encapsulating it within a class (like a configurator) may provide better organization and maintainability.\n3. **Dependency Injection**: Class methods allow the use of dependency injection, making it easier to manage dependencies and adhere to best practices in Symfony, such as keeping services decoupled and focused.\n4. **Simplicity**: For straightforward configurations, using a callable function may be quicker to implement and easier to understand. This can be beneficial for smaller projects.\n5. **Overhead**: Class instantiation might introduce additional overhead. If performance is a concern and configurators are heavily used, this may guide the decision towards more lightweight callable functions.""}]",knowledge/php/symfony-docs-7.1,1.0,train
"[{""from"": ""human"", ""value"": ""What is the role of the EmailFormatterManager in the example?""}, {""from"": ""gpt"", ""value"": ""The role of the `EmailFormatterManager` class in the provided example is to manage the loading, validation, and retrieval of enabled email formatters required by email managers. This class acts as a central authority that encapsulates the logic for determining which formatters are available and should be used at runtime based on the configuration settings. By doing so, it prevents the `NewsletterManager` and `GreetingCardManager` classes from being tightly coupled to the configuration details, thus supporting the principle of single responsibility and enhancing code modularity.""}]",knowledge/php/symfony-docs-7.1,1.0,train
"[{""from"": ""human"", ""value"": ""Explain the configurator option for services in Symfony's services.yaml.""}, {""from"": ""gpt"", ""value"": ""The `configurator` option in Symfony's `services.yaml` allows developers to specify a callable that will be invoked to configure the service after it has been instantiated. This option can take both a service and a method name. For instance, when configuring a service like `NewsletterManager`, you can set its configurator to the `EmailConfigurator` like this:\n\n```yaml\nApp\\Mail\\NewsletterManager:\n    configurator: ['@App\\Mail\\EmailConfigurator', 'configure']\n```\nThis configuration states that after the `NewsletterManager` service is created, Symfony should call the `configure` method of the `EmailConfigurator` service, passing in the `NewsletterManager` instance as an argument. This setup provides flexibility in configuring services based on application state or runtime conditions, without altering the internal structure of the services themselves.""}]",knowledge/php/symfony-docs-7.1,1.0,train
"[{""from"": ""human"", ""value"": ""What are the benefits of using invokable configurators?""}, {""from"": ""gpt"", ""value"": ""Invokable configurators provide several benefits in Symfony service configuration:\n1. **Simplicity**: By allowing the use of the `__invoke` method, you can eliminate the need to specify the method name when defining the configurator. This reduces verbosity and makes the configuration files neater.\n\n   Example:\n   ```yaml\n   App\\Mail\\NewsletterManager:\n       configurator: '@App\\Mail\\EmailConfigurator'\n   ```\n2. **Ease of Use**: Invokable configurators can be easier to use for developers because they allow objects to be treated as functions, simplifying the process of setting up service configurations.\n3. **Enhanced Readability**: The syntax becomes cleaner and readers can immediately understand that the purpose of the class is to configure the service.\n4. **Centralized Configuration Logic**: Invokable classes can contain any configurable logic, leading to better organization and portability within the application as the focus shifts directly to the service behaviors.""}]",knowledge/php/symfony-docs-7.1,1.0,train
"[{""from"": ""human"", ""value"": ""Provide an example of how to register services using the service configurator in PHP.""}, {""from"": ""gpt"", ""value"": ""To register services using the service configurator in PHP, you can use the `ContainerConfigurator` class provided by Symfony. Here\u2019s an example of how to do that:\n\n```php\n// config/services.php\nnamespace Symfony\\Component\\DependencyInjection\\Loader\\Configurator;\n\nuse App\\Mail\\EmailConfigurator;\nuse App\\Mail\\GreetingCardManager;\nuse App\\Mail\\NewsletterManager;\n\nreturn function(ContainerConfigurator $container): void {\n    $services = $container->services();\n    \n    // Loads all classes from the App directory as services\n    $services->load('App\\', '../src/*');\n\n    // Configures the NewsletterManager with EmailConfigurator\n    $services->set(NewsletterManager::class)\n             ->configurator([service(EmailConfigurator::class), 'configure']);\n\n    // Configures the GreetingCardManager with EmailConfigurator\n    $services->set(GreetingCardManager::class)\n             ->configurator([service(EmailConfigurator::class), 'configure']);\n};\n```\nThis code snippet demonstrates how to define a service configurator directly in PHP, where the `EmailConfigurator`\u2019s `configure` method sets up instances of both `NewsletterManager` and `GreetingCardManager` via dependency injection.""}]",knowledge/php/symfony-docs-7.1,1.0,train
"[{""from"": ""human"", ""value"": ""What is the potential impact of using a service configurator on application performance?""}, {""from"": ""gpt"", ""value"": ""Using a service configurator can have varying impacts on application performance, and several factors should be considered:\n1. **Instantiation Overhead**: Each time a service is created with a configurator, there is a slight delay due to the additional method call for configuration after instantiation. In high-latency systems, this might accumulate, leading to noticeable performance degradation if many services are configured this way.\n\n2. **Complexity of the Configuration Logic**: If the logic within the configurator is complex or requires multiple resource-intensive operations, it can temporarily slow down service instantiation. Therefore, it\u2019s essential that configurators remain efficient and focused on the task at hand.\n\n3. **Caching**: Symfony caches services and their configurations. This means that once a service is instantiated, future requests may not incur the overhead of running the configurator again. Utilizing effective caching strategies can mitigate potential negative impacts on performance.\n\n4. **Concurrency**: In a microservices architecture, configuring services dynamically based on runtime information can introduce bottlenecks if not designed to handle concurrent configurations properly.\n\nTo summarize, while there may be some performance overhead associated with using service configurators, if implemented wisely and efficiently, their advantages in terms of maintainability and flexibility often outweigh the downsides.""}]",knowledge/php/symfony-docs-7.1,1.0,train
"[{""from"": ""human"", ""value"": ""How can configurators maintain clean architecture in a Symfony application?""}, {""from"": ""gpt"", ""value"": ""Configurators contribute to clean architecture in a Symfony application by separating the configuration concerns from the business logic of services. Here are several ways they achieve this:\n1. **Single Responsibility**: By using configurators, the services can focus on their core functionality without worrying about how they are configured. This follows the single responsibility principle, which encourages a clean separation of concerns.\n2. **Decoupled Architecture**: Configurators allow services to be decoupled from their configuration. Each service can operate independently, leading to a more modular and easily testable code base. This is particularly important in larger applications where business logic can become entangled with configuration details.\n3. **Enhanced Testability**: By injecting configuration via configurators, services can be tested with different configurations without changing their internal structure. This leads to easier unit testing and better design practices.\n4. **Flexibility**: As application requirements evolve, configurators can be modified or extended without affecting the services themselves. This promotes adaptability in a changing environment and supports the principles of clean architecture.""}]",knowledge/php/symfony-docs-7.1,1.0,train
"[{""from"": ""human"", ""value"": ""What are the steps to create and use a service configurator in Symfony?""}, {""from"": ""gpt"", ""value"": ""Creating and using a service configurator in Symfony involves several steps:\n1. **Create the Configurator Class**: Define a class responsible for configuring your services. For example, `EmailConfigurator` may have a method to set enabled formatters.\n   ```php\n   // src/Mail/EmailConfigurator.php\n   namespace App\\Mail;\n\n   class EmailConfigurator\n   {\n       public function __construct(private EmailFormatterManager $formatterManager) {}\n\n       public function configure(EmailFormatterAwareInterface $emailManager): void\n       {\n           $emailManager->setEnabledFormatters($this->formatterManager->getEnabledFormatters());\n       }\n   }\n   ```\n2. **Define the Configuration in services.yaml or services.php**: Specify the use of the configurator in your service configuration.\n   ```yaml\n   App\\Mail\\NewsletterManager:\n       configurator: ['@App\\Mail\\EmailConfigurator', 'configure']\n   ```\n3. **Instantiate Services**: When Symfony instantiates your services like `NewsletterManager` or `GreetingCardManager`, it will invoke the configurator\u2019s `configure` method, injecting the correctly configured dependencies.\n4. **Testing and Validating**: Ensure the configurators are functioning as expected through unit tests. This checks that the services are correctly configured based on application requirements.\nBy following these steps, you can effectively use a service configurator in Symfony, promoting cleaner code, separation of concerns, and enhanced maintainability.""}]",knowledge/php/symfony-docs-7.1,1.0,train
"[{""from"": ""human"", ""value"": ""How does using configurators in Symfony promote the open/closed principle?""}, {""from"": ""gpt"", ""value"": ""Using configurators in Symfony promotes the Open/Closed Principle (OCP) by allowing services to be open for extension but closed for modification. Here\u2019s how:\n1. **Extending Functionality**: When you want to change how services are configured or add new configuration logic, you can do so by creating new configurator classes without altering the existing service definitions. For instance, if new types of email formatters are added, a new configurator can be created to handle those.\n\n2. **Decoupling Services**: Since services rely on configurators for their configuration, any changes in the configuration process don\u2019t require changes to the services themselves. This keeps the service code clean and allows it to operate independently of how it's set up.\n\n3. **Supporting Changes**: When application requirements evolve, new configurators can be implemented to adapt to those requirements while keeping existing services intact. This adaptation thus meets the OCP by enabling new behaviors externally rather than forcing changes within the existing system.\nIn summary, using configurators makes it easier to adapt and extend functionality without modifying existing services, thereby fulfilling the Open/Closed Principle in software design.""}]",knowledge/php/symfony-docs-7.1,1.0,train
"[{""from"": ""human"", ""value"": ""What is the rationale behind using a configurator pattern in software architecture?""}, {""from"": ""gpt"", ""value"": ""The rationale behind using a configurator pattern in software architecture is to achieve better separation of concerns, modularity, and maintainability of the code. Here's an in-depth look at its benefits:\n1. **Separation of Concerns**: By abstracting configuration logic away from business logic, configurators ensure that each class or component focuses on its primary responsibilities. This leads to cleaner and more understandable code.\n\n2. **Modularity**: Configurators allow individual classes to be self-sufficient while relying on external components to manage their configuration. This makes it easier to change configuration without affecting the core functionality of the service.\n\n3. **Flexibility and Reusability**: Configurator classes can be reused across different services, promoting DRY principles and allowing for better consistency in how configurations are applied throughout the application.\n\n4. **Improved Testability**: The ability to inject different configurations makes services easier to test, as developers can simulate various scenarios without altering the underlying services themselves.\n\n5. **Less Coupling**: Using the configurator pattern leads to designs where components are less dependent on specific implementations, enabling developers to substitute or modify configuration strategies without extensive rewrites.\nIn summary, the configurator pattern results in a more flexible, maintainable, and clean software architecture.""}]",knowledge/php/symfony-docs-7.1,1.0,train
"[{""from"": ""human"", ""value"": ""Can configurators be used with services that have dependencies? How?""}, {""from"": ""gpt"", ""value"": ""Yes, configurators can indeed be used with services that have dependencies. In fact, one of the primary reasons for using configurators is to manage the configuration of services that depend on various resources or objects. Here\u2019s how it works:\n1. **Dependency Injection**: When you define a configurator, you can inject dependencies directly into it. For example, if a configurator requires an `EmailFormatterManager` to retrieve formatters, you can set it up through the constructor:\n   ```php\n   namespace App\\Mail;\n\n   class EmailConfigurator\n   {\n       public function __construct(private EmailFormatterManager $formatterManager) {}\n   }\n   ```\n2. **Configuring Services**: When the configurator is applied, it can be used to resolve and inject dependencies into the service being configured. For example, when `EmailConfigurator::configure()` is called, it can retrieve necessary dependencies from the `EmailFormatterManager` and pass them to the email manager:\n   ```php\n   public function configure(EmailFormatterAwareInterface $emailManager): void\n   {\n       $emailManager->setEnabledFormatters($this->formatterManager->getEnabledFormatters());\n   }\n   ```\n3. **Service Configuration**: In the service configuration file (like `services.yaml`), you can register the configurator to be executed when instantiating the primary service, ensuring that all dependencies are correctly set up without tightly coupling them to the service itself.\nBy managing dependencies this way, configurators maintain a clean architecture, allowing services to rely on injected dependencies specified at runtime, thus enhancing modularity and flexibility.""}]",knowledge/php/symfony-docs-7.1,1.0,train
