conversations,source,score,split
"[{""from"": ""human"", ""value"": ""What is the main function of the Symfony Intl component?""}, {""from"": ""gpt"", ""value"": ""The Symfony Intl component provides access to localization data from the ICU (International Components for Unicode) library. It allows developers to handle language, country, locale, currency, and timezone information in their Symfony applications, facilitating the internationalization and localization of applications easily.""}]",knowledge/php/symfony-docs-7.1,1.0,train
"[{""from"": ""human"", ""value"": ""How do you install the Symfony Intl component?""}, {""from"": ""gpt"", ""value"": ""To install the Symfony Intl component, you can use Composer by running the following command in your terminal:\n\n```terminal\ncomposer require symfony/intl\n```""}]",knowledge/php/symfony-docs-7.1,1.0,train
"[{""from"": ""human"", ""value"": ""What are the main types of data accessible through the Symfony Intl component?""}, {""from"": ""gpt"", ""value"": ""The Symfony Intl component provides access to several types of ICU data including:\n- Language and Script Names\n- Country Names\n- Locales\n- Currencies\n- Timezones\nThese categories allow developers to manage various localization aspects needed for internationalized applications.""}]",knowledge/php/symfony-docs-7.1,1.0,train
"[{""from"": ""human"", ""value"": ""Can you explain how to access Language and Script Names using the Symfony Intl component?""}, {""from"": ""gpt"", ""value"": ""To access Language and Script Names, you can utilize the `Symfony\\Component\\Intl\\Languages` class. Below is an example of how to get the names of languages and scripts:\n\n```php\nuse Symfony\\Component\\Intl\\Languages;\n\n\\Locale::setDefault('en');\n\n$languages = Languages::getNames();\n// Returns an array of language codes and their names\n// Example output: ['fr' => 'French', 'de' => 'German', ...]\n\n$languages = Languages::getAlpha3Names();\n// Returns language names based on alpha-3 codes\n\n$language = Languages::getName('fr');\n// Returns: 'French'\n\n$script = Scripts::getName('Hans');\n// Returns: 'Simplified'\n```""}]",knowledge/php/symfony-docs-7.1,1.0,train
"[{""from"": ""human"", ""value"": ""How does the Symfony Intl component handle missing resources when accessing language data?""}, {""from"": ""gpt"", ""value"": ""When accessing language data using the Symfony Intl component, if a given language or script code does not exist, a `MissingResourceException` is triggered. It is possible to catch this exception in your code to handle potential errors gracefully. Additionally, you can validate if a language code exists using methods like `Languages::exists($languageCode);` or `Languages::alpha3CodeExists($alpha3Code);` before attempting to access the data.""}]",knowledge/php/symfony-docs-7.1,1.0,train
"[{""from"": ""human"", ""value"": ""Could you demonstrate how to get country names using the Symfony Intl component?""}, {""from"": ""gpt"", ""value"": ""Certainly! Here is an example of how to get country names using the `Symfony\\Component\\Intl\\Countries` class:\n\n```php\nuse Symfony\\Component\\Intl\\Countries;\n\n\\Locale::setDefault('en');\n\n$countries = Countries::getNames();\n// Returns an array of country codes and their names\n// Example output: ['GB' => 'United Kingdom', 'FR' => 'France', ...]\n\n$countries = Countries::getAlpha3Names();\n// Returns country names based on alpha-3 codes\n\n$country = Countries::getName('GB');\n// Returns: 'United Kingdom'\n```""}]",knowledge/php/symfony-docs-7.1,1.0,train
"[{""from"": ""human"", ""value"": ""What functionality does the Symfony Intl component provide regarding numeric country codes?""}, {""from"": ""gpt"", ""value"": ""The Symfony Intl component provides access to numeric country codes as defined by the ISO 3166-1 numeric standard. Numeric codes are preferred in some contexts because they are independent of the writing system. You can obtain numeric codes for countries using:\n\n```php\nuse Symfony\\Component\\Intl\\Countries;\n\n\\Locale::setDefault('en');\n\n$numericCodes = Countries::getNumericCodes();\n// Returns an array of alpha2 codes and their numeric codes\n\n$numericCode = Countries::getNumericCode('FR');\n// Returns: '250'\n\n$alpha2 = Countries::getAlpha2FromNumeric('250');\n// Returns: 'FR'\n```""}]",knowledge/php/symfony-docs-7.1,1.0,train
"[{""from"": ""human"", ""value"": ""How can you retrieve locale information using the Symfony Intl component?""}, {""from"": ""gpt"", ""value"": ""To retrieve locale information, you can use the `Symfony\\Component\\Intl\\Locales` class. Here is how you can access the names of locales:\n\n```php\nuse Symfony\\Component\\Intl\\Locales;\n\n\\Locale::setDefault('en');\n\n$locales = Locales::getNames();\n// Returns an array of locale codes and their names\n\n$locale = Locales::getName('zh_Hans_MO');\n// Returns: 'Chinese (Simplified, Macau SAR China)'\n```""}]",knowledge/php/symfony-docs-7.1,1.0,train
"[{""from"": ""human"", ""value"": ""Can you explain how the Symfony Intl component allows access to currency information?""}, {""from"": ""gpt"", ""value"": ""Yes! The `Symfony\\Component\\Intl\\Currencies` class in the Symfony Intl component provides access to various currency information, including names, symbols, and fraction digits. Here\u2019s an example:\n\n```php\nuse Symfony\\Component\\Intl\\Currencies;\n\n\\Locale::setDefault('en');\n\n$currencies = Currencies::getNames();\n// Returns an array of currency codes and their names\n\n$currency = Currencies::getName('INR');\n// Returns: 'Indian Rupee'\n\n$symbol = Currencies::getSymbol('INR');\n// Returns: '\u20b9'\n\n$fractionDigits = Currencies::getFractionDigits('INR');\n// Returns: 2\n```""}]",knowledge/php/symfony-docs-7.1,1.0,train
"[{""from"": ""human"", ""value"": ""What type of timezone data can be accessed using the Symfony Intl component?""}, {""from"": ""gpt"", ""value"": ""The `Symfony\\Component\\Intl\\Timezones` class allows access to timezone data, including:\n1. **Timezone Names:** Retrieve names of timezones in various languages.\n2. **Timezone IDs:** Access timezone IDs for specific countries.\n3. **Offsets:** Get the raw and GMT offsets for any timezone.\n\nExample code to access timezone data:\n\n```php\nuse Symfony\\Component\\Intl\\Timezones;\n\n\\Locale::setDefault('en');\n\n$timezones = Timezones::getNames();\n// Returns an array of timezone IDs and their names\n\n$timezone = Timezones::getName('Africa/Nairobi');\n// Returns: 'East Africa Time (Nairobi)'\n\n$offset = Timezones::getRawOffset('Etc/UTC');\n// Returns: 0\n```""}]",knowledge/php/symfony-docs-7.1,1.0,train
"[{""from"": ""human"", ""value"": ""How does Symfony Intl component handle daylight saving time (DST)?""}, {""from"": ""gpt"", ""value"": ""The Symfony Intl component allows for varying timezone offsets due to daylight saving time (DST). By default, methods like `getRawOffset()` and `getGmtOffset()` utilize the current time to determine the offset. You can also specify a timestamp as the second argument to get the offset at a specific point in time, such as before or after the DST period. This enables developers to accurately manage time representation across different locales.""}]",knowledge/php/symfony-docs-7.1,1.0,train
"[{""from"": ""human"", ""value"": ""What should be done if you need to compress Symfony Intl data files?""}, {""from"": ""gpt"", ""value"": ""To compress Symfony Intl data files in order to save disk space, you can run the following command after installing the package with Composer:\n\n```terminal\nphp ./vendor/symfony/intl/Resources/bin/compress\n```\nMake sure to adjust the path according to your application setup. This command uses the PHP `zlib` extension to compress the internal data files.""}]",knowledge/php/symfony-docs-7.1,1.0,train
"[{""from"": ""human"", ""value"": ""How can developers ensure the validity of a timezone ID before accessing its data in Symfony Intl?""}, {""from"": ""gpt"", ""value"": ""Developers can check the validity of a timezone ID using the `exists()` method provided by the `Symfony\\Component\\Intl\\Timezones` class. Here\u2019s how you can validate a timezone ID:\n\n```php\n$isValidTimezone = Timezones::exists($timezoneId);\n// Returns true if the timezone ID is valid, false otherwise.\n```""}]",knowledge/php/symfony-docs-7.1,1.0,train
"[{""from"": ""human"", ""value"": ""Can you give an example of retrieving the raw and GMT offsets for a timezone?""}, {""from"": ""gpt"", ""value"": ""Certainly! Here is an example of how to retrieve both the raw and GMT offsets for a specific timezone:\n\n```php\nuse Symfony\\Component\\Intl\\Timezones;\n\n\\Locale::setDefault('en');\n\n$rawOffset = Timezones::getRawOffset('America/Buenos_Aires');\n// Returns: -10800 (the offset in seconds)\n\n$gmtOffset = Timezones::getGmtOffset('America/Buenos_Aires');\n// Returns: 'GMT-03:00'\n```""}]",knowledge/php/symfony-docs-7.1,1.0,train
"[{""from"": ""human"", ""value"": ""What happens if you attempt to retrieve information using an invalid country code in Symfony Intl?""}, {""from"": ""gpt"", ""value"": ""If you attempt to retrieve information using an invalid country code in Symfony Intl, a `MissingResourceException` will be triggered. To avoid this issue, developers can validate the country code beforehand using methods such as `Countries::exists($alpha2Code);` or `Countries::alpha3CodeExists($alpha3Code);` to ensure that the code exists.""}]",knowledge/php/symfony-docs-7.1,1.0,train
"[{""from"": ""human"", ""value"": ""What approach does Symfony Intl component use for managing Emoji transliteration?""}, {""from"": ""gpt"", ""value"": ""The Symfony Intl component includes utilities that aid in the transliteration of emojis to their textual representations across multiple languages. It simplifies the process of converting emoji instances within strings, but specifics about the implementation can be found in the documentation regarding working with emojis.""}]",knowledge/php/symfony-docs-7.1,1.0,train
"[{""from"": ""human"", ""value"": ""What is the significance of using numeric country codes?""}, {""from"": ""gpt"", ""value"": ""Numeric country codes are significant because they offer a writing-system-independent way to represent countries, which is crucial for systems that may not support the English alphabet. They help in reducing errors while handling country-specific data in international applications, especially in non-Latin script contexts.""}]",knowledge/php/symfony-docs-7.1,1.0,train
"[{""from"": ""human"", ""value"": ""Explain how to get the name of a timezone in a specific locale using Symfony Intl.""}, {""from"": ""gpt"", ""value"": ""To get the name of a timezone in a specified locale using Symfony Intl, you can pass the locale as an optional parameter to the `getName()` method of the `Symfony\\Component\\Intl\\Timezones` class. For example:\n\n```php\nuse Symfony\\Component\\Intl\\Timezones;\n\n\\Locale::setDefault('en');\n\n$timezoneName = Timezones::getName('Africa/Nairobi', 'de');\n// Returns: 'Ostafrikanische Zeit (Nairobi)' (the timezone name in German)\n```""}]",knowledge/php/symfony-docs-7.1,1.0,train
"[{""from"": ""human"", ""value"": ""What methods would you use to retrieve currency information using Symfony Intl?""}, {""from"": ""gpt"", ""value"": ""To retrieve currency information using Symfony Intl, you can use the `Symfony\\Component\\Intl\\Currencies` class. Some of the methods include:\n- `getNames()`: To get an array of currency codes and their names.\n- `getName($currencyCode)`: To retrieve the name of a specific currency.\n- `getSymbol($currencyCode)`: To obtain the symbol for a specific currency.\n- `getFractionDigits($currencyCode)` and `getCashFractionDigits($currencyCode)`: To get information regarding the number of decimal digits for the currency.""}]",knowledge/php/symfony-docs-7.1,1.0,train
"[{""from"": ""human"", ""value"": ""Give an example of how to check if a language code exists using the Symfony Intl component.""}, {""from"": ""gpt"", ""value"": ""You can check if a language code exists using the `exists()` method from the `Symfony\\Component\\Intl\\Languages` class. Here\u2019s a simple example:\n\n```php\nuse Symfony\\Component\\Intl\\Languages;\n\n$languageCode = 'fr';\n$isValidLanguage = Languages::exists($languageCode);\n// Returns true if 'fr' is a valid language code, false otherwise.\n```""}]",knowledge/php/symfony-docs-7.1,1.0,train
"[{""from"": ""human"", ""value"": ""How can you convert between alpha2 and alpha3 language codes using Symfony Intl?""}, {""from"": ""gpt"", ""value"": ""To convert between alpha2 and alpha3 language codes in Symfony Intl, you can use the methods `getAlpha3Code($alpha2Code)` and `getAlpha2Code($alpha3Code)` from the `Languages` class. Here\u2019s an example:\n\n```php\nuse Symfony\\Component\\Intl\\Languages;\n\n$alpha3Code = Languages::getAlpha3Code('fr');\n// Converts 'fr' to 'fra'\n\n$alpha2Code = Languages::getAlpha2Code('fra');\n// Converts 'fra' back to 'fr'\n```""}]",knowledge/php/symfony-docs-7.1,1.0,train
"[{""from"": ""human"", ""value"": ""How can developers access timezone names in multiple languages using Symfony Intl?""}, {""from"": ""gpt"", ""value"": ""Developers can access timezone names in multiple languages using the `getNames()` method of the `Symfony\\Component\\Intl\\Timezones` class, which returns an array of timezone IDs and their names corresponding to the default locale. If required, you can pass a different locale to get the names in that language. For example:\n\n```php\nuse Symfony\\Component\\Intl\\Timezones;\n\n$timezones = Timezones::getNames('de');\n// Returns timezone names in German\n```""}]",knowledge/php/symfony-docs-7.1,1.0,train
"[{""from"": ""human"", ""value"": ""What information can be retrieved about currencies using Symfony Intl?""}, {""from"": ""gpt"", ""value"": ""Using Symfony Intl, developers can retrieve several pieces of information about currencies, including:\n- **Currency Names**: The full name of the currency.\n- **Currency Symbols**: The symbol used to represent the currency in transactions.\n- **Fraction Digits**: Information on the number of decimal points to be displayed during numeric formatting.\n- **Rounding Increments**: Specified rules for rounding currency values based on defined increments.""}]",knowledge/php/symfony-docs-7.1,1.0,train
"[{""from"": ""human"", ""value"": ""What is the default behavior of Symfony Intl methods when the locale is not specified?""}, {""from"": ""gpt"", ""value"": ""When the locale is not specified in Symfony Intl methods, they default to using the current default locale set by `\\Locale::setDefault('en');` or any other locale that has been defined in the application.""}]",knowledge/php/symfony-docs-7.1,1.0,train
"[{""from"": ""human"", ""value"": ""How do you access the names of scripts in Symfony Intl?""}, {""from"": ""gpt"", ""value"": ""To access the names of scripts in Symfony Intl, you can use the `Symfony\\Component\\Intl\\Scripts` class. Here\u2019s how:\n\n```php\nuse Symfony\\Component\\Intl\\Scripts;\n\n\\Locale::setDefault('en');\n\n$scripts = Scripts::getNames();\n// Returns an array of script codes and their names\n// Example output: ['Adlm' => 'Adlam', 'Hans' => 'Simplified', ...]\n```""}]",knowledge/php/symfony-docs-7.1,1.0,train
"[{""from"": ""human"", ""value"": ""What command is used to include the Intl component in your project?""}, {""from"": ""gpt"", ""value"": ""The command used to include the Symfony Intl component in your project is:\n```terminal\ncomposer require symfony/intl\n```""}]",knowledge/php/symfony-docs-7.1,1.0,train
"[{""from"": ""human"", ""value"": ""How does the Symfony Intl component assist in internationalizing PHP applications?""}, {""from"": ""gpt"", ""value"": ""The Symfony Intl component assists in internationalizing PHP applications by providing developers with robust utilities for managing localization data, including language names, country names, locales, currencies, and timezones. This support allows for user-friendly applications that cater to diverse linguistic and cultural audiences, enabling the use of appropriate formats and representations in different locales.""}]",knowledge/php/symfony-docs-7.1,1.0,train
"[{""from"": ""human"", ""value"": ""What kind of exception is thrown when an invalid resource is accessed in the Symfony Intl component?""}, {""from"": ""gpt"", ""value"": ""When an invalid resource is accessed in the Symfony Intl component, a `MissingResourceException` is thrown. This indicates that the requested language code, currency code, or any other resource is not available, alerting developers to handle such cases appropriately.""}]",knowledge/php/symfony-docs-7.1,1.0,train
"[{""from"": ""human"", ""value"": ""How do you retrieve timezone information for a specific country?""}, {""from"": ""gpt"", ""value"": ""To retrieve timezone information for a specific country in Symfony Intl, you can use the `forCountryCode($countryCode)` method from the `Symfony\\Component\\Intl\\Timezones` class. This returns an array of relevant timezone IDs:\n\n```php\n$timezones = Timezones::forCountryCode('CL');\n// Returns: ['America/Punta_Arenas', 'America/Santiago', 'Pacific/Easter']\n```""}]",knowledge/php/symfony-docs-7.1,1.0,train
"[{""from"": ""human"", ""value"": ""What is the role of the ICU library in regards to the Symfony Intl component?""}, {""from"": ""gpt"", ""value"": ""The ICU (International Components for Unicode) library serves as the foundation for the Symfony Intl component by providing the underlying localization data and functionalities. This allows Symfony developers to leverage comprehensive and standardized language, currency, and timezone data in their applications, ensuring accurate representation and formatting for global audiences.""}]",knowledge/php/symfony-docs-7.1,1.0,train
"[{""from"": ""human"", ""value"": ""How can fractional digits for currencies be determined using Symfony Intl?""}, {""from"": ""gpt"", ""value"": ""To determine the fractional digits for a currency using Symfony Intl, developers can use the `getFractionDigits($currencyCode)` method from the `Symfony\\Component\\Intl\\Currencies` class. This method provides the number of decimal digits to be displayed based on the specified currency:\n\n```php\n$fractionDigits = Currencies::getFractionDigits('INR');\n// Returns: 2 (for Indian Rupee)\n```""}]",knowledge/php/symfony-docs-7.1,1.0,train
"[{""from"": ""human"", ""value"": ""Can you show how to use the `getCountryCode()` method in Symfony Intl?""}, {""from"": ""gpt"", ""value"": ""Certainly! The `getCountryCode()` method from the `Symfony\\Component\\Intl\\Timezones` class is used to retrieve the country code associated with a given timezone ID. Here\u2019s how you can use it:\n\n```php\n$countryCode = Timezones::getCountryCode('America/Vancouver');\n// Returns: 'CA' (for Canada)\n```""}]",knowledge/php/symfony-docs-7.1,1.0,train
"[{""from"": ""human"", ""value"": ""What are the best practices when dealing with localization data in Symfony applications?""}, {""from"": ""gpt"", ""value"": ""Best practices for dealing with localization data in Symfony applications include:\n1. **Use the Intl Component**: Always utilize the Symfony Intl component to access localization data rather than hard-coding values.\n2. **Catch Exceptions**: Ensure to handle `MissingResourceExceptions` to provide feedback when invalid codes are used.\n3. **Validate Codes**: Before accessing data, validate language, currency, and timezone codes using the provided existing methods to minimize errors.\n4. **Set a Default Locale**: Always set a default locale suitable for your application's primary audience.\n5. **Optimize Data Storage**: If necessary, compress data files for deployment to save disk space.""}]",knowledge/php/symfony-docs-7.1,1.0,train
"[{""from"": ""human"", ""value"": ""What methods can determine the rounding increment for a specific currency?""}, {""from"": ""gpt"", ""value"": ""To determine the rounding increment for a specific currency, you can use the `getRoundingIncrement($currencyCode)` and `getCashRoundingIncrement($currencyCode)` methods from the `Symfony\\Component\\Intl\\Currencies` class:\n\n```php\n$roundingIncrement = Currencies::getRoundingIncrement('CAD');\n// Returns: 0 (for Canadian Dollar)\n\n$cashRoundingIncrement = Currencies::getCashRoundingIncrement('CAD');\n// Returns: 5 (due to rounding to nearest 5 cents in cash transactions)\n```""}]",knowledge/php/symfony-docs-7.1,1.0,train
"[{""from"": ""human"", ""value"": ""How can the Symfony Intl component assist with emoji transliteration?""}, {""from"": ""gpt"", ""value"": ""The Symfony Intl component provides utilities for translating emojis into their textual representations across different languages. This allows developers to handle emoji data more effectively in their applications and enhances the user experience by providing appropriate textual context for emoji symbols.""}]",knowledge/php/symfony-docs-7.1,1.0,train
"[{""from"": ""human"", ""value"": ""What types of localization data can be compressed to save disk space?""}, {""from"": ""gpt"", ""value"": ""All internal Symfony Intl data files can be compressed using the compress command provided in the component's resources. This can help save disk space in deployment, especially when working with services that have size constraints. Compressing data files reduces the overall footprint of the application.""}]",knowledge/php/symfony-docs-7.1,1.0,train
"[{""from"": ""human"", ""value"": ""How can developers test if a currency code is valid using the Symfony Intl component?""}, {""from"": ""gpt"", ""value"": ""Developers can test if a currency code is valid using the `exists($currencyCode)` method provided by the `Symfony\\Component\\Intl\\Currencies` class. This allows them to check for the existence of a specific currency code before attempting to access its associated data:\n\n```php\n$isValidCurrency = Currencies::exists('USD');\n// Returns true if 'USD' is a valid currency code.\n```""}]",knowledge/php/symfony-docs-7.1,1.0,train
"[{""from"": ""human"", ""value"": ""What process should be followed to retrieve information on timezones and their offsets?""}, {""from"": ""gpt"", ""value"": ""To retrieve information on timezones and their offsets, you can use the methods from the `Symfony\\Component\\Intl\\Timezones` class. Here\u2019s an approach:\n1. Use `getNames()` to obtain a list of timezone names.\n2. Use `getRawOffset($timezoneId)` to get the raw offset in seconds.\n3. Use `getGmtOffset($timezoneId)` to get the GMT offset string.\nExample:\n```php\n$timezones = Timezones::getNames();\n$rawOffset = Timezones::getRawOffset('America/New_York');\n$gmtOffset = Timezones::getGmtOffset('America/New_York');\n```""}]",knowledge/php/symfony-docs-7.1,1.0,train
"[{""from"": ""human"", ""value"": ""How does Symfony handle changes in timezone offsets due to daylight saving time?""}, {""from"": ""gpt"", ""value"": ""Symfony handles changes in timezone offsets due to daylight saving time (DST) by allowing the use of specific timestamps when calling methods like `getRawOffset()` and `getGmtOffset()`. This means you can retrieve the offset for a specific date and time, considering the DST rules in place for that period.""}]",knowledge/php/symfony-docs-7.1,1.0,train
"[{""from"": ""human"", ""value"": ""How do locale parameters affect the data retrieved via the Symfony Intl component?""}, {""from"": ""gpt"", ""value"": ""Locale parameters affect the data retrieved via the Symfony Intl component by dictating the language and regional variations of the returned data. For example, retrieving country names without specifying a locale defaults to the application\u2019s configured locale, but specifying a different locale can yield names in the requested language. This flexibility allows applications to present data in a user-friendly manner based on individual preferences.""}]",knowledge/php/symfony-docs-7.1,1.0,train
"[{""from"": ""human"", ""value"": ""What is a common practice to improve application performance when using Symfony Intl?""}, {""from"": ""gpt"", ""value"": ""A common practice to improve application performance when using Symfony Intl is to compress the localization data files after installation, especially prior to deployment in a production environment. This ensures that the application uses less disk space and potentially loads faster, as it reduces the amount of data that needs to be loaded into memory.""}]",knowledge/php/symfony-docs-7.1,1.0,train
"[{""from"": ""human"", ""value"": ""How can internationalization and localization improve user engagement?""}, {""from"": ""gpt"", ""value"": ""Internationalization (i18n) and localization (l10n) improve user engagement by providing users with content and interfaces in their native languages and formats. When users see familiar language, currencies, and time indicators, they are more likely to interact with the application positively. Tailoring content to specific demographic preferences not only improves usability but can also boost overall satisfaction and retention.""}]",knowledge/php/symfony-docs-7.1,1.0,train
