conversations,source,score,split
"[{""from"": ""human"", ""value"": ""What is the main purpose of the PropertyAccess component in Symfony?""}, {""from"": ""gpt"", ""value"": ""The PropertyAccess component in Symfony provides a set of functions to read and write values from objects and arrays using a simple string notation. This allows developers to access properties of objects or elements of arrays in a uniform way, facilitating dynamic property access without needing to know the structural details of the objects or arrays in advance.""}]",knowledge/php/symfony-docs-7.1,1.0,train
"[{""from"": ""human"", ""value"": ""How can the PropertyAccess component be installed in a Symfony project?""}, {""from"": ""gpt"", ""value"": ""To install the PropertyAccess component in a Symfony project, you can use Composer, which is a dependency manager for PHP. You simply run the following command in your terminal:\n\n```\n$ composer require symfony/property-access\n```""}]",knowledge/php/symfony-docs-7.1,1.0,train
"[{""from"": ""human"", ""value"": ""What is the entry point for using the PropertyAccess component?""}, {""from"": ""gpt"", ""value"": ""The main entry point for using the PropertyAccess component is the `PropertyAccess::createPropertyAccessor()` factory method. This method creates a new instance of the `PropertyAccessor` class with a default configuration, allowing you to begin reading and writing property values.""}]",knowledge/php/symfony-docs-7.1,1.0,train
"[{""from"": ""human"", ""value"": ""Can you provide an example of reading a value from an array using PropertyAccessor?""}, {""from"": ""gpt"", ""value"": ""Certainly! Here's an example of how to read a value from an array using the PropertyAccess component:\n\n```php\nuse Symfony\\Component\\PropertyAccess\\PropertyAccess;\n\n$propertyAccessor = PropertyAccess::createPropertyAccessor();\n\n$person = [\n    'first_name' => 'Wouter',\n];\n\nvar_dump($propertyAccessor->getValue($person, '[first_name]')); // Outputs: 'Wouter'\nvar_dump($propertyAccessor->getValue($person, '[age]')); // Outputs: null (index does not exist)\n```""}]",knowledge/php/symfony-docs-7.1,1.0,train
"[{""from"": ""human"", ""value"": ""What is the behavior of the getValue method when trying to access a non-existing index in an array?""}, {""from"": ""gpt"", ""value"": ""By default, when the `getValue` method is used to access a non-existing index in an array, it returns `null`. However, this behavior can be changed by enabling the exception handling feature. If you call `enableExceptionOnInvalidIndex()`, it will throw a `NoSuchIndexException` when trying to access a non-existing index instead of just returning null.""}]",knowledge/php/symfony-docs-7.1,1.0,train
"[{""from"": ""human"", ""value"": ""How do you enable exception throwing on accessing invalid indices in an array?""}, {""from"": ""gpt"", ""value"": ""To enable exception throwing when accessing invalid indices in an array using the PropertyAccess component, you can use the `PropertyAccessorBuilder` as shown in the following example:\n\n```php\nuse Symfony\\Component\\PropertyAccess\\PropertyAccess;\n\n$propertyAccessor = PropertyAccess::createPropertyAccessorBuilder()\n    ->enableExceptionOnInvalidIndex()\n    ->getPropertyAccessor();\n\n$person = [\n    'first_name' => 'Wouter',\n];\n\n// This will throw an exception because 'age' does not exist\n$value = $propertyAccessor->getValue($person, '[age]');\n```""}]",knowledge/php/symfony-docs-7.1,1.0,train
"[{""from"": ""human"", ""value"": ""What syntax is used to access multi-dimensional arrays with PropertyAccessor?""}, {""from"": ""gpt"", ""value"": ""In the PropertyAccess component, you can access multi-dimensional arrays using a notation that resembles standard array access in PHP. For example, if you have an array of persons:\n\n```php\n$persons = [\n    [\n        'first_name' => 'Wouter',\n    ],\n    [\n        'first_name' => 'Ryan',\n    ],\n];\n\nvar_dump($propertyAccessor->getValue($persons, '[0][first_name]')); // Outputs: 'Wouter'\nvar_dump($propertyAccessor->getValue($persons, '[1][first_name]')); // Outputs: 'Ryan'\n```""}]",knowledge/php/symfony-docs-7.1,1.0,train
"[{""from"": ""human"", ""value"": ""How do you escape special characters when accessing array keys?""}, {""from"": ""gpt"", ""value"": ""When using the PropertyAccess component to access array keys that contain special characters such as a dot (.) or a left square bracket ([), you must escape these characters with a backslash (\\). For example:\n\n```php\nvar_dump($propertyAccessor->getValue($persons, '[0][first\\.name]')); // Correct for accessing 'first.name' key\n```""}]",knowledge/php/symfony-docs-7.1,1.0,train
"[{""from"": ""human"", ""value"": ""How does PropertyAccessor handle reading properties from objects?""}, {""from"": ""gpt"", ""value"": ""The PropertyAccessor component can read properties from objects using dot notation. If you access a property directly, it looks for the public properties first. However, if a getter method exists for that property, it will prefer to call the getter method. For example:\n\n```php\n$person = new Person();\n$person->firstName = 'Wouter';\n\nvar_dump($propertyAccessor->getValue($person, 'firstName')); // Outputs: 'Wouter'\n```""}]",knowledge/php/symfony-docs-7.1,1.0,train
"[{""from"": ""human"", ""value"": ""What happens if there is no getter method for a property accessed?""}, {""from"": ""gpt"", ""value"": ""If there is no getter method for a property being accessed, the PropertyAccessor will use the public property directly. However, if the property is private and there is no getter defined, it will throw a `NoSuchPropertyException` by default. You can change this behavior using the `disableExceptionOnInvalidPropertyPath()` method in the `PropertyAccessorBuilder` to allow null returns instead.""}]",knowledge/php/symfony-docs-7.1,1.0,train
"[{""from"": ""human"", ""value"": ""What is the naming convention for getter methods when using PropertyAccessor?""}, {""from"": ""gpt"", ""value"": ""The PropertyAccessor component uses common naming conventions for getter methods. When accessing a property via a string name, it transforms the property name from snake_case (e.g., `first_name`) to camelCase (e.g., `FirstName`) and prefixes it with 'get'. So in practice, it checks for a method called `getFirstName()` for a property named `first_name`. For example:\n\n```php\nclass Person\n{\n    private string $firstName = 'Wouter';\n    public function getFirstName(): string\n    {\n        return $this->firstName;\n    }\n}\n\n$person = new Person();\nvar_dump($propertyAccessor->getValue($person, 'first_name')); // Outputs: 'Wouter'\n```""}]",knowledge/php/symfony-docs-7.1,1.0,train
"[{""from"": ""human"", ""value"": ""Can you explain how the PropertyAccessor can utilize the magic __get() method?""}, {""from"": ""gpt"", ""value"": ""The PropertyAccessor component can utilize the magic `__get()` method to access properties of an object. If a property is not directly accessible or does not exist as a public property, the PropertyAccessor can call the `__get()` method to fetch the value. For example:\n\n```php\nclass Person\n{\n    private array $children = [\n        'Wouter' => [...],\n    ];\n\n    public function __get($id): mixed\n    {\n        return $this->children[$id];\n    }\n}\n\n$person = new Person();\nvar_dump($propertyAccessor->getValue($person, 'Wouter')); // Outputs: [...]\n```""}]",knowledge/php/symfony-docs-7.1,1.0,train
"[{""from"": ""human"", ""value"": ""How can you enable the magic __call() method in PropertyAccessor?""}, {""from"": ""gpt"", ""value"": ""To enable the magic `__call()` method in the PropertyAccessor component, you need to use the `PropertyAccessorBuilder`. You can enable this feature using the `enableMagicCall()` method. Here\u2019s an example:\n\n```php\nclass Person\n{\n    private array $children = [\n        'wouter' => [...],\n    ];\n\n    public function __call($name, $args): mixed\n    {\n        $property = lcfirst(substr($name, 3));\n        if ('get' === substr($name, 0, 3)) {\n            return $this->children[$property] ?? null;\n        }\n    }\n}\n\n$propertyAccessor = PropertyAccess::createPropertyAccessorBuilder()\n    ->enableMagicCall()\n    ->getPropertyAccessor();\n\nvar_dump($propertyAccessor->getValue($person, 'wouter')); // Outputs: [...]\n```""}]",knowledge/php/symfony-docs-7.1,1.0,train
"[{""from"": ""human"", ""value"": ""What capabilities does the setValue method offer in the PropertyAccessor?""}, {""from"": ""gpt"", ""value"": ""The `setValue` method in the PropertyAccessor class offers the ability to write values to both arrays and objects. It can set values using public properties, setter methods, and the magic `__set()` method. The method intelligently decides how to set the value based on whether setters or properties are defined:\n\n```php\nclass Person\n{\n    public string $firstName;\n    private string $lastName;\n\n    public function setLastName($name): void\n    {\n        $this->lastName = $name;\n    }\n}\n\n$person = new Person();\n$propertyAccessor->setValue($person, 'firstName', 'Wouter');\n$propertyAccessor->setValue($person, 'lastName', 'de Jong'); // Calls setLastName\nvar_dump($person->firstName); // Outputs: 'Wouter'\nvar_dump($person->getLastName()); // Outputs: 'de Jong'\n```""}]",knowledge/php/symfony-docs-7.1,1.0,train
"[{""from"": ""human"", ""value"": ""Can you provide an example of how to write to an array using PropertyAccessor?""}, {""from"": ""gpt"", ""value"": ""Yes! Here is an example of how to write to an array using the `setValue` method of the PropertyAccessor component:\n\n```php\nuse Symfony\\Component\\PropertyAccess\\PropertyAccess;\n\n$propertyAccessor = PropertyAccess::createPropertyAccessor();\n\n$person = [];\n$propertyAccessor->setValue($person, '[first_name]', 'Wouter');\n\nvar_dump($propertyAccessor->getValue($person, '[first_name]')); // Outputs: 'Wouter'\n```""}]",knowledge/php/symfony-docs-7.1,1.0,train
"[{""from"": ""human"", ""value"": ""What features does the PropertyAccessor offer for writing to array properties?""}, {""from"": ""gpt"", ""value"": ""The PropertyAccessor allows you to update the content of arrays stored in object properties through *adder* and *remover* methods. It looks for methods following the naming convention of `add<SingularOfThePropertyName>()` for adding items and `remove<SingularOfThePropertyName>()` for removing items. Here's an example:\n\n```php\nclass Person\n{\n    private array $children = [];\n\n    public function addChild(string $name): void\n    {\n        $this->children[$name] = $name;\n    }\n    public function removeChild(string $name): void\n    {\n        unset($this->children[$name]);\n    }\n}\n\n$propertyAccessor->setValue($person, 'children', ['kevin', 'wouter']);\nvar_dump($person->getChildren()); // Outputs: ['kevin', 'wouter']\n```""}]",knowledge/php/symfony-docs-7.1,1.0,train
"[{""from"": ""human"", ""value"": ""How can you use non-standard adder/remover methods in PropertyAccessor?""}, {""from"": ""gpt"", ""value"": ""In cases where adder and remover methods do not follow the standard naming conventions (i.e., `add` or `remove`), you can configure the PropertyAccessor to recognize custom methods. Here\u2019s an example of how this can be accomplished:\n\n```php\nclass Team\n{\n    private array $team = [];\n\n    public function joinTeam(string $person): void\n    {\n        $this->team[] = $person;\n    }\n    public function leaveTeam(string $person): void\n    {\n        foreach ($this->team as $id => $item) {\n            if ($person === $item) {\n                unset($this->team[$id]);\n                break;\n            }\n        }\n    }\n}\n\n$propertyAccessor = new PropertyAccessor(...);\n$propertyAccessor->setValue($team, 'team', ['kevin', 'wouter']);\nvar_dump($team->getTeam()); // Outputs: ['kevin', 'wouter']\n```""}]",knowledge/php/symfony-docs-7.1,1.0,train
"[{""from"": ""human"", ""value"": ""What method can be used to check if a property path is readable?""}, {""from"": ""gpt"", ""value"": ""To check if a property path can be safely accessed without actually calling the `getValue` method, you can use the `isReadable` method from the PropertyAccessor class. Here's an example:\n\n```php\nif ($propertyAccessor->isReadable($person, 'firstName')) {\n    \n}```""}]",knowledge/php/symfony-docs-7.1,1.0,train
"[{""from"": ""human"", ""value"": ""What method checks if a property path is writable in PropertyAccessor?""}, {""from"": ""gpt"", ""value"": ""To determine if a property path can be updated, you would use the `isWritable` method provided by the PropertyAccessor class. This verifies if the specified path can accept a value without attempting to write it. Here\u2019s an example:\n\n```php\nif ($propertyAccessor->isWritable($person, 'firstName')) {\n    \n}```""}]",knowledge/php/symfony-docs-7.1,1.0,train
"[{""from"": ""human"", ""value"": ""Can you provide an example that mixes objects and arrays using PropertyAccessor?""}, {""from"": ""gpt"", ""value"": ""Certainly! Here\u2019s an example where an object contains an array, and we interact with both using PropertyAccessor:\n\n```php\nclass Person\n{\n    public string $firstName;\n    private array $children = [];\n\n    public function getChildren(): array\n    {\n        return $this->children;\n    }\n}\n\n$propertyAccessor->setValue($person, 'children[0]', new Person);\n$propertyAccessor->setValue($person, 'children[0].firstName', 'Wouter');\nvar_dump('Hello '.$propertyAccessor->getValue($person, 'children[0].firstName')); // Outputs: 'Hello Wouter'\n```""}]",knowledge/php/symfony-docs-7.1,1.0,train
"[{""from"": ""human"", ""value"": ""How do you enable additional features in PropertyAccessor?""}, {""from"": ""gpt"", ""value"": ""You can enable additional features in the PropertyAccessor by using the `PropertyAccessorBuilder`. This allows you to enable or disable magic methods or other behaviors. Example:\n\n```php\n$propertyAccessorBuilder = PropertyAccess::createPropertyAccessorBuilder();\n$propertyAccessorBuilder->enableMagicCall();\n$propertyAccessorBuilder->enableMagicGet();\n$propertyAccessorBuilder->enableMagicSet();\n\n$propertyAccessor = $propertyAccessorBuilder->getPropertyAccessor();\n```""}]",knowledge/php/symfony-docs-7.1,1.0,train
"[{""from"": ""human"", ""value"": ""What is the purpose of the isMagicCallEnabled method in PropertyAccessor?""}, {""from"": ""gpt"", ""value"": ""The `isMagicCallEnabled` method in the PropertyAccessorBuilder allows you to check whether the handling of the magic `__call()` method is currently enabled. This is useful for debugging and understanding whether the PropertyAccessor is configured to use magic methods for property access.""}]",knowledge/php/symfony-docs-7.1,1.0,train
"[{""from"": ""human"", ""value"": ""Can you summarize how PropertyAccessor facilitates both reading and writing to properties?""}, {""from"": ""gpt"", ""value"": ""The PropertyAccessor component in Symfony facilitates both reading and writing to properties by providing a unified API for accessing and manipulating object and array properties. With methods such as `getValue()` and `setValue()`, developers can use string notation to specify property paths simply and intuitively. The component supports various features, such as automatic handling of public properties, calling getter and setter methods, and enabling magic methods. This makes it versatile for various use cases in applications.""}]",knowledge/php/symfony-docs-7.1,1.0,train
"[{""from"": ""human"", ""value"": ""What exception is thrown when trying to access a non-existing property with getValue?""}, {""from"": ""gpt"", ""value"": ""When `getValue` is called with a non-existing property path, the PropertyAccessor throws a `NoSuchPropertyException` by default. However, this behavior can be modified using the `disableExceptionOnInvalidPropertyPath()` method to prevent exceptions from being thrown.""}]",knowledge/php/symfony-docs-7.1,1.0,train
"[{""from"": ""human"", ""value"": ""In what scenario would the nullsafe operator be used with PropertyAccessor?""}, {""from"": ""gpt"", ""value"": ""The nullsafe operator can be used in scenarios where you are accessing properties that may be `null`. For instance, when dealing with an object graph where a parent property can be `null`, using the nullsafe operator (`?.`) allows you to safely traverse the object graph without triggering an exception if the property is `null`. For example:\n\n```php\nvar_dump($propertyAccessor->getValue($comment, 'person?.firstname')); // Outputs: null if person is null\n```""}]",knowledge/php/symfony-docs-7.1,1.0,train
"[{""from"": ""human"", ""value"": ""Can PropertyAccessor handle arrays stored as object properties? How?""}, {""from"": ""gpt"", ""value"": ""Yes, PropertyAccessor can handle arrays stored as object properties. It does this by allowing you to access and modify array elements directly through property paths using notations similar to PHP's array syntax. You can add elements through *adder* and *remover* methods or by setting values directly to the array property:\n\n```php\nclass Person\n{\n    private array $children = [];\n\n    public function getChildren(): array\n    {\n        return $this->children;\n    }\n}\n\n$propertyAccessor->setValue($person, 'children', ['Wouter']);\nvar_dump($person->getChildren()); // Outputs: ['Wouter']\n```""}]",knowledge/php/symfony-docs-7.1,1.0,train
"[{""from"": ""human"", ""value"": ""What happens if you access an index without properly escaping special characters?""}, {""from"": ""gpt"", ""value"": ""If you attempt to access an array index without escaping special characters like dots (.) or left square brackets ([) in the key, the PropertyAccessor will not be able to retrieve the correct value, leading to unexpected behaviors, such as returning null or throwing exceptions. Always remember to escape these characters, for example:\n\n```php\nvar_dump($propertyAccessor->getValue($data, '[key.with.dots]')); // This will fail unless properly escaped\n```""}]",knowledge/php/symfony-docs-7.1,1.0,train
"[{""from"": ""human"", ""value"": ""What is the purpose of the createPropertyAccessor method?""}, {""from"": ""gpt"", ""value"": ""The `createPropertyAccessor` method serves to instantiate a new `PropertyAccessor` object configured with default settings. It acts as the main entry point for users of the PropertyAccess component, enabling them to easily create instances that will handle the reading and writing of properties dynamically.""}]",knowledge/php/symfony-docs-7.1,1.0,train
"[{""from"": ""human"", ""value"": ""How can you customize PropertyAccessor to suit specific needs in your application?""}, {""from"": ""gpt"", ""value"": ""You can customize the PropertyAccessor in your Symfony application by utilizing the `PropertyAccessorBuilder`. This allows you to enable or disable certain features like magic methods (`__get`, `__set`, and `__call`), configure exception handling, or set up specific behaviors for property handling. You would use methods provided in the builder to enable desired features or modify the default configurations based on your application's requirements.""}]",knowledge/php/symfony-docs-7.1,1.0,train
"[{""from"": ""human"", ""value"": ""Explain how the PropertyAccess component improves the flexibility of property handling?""}, {""from"": ""gpt"", ""value"": ""The PropertyAccess component improves the flexibility of property handling by providing a uniform interface that abstracts away the underlying object or array structures. It allows developers to read from and write to properties using simple string notations, which can be easily modified or extended. By supporting methods like `getValue()` and `setValue()`, it handles underlying complexities, allows for the inclusion of various access techniques (like getters, setters, and magic methods), and provides the capability to work with both multidimensional arrays and objects seamlessly.""}]",knowledge/php/symfony-docs-7.1,1.0,train
"[{""from"": ""human"", ""value"": ""What approaches does PropertyAccessor take to ensure it can access properties?""}, {""from"": ""gpt"", ""value"": ""The PropertyAccessor employs several approaches to ensure access to properties, including:\n1. **Direct Access**: It attempts to access public properties directly.\n2. **Using Getters**: If a property has an associated getter method, the accessor will call that method instead of accessing the property directly.\n3. **Magic Methods**: It utilizes PHP's magic methods like `__get()` to retrieve values when regular access is not possible.\n4. **Fallback to Private Properties**: If no getter is found, it may ultimately resort to direct property access, if it's public, or throw an exception if it's private and no access method is defined.""}]",knowledge/php/symfony-docs-7.1,1.0,train
"[{""from"": ""human"", ""value"": ""How does PropertyAccessor handle settings when working with arrays in terms of method calling?""}, {""from"": ""gpt"", ""value"": ""When working with arrays, the PropertyAccessor checks for specific methods associated with properties. It looks for setter methods with a defined naming convention, such as `set<PropertyName>()`, to set values, and for `add<SingularOfThePropertyName>()` and `remove<SingularOfThePropertyName>()` to manage items in array properties. This ensures that modifications to arrays are done using clearly defined behaviors, promoting cleaner code and better maintainability.""}]",knowledge/php/symfony-docs-7.1,1.0,train
"[{""from"": ""human"", ""value"": ""How can PropertyAccessor benefit PHP developers in terms of property management?""}, {""from"": ""gpt"", ""value"": ""The PropertyAccessor component can benefit PHP developers by simplifying the process of property management within their applications. By using a consistent and straightforward API to access and manipulate properties of objects and arrays, it reduces boilerplate code and increases code readability. Developers can dynamically interact with property values without deep knowledge of the object's structure, making it easier to build flexible components, handle dynamic data models, and defensively manage nullability and property accessibility dynamically.""}]",knowledge/php/symfony-docs-7.1,1.0,train
"[{""from"": ""human"", ""value"": ""What happens if you try to set a property using a non-existent setter?""}, {""from"": ""gpt"", ""value"": ""If you attempt to set a property using a non-existent setter method, the PropertyAccessor will either throw a `NoSuchPropertyException` or simply skip the operation, depending on the underlying property access configuration and how it is handled. If the property is accessible publicly, it will be directly set as long as it is defined, otherwise an exception will be raised if access policies are stricter.""}]",knowledge/php/symfony-docs-7.1,1.0,train
"[{""from"": ""human"", ""value"": ""Can the PropertyAccessor adjust its behavior based on the methods defined in a class?""}, {""from"": ""gpt"", ""value"": ""Yes, the PropertyAccessor can adjust its behavior based on the methods defined in a class. It checks for the presence of getters, setters, magic methods, and any custom-defined access methods to determine how to access or modify properties. By designing your classes with specific access methods, you can control how the PropertyAccessor interacts with the properties, allowing for encapsulation and enforcing business rules related to property management.""}]",knowledge/php/symfony-docs-7.1,1.0,train
"[{""from"": ""human"", ""value"": ""How does PropertyAccessor ensure backward compatibility when new features are added?""}, {""from"": ""gpt"", ""value"": ""The PropertyAccessor ensures backward compatibility by allowing developers to enable or disable features using the `PropertyAccessorBuilder`. Existing implementations that do not require the new features can continue to operate unchanged, while those that want to utilize the new capabilities can easily configure the accessor to meet their needs. This layered approach helps preserve the existing functionality while expanding the tool's versatility for new use cases without breaking changes.""}]",knowledge/php/symfony-docs-7.1,1.0,train
"[{""from"": ""human"", ""value"": ""What best practices should be followed when using PropertyAccessor?""}, {""from"": ""gpt"", ""value"": ""Best practices when using the PropertyAccessor include:\n1. **Consistent Naming**: Use consistent naming conventions for properties and methods to align with expectations of the PropertyAccessor.\n2. **Use Accessors Wisely**: Define getter and setter methods where appropriate to encapsulate business logic.\n3. **Proper Escaping**: Always escape special characters in array keys to avoid unexpected access behavior.\n4. **Error Handling**: Implement error handling logic for scenarios where properties may not exist or may be null to avoid exceptions during runtime.""}]",knowledge/php/symfony-docs-7.1,1.0,train
"[{""from"": ""human"", ""value"": ""What is the significance of using the PropertyAccessor when dealing with dynamic data structures?""}, {""from"": ""gpt"", ""value"": ""The significance of using the PropertyAccessor when dealing with dynamic data structures lies in its ability to provide a consistent interface for property access. As data structures may vary in shape or change over time, the PropertyAccessor allows developers to interact with properties without needing to modify the underlying code structure. This promotes adaptability and flexibility, enabling easier management of data that could come from various sources, such as APIs or databases, which may not have a fixed schema.""}]",knowledge/php/symfony-docs-7.1,1.0,train
