conversations,source,score,split
"[{""from"": ""human"", ""value"": ""What is the main purpose of the performance checklists provided for Symfony applications?""}, {""from"": ""gpt"", ""value"": ""The performance checklists for Symfony applications are designed to help developers optimize their applications and production servers. These checklists provide a structured approach to ensure that both the application and server configurations are geared towards achieving maximum performance. The checklists highlight best practices such as using caching solutions, limiting enabled locales, and optimizing the service container, among others. By following these guidelines, developers can significantly enhance the speed and efficiency of their Symfony applications and server environments.""}]",knowledge/php/symfony-docs-7.1,1.0,train
"[{""from"": ""human"", ""value"": ""How can you optimize Symfony applications with the APCu Polyfill?""}, {""from"": ""gpt"", ""value"": ""To optimize Symfony applications that are still using the legacy APC PHP extension instead of OPcache, you should install the APCu Polyfill component. This component allows compatibility with APCu PHP functions and facilitates the use of advanced Symfony features, specifically the APCu Cache adapter. Here\u2019s how to install it:\n1. **Install via Composer**: Run the composer command to require the polyfill.\n   ```bash\n   composer require symfony/polyfill-apcu\n   ```\n2. **Enable in Symfony Configuration**: Once installed, Symfony will automatically recognize and leverage the polyfill when necessary.\nBy using APCu Polyfill, you can improve object caching in your Symfony applications, ultimately enhancing performance, particularly in environments where the legacy APC extension is still in use.""}]",knowledge/php/symfony-docs-7.1,1.0,train
"[{""from"": ""human"", ""value"": ""What are the advantages of dumping the Symfony service container into a single file?""}, {""from"": ""gpt"", ""value"": ""Dumping the Symfony service container into a single file has several advantages:\n1. **Performance Improvement**: By compiling the entire container into a single file, you can reduce the overhead associated with loading multiple small files, which can enhance the application's performance, especially when using 'class preloading' available in PHP 7.4 or newer.\n2. **Simplified File Management**: Managing a single file is often easier than dealing with multiple smaller files, making updates and configurations more straightforward.\n3. **Reduced Latency**: Fewer file system operations reduce latency, meaning faster boot up times for the application.\nTo enable this feature, you can set the parameter in your configuration:\n```yaml\n# config/services.yaml\nparameters:\n    .container.dumper.inline_factories: true\n```\nThis method is crucial for optimizing Symfony applications that anticipate high traffic or complex dependency structures.""}]",knowledge/php/symfony-docs-7.1,1.0,train
"[{""from"": ""human"", ""value"": ""Can you provide a code snippet showing how to configure OPcache for maximum performance?""}, {""from"": ""gpt"", ""value"": ""Certainly! To optimize OPcache for your Symfony applications, you need to modify the PHP configuration file (php.ini) to set some recommended values. Below is a sample configuration:\n```ini\n; php.ini\n; maximum memory that OPcache can use to store compiled PHP files\nopcache.memory_consumption=256\n\n; maximum number of files that can be stored in the cache\nopcache.max_accelerated_files=20000\n\n; validate timestamps only if you are in a development environment\nopcache.validate_timestamps=0\n```\nIn this example:\n- `opcache.memory_consumption` is set to 256MB to ensure sufficient memory is available for caching compiled scripts.\n- `opcache.max_accelerated_files` is set to a high number to allow a large volume of scripts to be cached.\n- `opcache.validate_timestamps` is set to `0`, which means that OPcache will not check for file changes, reducing overhead\u2014this is ideal in a production environment where the codebase doesn't change often. Make sure to empty and regenerate the OPcache after deploying new changes.""}]",knowledge/php/symfony-docs-7.1,1.0,train
"[{""from"": ""human"", ""value"": ""How does Symfony provide profiling capabilities?""}, {""from"": ""gpt"", ""value"": ""Symfony offers built-in profiling capabilities primarily through two tools: Blackfire and the Stopwatch component.\n\n1. **Blackfire**: This is a commercial service that allows developers to profile and optimize the performance of Symfony applications during development, testing, and production. It provides detailed metrics and helps in identifying bottlenecks in the application.\n   - To get started, you typically install the Blackfire agent and client. Then you can run profiling sessions as needed.\n\n2. **Stopwatch Component**: Symfony features the Stopwatch component, which provides a basic profiler that can measure execution time and memory usage for any section of your code. To utilize it, you simply inject an instance of `Symfony\\Component\\Stopwatch\\Stopwatch` into your service or controller and use its methods to start, stop, and record measurements.\n   Here's a simple example:\n   ```php\n   use Symfony\\Component\\Stopwatch\\Stopwatch;\n\n   class DataExporter\n   {\n       public function __construct(private Stopwatch $stopwatch) {}\n\n       public function export(): void\n       {\n           $this->stopwatch->start('export-data');\n           // data export logic\n           $this->stopwatch->stop('export-data');\n       }\n   }\n   ```\n   Utilizing these profiling tools aids in gaining insights into where optimizations can be made to enhance application performance.""}]",knowledge/php/symfony-docs-7.1,1.0,train
"[{""from"": ""human"", ""value"": ""What strategies can be employed to profile categories and sections in Symfony?""}, {""from"": ""gpt"", ""value"": ""To effectively profile categories and sections in Symfony using the Stopwatch component, you can take advantage of the categorization and the concept of sections. Here are the strategies:\n\n1. **Defining Categories**: When starting an event, you can assign it a category or tag, allowing you to group and organize similar events. This can be done by passing a second argument to the `start()` method:\n   ```php\n   $this->stopwatch->start('export-data', 'export');\n   ```\n   This categorization helps in filtering results when analyzing profiling data.\n\n2. **Profiling with Sections**: Sections allow further organization of events into groups to create a distinct timeline. You can open a section, start profiling an event, and then stop the section when done:\n   ```php\n   $this->stopwatch->openSection();\n   $this->stopwatch->start('validating-file', 'validation');\n   $this->stopwatch->stopSection('validation');\n   ```\n   Here, events related to 'validation' are grouped together which enhances clarity when reviewing timing information.\n\n3. **Utilizing 'Lap' Method**: The Stopwatch component also provides a 'lap' feature, which captures intermediate measurements. Calling `lap()` stops the current event and immediately restarts it, facilitating detailed periodic tracking:\n   ```php\n   $this->stopwatch->start('process-data-records', 'export');\n   foreach ($records as $record) {\n       // process record\n       $this->stopwatch->lap('process-data-records');\n   }\n   ```\n   This method allows you to collect precise measurements of the time taken for processing individual records while still tracking the overall duration.\nUsing these strategies allows developers to gain granular insights into application performance and identify areas needing optimization.""}]",knowledge/php/symfony-docs-7.1,1.0,train
"[{""from"": ""human"", ""value"": ""How does Symfony allow optimization of Composer's autoloader in production?""}, {""from"": ""gpt"", ""value"": ""In production, Symfony allows optimization of Composer's autoloader to enhance performance using the following command, which generates a class map containing the locations of all classes:\n```bash\n$ composer dump-autoload --no-dev --classmap-authoritative\n```\nThis command has two important flags:\n1. `--no-dev`: This option excludes classes that are only required in the development environment (marked by `require-dev` in composer.json), thus reducing the autoloader's size and improving performance.\n2. `--classmap-authoritative`: This ensures that Composer creates a complete class map for all PSR-0 and PSR-4 compatible classes, preventing Composer from scanning the filesystem for class locations during runtime. Instead, it relies solely on the pre-generated class map.\nFollowing this optimization process will help reduce the overhead related to loading classes in the application and lead to faster response times in the production environment.""}]",knowledge/php/symfony-docs-7.1,1.0,train
"[{""from"": ""human"", ""value"": ""What configurations should be set to optimize the PHP realpath cache for Symfony applications?""}, {""from"": ""gpt"", ""value"": ""To optimize PHP's realpath cache for Symfony applications, certain parameters should be set in the PHP configuration file (php.ini) to improve performance, especially for applications that require accessing numerous PHP files. Here\u2019s how to configure it:\n```ini\n; php.ini\n; maximum memory allocated to store the results\nrealpath_cache_size=4096K\n\n; save the results for 10 minutes (600 seconds)\nrealpath_cache_ttl=600\n```\nThis configuration accomplishes two important optimizations:\n1. **Increased Memory Allocation**: Setting `realpath_cache_size` to 4096K allocates enough memory for the realpath cache to store numerous PHP paths, reducing the overhead of resolving the real path for multiple files.\n2. **Extended Cache Duration**: Setting `realpath_cache_ttl` to 600 seconds allows the cache to hold the resolved paths for a longer period, reducing the number of cache misses and improving lookup speed in subsequent requests.\nOverall, these configurations help mitigate file system access overhead and improve performance when handling a large number of files, typical in Symfony applications.""}]",knowledge/php/symfony-docs-7.1,1.0,train
"[{""from"": ""human"", ""value"": ""Can you explain how to disable the dumping of the container as XML in debug mode?""}, {""from"": ""gpt"", ""value"": ""To disable the dumping of the service container as XML in debug mode in Symfony, you can set a specific parameter in your services configuration files. This is useful to improve performance when the container grows large and the XML generation becomes a bottleneck. Here\u2019s how you can do this:\n\n1. **YAML Configuration**: In your `config/services.yaml` file, you can specify the following:\n   ```yaml\n   parameters:\n       debug.container.dump: false\n   ```\n2. **XML Configuration**: If you are using XML for configuration, modify your `config/services.xml` file as follows:\n   ```xml\n   <parameters>\n       <parameter key=\""debug.container.dump\"">false</parameter>\n   </parameters>\n   ```\n3. **PHP Configuration**: You may also set this in your PHP service configuration file:\n   ```php\n   // config/services.php\n   $container->parameters()->set('debug.container.dump', false);\n   ```\nBy disabling the XML dump, you prevent Symfony from generating the large file containing service container information, which can save on processing time and enhance the performance of your development and debugging processes.""}]",knowledge/php/symfony-docs-7.1,1.0,train
"[{""from"": ""human"", ""value"": ""How can Blackfire assist in profiling Symfony applications?""}, {""from"": ""gpt"", ""value"": ""Blackfire is a powerful tool that assists in profiling Symfony applications by providing a detailed analysis of application performance. Here's how it works:\n\n1. **Integration**: Blackfire is a commercial profiling service that can be integrated with Symfony applications. After installing the Blackfire agent and client, you can easily start profiling your application during development, testing, and even in production environments.\n\n2. **Performance Metrics**: It captures various performance metrics, including execution time, memory usage, and the ability to trace database queries and service calls. This helps identify bottlenecks or performance issues within the application.\n\n3. **User-Friendly Interface**: Blackfire offers a UI where you can view collected metrics in a clear and concise manner, allowing developers to quickly identify slow parts of their application.\n\n4. **Full-Featured Demo**: For developers who wish to explore Blackfire's capabilities, it provides a full-featured demo version, allowing them to test drive the profiler without requiring a subscription upfront.\nBy employing Blackfire in your Symfony applications, you can conduct thorough performance evaluations, optimize your codebase effectively, and ultimately enhance the responsiveness of your applications.""}]",knowledge/php/symfony-docs-7.1,1.0,train
"[{""from"": ""human"", ""value"": ""What is the role of Symfony's Stopwatch component in performance profiling?""}, {""from"": ""gpt"", ""value"": ""Symfony's Stopwatch component plays a crucial role in performance profiling by allowing developers to measure the execution time and memory usage of their application code. Here\u2019s how it functions:\n\n1. **Event Measurement**: The Stopwatch component allows developers to create timing events by using methods such as `start()`, `stop()`, and `lap()`. These methods facilitate precise tracking of how long certain pieces of code take to execute, which is invaluable for identifying performance bottlenecks.\n   ```php\n   use Symfony\\Component\\Stopwatch\\Stopwatch;\n   $stopwatch = new Stopwatch();\n   $stopwatch->start('my_event');\n   // execute some code\n   $event = $stopwatch->stop('my_event');\n   echo $event->getDuration(); // returns execution time\n   ```\n2. **Memory Usage Tracking**: Besides execution time, the Stopwatch also records memory consumption during the execution of events. This helps identify not only slow parts of the code but also areas where memory usage can be optimized.\n3. **Integration with Symfony Profiler**: Events tracked using the Stopwatch can be viewed within the Symfony profiler, providing a comprehensive overview of your application\u2019s performance.\nOverall, the Stopwatch component is an essential tool for developers aiming to enhance their code's efficiency and optimize application performance.""}]",knowledge/php/symfony-docs-7.1,1.0,train
"[{""from"": ""human"", ""value"": ""How can you implement profiling in a Symfony controller using the Stopwatch component?""}, {""from"": ""gpt"", ""value"": ""To implement profiling in a Symfony controller using the Stopwatch component, follow these steps:\n\n1. **Inject the Stopwatch**: Start by injecting the `Symfony\\Component\\Stopwatch\\Stopwatch` service into your controller's constructor:\n   ```php\n   use Symfony\\Component\\Stopwatch\\Stopwatch;\n\n   class MyController\n   {\n       private Stopwatch $stopwatch;\n\n       public function __construct(Stopwatch $stopwatch)\n       {\n           $this->stopwatch = $stopwatch;\n       }\n       \n       public function myAction()\n       {\n           // Start measuring \n           $this->stopwatch->start('my_action');\n           \n           // Your controller logic goes here\n          \n           // Stop measuring\n           $this->stopwatch->stop('my_action');\n           \n           // Optionally: Use the event for debugging or logging\n           $event = $this->stopwatch->getEvent('my_action');\n           dump((string) $event); // Displays the profiling result\n       }\n   }\n   ```\n2. **Analyze Results**: After executing the action, the profiling data captured by the Stopwatch can be analyzed using the Symfony profiler tool in the development environment. This will show execution times and memory usage for the specific action.\nImplementing profiling in your controller will help you gain insights into the performance of your application and identify areas that may require optimization.""}]",knowledge/php/symfony-docs-7.1,1.0,train
"[{""from"": ""human"", ""value"": ""What is the significance of using the 'lap()' method in Symfony's Stopwatch component?""}, {""from"": ""gpt"", ""value"": ""The 'lap()' method in Symfony's Stopwatch component is significant for several reasons:\n1. **Intermediate Timing Measurements**: The `lap()` method allows developers to capture intermediate timing measurements within a long-running process. This is particularly useful for tracking execution time for loops or batch processing.\n   ```php\n   $this->stopwatch->start('process-data');\n   foreach ($dataSet as $data) {\n       // process current data\n       $this->stopwatch->lap('process-data'); // Record lap time\n   }\n   $event = $this->stopwatch->stop('process-data');\n   ```\n   In this example, `lap()` records the time taken for each iteration within the loop, providing visibility into performance for each data point.\n2. **Detailed Profiling**: Using the `lap()` method creates a history of periods that provides insights into the duration of each segment of your code execution. You can examine and analyze how long each sub-process took, helping you identify specific areas that may require optimization.\n3. **Enhanced Debugging**: By capturing detailed timing data at specific points in your processing logic, developers can better understand performance bottlenecks and make informed decisions about code optimizations.\nOverall, the `lap()` method serves as a valuable tool for developers engaged in in-depth performance profiling and optimization.""}]",knowledge/php/symfony-docs-7.1,1.0,train
"[{""from"": ""human"", ""value"": ""What approach should be taken to optimize the Symfony security class?""}, {""from"": ""gpt"", ""value"": ""Optimizing the Symfony security class can be approached through several strategies to enhance performance while maintaining robust security protocols:\n1. **Minimize Service Dependencies**: Review and minimize the number of services registered in your security configuration. Each service can introduce overhead, so ensuring only necessary services are loaded can lead to performance benefits.\n2. **Use Firewalls and Access Control Lists**: Implementing targeted firewalls and access control lists can restrict unnecessary security checks. Only required routes should be protected, decreasing the volume of checks Symfony needs to perform during requests.\n3. **Cache Security Configuration**: Caching security-related data (like roles, permissions, etc.) can improve performance by reducing the number of database queries or API calls made during the authentication process. Symfony supports caching mechanisms like Redis or Memcached to store these values.\n4. **Profile Security Logic**: Use the Stopwatch component to profile security-related logic to identify any bottlenecks in authorization processes. By identifying delays, targeted optimizations can be made where necessary.\n5. **Review User Authentication Mechanisms**: Ensure that user authentication processes are efficient. For instance, using asynchronous authentication processes or caching user sessions can significantly enhance the responsive speed of secure routes.\nBy following these strategies, you can optimize the Symfony security class, reduce latency in user authentication, and ensure overall application performance is enhanced without compromising security.""}]",knowledge/php/symfony-docs-7.1,1.0,train
