conversations,source,score,split
"[{""from"": ""human"", ""value"": ""What is the difference between public and private services in Symfony?""}, {""from"": ""gpt"", ""value"": ""In Symfony, services can be either public or private. A public service can be accessed directly from the service container using `$container->get('service_id')`. An example of a public service is the `doctrine` service, which can be obtained directly as shown below:\n```php\n$doctrine = $container->get('doctrine');\n```\n\nOn the other hand, a private service means that it cannot be accessed directly from the container. Instead, private services are meant to be injected into other services, which is the recommended approach. By default, all services in Symfony are private unless explicitly set to public in the service configuration files.\nMaking services private enhances performance by allowing the container to optimize the instantiation and provides better error management.""}]",knowledge/php/symfony-docs-7.1,1.0,train
"[{""from"": ""human"", ""value"": ""When should you mark a service as private?""}, {""from"": ""gpt"", ""value"": ""You should mark a service as private in Symfony if you do not intend to access it directly from the service container. By making services private, you encourage good design practices, such as utilizing dependency injection instead. This leads to better maintainability and testability of your code, as dependencies are injected where needed rather than being fetched from the container, which can introduce tight coupling. Furthermore, private services allows Symfony's service container to optimize how they are created, which can enhance overall application performance.""}]",knowledge/php/symfony-docs-7.1,1.0,train
"[{""from"": ""human"", ""value"": ""How can you configure a service to be public in Symfony?""}, {""from"": ""gpt"", ""value"": ""To configure a service as public in Symfony, you can do it in several ways depending on the format of your service configuration file. Here are examples for YAML, XML, and PHP:\n\n1. **YAML**:\n```yaml\n# config/services.yaml\nservices:\n    App\\Service\\Foo:\n        public: true\n```\n\n2. **XML**:\n```xml\n<!-- config/services.xml -->\n<?xml version=\""1.0\"" encoding=\""UTF-8\"" ?>\n<container xmlns=\""http://symfony.com/schema/dic/services\""\n           xmlns:xsi=\""http://www.w3.org/2001/XMLSchema-instance\""\n           xsi:schemaLocation=\""http://symfony.com/schema/dic/services https://symfony.com/schema/dic/services/services-1.0.xsd\"">\n    <services>\n        <service id=\""App\\Service\\Foo\"" public=\""true\""/>\n    </services>\n</container>\n```\n\n3. **PHP**:\n```php\n// config/services.php\nnamespace Symfony\\Component\\DependencyInjection\\Loader\\Configurator;\n\nuse App\\Service\\Foo;\n\nreturn function(ContainerConfigurator $container): void {\n    $services = $container->services();\n    $services->set(Foo::class)\n        ->public();\n};\n```\n\nIn each case, you specify the service class and set the `public` attribute to `true` to allow direct access from the container.""}]",knowledge/php/symfony-docs-7.1,1.0,train
"[{""from"": ""human"", ""value"": ""What do private services allow in Symfony?""}, {""from"": ""gpt"", ""value"": ""Private services in Symfony allow the service container to optimize the instantiation process, potentially improving performance. By marking a service as private, you ensure that the service is only accessed through dependency injection rather than directly from the container, which can reduce tight coupling and improve your application's design. Furthermore, if you reference a non-existent private service, it generates a clearer error message when the application tries to access it, providing better debugging information. This improves the maintainability of the application as it enforces a consistent approach to service usage.""}]",knowledge/php/symfony-docs-7.1,1.0,train
"[{""from"": ""human"", ""value"": ""How do you define a service alias in Symfony?""}, {""from"": ""gpt"", ""value"": ""To define a service alias in Symfony, you can use the configuration files in different formats. A service alias allows you to create a shortcut to access a service, even if the original service is private. Here\u2019s how to define a service alias in YAML, XML, and PHP formats:\n\n1. **YAML**:\n```yaml\n# config/services.yaml\nservices:\n    App\\Mail\\PhpMailer:\n        public: false\n    app.mailer:\n        alias: App\\Mail\\PhpMailer\n        public: true\n```\n\n2. **XML**:\n```xml\n<!-- config/services.xml -->\n<?xml version=\""1.0\"" encoding=\""UTF-8\"" ?>\n<container xmlns=\""http://symfony.com/schema/dic/services\""\n           xmlns:xsi=\""http://www.w3.org/2001/XMLSchema-instance\""\n           xsi:schemaLocation=\""http://symfony.com/schema/dic/services https://symfony.com/schema/dic/services/services-1.0.xsd\"">\n    <services>\n        <service id=\""App\\Mail\\PhpMailer\"" public=\""false\""/>\n        <service id=\""app.mailer\"" alias=\""App\\Mail\\PhpMailer\""/>\n    </services>\n</container>\n```\n\n3. **PHP**:\n```php\n// config/services.php\nnamespace Symfony\\Component\\DependencyInjection\\Loader\\Configurator;\n\nuse App\\Mail\\PhpMailer;\n\nreturn function(ContainerConfigurator $container): void {\n    $services = $container->services();\n    $services->set(PhpMailer::class)\n        ->private();\n    $services->alias('app.mailer', PhpMailer::class);\n};\n```\n\nIn these examples, the service `PhpMailer` can be accessed via the alias `app.mailer` despite being marked private, facilitating easier access.""}]",knowledge/php/symfony-docs-7.1,1.0,train
"[{""from"": ""human"", ""value"": ""What happens when you deprecate a service alias in Symfony?""}, {""from"": ""gpt"", ""value"": ""When you deprecate a service alias in Symfony, you indicate to developers that the alias is outdated and should not be used anymore. This is done by specifying a deprecation message in the service configuration, which will trigger a warning when the deprecated alias is accessed. Here\u2019s how you can deprecate a service alias:\n\n1. **YAML**:\n```yaml\napp.mailer:\n    alias: 'App\\Mail\\PhpMailer'\n    deprecated:\n        package: 'acme/package'\n        version: '1.2'\n        message: 'The \""%alias_id%\"" alias is deprecated. Do not use it anymore.'\n```\n\n2. **XML**:\n```xml\n<service id=\""app.mailer\"" alias=\""App\\Mail\\PhpMailer\"">\n    <deprecated package=\""acme/package\"" version=\""1.2\"">The \""%alias_id%\"" service alias is deprecated. Don't use it anymore.</deprecated>\n</service>\n```\n\n3. **PHP**:\n```php\n$container->setAlias('app.mailer', 'App\\Mail\\PhpMailer')\n    ->setDeprecated('acme/package', '1.2', 'The \""%alias_id%\"" service alias is deprecated. Don\\'t use it anymore.');\n```\n\nWhen the deprecated alias is used, the application will output a warning based on the provided deprecation message, advising developers to stop using that alias as it will be removed in the future. The deprecation messages are important for managing changes and encouraging developers to adapt to new services or patterns.""}]",knowledge/php/symfony-docs-7.1,1.0,train
"[{""from"": ""human"", ""value"": ""What are anonymous services and when would you use them?""}, {""from"": ""gpt"", ""value"": ""Anonymous services in Symfony are services that do not have a designated ID. These are typically used when you want to prevent a service from being directly accessible or injected as a dependency elsewhere in your application. They are created at the point of use, meaning they are instantiated where needed without being defined globally.\n\nYou might use anonymous services in cases where:\n1. **Limited Scope**: You want a service that is only ever used once or in a very limited scope. For example, when creating complex services that are tightly coupled, and you do not want their dependencies messing with the global service space.\n\n2. **Preventing Reuse**: You want to ensure that the service cannot be reused elsewhere in the application.\n\n3. **Factory Methods**: When defining a factory service where each invocation can use a fresh instance of the service, thereby avoiding the overhead of defining a named service.\n\nTo define an anonymous service in YAML, you might configure it like this:\n```yaml\n# config/services.yaml\nservices:\n    App\\Foo:\n        arguments:\n            - !service\n                class: App\\AnonymousBar\n```\nIn this snippet, `App\\AnonymousBar` is defined as an anonymous service that is injected into `App\\Foo`.""}]",knowledge/php/symfony-docs-7.1,1.0,train
"[{""from"": ""human"", ""value"": ""Can you provide an example of how to deprecate a service in Symfony?""}, {""from"": ""gpt"", ""value"": ""To deprecate a service in Symfony, you need to specify the deprecation details in the service configuration. Here's how you can do it in YAML, XML, and PHP:\n\n1. **YAML**:\n```yaml\n# config/services.yaml\nApp\\Service\\OldService:\n    deprecated:\n        package: 'vendor-name/package-name'\n        version: '2.8'\n        message: 'The \""%service_id%\"" service is deprecated since vendor-name/package-name 2.8 and will be removed in 3.0.'\n```\n\n2. **XML**:\n```xml\n<service id=\""App\\Service\\OldService\"">\n    <deprecated package=\""vendor-name/package-name\"" version=\""2.8\"">The \""%service_id%\"" service is deprecated since vendor-name/package-name 2.8 and will be removed in 3.0.</deprecated>\n</service>\n```\n\n3. **PHP**:\n```php\n// config/services.php\nnamespace Symfony\\Component\\DependencyInjection\\Loader\\Configurator;\n\nuse App\\Service\\OldService;\n\nreturn function(ContainerConfigurator $container): void {\n    $services = $container->services();\n    $services->set(OldService::class)\n        ->deprecate(\n            'vendor-name/package-name',\n            '2.8',\n            'The \""%service_id%\"" service is deprecated since vendor-name/package-name 2.8 and will be removed in 3.0.'\n        );\n};\n```\n\nIn each example, you provide the package name, version, and a deprecation message that includes the `%service_id%` placeholder to inform users adequately about the service's deprecated status.""}]",knowledge/php/symfony-docs-7.1,1.0,train
"[{""from"": ""human"", ""value"": ""What considerations should you keep in mind when deprecating services in Symfony?""}, {""from"": ""gpt"", ""value"": ""When deprecating services in Symfony, consider the following key points:\n1. **Custom Deprecation Messages**: Always provide a custom deprecation message to inform users about the reasons for deprecation, alternatives if any, and the timeframe within which they should stop using it.\n2. **Version Control**: Specify the version in which the service was deprecated and the version in which it will be removed. This helps users plan their migration accordingly.\n3. **Default Message**: Keep in mind that if you don't specify a message when deprecating a service, Symfony will use a default message which may not provide sufficient context. It is generally better to create informative messages.\n4. **Test Coverage**: Ensure that there are sufficient tests to cover the code where the service is used, so you can identify when the deprecated code paths are hit during the migration process.\n5. **Communication**: If you are maintaining a package or library, communicate these changes to users as they may have dependencies on that service.\n6. **Transition Plan**: Support a transition plan if the deprecated service has significant usage, especially in larger applications or systems.""}]",knowledge/php/symfony-docs-7.1,1.0,train
"[{""from"": ""human"", ""value"": ""How do anonymous services behave in relation to autowiring in Symfony?""}, {""from"": ""gpt"", ""value"": ""Anonymous services in Symfony do not inherit the default definitions provided in the service configuration, such as autowiring or autoconfiguration attributes. Therefore, if you choose to use anonymous services, you must explicitly specify if you want them to be autowired or autoconfigured. This ensures that the service behaves as expected even though it does not have a globally defined ID.\n\nFor example, if you want to ensure that an anonymous service is autowired, you could define it in this way:\n```yaml\n# config/services.yaml\nservices:\n    App\\Foo:\n        arguments:\n            - !service\n                class: App\\AnonymousBar\n                autowire: true\n```\n\nIn this example, the anonymous service `App\\AnonymousBar` is explicitly set to be autowired.""}]",knowledge/php/symfony-docs-7.1,1.0,train
"[{""from"": ""human"", ""value"": ""What are some advantages and disadvantages of using anonymous services?""}, {""from"": ""gpt"", ""value"": ""Using anonymous services in Symfony comes with its own set of advantages and disadvantages:\n\n**Advantages:**\n1. **Scoped Usage**: Anonymous services are instantiated where they are used, which can help maintain a cleaner service container without cluttering it with many services that are only used in one place.\n2. **Preventing Dependency Injection**: They cannot be injected as a dependency elsewhere, which may be desirable for maintaining strict boundaries between components.\n3. **Dynamic Creation**: They allow for a more dynamic programming style, where services can be created on-demand.\n\n**Disadvantages:**\n1. **No ID**: Since they lack a service ID, it can be harder to reference them in debugging or logging, leading to potential challenges in identifying issues.\n2. **Configuration Complexity**: Setting up anonymous services can become complex, especially when it comes to defining dependencies or configuring them, as you cannot reuse configurations or service options easily.\n3. **Learning Curve**: For developers not familiar with the concept, using anonymous services may introduce a steeper learning curve as they adapt to this pattern.""}]",knowledge/php/symfony-docs-7.1,1.0,train
"[{""from"": ""human"", ""value"": ""What is the impact of deprecating services on application maintenance?""}, {""from"": ""gpt"", ""value"": ""Deprecating services has a significant impact on application maintenance in a few key areas:\n1. **Code Refactoring**: When deprecated services are found in the codebase, developers will need to refactor the code to replace deprecated functionality with alternatives, which can be time-consuming.\n2. **Testing and Validation**: It becomes crucial to test the application to ensure that refactoring is done correctly, which may require considerable effort, especially in large codebases. Continuous integration tests can help catch issues early.\n3. **Documentation Updates**: The deprecation of services might require updates to the documentation to reflect changes in usage and introduce developers to alternatives.\n4. **User Communication**: If the application is part of a library or package used by others, it is critical to communicate these changes so that users can adapt their implementations based on the deprecation timelines provided.\n5. **Encouraging Best Practices**: Deprecation can drive developers towards adopting current best practices and keeping the codebase modern and robust. Developers need to stay informed about updates and changes in frameworks to maintain quality.""}]",knowledge/php/symfony-docs-7.1,1.0,train
"[{""from"": ""human"", ""value"": ""How does Symfony handle errors when referencing non-existent private services?""}, {""from"": ""gpt"", ""value"": ""In Symfony, if you try to reference a non-existent private service, the framework generates a clear error message at runtime. This happens when there is an attempt to fetch a private service that has not been defined in the service container. The error message typically indicates that the specified service cannot be found or is not available, helping you quickly identify the issue while debugging.\n\nThis error handling approach improves developer experience as it provides immediate feedback about incorrect service usages, making it easier to resolve issues proactively instead of after deployment. This mechanism encourages better coding practices by promoting diligent use of service management.""}]",knowledge/php/symfony-docs-7.1,1.0,train
"[{""from"": ""human"", ""value"": ""Can you explain the service deprecation process in Symfony?""}, {""from"": ""gpt"", ""value"": ""The service deprecation process in Symfony involves the following steps:\n1. **Identify Services to Deprecate**: Assess services that are outdated, no longer maintained, or should not be recommended for use due to new alternatives.\n2. **Define Deprecation Metadata**: Implement a deprecation message in the service configuration using YAML, XML, or PHP, outlining why the service is deprecated, the version when it was deprecated, and the version when it will be removed. This typically includes a message template with placeholders for service IDs.\n3. **Update Codebase**: As developers use the deprecated service, they will receive warnings. The next step involves updating the application code to replace usage of the deprecated service with the recommended alternatives.\n4. **Communicate the Changes**: If necessary, inform users of your application or library about the upcoming deprecation to facilitate smoother transitions.\n5. **Remove Deprecated Services**: In a subsequent release (often the next major version), completely remove the deprecated services from the codebase once enough time has been allotted for adaptation.""}]",knowledge/php/symfony-docs-7.1,1.0,train
