conversations,source,score,split
"[{""from"": ""human"", ""value"": ""What is the definition of a workflow in the context of Symfony?""}, {""from"": ""gpt"", ""value"": ""In Symfony, a workflow is defined as a model of a process within an application. It encompasses various predefined steps (places) and actions (transitions) that move an object from one state to another. The workflow provides a structured way to manage and represent processes such as the lifecycle of a blog post\u2014from drafting to publishing\u2014or a series of form submissions. Workflows keep process logic separate from controllers, models, and views, allowing for greater flexibility in how the processes are configured and executed.""}]",knowledge/php/symfony-docs-7.1,1.0,train
"[{""from"": ""human"", ""value"": ""What are transitions in Symfony workflows?""}, {""from"": ""gpt"", ""value"": ""Transitions in Symfony workflows refer to the defined actions that enable movement from one place (state) to another within a workflow. Each transition specifies a starting place and a destination place. For example, in a workflow for job applications, a transition could define how a submission can proceed from a 'test' state to a 'review' state. By setting up transitions effectively, developers can enforce business rules and logic within the process management framework.""}]",knowledge/php/symfony-docs-7.1,1.0,train
"[{""from"": ""human"", ""value"": ""Can you explain the role of the marking store in a Symfony workflow?""}, {""from"": ""gpt"", ""value"": ""The marking store in a Symfony workflow is responsible for tracking the current state (or place) of an object within the workflow. When an object's state is changed via a transition, the marking store writes this updated state to a specified property on the object, which allows for persistence of the workflow's current position. This mechanism ensures that the state of the workflow can be easily retrieved and manipulated, facilitating accurate process management in the application.""}]",knowledge/php/symfony-docs-7.1,1.0,train
"[{""from"": ""human"", ""value"": ""What is the difference between workflows and state machines?""}, {""from"": ""gpt"", ""value"": ""The main differences between workflows and state machines in Symfony are as follows:\n1. **Multiplicity of Places**: Workflows can exist in multiple places at the same time, meaning an object can be in several states simultaneously, while state machines can only be in one state at a time.\n2. **Transition Conditions**: To apply a transition in a workflow, the object must be present in all the previous places that lead to the transition, whereas a state machine only requires the object to be in one of the specified places.\nThese distinctions define their respective usages, with workflows being suitable for more complex scenarios involving multiple processes, and state machines being better for straightforward state management.""}]",knowledge/php/symfony-docs-7.1,1.0,train
"[{""from"": ""human"", ""value"": ""Describe a simple example of a workflow and its elements.""}, {""from"": ""gpt"", ""value"": ""A simple example of a workflow can be illustrated using a process for a blog post:\n1. **Places**: 'Draft', 'Review', 'Published'.\n2. **Transitions**: \n   - Transition from 'Draft' to 'Review' when the author submits the post for review.\n   - Transition from 'Review' to 'Published' upon approval.\nIn this example, the workflow outlines the states that a blog post can be in and the actions required to move it through its lifecycle. This structure allows easier management of the publishing process without mixing it with the application\u2019s core logic.""}]",knowledge/php/symfony-docs-7.1,1.0,train
"[{""from"": ""human"", ""value"": ""What does a GuardEvent do in a Symfony workflow?""}, {""from"": ""gpt"", ""value"": ""A `GuardEvent` in a Symfony workflow serves as a checkpoint that determines whether a transition is permissible based on certain conditions. It allows developers to specify rules that need to be satisfied before proceeding with a transition. For instance, in a job application workflow, a `GuardEvent` may assess whether the requisite personality and logic tests have been completed before allowing the candidate to proceed to the 'Review' stage of their application.""}]",knowledge/php/symfony-docs-7.1,1.0,train
"[{""from"": ""human"", ""value"": ""Can you provide the YAML configuration for a pull request state machine?""}, {""from"": ""gpt"", ""value"": ""Sure! Below is an example YAML configuration for a pull request state machine in Symfony:\n```yaml\n# config/packages/workflow.yaml\nframework:\n    workflows:\n        pull_request:\n            type: 'state_machine'\n            marking_store:\n                 type: 'method'\n                 property: 'currentPlace'\n            supports:\n                - App\\Entity\\PullRequest\n            initial_marking: start\n            places:\n                - start\n                - coding\n                - test\n                - review\n                - merged\n                - closed\n            transitions:\n                submit:\n                    from: start\n                    to: test\n                update:\n                    from: [coding, test, review]\n                    to: test\n                wait_for_review:\n                    from: test\n                    to: review\n                request_change:\n                    from: review\n                    to: coding\n                accept:\n                    from: review\n                    to: merged\n                reject:\n                    from: review\n                    to: closed\n                reopen:\n                    from: closed\n                    to: review\n```\nThis configuration outlines the states (places) and allowable transitions for a pull request lifecycle.""}]",knowledge/php/symfony-docs-7.1,1.0,train
"[{""from"": ""human"", ""value"": ""What is a practical example of a state machine in action in Symfony?""}, {""from"": ""gpt"", ""value"": ""A practical example of a state machine in Symfony can be illustrated via a pull request process in a version control system. Here\u2019s how the states might be configured:  \n1. **States**: 'start', 'test', 'review', 'merged', 'closed'.  \n2. **Transitions**: \n   - From 'start' to 'test' when tests are triggered. \n   - From 'test' to 'review' after tests completion. \n   - From 'review' to 'merged' when accepted, or to 'closed' if rejected. \n   - From 'closed' back to 'review' if the pull request is reopened.  \nThis setup provides clear tracking of the pull request lifecycle while ensuring that each transition is explicit and manageable, with defined rules to follow as contributors interact with the pull request.""}]",knowledge/php/symfony-docs-7.1,1.0,train
"[{""from"": ""human"", ""value"": ""Explain how to implement automatic validation for state machines in Symfony.""}, {""from"": ""gpt"", ""value"": ""To implement automatic validation for state machines in Symfony, you must follow these steps:\n1. **Define Your States and Transitions**: Clearly outline all the states and valid transitions within your configuration.\n2. **Configure Your State Machine**: Set up your state machine configuration in either YAML, XML, or PHP based on your preference.\n3. **Use Automatic Validation During Cache Warmup**: Symfony validations occur during the cache warmup phase, which automatically checks the defined workflows and state machines in configuration files for consistency and correctness.\n4. **Manually Validate Programmatically**: If your state machine is defined programmatically, utilize the `StateMachineValidator` class to validate it manually. Here\u2019s an example:\n```php\nuse Symfony\\Component\\Workflow\\Definition;\nuse Symfony\\Component\\Workflow\\StateMachine;\nuse Symfony\\Component\\Workflow\\Validator\\StateMachineValidator;\n\n$states = ['created', 'activated', 'deleted'];\n$stateTransitions = [\n    new Transition('activate', 'created', 'activated'),\n    // This duplicate event from \""created\"" state is invalid\n    new Transition('activate', 'created', 'deleted'),\n    new Transition('delete', 'activated', 'deleted'),\n];\n\ndefinition = new Definition($states, $stateTransitions);\n$validator = new StateMachineValidator();\n$validator->validate($definition, 'My First StateMachine');\n// This will throw an InvalidDefinitionException if the transitions are incorrect.\n```\nThis approach ensures your configurations are valid, preventing unexpected behavior at runtime.""}]",knowledge/php/symfony-docs-7.1,1.0,train
"[{""from"": ""human"", ""value"": ""What code snippet demonstrates service autowiring for workflows in Symfony?""}, {""from"": ""gpt"", ""value"": ""To demonstrate service autowiring for workflows in Symfony, you might have a service class that utilizes the workflow for processing pull requests. Here's an example:\n```php\nnamespace App\\Service;\n\nuse App\\Entity\\PullRequest;\nuse Symfony\\Component\\Workflow\\WorkflowInterface;\n\nclass PullRequestService\n{\n    public function __construct(\n        private WorkflowInterface $pullRequestStateMachine\n    ) {}\n\n    public function handlePullRequest(PullRequest $pullRequest): void\n    {\n        $this->pullRequestStateMachine->apply($pullRequest, 'wait_for_review', [\n            'log_comment' => 'Transitioning to wait for review.'\n        ]);\n        // Additional logic to handle pull request...\n    }\n}\n```\nIn this snippet, Symfony automatically injects the configured 'pull_request' state machine into the `PullRequestService` class, allowing for streamlined processing of the pull request through the defined workflow.""}]",knowledge/php/symfony-docs-7.1,1.0,train
"[{""from"": ""human"", ""value"": ""How does Symfony automatically create a service for each defined workflow?""}, {""from"": ""gpt"", ""value"": ""Symfony automatically creates a service for each workflow or state machine defined in your configuration files through its service container. When you specify a workflow in the configuration (e.g., YAML, XML), the framework generates a corresponding service of type `Symfony\\Component\\Workflow\\Workflow` for workflows or `Symfony\\Component\\Workflow\\StateMachine` for state machines. This allows you to easily inject the workflow into services or controllers using dependency injection. The naming convention for these services follows the pattern 'camelCased workflow name + Workflow' for workflows, and 'camelCased workflow name + StateMachine' for state machines, which maintains consistency and facilitates autowiring.""}]",knowledge/php/symfony-docs-7.1,1.0,train
"[{""from"": ""human"", ""value"": ""What types of transitions are available in the pull request state machine example?""}, {""from"": ""gpt"", ""value"": ""In the pull request state machine example, the following transitions are defined:\n1. **submit**: Moves the state from 'start' to 'test'.\n2. **update**: Transitions from 'coding', 'test', or 'review' back to 'test'.\n3. **wait_for_review**: Transitions from 'test' to 'review'.\n4. **request_change**: Moves from 'review' to 'coding' if changes are required.\n5. **accept**: Transitions from 'review' to 'merged' when the pull request is accepted.\n6. **reject**: Moves from 'review' to 'closed' if the pull request is rejected.\n7. **reopen**: Transitions back from 'closed' to 'review' if the pull request is reopened.\nThese transitions establish a clear pathway for managing the states of pull requests within the system.""}]",knowledge/php/symfony-docs-7.1,1.0,train
"[{""from"": ""human"", ""value"": ""Can you summarize the entire process of configuring a state machine in Symfony?""}, {""from"": ""gpt"", ""value"": ""Configuring a state machine in Symfony involves several steps:\n1. **Define the State Machine Configuration**: Start by outlining your states and transitions in a configuration file (YAML, XML, or PHP). This defines the behavior of the state machine and how objects will transition from one state to another.\n2. **Declare the Marking Store**: Set up the marking store to specify how the current state will be tracked within the objects. This is crucial for retaining the current state during the lifecycle of an object.\n3. **Integrate with Entities**: Ensure the state machine is linked to relevant entities, allowing it to manage their state effectively. This is done through the 'supports' key in the configuration.\n4. **Automatic Validation Setup**: Enable automatic validation during the cache warmup so that Symfony checks for inconsistencies or errors in the configuration.\n5. **Service Autowiring**: Use service autowiring to inject the state machine into services using the established naming conventions. This simplifies usage across different parts of the application.\n6. **Handling Transitions**: Implement logic within services or controllers to apply transitions based on user actions or events, leveraging the state machine\u2019s capabilities to maintain the correct state of objects.  \nBy following these steps, developers ensure functional and manageable state machines within their Symfony applications, enabling effective process management.""}]",knowledge/php/symfony-docs-7.1,1.0,train
"[{""from"": ""human"", ""value"": ""How does the Symfony workflow configuration differ when defined in PHP compared to YAML?""}, {""from"": ""gpt"", ""value"": ""The Symfony workflow configuration differs in structure and syntax when defined in PHP compared to YAML:\n1. **Syntax**: YAML uses a hierarchical structure with indentation and, generally, a simpler syntax, while PHP requires an explicit function definition within an array format, using method calls to define states, transitions, and other properties. \n2. **Dynamic Configurations**: Defining workflows in PHP allows for dynamic configurations where you might conditionally determine states or transitions based on runtime conditions, something more static in YAML.\n3. **Type Safety**: PHP definitions may provide better type safety and clarity, allowing for explicit control over how configurations are set and used within the application.\nHere\u2019s an example in PHP:\n```php\nuse Symfony\\Config\\FrameworkConfig;\n\nreturn static function (FrameworkConfig $framework): void {\n    $pullRequest = $framework->workflows()->workflows('pull_request');\n    $pullRequest->type('state_machine')\n        ->supports(['App\\Entity\\PullRequest'])\n        ->initialMarking(['start']);\n    // ... more configuration\n};\n```\nIn contrast, a corresponding YAML configuration would be:\n```yaml\nframework:\n    workflows:\n        pull_request:\n            type: 'state_machine'\n            supports:\n                - App\\Entity\\PullRequest\n            initial_marking: start\n            # ... more configuration\n```\nThese differences affect how developers interact with configuration and the degree of flexibility they have.""}]",knowledge/php/symfony-docs-7.1,1.0,train
"[{""from"": ""human"", ""value"": ""What mechanisms does Symfony provide for verifying workflows and state machines?""}, {""from"": ""gpt"", ""value"": ""Symfony provides several mechanisms for verifying workflows and state machines:\n1. **Automatic Validation During Cache Warmup**: When Symfony's cache is warmed up, it automatically validates the workflows and state machines defined in any configuration files. This checks for configuration consistency and correctness before the application execution begins.\n2. **Manual Validation**: If workflows or state machines are defined programmatically, developers can use the `WorkflowValidator` and `StateMachineValidator` classes to manually validate their configurations at any point in the application lifecycle. \n3. **Error Handling**: If validation fails, Symfony throws an `InvalidDefinitionException`, helping developers identify and rectify issues in their workflow configurations efficiently.\n4. **Logging and Monitoring**: Developers can implement logging to capture validation errors or configurations that do not adhere to expected patterns, promoting better maintenance practices.  \nOverall, these mechanisms ensure that workflows and state machines operate correctly, preventing runtime errors due to improper configurations.""}]",knowledge/php/symfony-docs-7.1,1.0,train
"[{""from"": ""human"", ""value"": ""What is the significance of using GuardEvents in workflows?""}, {""from"": ""gpt"", ""value"": ""The significance of using `GuardEvents` in Symfony workflows lies in their ability to enforce business rules and decision logic at specific points within the workflow process. Here are several key roles they play:\n1. **Conditional Processing**: They allow transitions to only occur if certain conditions or criteria are met, ensuring that workflows adhere to predefined rules.\n2. **Improved Robustness**: By implementing `GuardEvents`, developers can prevent invalid transitions that could lead to inconsistencies or errors in the application state.\n3. **Decoupled Logic**: They help in separating the transition logic from the workflow definitions, thereby promoting cleaner code and easier maintenance by isolating the decision-making aspects from the state management.\n4. **Flexible Control**: With `GuardEvents`, more complex workflows can be designed to dynamically respond to user input or system states, enhancing overall user experience and system reliability.\nBy leveraging `GuardEvents`, developers can create more intelligent workflows that adapt to changing conditions and requirements.""}]",knowledge/php/symfony-docs-7.1,1.0,train
"[{""from"": ""human"", ""value"": ""What should be considered when designing a state machine?""}, {""from"": ""gpt"", ""value"": ""When designing a state machine, several factors should be considered:\n1. **State Definitions**: Clearly define all possible states and ensure they cover every scenario the object may encounter throughout its lifecycle.\n2. **Transitions**: Specify allowable transitions between states, and make sure they reflect realistic paths the object can take. Incorrect or ambiguous transitions can lead to unexpected behavior.\n3. **Guard Events**: Implement guard events where necessary to enforce business rules and prevent illegal transitions. This ensures that the state machine adheres to the application\u2019s business logic.\n4. **Testing**: Thoroughly test state transitions under various scenarios to ensure that the state machine behaves as expected, particularly edge cases that might lead to failure.\n5. **Performance**: Consider the performance implications of the state machine, especially in complex scenarios involving many states and transitions. Efficient processing is crucial for performance-sensitive applications.\n6. **Documentation**: Maintain extensive documentation of the state machine design, including state transitions and the rationale behind the configurations, to facilitate easier onboarding of new developers and maintainability.\nBy paying attention to these factors, developers can design robust and efficient state machines suitable for handling complex application logic.""}]",knowledge/php/symfony-docs-7.1,1.0,train
