conversations,source,score,split
"[{""from"": ""human"", ""value"": ""What is the purpose of the Symfony Config component?""}, {""from"": ""gpt"", ""value"": ""The Symfony Config component is designed to assist developers in managing configuration values across various sources such as YAML, XML, INI files, or databases. It provides classes to help find, load, combine, fill, and validate these configuration values seamlessly, ensuring flexibility and ease of use when handling application configurations.""}]",knowledge/php/symfony-docs-7.1,1.0,train
"[{""from"": ""human"", ""value"": ""How can you install the Symfony Config component?""}, {""from"": ""gpt"", ""value"": ""You can install the Symfony Config component using Composer by running the following command in your terminal:\n\n```bash\n$ composer require symfony/config\n```\nThis command will add the Config component to your Symfony project, making it available for managing configuration values.""}]",knowledge/php/symfony-docs-7.1,1.0,train
"[{""from"": ""human"", ""value"": ""What types of configuration sources does the Symfony Config component support?""}, {""from"": ""gpt"", ""value"": ""The Symfony Config component supports several sources for configuration values, including:\n- **YAML**: A human-readable data serialization format often used for configuration files.\n- **XML**: A markup language that defines a set of rules for encoding documents in a format that is both human-readable and machine-readable.\n- **INI files**: Simple text files for configuration, commonly used in PHP applications.\n- **Databases**: The component can also load configurations stored in databases, allowing for dynamic configuration management.\nThis versatility makes it suitable for a wide range of applications.""}]",knowledge/php/symfony-docs-7.1,1.0,train
"[{""from"": ""human"", ""value"": ""Can you provide an example of how to load a configuration file using the Symfony Config component?""}, {""from"": ""gpt"", ""value"": ""Certainly! Below is an example of how to use the Symfony Config component to load a YAML configuration file:\n\n1. **First**, create a configuration file named `config.yaml`:\n```yaml\nparameters:\n    database_host: localhost\n    database_user: root\n    database_password: secret\n```\n\n2. **Next**, create a PHP script to load this configuration:\n```php\n// src/ConfigLoader.php\nnamespace App;\n\nuse Symfony\\Component\\Config\\Loader\\LoaderInterface;\nuse Symfony\\Component\\Config\\FileLocator;\nuse Symfony\\Component\\Yaml\\Yaml;\n\nclass ConfigLoader\n{\n    private $config;\n\n    public function __construct() {\n        $this->loadConfig();\n    }\n\n    private function loadConfig() {\n        try {\n            $this->config = Yaml::parseFile(__DIR__ . '/config.yaml');\n        } catch (Exception $e) {\n            // Handle loading error\n            echo 'Could not load configuration: ' . $e->getMessage();\n        }\n    }\n\n    public function getConfig() {\n        return $this->config;\n    }\n}\n```\n\n3. **Finally**, you can use the `ConfigLoader` class to fetch the configuration values:\n```php\n$configLoader = new App\\ConfigLoader();\n$config = $configLoader->getConfig();\necho $config['parameters']['database_host']; // Outputs: localhost\n```""}]",knowledge/php/symfony-docs-7.1,1.0,train
"[{""from"": ""human"", ""value"": ""What are some advantages of using the Symfony Config component for application configuration?""}, {""from"": ""gpt"", ""value"": ""Using the Symfony Config component offers several advantages for managing application configurations:\n1. **Support for Multiple Formats**: It allows for configuration values to be defined in various formats (YAML, XML, INI), catering to different preferences and use cases.\n2. **Validation**: The component can validate configurations, ensuring that the provided values comply with specified rules before being used by the application.\n3. **Extensibility**: Developers can extend the functionality of the Config component, allowing for customized loading and merging strategies tailored to specific application needs.\n4. **Consistency**: With a centralized management system for configuration values, it promotes consistency across different parts of an application, reducing the risk of errors due to misconfigured settings.\n5. **Separation of Concerns**: It helps maintain a clear separation of application logic and configuration details, making the application easier to maintain and adapt.""}]",knowledge/php/symfony-docs-7.1,1.0,train
"[{""from"": ""human"", ""value"": ""What additional resources are available for learning more about the Symfony Config component?""}, {""from"": ""gpt"", ""value"": ""To learn more about the Symfony Config component, you can explore the following resources:\n- **Official Symfony Documentation**: The best place to start is the official Symfony documentation, which provides comprehensive details on installation, usage, and examples.\n- **GitHub Repository**: Check out the Symfony Config component's GitHub repository for the latest updates, source code, and community discussions.\n- **Tutorials**: Various online tutorials and courses focus on Symfony, some of which include sections dedicated to the Config component.\n- **Symfony Community**: Engaging with the Symfony community through forums and chat groups can provide practical insights and tips from experienced developers.""}]",knowledge/php/symfony-docs-7.1,1.0,train
"[{""from"": ""human"", ""value"": ""How does the Symfony Config component help in combining configuration values from different sources?""}, {""from"": ""gpt"", ""value"": ""The Symfony Config component facilitates the combination of configuration values from different sources by providing classes and interfaces that can handle multiple formats and origins. Here\u2019s how:\n1. **Hierarchy Management**: It allows developers to define a hierarchy of configuration files, where lower priority configurations can be overridden by higher priority ones, thus managing conflicts seamlessly.\n2. **Loader Classes**: Specialized loader classes can be created to load configurations from various sources, such as files, environment variables, or even databases, enabling a flexible and adaptable configuration system.\n3. **Merging Strategies**: The component allows developers to define custom merging strategies for combining values from different sources. For example, if two configuration files define the same parameter, developers can choose to merge the values (if they are arrays) or one value can take precedence over another.\n4. **Environment-Specific Configurations**: It supports environment-specific configurations, allowing the application to load different settings based on the environment (development, production, etc.), which is essential for robust application deployment across various environments.""}]",knowledge/php/symfony-docs-7.1,1.0,train
"[{""from"": ""human"", ""value"": ""Can you explain the concept of validation in the Symfony Config component?""}, {""from"": ""gpt"", ""value"": ""Validation in the Symfony Config component refers to the process of ensuring that the configuration values meet specific requirements before they are utilized by the application. Here are the main concepts regarding validation in this component:\n1. **Schema Definition**: Developers can define schemas that specify the expected structure and types of the configuration values. This can include data types like strings, integers, arrays, and even more complex objects.\n2. **Built-in Validation**: The component provides built-in validation mechanisms that check whether the configuration values adhere to the defined schema. This step is crucial for avoiding runtime errors due to misconfigured settings.\n3. **Custom Validators**: If the built-in validators are insufficient, developers can create custom validators to enforce business-specific rules, such as checking value ranges or ensuring certain values are not empty.\n4. **Error Handling**: In case of validation failures, the component can throw exceptions or return specific error messages, making it easier for developers to pinpoint and correct configuration issues during deployment.""}]",knowledge/php/symfony-docs-7.1,1.0,train
