conversations,source,score,split
"[{""from"": ""human"", ""value"": ""What is the main purpose of the VarExporter component in Symfony?""}, {""from"": ""gpt"", ""value"": ""The VarExporter component in Symfony is designed to export any serializable PHP data structure to plain PHP code. This allows for the instantiation and population of objects without requiring the invocation of their constructors. By doing so, it offers a performance advantage over traditional serialization methods such as `serialize()` or `igbinary`, particularly when combined with PHP's OPcache, leading to better memory efficiency and faster execution.""}]",knowledge/php/symfony-docs-7.1,1.0,train
"[{""from"": ""human"", ""value"": ""How can you install the VarExporter component?""}, {""from"": ""gpt"", ""value"": ""You can install the VarExporter component in Symfony by using Composer with the following command:\n```bash\n$ composer require --dev symfony/var-exporter\n```This command adds the VarExporter component as a development dependency to your Symfony project.""}]",knowledge/php/symfony-docs-7.1,1.0,train
"[{""from"": ""human"", ""value"": ""Can you provide a code snippet demonstrating how to export and regenerate a variable using the VarExporter component?""}, {""from"": ""gpt"", ""value"": ""Sure! Here\u2019s a code snippet that demonstrates how to use the VarExporter component to export a variable and later regenerate it:\n```php\nuse Symfony\\Component\\VarExporter\\VarExporter;\n\n// Exporting a variable\n$someVariable = ['foo' => 'bar', 'baz' => 123];\n$exported = VarExporter::export($someVariable);\n// Store the exported variable in a PHP file\nfile_put_contents('exported.php', '<?php return ' . $exported . ';');\n\n// Regenerating the variable later\n$regeneratedVariable = require 'exported.php';\n```In this example, we create an array, export it, save it to a file, and later regenerate it by including that file.""}]",knowledge/php/symfony-docs-7.1,1.0,train
"[{""from"": ""human"", ""value"": ""What advantages does VarExporter have over the standard serialize function?""}, {""from"": ""gpt"", ""value"": ""The VarExporter component offers several advantages over the standard `serialize()` function:\n1. **Performance**: It generates plain PHP code that, when executed, offers faster performance and more efficient memory usage compared to `unserialize()`.\n2. **Preservation of Semantics**: It maintains semantics associated with serialization like `__wakeup()`, `__sleep()`, and `Serializable`, which the `var_export` function ignores.\n3. **Reference Handling**: References involving classes such as `SplObjectStorage`, `ArrayObject`, and `ArrayIterator` are preserved.\n4. **Error Handling**: Missing classes throw a `ClassNotFoundException` rather than being unserialized into `PHP_Incomplete_Class` objects, enhancing error management.\n5. **Restricted Classes**: Classes like `Reflection*`, `IteratorIterator`, and `RecursiveIteratorIterator` will throw exceptions when serialization is attempted, providing greater control.\nThese features lead to a more predictable and efficient handling of PHP data structures.""}]",knowledge/php/symfony-docs-7.1,1.0,train
"[{""from"": ""human"", ""value"": ""What does the instantiator in the VarExporter component do?""}, {""from"": ""gpt"", ""value"": ""The instantiator in the VarExporter component allows you to create objects and assign their properties without invoking their constructors or any other methods. This is useful in scenarios where you want to instantiate an object in a specific state without triggering the initialization routines defined in its constructor. For example:\n```php\nuse Symfony\\Component\\VarExporter\\Instantiator;\n\n// creates an empty instance of Foo\n$fooObject = Instantiator::instantiate(Foo::class);\n\n// creates a Foo instance and sets one of its properties\n$fooObject = Instantiator::instantiate(Foo::class, ['propertyName' => $propertyValue]);\n```In this code snippet, the `instantiate` method can be used to create an instance of a class, optionally providing property values directly.""}]",knowledge/php/symfony-docs-7.1,1.0,train
"[{""from"": ""human"", ""value"": ""How can the Hydrator be used with existing objects in Symfony's VarExporter?""}, {""from"": ""gpt"", ""value"": ""The Hydrator in Symfony's VarExporter component is used to populate properties of already instantiated objects. This allows you to set properties on objects that have already been created, without using their constructors. Here\u2019s an example usage:\n```php\nuse Symfony\\Component\\VarExporter\\Hydrator;\n\n$object = new Foo();\nHydrator::hydrate($object, ['propertyName' => $propertyValue]);\n```\nIn this example, an instance of `Foo` is created first and then its property is populated using the `hydrate` method. You can also hydrate properties of a parent class by providing the class name in the third argument:\n```php\nHydrator::hydrate($object, [], [Bar::class => ['privateBarProperty' => $propertyValue]]);\n```This enables you to manage properties efficiently after the object has been created.""}]",knowledge/php/symfony-docs-7.1,1.0,train
"[{""from"": ""human"", ""value"": ""Explain what lazy objects are and how they are implemented in the VarExporter component.""}, {""from"": ""gpt"", ""value"": ""Lazy objects are instances of classes that are instantiated without any initial properties, and their properties are populated only when needed. This is useful for optimizing performance, especially when certain properties require expensive computations to determine their values. In Symfony's VarExporter component, lazy objects can be implemented using the `LazyGhostTrait`. Here is an example:\n```php\nnamespace App\\Hash;\n\nuse Symfony\\Component\\VarExporter\\LazyGhostTrait;\n\nclass HashProcessor\n{\n    use LazyGhostTrait;\n\n    public readonly string $hash;\n\n    public function __construct()\n    {\n        self::createLazyGhost(initializer: $this->populateHash(...), instance: $this);\n    }\n\n    private function populateHash(array $data): void\n    {\n        // Compute $this->hash value with the passed data\n    }\n}\n```\nIn this example, `HashProcessor` implements `LazyGhostTrait`. The `populateHash` method will only be called when a method on the `HashProcessor` object is actually used, preventing unnecessary heavy computation until its value is needed.""}]",knowledge/php/symfony-docs-7.1,1.0,train
"[{""from"": ""human"", ""value"": ""Can you describe the functionality of the `LazyProxyTrait` in the VarExporter component?""}, {""from"": ""gpt"", ""value"": ""The `LazyProxyTrait` in the VarExporter component serves a similar purpose to lazy objects, but it is specifically designed to work with abstract classes and internal PHP classes. This trait facilitates the creation of virtual proxies, allowing you to implement on-demand property loading while adhering to the Liskov Substitution Principle. Here's how it works:\n1. **Proxy Creation**: You create a proxy class for an abstract or internal class using the `ProxyHelper` to generate the proxy class code.\n2. **Initialization Logic**: When creating an instance of the proxy, you can define an initializer function that sets values or performs operations needed to compute the properties only when they're accessed.\nExample usage:\n```php\n$proxyCode = ProxyHelper::generateLazyProxy(new \\ReflectionClass(AbstractProcessor::class));\neval('class HashProcessorProxy'.$proxyCode);\n\n$processor = HashProcessorProxy::createLazyProxy(initializer: function (): ProcessorInterface {\n    $data = /** Retrieve required data to compute the hash */;\n    return new HashProcessor(...$data);\n});\n```\nWith this implementation, if a property like `hash` isn't accessed, the heavy computation is never triggered, effectively optimizing performance while maintaining the contract of the abstract processor class.""}]",knowledge/php/symfony-docs-7.1,1.0,train
"[{""from"": ""human"", ""value"": ""What are the differences between ghost objects and virtual proxies in the VarExporter?""}, {""from"": ""gpt"", ""value"": ""Ghost objects and virtual proxies both aim to optimize the instantiation of objects to avoid heavy computations until necessary, but they differ in their implementation and usage:\n1. **Class Restriction**: Ghost objects require extending a base class, whereas virtual proxies can work with abstract classes and internal PHP classes without the need for inheritance.\n2. **Flexibility**: Virtual proxies leverage the Liskov Substitution Principle, allowing you to switch between different implementations that adhere to the same interface, enhancing flexibility.\n3. **Implementation**: Ghost objects utilize the `LazyGhostTrait` to modify their behavior, while virtual proxies are created using the `ProxyHelper` to generate class code that governs their behavior.\n4. **Initialization**: The way properties are initialized differs. Ghost objects may use a general initializer for the entire object, while virtual proxies can handle property initialization one by one based on the logic defined in the initializer function.\nBoth approaches aim to improve the performance of your applications by minimizing unnecessary computation when properties are not accessed.""}]",knowledge/php/symfony-docs-7.1,1.0,train
"[{""from"": ""human"", ""value"": ""Can you give an example of how to create and use LazyGhost objects in Symfony?""}, {""from"": ""gpt"", ""value"": ""Certainly! Here is an example of how to create and use LazyGhost objects in Symfony using the `LazyGhostTrait`:\n```php\nnamespace App\\Hash;\n\nuse Symfony\\Component\\VarExporter\\LazyGhostTrait;\n\nclass MyLazyObject\n{\n    use LazyGhostTrait;\n\n    public readonly string $importantValue;\n\n    public function __construct()\n    {\n        self::createLazyGhost(initializer: $this->performHeavyComputation(...), instance: $this);\n    }\n\n    private function performHeavyComputation(array $data): void\n    {\n        // Simulate heavy computation\n        $this->importantValue = 'Computed Value';\n    }\n}\n\n$lazyObject = new MyLazyObject();\n// The heavy computation is not triggered yet.\n// Trigger the computation when accessing the property:\necho $lazyObject->importantValue;  // This will compute the value for the first time.\n```\nIn this example, `MyLazyObject` is an instance that employs lazy computation for its `importantValue` property. The property is computed only the first time it's accessed, thereby optimizing resource usage.""}]",knowledge/php/symfony-docs-7.1,1.0,train
"[{""from"": ""human"", ""value"": ""What is the role of the Hydrator class in Symfony's VarExporter component?""}, {""from"": ""gpt"", ""value"": ""The Hydrator class in Symfony's VarExporter component plays a crucial role in populating properties of existing objects. It effectively allows the assignment of values to an object's properties after its instantiation, facilitating the management of object state. This is especially useful in scenarios where you have a previously created object whose properties need to be set based on some external data or condition. For example:\n```php\nuse Symfony\\Component\\VarExporter\\Hydrator;\n\n$object = new Foo();\nHydrator::hydrate($object, ['propertyName' => $propertyValue]);\n```\nIn this code, a new instance of `Foo` is created, and then the `hydrate` method is called to populate a specific property with a value. This method can also accommodate properties of parent classes and provides flexibility in adjusting an object's state without the need for further constructor logic.""}]",knowledge/php/symfony-docs-7.1,1.0,train
"[{""from"": ""human"", ""value"": ""How can the special property name '\\0' be used with ArrayObject in the VarExporter component?""}, {""from"": ""gpt"", ""value"": ""In the VarExporter component, the special property name `\\0` is used to define the internal value of specific objects such as `ArrayObject`, `ArrayIterator`, and `SplObjectHash`. This allows the instantiation of these complex data structures while enabling you to set their initial states. Here\u2019s how you can use it with `ArrayObject`:\n```php\nuse Symfony\\Component\\VarExporter\\Instantiator;\n\n$theObject = Instantiator::instantiate(ArrayObject::class, [\n    \""\\0\"" => [$inputArray],\n]);\n```\nIn this snippet, an instance of `ArrayObject` is created and populated with an input array via the `\\0` property. This capability enables seamless instantiation of PHP data structures while adhering to the VarExporter component.""}]",knowledge/php/symfony-docs-7.1,1.0,train
"[{""from"": ""human"", ""value"": ""What types of data objects can be instantiated using Symfony's VarExporter component?""}, {""from"": ""gpt"", ""value"": ""Using Symfony's VarExporter component, you can instantiate various types of data objects including:\n1. **Standard classes**: Regular classes that do not have complex initialization requirements.\n2. **Inheriting classes**: Classes that derive from parent classes can have their parent properties initialized through the instantiator.\n   ```php\n   use Symfony\\Component\\VarExporter\\Instantiator;\n   $fooObject = Instantiator::instantiate(Foo::class, [], [\n       Bar::class => ['privateBarProperty' => $propertyValue],\n   ]);\n   ```\n3. **Array-like objects**: Such as `ArrayObject`, `ArrayIterator`, and `SplObjectStorage`, where you can use specialized property names to set their internal values.\n   ```php\n   $theObject = Instantiator::instantiate(ArrayObject::class, [\n       \""\\0\"" => [$inputArray],\n   ]);\n   ```\nThe VarExporter component provides a flexible and powerful way to create and manage PHP objects and their properties, supporting both standard and complex data structures.""}]",knowledge/php/symfony-docs-7.1,1.0,train
"[{""from"": ""human"", ""value"": ""What measures does the VarExporter take to handle missing classes during serialization?""}, {""from"": ""gpt"", ""value"": ""When using Symfony's VarExporter component, if a class is missing during serialization, it throws a `ClassNotFoundException`. This behavior is superior to traditional serialization methods which would unserialize missing classes into `PHP_Incomplete_Class` objects. This means that developers are made aware of the issue immediately, allowing them to address the missing class error rather than dealing with potential bugs that could arise from the presence of incomplete class instances.""}]",knowledge/php/symfony-docs-7.1,1.0,train
"[{""from"": ""human"", ""value"": ""How does the VarExporter component help in performance optimization?""}, {""from"": ""gpt"", ""value"": ""The VarExporter component assists in performance optimization primarily due to its efficiency in exporting PHP data structures to plain PHP code. This method is significantly faster and requires less memory compared to other serialization techniques such as `serialize()` and `igbinary_unserialize()`. With the use of OPcache, which caches the output of PHP scripts, the exported code can execute at high speed, minimizing the overhead associated with traditional serialization methods. Additionally, by allowing for lazy loading of object properties and the efficient handling of complex objects, it further reduces unnecessary data processing, contributing to overall performance improvements in applications.""}]",knowledge/php/symfony-docs-7.1,1.0,train
"[{""from"": ""human"", ""value"": ""What types of PHP data structures can VarExporter export?""}, {""from"": ""gpt"", ""value"": ""The VarExporter component can export any serializable PHP data structure, which includes:\n1. **Arrays**: Both indexed and associative arrays.\n2. **Objects**: Instances of classes, including classes that use inheritance.\n3. **Standard PHP Data Types**: Such as integers, floats, strings, booleans, and null values.\n4. **Complex Objects**: Including collections like `ArrayObject`, `ArrayIterator`, and `SplObjectStorage`.\n5. **Nested Structures**: Combinations of arrays and objects, allowing for the reconstruction of complex object graphs. The versatility in handling various PHP data types makes the VarExporter component highly useful for exporting configurations, application states, and more.""}]",knowledge/php/symfony-docs-7.1,1.0,train
"[{""from"": ""human"", ""value"": ""Can you explain how to use the VarExporter to create an instance of an ArrayIterator?""}, {""from"": ""gpt"", ""value"": ""Certainly! To use the VarExporter component to create an instance of `ArrayIterator`, you can instantiate it while setting its internal value using the special `\\0` property name. Here's an example:\n```php\nuse Symfony\\Component\\VarExporter\\Instantiator;\n\n$arrayData = [1, 2, 3, 4, 5];\n$arrayIterator = Instantiator::instantiate(ArrayIterator::class, [\n    \""\\0\"" => [$arrayData],\n]);\n```In this snippet, we are creating an instance of `ArrayIterator` and populating it with an array of integers. The `\\0` property name is used to define the internal values of the instantiated `ArrayIterator`, allowing it to work with the provided data structure seamlessly.""}]",knowledge/php/symfony-docs-7.1,1.0,train
"[{""from"": ""human"", ""value"": ""How does the VarExporter maintain compatibility with PSR-2 standards?""}, {""from"": ""gpt"", ""value"": ""The VarExporter component ensures compatibility with PSR-2 standards by generating exported data as a valid PHP file that follows the PSR-2 coding style guidelines. This means that the generated PHP code adheres to rules regarding indentation, line length, and formatting, thus promoting code maintainability and readability across various environments. By producing clean and standardized output, the VarExporter component facilitates seamless integration within larger codebases that also adhere to PSR-2, enhancing overall project consistency.""}]",knowledge/php/symfony-docs-7.1,1.0,train
"[{""from"": ""human"", ""value"": ""What limitations exist when using ghost objects in the VarExporter component?""}, {""from"": ""gpt"", ""value"": ""While ghost objects provide a powerful mechanism for lazy loading properties, they exhibit some limitations:\n1. **Abstract Classes**: Ghost objects cannot be used with abstract classes since they require a specific class to extend.\n2. **Internal PHP Classes**: They also cannot work with internal PHP classes, limiting the scope of their usage.\n3. **Complex Initialization Logic**: If a property requires more complex initialization logic, this may not be easily accommodated within the ghost object implementation.\n4. **Performance Overhead**: While they are intended for performance optimization, if not used wisely, they can sometimes introduce overhead due to the dynamic nature of property access and lazy initialization.\nDespite these limitations, they remain a valuable tool for optimizing object instantiation.""}]",knowledge/php/symfony-docs-7.1,1.0,train
"[{""from"": ""human"", ""value"": ""Can you summarize the main features of the VarExporter component?""}, {""from"": ""gpt"", ""value"": ""The main features of the VarExporter component include:\n1. **Exporting Data Structures**: It exports and serializes any PHP data structure to plain PHP code, allowing for simple regeneration and instantiation.\n2. **Instantiating Objects**: Objects can be created and populated without invoking their constructors with the instantiator feature.\n3. **Hydration**: The Hydrator class allows for the populating of properties in existing objects, providing flexibility in managing object states.\n4. **Support for Lazy Loading**: It supports the creation of lazy objects and virtual proxies, deferring heavy computation until necessary.\n5. **Performance Efficiency**: By utilizing OPcache and generating optimized PHP code, VarExporter enhances performance, making data handling more efficient.\n6. **Error Handling**: Improved error management with specific exceptions for missing classes during serialization.""}]",knowledge/php/symfony-docs-7.1,1.0,train
"[{""from"": ""human"", ""value"": ""How do you create a virtual proxy using the VarExporter in Symfony?""}, {""from"": ""gpt"", ""value"": ""To create a virtual proxy using the VarExporter in Symfony, you can utilize the `ProxyHelper` class to generate a proxy class code for an abstract class. Here\u2019s a basic example:\n```php\nuse Symfony\\Component\\VarExporter\\ProxyHelper;\n\n// Define an abstract class\nabstract class AbstractProcessor\n{\n    protected string $hash;\n    public function getHash(): bool\n    {\n        return $this->hash;\n    }\n}\n\n// Generate the proxy class\n$proxyCode = ProxyHelper::generateLazyProxy(new \\ReflectionClass(AbstractProcessor::class));\neval('class HashProcessorProxy' . $proxyCode);\n\n// Use the proxy class\n$processor = HashProcessorProxy::createLazyProxy(initializer: function (): ProcessorInterface {\n    $data = /** Retrieve required data to compute the hash */;\n    return new HashProcessor(...$data);\n});\n```In this example, we define an abstract class and utilize `ProxyHelper` to generate the proxy code, enabling lazy loading of properties and operations. This keeps the performance optimized while allowing the use of abstract classes in Symfony.""}]",knowledge/php/symfony-docs-7.1,1.0,train
"[{""from"": ""human"", ""value"": ""In what scenarios would you recommend using the VarExporter component?""}, {""from"": ""gpt"", ""value"": ""I would recommend using the VarExporter component in scenarios such as:\n1. **Performance-Critical Applications**: When your application requires efficient serialization and deserialization processes with high-speed execution, VarExporter provides an optimized approach.\n2. **Instantiating Complex Data Structures**: When working with complex object hierarchies and needing to instantiate or hydrate them without invoking constructors or complex logic.\n3. **Managing State in Long-Lived Objects**: When maintaining state across requests in long-lived objects, using exported variables can help efficiently manage object states.\n4. **Dynamic Property Loading**: In cases where properties require heavy computation, employing lazy loading mechanisms (ghost objects or virtual proxies) can significantly improve the application's performance.\n5. **Error Management**: If you want better error handling, particularly with missing classes during serialization, VarExporter provides structured exception management, which can aid in diagnostics and troubleshooting.""}]",knowledge/php/symfony-docs-7.1,1.0,train
"[{""from"": ""human"", ""value"": ""How does Symfony's VarExporter component improve error handling when it comes to serialization?""}, {""from"": ""gpt"", ""value"": ""Symfony's VarExporter component enhances error handling by throwing a `ClassNotFoundException` if a class is missing during the serialization process. This approach is beneficial compared to conventional serialization methods, which often result in the creation of `PHP_Incomplete_Class` objects, lacking full metadata and potentially leading to silent failures or hidden bugs. By providing specific exceptions, developers are immediately notified of issues regarding class availability, allowing them to address these issues proactively rather than dealing with unpredictable behavior in the application.""}]",knowledge/php/symfony-docs-7.1,1.0,train
"[{""from"": ""human"", ""value"": ""What is the significance of using `LazyGhostTrait` in Symfony's VarExporter?""}, {""from"": ""gpt"", ""value"": ""The significance of using `LazyGhostTrait` in Symfony's VarExporter lies in its ability to facilitate lazy loading of properties in objects. This trait allows you to create ghost objects that are instantiated without fully initializing their properties, deferring any heavy computation until a property is accessed. This optimizes resource utilization and system performance by avoiding unnecessary computations when certain properties may not be needed. With `LazyGhostTrait`, developers can implement efficient data handling strategies that ensure their applications remain responsive, especially when dealing with resource-intensive operations.""}]",knowledge/php/symfony-docs-7.1,1.0,train
"[{""from"": ""human"", ""value"": ""Can you detail how to use the LazyGhostTrait for lazy loading of properties?""}, {""from"": ""gpt"", ""value"": ""To use the `LazyGhostTrait` for lazy loading properties, you need to follow these steps:\n1. **Define Your Class**: Include the `LazyGhostTrait` in your class where you want to implement lazy loading.\n2. **Use createLazyGhost Method**: Inside the constructor of your class, call `self::createLazyGhost(initializer)` with your initializer function which will populate your properties when they are needed.\n3. **Define the Initializer Function**: This function should contain the logic to populate the properties based on the input data or some other conditions.\nHere is an example implementation:\n```php\nnamespace App\\Cache;\n\nuse Symfony\\Component\\VarExporter\\LazyGhostTrait;\n\nclass DataProcessor\n{\n    use LazyGhostTrait;\n\n    private string $data;\n\n    public function __construct()\n    {\n        self::createLazyGhost(\n            instance: $this,\n            initializer: function (DataProcessor $instance): void {\n                $instance->data = 'Populated Data';\n            }\n        );\n    }\n\n    public function getData(): string\n    {\n        return $this->data;\n    }\n}\n```\nIn this code, the `DataProcessor` class has a property `data` that is only populated when `getData()` is called for the first time. This optimizes performance by avoiding unwarranted heavy processes when the object is instantiated.""}]",knowledge/php/symfony-docs-7.1,1.0,train
