conversations,source,score,split
"[{""from"": ""human"", ""value"": ""Can you use Docker with Symfony?""}, {""from"": ""gpt"", ""value"": ""Yes, Docker can be used with Symfony. There are several tools available to set up and manage a Docker environment for Symfony applications. One popular tool is the `symfony-docker` repository on GitHub, which provides a complete Docker environment that includes PHP, web servers, databases and more. Alternatively, you can take advantage of the Symfony binary Docker integration if you prefer to install PHP locally.""}]",knowledge/php/symfony-docs-7.1,1.0,train
"[{""from"": ""human"", ""value"": ""What is a complete Docker environment for Symfony?""}, {""from"": ""gpt"", ""value"": ""A complete Docker environment for Symfony refers to a setup where all the necessary components to run a Symfony application\u2014such as PHP, a web server (like Nginx or Apache), a database (like MySQL or PostgreSQL), and other services\u2014are encapsulated within Docker containers. This allows for easy management and consistent development environments across different machines. The repository `https://github.com/dunglas/symfony-docker` provides a full-featured example of such a setup, allowing developers to spin up Symfony applications with all the dependencies managed by Docker.""}]",knowledge/php/symfony-docs-7.1,1.0,train
"[{""from"": ""human"", ""value"": ""How does Symfony Flex support Docker configuration?""}, {""from"": ""gpt"", ""value"": ""Symfony Flex supports Docker configuration by automatically updating the `docker-compose.yaml` file when certain packages (like `doctrine` or `symfony/orm-pack`) are installed using Composer. When you run `composer require` for these packages, Flex prompts you to include Docker configuration if there are relevant recipes that contain it. Additionally, you can specify a preference in your `composer.json` file under the `extra.symfony.docker` config, allowing you to decide whether to include Docker setup automatically.""}]",knowledge/php/symfony-docs-7.1,1.0,train
"[{""from"": ""human"", ""value"": ""What should be included in the Dockerfile to properly use Flex recipes with Docker?""}, {""from"": ""gpt"", ""value"": ""To properly use Flex recipes with Docker, your `Dockerfile` should include a specific section that acts as a marker for the Flex to inject configurations. This section is typically defined by the following comments within the `Dockerfile`:\n\n```text\n###> recipes ###\n###< recipes ###\n```\n\nBy placing these comments in the appropriate locations within your `Dockerfile`, Flex will be able to recognize where to add any necessary configuration changes after you install relevant packages. This ensures that your application\u2019s Docker setup is correctly aligned with the dependencies being added.""}]",knowledge/php/symfony-docs-7.1,1.0,train
"[{""from"": ""human"", ""value"": ""What command must be run after modifying the Dockerfile or adding packages in Symfony with Docker?""}, {""from"": ""gpt"", ""value"": ""After modifying the Dockerfile or adding packages in Symfony when using Docker, you should rebuild your Docker containers to apply the changes. This can be done by running the following command in your terminal:\n\n```terminal\n$ docker-compose up --build\n```\n\nThis command informs Docker to recreate the containers based on the updated configuration specified in your Dockerfile and any changes in `docker-compose.yaml`.""}]",knowledge/php/symfony-docs-7.1,1.0,train
"[{""from"": ""human"", ""value"": ""How does the Symfony binary web server integrate with Docker?""}, {""from"": ""gpt"", ""value"": ""The Symfony binary web server integrates seamlessly with Docker by automatically detecting Docker services defined in the environment. When you start the Symfony server using the command `symfony server:start`, it can expose these Docker services as environment variables to the Symfony application. This integration provides a straightforward way to manage and utilize various services in a Dockerized environment without needing to hardcode service configurations.""}]",knowledge/php/symfony-docs-7.1,1.0,train
"[{""from"": ""human"", ""value"": ""What special consideration do macOS users need to make when using Docker with Symfony?""}, {""from"": ""gpt"", ""value"": ""macOS users need to explicitly allow the default Docker socket to be used for Docker integration to function correctly with Symfony. This requirement is outlined in the Docker documentation and may involve adjusting Docker settings or permissions to ensure that Symfony can communicate properly with Docker services. It's essential to follow these guidelines to prevent any issues with accessing the Docker environment.""}]",knowledge/php/symfony-docs-7.1,1.0,train
"[{""from"": ""human"", ""value"": ""What would happen if the Docker configuration is omitted while installing a recipe in Symfony?""}, {""from"": ""gpt"", ""value"": ""If the Docker configuration is omitted while installing a Flex recipe in Symfony, the necessary services and configurations that would typically be included in the `docker-compose.yaml` and `Dockerfile` will not be set up. This may lead to runtime issues because the application may expect certain services (like a database) to be available as Docker containers. Specifically, developers might encounter errors when trying to run or build the application in a Dockerized environment due to missing dependencies that were intended to be included by the recipe.""}]",knowledge/php/symfony-docs-7.1,1.0,train
"[{""from"": ""human"", ""value"": ""Can you give examples of services that can be configured using Docker in a Symfony application?""}, {""from"": ""gpt"", ""value"": ""Common services that can be configured using Docker in a Symfony application include:\n- **Database Services**: Such as MySQL or PostgreSQL, providing the storage backend for the application.\n- **Web Servers**: Like Nginx or Apache, serving the application to the web and handling HTTP requests.\n- **PHP FPM**: For handling PHP requests efficiently in a containerized environment.\n- **Redis or Memcached**: For caching and session management to improve performance.\n- **Elasticsearch**: For advanced search capabilities in the application.\n\nThese services can be easily integrated and managed using Docker and Docker Compose, allowing developers to create a cohesive development workflow.""}]",knowledge/php/symfony-docs-7.1,1.0,train
"[{""from"": ""human"", ""value"": ""What happens to your `docker-compose.yaml` file when you run `composer require doctrine` in Symfony?""}, {""from"": ""gpt"", ""value"": ""When you run `composer require doctrine` in a Symfony application that utilizes Flex, the `docker-compose.yaml` file is automatically updated to include a `database` service. This automation simplifies the process of managing services, as Flex leverages the recipe associated with Doctrine to ensure all necessary configurations for connecting to the database are appropriately set up. As part of this process, you may be prompted to confirm whether you want to include the Docker configuration pertaining to the `database` service.""}]",knowledge/php/symfony-docs-7.1,1.0,train
"[{""from"": ""human"", ""value"": ""Explain why Symfony Flex makes working with Docker easier.""}, {""from"": ""gpt"", ""value"": ""Symfony Flex simplifies Docker integration by automating many of the repetitive tasks associated with configuring Docker environments. It provides:\n1. **Automatic Docker Configurations**: When installing packages, Flex intelligently updates `docker-compose.yaml` to include required Docker services.\n2. **Flex Recipes**: Recipes define configurations and setups for various packages, reducing manual setup time for developers.\n3. **Integration Preferences**: Developers can easily set preferences regarding Docker integration in `composer.json`, allowing for custom configurations.\n4. **Ease of Use**: Instead of manually writing Docker service definitions, developers can rely on Flex's automation, leading to fewer errors and quicker setups.\nOverall, Flex streamlines the integration of Docker with Symfony, making it more accessible to developers.""}]",knowledge/php/symfony-docs-7.1,1.0,train
"[{""from"": ""human"", ""value"": ""Describe how to expose Docker services as environment variables in Symfony.""}, {""from"": ""gpt"", ""value"": ""To expose Docker services as environment variables in Symfony, you must:\n1. **Use Symfony Binary Server**: Start by using the Symfony binary web server (`symfony server:start`). This server automatically recognizes Docker services in your environment.\n2. **Check Docker Compose Configuration**: Ensure that your services are correctly defined in your `docker-compose.yaml` file, which includes environment variables necessary for your application.\n3. **Access Environment Variables**: Within your Symfony application, utilize the environment variables to configure services like databases or cache systems by accessing them in your application code or configuration files.\n\nThis approach allows your Symfony application to dynamically adapt to the Docker environment without hardcoding service configurations.""}]",knowledge/php/symfony-docs-7.1,1.0,train
"[{""from"": ""human"", ""value"": ""What does the command `docker-compose up --build` do?""}, {""from"": ""gpt"", ""value"": ""The command `docker-compose up --build` performs a few important functions:\n1. **Build Images**: It rebuilds the images for the services defined in your `docker-compose.yaml` file, leveraging any changes made in the Dockerfile or the configuration files.\n2. **Create Containers**: It creates containers for those services if they do not already exist.\n3. **Start Services**: It starts all the defined services, ensuring that they are running and accessible according to the configurations.\n4. **Recreate Containers**: If containers for services already exist, this command will recreate them with the latest image configurations after rebuilding, ensuring an updated runtime environment.\n\nThis command is essential when you modify your Docker setup or when changing package dependencies to ensure everything runs as expected.""}]",knowledge/php/symfony-docs-7.1,1.0,train
"[{""from"": ""human"", ""value"": ""What is the purpose of the section marked by `###> recipes ###` and `###< recipes ###` in a Dockerfile?""}, {""from"": ""gpt"", ""value"": ""The purpose of the section marked by `###> recipes ###` and `###< recipes ###` in a Dockerfile is to serve as a placeholder where Symfony Flex can inject additional configurations specified by Flex recipes. When you install packages with Docker-specific configurations, Flex recognizes this section and modifies it, adding necessary commands or configurations without overwriting the existing ones in the Dockerfile. This allows for seamless integration of new services or dependencies related to the installed recipe while maintaining the structure of the existing Dockerfile.""}]",knowledge/php/symfony-docs-7.1,1.0,train
"[{""from"": ""human"", ""value"": ""What should you do to check if your Docker is configured correctly for Symfony on macOS?""}, {""from"": ""gpt"", ""value"": ""To check if your Docker is configured correctly for Symfony on macOS, follow these steps:\n1. **Install Docker Desktop**: Make sure you have Docker Desktop installed and running on your macOS.\n2. **Open Docker Settings**: Go to the Docker preferences/settings menu and check if the Docker Engine is running.\n3. **Allow Default Docker Socket**: Ensure that access permissions for the default Docker socket are set, so Symfony can communicate properly with Docker. This can involve configuring user permissions as outlined in the Docker documentation.\n4. **Test Symfony and Docker Integration**: Run a simple Symfony command that utilizes Docker, such as `symfony server:start`, and monitor the output to verify if Docker services are being detected and exposed correctly.\n5. **Check Logs for Errors**: Review the logs if you encounter issues, to identify any permissions or configuration problems.""}]",knowledge/php/symfony-docs-7.1,1.0,train
"[{""from"": ""human"", ""value"": ""How can you install Symfony and Docker together efficiently?""}, {""from"": ""gpt"", ""value"": ""To install Symfony and Docker together efficiently, you can follow these steps:\n1. **Clone Symfony Docker**: Start by cloning the `symfony-docker` repository from GitHub, which provides a preconfigured Symfony application with Docker.\n2. **Run Docker Compose**: Navigate to the project's directory and run `docker-compose up` to start the fully configured environment containing PHP, a web server, a database, and any other service you require.\n3. **Install Packages**: Use Composer within the Docker container to install additional Symfony packages as needed. You can run commands like `docker-compose exec php composer require package-name` to install packages in the PHP container.\n4. **Configuration Check**: Ensure your `docker-compose.yaml` and `Dockerfile` are correctly set up based on your application needs, particularly monitoring any requirements specified in Flex recipes.\n5. **Use Symfony CLI**: Utilize the Symfony CLI for creating new projects and managing dependencies to streamline the development workflow.\nBy following these steps, developers can effectively leverage both Symfony and Docker for their projects.""}]",knowledge/php/symfony-docs-7.1,1.0,train
"[{""from"": ""human"", ""value"": ""What documentation should macOS users refer to regarding Docker permissions?""}, {""from"": ""gpt"", ""value"": ""macOS users should refer to the Docker documentation specific to permissions and requirements for using Docker on macOS. This documentation includes guidelines on how to configure the Docker socket permissions, which are essential for ensuring that applications, like Symfony, can interact seamlessly with Docker services. You can access this documentation through the following link: `https://docs.docker.com/desktop/mac/permission-requirements/`, which outlines the necessary steps to address any permission issues that might arise.""}]",knowledge/php/symfony-docs-7.1,1.0,train
"[{""from"": ""human"", ""value"": ""Can you give an overview of how Docker enables better development workflows with Symfony?""}, {""from"": ""gpt"", ""value"": ""Docker enhances development workflows with Symfony by providing:\n1. **Environment Consistency**: Docker ensures that applications run in the same environment regardless of the machine, minimizing the \""it works on my machine\"" problem.\n2. **Service Isolation**: Each service (like databases, caches, etc.) runs in its own container, leading to cleaner and more manageable configurations.\n3. **Easier Testing**: With Docker, developers can easily spin up or down test environments without affecting their local development, allowing for quick iterations.\n4. **Simple Microservices Architecture**: Docker facilitates the development of microservices by allowing each service to be contained independently, which can interact with others over a network.\n5. **Collaboration**: Teams can share Docker configurations to ensure that all members are developing under the same conditions, simplifying onboarding for new developers and ensuring project consistency.\nThis approach significantly boosts productivity and reduces setup time in Symfony projects.""}]",knowledge/php/symfony-docs-7.1,1.0,train
