conversations,source,score,split
"[{""from"": ""human"", ""value"": ""What is the purpose of the Semaphore Component in Symfony?""}, {""from"": ""gpt"", ""value"": ""The Semaphore Component in Symfony is designed to manage semaphores, which are synchronization mechanisms that provide exclusive access to shared resources in concurrent systems. Semaphores allow multiple processes to access a resource simultaneously while coordinating their access, unlike locks that permit exclusive access to only one process. This component is particularly useful in multitasking environments where resource contention may occur.""}]",knowledge/php/symfony-docs-7.1,1.0,train
"[{""from"": ""human"", ""value"": ""How do you install the Semaphore Component in a Symfony project?""}, {""from"": ""gpt"", ""value"": ""To install the Semaphore Component in a Symfony project, you need to use Composer, the dependency manager for PHP. Run the following command in your terminal:\n\n```bash\n$ composer require symfony/semaphore\n``` \nThis command will fetch the Semaphore Component package and include it in your project, making it available for use.""}]",knowledge/php/symfony-docs-7.1,1.0,train
"[{""from"": ""human"", ""value"": ""How can you create a semaphore using the Semaphore Component?""}, {""from"": ""gpt"", ""value"": ""To create a semaphore with the Semaphore Component, you must use the `SemaphoreFactory` class. Here\u2019s a step-by-step guide on how to implement it:\n\n1. First, set up a storage class to manage the semaphore. In this case, we can use `RedisStore` with a Redis connection.\n2. Next, create an instance of `SemaphoreFactory` using the store you just created.\n3. Finally, create a semaphore by calling the `createSemaphore` method, passing the resource name and the maximum number of processes allowed.\n\nHere is an example code snippet:\n```php\nuse Symfony\\Component\\Semaphore\\SemaphoreFactory;\nuse Symfony\\Component\\Semaphore\\Store\\RedisStore;\n\n$redis = new Redis();\n$redis->connect('172.17.0.2');\n\n$store = new RedisStore($redis);\n$factory = new SemaphoreFactory($store);\n\n$semaphore = $factory->createSemaphore('pdf-invoice-generation', 2);\n``` \nThis will create a semaphore that allows up to 2 processes to access the resource named 'pdf-invoice-generation'.""}]",knowledge/php/symfony-docs-7.1,1.0,train
"[{""from"": ""human"", ""value"": ""Can you provide an example of acquiring a semaphore?""}, {""from"": ""gpt"", ""value"": ""Absolutely! Here\u2019s how to acquire a semaphore using the Semaphore Component. After creating the semaphore instance, you can call the `acquire` method to try to lock the resource. If successful, you can perform operations on the resource. Here is a complete example:\n\n```php\n// Assuming the RedisStore and SemaphoreFactory are set up as described in the previous answer\n$semaphore = $factory->createSemaphore('pdf-invoice-generation', 2);\n\nif ($semaphore->acquire()) {\n    // The resource \""pdf-invoice-generation\"" is now locked.\n    // Perform your operations here, e.g., generating an invoice.\n    echo 'Generating PDF invoice...';\n\n    // Once done, release the semaphore\n    $semaphore->release();\n} else {\n    echo 'Could not acquire the semaphore, resource is busy.';\n}\n```\nIn this snippet, the semaphore is checked for acquisition, and if successful, operations can be safely performed on the locked resource.""}]",knowledge/php/symfony-docs-7.1,1.0,train
"[{""from"": ""human"", ""value"": ""What happens if you do not release a semaphore?""}, {""from"": ""gpt"", ""value"": ""If you do not explicitly release a semaphore using the `release()` method, it will be released automatically when the semaphore instance is destroyed. This means that the semaphore will still unlock the resource when it goes out of scope, potentially at the end of the script execution. However, in certain scenarios, it might be useful to retain the lock across several requests or operations. To do this intentionally, you can disable automatic release by setting the fifth argument of the `createSemaphore()` method to `false`. This helps manage resource locking more deliberately across multiple operations.""}]",knowledge/php/symfony-docs-7.1,1.0,train
"[{""from"": ""human"", ""value"": ""What is the difference between semaphores and locks?""}, {""from"": ""gpt"", ""value"": ""The primary difference between semaphores and locks lies in how they control access to shared resources in concurrent programming. \n- **Semaphores** allow multiple processes to access a shared resource simultaneously, which means that if multiple semaphores are created for the same resource, more than one process can be granted access as long as it does not exceed the maximum limit defined when creating the semaphore.\n- **Locks**, on the other hand, provide exclusive access to a resource, allowing only one process to access it at any given time. Locks are typically binary and do not allow concurrent access. \nTherefore, semaphores are used in situations where multiple concurrent access is permissible, while locks are suitable for situations requiring strict sequential access.""}]",knowledge/php/symfony-docs-7.1,1.0,train
"[{""from"": ""human"", ""value"": ""How can you ensure that a semaphore is shared across multiple services?""}, {""from"": ""gpt"", ""value"": ""To ensure that a semaphore is shared across multiple services in Symfony, you should share the same instance of the semaphore returned by the `SemaphoreFactory::createSemaphore()` method. This can be achieved by storing this instance in a shared service or using Dependency Injection to provide the same instance across various service classes or components. Here\u2019s how you could implement it:\n\n1. **Create a Singleton Service**: You can define a singleton service in Symfony that creates and stores the semaphore.\n2. **Inject the Singleton**: Use Symfony\u2019s dependency injection to inject this singleton semaphore into the various services that require access to the same semaphore.\n\nExample code snippet to define a semaphore service in your service configuration:\n```yaml\n# config/services.yaml\nservices:\n    App\\Service\\SemaphoreService:\n        arguments:\n            $semaphore: '@App\\Factory\\SemaphoreFactory'\n``` \nWith this setup, services that require access to the semaphore will receive the same instance, ensuring consistent access patterns.""}]",knowledge/php/symfony-docs-7.1,1.0,train
"[{""from"": ""human"", ""value"": ""What consideration should be taken while handling multiple requests with semaphores?""}, {""from"": ""gpt"", ""value"": ""When handling multiple requests with semaphores, several considerations should be taken into account to ensure proper functioning and resource management:\n1. **Concurrent Access Limits**: Define the maximum number of processes that can access the semaphore to avoid resource overloading. Setting this limit correctly based on expected usage helps manage contention effectively.\n2. **Thread Safety**: Ensure that your code is thread-safe, particularly in the operations that share resources. This includes considering any shared data structures and how they may be modified by concurrent processes.\n3. **Exception Handling**: Implement robust exception handling around semaphore acquisition and release to ensure that resources are not left locked in the event of an error or unexpected failure.\n4. **Performance Monitoring**: Monitor the application\u2019s performance to identify bottlenecks or contention points when semaphores are heavily used. This might lead to redesigning certain critical paths to improve throughput.\n5. **Testing Under Load**: Simulate scenarios where multiple requests are made concurrently to see how the system behaves under stressed conditions, checking for race conditions, deadlocks, or excessive waiting times.\nBy following these considerations, developers can better manage the complexity and challenges associated with concurrent processing using semaphores.""}]",knowledge/php/symfony-docs-7.1,1.0,train
"[{""from"": ""human"", ""value"": ""Can you explain the structure of a semaphore in Symfony?""}, {""from"": ""gpt"", ""value"": ""In Symfony, a semaphore is primarily structured through two main classes: `SemaphoreFactory` and `SemaphoreInterface`.\n- **SemaphoreFactory**: This class is responsible for creating semaphore instances. It acts as a factory and requires a storage mechanism (such as RedisStore) to persist semaphore states. You initiate the factory with a store object, and from it, you can create semaphore instances that represent different resources.\n- **SemaphoreInterface**: This interface defines the behavior of a semaphore. It includes methods such as `acquire()` and `release()`. The `acquire()` method attempts to lock the resource, returning true on success and false if already locked. The `release()` method frees the resource, allowing other processes access.\n\nOverall, the semaphore\u2019s structure allows it to be flexible, enabling various implementations of the storage mechanism while adhering to the necessary locking semantics defined in the SemaphoreInterface.""}]",knowledge/php/symfony-docs-7.1,1.0,train
"[{""from"": ""human"", ""value"": ""How does the Semaphore Component handle semaphore instances?""}, {""from"": ""gpt"", ""value"": ""The Semaphore Component handles semaphore instances by distinctly identifying them, even for the same locked resource. Each semaphore created through the `SemaphoreFactory::createSemaphore()` method is treated as a unique instance. This is crucial in multi-service environments where different services might attempt to manage access to the same resource under concurrent conditions. By ensuring that semaphore instances are unique rather than reused, the Component prevents potential conflicts and allows proper management of semaphore states across various contexts.""}]",knowledge/php/symfony-docs-7.1,1.0,train
"[{""from"": ""human"", ""value"": ""What additional configurations can be made to the createSemaphore() method?""}, {""from"": ""gpt"", ""value"": ""The `createSemaphore()` method can be configured with several parameters for enhanced functionality. Apart from the resource name and maximum process count, additional configurations include:\n1. **Timeout**: Setting a timeout can limit how long a process can wait to acquire a semaphore before giving up. This helps avoid indefinite blocking.\n2. **Automatic Release**: The fifth argument allows you to control the automatic release behavior. Setting it to `false` enables the semaphore to stay locked across multiple request scopes until explicitly released, which can be useful for certain workflows.\n3. **Custom Storage**: You can pass a custom store implementation to alter how semaphore states are managed, allowing flexibility in using different storage backends (e.g., databases, file systems).\n\nBy leveraging these configurations, developers can fine-tune semaphore behavior to fit specific application requirements.""}]",knowledge/php/symfony-docs-7.1,1.0,train
