conversations,source,score,split
"[{""from"": ""human"", ""value"": ""How is the PropertyAccess component's API designed for ease of use?""}, {""from"": ""gpt"", ""value"": ""The PropertyAccess component's API is designed for ease of use by providing intuitive methods such as `getValue()` and `setValue()` that abstract away the complexities of handling properties. The use of string paths makes it easy to read and write values. Additionally, the builder pattern via `PropertyAccessorBuilder` allows for customization without needing to dive deep into the implementation, making it accessible for developers of all levels, from beginners to advanced users.""}]",knowledge/php/symfony-docs-7.1,1.0,train
"[{""from"": ""human"", ""value"": ""What techniques can be employed to manage nullable properties with PropertyAccessor?""}, {""from"": ""gpt"", ""value"": ""To manage nullable properties with the PropertyAccessor, you can use the nullsafe operator (`?.`) that allows safe navigation through potentially null objects without throwing exceptions. This ensures that if a property is null, the accessor will not attempt to evaluate further down the property path and will simply return null instead. Additionally, ensure that appropriate checks are in place when working with properties that may not be set to avoid runtime errors.""}]",knowledge/php/symfony-docs-7.1,1.0,train
"[{""from"": ""human"", ""value"": ""What role does the createPropertyAccessorBuilder method serve?""}, {""from"": ""gpt"", ""value"": ""The `createPropertyAccessorBuilder` method serves the role of configuring and customizing the behavior of the PropertyAccessor. It allows users to enable or disable various features such as magic methods and exception handling. This builder approach helps in fine-tuning the PropertyAccess configurations according to specific application requirements before obtaining a concrete PropertyAccessor instance.""}]",knowledge/php/symfony-docs-7.1,1.0,train
"[{""from"": ""human"", ""value"": ""Explain how property access can be simplified when using frameworks like Symfony.""}, {""from"": ""gpt"", ""value"": ""Using frameworks like Symfony simplifies property access by abstracting the complexity of dealing with underlying data structures. The PropertyAccess component allows developers to work with object properties and arrays using a unified approach via string notation, enabling cleaner and more concise code. It handles various cases of property accessibility (e.g., public, private, static) uniformly, significantly reducing the amount of boilerplate code required and minimizing the potential for errors, thereby enhancing developer productivity.""}]",knowledge/php/symfony-docs-7.1,1.0,train
"[{""from"": ""human"", ""value"": ""What considerations should be taken into account when working with the PropertyAccess component in Symfony?""}, {""from"": ""gpt"", ""value"": ""When working with the PropertyAccess component in Symfony, considerations include:\n1. **Performance Impact**: Using reflection for dynamic access may introduce performance overhead compared to direct access.\n2. **Error Handling**: Understanding how exceptions are thrown or managed when accessing properties can prevent runtime issues.\n3. **Compatibility with Dynamic Data**: When integrating with dynamic data sources (like APIs), ensure that property paths are structured to reflect potential variances in the data schema.\n4. **Usage of Magic Methods**: Be cautious when enabling magic methods (`__get`, `__set`, etc.) as they can introduce complexity and unintended behaviors if not managed properly.""}]",knowledge/php/symfony-docs-7.1,1.0,train
"[{""from"": ""human"", ""value"": ""How does the PropertyAccess component handle arrays that contain objects?""}, {""from"": ""gpt"", ""value"": ""The PropertyAccess component allows accessing and manipulating arrays that contain objects seamlessly. It utilizes both standard array and object property access techniques, enabling developers to set and get values through combined paths. For instance, you can access an object's property within an array context using this syntax:\n\n```php\n$propertyAccessor->setValue($person, 'children[0].firstName', 'John');\nvar_dump($propertyAccessor->getValue($person, 'children[0].firstName')); // Outputs: 'John'\n```""}]",knowledge/php/symfony-docs-7.1,1.0,train
"[{""from"": ""human"", ""value"": ""What overall advantages does using the PropertyAccess component provide to developers?""}, {""from"": ""gpt"", ""value"": ""Using the PropertyAccess component offers several advantages to developers:\n1. **Flexibility**: It allows dynamic access and modification of properties without requiring hard-coded paths, which can evolve over time.\n2. **Simplicity**: Developers can interact with objects and arrays in a uniform way, reducing the complexity of property access logic.\n3. **Compatibility**: It works well with both regular objects and dynamic data types, improving codeability in diverse scenarios.\n4. **Reduced Boilerplate Code**: By abstracting away common logic, it can significantly reduce the amount of repetitive code developers need to write.""}]",knowledge/php/symfony-docs-7.1,1.0,train
"[{""from"": ""human"", ""value"": ""Can you summarize what the PropertyAccess component allows developers to do?""}, {""from"": ""gpt"", ""value"": ""The PropertyAccess component allows developers to easily read and write properties of objects and elements of arrays using a consistent string notation. It supports various access patterns, including dot notation for objects, array index notation, and automated handling of getters, setters, and magic methods. This provides a flexible and powerful mechanism for dynamically interacting with data structures, enhancing the readability and maintainability of the code.""}]",knowledge/php/symfony-docs-7.1,1.0,train
