conversations,source,score,split
"[{""from"": ""human"", ""value"": ""What is a controller in a Stimulus application?""}, {""from"": ""gpt"", ""value"": ""A controller is the basic organizational unit within a Stimulus application. It is an instance of a JavaScript class defined by the developer, inheriting from the base `Controller` class provided by the `@hotwired/stimulus` module. Controllers augment HTML with behavior, enabling dynamic interactions without reloading the page.""}]",knowledge/js/stimulus_docs/reference,1.0,train
"[{""from"": ""human"", ""value"": ""How does one create a controller in Stimulus?""}, {""from"": ""gpt"", ""value"": ""To create a controller in Stimulus, you need to define a JavaScript class that extends the `Controller` class from the `@hotwired/stimulus` library. Here\u2019s a basic example:\n```js\nimport { Controller } from \""@hotwired/stimulus\"";\n\nexport default class extends Controller {\n  // Any methods and properties can be added here\n}\n```\nYou place this class in a file named `[identifier]_controller.js` within the `controllers/` directory, where `[identifier]` is the name you use to reference the controller in your HTML.""}]",knowledge/js/stimulus_docs/reference,1.0,train
"[{""from"": ""human"", ""value"": ""What properties are accessible within a Stimulus controller?""}, {""from"": ""gpt"", ""value"": ""Within a Stimulus controller, you can access three main properties:\n* **application**: This property is referenced as `this.application` and represents the Stimulus `Application` instance the controller belongs to.\n* **element**: Accessed through `this.element`, this property holds the HTML element to which the controller is connected.\n* **identifier**: You can access the controller's identifier via `this.identifier`, which is the name defined in the `data-controller` attribute in the HTML.""}]",knowledge/js/stimulus_docs/reference,1.0,train
"[{""from"": ""human"", ""value"": ""How should controller files be named and organized in a Stimulus project?""}, {""from"": ""gpt"", ""value"": ""Controller files in a Stimulus project should be organized in the `controllers/` directory, with each file representing a single controller class. The naming convention for these files is `[identifier]_controller.js`, where the `[identifier]` corresponds to the controller's identifier. For example, a controller with the identifier `gallery` would be named `gallery_controller.js`.""}]",knowledge/js/stimulus_docs/reference,1.0,train
"[{""from"": ""human"", ""value"": ""Explain how identifiers work in Stimulus.""}, {""from"": ""gpt"", ""value"": ""Identifiers in Stimulus are the names you use to reference a controller class in HTML. When you add a `data-controller` attribute to an HTML element, Stimulus interprets the value as an identifier, creating a new instance of the corresponding controller class associated with that element. For instance, if you have a controller defined in `gallery_controller.js`, you would reference it in your HTML as:\n```html\n<div data-controller=\""gallery\""></div>\n``` \nThis would trigger the instantiation of the `GalleryController` class.""}]",knowledge/js/stimulus_docs/reference,1.0,train
"[{""from"": ""human"", ""value"": ""What is the scope of a Stimulus controller?""}, {""from"": ""gpt"", ""value"": ""The scope of a Stimulus controller encompasses the HTML element it is connected to and all of its child elements. For example, in the following structure:\n```html\n<main>\n  <div data-controller=\""example\"">\n    <h1>Example</h1>\n  </div>\n</main>\n```\nThe scope of the `example` controller includes both the `<div>` and the `<h1>` tags, but not the outer `<main>` element.""}]",knowledge/js/stimulus_docs/reference,1.0,train
"[{""from"": ""human"", ""value"": ""How do nested scopes work in Stimulus?""}, {""from"": ""gpt"", ""value"": ""Nested scopes in Stimulus imply that each controller is only aware of its own scope. For instance, consider the following code:\n```html\n<ul id=\""parent\"" data-controller=\""list\"">\n  <li data-list-target=\""item\"">One</li>\n  <li data-list-target=\""item\"">Two</li>\n  <li>\n    <ul id=\""child\"" data-controller=\""list\"">\n      <li data-list-target=\""item\"">I am</li>\n      <li data-list-target=\""item\"">a nested list</li>\n    </ul>\n  </li>\n</ul>\n```\nHere, the `list` controller for `#parent` is not aware of any targets or methods within the nested `list` controller under `#child`.""}]",knowledge/js/stimulus_docs/reference,1.0,train
"[{""from"": ""human"", ""value"": ""Can an HTML element have multiple controllers, and how is it represented?""}, {""from"": ""gpt"", ""value"": ""Yes, an HTML element can have multiple controllers. This is represented by setting the `data-controller` attribute's value as a space-separated list of identifiers. For example:\n```html\n<div data-controller=\""clipboard list-item\""></div>\n```\nIn this example, the `<div>` has both the `clipboard` and `list-item` controllers attached to it.""}]",knowledge/js/stimulus_docs/reference,1.0,train
"[{""from"": ""human"", ""value"": ""What are the naming conventions for properties and methods in Stimulus controllers?""}, {""from"": ""gpt"", ""value"": ""In Stimulus controllers, camelCase should be used for method and property names. When creating identifiers composed of multiple words, the convention is to use kebab-case (dashes) such as `date-picker` or `list-item`. For filenames, you can separate multiple words using either underscores or dashes, such as `date_picker_controller.js` or `list-item-controller.js`.""}]",knowledge/js/stimulus_docs/reference,1.0,train
"[{""from"": ""human"", ""value"": ""How can you register a controller manually in Stimulus?""}, {""from"": ""gpt"", ""value"": ""To manually register a controller in Stimulus, you first need to import the controller class and then use the `Application#register` method on your application instance. Here's an example:\n```js\nimport ReferenceController from \""./controllers/reference_controller\"";\n\napplication.register(\""reference\"", ReferenceController);\n```\nYou can also inline the registration by defining the class directly:\n```js\nimport { Controller } from \""@hotwired/stimulus\"";\n\napplication.register(\""reference\"", class extends Controller {\n  // ... \n});\n```""}]",knowledge/js/stimulus_docs/reference,1.0,train
"[{""from"": ""human"", ""value"": ""Describe how to prevent registration of a controller based on environmental factors.""}, {""from"": ""gpt"", ""value"": ""To prevent the registration of a controller based on specific environmental conditions, you can override the static `shouldLoad` method in the controller class. For instance:\n```js\nclass UnloadableController extends Controller {\n  static get shouldLoad() {\n    return false;\n  }\n}\napplication.register(\""unloadable\"", UnloadableController);\n```\nThis code ensures that the `UnloadableController` is not loaded or registered in the application, regardless of the HTML.""}]",knowledge/js/stimulus_docs/reference,1.0,train
"[{""from"": ""human"", ""value"": ""How can you trigger behavior when a Stimulus controller is registered?""}, {""from"": ""gpt"", ""value"": ""To trigger a behavior once a controller is registered, you can define a static `afterLoad` method in your controller class. This method receives the `identifier` of the controller and the Stimulus application instance as arguments. For example:\n```js\nclass SpinnerButton extends Controller {\n  static afterLoad(identifier, application) {\n    // Implement your behavior here\n  }\n}\napplication.register(\""spinner-button\"", SpinnerButton);\n``` \nThe `afterLoad` method is called immediately after registration, allowing you to perform actions such as updating DOM elements.""}]",knowledge/js/stimulus_docs/reference,1.0,train
"[{""from"": ""human"", ""value"": ""How can controllers communicate with each other in Stimulus?""}, {""from"": ""gpt"", ""value"": ""Controllers in Stimulus can communicate with each other through events. The `Controller` class provides a convenient method called `dispatch` that simplifies this process. When one controller dispatches an event, it gets automatically prefixed with the controller's name. For instance:\n```js\nclass ClipboardController extends Controller {\n  copy() {\n    this.dispatch(\""copy\"", { detail: { content: this.sourceTarget.value } });\n  }\n}\n``` \nAnother controller can listen for this event and respond accordingly, creating an interactive and cohesive user experience.""}]",knowledge/js/stimulus_docs/reference,1.0,train
"[{""from"": ""human"", ""value"": ""Give an example of using the dispatch method in a controller.""}, {""from"": ""gpt"", ""value"": ""Here\u2019s a practical example of using the `dispatch` method within a controller:\n```js\nclass ClipboardController extends Controller {\n  static targets = [ \""source\"" ];\n\n  copy() {\n    const event = this.dispatch(\""copy\"", { detail: { content: this.sourceTarget.value } });\n    navigator.clipboard.writeText(this.sourceTarget.value);\n  }\n}\n```\nWhen the `copy` method is called, it dispatches a `copy` event. Other parts of the application can listen for this event and execute related actions, promoting effective communication between controllers.""}]",knowledge/js/stimulus_docs/reference,1.0,train
"[{""from"": ""human"", ""value"": ""Explain how to handle custom events and prevent default actions in Stimulus.""}, {""from"": ""gpt"", ""value"": ""To handle custom events and allow for the prevention of default actions in Stimulus, you can pass options to the `dispatch` method. For instance:\n```js\nclass ClipboardController extends Controller {\n  copy() {\n    const event = this.dispatch(\""copy\"", { cancelable: true });\n    if (event.defaultPrevented) return;\n    navigator.clipboard.writeText(this.sourceTarget.value);\n  }\n}\n```\nIn this example, dispatching the `copy` event is set as cancelable. If another controller listens to this event and calls `event.preventDefault()`, the clipboard action will be halted.""}]",knowledge/js/stimulus_docs/reference,1.0,train
"[{""from"": ""human"", ""value"": ""How can you directly invoke methods of other controllers?""}, {""from"": ""gpt"", ""value"": ""You can directly invoke methods of other controllers by using the `getControllerForElementAndIdentifier` method from the application instance. It\u2019s typically recommended to communicate using events, but if necessary, you can retrieve a specific controller like this:\n```js\nclass MyController extends Controller {\n  copy() {\n    const otherController = this.application.getControllerForElementAndIdentifier(this.otherTarget, 'other');\n    otherController.otherMethod();\n  }\n}\n```\nHere, `MyController` can call `otherMethod` directly on the `other` controller, but this should be used sparingly.""}]",knowledge/js/stimulus_docs/reference,1.0,train
"[{""from"": ""human"", ""value"": ""What are the benefits of using the afterLoad method?""}, {""from"": ""gpt"", ""value"": ""The `afterLoad` method is beneficial for executing logic immediately after a controller is registered, enabling actions that must occur as soon as the controller is set up, even if the associated HTML is not fully rendered yet. This can include initializing elements, adjusting configurations, or updating DOM attributes according to the loaded controller\u2019s state. As a result, it improves the responsiveness of your application.""}]",knowledge/js/stimulus_docs/reference,1.0,train
"[{""from"": ""human"", ""value"": ""How can you ensure controllers are decoupled while using shared events?""}, {""from"": ""gpt"", ""value"": ""To ensure controllers are decoupled while still communicating through shared events, you should utilize the event system to manage interactions rather than direct method calls. This means using the `dispatch` method to send events and setting up listeners on the receiving controllers to respond to those events. Defining clear event names and purposes allows independent evolution of each controller, maintaining a clean separation of concerns.""}]",knowledge/js/stimulus_docs/reference,1.0,train
"[{""from"": ""human"", ""value"": ""What precautions should be taken when using getControllerForElementAndIdentifier?""}, {""from"": ""gpt"", ""value"": ""When using `getControllerForElementAndIdentifier`, exercise caution as this method couples controllers tightly, which can reduce the modularity of your application. It's best to use this only when absolutely necessary; otherwise, rely on the event system for communication. Additionally, ensure the target element and associated controller are correctly referenced to avoid runtime errors. Lastly, understand that frequent use can lead to harder maintainability.""}]",knowledge/js/stimulus_docs/reference,1.0,train
"[{""from"": ""human"", ""value"": ""Can you provide an example of defining a controller in a Stimulus application?""}, {""from"": ""gpt"", ""value"": ""Certainly! Here\u2019s an example of defining a simple controller called `CounterController` in Stimulus:\n```js\n// controllers/counter_controller.js\nimport { Controller } from \""@hotwired/stimulus\"";\n\nexport default class extends Controller {\n  static targets = [\""count\""];\n\n  initialize() {\n    this.countValue = 0;\n  }\n\n  increment() {\n    this.countValue++;\n    this.countTarget.textContent = this.countValue;\n  }\n}\n```\nIn this example, we define a `CounterController`, which manages a count displayed in the HTML via a `countTarget`. The `increment` method increases the count and updates the displayed value.""}]",knowledge/js/stimulus_docs/reference,1.0,train
"[{""from"": ""human"", ""value"": ""How would you set up a basic HTML structure to use with the CounterController?""}, {""from"": ""gpt"", ""value"": ""To set up a basic HTML structure for the `CounterController`, you need to create elements that work with the defined targets in your controller. Here\u2019s a simple example:\n```html\n<div data-controller=\""counter\"">\n  <h1 data-counter-target=\""count\"">0</h1>\n  <button data-action=\""click->counter#increment\"">Increment</button>\n</div>\n```\nIn this HTML, we connect the `CounterController` to a `<div>`. The `<h1>` displays the count, and the button increments the count when clicked, using Stimulus action syntax.""}]",knowledge/js/stimulus_docs/reference,1.0,train
"[{""from"": ""human"", ""value"": ""What is the role of the `dispatch` method in controller communication?""}, {""from"": ""gpt"", ""value"": ""The `dispatch` method in Stimulus controllers serves as a means to communicate between different controllers by emitting custom events. Each event dispatched can include details carried in the `detail` object, allowing for streamlined interactions without tight coupling of controllers. This facilitates a more modular architecture where controllers can evolve independently while still being able to trigger actions in response to specific events.""}]",knowledge/js/stimulus_docs/reference,1.0,train
"[{""from"": ""human"", ""value"": ""What should you keep in mind when managing multiple controllers on the same element?""}, {""from"": ""gpt"", ""value"": ""When managing multiple controllers on the same element, remember to:\n1. **Ensure Unique Identifiers**: Use unique identifiers for each controller to avoid conflicts in functionality.\n2. **Be Aware of Scope**: Understand that each controller operates within its own scope, which can simplify management of events and targets.\n3. **Handle Event Conflicts**: Be cautious of potential event conflicts if different controllers listen for the same event; ensure clear responsibilities.\n4. **Optimize Performance**: Minimize logic within combined controllers to ensure efficiency and reduce unnecessary DOM manipulations.""}]",knowledge/js/stimulus_docs/reference,1.0,train
"[{""from"": ""human"", ""value"": ""How does the data-action attribute facilitate controller actions?""}, {""from"": ""gpt"", ""value"": ""The `data-action` attribute in Stimulus allows you to define event listeners directly in your HTML, linking user interactions (like clicks) to controller methods. For instance:\n```html\n<button data-action=\""click->counter#increment\"">Increment</button>\n```\nThis means that when the button is clicked, the `increment` method in the `CounterController` will be called. It effectively binds events to controller actions, streamlining the connection between the HTML and JavaScript behavior.""}]",knowledge/js/stimulus_docs/reference,1.0,train
"[{""from"": ""human"", ""value"": ""Can you explain the purpose of static fields in the context of Stimulus controllers?""}, {""from"": ""gpt"", ""value"": ""In Stimulus controllers, static fields are used to define properties that are shared across all instances of the controller. For example, properties like `static targets` help designate which elements in the DOM the controller should interact with. Static fields can also include configurations or constants necessary for the functionality of the class, enhancing organization and readability while minimizing redundancy across instances.""}]",knowledge/js/stimulus_docs/reference,1.0,train
"[{""from"": ""human"", ""value"": ""How do you ensure that methods in a Stimulus controller are properly encapsulated?""}, {""from"": ""gpt"", ""value"": ""To ensure that methods in a Stimulus controller are properly encapsulated:\n1. **Use Private Methods**: Define private methods (prefixing with `_`) that are not accessible externally, promoting the encapsulation of logic within the controller.\n2. **Avoid Global Variables**: Keep any state or configuration contained within the class instead of using global variables that can introduce conflicts.\n3. **Limit Public Interface**: Only expose methods that are necessary for event handling or initialization through the `data-action` attribute, to keep the public API clean.\nThis enhances maintainability and reduces the potential for unintended interactions.""}]",knowledge/js/stimulus_docs/reference,1.0,train
"[{""from"": ""human"", ""value"": ""How do you set targets in a Stimulus controller?""}, {""from"": ""gpt"", ""value"": ""In a Stimulus controller, you can set targets by defining a `static targets` array that lists the names of the targets you want to reference in your methods. For instance:\n```js\nclass MyController extends Controller {\n  static targets = [\""input\"", \""output\""];\n\n  updateOutput() {\n    this.outputTarget.textContent = this.inputTarget.value;\n  }\n}\n```\nIn this example, `input` and `output` are targets that can be referenced directly via `this.inputTarget` and `this.outputTarget` within controller methods, streamlining your code and making it more readable.""}]",knowledge/js/stimulus_docs/reference,1.0,train
"[{""from"": ""human"", ""value"": ""What role does the `initialize` method serve in a Stimulus controller?""}, {""from"": ""gpt"", ""value"": ""The `initialize` method in a Stimulus controller serves as a setup function that runs automatically when a controller instance is created. It is an ideal place to set default values for properties, initialize states, or perform configuration tasks. For instance:\n```js\nclass ExampleController extends Controller {\n  initialize() {\n    this.value = 0;\n  }\n}\n```\nIn this example, the `initialize` method sets a default value for the `value` property each time the controller instance is created.""}]",knowledge/js/stimulus_docs/reference,1.0,train
"[{""from"": ""human"", ""value"": ""How does the `application` property of a Stimulus controller enhance its functionality?""}, {""from"": ""gpt"", ""value"": ""The `application` property of a Stimulus controller enhances its functionality by providing access to the parent `Application` instance, which allows the controller to register other controllers, dispatch global events, and interact with shared configurations. It can be utilized for dynamic registration of new controllers or retrieving application-level settings, thereby integrating the controller more deeply into the Stimulus ecosystem.""}]",knowledge/js/stimulus_docs/reference,1.0,train
"[{""from"": ""human"", ""value"": ""How can methods be dynamically bound to events in Stimulus?""}, {""from"": ""gpt"", ""value"": ""Methods can be dynamically bound to events in Stimulus using the `data-action` attribute in your HTML. This attribute specifies the event type and the corresponding method to be invoked. For example:\n```html\n<button data-action=\""click->my-controller#myMethod\"">Click Me</button>\n```\nHere, when the button is clicked, the `myMethod` function of the `MyController` is called. This seamless binding allows for clear interaction between user actions and controller methods.""}]",knowledge/js/stimulus_docs/reference,1.0,train
"[{""from"": ""human"", ""value"": ""Can you describe the purpose of the static legacySelector field?""}, {""from"": ""gpt"", ""value"": ""The `static legacySelector` field in a Stimulus controller is used to define a CSS selector for elements that are considered legacy or backward compatible. In certain scenarios, you may want to update old DOM elements to use the new controller behavior. For example:\n```js\nclass SpinnerButton extends Controller {\n  static legacySelector = \"".legacy-spinner-button\"";\n}\n```\nBy defining this selector, the controller can identify and interact with legacy elements, updating their attributes or behaviors without rewriting the entire codebase.""}]",knowledge/js/stimulus_docs/reference,1.0,train
"[{""from"": ""human"", ""value"": ""What considerations should be made when using legacy elements with Stimulus controllers?""}, {""from"": ""gpt"", ""value"": ""When using legacy elements with Stimulus controllers, consider the following:\n1. **Selector Accuracy**: Ensure that the defined selectors specifically target the intended elements to prevent unintended interactions.\n2. **Behavior Consistency**: Maintain consistency in how legacy elements behave compared to new elements controlled by Stimulus to avoid confusing users.\n3. **Performance**: Be aware that manipulating legacy elements can introduce overhead; manage updates efficiently to keep the UI responsive.\n4. **Migration Plan**: Have a strategy for transitioning legacy elements to full Stimulus controllers in the future, ensuring a gradual improvement in your codebase.""}]",knowledge/js/stimulus_docs/reference,1.0,train
"[{""from"": ""human"", ""value"": ""How do you update legacy elements when new controllers are registered?""}, {""from"": ""gpt"", ""value"": ""To update legacy elements when new controllers are registered, you can implement the `afterLoad` method in your controller. In this method, select the legacy elements and update their attributes or behaviors accordingly. For example:\n```js\nclass SpinnerButton extends Controller {\n  static afterLoad(identifier, application) {\n    const updateLegacySpinners = () => {\n      document.querySelectorAll(this.legacySelector).forEach((element) => {\n        element.setAttribute(application.schema.controllerAttribute, identifier);\n      });\n    };\n\n    if (document.readyState == \""loading\"") {\n      document.addEventListener(\""DOMContentLoaded\"", updateLegacySpinners);\n    } else {\n      updateLegacySpinners();\n    }\n  }\n}\n```\nThis method updates any legacy spinner elements once the controller is registered.""}]",knowledge/js/stimulus_docs/reference,1.0,train
"[{""from"": ""human"", ""value"": ""What is the use of the `data-controller` attribute in HTML?""}, {""from"": ""gpt"", ""value"": ""The `data-controller` attribute in HTML is used to specify which Stimulus controller is associated with a particular DOM element. When this attribute is added to an element, Stimulus automatically instantiates the controller class defined by the identifier contained in the attribute's value. This enables the element to interact with JavaScript functionality defined in the corresponding controller class, enhancing the web page's interactivity and functionality.""}]",knowledge/js/stimulus_docs/reference,1.0,train
"[{""from"": ""human"", ""value"": ""How can the layout of controllers improve the maintainability of a Stimulus application?""}, {""from"": ""gpt"", ""value"": ""The layout of controllers can significantly improve the maintainability of a Stimulus application by enforcing a modular architecture:\n1. **Single Responsibility**: Each controller focuses on a distinct functionality, making it easier to understand and modify.\n2. **Clear Organization**: Structuring controllers in designated directories with descriptive names aids in finding and using specific features quickly.\n3. **Ease of Testing**: Smaller, isolated job descriptions lend themselves to easier unit testing, ensuring reliable behaviors.\n4. **Reduced Coupling**: Well-laid-out controllers can interact through events instead of direct method calls, preventing tight coupling and enhancing flexibility for future changes.""}]",knowledge/js/stimulus_docs/reference,1.0,train
