conversations,source,score,split
"[{""from"": ""human"", ""value"": ""In what context would you prefer to work with the `dispatch` method rather than direct method invocation?""}, {""from"": ""gpt"", ""value"": ""You would prefer to use the `dispatch` method over direct method invocation in scenarios where decoupling and modularity are valued, such as:\n1. **Inter-Component Communication**: When multiple components need to react to the same event without depending on each other's implementation.\n2. **Dynamic Scenarios**: When elements may not always be present in the DOM or when their states can change frequently.\n3. **Legacy Support**: When integrating legacy code or behaviors that need to listen for suggested interactions without causing tight coupling.\nBy dispatching events, you ensure that your components can remain independent and maintainable.""}]",knowledge/js/stimulus_docs/reference,1.0,train
"[{""from"": ""human"", ""value"": ""How do you prevent method call conflicts in a Stimulus application?""}, {""from"": ""gpt"", ""value"": ""To prevent method call conflicts in a Stimulus application, you should:\n1. **Use Unique Identifiers**: Ensure every controller and action has unique identifiers to avoid clashes.\n2. **Organize Methods by Functionality**: Group methods logically and avoid naming overlaps to enhance clarity and prevent conflicts.\n3. **Employ Namespaces/Prefixes**: If multiple actions across different controllers share similar names, use prefixes or namespaces to distinguish them clearly.\n4. **Document Your Code**: Maintaining clear documentation helps other developers understand interactions, reducing potential conflicts stemming from miscommunication.""}]",knowledge/js/stimulus_docs/reference,1.0,train
"[{""from"": ""human"", ""value"": ""How does Stimulus support rapid development of rich web applications?""}, {""from"": ""gpt"", ""value"": ""Stimulus supports rapid development of rich web applications by encouraging a structured approach to enhancing HTML with minimal JavaScript. Key factors include:\n1. **Lightweight Integration**: Stimulus is designed to work alongside existing HTML and CSS, requiring no major rewrites, thus allowing developers to incrementally enhance their applications.\n2. **Declarative Approach**: By using data attributes in HTML, developers can quickly bind JavaScript behaviors to elements, enabling faster UI interactivity designs.\n3. **Reduced Boilerplate**: Stimulus minimizes repetitive code through controllers that manage specific aspects of behavior, fostering concise code and efficient management of application state.\n4. **Modular Architecture**: Controllers can manage different behaviors independently, making it easier to develop and test components separately.""}]",knowledge/js/stimulus_docs/reference,1.0,train
"[{""from"": ""human"", ""value"": ""How can controller inheritance be leveraged in a Stimulus application?""}, {""from"": ""gpt"", ""value"": ""Controller inheritance can be leveraged in a Stimulus application by creating a base controller class that encapsulates common actions and properties adopted by derived controllers, leading to code reuse and maintainability. Consider this example:\n```js\nclass BaseController extends Controller {\n  commonMethod() {\n    console.log(\""This method is shared among all controllers\"");\n  }\n}\n\nclass ChildController extends BaseController {\n  activate() {\n    this.commonMethod();\n  }\n}\n```\nIn this case, `ChildController` inherits methods from `BaseController`, allowing it to leverage shared behavior, thus reducing code duplication.""}]",knowledge/js/stimulus_docs/reference,1.0,train
"[{""from"": ""human"", ""value"": ""What is the advantage of using a framework like Stimulus for a web application?""}, {""from"": ""gpt"", ""value"": ""Using a framework like Stimulus for a web application provides several advantages:\n1. **Enhanced Interactivity**: Stimulus introduces dynamic behavior to applications without the overhead of a full SPA (Single Page Application) approach.\n2. **Simplicity and Clarity**: With its simplistic model, developers can enhance existing HTML and CSS with minimal JavaScript, promoting clearer separation of concerns and less complexity.\n3. **Rapid Development Cycle**: Due to the ease of integration and the reduction of boilerplate code, developers can quickly prototype and iterate on features.\n4. **Integration with Turbolinks**: Stimulus pairs well with Turbolinks, which speeds up navigation by only updating the content of the page, enhancing the user experience.""}]",knowledge/js/stimulus_docs/reference,1.0,train
"[{""from"": ""human"", ""value"": ""How does controller registration improve application performance?""}, {""from"": ""gpt"", ""value"": ""Controller registration enhances application performance by enabling only the necessary controllers to be loaded when the page loads. This means that:\n1. **Reduced Initial Load Time**: By registering controllers selectively, the application can decrease the amount of JavaScript needed at the start, allowing for faster page loads.\n2. **Lazy Loading Capabilities**: Developers can implement strategies to load controllers only when they are needed, optimizing memory usage and responsiveness.\n3. **Scoped Actions**: Controllers only execute when relevant HTML elements are in the DOM, deterring unnecessary processing and improving performance.""}]",knowledge/js/stimulus_docs/reference,1.0,train
"[{""from"": ""human"", ""value"": ""What are the steps to implement a new controller in Stimulus?""}, {""from"": ""gpt"", ""value"": ""To implement a new controller in Stimulus, follow these steps:\n1. **Create the Controller File**: Define your controller class in a new file in the `controllers/` directory.\n2. **Define the Class**: Extend the `Controller` base class and define any properties and methods needed for your behavior.\n3. **Export the Class**: Export the controller as the default object from the file.\n4. **Use the data-controller Attribute**: Add the `data-controller` attribute in your HTML to link the element to your newly defined controller.\n5. **Register the Controller**: Ensure the controller is registered, either automatically using import maps/Webpack or manually using `Application#register` if required.""}]",knowledge/js/stimulus_docs/reference,1.0,train
"[{""from"": ""human"", ""value"": ""What methods can be implemented in a typical Stimulus controller?""}, {""from"": ""gpt"", ""value"": ""A typical Stimulus controller can implement various methods, such as:\n1. **initialize()**: This method sets up initial states when the controller is created.\n2. **connect()**: Called when the controller is connected to the DOM, perfect for attaching event listeners or setting up default behavior.\n3. **disconnect()**: Invoked when the controller is removed from the DOM, useful for cleanup tasks.\n4. **Custom Action Methods**: Any additional methods that correspond to events defined via `data-action`, handling specific behaviors like responding to user interactions.""}]",knowledge/js/stimulus_docs/reference,1.0,train
