conversations,source,score,split
"[{""from"": ""human"", ""value"": ""What are lifecycle callbacks in Stimulus?""}, {""from"": ""gpt"", ""value"": ""Lifecycle callbacks in Stimulus are special methods that allow developers to respond to the connection and disconnection events of controllers and their targets. These callbacks enable a controller to execute code at specific moments in its lifecycle, such as when a controller is instantiated, connected to the DOM, a target is connected or disconnected, and when a controller is disconnected from the DOM. For example, you can use the `connect()` method to initialize resources when a controller becomes active, and `disconnect()` to clean up when it goes inactive.""}]",knowledge/js/stimulus_docs/reference,1.0,train
"[{""from"": ""human"", ""value"": ""List the lifecycle methods that can be defined in a Stimulus controller.""}, {""from"": ""gpt"", ""value"": ""In a Stimulus controller, you can define the following lifecycle methods: \n1. `initialize()`: This method is invoked once when the controller is first instantiated.\n2. `[name]TargetConnected(target: Element)`: Triggered anytime a target connected to the DOM.\n3. `connect()`: Called anytime the controller is connected to the DOM.\n4. `[name]TargetDisconnected(target: Element)`: Invoked when a target is disconnected from the DOM.\n5. `disconnect()`: Called anytime the controller is disconnected from the DOM.\n\nThese methods allow the controller to handle specific events effectively.""}]",knowledge/js/stimulus_docs/reference,1.0,train
"[{""from"": ""human"", ""value"": ""Explain how a controller becomes connected to the document.""}, {""from"": ""gpt"", ""value"": ""A controller becomes connected to the document under two conditions: \n1. **Element Presence**: The controller's associated element must be present in the DOM, meaning it must be a descendant of the `document.documentElement` (the `<html>` element).\n2. **Data Attributes**: The controller's identifier has to be present in the element's `data-controller` attribute.\n\nWhen both of these conditions are satisfied, Stimulus invokes the controller's `connect()` method, signaling that the controller is active and ready to execute its behaviors.""}]",knowledge/js/stimulus_docs/reference,1.0,train
"[{""from"": ""human"", ""value"": ""What conditions need to be met for a target to be considered connected?""}, {""from"": ""gpt"", ""value"": ""A target is considered connected to the document when:\n1. **Element Presence**: The target element is present in the document as a descendant of its corresponding controller's element.\n2. **Data Attributes**: The target element has its identifier present in the element's `data-{identifier}-target` attribute.\n\nOnce these criteria are met, Stimulus triggers the controller's `[name]TargetConnected()` method, passing the target element as an argument.""}]",knowledge/js/stimulus_docs/reference,1.0,train
"[{""from"": ""human"", ""value"": ""Describe the process of a controller becoming disconnected and the circumstances that lead to it.""}, {""from"": ""gpt"", ""value"": ""A connected controller becomes disconnected when either of the following conditions becomes false:\n1. The controller's element is explicitly removed from the document (e.g., using `Node#removeChild()` or `ChildNode#remove()`).\n2. One of the controller's parent elements is removed from the document or has its contents replaced (e.g., via `Element#innerHTML=`).\n3. The `data-controller` attribute is removed or modified on the element.\n4. If the document installs a new `<body>` element, such as during a Turbo page change. \n\nWhen the controller becomes disconnected, Stimulus calls the controller's `disconnect()` method, allowing for any cleaning or resource release as needed.""}]",knowledge/js/stimulus_docs/reference,1.0,train
"[{""from"": ""human"", ""value"": ""How does Stimulus handle the reconnection of a controller?""}, {""from"": ""gpt"", ""value"": ""When a disconnected controller is re-connected, Stimulus reuses the existing instance of the controller. For example, if the controller's element was removed from the document and then re-attached, Stimulus will call the `connect()` method of that existing controller instance. This means that the controller can retain its previous state and continue functioning as before. The same process applies to targets; when a previously disconnected target is re-connected, Stimulus will again invoke the controller's `[name]TargetConnected()` method.""}]",knowledge/js/stimulus_docs/reference,1.0,train
"[{""from"": ""human"", ""value"": ""What role does the MutationObserver API play in Stimulus?""}, {""from"": ""gpt"", ""value"": ""The MutationObserver API is used by Stimulus to asynchronously observe changes in the DOM. When changes occur, it ensures that lifecycle methods of controllers are called in the next microtask, allowing for efficient handling of the document's state. This observation means that if a controller or target is added, removed, or modified, Stimulus will react appropriately, invoking lifecycle methods like `connect()`, `disconnect()`, `[name]TargetConnected()`, and `[name]TargetDisconnected()`, in the proper order.""}]",knowledge/js/stimulus_docs/reference,1.0,train
"[{""from"": ""human"", ""value"": ""Can you provide a simple example of a Stimulus controller that utilizes lifecycle callbacks?""}, {""from"": ""gpt"", ""value"": ""Certainly! Below is a simple example of a Stimulus controller that utilizes lifecycle callbacks to manage its behavior upon connecting and disconnecting from the DOM:\n```js\nimport { Controller } from \""@hotwired/stimulus\"";\n\nexport default class extends Controller {\n    initialize() {\n        console.log('Controller is initialized.');\n    }\n\n    connect() {\n        console.log('Controller is connected to the DOM.');\n        // perform setup here\n    }\n\n    disconnect() {\n        console.log('Controller is disconnected from the DOM.');\n        // perform cleanup here\n    }\n}\n```\nIn this example, the `initialize()` method logs when the controller is instantiated, the `connect()` method logs a message when the controller is connected, and the `disconnect()` method logs messaging for cleanup when the controller is disconnected.""}]",knowledge/js/stimulus_docs/reference,1.0,train
"[{""from"": ""human"", ""value"": ""What happens if a controller's connect method is called multiple times?""}, {""from"": ""gpt"", ""value"": ""If a controller's `connect()` method is called multiple times, it will occur in a controlled manner due to the lifecycle of the controller. Specifically, when a controller is re-connected after being previously connected, Stimulus will invoke the `disconnect()` method before calling `connect()` again. This ensures that resources are properly released before re-initializing, maintaining a predictable state and behavior between connections.""}]",knowledge/js/stimulus_docs/reference,1.0,train
"[{""from"": ""human"", ""value"": ""How can you check if a controller's method is called when a target is connected?""}, {""from"": ""gpt"", ""value"": ""To check if a controller's method is called when a target is connected, you can implement the `[name]TargetConnected(target: Element)` lifecycle method in your controller. You can log a message or perform any action within this method whenever a target connected to the DOM. Here\u2019s an example:\n```js\nimport { Controller } from \""@hotwired/stimulus\"";\n\nexport default class extends Controller {\n    connect() {\n        console.log('Controller is connected.');\n    }\n\n    myTargetConnected(target) {\n        console.log('Target connected:', target);\n        // Additional actions on target connection\n    }\n}\n```\nIn this example, when a specific target is connected, the `myTargetConnected()` method is called and logs the target element.""}]",knowledge/js/stimulus_docs/reference,1.0,train
"[{""from"": ""human"", ""value"": ""What is the sequence of calls to lifecycle methods when a controller is connected to the DOM?""}, {""from"": ""gpt"", ""value"": ""When a controller is connected to the DOM in Stimulus, the sequence of calls to lifecycle methods is as follows:\n1. First, any `initialize()` methods are called once when the controller is instantiated.\n2. Then, if a target is connected at that time, the corresponding `[name]TargetConnected(target: Element)` method is invoked for each target.\n3. Finally, the controller itself will have its `connect()` method called.\n\nThis sequence ensures that all target-related operations are properly handled before the main connection logic in the controller.""}]",knowledge/js/stimulus_docs/reference,1.0,train
"[{""from"": ""human"", ""value"": ""What should a developer consider when managing resources in the disconnect method?""}, {""from"": ""gpt"", ""value"": ""When managing resources in the `disconnect()` method, a developer should consider the following: \n1. **Clean Up**: Ensure that any persistent event listeners, timers, or intervals are removed, so that they do not cause memory leaks or unintended behavior once the controller is no longer active.\n2. **State Preservation**: If there's any state that needs to be preserved for when the controller is reconnected, save it before cleanup occurs.\n3. **Detaching DOM Elements**: If the controller manages any DOM elements directly, ensure that references to them are cleared, or they are properly removed to avoid reference issues when the controller is not in use.\n4. **Error Handling**: Handle any potential errors that may arise during the cleanup process gracefully, ensuring that the application continues to behave correctly.""}]",knowledge/js/stimulus_docs/reference,1.0,train
"[{""from"": ""human"", ""value"": ""Provide an example of how to utilize the `initialize` and `disconnect` methods in a Stimulus controller.""}, {""from"": ""gpt"", ""value"": ""Here's an example of a Stimulus controller that utilizes the `initialize` and `disconnect` methods:\n```js\nimport { Controller } from \""@hotwired/stimulus\"";\n\nexport default class extends Controller {\n    constructor() {\n        super();\n        this.dataKey = 'someValue'; // example state\n    }\n\n    initialize() {\n        console.log('Controller initialized with data key:', this.dataKey);\n    }\n\n    disconnect() {\n        console.log('Cleaning up on disconnect.');\n        // Logic to perform cleanup\n    }\n}\n```\nIn this example, the `initialize()` method logs a message with a data key and sets up initial state, while the `disconnect()` method handles cleanup activities when the controller is no longer connected to the DOM.""}]",knowledge/js/stimulus_docs/reference,1.0,train
"[{""from"": ""human"", ""value"": ""What are some best practices for using lifecycle callbacks effectively in Stimulus?""}, {""from"": ""gpt"", ""value"": ""Some best practices for using lifecycle callbacks effectively in Stimulus include:\n1. **Keep It Lightweight**: Ensure that the logic in the lifecycle methods is concise and focused, preventing long-running operations that may lead to performance issues.\n2. **Avoid Side Effects**: Try to minimize side effects, especially in `connect()` and `disconnect()` methods, ensuring that state and behaviors are predictable.\n3. **Type Safety**: Utilize TypeScript or JSDoc annotations to clearly define the expected types for parameters in lifecycle methods, improving maintainability and clarity of code.\n4. **Testing**: Write tests for lifecycle methods to ensure they behave as expected in different scenarios, particularly when adding and removing elements dynamically.\n5. **Document**: Keep the lifecycle methods documented to provide clear understanding of their behavior and the order of execution for future developers.""}]",knowledge/js/stimulus_docs/reference,1.0,train
"[{""from"": ""human"", ""value"": ""How can you leverage the asynchronous nature of lifecycle methods in Stimulus?""}, {""from"": ""gpt"", ""value"": ""To leverage the asynchronous nature of lifecycle methods in Stimulus, you can utilize the `MutationObserver API` to react to changes in the DOM and manage the execution of lifecycle method calls accordingly. You can incorporate async functions to load resources, make API calls, or perform other asynchronous tasks within these methods. For example:\n```js\nimport { Controller } from \""@hotwired/stimulus\"";\n\nexport default class extends Controller {\n    async connect() {\n        console.log('Connecting...');\n        await this.loadData();\n    }\n\n    async loadData() {\n        const response = await fetch('/api/data');\n        const data = await response.json();\n        console.log('Data loaded:', data);\n    }\n}\n```\nIn this scenario, the `connect()` method is asynchronous, allowing data to be loaded as soon as the controller is connected.""}]",knowledge/js/stimulus_docs/reference,1.0,train
"[{""from"": ""human"", ""value"": ""What is the benefit of having methods like [name]TargetConnected in a Stimulus controller?""}, {""from"": ""gpt"", ""value"": ""Having methods like `[name]TargetConnected` in a Stimulus controller provides a structured way to handle specific actions related to the targets of that controller. This allows developers to encapsulate logic that pertains to particular elements, making it easier to manage interactions as elements are added or removed from the DOM. It enables clear separation of concerns: the controller manages overall functionality while individual target methods handle specific scenarios. For instance, developers can react differently when a target becomes active or inactive, thus enhancing responsiveness and adaptability of the application.""}]",knowledge/js/stimulus_docs/reference,1.0,train
"[{""from"": ""human"", ""value"": ""Explain the importance of order in lifecycle method calls in Stimulus.""}, {""from"": ""gpt"", ""value"": ""The order of lifecycle method calls in Stimulus is important as it defines the behavior and flow of execution across connected controllers and targets. When a controller transitions between states (e.g., connected to disconnected), the sequence ensures that resources are cleaned up and initialized correctly. For example, the sequence is designed such that a call to `connect()` will always follow after the associated target's `[name]TargetDisconnected()` if that target was previously connected. This predictable ordering helps in managing dependencies and maintaining application stability during state transitions.""}]",knowledge/js/stimulus_docs/reference,1.0,train
"[{""from"": ""human"", ""value"": ""How do changes in the DOM affect the lifecycle of Stimulus controllers?""}, {""from"": ""gpt"", ""value"": ""Changes in the DOM directly affect the lifecycle of Stimulus controllers by triggering the corresponding lifecycle methods. For instance, adding or removing elements affiliated with a controller can result in the invocation of `connect()` and `disconnect()` methods. Likewise, when targets are added or removed, the target connection methods `[name]TargetConnected()` and `[name]TargetDisconnected()` are triggered respectively. This allows Stimulus to adaptively respond to user interactions or dynamic content updates, ensuring that the application remains responsive and behaves as intended.""}]",knowledge/js/stimulus_docs/reference,1.0,train
"[{""from"": ""human"", ""value"": ""What is the difference between `connect()` and `[name]TargetConnected(target)` lifecycle methods?""}, {""from"": ""gpt"", ""value"": ""The `connect()` lifecycle method is called when the controller itself is connected to the DOM, indicating that the controller is prepared to perform its designated tasks. In contrast, the `[name]TargetConnected(target)` method is specifically invoked when a target element related to that controller becomes connected to the DOM. While `connect()` handles the controller's overall operations, `[name]TargetConnected(target)` focuses on the state and behavior of specific target elements, enabling fine-tuned control over each connected target.""}]",knowledge/js/stimulus_docs/reference,1.0,train
"[{""from"": ""human"", ""value"": ""What actions should be taken in the `disconnect()` method?""}, {""from"": ""gpt"", ""value"": ""In the `disconnect()` method, several key actions should be taken to ensure proper cleanup and release of resources:\n1. **Remove Event Listeners**: Unsubscribe from any event listeners that were added in `connect()` to prevent memory leaks.\n2. **Clear Data**: If the controller maintains any data or state, reset or clear it to avoid retaining unnecessary information when the controller is inactive.\n3. **Stop Timers/Intervals**: If there are any timers or intervals created, clear them to ensure they don't continue running indefinitely or interfere with the app's performance.\n4. **Detach DOM Elements if Needed**: If the controller managed direct DOM elements, ensure they are properly removed or their references cleared to avoid dangling pointers.\nBy properly implementing these actions, the controller can ensure a clean disconnection process.""}]",knowledge/js/stimulus_docs/reference,1.0,train
"[{""from"": ""human"", ""value"": ""What can trigger the disconnection of a controller?""}, {""from"": ""gpt"", ""value"": ""A controller can be triggered to disconnect from the DOM under several circumstances:\n1. **Element Removal**: The controller's element is explicitly removed by calls like `Node#removeChild()` or `ChildNode#remove()`.\n2. **Parent Element Changes**: If one of the parent elements of the controller's element is removed or modified, it can cause the controller to disconnect.\n3. **Contents Replacement**: If a parent element's contents are replaced via `Element#innerHTML=`, it can lead to the disconnection of child controllers.\n4. **Attribute Changes**: Modifying or removing the controller's `data-controller` attribute can result in disconnection.\n5. **Dynamic Page Changes**: Document-level changes, like installing a new `<body>` in Turbo-driven applications, will cause controllers to disconnect as well.""}]",knowledge/js/stimulus_docs/reference,1.0,train
