conversations,source,score,split
"[{""from"": ""human"", ""value"": ""What role does exporting play in GrapesJS component handling?""}, {""from"": ""gpt"", ""value"": ""Exporting plays a critical role in GrapesJS component handling as it allows developers to retrieve and save the generated HTML for further use, whether that's for deployment on a live site or for creating templates.\n\n1. **HTML Generation**: When you use the `editor.getHtml()` method, GrapesJS compiles all components and their associated scripts into a single HTML output. This process involves serializing the entire canvas and ensuring that all component logic is preserved in the output.\n   \n2. **Easy Integration**: Once exported, the generated HTML can easily be integrated into any web application or CMS, allowing developers to utilize the GrapesJS editor to create visually appealing layouts without writing any HTML manually.\n   \n3. **Customizable Output**: Developers can customize the exporting process by integrating additional scripts, external resources, or more settings pertinent to their application needs, ensuring the exported version fits seamlessly into its environment.\n   \n4. **Maintain Interactivity**: The exported HTML contains the necessary JavaScript and script references, which ensures that the components remain interactive once deployed on the final site. This guarantees that functionalities like toggles, modals, or galleries retain their behavior.""}]",knowledge/js/grapesjs/modules,1.0,train
"[{""from"": ""human"", ""value"": ""How can you ensure that the final HTML exported from GrapesJS includes necessary resources?""}, {""from"": ""gpt"", ""value"": ""To ensure that the final HTML exported from GrapesJS includes necessary resources, you can follow these best practices:\n\n1. **Manual Inclusion**: Explicitly include all necessary scripts and styles within your component or template definitions. This means wrapping essential libraries and styles in the exported HTML structure that you control.\n   ```js\n   const editor = grapesjs.init({\n     canvas: {\n       scripts: ['https://code.jquery.com/jquery-3.5.1.min.js'], // Include jQuery\n     },\n   });\n   ```\n\n2. **Final Page Integration**: When rendering the final page where the exported HTML will be inserted, make sure to include all required libraries in that context as well, for example in your main HTML structure or layout file.\n   ```html\n   <script src='https://code.jquery.com/jquery-3.5.1.min.js'></script>\n   ```\n\n3. **Use of `editor.getHtml`**: When exporting, utilize the `editor.getHtml()` method while ensuring to also manually add the script and link tags for your necessary resources within the resulting HTML string. This could look like integrating the required paths into the export routine.\n   \n4. **Testing**: Always test the exported HTML in a local or staging environment to verify that the JavaScript and CSS behaviors function as expected, ensuring everything integrates properly before going live.""}]",knowledge/js/grapesjs/modules,1.0,train
"[{""from"": ""human"", ""value"": ""What is the role of the `script` property in component definitions?""}, {""from"": ""gpt"", ""value"": ""The `script` property in component definitions serves to define the functionality that will be executed when the component is rendered on the canvas. It allows you to specify a JavaScript function that will run in response to user interactions or component lifecycle events.\n\n1. **Encapsulated Logic**: The `script` property encapsulates logic specific to that component, allowing you to add interactivity tailored to what the component is meant to do.\n   ```js\n   const script = function () {\n     alert('Component Clicked!');\n   };\n   ```\n\n2. **Direct Manipulation**: It enables direct manipulation of the component's styles and properties using the `this` keyword, which points to the component instance, providing context.\n\n3. **Dynamic Behavior**: By defining a `script`, you can create dynamic behavior that changes based on user input, which can significantly enhance the user experience and interaction with the components.\n\n4. **Integration with External Libraries**: The `script` property also facilitates the integration of external JavaScript libraries, making it possible for components to utilize additional functionalities not provided by GrapesJS out of the box.\n\nThe flexibility provided by the `script` property is fundamental in building interactive applications using GrapesJS.""}]",knowledge/js/grapesjs/modules,1.0,train
"[{""from"": ""human"", ""value"": ""How can developers manage multiple component states in GrapesJS?""}, {""from"": ""gpt"", ""value"": ""Developers can manage multiple component states in GrapesJS through a variety of methodologies:\n\n1. **Using Traits**: Leverage traits to track and manage state changes. By giving each component specific traits (like dropdowns, sliders, etc.), developers can allow users to manipulate component states easily without directly interacting with the code.\n   ```js\n   traits: [{ type: 'select', name: 'visibility', options: [ ... ] }]\n   ```\n\n2. **Event Listeners**: Implement event listeners in the script property that can trigger functions based on user interactions. For example, changing visibility or style upon certain events like clicks or hover actions.\n   ```js\n   events: {\n     click: function () { this.style.display = 'none'; }\n   }\n   ```\n\n3. **Script Props**: Use `script-props` to dynamically change component behavior. By passing traits as props into scripts, developers can create highly responsive components that adapt to changes.\n   ```js\n   'script-props': ['visibility'],\n   ```\n\n4. **Component States**: Define various component states within the model. By creating custom attributes or modifying properties based on user interactions, developers can effectively manage and maintain multiple states.\n\n5. **Global State Management**: In larger applications, consider implementing a global state management solution (like Redux or Vuex) to keep track of overall application state, ensuring consistency when components reserve relational states.""}]",knowledge/js/grapesjs/modules,1.0,train
"[{""from"": ""human"", ""value"": ""What is the importance of the `editor.getHtml()` method in the GrapesJS workflow?""}, {""from"": ""gpt"", ""value"": ""The `editor.getHtml()` method in the GrapesJS workflow is vital for several reasons:\n\n1. **HTML Compilation**: This method compiles the current state of the canvas and converts all the components into a cohesive HTML structure, making it crucial for generating the output required for deployment.\n\n2. **Real-Time Preview**: It allows developers to preview how their components will look and behave once rendered with the actual page structure, which aids in user experience testing and optimization.\n\n3. **Template Creation**: By utilizing `editor.getHtml()`, developers can save or export their components as reusable templates, enabling easier sharing and reuse in future projects or within different sections of the same application.\n\n4. **Integration with Other Systems**: Once the HTML is generated, it can be integrated into various web applications or content management systems, providing the flexibility needed in different environments.\n\n5. **Debugging Tool**: It can serve as a tool for debugging issues, where developers can inspect the generated HTML for errors or unexpected structures resulting from code modifications, thereby facilitating streamlined development.""}]",knowledge/js/grapesjs/modules,1.0,train
"[{""from"": ""human"", ""value"": ""Can you summarize the primary functions of GrapesJS in terms of component management?""}, {""from"": ""gpt"", ""value"": ""GrapesJS provides a comprehensive suite of features for component management, including:\n\n1. **Custom Component Creation**: Developers can create fully customizable components with specific attributes, styles, and behaviors, allowing for intricate UI designs without deep coding knowledge.\n\n2. **Script Integration**: The framework allows users to attach scripts to components with ease, enhancing interactivity and enabling dynamic content manipulation through JavaScript.\n\n3. **Trait Management**: Traits allow users to alter component properties directly from the graphical editor without modifying the underlying code manually, promoting accessibility and ease of use.\n\n4. **Dynamic Behaviors**: Scripts can be designed to adapt based on user interactions or input changes, allowing the components to behave responsively according to their state.\n\n5. **Export Functionality**: GrapesJS includes functionality for exporting the visual layout as HTML, making it simpler for developers to deploy or implement designs in real-world applications effectively.""}]",knowledge/js/grapesjs/modules,1.0,train
"[{""from"": ""human"", ""value"": ""How do events play a role in component interactivity in GrapesJS?""}, {""from"": ""gpt"", ""value"": ""Events play a crucial role in enhancing component interactivity in GrapesJS by allowing developers to define specific actions in response to user interactions. Here's how events contribute to interactivity:\n\n1. **Defining Interactions**: Developers can specify event listeners directly within the component model. For example, an event like a click can trigger a function or a change in state when a user interacts with the component.\n   ```js\n   events: {\n     click: function () { alert('Component clicked!'); }\n   },\n   ```\n\n2. **Custom Behavior**: By tying functions to these events, custom behaviors can be executed seamlessly, enhancing the overall experience for users. This could involve things like toggling visibility, changing styles, or manipulating data.\n\n3. **Dynamic Updates**: Events allow components to respond dynamically to user actions, enabling real-time changes. For instance, changing the color of an element immediately upon selection from a dropdown can significantly improve user engagement.\n\n4. **Managing State**: Event-driven interactions can help manage the state of components, allowing for efficient updates based on user choices, such as form validations or changing attributes based on input.\n\nOverall, events in GrapesJS serve as the backbone for interactivity, enabling a responsive and engaging user experience when utilizing custom components.""}]",knowledge/js/grapesjs/modules,1.0,train
"[{""from"": ""human"", ""value"": ""What are the features of the traits system in GrapesJS?""}, {""from"": ""gpt"", ""value"": ""The traits system in GrapesJS has several features that enhance component flexibility and user interaction:\n\n1. **Customization**: Traits allow users to customize component properties through a user-friendly interface, enabling adjustments to various attributes without requiring coding skills.\n   ```js\n   traits: [\n     { type: 'text', name: 'Custom Text' },\n     { type: 'number', name: 'Font Size' },\n   ]\n   ```\n\n2. **Dynamic Propagation**: Traits can trigger dynamic changes in components when values are updated, such as modifying displayed text or changing styles in real-time, which utilizes the `changeProp` attribute effectively.\n\n3. **Variety of Input Types**: The traits system supports multiple input types, including text fields, select dropdowns, checkboxes, and sliders, allowing for diverse types of user input customization.\n   ```js\n   traits: [\n     { type: 'select', name: 'Color', options: [ ... ] },\n   ]\n   ```\n\n4. **Script Integration**: Traits can be linked to scripts through the `script-props` property, directly passing current values to scripts that drive component behavior based on user selections or inputs.\n\n5. **Extensibility**: Developers can easily create custom traits suited to their specific requirements, enhancing the adaptability and usability of components designed within GrapesJS.""}]",knowledge/js/grapesjs/modules,1.0,train
"[{""from"": ""human"", ""value"": ""How can dependencies be organized for optimal efficiency in a GrapesJS project?""}, {""from"": ""gpt"", ""value"": ""To organize dependencies for optimal efficiency in a GrapesJS project, consider the following strategies:\n\n1. **Component-Scoped Dependencies**: Load libraries that are only required by specific components as part of the component\u2019s initialization script. This ensures that dependencies are only loaded when the component is present, minimizing bloat and potential conflicts.\n   ```js\n   if (typeof someLib == 'undefined') {\n     const script = document.createElement('script');\n     script.src = 'https://path/to/library.js';\n   }\n   ```\n\n2. **Central Management for Global Libraries**: For libraries that all components may rely on, manage them at the template level rather than in each component. This strategy helps to avoid multiple load requests for the same library across various components, improving performance.\n   ```js\n   const editor = grapesjs.init({\n     canvas: {\n       scripts: [ 'https://path/to/globalLib.js' ],\n     },\n   });\n   ```\n\n3. **Load Libraries Asynchronously**: When loading large libraries or scripts, use asynchronous loading methods to improve the loading time of the application. This ensures that the component display is not blocked by waiting for libraries to load.\n   ```html\n   <script src='library.js' async></script>\n   ```\n\n4. **Bundle Dependencies**: Utilize tools like Webpack or Rollup to bundle dependencies into a single file, decreasing the number of HTTP requests and potentially speeding up loading times.\n\n5. **Monitoring and Cleanup**: Keep track of your dependencies usage. If certain libraries are no longer in use, remove them to keep the project lightweight and efficient.\n\nBy following these practices, developers can optimize their dependencies in a GrapesJS project, leading to improved loading times and better performance.""}]",knowledge/js/grapesjs/modules,1.0,train
