conversations,source,score,split
"[{""from"": ""human"", ""value"": ""What is the purpose of attaching component related scripts in GrapesJS?""}, {""from"": ""gpt"", ""value"": ""Attaching component related scripts in GrapesJS allows developers to enhance the functionality of custom components by incorporating external JavaScript libraries or custom scripts that can interact with the component elements. This enables features like counters, galleries, or slideshows to be seamlessly integrated into the components designed within the GrapesJS editor. It enhances the interactivity and dynamic behavior of the components, giving users more control over how the components behave once they are rendered in the final template.""}]",knowledge/js/grapesjs/modules,1.0,train
"[{""from"": ""human"", ""value"": ""Can you explain how scripts are attached to components in GrapesJS with an example?""}, {""from"": ""gpt"", ""value"": ""In GrapesJS, scripts can be attached to components by defining a custom script function within the component's model defaults. The custom script becomes part of the component's lifecycle and can be executed when the component is rendered in the canvas. \n\nHere\u2019s an example of how to attach a script to a custom component 'comp-with-js':\n\n```js\n// Define a custom script that will be called when the component is rendered\nconst script = function () {\n  alert('Hi'); // Display an alert when the component is interacted with\n  console.log('the element', this); // Log the component element in the console\n};\n\n// Adding the custom component type to the editor\neditor.Components.addType('comp-with-js', {\n  model: {\n    defaults: {\n      script, // Attaching the script here\n      // Adding styles to make the component visible\n      style: {\n        width: '100px',\n        height: '100px',\n        background: 'red',\n      },\n    },\n  },\n});\n\n// Create a block for easy dragging into the canvas\neditor.Blocks.add('test-block', {\n  label: 'Test block',\n  attributes: { class: 'fa fa-text' },\n  content: { type: 'comp-with-js' },\n});\n```\n\nWhen you drag this block into the canvas, the alert will pop up, and the message will be logged in the console, demonstrating that the script is functional and the context (`this`) is bound to the component.""}]",knowledge/js/grapesjs/modules,1.0,train
"[{""from"": ""human"", ""value"": ""What happens to the `this` context in the script when a component is rendered?""}, {""from"": ""gpt"", ""value"": ""The `this` context in the script of a component refers to the component element itself when the script is executed. This means within the custom script function, you can manipulate the component's properties or methods directly using `this`. For example, if you wanted to change the inner HTML of the component when it is rendered, you could do something like:\n\n```js\nconst script = function () {\n  this.innerHTML = 'inner content'; // Change the inner HTML of the component\n};\n```\n\nWhen the component is rendered in the canvas, `this` will point to the specific instance of the component, allowing developers to dynamically alter its content or properties.""}]",knowledge/js/grapesjs/modules,1.0,train
"[{""from"": ""human"", ""value"": ""Explain the key caveat when using scripts inside components in GrapesJS?""}, {""from"": ""gpt"", ""value"": ""A crucial caveat to consider when using scripts inside components in GrapesJS is that the script executes inside an iframe that isolates the canvas, meaning it does not have access to the main document or anything defined outside its own function scope. This can lead to issues such as trying to access global variables that won\u2019t be defined within the iframe.\n\nFor example:\n\n```js\nconst myVar = 'John';\n\nconst script = function () {\n  alert('Hi ' + myVar); // This will result in an error\n  console.log('the element', this);\n};\n```\n\nIn this case, `myVar` would be undefined in the context of the component\u2019s script, leading to an error in the console. Therefore, it is important to pass in any required data through props or by embedding everything necessary within the script itself.""}]",knowledge/js/grapesjs/modules,1.0,train
"[{""from"": ""human"", ""value"": ""What are the two approaches to manage external dependencies in GrapesJS?""}, {""from"": ""gpt"", ""value"": ""In GrapesJS, there are two primary approaches to manage external dependencies that your components may require:\n\n1. **Component-related approach**: This approach involves loading dependencies dynamically within the component's script, ensuring that they are only included when the component is actually present in the canvas. This method also allows you to control when initialization scripts for the libraries are called.\n   \n   ```js\n   const script = function (props) {\n     const initLib = function () {\n       const el = this;\n       const myLibOpts = {\n         prop1: props.myprop1,\n         prop2: props.myprop2,\n       };\n       someExtLib(el, myLibOpts);\n     };\n     \n     if (typeof someExtLib == 'undefined') {\n       const script = document.createElement('script');\n       script.onload = initLib;\n       script.src = 'https://.../somelib.min.js';\n       document.body.appendChild(script);\n     } else {\n       initLib();\n     }\n   };\n   ```\n\n2. **Template-related approach**: This approach is suitable for libraries that are commonly used across various components, such as jQuery. Instead of including the library in each component's script, you can inject it directly into the editor's canvas configuration.\n   \n   ```js\n   const editor = grapesjs.init({\n     ...\n     canvas: {\n       scripts: ['https://.../somelib.min.js'],\n       styles: ['https://.../ext-style.min.css'],\n     }\n   });\n   ```\n   However, keep in mind that dependencies included in this manner will not be present in the exported HTML, which will require you to handle them manually when rendering the final page.""}]",knowledge/js/grapesjs/modules,1.0,train
"[{""from"": ""human"", ""value"": ""Why is it important to ensure that the scripts loaded are specific to components?""}, {""from"": ""gpt"", ""value"": ""It's essential to ensure that the scripts loaded are specific to components in order to maintain a clean and efficient codebase, avoiding unnecessary loading of scripts that could affect performance. This approach ensures that dependencies are only included when they are needed, minimizing the impact on the overall loading time and resource usage of the application. Additionally, dynamically loading scripts specific to components can help prevent potential conflicts between multiple instances of the same library or different libraries altogether, ensuring that each component operates independently without globally affecting others within the canvas.""}]",knowledge/js/grapesjs/modules,1.0,train
"[{""from"": ""human"", ""value"": ""What is the importance of reading the official GrapesJS documentation alongside guides?""}, {""from"": ""gpt"", ""value"": ""Reading the official GrapesJS documentation alongside guides is important for several reasons:\n1. **Comprehensive Understanding**: The official documentation provides detailed explanations, use cases, and reference material that can deepen one's understanding of the framework's capabilities, beyond what a single guide might offer.\n\n2. **Stay Updated**: As GrapesJS evolves, the documentation is updated to reflect new features and changes. By keeping up with the official resources, developers can leverage the latest functionalities and avoid deprecated practices.\n\n3. **Best Practices**: Official documentation often outlines best practices which help developers write cleaner, more maintainable code. This can save time in the long run and improve the performance and reliability of applications built with GrapesJS.\n\n4. **Troubleshooting**: If discrepancies arise between guide content and actual framework behavior, checking the official documentation can provide clarity and solutions to specific problems, helping maintain effective development workflows.""}]",knowledge/js/grapesjs/modules,1.0,train
"[{""from"": ""human"", ""value"": ""How does GrapesJS ensure that component scripts are executed correctly, even when rendered in the final HTML?""}, {""from"": ""gpt"", ""value"": ""GrapesJS ensures that component scripts are executed correctly even when rendered in the final HTML by assigning unique IDs to each component instance and storing the associated script logic in a way that allows it to be recalled dynamically based on these IDs. When components are dragged into the canvas, the editor creates the appropriate script elements that include the necessary logic to execute the scripts when the actual component is rendered.\n\nFor instance, when you create an instance of a component with a script, it captures the script portion tied to that unique identifier in the generated HTML. This allows the editor to utilize `querySelectorAll` to target those specific IDs, encapsulating the script's functionality within an IIFE (Immediately Invoked Function Expression). This ensures that each component's logic runs in its own safe, isolated execution context, preventing conflicts and ensuring correct operations.""}]",knowledge/js/grapesjs/modules,1.0,train
"[{""from"": ""human"", ""value"": ""What are the roles of `script`, `scripts`, and `script-props` in GrapesJS?""}, {""from"": ""gpt"", ""value"": ""In GrapesJS, the roles of `script`, `scripts`, and `script-props` are as follows:\n\n- **script**: This refers to a JavaScript function that contains the logic that will be executed when the component is rendered. This function can manipulate the component's properties and interact with external libraries, making the component dynamic and functional. \n\n- **scripts**: This property typically refers to an array where you can define external script URLs that the editor should load, especially for libraries that you want available during the initialization of the canvas. It helps in ensuring that the necessary external libraries are available for your components directly when the canvas initializes.\n\n- **script-props**: This property is used to specify which custom properties of a component should be passed to the script when it is executed. By doing so, the script receives context about the component's state, allowing it to behave dynamically based on the component\u2019s traits or user modifications. This enables more interactive and adaptable behaviors depending on user input.""}]",knowledge/js/grapesjs/modules,1.0,train
"[{""from"": ""human"", ""value"": ""Can you provide an example of triggering a script based on changing properties in GrapesJS?""}, {""from"": ""gpt"", ""value"": ""Sure! Here\u2019s an example demonstrating how to trigger a script when properties change using `script-props`:\n\n```js\nconst script = function (props) {\n  // This code will run whenever the properties are updated\n  alert('Updated properties: ' + JSON.stringify(props));\n};\n\neditor.Components.addType('dynamic-comp', {\n  model: {\n    defaults: {\n      script,\n      // Custom properties to be passed to the script\n      myprop: 'Initial Value',\n      traits: [\n        {\n          type: 'text',\n          name: 'myprop',\n          changeProp: true,\n        },\n      ],\n      'script-props': ['myprop'],\n    },\n  },\n});\n```\nIn this example, when the `myprop` trait value changes in the component, the `script` function is invoked with the new `myprop` value. This allows the component to react immediately to user changes and dynamically update its behavior based on new prop values.""}]",knowledge/js/grapesjs/modules,1.0,train
"[{""from"": ""human"", ""value"": ""How can you ensure that scripts loaded with components do not conflict with other libraries?""}, {""from"": ""gpt"", ""value"": ""To ensure that scripts loaded with components do not conflict with other libraries in GrapesJS, developers can take the following steps:\n\n1. **use Namespaces**: When creating functions or variables in your scripts, encapsulate them in objects or use unique prefixes. This minimizes the chance of colliding with other global variables or functions from different libraries.\n\n   ```js\n   const MyLibrary = {\n     init: function() {\n       // initialization code\n     }\n   };\n   ```\n\n2. **Load Libraries Conditionally**: Check if libraries are already loaded before adding them to the page. This ensures that scripts are loaded only once eliminating duplicates.\n   \n   ```js\n   if (typeof myLibrary == 'undefined') {\n     // Load the library\n   }\n   ```\n\n3. **Avoid Global Pollution**: Utilize IIFEs (Immediately Invoked Function Expressions) within your scripts to limit the scope of variables and functions, thereby preventing them from leaking into the global scope.\n   \n   ```js\n   (function() {\n     // Your library code here\n   })();\n   ```\n\n4. **Utilize Module Systems**: If supported, use JavaScript module systems (like ES modules or CommonJS) which naturally scope variables to their modules, dramatically reducing the chances of conflicts.\n\nBy following these practices, developers can create a more robust and error-free integration of various scripts within GrapesJS.""}]",knowledge/js/grapesjs/modules,1.0,train
"[{""from"": ""human"", ""value"": ""In what scenarios would the template-related approach for dependencies be favored?""}, {""from"": ""gpt"", ""value"": ""The template-related approach for managing dependencies is favored in several scenarios:\n\n1. **Common Libraries Across Components**: When a library like jQuery or Bootstrap is widely used across multiple components and is not specific to any one component, it makes sense to include it once in the template rather than loading it individually for each component.\n\n2. **Global Functionality Needed**: If the functionality provided by a library is needed globally throughout the application (for example, for handling Ajax calls or common UI elements), integrating it at the template level can reduce redundancy and improve loading times.\n\n3. **Performance Optimization**: By including common dependencies once at the template level, it reduces the cumulative loading time that would occur if each component were to load its own instance of the same library, enhancing performance and user experience.\n\n4. **Consistency**: When all components share the same version of a library, it can prevent potential conflicts arising from mismatched versions being loaded by different components, ensuring consistent behavior of common functionalities.\n\n5. **Export Considerations**: If you have templates being exported that should maintain references to certain libraries in the final rendered environment, including them directly in the template configuration makes it easier to manage these external resources.""}]",knowledge/js/grapesjs/modules,1.0,train
"[{""from"": ""human"", ""value"": ""What best practices should be followed when defining scripts for components in GrapesJS?""}, {""from"": ""gpt"", ""value"": ""When defining scripts for components in GrapesJS, developers should follow these best practices:\n\n1. **Avoid Global Scope Pollution**: Define your scripts using closures or IIFEs to ensure your code does not pollute the global namespace. This helps prevent conflicts with other scripts.\n   ```js\n   (function() {\n     // Component script\n   })();\n   ```\n\n2. **Use Unique Naming Conventions**: Use unique naming conventions for variables and functions to minimize clashes with other libraries or components. For example, prefix function names with the component name. \n   ```js\n   const MyComponentScript = () => { ... }\n   ```\n\n3. **Leverage Component Properties**: Always use the properties defined in the component\u2019s model to customize behavior dynamically. Utilize props through `script-props` as needed while designing your components.\n   ```js\n   const script = function (props) {\n     console.log('Property:', props.myprop);\n   };\n   ```\n\n4. **Keep Scripts Small and Focused**: Make sure each script serves a single purpose or functionality related to the component. This aids in easier debugging, maintenance, and reusability.\n\n5. **Test Across Scenarios**: Always test your scripts in multiple scenarios to ensure they perform correctly across different instances of the component and under various input conditions, preventing unexpected behavior.\n\n6. **Properly Handle Asynchronous Loads**: If your scripts depend on external libraries, always check if they are loaded before executing any dependent code. This can be done through callback functions or by checking library availability.\n   ```js\n   if (typeof libraryName == 'undefined') {\n       // Load library\n   } else {\n       // Execute dependent code\n   }\n   ```\n\nBy following these best practices, developers can enhance the reliability and maintainability of scripts in GrapesJS components.""}]",knowledge/js/grapesjs/modules,1.0,train
"[{""from"": ""human"", ""value"": ""Can you demonstrate how to create a simple interactive component using GrapesJS?""}, {""from"": ""gpt"", ""value"": ""Certainly! Here's a simple example of creating a custom interactive component in GrapesJS that changes its background color when clicked:\n\n```js\n// Define a script to change the color\nconst script = function () {\n  this.style.backgroundColor = this.style.backgroundColor === 'blue' ? 'red' : 'blue'; // Toggle color\n};\n\n// Define the custom component\neditor.Components.addType('color-toggle', {\n  model: {\n    defaults: {\n      script, // Attach our color toggle function as the script\n      style: {\n        width: '100px',\n        height: '100px',\n        background: 'blue', // Initial background color\n      },\n      // Add an event listener to the element to handle clicks\n      events: {\n        click: script\n      }\n    },\n  },\n});\n\n// Create a block for the new component\neditor.Blocks.add('color-toggle-block', {\n  label: 'Color Toggle',\n  attributes: { class: 'fa fa-paint-brush' },\n  content: { type: 'color-toggle' },\n});\n```\nIn this example, when the `color-toggle` component is clicked, its background color will switch between blue and red due to the `script` function defined. This demonstrates how to integrate interactivity within a custom component efficiently.""}]",knowledge/js/grapesjs/modules,1.0,train
"[{""from"": ""human"", ""value"": ""What role do traits play in enhancing the functionality of components in GrapesJS?""}, {""from"": ""gpt"", ""value"": ""Traits in GrapesJS enhance the functionality of components by providing a way to define customizable properties that users can modify directly in the GrapesJS editor interface. By using traits, developers can allow users to change specific attributes of components without having to delve into the code, promoting ease of use and flexibility.\n\nFor instance:\n- **User Input**: Traits can be configured to accept user input for attributes like color, text, or size, allowing for dynamic changes to the component based on user preferences.\n- **Real-Time Updates**: When traits are linked to scripts using `script-props`, modifications in the trait values immediately trigger the script, resulting in real-time changes in the component\u2019s behavior or display.\n- **Customizability**: Traits can be of various types (text field, number, select dropdown, etc.), making it possible to create highly customizable and interactive components that cater to user needs. \n\nFor example:\n```js\ntraits: [\n  {\n    type: 'select',\n    name: 'color',\n    options: [\n      { value: 'red', name: 'Red' },\n      { value: 'green', name: 'Green' },\n    ],\n  },\n]\n```\nBy incorporating traits effectively, developers create rich, interactive environments where end-users can personalize components to fit their specific needs and create unique web applications.""}]",knowledge/js/grapesjs/modules,1.0,train
"[{""from"": ""human"", ""value"": ""How can you manage global library loading in GrapesJS for enhanced performance?""}, {""from"": ""gpt"", ""value"": ""To manage global library loading in GrapesJS for enhanced performance, consider the following strategies:\n\n1. **Centralized Library Injection**: Instead of including libraries in every component, inject commonly used libraries at the editor initialization level. This way, libraries like jQuery or Bootstrap are available globally without repetitive requests.\n   ```js\n   const editor = grapesjs.init({\n     canvas: {\n       scripts: ['https://code.jquery.com/jquery-3.6.0.min.js'],\n     },\n   });\n   ```\n\n2. **Conditional Loading**: Check for the presence of libraries before loading them, to avoid unnecessary network calls if they have already been added. This can save time and resources during dynamic component creation.\n   ```js\n   if (typeof jQuery == 'undefined') {\n     // Load jQuery\n   }\n   ```\n\n3. **Minimize File Sizes**: Use minified versions of libraries to reduce the size of files being transferred over the network, speeding up loading times.\n   ```html\n   <script src='https://code.jquery.com/jquery-3.6.0.min.js'></script>\n   ```\n\n4. **Asynchronous Loading**: Load libraries asynchronously to improve perceived loading times for the user. Using `async` or `defer` attributes can help with this.\n   ```html\n   <script src='https://code.jquery.com/jquery-3.6.0.min.js' async></script>\n   ```\n\n5. **Bundling Resources**: Use bundlers to combine multiple libraries into a single file to further reduce loading times. Tools like Webpack can help accomplish this.\n\nBy implementing these strategies, you can enhance performance and ensure that your GrapesJS setup runs efficiently by managing global library usage effectively.""}]",knowledge/js/grapesjs/modules,1.0,train
"[{""from"": ""human"", ""value"": ""What are the benefits of making component logic dynamic via script-props?""}, {""from"": ""gpt"", ""value"": ""The benefits of making component logic dynamic via `script-props` in GrapesJS include:\n\n1. **Interactivity**: Scripts can respond to user input or changes to component traits, offering real-time feedback and altering component behavior dynamically based on user actions.\n\n2. **Customization**: By mapping component properties to script actions through `script-props`, developers enable users to customize component behavior based on their specific needs, contributing to a personalized experience.\n   ```js\n   // Example of customization based on props\n   const script = function (props) {\n     console.log('Current prop value:', props.someProp);\n   };\n   ```\n\n3. **Flexibility**: Scripts can adapt based on different values provided in `script-props`, allowing for component versatility and reusability across various contexts.\n\n4. **Reduced Redundancy**: By using a single script with dynamic behavior driven by properties, you avoid duplicating code that would otherwise be needed to handle similar logic for different scenarios or variations of a component.\n\n5. **Easier Maintenance**: Dynamic scripts that leverage `script-props` are generally easier to maintain since you can modify logic in accordance with changing attributes without altering the structure of the component itself.\n\nOverall, utilizing `script-props` can lead to cleaner, more maintainable code and enhances the overall user experience with dynamic, interactive components.""}]",knowledge/js/grapesjs/modules,1.0,train
"[{""from"": ""human"", ""value"": ""Can you provide an example of a component that updates in response to trait changes in GrapesJS?""}, {""from"": ""gpt"", ""value"": ""Certainly! Below is an example of a GrapesJS component that updates its background color based on user-selected traits:\n\n```js\n// Define the script that updates color based on props\nconst script = function (props) {\n  this.style.backgroundColor = props.color; // Update the background based on the selected color\n};\n\n// Add the custom component type\neditor.Components.addType('color-changer', {\n  model: {\n    defaults: {\n      script,\n      style: {\n        width: '100px',\n        height: '100px',\n        background: 'white', // Default color\n      },\n      traits: [\n        {\n          type: 'select',\n          name: 'color',\n          options: [\n            { value: 'red', name: 'Red' },\n            { value: 'green', name: 'Green' },\n            { value: 'blue', name: 'Blue' },\n          ],\n          changeProp: true,\n        },\n      ],\n      'script-props': ['color'], // Pass the color prop to the script\n    },\n  },\n});\n```\nIn this example, whenever a user selects a new color from the dropdown trait, the `script` function gets called, updating the component's background color immediately. This showcases how to create reactive components in GrapesJS that respond to user actions effectively.""}]",knowledge/js/grapesjs/modules,1.0,train
