conversations,source,score,split
"[{""from"": ""human"", ""value"": ""What are the advantages of using toggle or rating scales in surveys?""}, {""from"": ""gpt"", ""value"": ""Toggle or rating scales in surveys have several advantages, including simplicity and ease of use. They allow respondents to express their opinions quickly and consistently on a defined range, helping to quantify subjective data effectively. This uniformity aids in analysis because each response can be treated as a numeric value, making it easy to perform statistical operations. Additionally, using these scales can improve response rates, as they are often less daunting than open-ended questions, encouraging more participants to complete the survey.""}]",knowledge/php/limesurvey,1.0,train
"[{""from"": ""human"", ""value"": ""What considerations should be taken into account when using media elements in survey design?""}, {""from"": ""gpt"", ""value"": ""When using media elements in survey design, considerations should include the clarity and appropriateness of the media used in relation to the questions. It's essential to ensure that the media enhances, rather than detracts from, the respondents' understanding of the questions. Additionally, consider file sizes and loading times, as large files can disrupt the survey experience. Lastly, keep accessibility in mind; ensure that media is usable by all participants, including those with disabilities, by providing alternative text for images and captions for videos.""}]",knowledge/php/limesurvey,1.0,train
"[{""from"": ""human"", ""value"": ""How do relevance equations improve the respondent experience in LimeSurvey?""}, {""from"": ""gpt"", ""value"": ""Relevance equations in LimeSurvey significantly improve the respondent experience by personalizing the survey path based on previous answers. By showing or hiding questions conditionally, respondents are guided through a tailored flow that is more relevant to their experiences and perspectives. This approach helps avoid overwhelming participants with irrelevant questions, maintaining engagement and reducing frustration. Additionally, it enhances data quality by ensuring that only pertinent questions are answered, leading to clearer insights.""}]",knowledge/php/limesurvey,1.0,train
"[{""from"": ""human"", ""value"": ""What features are critical for the effective use of LimeSurvey?""}, {""from"": ""gpt"", ""value"": ""Key features critical for the effective use of LimeSurvey include: \n1. **Variety of Question Types**: Offers different ways to format and collect data suited to the survey's purpose. \n2. **Relevance Equations**: Allows conditional question display based on prior respondent input, making surveys personalized. \n3. **Media Management**: Facilitates the inclusion of images, videos, and interactive elements that enhance engagement. \n4. **HTML Editing Options**: Provides tools for customizing the appearance and structure of questions. \n5. **Import/Export Functionalities**: Simplifies the management of labels and questions across multiple surveys. Having these features ensures flexibility and effectiveness in designing and deploying surveys.""}]",knowledge/php/limesurvey,1.0,train
"[{""from"": ""human"", ""value"": ""What are the steps to edit and manage answers in LimeSurvey?""}, {""from"": ""gpt"", ""value"": ""To edit and manage answers in LimeSurvey, follow these steps: \n1. **Access Survey Editor**: Open your survey and navigate to the question you wish to modify. \n2. **Edit Answer**: Click on the 'edit answer' or 'subquestion' button to access the editing interface. \n3. **Modify Content**: Adjust the answer text using the HTML editor for complex editing tasks such as formatting or adding media. \n4. **Assign Codes**: Ensure that each answer has a unique code, adhering to restrictions on length and character types. \n5. **Reorder Fields**: Drag the 'three-lines' symbol to reorder answers or subquestions as necessary. \n6. **Set Relevance**: If required, set or modify relevance equations for conditional display. \n7. **Add/Delete Fields**: Use '+' to add new fields or 'trash' to delete unnecessary ones. \nBy following these steps, you can effectively manage survey answers.""}]",knowledge/php/limesurvey,1.0,train
"[{""from"": ""human"", ""value"": ""How do you ensure a survey remains engaging and relevant for respondents during its design?""}, {""from"": ""gpt"", ""value"": ""To ensure a survey remains engaging and relevant for respondents during its design, consider the following strategies: \n1. **Utilize Varied Question Types**: Incorporate multiple question formats to maintain respondent interest and cater to different preferences. \n2. **Implement Relevance Logic**: Use relevance equations to control which questions appear based on prior answers, ensuring each respondent only sees questions that are pertinent to them. \n3. **Incorporate Media**: Add images, videos, or other media elements to enhance questions and provide additional context that can make the survey more engaging. \n4. **Limit Survey Length**: Keep surveys concise and to the point, avoiding unnecessary complexity that may lead to participant fatigue. \n5. **Test and Gather Feedback**: Test the survey with a sample audience and collect feedback to identify areas for improvement. Making adjustments based on input can greatly enhance relevance and user experience.""}]",knowledge/php/limesurvey,1.0,train
"[{""from"": ""human"", ""value"": ""What is the importance of designing effective survey questions using LimeSurvey?""}, {""from"": ""gpt"", ""value"": ""Designing effective survey questions using LimeSurvey is crucial because well-constructed questions directly influence the quality and reliability of the data collected. Clear and engaging questions lead to more accurate responses, improving the overall research outcomes. Poorly phrased or confusing questions can result in misleading data, which can have negative implications for decision-making based on survey findings. Furthermore, effective question design enhances the respondent experience, reducing dropout rates and fostering a higher completion rate.""}]",knowledge/php/limesurvey,1.0,train
"[{""from"": ""human"", ""value"": ""How can you leverage LimeSurvey's features to enhance data collection?""}, {""from"": ""gpt"", ""value"": ""To leverage LimeSurvey's features for enhancing data collection, you can: \n1. **Use Diverse Question Types**: Implement various question formats to cater to different respondent preferences and improve engagement. \n2. **Incorporate Media**: Enrich questions with images and videos to provide context and clarity to survey items. \n3. **Apply Relevance Logic**: Use relevance equations to ensure respondents only answer pertinent questions, leading to better data quality and reduced confusion. \n4. **Employ Assessment Values**: Add scoring systems to answers for quantitative analysis, which can complement qualitative insights. \n5. **Test Surveys Thoroughly**: Conduct thorough testing including logic checks to identify potential issues before launching. This careful preparation can ultimately lead to a more successful data collection process.""}]",knowledge/php/limesurvey,1.0,train
"[{""from"": ""human"", ""value"": ""What steps should be taken to prepare a LimeSurvey questionnaire for participants?""}, {""from"": ""gpt"", ""value"": ""To prepare a LimeSurvey questionnaire for participants, follow these steps: \n1. **Define Objectives**: Clearly outline the goals of the survey to guide question design. \n2. **Design Questions Thoughtfully**: Utilize various question types and formats to keep the survey engaging. \n3. **Incorporate Relevance Logic**: Implement relevance equations to tailor the survey experience to individual respondents based on their answers. \n4. **Add Visual and Media Elements**: Use the HTML editor to incorporate images, videos, and other media that may enhance understanding and engagement. \n5. **Conduct Usability Testing**: Gather feedback from a sample audience to identify any issues with clarity or flow, and make necessary adjustments. \n6. **Check for Errors**: Perform logic checks to ensure that all questions display correctly and that no settings are improperly configured. \nBy taking these preparatory steps, you can create a more effective and user-friendly survey.""}]",knowledge/php/limesurvey,1.0,train
"[{""from"": ""human"", ""value"": ""How important is it to gather feedback during the LimeSurvey questionnaire design phase?""}, {""from"": ""gpt"", ""value"": ""Gathering feedback during the LimeSurvey questionnaire design phase is critically important as it enables designers to identify potential shortcomings in the survey content, clarity, and usability before it goes live. Feedback allows for the testing of question effectiveness and the logic behind flow, highlighting areas that may confuse respondents. This process leads to refinements in question phrasing, order, and interactive elements, ultimately enhancing the respondent experience and improving the reliability of the data collected.""}]",knowledge/php/limesurvey,1.0,train
"[{""from"": ""human"", ""value"": ""What are the critical reasons for using an HTML editor in LimeSurvey?""}, {""from"": ""gpt"", ""value"": ""The HTML editor in LimeSurvey is critical for several reasons: \n1. **Enhanced Formatting**: It allows users to format their text, control styling, and integrate various HTML elements for improved visual appeal. \n2. **Incorporation of Media**: Users can add images, videos, and other media directly into the answers or questions, making surveys more engaging and informative. \n3. **User-Friendly Interface**: The WYSIWYG nature of the HTML editor enables even non-technical users to create visually compelling surveys without needing deep HTML knowledge. \n4. **Overall Engagement**: Utilizing an HTML editor generally enhances the overall engagement of respondents by providing a cleaner, more attractive survey experience, thus potentially increasing completion rates.""}]",knowledge/php/limesurvey,1.0,train
