conversations,source,score,split
"[{""from"": ""human"", ""value"": ""What is the purpose of using different question types in LimeSurvey?""}, {""from"": ""gpt"", ""value"": ""Different question types in LimeSurvey allow you to create advanced and personalized survey questions that can cater to various respondent needs. By utilizing various formats (like multiple choice, long free text, or arrays), you can enhance the complexity of the survey and gather more detailed and structured data from respondents. This flexibility helps ensure that the surveys you design are not only engaging but also capable of collecting the right kind of information to meet your objectives.""}]",knowledge/php/limesurvey,1.0,train
"[{""from"": ""human"", ""value"": ""How can answers and subquestions enhance the complexity of a survey?""}, {""from"": ""gpt"", ""value"": ""Adding answers and subquestions enables you to create a hierarchical structure within questions, thereby enhancing the complexity and depth of the survey. Each answer can have multiple subquestions which provide respondents with additional context and options for their responses. For example, a main question might be about customer satisfaction, while subquestions can dive deeper into specific areas like service quality, product range, or pricing. This structure allows researchers to gather nuanced data that can lead to more informed analyses and conclusions.""}]",knowledge/php/limesurvey,1.0,train
"[{""from"": ""human"", ""value"": ""How do you assign codes to answers in LimeSurvey?""}, {""from"": ""gpt"", ""value"": ""When adding answers in LimeSurvey, each answer/subquestion must be assigned a unique code. This code is crucial since it is typically exported to your results spreadsheet, allowing for easier data management and analysis. To assign a code, simply enter a unique alphanumeric string with a maximum length of five characters. It is important to ensure that codes are unique among the answer options for the particular question to prevent any confusion during data analysis.""}]",knowledge/php/limesurvey,1.0,train
"[{""from"": ""human"", ""value"": ""Can you explain how to reorder answers and subquestions in LimeSurvey?""}, {""from"": ""gpt"", ""value"": ""Reordering answers and subquestions in LimeSurvey is straightforward. You just need to click on the 'three-lines' symbol next to the answer or subquestion you wish to move. By clicking and dragging this symbol, you can reposition the fields either up or down to your desired location within the list of answers. This feature allows for easy adjustments to the flow and presentation of survey questions, enhancing user experience.""}]",knowledge/php/limesurvey,1.0,train
"[{""from"": ""human"", ""value"": ""What is the relevance equation in LimeSurvey and how is it applied?""}, {""from"": ""gpt"", ""value"": ""The relevance equation in LimeSurvey is a function that controls the visibility and conditionality of survey items based on certain criteria. It is particularly useful for subquestions in cases where you want to show or hide responses based on previous answers. By using ExpressionScript, you can designate whether certain answers should appear under specific conditions, effectively guiding the respondent through a personalized survey experience. For subquestions, a default relevance value of '1' means the item is always displayed, while values can be set to conditionally show them.""}]",knowledge/php/limesurvey,1.0,train
"[{""from"": ""human"", ""value"": ""What are some specific functionalities available for editing answers in LimeSurvey?""}, {""from"": ""gpt"", ""value"": ""In LimeSurvey, when editing answers, you have several functionalities available: \n1. **HTML Editor**: By clicking the green pencil button, you can switch to a WYSIWYG (What You See Is What You Get) mode to edit your answer's layout, allowing you to add images, videos, and more. \n2. **Assessment Value**: For questions with assessment mode enabled, you can assign a positive or negative integer as an assessment value to each answer. \n3. **Adding/Deleting Fields**: You can add new answers or subquestions using the green 'plus' button or remove them with the red 'trash' button.""}]",knowledge/php/limesurvey,1.0,train
"[{""from"": ""human"", ""value"": ""How do you implement the semantic differential question type in LimeSurvey?""}, {""from"": ""gpt"", ""value"": ""To implement a semantic differential question type in LimeSurvey, you can create an answer that displays options on both sides of an array row by using a pipe character '|' to separate them. For instance, if you want 'Good' to appear on the left and 'Evil' on the right of a row, you would input 'Good|Evil' in the answer text field. This allows respondents to evaluate items along a continuum, offering a rich dataset for analysis of attitudes or perceptions.""}]",knowledge/php/limesurvey,1.0,train
"[{""from"": ""human"", ""value"": ""What features does LimeSurvey provide for managing media in answers?""}, {""from"": ""gpt"", ""value"": ""LimeSurvey provides features that allow the inclusion of various media elements within answer texts. By utilizing the HTML editor (activated with a pencil icon), users can add images, videos, and other media content to enrich the survey experience. This feature allows for a more engaging question format that can enhance response accuracy and participant interest.""}]",knowledge/php/limesurvey,1.0,train
"[{""from"": ""human"", ""value"": ""How can you ensure that your relevance equations have no errors in LimeSurvey?""}, {""from"": ""gpt"", ""value"": ""To ensure that your relevance equations are free from errors in LimeSurvey, it is recommended to perform a logic file check after setting the equations. This check helps identify any issues with the equations that could affect survey functionality. It's important to review the ExpressionScript code for correctness, including proper syntax and appropriate conditions, to guarantee that your survey leads to the desired respondent pathway without unnecessary complications.""}]",knowledge/php/limesurvey,1.0,train
"[{""from"": ""human"", ""value"": ""What customization options are available for answer layouts in LimeSurvey?""}, {""from"": ""gpt"", ""value"": ""LimeSurvey offers several customization options for answer layouts, allowing users to tailor the presentation of survey questions to their needs. Users can adjust layouts via the HTML editor, where they can format text, change fonts, or add multimedia elements. Additionally, users can create complex structures by adding subquestions, changing the order of answers, and incorporating relevance equations, which together help design visually appealing and logically coherent surveys.""}]",knowledge/php/limesurvey,1.0,train
"[{""from"": ""human"", ""value"": ""What is the difference between 'edit answers' and 'edit default answers' in LimeSurvey?""}, {""from"": ""gpt"", ""value"": ""The 'edit answers' feature in LimeSurvey allows users to modify the specific answers associated with a question for a single survey instance. In contrast, the 'edit default answers' option enables users to set or change the default responses that will be available across multiple surveys or templates. Understanding this distinction is critical for effectively managing survey content and ensuring that the intended responses are correctly displayed to participants.""}]",knowledge/php/limesurvey,1.0,train
"[{""from"": ""human"", ""value"": ""Can subquestions utilize relevance equations in LimeSurvey?""}, {""from"": ""gpt"", ""value"": ""Yes, subquestions in LimeSurvey can utilize relevance equations. This feature is specifically applicable to subquestions situated along the X-axis, particularly when a question type allows for multiple subquestions. By applying relevance equations, certain subquestions can be conditionally shown or hidden based on participant responses, enhancing the survey's flexibility and ensuring that respondents only see questions pertinent to their situation.""}]",knowledge/php/limesurvey,1.0,train
"[{""from"": ""human"", ""value"": ""How can label sets be managed in LimeSurvey?""}, {""from"": ""gpt"", ""value"": ""Label sets in LimeSurvey can be managed through the import/export functionalities. Users can create and edit label sets to define options such as country names that can be used across various questions, like dropdown lists. This not only saves time in survey design but also ensures consistency in the terms used throughout different surveys. The ability to import existing label sets helps streamline the setup process when creating new surveys.""}]",knowledge/php/limesurvey,1.0,train
"[{""from"": ""human"", ""value"": ""What restrictions apply to the codes assigned to answers in LimeSurvey?""}, {""from"": ""gpt"", ""value"": ""When assigning codes in LimeSurvey for answers, there are specific restrictions you must adhere to: 1. **Length**: The code can be a maximum of five characters. 2. **Characters**: Only standard alphanumeric characters are permissible in the code. 3. **Uniqueness**: The code assigned to each answer/subquestion must be unique within the context of the question to avoid confusion during data export and analysis. Keeping these restrictions in mind is crucial for effective survey management.""}]",knowledge/php/limesurvey,1.0,train
"[{""from"": ""human"", ""value"": ""What kind of media can be included in answers using the HTML editor in LimeSurvey?""}, {""from"": ""gpt"", ""value"": ""The HTML editor in LimeSurvey allows for the inclusion of various types of media in answers. This can include images, videos, audio clips, and even interactive elements like maps or charts, depending on the survey requirements. By enabling these media elements, surveys can become more engaging and visually informative, leading to a potentially higher response rate and richer data collection.""}]",knowledge/php/limesurvey,1.0,train
"[{""from"": ""human"", ""value"": ""How can the assessment value field be used in LimeSurvey?""}, {""from"": ""gpt"", ""value"": ""In LimeSurvey, the assessment value field is used in scenarios where the assessment mode is enabled, allowing you to assign numeric values to individual answers. These values can represent various metrics, such as ratings for each option. When respondents select an answer, the assessment value is recorded, enabling further quantitative analysis of survey results based on how respondents rated each option. This approach is particularly useful for survey types that require scoring or ranking.""}]",knowledge/php/limesurvey,1.0,train
"[{""from"": ""human"", ""value"": ""What are two available actions when editing answer fields in LimeSurvey?""}, {""from"": ""gpt"", ""value"": ""When editing answer fields in LimeSurvey, two primary actions are available: \n1. **Add New Field**: By clicking the green 'plus' button, you can add a new answer or subquestion to the existing list, allowing for increased input from respondents. \n2. **Delete This Field**: The red 'trash' button allows you to remove a selected answer or subquestion that is no longer needed, helping maintain clarity and conciseness in your survey design.""}]",knowledge/php/limesurvey,1.0,train
"[{""from"": ""human"", ""value"": ""Why is it essential to keep a code unique among answer options in LimeSurvey?""}, {""from"": ""gpt"", ""value"": ""Maintaining a unique code for each answer option in LimeSurvey is essential because it ensures clarity and prevents confusion during data collection and analysis. If two answer options share the same code, it can lead to ambiguity when compiling results and significantly complicate the data export process. Unique codes facilitate accurate data mapping and allow researchers to more easily analyze responses based on specific questions.""}]",knowledge/php/limesurvey,1.0,train
"[{""from"": ""human"", ""value"": ""What guidance is offered for managing the complexity of survey questions in LimeSurvey?""}, {""from"": ""gpt"", ""value"": ""To manage the complexity of survey questions in LimeSurvey, users are encouraged to leverage various question types, subquestions, and answers strategically. Introducing answers and subquestions can deepen the inquiry by enabling branching logic and tailored question paths. Utilize the WYSIWYG editor to design visually appealing answers that can include multimedia content, making questions clearer and more engaging. Additionally, employ relevance equations wisely to ensure respondents only see relevant questions, enhancing the overall survey experience.""}]",knowledge/php/limesurvey,1.0,train
"[{""from"": ""human"", ""value"": ""How can you enhance response accuracy by utilizing media elements in LimeSurvey?""}, {""from"": ""gpt"", ""value"": ""Utilizing media elements in LimeSurvey can significantly enhance response accuracy by providing clearer context for respondents. For example, incorporating images or videos can help clarify a question's intent or present information that requires visual representation. This can reduce misunderstandings and encourage more thoughtful responses, leading to richer, more qualitative data. Utilizing diverse media types allows respondents to interact with questions in different ways, which can also maintain their engagement throughout the survey.""}]",knowledge/php/limesurvey,1.0,train
"[{""from"": ""human"", ""value"": ""What is the significance of the pencil icon in LimeSurvey's answer editing section?""}, {""from"": ""gpt"", ""value"": ""The pencil icon in LimeSurvey's answer editing section signifies the option to access the HTML editor, which enables users to enrich their answer texts with formatting and multimedia elements. By clicking this icon, users can switch from a simple text input to a WYSIWYG interface, allowing for a more interactive and visually appealing answer presentation. This feature is significant because it helps enhance the respondent's experience and ensures that survey questions are clearly articulated.""}]",knowledge/php/limesurvey,1.0,train
"[{""from"": ""human"", ""value"": ""What should be considered when configuring relevance equations for subquestions?""}, {""from"": ""gpt"", ""value"": ""When configuring relevance equations for subquestions in LimeSurvey, you should consider the logical flow of your survey. Ensure that the equations accurately reflect the conditions under which certain subquestions should appear or be hidden based on previous responses. Additionally, be mindful of syntax and proper use of variables to avoid errors. Testing the relevance conditions using the built-in logic file check is vital to identify any possible pitfalls or points of confusion before launching the survey.""}]",knowledge/php/limesurvey,1.0,train
"[{""from"": ""human"", ""value"": ""Can pictures be included in the answers of a LimeSurvey questionnaire?""}, {""from"": ""gpt"", ""value"": ""Yes, pictures can be included in the answers of a LimeSurvey questionnaire. By using the HTML editor, users can easily insert images into their answer text fields. This capability allows surveys to be more visually appealing and can help clarify complex questions by providing illustrative examples, which in turn can lead to higher engagement and better quality responses from participants.""}]",knowledge/php/limesurvey,1.0,train
"[{""from"": ""human"", ""value"": ""What troubleshooting step should be taken after setting relevance equations in LimeSurvey?""}, {""from"": ""gpt"", ""value"": ""After setting relevance equations in LimeSurvey, a recommended troubleshooting step is to perform a logic file check. This action helps identify any syntactical errors or logical inconsistencies within your equations, ensuring that they function correctly when the survey is conducted. Conducting this check before launching the survey can prevent potential issues that could disrupt the respondent's experience.""}]",knowledge/php/limesurvey,1.0,train
"[{""from"": ""human"", ""value"": ""How does creating subquestions impact the data analysis of a survey?""}, {""from"": ""gpt"", ""value"": ""Creating subquestions in a survey allows for more granular data analysis by enabling researchers to dissect responses into more specific categories. Each subquestion can focus on particular aspects of the main question, allowing for more detailed evaluation of how respondents perceive various elements. This specificity in responses provides a richer dataset that can lead to more insightful analysis, ultimately resulting in better-informed decisions based on respondent feedback.""}]",knowledge/php/limesurvey,1.0,train
"[{""from"": ""human"", ""value"": ""What is the role of Expressionscript in controlling navigation in LimeSurvey?""}, {""from"": ""gpt"", ""value"": ""Expressionscript in LimeSurvey plays a critical role in controlling navigation through the survey by allowing creators to implement relevance equations that determine which questions are displayed to respondents based on their prior answers. This logic not only enhances the survey's interactivity but also enables a tailored experience for participants, as they only see questions that are pertinent to their previous responses. This can lead to improved response accuracy and overall engagement throughout the survey.""}]",knowledge/php/limesurvey,1.0,train
"[{""from"": ""human"", ""value"": ""Explain the significance of the 'three-lines' symbol when editing questions in LimeSurvey.""}, {""from"": ""gpt"", ""value"": ""The 'three-lines' symbol, often referred to as a drag handle, is significant in LimeSurvey's editing interface because it allows users to reorder questions, answers, or subquestions effortlessly. By clicking and dragging the three lines, users can reorganize the sequence in which responses are presented, contributing to a logical flow in the survey design. This feature is essential for customizing how questions are presented and ensures that the survey remains coherent and user-friendly.""}]",knowledge/php/limesurvey,1.0,train
"[{""from"": ""human"", ""value"": ""How can import/export functionalities help in managing answer labels in LimeSurvey?""}, {""from"": ""gpt"", ""value"": ""Import/export functionalities in LimeSurvey provide a convenient way to manage answer labels by allowing users to transfer sets of predefined answers between different surveys or instances. For instance, if a user has a standard list of options like countries for dropdowns, they can export this list and import it into a new survey without the need to recreate it from scratch. This not only saves time but also enhances consistency in responses across various surveys.""}]",knowledge/php/limesurvey,1.0,train
"[{""from"": ""human"", ""value"": ""What options are available for customizing the appearance of answers in LimeSurvey?""}, {""from"": ""gpt"", ""value"": ""In LimeSurvey, there are several options available for customizing the appearance of answers. Users can utilize the HTML editor to format the text, change fonts, and incorporate structural elements such as headings or lists to enhance readability. Additionally, users can add images, videos, and other media types directly into their answer fields, creating more engaging and visually appealing survey questions that can help improve response rates and data quality.""}]",knowledge/php/limesurvey,1.0,train
"[{""from"": ""human"", ""value"": ""What is the impact of using assessment values for answers in surveys?""}, {""from"": ""gpt"", ""value"": ""Using assessment values for answers in surveys allows researchers to quantify responses based on predefined criteria. When assessment values are assigned to specific answers, researchers can analyze responses more effectively by turning qualitative feedback into quantitative data. This can lead to a better understanding of trends and preferences among participants. Additionally, assigning positive or negative values can help in scoring and ranking responses, adding an additional layer of analysis to the survey results.""}]",knowledge/php/limesurvey,1.0,train
"[{""from"": ""human"", ""value"": ""How might engaging with pictures within answer fields affect survey responses?""}, {""from"": ""gpt"", ""value"": ""Engaging with pictures within answer fields can positively affect survey responses by providing visual context that aids understanding. When respondents see relevant images associated with questions, it can clarify their intent and elicit more accurate feedback. The presence of engaging visual elements can also enhance the survey experience, making it more enjoyable and leading to higher completion rates as respondents remain interested and engaged.""}]",knowledge/php/limesurvey,1.0,train
"[{""from"": ""human"", ""value"": ""What is the default behavior of subquestions without assigned relevance equations?""}, {""from"": ""gpt"", ""value"": ""By default, subquestions in LimeSurvey will display to respondents if no relevance equations are assigned to them. The relevance setting defaults to a value of '1', which signifies that the item is always shown. This behavior ensures that all subquestions related to a main question are presented to respondents unless explicitly controlled by specific relevance conditions, allowing for a straightforward data collection unless further complexity is introduced.""}]",knowledge/php/limesurvey,1.0,train
"[{""from"": ""human"", ""value"": ""Can you elaborate on the significance of maintaining a logical flow in survey questions?""}, {""from"": ""gpt"", ""value"": ""Maintaining a logical flow in survey questions is essential for ensuring clarity and coherence throughout the survey. A well-structured survey guides respondents intuitively through the questions, minimizing confusion and enhancing their overall experience. Logical flow also aids in maintaining respondent engagement, as participants are less likely to feel overwhelmed or frustrated by disjointed questions. Moreover, a logical sequence can improve data quality, as respondents are more likely to answer accurately when questions follow a clear progression.""}]",knowledge/php/limesurvey,1.0,train
"[{""from"": ""human"", ""value"": ""How does LimeSurvey facilitate the use of surveys in different languages?""}, {""from"": ""gpt"", ""value"": ""LimeSurvey facilitates the use of surveys in different languages through its multi-language support feature. Users can create surveys that switch languages on the fly, allowing respondents to select their preferred language for completion. This ensures inclusivity and accessibility, allowing researchers to reach a wider audience. Additionally, LimeSurvey provides tools for managing translations, enabling consistent phrasing and terminology across language versions.""}]",knowledge/php/limesurvey,1.0,train
"[{""from"": ""human"", ""value"": ""What visualization features does LimeSurvey provide for survey responses?""}, {""from"": ""gpt"", ""value"": ""LimeSurvey provides several visualization features for analyzing survey responses, including graphs and charts that help users interpret data at a glance. Once the data is collected, respondents' answers can be represented visually to reveal patterns, trends, and anomalies in the responses. These visualization tools aid researchers in communicating findings clearly and effectively, allowing stakeholders to grasp the insights derived from the survey quickly.""}]",knowledge/php/limesurvey,1.0,train
"[{""from"": ""human"", ""value"": ""How do you add assessment values to answers in LimeSurvey?""}, {""from"": ""gpt"", ""value"": ""To add assessment values to answers in LimeSurvey, first ensure that the assessment mode is enabled in your survey settings. Once activated, you can enter a positive or negative integer value for each answer option when editing the answer. This value can represent a score or rating corresponding to that option, allowing you to analyze results based on the assigned assessment values during your evaluation of the survey data.""}]",knowledge/php/limesurvey,1.0,train
"[{""from"": ""human"", ""value"": ""Discuss the importance of feedback and testing prior to launching a LimeSurvey questionnaire.""}, {""from"": ""gpt"", ""value"": ""Gathering feedback and conducting thorough testing prior to launching a LimeSurvey questionnaire is crucial for ensuring the survey's effectiveness and usability. Testing the survey helps identify any issues with question clarity, flow, and functionality, ensuring that respondents can navigate it seamlessly. Feedback from pre-tests can provide insights into potential improvements, allowing researchers to make necessary adjustments to enhance clarity and engagement. This iterative process is vital for improving response quality and reducing dropout rates during the actual survey.""}]",knowledge/php/limesurvey,1.0,train
"[{""from"": ""human"", ""value"": ""How can using array question types benefit data collection in LimeSurvey?""}, {""from"": ""gpt"", ""value"": ""Using array question types in LimeSurvey can significantly enhance data collection by allowing respondents to assess multiple items against the same set of criteria in a structured format. This type of question presents items in a grid layout, encouraging respondents to evaluate their opinions on several aspects simultaneously. The structured responses facilitate easier comparison and analysis of the data, leading to insights that might be overlooked when using various question types separately. It promotes structured responses and can improve data quality.""}]",knowledge/php/limesurvey,1.0,train
