conversations,source,score,split
"[{""from"": ""human"", ""value"": ""What is the main purpose of the Survey Structure in LimeSurvey?""}, {""from"": ""gpt"", ""value"": ""The Survey Structure in LimeSurvey serves as a foundational framework for organizing the elements of a survey. It allows users to manage question groups and questions, which are essential components of any survey. The Survey Structure is accessed by clicking on the 'Structure' tab next to the 'Settings' tab, enabling users to view and manipulate how questions and question groups are laid out within the survey. This organized view helps users maintain a clearer workflow when building their surveys and allows for efficient reordering and categorization of questions.""}]",knowledge/php/limesurvey,1.0,train
"[{""from"": ""human"", ""value"": ""How can users add questions to their surveys?""}, {""from"": ""gpt"", ""value"": ""Users can add questions to their surveys through the Survey Structure menu in LimeSurvey. First, they need to create at least one question group, as every question must be associated with a question group. Once a question group is created, users can proceed to add questions to it. For additional details, users can refer to the 'Question groups - introduction' wiki section. This is crucial for ensuring that the survey is well-organized and that questions are categorized effectively.""}]",knowledge/php/limesurvey,1.0,train
"[{""from"": ""human"", ""value"": ""What elements are included in a LimeSurvey survey?""}, {""from"": ""gpt"", ""value"": ""A LimeSurvey survey comprises various elements that form its structure. These elements include:\n- Questions and question groups, which are the core components of the survey.\n- Main and additional survey languages, allowing for multilingual surveys.\n- Question attributes, providing specific features for questions.\n- Answers and subquestions, enabling more complex responses.\n- Default answers, which can streamline the respondent experience.\n- Assessments, for evaluating answers.\n- Quotas and quota members, to control how many responses are collected.\n- Quota language settings, ensuring consistency across languages.\n- Survey users and their permissions, managing who can view or modify the survey.\n- Survey-specific settings, providing customization options for each survey.\nThese components are typically included in .lsa and/or .lss files, which facilitate easy import and export of surveys.""}]",knowledge/php/limesurvey,1.0,train
"[{""from"": ""human"", ""value"": ""What is the purpose of the 'regenerate question codes' function in LimeSurvey?""}, {""from"": ""gpt"", ""value"": ""The 'regenerate question codes' function in LimeSurvey is a tool to automatically renumber questions and question groups within a survey. This feature helps maintain a clear and organized structure, especially after adding or rearranging questions and groups. It ensures that the numbering is sequential and reflects the current order of the questions, making it easier for both the survey creator and the respondents to navigate through the survey. Users can find more detailed information about this function in the related wiki section.""}]",knowledge/php/limesurvey,1.0,train
"[{""from"": ""human"", ""value"": ""Can you describe how to reorder questions and question groups in LimeSurvey?""}, {""from"": ""gpt"", ""value"": ""Reordering questions and question groups in LimeSurvey has evolved between versions. In LimeSurvey 2, users could access the 'Question organizer' option from the home page of the survey after clicking the 'Survey' button. This page allowed them to click and drag questions to reorder them. \n\nIn LimeSurvey 3, reordering is simplified within the 'Survey Structure' menu. Users can find a three-lines symbol next to each question or group name and simply drag it to the desired position to reorder. It's important to note that conditions may prevent some questions from being reordered, in which case users would need to adjust or remove those conditions first.""}]",knowledge/php/limesurvey,1.0,train
"[{""from"": ""human"", ""value"": ""What features were added in the later releases of LimeSurvey regarding the reordering of questions?""}, {""from"": ""gpt"", ""value"": ""In the later releases of LimeSurvey, enhanced options were introduced under the 'Settings tab' to improve the reordering experience of questions and question groups. A new 'Reorder questions and question groups' panel was added, which utilizes a similar drag-and-drop system to reordering described previously. This additional feature provides a more intuitive and visually manageable way for users to rearrange their survey questions and groups, making it easier to get a comprehensive perspective on the overall survey layout.""}]",knowledge/php/limesurvey,1.0,train
"[{""from"": ""human"", ""value"": ""What are some considerations to keep in mind when reordering questions in LimeSurvey?""}, {""from"": ""gpt"", ""value"": ""When reordering questions in LimeSurvey, creators should consider the following:\n1. **Order of Presentation**: The sequence of questions can significantly impact how respondents interpret and answer questions. Logical flow should be maintained.\n2. **Conditions**: If questions are subject to conditions, reordering may be restricted. It's critical to review these conditions to ensure intended questions remain accessible after reordering.\n3. **Grouping**: Questions that are related should ideally be grouped together. This makes it easier for respondents to provide answers and enhances the overall clarity of the survey.\n4. **Preview**: After making changes, it\u2019s advisable to preview the survey to ensure everything appears as expected and functioning properly.\nThese considerations help ensure that the survey efficiently gathers data while maintaining a good user experience.""}]",knowledge/php/limesurvey,1.0,train
"[{""from"": ""human"", ""value"": ""Why is creating a question group necessary before adding questions?""}, {""from"": ""gpt"", ""value"": ""Creating a question group is a prerequisite for adding questions in LimeSurvey because every question must be linked to a specific group. This linkage helps organize the questions in a structured manner, ensuring that related questions are treated collectively. Without a question group, questions would lack proper categorization, which could lead to a disorganized and confusing survey layout. Thus, establishing question groups is fundamental in providing clarity and coherence in survey design.""}]",knowledge/php/limesurvey,1.0,train
"[{""from"": ""human"", ""value"": ""What types of files are useful for importing and exporting surveys in LimeSurvey?""}, {""from"": ""gpt"", ""value"": ""In LimeSurvey, two key file types are utilized for importing and exporting surveys: .lsa (LimeSurvey Archive) and .lss (LimeSurvey Survey Structure). The .lsa file encompasses a full survey package, containing all relevant components\u2014including questions, groups, answers, etc.\u2014while the .lss file specifically focuses on the structural aspects of the survey. Using these file formats allows users to easily back up surveys, transfer them between different LimeSurvey installations, or share them with others, enhancing collaboration and usability.""}]",knowledge/php/limesurvey,1.0,train
"[{""from"": ""human"", ""value"": ""What is the significance of survey language settings in LimeSurvey?""}, {""from"": ""gpt"", ""value"": ""Survey language settings in LimeSurvey are significant for several reasons:\n1. **Multilingual Support**: They allow creators to offer surveys in multiple languages, making them accessible to a broader audience.\n2. **User Experience**: Tailoring the survey in the respondent's preferred language enhances their comfort and increases the likelihood of complete and thoughtful responses.\n3. **Data Accuracy**: Collecting data in the respondent's language helps mitigate misunderstandings or misinterpretations of questions, leading to more reliable and accurate data.\nOverall, language settings are essential for improving the inclusiveness and effectiveness of surveys.""}]",knowledge/php/limesurvey,1.0,train
"[{""from"": ""human"", ""value"": ""What are question attributes in LimeSurvey?""}, {""from"": ""gpt"", ""value"": ""Question attributes in LimeSurvey are additional features or settings that can be applied to a question to enhance its functionality or restrict its behavior. These attributes can control aspects such as:\n- Visibility: Determine whether a question should be visible to respondents based on conditions set.\n- Validation: Enforce rules to ensure that responses meet certain criteria (like numeric input for a number question).\n- Display Order: Influence how questions are presented to respondents.\nThese attributes provide survey creators with powerful tools to tailor the respondent experience and ensure that data collected aligns with the desired research objectives.""}]",knowledge/php/limesurvey,1.0,train
"[{""from"": ""human"", ""value"": ""Why is it important to organize questions and question groups in a survey?""}, {""from"": ""gpt"", ""value"": ""Organizing questions and question groups in a survey is vitally important for several reasons:\n1. **Clarity**: A well-organized survey is easier for respondents to navigate, which helps them provide accurate answers, ultimately leading to better quality data.\n2. **Efficiency**: Organizing questions logically allows respondents to flow through the survey smoothly, reducing fatigue and breaking down complex surveys into manageable sections.\n3. **Analysis**: A clear structure aids in the analysis of the results, as data can be grouped and compared within logical segments rather than being a disorganized collection.\n4. **Implementation of Logic**: Proper organization enables the effective implementation of skip logic or branching questions, tailoring the survey path to respondent answers.\nIn summary, good organization facilitates a better user experience and enhances survey quality.""}]",knowledge/php/limesurvey,1.0,train
"[{""from"": ""human"", ""value"": ""How do default answers work in LimeSurvey?""}, {""from"": ""gpt"", ""value"": ""In LimeSurvey, default answers refer to pre-set responses that are automatically populated in specific questions when a respondent starts taking a survey. This feature is important for a couple of reasons:\n1. **Streamlining**: It can save respondents time, as they may often agree with common responses. For example, in a yes/no question, 'Yes' can be set as the default answer.\n2. **Data Consistency**: Default answers help maintain consistency in responses, particularly for closed questions where options are clearly defined.\n3. **Encouragement of Action**: Pre-filled responses can prompt respondents to consider the question more thoughtfully if the defaults represent usual opinions or typical answers.\nOverall, default answers can improve the survey's efficiency and responsiveness.""}]",knowledge/php/limesurvey,1.0,train
"[{""from"": ""human"", ""value"": ""Describe some possible question types available in LimeSurvey?""}, {""from"": ""gpt"", ""value"": ""LimeSurvey offers a variety of question types to cater to different data collection needs. Some common question types include:\n- **Multiple Choice**: Allows respondents to select one or more options from a list.\n- **Drop-down**: Respondents can choose one option from a drop-down menu.\n- **Long Free Text**: Provides space for respondents to input lengthy text responses.\n- **Array**: A grid-style question allowing evaluation across multiple items on the same filters.\n- **Rating Scale**: Enables respondents to rank items based on predefined scales (e.g., from 1 to 5).\nThese diverse question types allow for flexible survey design, addressing both qualitative and quantitative data needs.""}]",knowledge/php/limesurvey,1.0,train
"[{""from"": ""human"", ""value"": ""What measures should users take when exporting themes or resources in LimeSurvey?""}, {""from"": ""gpt"", ""value"": ""When exporting themes or resources in LimeSurvey, users should take specific measures to ensure the process is smooth and effective:\n1. **Separate Exports**: Be aware that themes, survey participants tables, and resources must be exported separately from the main survey structure (like questions and question groups). This requires attention to detail to prevent missing assets.\n2. **Verification**: After exporting, users should verify that all required resources are included and functioning correctly in the new installation, especially if they involve custom themes.\n3. **Documentation**: Keeping clear documentation of what has been exported and how it should be integrated can simplify the re-import process.\n4. **Testing**: Testing the imported survey structure alongside themes and resources can help identify any discrepancies or issues post-export.\nBy adhering to these measures, users can alleviate potential issues during the survey migration process.""}]",knowledge/php/limesurvey,1.0,train
"[{""from"": ""human"", ""value"": ""How does LimeSurvey help manage user permissions for surveys?""}, {""from"": ""gpt"", ""value"": ""LimeSurvey provides features for managing user permissions which are essential for controlling access to surveys and data. User permissions can be structured as follows:\n1. **Role-Based Access**: Different roles can be assigned to users (such as administrator, editor, or respondent), each with specific rights and capabilities regarding survey creation, editing, and viewing results.\n2. **Group Permissions**: Users can be organized into groups, and permissions can be set at the group level, allowing for bulk management of access rights.\n3. **Customization**: Administrators can customize permissions based on the specific requirements of the survey or the organization, ensuring security and confidentiality of data.\nBy thoughtfully managing user permissions, LimeSurvey enhances the governance of data and protects sensitive respondent information.""}]",knowledge/php/limesurvey,1.0,train
"[{""from"": ""human"", ""value"": ""What should be considered when adding subquestions to a survey question?""}, {""from"": ""gpt"", ""value"": ""When adding subquestions to a survey question in LimeSurvey, creators should consider the following factors:\n1. **Clarity**: Ensure that subquestions are clearly related to the main question and are understandable in context, which helps prevent respondent confusion.\n2. **Logical Grouping**: Group subquestions under a common topic to create a cohesive response section, facilitating analysis and improving respondent navigation.\n3. **Response Formats**: Consider what types of responses are needed for subquestions (e.g., multiple choice, text input) and ensure that they are suitable for the data collection goals.\n4. **Conditions**: If subquestions depend on previous answers, set appropriate conditions to show or hide them based on the respondent's input.\nBy keeping these considerations in mind, the survey will be better structured, and data quality will improve.""}]",knowledge/php/limesurvey,1.0,train
"[{""from"": ""human"", ""value"": ""Can you explain what quotas are in the context of LimeSurvey?""}, {""from"": ""gpt"", ""value"": ""In the context of LimeSurvey, quotas are limits set by survey creators to control the number of responses collected according to specific criteria. Quotas can be used for:\n1. **Response Management**: They help in ensuring that a survey does not exceed a maximum number of responses, maintaining data integrity.\n2. **Demographic Segmentation**: Quotas can be set for different demographic groups (for example, age or gender), ensuring that the survey sample reflects the target population accurately.\n3. **Resource Allocation**: By limiting responses, quotas prevent the overextension of resources, particularly in time-limited or resource-sensitive studies. \nOverall, quotas ensure balanced and valid sample collection for data analysis.""}]",knowledge/php/limesurvey,1.0,train
"[{""from"": ""human"", ""value"": ""What are the benefits of using assessments in a survey?""}, {""from"": ""gpt"", ""value"": ""Using assessments in a survey provides several key benefits:\n1. **Objective Measurements**: Assessments can help quantify responses, allowing researchers to analyze data objectively rather than relying solely on subjective interpretations.\n2. **Standardized Evaluation**: They create a standardized method for evaluating respondents' answers, which is particularly useful for comparative analysis.\n3. **Enhanced Insights**: Implementing assessments adds depth to the analysis, enabling researchers to assess attitudes, opinions, or knowledge on a systematic basis.\n4. **Clear Feedback for Respondents**: When assessments are incorporated, the process can offer immediate feedback to respondents, helping them understand their own standings in relation to the assessed items.\nOverall, assessments enrich the data-gathering process and lead to more meaningful insights.""}]",knowledge/php/limesurvey,1.0,train
"[{""from"": ""human"", ""value"": ""What is required to successfully import a survey into LimeSurvey?""}, {""from"": ""gpt"", ""value"": ""To successfully import a survey into LimeSurvey, several requirements must be met:\n1. **Correct File Format**: The survey should be in the appropriate file format (either .lsa or .lss) to ensure compatibility with LimeSurvey's import capabilities.\n2. **Data Validation**: Before importing, it's important to validate the data in the file to prevent any errors during the import process. This could involve checking for missing fields or incorrect data types.\n3. **Permissions**: The user performing the import must have the necessary permissions to add or modify surveys within LimeSurvey.\n4. **Backup Existing Data**: It's a best practice to back up any existing surveys or data prior to the import, in case the process needs to be reverted. \nBy ensuring these requirements are satisfied, users can mitigate issues and ensure a smoother import process.""}]",knowledge/php/limesurvey,1.0,train
"[{""from"": ""human"", ""value"": ""How can survey users manage their permissions effectively in LimeSurvey?""}, {""from"": ""gpt"", ""value"": ""Survey users can manage their permissions effectively in LimeSurvey by:\n1. **Defining User Roles**: Clearly define user roles and their respective permissions based on organizational needs, ensuring that sensitive data is protected and only accessible to authorized personnel.\n2. **Regular Audits**: Conduct periodic reviews of user permissions to identify and remove access that is no longer necessary, which helps maintain security over time.\n3. **User Education**: Provide training or resources to users about the permission settings to empower them in using the permissions effectively and responsibly.\n4. **Utilizing Groups**: Leverage user groups to manage permissions in bulk, which simplifies governance and oversight, particularly in larger teams.\nThese strategies enable better control over data access, thus enhancing security and compliance.""}]",knowledge/php/limesurvey,1.0,train
"[{""from"": ""human"", ""value"": ""What is the importance of the user interface when building surveys in LimeSurvey?""}, {""from"": ""gpt"", ""value"": ""The user interface (UI) is crucial when building surveys in LimeSurvey for several reasons:\n1. **Usability**: A clean and intuitive UI improves user experience, making it easier for creators to design, organize, and manage their surveys effectively.\n2. **Efficiency**: An effective UI allows for quicker navigation through options, reducing the time spent on survey creation and adjustments.\n3. **Reduced Errors**: A well-structured UI can minimize the risk of errors during the survey creation process by clearly guiding users through necessary steps and available features.\n4. **Feedback Mechanisms**: A good UI will also typically include helpful feedback mechanisms that assist creators in understanding how changes impact the survey, guiding them in making informed adjustments.\nOverall, a user-friendly interface significantly enhances the overall workflow and efficiency of survey development.""}]",knowledge/php/limesurvey,1.0,train
"[{""from"": ""human"", ""value"": ""How can survey languages be changed in LimeSurvey?""}, {""from"": ""gpt"", ""value"": ""In LimeSurvey, survey languages can be changed by:\n1. **Accessing Language Settings**: Navigate to the survey settings and locate the languages tab. Here you can see which languages are currently enabled.\n2. **Adding Languages**: To include additional languages, users can select from available language packs that LimeSurvey offers, enabling broader accessibility for respondents.\n3. **Setting Default Language**: Change the default survey language, which determines the language in which the survey will first appear to respondents.\n4. **Editing Language Translations**: If needed, users can edit language translations to ensure they are accurate and suitable for the target audience. \nBy implementing these steps, LimeSurvey facilitates surveys that can cater to various respondent demographics effectively.""}]",knowledge/php/limesurvey,1.0,train
"[{""from"": ""human"", ""value"": ""What precautions should be taken regarding conditional logic in LimeSurvey?""}, {""from"": ""gpt"", ""value"": ""When utilizing conditional logic in LimeSurvey, it's essential to take several precautions:\n1. **Clear Scenario Definition**: Clearly define the conditions and scenarios under which certain questions will be shown or hidden to avoid confusing respondents.\n2. **Testing Conditions**: Thoroughly test all conditions to ensure they function as intended across different response paths and scenarios before launching the survey.\n3. **Monitor Conditional Complexity**: Avoid excessive complexity in condition setting, which can lead to unintended behaviors and a confusing user experience.\n4. **Documentation**: Keep detailed documentation of condition settings for future reference, troubleshooting, and adjustments.\nBy being mindful of these precautions, creators can maintain a smooth user experience and gather more accurate data.""}]",knowledge/php/limesurvey,1.0,train
"[{""from"": ""human"", ""value"": ""How can you effectively utilize the quota system in LimeSurvey?""}, {""from"": ""gpt"", ""value"": ""To effectively utilize the quota system in LimeSurvey, consider the following strategies:\n1. **Define Clear Goals**: Clearly articulate the purposes of setting quotas and what demographic or response characteristics you aim to balance.\n2. **Segmentation**: Set quotas for various segments (e.g., age groups, regions) to ensure that the survey reaches its intended audience and achieves the desired diversity.\n3. **Monitoring Responses**: Regularly monitor responses as they come in to ensure that quotas are being met accurately, and adjust strategies as necessary.\n4. **Flexibility**: Be prepared to adapt quotas if responses aren\u2019t aligning with expectations, using real-time data to make informed adjustments. \n5. **Documentation**: Maintain comprehensive documentation regarding quota settings to facilitate future surveys and to track historical data patterns. \nUtilizing these strategies can help leverage the quota system effectively for better data management.""}]",knowledge/php/limesurvey,1.0,train
"[{""from"": ""human"", ""value"": ""What is the role of the user management feature in LimeSurvey?""}, {""from"": ""gpt"", ""value"": ""The user management feature in LimeSurvey plays a crucial role in maintaining the integrity and security of survey data. Its key functions include:\n1. **Access Control**: It allows administrators to manage who has access to surveys, data collection, reporting, and survey editing functionalities, ensuring only authorized personnel can access sensitive data.\n2. **Role Assignments**: Users can be granted specific roles with distinct permissions (e.g., administrator, user, or viewer), providing tailored access based on individual responsibilities.\n3. **Audit Trails**: Keeping track of user activities can help identify who made changes to survey setups or data, essential for accountability and ensuring compliance with data governance policies.\nBy implementing robust user management practices, LimeSurvey enhances the privacy and security of survey data and fosters a trustworthy survey environment.""}]",knowledge/php/limesurvey,1.0,train
"[{""from"": ""human"", ""value"": ""How does LimeSurvey facilitate collaboration on survey projects?""}, {""from"": ""gpt"", ""value"": ""LimeSurvey facilitates collaboration on survey projects through several features:\n1. **User Management**: It enables multiple users to collaborate on surveys with distinct roles, ensuring that team members can work simultaneously while managing data and changes securely.\n2. **Version Tracking**: By tracking changes made to surveys, users can see the evolution of a project and revert to previous versions if necessary.\n3. **Shared Resources**: Users can share themes, templates, and previously developed surveys, streamlining the project workflow by reusing existing components.\n4. **Feedback Mechanism**: LimeSurvey allows for feedback on survey questions and setups, enabling collaborative discussions and improvements. \nThese collaborative features enhance efficiency in survey development and promote team synergy in research efforts.""}]",knowledge/php/limesurvey,1.0,train
