conversations,source,score,split
"[{""from"": ""human"", ""value"": ""What actions should be taken if a response cap is reached in LimeSurvey?""}, {""from"": ""gpt"", ""value"": ""If a response cap is reached in LimeSurvey, users should consider either upgrading their account to access more responses or purchasing additional response options if available. Monitoring the 'Response Balance' regularly allows you to anticipate when you will reach limits, ensuring that surveys remain open for participation without interruption.""}]",knowledge/php/limesurvey,1.0,train
"[{""from"": ""human"", ""value"": ""In what ways does the 'Storage' feature influence user experience in LimeSurvey?""}, {""from"": ""gpt"", ""value"": ""The 'Storage' feature in LimeSurvey influences user experience by determining how much data can be stored, including survey responses and associated media files. On a free account, users are limited to 10 MB. This limitation encourages users to actively manage their data, possibly influencing their decision to upgrade for increased capacity. Adequate storage ensures that surveys function smoothly and that users can maintain necessary records without data loss.""}]",knowledge/php/limesurvey,1.0,train
"[{""from"": ""human"", ""value"": ""What role does the LimeSurvey community play for its users?""}, {""from"": ""gpt"", ""value"": ""The LimeSurvey community plays a vital role for its users by offering support, knowledge sharing, and collaboration opportunities. Through forums and community chats on platforms like Discord, users can ask questions, provide feedback, and participate in discussions about survey best practices, troubleshooting, and new feature requests. This sense of community fosters user engagement and enhances the overall experience when using LimeSurvey.""}]",knowledge/php/limesurvey,1.0,train
"[{""from"": ""human"", ""value"": ""How does the 'Edit answer options' feature assist users in configuring survey questions?""}, {""from"": ""gpt"", ""value"": ""The 'Edit answer options' feature in LimeSurvey assists users in configuring survey questions by enabling them to specify predefined answer choices for certain question types. By allowing customization of answer options, users can tailor responses to match survey goals, ensuring participants can select from clearly defined options which can streamline data analysis and improve response accuracy. The intuitive interface further simplifies the process of editing and adding answers.""}]",knowledge/php/limesurvey,1.0,train
"[{""from"": ""human"", ""value"": ""What are the potential consequences of keeping responses anonymous in surveys on LimeSurvey?""}, {""from"": ""gpt"", ""value"": ""Keeping responses anonymous in surveys on LimeSurvey can have several consequences. It can boost honest participation, as respondents might feel more secure providing candid feedback without fear of judgement. However, this may limit the ability to track or follow up with participants based on their answers, which could affect data quality and the ability to link responses to specific demographics. Understanding these trade-offs is essential for designing effective surveys that meet organizational goals.""}]",knowledge/php/limesurvey,1.0,train
"[{""from"": ""human"", ""value"": ""What should be included when defining the 'Welcome Message' for survey participants in LimeSurvey?""}, {""from"": ""gpt"", ""value"": ""When defining the 'Welcome Message' for survey participants in LimeSurvey, it should include key information such as: the purpose of the survey, an appreciation for participation, estimated time for completion, and any details on how the data will be used. This message sets the tone for the survey and can increase engagement by helping participants feel valued and informed about their role in the research process.""}]",knowledge/php/limesurvey,1.0,train
"[{""from"": ""human"", ""value"": ""In what areas can customization be made within the WordPress integration of LimeSurvey?""}, {""from"": ""gpt"", ""value"": ""Customization within the WordPress integration of LimeSurvey can include theme adjustments, plugin activation for additional functionalities, and using specific LimeSurvey shortcodes to embed surveys directly into posts or pages. This flexibility allows WordPress users to create a seamless visitor experience while integrating survey capabilities directly into their website, enhancing engagement and data collection.""}]",knowledge/php/limesurvey,1.0,train
"[{""from"": ""human"", ""value"": ""How can feedback from the LimeSurvey community influence the development of future features?""}, {""from"": ""gpt"", ""value"": ""Feedback from the LimeSurvey community can significantly influence the development of future features by providing insights into user needs, preferences, and pain points. The community\u2019s direct suggestions, critiques, and experiences can inform developers about which enhancements would improve user satisfaction and broaden LimeSurvey's applicability. Engaging with the community fosters a collaborative environment, propelling innovative solutions and enriching the overall platform.""}]",knowledge/php/limesurvey,1.0,train
"[{""from"": ""human"", ""value"": ""What mechanisms does LimeSurvey provide to ensure user data privacy?""}, {""from"": ""gpt"", ""value"": ""LimeSurvey provides several mechanisms to ensure user data privacy, including features that allow for anonymized responses, options for storing or not storing IP addresses, and settings to limit accessibility of data only to authorized users. Proper configuration of these features is essential for protecting personally identifiable information and ensuring compliance with data protection regulations like GDPR.""}]",knowledge/php/limesurvey,1.0,train
"[{""from"": ""human"", ""value"": ""How can platform reliability affect survey responses in LimeSurvey?""}, {""from"": ""gpt"", ""value"": ""Platform reliability can have a substantial effect on survey responses in LimeSurvey. If users experience downtime, slow loading times, or technical glitches, it may frustrate participants and lead to incomplete responses, high dropout rates, or negative impressions of the survey. Ensuring that LimeSurvey operates effectively is crucial for collecting accurate data and maintaining user trust; therefore, reliable performance fosters higher completion rates and valid feedback.""}]",knowledge/php/limesurvey,1.0,train
"[{""from"": ""human"", ""value"": ""What types of participant settings can be managed using LimeSurvey?""}, {""from"": ""gpt"", ""value"": ""In LimeSurvey, participant settings can include managing user roles, creating tokens to identify respondents, configuring access control (such as anonymous participation or public access), and segmenting respondents into groups for targeted surveys. These settings allow researchers to control survey access, maintain data security, and tailor participant interactions to meet the specific needs of their study.""}]",knowledge/php/limesurvey,1.0,train
"[{""from"": ""human"", ""value"": ""How can enhanced statistics features support data-driven decision-making?""}, {""from"": ""gpt"", ""value"": ""Enhanced statistics features in LimeSurvey can support data-driven decision-making by providing users with detailed analyses of survey responses. Users can view graphs, trends, and summary statistics, which help identify patterns, measure participant satisfaction, and assess overall response quality. With advanced statistical filtering and export options, organizations can gain actionable insights that inform strategic planning and improve future surveys.""}]",knowledge/php/limesurvey,1.0,train
"[{""from"": ""human"", ""value"": ""What is the benefit of having a 'Global Settings' option in LimeSurvey?""}, {""from"": ""gpt"", ""value"": ""The 'Global Settings' option in LimeSurvey benefits users by allowing for overarching configurations that affect the entire application. These settings ensure consistent functionalities and user experiences across all surveys conducted within the platform. By centralizing settings such as security protocols, interface customizations, and overall application behavior, users can efficiently manage their survey environment and maintain organization-wide standards.""}]",knowledge/php/limesurvey,1.0,train
"[{""from"": ""human"", ""value"": ""What best practices should be followed when creating questions in LimeSurvey?""}, {""from"": ""gpt"", ""value"": ""When creating questions in LimeSurvey, best practices include:\n1. Be Clear and Concise: Ensure questions are easy to understand to avoid confusion.\n2. Use Simple Language: Avoid jargon or complex terminology.\n3. Specify Question Type: Choose the most suitable question type based on the data needed.\n4. Provide Examples: For complex questions, add examples or help text to guide respondents.\n5. Pretest Surveys: Conduct a pilot test to identify potential issues or misunderstandings in questions.\nFollowing these best practices enhances the quality of responses and data gathered.""}]",knowledge/php/limesurvey,1.0,train
"[{""from"": ""human"", ""value"": ""What types of analysis can be performed with exported survey results from LimeSurvey?""}, {""from"": ""gpt"", ""value"": ""Exported survey results from LimeSurvey can undergo various types of analysis, including descriptive analysis (summary statistics, mean scores, and frequency distributions), inferential analysis (testing hypotheses about the population), and advanced statistical techniques (such as regression analysis or factor analysis). The format of the exported data, such as HTML, Excel, or SPSS, allows for flexible analysis depending on the chosen software tool.""}]",knowledge/php/limesurvey,1.0,train
"[{""from"": ""human"", ""value"": ""In what ways can LimeSurvey assist with branding surveys?""}, {""from"": ""gpt"", ""value"": ""LimeSurvey assists with branding surveys through its customizable themes, enabling users to create surveys that align with organizational branding standards. Users can adjust colors, logos, and layout to ensure surveys reflect their brand identity. This level of customization enhances participant engagement and trust, as respondents recognize the familiar branding elements within the surveys administered.""}]",knowledge/php/limesurvey,1.0,train
"[{""from"": ""human"", ""value"": ""What should one consider regarding participant engagement strategies while using LimeSurvey?""}, {""from"": ""gpt"", ""value"": ""When implementing participant engagement strategies using LimeSurvey, consider:\n1. Clear Communication: Inform participants about survey purposes and benefits.\n2. Incentives: Offer rewards or incentives for completing the survey to improve participation rates.\n3. User-Friendly Design: Ensure that surveys are visually appealing and easy to navigate.\n4. Mobile Compatibility: Optimize surveys for mobile users to increase accessibility.\n5. Follow-Up: Send reminders to participants, thanking them for their input or sharing results (if possible). \nBy enhancing user experience and communication, participant engagement can substantially increase.""}]",knowledge/php/limesurvey,1.0,train
"[{""from"": ""human"", ""value"": ""What insights can be gained from analyzing response patterns in LimeSurvey?""}, {""from"": ""gpt"", ""value"": ""Analyzing response patterns in LimeSurvey can provide insights into participant behaviors, preferences, and trends over time. By identifying common response patterns, surveyors can gain a better understanding of customer satisfaction, product feedback, market research, or other areas of interest. These insights enable organizations to make informed decisions, adjust strategies based on feedback, and tailor services to meet participant needs more effectively.""}]",knowledge/php/limesurvey,1.0,train
"[{""from"": ""human"", ""value"": ""What considerations should be taken when exporting survey data for sensitive information?""}, {""from"": ""gpt"", ""value"": ""When exporting survey data that may contain sensitive information, it is critical to consider data privacy laws and regulations such as GDPR. Ensure that personal identifiers are anonymized or removed to protect respondent\u2019s confidentiality. Use secure methods for transferring data and limit access to sensitive information to authorized personnel only. This approach minimizes risks related to data breaches and assures compliance with data protection standards.""}]",knowledge/php/limesurvey,1.0,train
"[{""from"": ""human"", ""value"": ""What features does LimeSurvey provide for enhancing survey visibility?""}, {""from"": ""gpt"", ""value"": ""LimeSurvey provides several features for enhancing survey visibility, such as the ability to customize survey URLs for better memorability, sharing options through social media, embedding surveys on websites, and utilizing distribution features to send surveys directly to targeted email lists. Additionally, the option to set surveys to public or require tokens also aids in increasing or limiting access based on desired visibility.""}]",knowledge/php/limesurvey,1.0,train
"[{""from"": ""human"", ""value"": ""How can user feedback collected through LimeSurvey enhance future surveys?""}, {""from"": ""gpt"", ""value"": ""User feedback collected through LimeSurvey can enhance future surveys by identifying areas that require improvement, understanding which questions are unclear or problematic, and gathering suggestions for new topics or themes. By systematically analyzing participant feedback, organizations can refine survey design, improve question phrasing, and increase overall engagement, leading to higher-quality data collection.""}]",knowledge/php/limesurvey,1.0,train
"[{""from"": ""human"", ""value"": ""What role do tutorials play for new LimeSurvey users?""}, {""from"": ""gpt"", ""value"": ""Tutorials play a crucial role for new LimeSurvey users by providing structured guidance on how to navigate the platform, utilize features, and implement best practices for survey creation. They serve as a valuable resource to familiarize newcomers with the interface and help them achieve a successful experience while leveraging LimeSurvey's capabilities effectively. Tutorials often include step-by-step instructions, tips, and examples, making them an essential tool for learning.""}]",knowledge/php/limesurvey,1.0,train
"[{""from"": ""human"", ""value"": ""In which ways can survey questions be customized in LimeSurvey?""}, {""from"": ""gpt"", ""value"": ""Survey questions in LimeSurvey can be customized in various ways, including:\n1. Question Type Selection: Choose from multiple formats (multiple choice, rating, open-ended, etc.) based on expected responses.\n2. Theming: Apply custom themes to align with branding and aesthetics.\n3. Logic and Validation: Implement relevance equations for question visibility and validation rules to enforce answer correctness.\n4. Help Text: Add explanatory notes to clarify questions for respondents.\n5. Randomization: Randomly display certain questions to reduce bias.\nThese customization options enhance the quality of responses and overall survey effectiveness.""}]",knowledge/php/limesurvey,1.0,train
"[{""from"": ""human"", ""value"": ""How does LimeSurvey facilitate the creation of efficient surveys?""}, {""from"": ""gpt"", ""value"": ""LimeSurvey facilitates the creation of efficient surveys through its user-friendly interface, vast array of question types, and customizable settings designed for a diverse audience. The platform enables users to structure surveys logically, include instructions for respondents, and implement advanced features like branching logic and question randomization. With built-in analytics and exporting options, users can quickly gather and analyze data, streamlining the entire surveying process.""}]",knowledge/php/limesurvey,1.0,train
"[{""from"": ""human"", ""value"": ""What features exist in LimeSurvey for managing survey access and participant engagement?""}, {""from"": ""gpt"", ""value"": ""In LimeSurvey, features for managing survey access and participant engagement include:\n1. Token Management: Create unique tokens for invited participants to control access to the survey.\n2. Public Surveys: Option to allow anonymous access to anyone who has the survey link.\n3. Reminder Emails: Send automated reminders to participants regarding project deadlines to foster engagement.\n4. Survey Completion Tracking: Allow administrators to monitor progress and participation rates, enabling timely follow-ups.\nThese functionalities help enhance participant interaction and maintain survey integrity.""}]",knowledge/php/limesurvey,1.0,train
"[{""from"": ""human"", ""value"": ""How can you personalize the participant experience in LimeSurvey?""}, {""from"": ""gpt"", ""value"": ""You can personalize the participant experience in LimeSurvey by customizing the survey's welcome message, creating tailored questions based on previous responses, and designing surveys that reflect the branding of your organization. Additionally, offering surveys in multiple languages and adjusting question phrasing to suit the target audience\u2019s demographic can further enhance the personalization and engagement of participants.""}]",knowledge/php/limesurvey,1.0,train
"[{""from"": ""human"", ""value"": ""What benefits does backup functionality provide for LimeSurvey users?""}, {""from"": ""gpt"", ""value"": ""The backup functionality in LimeSurvey provides several benefits for users, including:\n1. Data Security: Ensures that both survey results and structural data can be restored in case of data loss due to accidental deletion or corruption.\n2. Stability in Upgrades: Facilitates smoother transitions during software updates or migrations to avoid losing essential configurations.\n3. Historical Data: Allows users to maintain historical records of survey data over time for comparative analyses or reporting.\nBy regularly backing up, users can mitigate risks associated with data management.""}]",knowledge/php/limesurvey,1.0,train
"[{""from"": ""human"", ""value"": ""What aspects of survey results can be analyzed using LimeSurvey's statistics feature?""}, {""from"": ""gpt"", ""value"": ""LimeSurvey's statistics feature allows users to analyze various aspects of survey results, including:\n1. Response Rates: Quick insights into how many participants completed the survey compared to how many started.\n2. Demographic Analysis: Breakdown of responses according to demographic variables to understand trends and preferences.\n3. Question-specific Insights: View mean, median, and distribution of responses for individual questions for deeper analysis.\n4. Cross-tabulation: Compare multiple variables to see how they interact with one another, providing comprehensive insights into survey data.\nThese analysis aspects help users derive actionable insights from collected survey information.""}]",knowledge/php/limesurvey,1.0,train
"[{""from"": ""human"", ""value"": ""What strategies can improve survey retention rates when using LimeSurvey?""}, {""from"": ""gpt"", ""value"": ""Strategies to improve survey retention rates when using LimeSurvey include:\n1. Clear Instructions: Providing concise guidelines on how to complete the survey.\n2. Incentives: Offering rewards for completion can motivate participants to remain engaged.\n3. Shortened Length: Keeping surveys as concise as possible can reduce survey fatigue and help participants complete them.\n4. Regular Follow-ups: Sending timely reminders to participants who haven\u2019t completed the survey encourages them to return.\n5. Engaging Design: Utilizing an attractive interface keeps participants interested, promoting higher retention throughout the survey.""}]",knowledge/php/limesurvey,1.0,train
"[{""from"": ""human"", ""value"": ""How does LimeSurvey's design accommodate for mobile survey completion?""}, {""from"": ""gpt"", ""value"": ""LimeSurvey's design accommodates mobile survey completion by using a responsive web interface that adjusts to various screen sizes. This adaptability allows participants to complete surveys on their smartphones and tablets comfortably. Additionally, users are encouraged to preview surveys in different formats to ensure functionality across devices, ensuring participants have a seamless experience irrespective of the medium they choose to use.""}]",knowledge/php/limesurvey,1.0,train
"[{""from"": ""human"", ""value"": ""In what cases should 'Anonymized Responses' be enabled?""}, {""from"": ""gpt"", ""value"": ""The 'Anonymized Responses' feature should be enabled in cases where respondent confidentiality is critical, such as in sensitive surveys dealing with personal opinions on controversial topics, health information, or feedback about internal company matters. Enabling this feature encourages respondents to be honest and forthright, knowing that their individual identities will remain hidden, which can enhance the quality of the data collected.""}]",knowledge/php/limesurvey,1.0,train
"[{""from"": ""human"", ""value"": ""What can be done to streamline the survey creation process in LimeSurvey?""}, {""from"": ""gpt"", ""value"": ""To streamline the survey creation process in LimeSurvey, consider the following actions:\n1. Use Templates: Make use of existing templates for consistent formatting across multiple surveys.\n2. Batch Upload Questions: Utilize the import feature to upload multiple questions at once instead of doing them one by one.\n3. Familiarize with Features: Understand the functionalities available, such as question randomization and branching logic, to implement effectively without unnecessary edits later on.\n4. Engage Collaborators: Utilize features allowing team collaboration for building surveys to pool insights and minimize individual workloads.\nOverall efficiency will increase with clear strategies and leveraging LimeSurvey\u2019s built-in tools.""}]",knowledge/php/limesurvey,1.0,train
"[{""from"": ""human"", ""value"": ""What is the importance of participant demographics in survey analysis?""}, {""from"": ""gpt"", ""value"": ""Participant demographics are important in survey analysis because they provide context to the survey results, helping to identify trends and patterns within different segments of the population. Analyzing responses based on demographic factors such as age, gender, location, and socioeconomic status allows organizations to tailor their strategies and offerings to meet the specific needs of different groups, leading to more targeted and effective outcomes.""}]",knowledge/php/limesurvey,1.0,train
"[{""from"": ""human"", ""value"": ""How can different languages in LimeSurvey support survey reach?""}, {""from"": ""gpt"", ""value"": ""Different languages in LimeSurvey support survey reach by allowing a broader audience to participate, catering to individuals who may not be proficient in the primary language of the survey. Multilingual support ensures inclusivity, enhances understanding among participants, and can significantly improve response rates as participants are more likely to engage with content in their preferred language.""}]",knowledge/php/limesurvey,1.0,train
"[{""from"": ""human"", ""value"": ""Why is it beneficial to provide a 'Thank You' message upon survey completion?""}, {""from"": ""gpt"", ""value"": ""Providing a 'Thank You' message upon survey completion is beneficial as it expresses appreciation for the respondent\u2019s time and insights, leaving a positive impression of the survey experience. Acknowledging participants increases their likelihood of participating in future surveys, reinforces a favorable brand image, and gives a sense of closure to the interaction.""}]",knowledge/php/limesurvey,1.0,train
"[{""from"": ""human"", ""value"": ""What features does LimeSurvey offer for ensuring accessibility?""}, {""from"": ""gpt"", ""value"": ""LimeSurvey offers various features for ensuring accessibility, including options for screen reader compatibility, responsive design for mobile devices, and support for multiple languages. By allowing customizable themes and customizable question types, LimeSurvey can cater to the needs of diverse respondents, ensuring that surveys are inclusive and understandable for users with different abilities.""}]",knowledge/php/limesurvey,1.0,train
"[{""from"": ""human"", ""value"": ""How can administering surveys via LimeSurvey benefit organizations?""}, {""from"": ""gpt"", ""value"": ""Administering surveys via LimeSurvey benefits organizations by providing a user-friendly platform for collecting valuable feedback and insights. It enables data-driven decision-making by automating the process of survey creation, distribution, and analysis. Organizations can engage effectively with participants, adapt offerings based on collected data, and enhance their services or products, ultimately leading to improved performance and customer satisfaction.""}]",knowledge/php/limesurvey,1.0,train
"[{""from"": ""human"", ""value"": ""What best practice can be adopted for ensuring question clarity in LimeSurvey?""}, {""from"": ""gpt"", ""value"": ""A best practice for ensuring question clarity in LimeSurvey is to adopt the 'Five-Second Rule'; wherein questions should be understandable to someone unfamiliar with the subject matter within five seconds. This can be achieved by using straightforward language, avoiding jargon, and ensuring direct question phrasing. Additionally, utilizing help text where necessary can provide further clarity and guide respondents through any complex questions.""}]",knowledge/php/limesurvey,1.0,train
