conversations,source,score,split
"[{""from"": ""human"", ""value"": ""What user engagement strategies can be implemented in LimeSurvey?""}, {""from"": ""gpt"", ""value"": ""User engagement strategies in LimeSurvey can include:\n1. Customizable Surveys: Creating visually appealing and brand-consistent surveys to enhance participant interest.\n2. Short Surveys: Keeping surveys concise to prevent fatigue and encourage completion.\n3. Pre-Survey Communication: Informing participants of the survey's purpose and estimated time commitment before engaging them.\n4. Feedback Collection: Allowing respondents to provide feedback about the survey itself can improve future engagement efforts.\n5. Incentives: Offering incentives or rewards can motivate respondents to participate and share their survey with others.""}]",knowledge/php/limesurvey,1.0,train
"[{""from"": ""human"", ""value"": ""How does LimeSurvey's infrastructure support data security?""}, {""from"": ""gpt"", ""value"": ""LimeSurvey's infrastructure supports data security through robust access controls, encrypted data transmission, and secure data storage practices. Regular backups and compliance with data protection regulations are also part of its approach to safeguarding sensitive information. Administrators can control who has access to data, ensuring that only authorized users can manage participant information, thereby reducing the risk of data breaches.""}]",knowledge/php/limesurvey,1.0,train
"[{""from"": ""human"", ""value"": ""What should one keep in mind when designing surveys for international audiences?""}, {""from"": ""gpt"", ""value"": ""When designing surveys for international audiences, one should consider cultural differences, language barriers, and varying norms regarding data privacy. It's essential to use clear, simple language and localized formats for dates and numbers to cater to different regional understandings. Moreover, ensuring accessibility features is crucial, as differing abilities may be present across diverse populations. Additionally, be mindful of potential biases that may appear due to cultural context when formulating questions.""}]",knowledge/php/limesurvey,1.0,train
"[{""from"": ""human"", ""value"": ""What are potential challenges when using LimeSurvey for the first time?""}, {""from"": ""gpt"", ""value"": ""Potential challenges when using LimeSurvey for the first time can include navigating through the extensive features available, understanding how to customize settings for specific needs, and ensuring technical capabilities align with intended survey deployment. New users may struggle with developing structured questions or utilizing data analysis tools effectively. Drafting a clear plan beforehand and utilizing available tutorials can help mitigate these challenges.""}]",knowledge/php/limesurvey,1.0,train
"[{""from"": ""human"", ""value"": ""How can user experience be optimized in mobile surveys through LimeSurvey?""}, {""from"": ""gpt"", ""value"": ""To optimize user experience in mobile surveys through LimeSurvey, ensure that the survey is responsive and easy to navigate on smaller screens. Use clear, large buttons and concise questions to enhance readability. Reduce the number of questions to minimize scrolling and provide a straightforward, linear flow in survey design to avoid user frustration. Testing the survey on various mobile devices can also help refine the user experience before launch.""}]",knowledge/php/limesurvey,1.0,train
"[{""from"": ""human"", ""value"": ""What are effective methods for collecting qualitative feedback through LimeSurvey?""}, {""from"": ""gpt"", ""value"": ""Effective methods for collecting qualitative feedback through LimeSurvey include using open-ended question formats that prompt participants to elaborate on their experiences and opinions. Deploying comment boxes after closed questions allows respondents the space to provide additional context. Also, incorporating focus group style questions that invite rich, descriptive responses can capture in-depth insights, enhancing the quality of feedback received.""}]",knowledge/php/limesurvey,1.0,train
"[{""from"": ""human"", ""value"": ""What insights can be gained from analyzing the demographic data collected via LimeSurvey?""}, {""from"": ""gpt"", ""value"": ""Analyzing demographic data collected via LimeSurvey can reveal trends, preferences, and behaviors specific to different demographic segments. This insight helps in tailoring marketing strategies, refining products or services to meet the needs of specific groups, and making informed decisions based on participant characteristics. Organization decisions can be more impactful when supported by data trends grounded in the demographics of the surveyed population.""}]",knowledge/php/limesurvey,1.0,train
"[{""from"": ""human"", ""value"": ""How can data integrity be maintained in LimeSurvey during the survey process?""}, {""from"": ""gpt"", ""value"": ""Data integrity in LimeSurvey can be maintained during the survey process by implementing validation checks for question responses, utilizing the data integrity check feature to monitor for inconsistencies, and regularly backing up survey data. Moreover, setting clear definitions for response options and ensuring careful question design can help collect reliable data that accurately reflects participant sentiments.""}]",knowledge/php/limesurvey,1.0,train
"[{""from"": ""human"", ""value"": ""How can demographic trends influence survey design in LimeSurvey?""}, {""from"": ""gpt"", ""value"": ""Demographic trends can greatly influence survey design in LimeSurvey by shaping the types of questions asked, the language used, and the overall survey structure. Understanding the demographics of the target audience can guide the customization of questions to ensure relevance and clarity, enable tailored communication strategies, and ultimately affect participant engagement levels, completing a well-rounded response collection.""}]",knowledge/php/limesurvey,1.0,train
"[{""from"": ""human"", ""value"": ""What practices should one adopt for presenting survey results collected through LimeSurvey?""}, {""from"": ""gpt"", ""value"": ""When presenting survey results collected through LimeSurvey, adopt practices that ensure clarity and comprehensibility by:\n1. Utilizing Visual Aids: Include graphs, charts, and infographics to illustrate data trends visually.\n2. Structuring Reports: Organize findings logically, highlighting key insights and supporting data in an easily navigable format.\n3. Contextualizing Findings: Provide background information and interpretations of the data to help audiences understand its significance.\n4. Tailoring Presentations: Customize results to match the interests and knowledge levels of different stakeholder groups.\nThese practices enhance data presentation, ensuring messages are impactful and actionable.""}]",knowledge/php/limesurvey,1.0,train
"[{""from"": ""human"", ""value"": ""How important is user feedback for the improvement of LimeSurvey?""}, {""from"": ""gpt"", ""value"": ""User feedback is incredibly important for the improvement of LimeSurvey as it provides insights into user experiences, identifies areas for enhancement, and guides the development of new features. By actively listening to user feedback, LimeSurvey can better align its functionalities with user needs, resulting in a more robust platform. Continuous improvement based on user input ultimately promotes a more effective, user-centered survey application.""}]",knowledge/php/limesurvey,1.0,train
"[{""from"": ""human"", ""value"": ""What ways can offering multilingual support enhance a survey's reach?""}, {""from"": ""gpt"", ""value"": ""Offering multilingual support enhances a survey's reach by accommodating non-native speakers and ensuring accessibility for a wider audience. This approach increases participant engagement, as respondents can complete the survey in their preferred language, leading to more accurate and honest feedback. Multilingual capabilities reflect inclusivity and respect for cultural diversity, which can improve response rates and data quality significantly.""}]",knowledge/php/limesurvey,1.0,train
"[{""from"": ""human"", ""value"": ""What are some strategies for maintaining participant engagement throughout the survey?""}, {""from"": ""gpt"", ""value"": ""Strategies for maintaining participant engagement throughout the survey include:\n1. Clear Navigation: Provide easy-to-follow instructions to help participants move through the survey without confusion.\n2. Shorter Surveys: Keep surveys concise to minimize fatigue and improve odds of completion.\n3. Interactive Elements: Use engaging question formats to maintain interest, such as sliders or clickable images.\n4. Regular Checkpoints: Remind participants how far along they are to encourage them to complete the survey.\n5. Follow-up Communication: Send thank-you messages and results sharing with participants to foster community and continued interest.""}]",knowledge/php/limesurvey,1.0,train
"[{""from"": ""human"", ""value"": ""Why is it crucial to pretest surveys before launching them on LimeSurvey?""}, {""from"": ""gpt"", ""value"": ""Pretesting surveys before launching them on LimeSurvey is crucial because it helps identify potential issues regarding question clarity, technical functionality, and overall flow. Testing surveys with a small audience allows for adjustments based on feedback before broader distribution, ensuring the survey effectively collects the desired data and operates smoothly for participants. This practice increases the overall quality and reliability of the data collected.""}]",knowledge/php/limesurvey,1.0,train
"[{""from"": ""human"", ""value"": ""How can LimeSurvey's features make it more appealing to organizations compared to other survey tools?""}, {""from"": ""gpt"", ""value"": ""LimeSurvey's appeal to organizations compared to other survey tools can be attributed to its open-source nature, which allows for high customization and flexibility. Its wide array of question types, user-friendly interface, robust statistical analysis capabilities, and extensive support from a dedicated community provide users with powerful tools for data collection. Additionally, LimeSurvey supports multilingual capabilities and offers strong data privacy options, making it an attractive choice for organizations with diverse needs.""}]",knowledge/php/limesurvey,1.0,train
"[{""from"": ""human"", ""value"": ""What are some effective follow-up actions one can take after survey completion on LimeSurvey?""}, {""from"": ""gpt"", ""value"": ""Effective follow-up actions after survey completion on LimeSurvey include:\n1. Analyzing Results: Dive into the collected data to derive actionable insights and findings.\n2. Sending Thank-You Notes: Express appreciation to participants for their time, reinforcing engagement for future surveys.\n3. Sharing Results: Inform participants about the outcomes of the survey and any actions taken as a result of their feedback.\n4. Scheduling Future Surveys: Consider scheduling follow-up surveys based on insights gained to continue gathering feedback.\n5. Updating Stakeholders: Communicate results and insights with relevant stakeholders to aid in informed decision-making within the organization.""}]",knowledge/php/limesurvey,1.0,train
"[{""from"": ""human"", ""value"": ""What should organizations consider regarding data responsiveness in LimeSurvey?""}, {""from"": ""gpt"", ""value"": ""Organizations should consider the implications of data responsiveness in LimeSurvey, such as ensuring that their surveys are optimized for various devices and screen sizes to enhance participant accessibility. They should also evaluate how quickly they can react to the incoming data post-survey, including methods for analyzing and reporting outcomes efficiently. A good strategy involves planning data responsiveness to not only gather but also act upon the survey results promptly.""}]",knowledge/php/limesurvey,1.0,train
"[{""from"": ""human"", ""value"": ""How does LimeSurvey ensure compliance with data protection regulations?""}, {""from"": ""gpt"", ""value"": ""LimeSurvey ensures compliance with data protection regulations by providing features that allow for anonymized responses, access control to sensitive data, and settings for data retention and deletion. Users can configure surveys to adhere to rules set forth by regulations such as GDPR, ensuring that personal data collection and storage at every stage of the survey process is handled responsibly and ethically.""}]",knowledge/php/limesurvey,1.0,train
"[{""from"": ""human"", ""value"": ""What impact does convenient survey design have on participation rates?""}, {""from"": ""gpt"", ""value"": ""Convenient survey design has a significant impact on participation rates, as it directly affects the user experience. A well-structured survey with clear instructions, logical flow, and easy navigation encourages participants to complete the survey without frustration. By minimizing barriers, such as complex questions or too many pages, organizations can enhance the likelihood of full participation, leading to more accurate and comprehensive data collection.""}]",knowledge/php/limesurvey,1.0,train
"[{""from"": ""human"", ""value"": ""What are some advantages of using LimeSurvey for organizations interested in customer feedback?""}, {""from"": ""gpt"", ""value"": ""Using LimeSurvey for gathering customer feedback offers organizations several advantages, including the ability to create customizable surveys tailored to specific goals, access to a variety of question types to explore customer sentiments comprehensively, and a robust analytics framework to track and interpret results. Additionally, organizations enjoy the benefit of a supportive community and extensive resources for troubleshooting and optimization.""}]",knowledge/php/limesurvey,1.0,train
"[{""from"": ""human"", ""value"": ""How can participants' answers be influenced by question phrasing in LimeSurvey?""}, {""from"": ""gpt"", ""value"": ""Participants' answers can be heavily influenced by the phrasing of questions in LimeSurvey. Leading or ambiguous phrasing can result in biased responses or misinterpretation of what the survey intends to measure. To mitigate these effects, questions should be straightforward, neutral, and clearly framed to ensure that participants understand the intent without suggesting a particular answer. Proper design enhances the validity and reliability of the data collected.""}]",knowledge/php/limesurvey,1.0,train
"[{""from"": ""human"", ""value"": ""How can visual themes enhance the response experience in LimeSurvey?""}, {""from"": ""gpt"", ""value"": ""Visual themes can enhance the response experience in LimeSurvey by improving aesthetics and creating an inviting atmosphere for participants. Well-designed themes can create a sense of professionalism and credibility, encouraging respondents to engage more deeply with the survey content. Engaging visuals can also help break monotonicity, drawing participants in and sustaining their interest throughout the survey completion process.""}]",knowledge/php/limesurvey,1.0,train
"[{""from"": ""human"", ""value"": ""What potential pitfalls should be avoided when creating surveys in LimeSurvey?""}, {""from"": ""gpt"", ""value"": ""When creating surveys in LimeSurvey, potential pitfalls to avoid include:\n1. Overly Complex Questions: Avoid using jargon or complex language that could confuse respondents.\n2. Lengthy Surveys: Ensure surveys do not exceed reasonable lengths to prevent fatigue.\n3. Lack of Clear Purpose: Clearly communicate the survey\u2019s objectives to participants.\n4. Ignoring Pretests: Neglecting to pilot surveys may result in undetected flaws.\n5. Unclear Flow: Ensure logical question ordering to guide respondents smoothly through the survey.\nBy steering clear of these pitfalls, survey creators can optimize data quality and participant engagement.""}]",knowledge/php/limesurvey,1.0,train
"[{""from"": ""human"", ""value"": ""How can rewards for participation improve survey responses in LimeSurvey?""}, {""from"": ""gpt"", ""value"": ""Offering rewards for participation can improve survey responses in LimeSurvey by incentivizing potential respondents to take part in the survey process. When individuals feel their time and effort are acknowledged through rewards\u2014be it discounts, entry into a raffle, or even small gifts\u2014they are more likely to prioritize completing the survey. This strategy can significantly boost response rates and help gather sufficient data for meaningful analysis.""}]",knowledge/php/limesurvey,1.0,train
"[{""from"": ""human"", ""value"": ""What considerations should be made regarding survey accessibility features in LimeSurvey?""}, {""from"": ""gpt"", ""value"": ""When considering survey accessibility features in LimeSurvey, it's important to ensure that the survey can be completed by individuals with various disabilities. This includes implementing screen reader compatibility, providing alternative text for images, ensuring adequate contrast in design, and structuring questions in a manner understandable to all participants. Considering these factors ensures inclusivity and can lead to broader and more representative survey responses.""}]",knowledge/php/limesurvey,1.0,train
"[{""from"": ""human"", ""value"": ""What steps should be followed for effective data analysis after conducting a survey with LimeSurvey?""}, {""from"": ""gpt"", ""value"": ""For effective data analysis after conducting a survey with LimeSurvey, follow these steps:\n1. Clean the Data: Ensure all responses are accurate and remove any duplicates or incomplete submissions.\n2. Utilize Built-in Analytics: Take advantage of LimeSurvey's built-in analytics tools to generate preliminary reports and data visualizations.\n3. Export Data for Advanced Analysis: Use export functionalities to send the data to statistical programs (like SPSS or R) for deeper analysis.\n4. Review and Interpolate Insights: Analyze patterns in responses, correlate findings, and derive actionable insights from the data.\n5. Share Findings: Present results to stakeholders and, if appropriate, communicate key results with the participants.\nThese organized steps ensure that the data analysis process is thorough and insightful.""}]",knowledge/php/limesurvey,1.0,train
"[{""from"": ""human"", ""value"": ""How does the survey design impact response accuracy in LimeSurvey?""}, {""from"": ""gpt"", ""value"": ""Survey design significantly impacts response accuracy in LimeSurvey as it influences how respondents interpret and understand questions. Poorly designed surveys with leading questions, unclear wording, or confusing formats can result in inaccurate responses that do not reflect genuine opinions. Conversely, a well-structured survey with clear questions and logical flow supports accurate data collection by guiding respondents toward thoughtful and honest answers.""}]",knowledge/php/limesurvey,1.0,train
"[{""from"": ""human"", ""value"": ""What training resources does LimeSurvey provide to support users?""}, {""from"": ""gpt"", ""value"": ""LimeSurvey provides various training resources to support users, including comprehensive documentation, tutorial videos, community forums, and webinars. These resources cover topics such as survey design best practices, advanced functionalities, statistical analysis tools, and troubleshooting tips. Users can leverage these support materials to develop their skills and enhance their proficiency in utilizing LimeSurvey effectively.""}]",knowledge/php/limesurvey,1.0,train
"[{""from"": ""human"", ""value"": ""What metrics can be monitored to improve survey performance in LimeSurvey?""}, {""from"": ""gpt"", ""value"": ""Metrics that can be monitored to improve survey performance in LimeSurvey include response rates, completion times, dropout rates, and demographic diversity of participants. By analyzing these metrics, organizations can identify areas of improvement, such as modifying question phrasing, adjusting the survey length, or targeting specific demographics to enhance engagement and data richness.""}]",knowledge/php/limesurvey,1.0,train
"[{""from"": ""human"", ""value"": ""What is the significance of placeholder text in survey questions within LimeSurvey?""}, {""from"": ""gpt"", ""value"": ""Placeholder text in survey questions within LimeSurvey serves to guide respondents on what type of information or format is expected in their responses. It can reduce ambiguity, enhance understanding, and direct user input effectively. By offering examples within the fields, placeholder text can lead to more accurate and relevant answers, improving the quality of the survey data collected.""}]",knowledge/php/limesurvey,1.0,train
"[{""from"": ""human"", ""value"": ""How can participants' feedback be structured for analysis using LimeSurvey?""}, {""from"": ""gpt"", ""value"": ""Participants' feedback can be structured for analysis using LimeSurvey by implementing both quantitative and qualitative question types. Using Likert scales and multiple-choice questions can facilitate quantitative analysis, while open-ended questions can gather qualitative insights. It's beneficial to categorize feedback themes and trends to streamline analysis, allowing for comprehensive understanding and actionable insights from the collected data.""}]",knowledge/php/limesurvey,1.0,train
"[{""from"": ""human"", ""value"": ""What value do follow-up surveys hold for organizations using LimeSurvey?""}, {""from"": ""gpt"", ""value"": ""Follow-up surveys hold significant value for organizations using LimeSurvey as they provide insights into changes over time, measure the impact of interventions, and gauge participant satisfaction with implemented initiatives. By regularly soliciting feedback, organizations can adapt strategies, improve services, and foster stronger relationships with participants, ultimately leading to higher satisfaction and loyalty.""}]",knowledge/php/limesurvey,1.0,train
"[{""from"": ""human"", ""value"": ""What is the importance of user-friendly design in LimeSurvey surveys?""}, {""from"": ""gpt"", ""value"": ""User-friendly design in LimeSurvey surveys is crucial as it directly affects respondents' willingness to engage and complete the survey. A clear and intuitive layout minimizes confusion and streamlines the process, reducing dropout rates. By prioritizing accessibility, visual appeal, and logical navigation, user-friendly design enhances the likelihood of accurate, thoughtful responses, ultimately leading to more reliable data collection.""}]",knowledge/php/limesurvey,1.0,train
"[{""from"": ""human"", ""value"": ""How can organizations leverage LimeSurvey to drive customer insights?""}, {""from"": ""gpt"", ""value"": ""Organizations can leverage LimeSurvey to drive customer insights through systematic survey deployment to gather feedback on products, services, and overall customer satisfaction. By analyzing survey results, they can identify pain points, areas for improvement, and emerging trends in customer preferences. This data-driven approach allows for informed decision-making, strategic planning, and enhanced customer engagement, ultimately improving service offerings.""}]",knowledge/php/limesurvey,1.0,train
"[{""from"": ""human"", ""value"": ""How can incorporating multimedia elements enhance the survey experience in LimeSurvey?""}, {""from"": ""gpt"", ""value"": ""Incorporating multimedia elements such as images, videos, and audio clips can enhance the survey experience in LimeSurvey by making the content more engaging and interactive. These elements can provide context or examples that clarify questions, keeping participants interested and facilitating more accurate responses. Appealing visuals can also improve retention by creating a memorable survey experience, which can result in higher completion rates.""}]",knowledge/php/limesurvey,1.0,train
"[{""from"": ""human"", ""value"": ""What strategies can enhance clarity in survey communication within LimeSurvey?""}, {""from"": ""gpt"", ""value"": ""Strategies to enhance clarity in survey communication within LimeSurvey include:\n1. Using Simple Language: Avoid jargon and technical terms that may confuse respondents.\n2. Structuring Questions Logically: Ensure a flow that makes sense, guiding participants through the survey sequentially.\n3. Providing Context: Include brief explanations or examples for complex questions to aid understanding.\n4. Regular Testing: Conduct pretests with varied audiences to identify confusing elements or poor phrasing.\nImplementing these strategies ensures participants fully comprehend survey questions, leading to higher-quality responses.""}]",knowledge/php/limesurvey,1.0,train
"[{""from"": ""human"", ""value"": ""How does LimeSurvey facilitate the collection of longitudinal data?""}, {""from"": ""gpt"", ""value"": ""LimeSurvey facilitates the collection of longitudinal data by allowing organizations to deploy repeated surveys to the same participant base over time. This can track changes, trends, and the impact of interventions across time periods. Users can utilize the token management system for consistent respondent tracking and comparison, ensuring that data collected in phases provides reliable insights into participant behaviors or sentiments over time.""}]",knowledge/php/limesurvey,1.0,train
