conversations,source,score,split
"[{""from"": ""human"", ""value"": ""What is LimeSurvey and what capabilities does it provide?""}, {""from"": ""gpt"", ""value"": ""LimeSurvey is a free open-source online survey application written in PHP and licensed under the GNU General Public License. It enables users to create and publish online surveys, collect responses, generate statistics, and export results to other applications. Users can install LimeSurvey on their own servers through the Community Edition or use the hosted service offered by LimeSurvey Cloud. The application is designed to simplify the survey process, catering to both novice users and advanced users seeking detailed functionalities.""}]",knowledge/php/limesurvey,1.0,train
"[{""from"": ""human"", ""value"": ""How do you create a free LimeSurvey account?""}, {""from"": ""gpt"", ""value"": ""To create a free LimeSurvey account, visit the LimeSurvey website and click on the 'Sign Up For Free' button or select 'Pricing' to find the free option among other plans. After opting for 'Free', complete the registration form requiring a username, email address, and password. An activation link will then be emailed to the provided address. Once you click this link, you'll gain access to your account.""}]",knowledge/php/limesurvey,1.0,train
"[{""from"": ""human"", ""value"": ""What steps are required to set up a survey site using LimeSurvey?""}, {""from"": ""gpt"", ""value"": ""To set up your LimeSurvey site, log in to your LimeSurvey account and click on 'Create survey site'. You will then need to fill in your site name, choose a domain from the dropdown menu, select a server location, and click 'Save & Set Up LimeSurvey Site'. The process might take up to 20 seconds, and once complete, you can access your survey site through the 'View Survey Site' option.""}]",knowledge/php/limesurvey,1.0,train
"[{""from"": ""human"", ""value"": ""What are the main features present in the LimeSurvey toolbar?""}, {""from"": ""gpt"", ""value"": ""The LimeSurvey toolbar contains several critical features: 'Tutorials', which includes a 'Beginner Tour'; 'Configuration' with settings for customization and user management; 'Surveys' to create new surveys, import existing ones, and list all surveys; 'Response Balance' to track remaining responses in your account; 'Storage' to manage available data storage; 'Username' for user preference settings; and 'Bell Icon' to view notifications related to the application.""}]",knowledge/php/limesurvey,1.0,train
"[{""from"": ""human"", ""value"": ""How can you create a new survey in LimeSurvey?""}, {""from"": ""gpt"", ""value"": ""To create a new survey in LimeSurvey, click the 'Create survey' box on the home page. You will be directed to the 'Create survey' page where you'll need to provide a 'Survey Title', select a 'Basic Language', and decide on additional configurations like enabling or disabling sample questions, setting an end URL for redirection after survey completion, and deciding on date and decimal formats. After filling in the relevant fields, click 'Save' to finish the process.""}]",knowledge/php/limesurvey,1.0,train
"[{""from"": ""human"", ""value"": ""What options do you have when creating a question group in LimeSurvey?""}, {""from"": ""gpt"", ""value"": ""When creating a question group in LimeSurvey, you need to select a survey first. Then, from the 'Structure' tab, click on 'Add question group'. You will then need to provide a title and, optionally, a description for the question group. You can also assign it to a randomization group and apply a relevance equation if desired. Once you have filled out these options, you can save the group.""}]",knowledge/php/limesurvey,1.0,train
"[{""from"": ""human"", ""value"": ""What steps should you take when adding a question in LimeSurvey?""}, {""from"": ""gpt"", ""value"": ""To add a question in LimeSurvey, ensure you have created a question group first. Navigate to the 'Structure' tab and click on 'Add question'. You will then fill in fields such as 'Code' (the question identifier), 'Question' (the text of the question), 'Help' (optional help text), and select general options related to the question type, mandatory status, and validation. After completing the required fields, click 'Save' to add the question.""}]",knowledge/php/limesurvey,1.0,train
"[{""from"": ""human"", ""value"": ""How can you add subquestions in LimeSurvey?""}, {""from"": ""gpt"", ""value"": ""To add subquestions in LimeSurvey, first ensure that you are on the question editing page. Click on the 'Edit subquestions' option from the top toolbar. You can then type in the subquestions you wish for the survey participants to answer. Use the green plus sign under the 'Actions' column to add more subquestions as needed. Once completed, save your changes.""}]",knowledge/php/limesurvey,1.0,train
"[{""from"": ""human"", ""value"": ""What is the process of activating a survey in LimeSurvey?""}, {""from"": ""gpt"", ""value"": ""To activate a survey in LimeSurvey, first ensure that you have added at least one question group and one question. Select the 'Settings' tab and click on 'Overview'. Then, click on 'Activate this survey' in the toolbar. A window will prompt you for general survey settings, such as enabling anonymized responses and storing IP addresses. After configuring the settings as desired, click 'Save & activate survey' to make your survey live.""}]",knowledge/php/limesurvey,1.0,train
"[{""from"": ""human"", ""value"": ""What are the different export formats available for survey results in LimeSurvey?""}, {""from"": ""gpt"", ""value"": ""In LimeSurvey, you can export survey results in various formats, including HTML, Excel, and PDF, for ease of analysis and reporting. For advanced statistical analysis, data can be exported to formats compatible with statistical software such as SPSS, R, and STATA. This flexibility allows users to analyze results in the tool that best fits their needs.""}]",knowledge/php/limesurvey,1.0,train
"[{""from"": ""human"", ""value"": ""How do you organize questions within a survey on LimeSurvey?""}, {""from"": ""gpt"", ""value"": ""To organize questions within a survey in LimeSurvey, navigate to the 'Structure' tab. Here, you can easily drag and drop questions and question groups using the three-line symbol that appears next to their names. This method allows for quick reorganizing of the question order without needing to access each question individually.""}]",knowledge/php/limesurvey,1.0,train
"[{""from"": ""human"", ""value"": ""What considerations should you keep in mind when deciding to store respondents' IP addresses in LimeSurvey?""}, {""from"": ""gpt"", ""value"": ""When deciding to store respondents' IP addresses in LimeSurvey, consider privacy implications and data protection regulations. If you enable this option, IP addresses will be linked to answers, which may not comply with anonymity principles desired in certain survey contexts. Thus, evaluate whether it's necessary for your analysis and ensure that respondents are informed about their data usage.""}]",knowledge/php/limesurvey,1.0,train
"[{""from"": ""human"", ""value"": ""What is the purpose of the 'Response Balance' feature in LimeSurvey?""}, {""from"": ""gpt"", ""value"": ""The 'Response Balance' feature in LimeSurvey allows users to monitor the number of responses remaining on their subscription. This feature is especially useful for users on free plans, as it indicates response limits and helps manage the survey participation accordingly. If a user exhausts their response quota, they can purchase more responses through the LimeSurvey pricing page.""}]",knowledge/php/limesurvey,1.0,train
"[{""from"": ""human"", ""value"": ""What advanced user features are available to manage surveys in LimeSurvey?""}, {""from"": ""gpt"", ""value"": ""For advanced users, LimeSurvey offers several features to manage surveys efficiently. These include advanced settings for customizing themes, managing label sets, and ensuring data integrity. Advanced users can utilize the plugin manager to activate or add custom plugins and handle demographic databases to store survey participant information independently.""}]",knowledge/php/limesurvey,1.0,train
"[{""from"": ""human"", ""value"": ""How can surveys be shared after being activated on LimeSurvey?""}, {""from"": ""gpt"", ""value"": ""After activating a survey on LimeSurvey, you can share it by navigating to the home page of your survey, where you will find the survey URL listed under the 'Survey summary' section. Copy this link and distribute it to your target audience to allow them access to the survey. Make sure to inform participants about the survey's purpose and any relevant timelines for completion.""}]",knowledge/php/limesurvey,1.0,train
"[{""from"": ""human"", ""value"": ""What can you do if you want to analyze your survey results in a statistical tool?""}, {""from"": ""gpt"", ""value"": ""If you want to analyze your survey results in a statistical tool, you can export the data from LimeSurvey in formats compatible with popular statistical software such as SPSS, R, or STATA. To do this, navigate to the 'Responses' tab on your survey's toolbar, select 'Responses & Statistics', and then click on 'Export' to choose your desired format for analysis.""}]",knowledge/php/limesurvey,1.0,train
"[{""from"": ""human"", ""value"": ""How can you manage user permissions and roles within the LimeSurvey application?""}, {""from"": ""gpt"", ""value"": ""Within LimeSurvey, user permissions and roles can be managed under the 'Users' settings found in the main toolbar. Here, options exist for managing survey administrators, creating and editing user groups, and utilizing central participant databases to store information related to survey respondents. Ensuring proper configurations here helps restrict access to sensitive survey data and maintain organized survey management.""}]",knowledge/php/limesurvey,1.0,train
"[{""from"": ""human"", ""value"": ""What steps are necessary to create a question type in LimeSurvey?""}, {""from"": ""gpt"", ""value"": ""Creating a question type in LimeSurvey involves selecting from the available options during question creation. While on the 'Create question' page, you can determine the 'Question Type' from a dropdown list that includes various formats like multiple choice, text entry, or array questions. Different options and settings will appear based on which question type is selected. Ensure to configure parameters accordingly and save the question once completed.""}]",knowledge/php/limesurvey,1.0,train
"[{""from"": ""human"", ""value"": ""Can you describe how to unsubscribe from LimeSurvey newsletters?""}, {""from"": ""gpt"", ""value"": ""To unsubscribe from LimeSurvey newsletters, locate the unsubscribe link typically provided at the end of the newsletters you receive. Clicking this link will allow you to opt out and stop receiving further communications from LimeSurvey. Ensure to follow the prompts accurately to complete the unsubscribing process.""}]",knowledge/php/limesurvey,1.0,train
"[{""from"": ""human"", ""value"": ""What is the importance of date and decimal formats in a LimeSurvey?""}, {""from"": ""gpt"", ""value"": ""The importance of date and decimal formats in LimeSurvey lies in ensuring the survey is user-friendly and understandable for the target audience. Users can select formats they are accustomed to, which is crucial for an international audience where date formats (e.g., dd/mm vs mm/dd) and decimal representations (e.g., dot vs comma) may differ. This consideration enhances clarity and data accuracy during responses.""}]",knowledge/php/limesurvey,1.0,train
"[{""from"": ""human"", ""value"": ""What options does the 'Advanced Settings' tab include in LimeSurvey?""}, {""from"": ""gpt"", ""value"": ""The 'Advanced Settings' tab in LimeSurvey includes features for enhancing the application beyond basic user or survey settings. Users can access a theme editor to customize the appearance of surveys and the admin interface, manage label sets for standardizing question responses, perform data integrity checks to ensure accurate data entry, and utilize options for backing up the entire LimeSurvey database.""}]",knowledge/php/limesurvey,1.0,train
"[{""from"": ""human"", ""value"": ""Describe how to use the Import feature in LimeSurvey for survey creation.""}, {""from"": ""gpt"", ""value"": ""In LimeSurvey, the Import feature allows users to upload existing surveys into the application. To use this, navigate to the 'Surveys' tab in the toolbar and click on the green arrow next to the list of surveys. Select 'Import a New Survey' from the options that appear. Follow the prompts to upload your survey file; this can save time if you have pre-built surveys or templates that you wish to work with instead of creating a new one from scratch.""}]",knowledge/php/limesurvey,1.0,train
"[{""from"": ""human"", ""value"": ""How does LimeSurvey's plugin manager enhance survey functionality?""}, {""from"": ""gpt"", ""value"": ""LimeSurvey's plugin manager enhances survey functionality by allowing users to activate, manage, and even create custom plugins tailored to their specific survey requirements. This feature ensures that users can extend capabilities beyond the default offerings, bringing additional tools and integrations into their surveys. Users can enable community-supported plugins provided by LimeSurvey or develop their own to implement unique features or functionalities.""}]",knowledge/php/limesurvey,1.0,train
"[{""from"": ""human"", ""value"": ""What should you be aware of before stopping a survey in LimeSurvey?""}, {""from"": ""gpt"", ""value"": ""Before stopping a survey in LimeSurvey, it is essential to understand that once a survey is activated, you cannot add or delete groups or questions, nor change their codes. Stopping the survey will prevent further responses, but remember to inform participants of the survey's closing status and consider how closing the survey might affect data analysis or completion rates.""}]",knowledge/php/limesurvey,1.0,train
"[{""from"": ""human"", ""value"": ""Why might you want to include an 'End URL' in your survey settings?""}, {""from"": ""gpt"", ""value"": ""Including an 'End URL' in your survey settings is useful for redirecting participants to a specific webpage after they have completed the questionnaire. This feature can enhance the user experience by providing participants with additional information, thanking them for their participation, or directing them to further actions relevant to the survey topic. Setting the 'automatically load URL' option ensures a seamless transition for users.""}]",knowledge/php/limesurvey,1.0,train
"[{""from"": ""human"", ""value"": ""What is the benefit of setting a welcome message in LimeSurvey?""}, {""from"": ""gpt"", ""value"": ""Setting a welcome message in LimeSurvey is beneficial as it introduces participants to the context of the survey, sets expectations, and can help improve survey completion rates. A well-crafted welcome message can enhance engagement by informing participants about the purpose of the survey, the estimated time for completion, and any incentives for participation, making respondents feel valued from the start.""}]",knowledge/php/limesurvey,1.0,train
"[{""from"": ""human"", ""value"": ""Explain how to use the Statistics feature in LimeSurvey.""}, {""from"": ""gpt"", ""value"": ""To use the Statistics feature in LimeSurvey, navigate to the survey you wish to analyze and select the 'Statistics' button found in the column corresponding to the survey list. This action opens a new window containing graphs and data visualizations related to survey responses. You can view the results in various formats and customize your statistics by applying different filters through the 'Expert mode' option for a deeper analysis.""}]",knowledge/php/limesurvey,1.0,train
"[{""from"": ""human"", ""value"": ""Why is it important to have a properly configured survey settings before activation?""}, {""from"": ""gpt"", ""value"": ""Having properly configured survey settings before activation is crucial to ensure that the survey aligns with its intended purpose and adheres to any data protection regulations. Configurations such as anonymizing responses, saving IP addresses, and enabling timestamp logging directly impact how data is collected and processed. A well-set survey minimizes potential issues with data integrity and confidentiality, leading to more accurate and compliant outcomes.""}]",knowledge/php/limesurvey,1.0,train
"[{""from"": ""human"", ""value"": ""How can you regularly receive updates and information from LimeSurvey?""}, {""from"": ""gpt"", ""value"": ""To regularly receive updates and information from LimeSurvey, users should subscribe to the LimeSurvey newsletter during the account creation process or through their account settings. LimSurvey typically includes news about new features, tips on usage, updates about the platform, and special offers as part of their communication strategy. Users can unsubscribe if they choose to stop receiving such updates.""}]",knowledge/php/limesurvey,1.0,train
"[{""from"": ""human"", ""value"": ""How does LimeSurvey allow customization of survey themes?""}, {""from"": ""gpt"", ""value"": ""LimeSurvey allows customization of survey themes through the 'Theme editor' found in the 'Advanced Settings' tab. Administrators can add, edit, or delete themes to tailor the appearance of surveys to match branding or preferences. Using the theme editor helps create visually appealing surveys aligned with organizational aesthetics, enhancing participant engagement based on the customization of the survey interface.""}]",knowledge/php/limesurvey,1.0,train
"[{""from"": ""human"", ""value"": ""What types of questions can you create in LimeSurvey?""}, {""from"": ""gpt"", ""value"": ""In LimeSurvey, you can create a variety of question types, including: \n1. Multiple Choice: Participants select one or more answers from a list.\n2. Drop-down: Respondents choose an option from a dropdown menu.\n3. Long Free Text: Participants can provide extensive text responses.\n4. Array: A grid format allowing evaluations of various items.\n5. Rating Scale: Participants rank items using defined value scales (e.g., 1 to 5). \n\nThese diverse question formats ensure flexibility in capturing both qualitative and quantitative insights through surveys.""}]",knowledge/php/limesurvey,1.0,train
"[{""from"": ""human"", ""value"": ""How can you provide support or ask questions regarding LimeSurvey?""}, {""from"": ""gpt"", ""value"": ""To seek support or ask questions about LimeSurvey, users can post inquiries on the LimeSurvey community forums or join the community chat on Discord. These platforms allow users to share experiences, ask for help with specific functionalities, and engage with both community members and LimeSurvey administrators for guidance on using the application effectively.""}]",knowledge/php/limesurvey,1.0,train
"[{""from"": ""human"", ""value"": ""What does the 'Backup Entire Database' option in LimeSurvey do?""}, {""from"": ""gpt"", ""value"": ""The 'Backup Entire Database' option in LimeSurvey allows users to create a complete backup of their survey data and settings. This is particularly crucial during significant upgrades or when migrating the LimeSurvey application to a different server. By performing regular backups, users can safeguard against data loss and ensure that they have a restore point for their surveys and participant data.""}]",knowledge/php/limesurvey,1.0,train
"[{""from"": ""human"", ""value"": ""What is the difference between 'Free', 'Basic', 'Expert', and 'Enterprise' options in LimeSurvey's pricing?""}, {""from"": ""gpt"", ""value"": ""In LimeSurvey's pricing structure, the 'Free' option offers limited features suitable for basic use with a cap on responses, while the 'Basic' plan introduces additional functionality and a higher response limit. The 'Expert' plan includes advanced features for professional survey creation, including more robust data analysis capabilities. 'Enterprise' is tailored for organizations needing extensive customization, larger storage, and dedicated support. Each tier increases in both functionality and support.""}]",knowledge/php/limesurvey,1.0,train
"[{""from"": ""human"", ""value"": ""What provisions can be included in a confirmation email after account creation in LimeSurvey?""}, {""from"": ""gpt"", ""value"": ""After creating an account in LimeSurvey, the confirmation email typically contains an activation link to verify the new account. It may also include helpful tips on how to get started with LimeSurvey, links to resources like tutorials or documentation, and information regarding privacy policies, customer support, and any promotional offers available to the new user.""}]",knowledge/php/limesurvey,1.0,train
"[{""from"": ""human"", ""value"": ""How can LimeSurvey enhance survey participation rates?""}, {""from"": ""gpt"", ""value"": ""LimeSurvey can enhance survey participation rates through various features designed to improve user experience. By allowing for customizable themes, interactive question types, and welcome messages that engage participants, users are encouraged to complete surveys. Additionally, incorporating elements such as incentives for participation, ensuring mobile responsiveness, and minimizing the time required to finish can significantly boost response rates in survey distributions.""}]",knowledge/php/limesurvey,1.0,train
"[{""from"": ""human"", ""value"": ""What strategies can be employed to ensure data integrity within LimeSurvey?""}, {""from"": ""gpt"", ""value"": ""To ensure data integrity within LimeSurvey, users can employ several strategies:\n1. Validation Features: Use response validation to ensure only accurate data formats are accepted for responses.\n2. Backup Procedures: Regularly back up all survey data to recover from potential loss or corruption.\n3. Consistent Review: Periodically review survey questions and settings to align them with data integrity standards.\n4. Check Data Integrity Feature: Utilize the built-in data integrity check options which alert users about inconsistent or duplicate entries.\nThese practices help to maintain high-quality data throughout the survey process.""}]",knowledge/php/limesurvey,1.0,train
"[{""from"": ""human"", ""value"": ""How can users manage their survey participant base using LimeSurvey?""}, {""from"": ""gpt"", ""value"": ""Users can manage their survey participant base in LimeSurvey using the features offered under the 'Users' tab. They can create and edit user groups to segment audiences, maintain central participant databases to store and manage respondent data, and use the participant settings options to customize how participants interact with surveys. This organization allows for efficient management, targeting, and analyzing respondent participation.""}]",knowledge/php/limesurvey,1.0,train
"[{""from"": ""human"", ""value"": ""What tips can be provided to new users whom are getting started with LimeSurvey?""}, {""from"": ""gpt"", ""value"": ""New users looking to get started with LimeSurvey should consider the following tips:\n1. Begin with Tutorials: Take advantage of the 'Beginner Tour' tutorials provided to familiarize yourself with the interface and functions.\n2. Start Simple: Begin with creating a basic survey to understand the features and gradually explore advanced options.\n3. Explore Documentation: Refer to the LimeSurvey manual for detailed guides and troubleshooting help.\n4. Join the Community: Engage in forums and Discord to connect with other users and seek guidance from experienced members.\n5. Test Their Surveys: Before launching, always preview your surveys to ensure they function as expected.""}]",knowledge/php/limesurvey,1.0,train
"[{""from"": ""human"", ""value"": ""What are the advantages of using LimeSurvey for creating surveys?""}, {""from"": ""gpt"", ""value"": ""The advantages of using LimeSurvey for creating surveys include:\n1. Open Source: Being open source means that it provides free usage and allows for extensive customization options.\n2. User-Friendly Interface: LimeSurvey features a straightforward design that helps users easily navigate and create surveys without extensive technical knowledge.\n3. Versatile Question Types: Supports various question formats, accommodating different data collection needs.\n4. Comprehensive Analysis Tools: Offers built-in statistics and export options for effective data analysis.\n5. Community Support: A strong community presence provides users with forums and real-time assistance via Discord, ensuring they can readily get help and share experiences.""}]",knowledge/php/limesurvey,1.0,train
"[{""from"": ""human"", ""value"": ""How can additional languages be incorporated into LimeSurvey surveys?""}, {""from"": ""gpt"", ""value"": ""Additional languages can be incorporated into LimeSurvey surveys by navigating to the survey settings and selecting the 'Basic Language' option. You can then configure the survey to include additional languages using the settings under the 'Languages' tab. This allows respondents to choose their preferred language when completing the survey and ensures inclusivity for a diverse audience.""}]",knowledge/php/limesurvey,1.0,train
