conversations,source,score,split
"[{""from"": ""human"", ""value"": ""How does editing and version control work within LimeSurvey?""}, {""from"": ""gpt"", ""value"": ""Editing and version control within LimeSurvey allows users to maintain a history of changes made to surveys over time. Users can edit surveys easily and save versions, which can be essential for tracking modifications and reverting to previous states if necessary. This feature ensures that alterations can be made safely, allowing for continuous improvement of survey designs without the fear of losing previous configurations.""}]",knowledge/php/limesurvey,1.0,train
"[{""from"": ""human"", ""value"": ""What limitations should one acknowledge when using LimeSurvey?""}, {""from"": ""gpt"", ""value"": ""When using LimeSurvey, one should acknowledge limitations such as:\n1. Limited functionality on free plans, affecting response numbers and available features.\n2. The necessity for some technical knowledge to utilize advanced features effectively.\n3. Potential learning curve for users unfamiliar with survey design principles or data analysis techniques.\n4. Depending on internet connectivity, survey accessibility may be affected.\nRecognizing these limitations can guide users in making informed decisions about leveraging LimeSurvey for their survey needs.""}]",knowledge/php/limesurvey,1.0,train
"[{""from"": ""human"", ""value"": ""How can organizations provide resources within LimeSurvey surveys for participants?""}, {""from"": ""gpt"", ""value"": ""Organizations can provide resources within LimeSurvey surveys by including links to relevant materials, embedding instructional videos, or adding informational text before critical questions. By doing so, organizations ensure that participants have access to necessary context that may enhance understanding and improve the quality of responses received.""}]",knowledge/php/limesurvey,1.0,train
"[{""from"": ""human"", ""value"": ""Why is it essential to review survey results authentically?""}, {""from"": ""gpt"", ""value"": ""Authentic review of survey results is essential as it reveals genuine participant sentiment and perspectives. Acknowledging biases, understanding limitations in the data, and interpreting results within the context of the survey's intentions enable organizations to make more informed decisions. This authenticity fosters trust among stakeholders and supports the integrity of data-driven conclusions.""}]",knowledge/php/limesurvey,1.0,train
"[{""from"": ""human"", ""value"": ""How can LimeSurvey adapt to different types of qualitative research methodologies?""}, {""from"": ""gpt"", ""value"": ""LimeSurvey can adapt to various qualitative research methodologies by allowing for the collection of open-ended responses, providing customizable question formats that support thematic analysis, and facilitating rich descriptions. By incorporating features like comment fields and flexibility in question design, researchers conducting interviews, focus groups, or narrative inquiries can effectively gather qualitative data that aligns with their methodologies.""}]",knowledge/php/limesurvey,1.0,train
"[{""from"": ""human"", ""value"": ""What role does survey testing play in ensuring survey effectiveness on LimeSurvey?""}, {""from"": ""gpt"", ""value"": ""Survey testing plays a pivotal role in ensuring survey effectiveness on LimeSurvey by identifying potential issues in question clarity, technical functionalities, and overall respondent navigation. Pre-testing with selected participants helps gather feedback before full deployment, enabling adjustments and refinements to improve outcomes. This anticipation of respondent experience significantly enhances data quality and participant engagement.""}]",knowledge/php/limesurvey,1.0,train
"[{""from"": ""human"", ""value"": ""How can LimeSurvey accommodate various organizational needs through customization?""}, {""from"": ""gpt"", ""value"": ""LimeSurvey can accommodate various organizational needs through extensive customization options such as altering survey themes for branding, selecting specific question types tailored to data objectives, and adjusting survey settings for confidentiality and data handling. This level of customization allows organizations to create surveys that align with their specific operational requirements and strategic goals.""}]",knowledge/php/limesurvey,1.0,train
"[{""from"": ""human"", ""value"": ""In what scenarios might survey anonymity be prioritized by researchers using LimeSurvey?""}, {""from"": ""gpt"", ""value"": ""Survey anonymity may be prioritized by researchers using LimeSurvey in cases where sensitive data is being collected, such as health information, personal opinions on controversial topics, or employee feedback about workplace policies. Maintaining anonymity encourages honest participation and protects respondents' identities, fostering a more open dialogue and obtaining reliable data that can inform research findings.""}]",knowledge/php/limesurvey,1.0,train
"[{""from"": ""human"", ""value"": ""How does LimeSurvey support collaboration among multiple users in creating surveys?""}, {""from"": ""gpt"", ""value"": ""LimeSurvey supports collaboration among multiple users in creating surveys by offering shared access to survey projects, allowing teams to work together in real time. Users can assign roles, manage permissions, and track changes made by collaborators. This collaborative framework enhances the survey design process, integrating different perspectives and expertise for a more comprehensive survey outcome.""}]",knowledge/php/limesurvey,1.0,train
"[{""from"": ""human"", ""value"": ""What approaches can be applied to analyze open-ended responses collected in LimeSurvey?""}, {""from"": ""gpt"", ""value"": ""Approaches to analyze open-ended responses collected in LimeSurvey can include thematic analysis, where responses are reviewed to identify common themes and patterns, and content analysis, where qualitative data is quantified by coding responses according to predefined categories. Additionally, using natural language processing (NLP) tools can help to automate the analysis and gain deeper insights from participant feedback.""}]",knowledge/php/limesurvey,1.0,train
"[{""from"": ""human"", ""value"": ""How does participant diversity influence survey results in LimeSurvey?""}, {""from"": ""gpt"", ""value"": ""Participant diversity influences survey results in LimeSurvey as it ensures that the feedback represents a broad spectrum of perspectives and experiences. A diverse participant base helps capture varied insights that are more reflective of the general population, leading to richer data and more comprehensive understanding of the issues being surveyed. It is crucial for the validity and applicability of findings.""}]",knowledge/php/limesurvey,1.0,train
"[{""from"": ""human"", ""value"": ""What role does user engagement play in the overall success of surveys in LimeSurvey?""}, {""from"": ""gpt"", ""value"": ""User engagement plays a critical role in the overall success of surveys in LimeSurvey, as high engagement typically correlates with higher completion rates and more reliable data. By designing engaging questions, providing clear communication, and offering incentives for participation, users are more likely to complete surveys, leading to a more accurate and representative dataset.""}]",knowledge/php/limesurvey,1.0,train
"[{""from"": ""human"", ""value"": ""What factors should be considered in survey design to enhance data completeness in LimeSurvey?""}, {""from"": ""gpt"", ""value"": ""Factors to enhance data completeness in survey design on LimeSurvey include:\n1. Logical Question Flow: Ensure questions are organized in a clear sequence to guide participants smoothly.\n2. Clear Instructions: Provide explicit instructions to clarify how to answer questions.\n3. Mandatory Questions: Utilize required questions judiciously to ensure key data points are always collected.\n4. Pre-Testing: Run pilot tests to identify potential drop-off points and adjust survey length or complexity accordingly.\n5. Follow-Up Reminders: Consider sending reminders to those who haven't completed the survey.\nIncorporating these factors can lead to higher completion rates and fuller datasets.""}]",knowledge/php/limesurvey,1.0,train
"[{""from"": ""human"", ""value"": ""What can be done to ensure that the feedback gathered through LimeSurvey is actionable?""}, {""from"": ""gpt"", ""value"": ""To ensure that feedback gathered through LimeSurvey is actionable, it is essential to frame questions clearly, ask for specific insights, and engage respondents in a way that supports clarity. Regularly analyzing the results in conjunction with stakeholder objectives can help contextualize feedback and identify trends. Additionally, encouraging participants to provide suggestions for improvements can lead to direct action points.""}]",knowledge/php/limesurvey,1.0,train
"[{""from"": ""human"", ""value"": ""How can organizations use LimeSurvey to monitor changes in participant attitudes over time?""}, {""from"": ""gpt"", ""value"": ""Organizations can use LimeSurvey to monitor changes in participant attitudes over time by conducting longitudinal studies with repeated surveys that target the same population. By collecting data at different intervals, organizations can track shifts in attitudes, preferences, or behaviors, allowing for comprehensive analysis and reporting that reflects the effects of interventions or external changes.""}]",knowledge/php/limesurvey,1.0,train
"[{""from"": ""human"", ""value"": ""What role does color psychology play in designing surveys with LimeSurvey?""}, {""from"": ""gpt"", ""value"": ""Color psychology plays a significant role in designing surveys with LimeSurvey as colors can influence mood and perceptions. Choosing colors that evoke trust and calmness, such as blues or greens, can create a positive survey experience, while vibrant colors can grab attention and encourage engagement. Effective use of color can enhance visual appeal, direct focus to important elements, and improve participant satisfaction.""}]",knowledge/php/limesurvey,1.0,train
"[{""from"": ""human"", ""value"": ""How can organizations create surveys that respect cultural sensitivities using LimeSurvey?""}, {""from"": ""gpt"", ""value"": ""Organizations can create surveys that respect cultural sensitivities using LimeSurvey by conducting thorough research on the cultural backgrounds of their participants and designing questions that are respectful and non-offensive. Avoiding leading or loaded questions that may contradict cultural norms and providing a range of response options can enhance inclusivity. Additionally, ensuring that questions are relevant to diverse cultural contexts will foster a respectful approach to data collection.""}]",knowledge/php/limesurvey,1.0,train
"[{""from"": ""human"", ""value"": ""How can LimeSurvey aid in developing a comprehensive feedback loop for organizations?""}, {""from"": ""gpt"", ""value"": ""LimeSurvey can aid in developing a comprehensive feedback loop for organizations by facilitating the continuous collection of participant responses through surveys, allowing organizations to regularly assess the effectiveness of their services, products, or strategies. By analyzing survey results and implementing recommended changes, then conducting follow-up surveys, organizations can establish a cycle of improvement that directly responds to participant needs and enhances overall satisfaction.""}]",knowledge/php/limesurvey,1.0,train
"[{""from"": ""human"", ""value"": ""What strategies can improve participant motivation in LimeSurvey surveys?""}, {""from"": ""gpt"", ""value"": ""Strategies to improve participant motivation in LimeSurvey surveys include:\n1. Offering Incentives: Provide rewards or prizes for survey completion.\n2. Communicating Purpose: Clearly explain the survey's objectives and expected outcomes.\n3. Making It Engaging: Utilize interesting question formats and multimedia elements to make the survey interactive.\n4. Time Awareness: Inform participants about how long the survey will take to complete.\n5. Personalizing Invitations: Address participants by name and tailor communications to make them feel valued.\nThese strategies can help create a sense of ownership among participants, leading to higher motivation.""}]",knowledge/php/limesurvey,1.0,train
"[{""from"": ""human"", ""value"": ""How can organizations utilize LimeSurvey to enhance employee engagement?""}, {""from"": ""gpt"", ""value"": ""Organizations can utilize LimeSurvey to enhance employee engagement by conducting regular surveys to gather feedback on organizational culture, job satisfaction, and employee needs. By acting on the insights gained from these surveys, organizations can improve workplace conditions, address concerns, and foster a sense of inclusion and belonging among employees. Engagement can also be enhanced by involving employees in the survey design process to ensure relevance and buy-in.""}]",knowledge/php/limesurvey,1.0,train
"[{""from"": ""human"", ""value"": ""What features allow users to customize survey experiences in LimeSurvey?""}, {""from"": ""gpt"", ""value"": ""LimeSurvey offers several features that allow users to customize survey experiences, including:\n1. Custom Themes: Users can design surveys that reflect their branding.\n2. Diverse Question Types: The platform supports various question formats to enhance engagement.\n3. Logic and Flow Options: Conditional logic allows for dynamic question paths based on participant responses.\n4. Language Settings: Surveys can be offered in multiple languages.\n5. Customizable Thank You Pages: Users can motivate further engagement with personalized messages post-survey completion.\nThese features enable tailored experiences that can significantly increase participation and satisfaction.""}]",knowledge/php/limesurvey,1.0,train
"[{""from"": ""human"", ""value"": ""What considerations should be taken when designing surveys for diverse participant groups?""}, {""from"": ""gpt"", ""value"": ""When designing surveys for diverse participant groups, considerations should include:\n1. Language Accessibility: Ensure clarity and translations for non-native speakers.\n2. Question Phrasing: Use culturally sensitive language and avoid leading questions.\n3. Inclusivity: Be mindful of different cultural norms and avoid assumptions based on a single cultural perspective.\n4. Format Diversity: Provide various response formats to cater to different communication styles.\n5. Testing Across Groups: Pilot tests with individuals from various backgrounds can provide valuable feedback to make necessary adjustments.\nAddressing these factors promotes inclusivity and enhances the quality of the data collected.""}]",knowledge/php/limesurvey,1.0,train
"[{""from"": ""human"", ""value"": ""How does analyzing response patterns aid in refining survey questions?""}, {""from"": ""gpt"", ""value"": ""Analyzing response patterns aids in refining survey questions by identifying which questions yield the most insightful data, observing how different demographics respond, and detecting any confusing or misleading questions based on participant feedback. By continuously assessing these patterns, organizations can adjust questions to better align with participant understanding, remove redundancy, and optimize clarity, thereby enhancing data quality and survey effectiveness.""}]",knowledge/php/limesurvey,1.0,train
"[{""from"": ""human"", ""value"": ""What strategies can enhance clarity in open-ended questions within LimeSurvey?""}, {""from"": ""gpt"", ""value"": ""Strategies to enhance clarity in open-ended questions within LimeSurvey include:\n1. Clear Instructions: Provide specific guidelines on the type of response expected.\n2. Examples: Offer example responses to give context to participants.\n3. Limit Scope: Encourage concise responses by limiting the number of lines available for answers.\n4. Avoid Jargon: Use plain language to make it accessible to all respondents.\n5. Testing: Pilot the open-ended questions to revisit any areas of confusion.\nImplementing these approaches can improve participant response quality and relevance.""}]",knowledge/php/limesurvey,1.0,train
"[{""from"": ""human"", ""value"": ""How can organizations utilize LimeSurvey to improve customer experience?""}, {""from"": ""gpt"", ""value"": ""Organizations can utilize LimeSurvey to improve customer experience by gathering feedback directly from customers about their interactions, preferences, and satisfaction levels. By analyzing these responses, organizations can identify areas that require enhancement and implement changes based on direct customer input, ensuring that services and products are aligned with customer expectations. Effective communication of findings back to customers also fosters trust and reinforces a customer-centric approach.""}]",knowledge/php/limesurvey,1.0,train
"[{""from"": ""human"", ""value"": ""How can LimeSurvey facilitate collaboration among different stakeholders during survey design?""}, {""from"": ""gpt"", ""value"": ""LimeSurvey facilitates collaboration among different stakeholders during survey design by allowing multi-user access to survey projects, enabling team members to contribute insights and suggestions in real-time. Users can comment on specific questions, provide feedback, and edit questions collectively, ensuring diverse perspectives inform the survey development process. This collaborative approach results in comprehensively designed surveys that effectively meet diverse stakeholder needs.""}]",knowledge/php/limesurvey,1.0,train
"[{""from"": ""human"", ""value"": ""What are the implications of survey design on data accuracy and reliability in LimeSurvey?""}, {""from"": ""gpt"", ""value"": ""The implications of survey design on data accuracy and reliability in LimeSurvey are profound; well-designed surveys yield high-quality data that accurately reflects participant sentiments, while poorly constructed surveys can result in inaccuracies and unreliable insights. Key factors such as question clarity, logical flow, and engaging layouts directly affect how respondents interpret questions and, consequently, how they answer, making thoughtful survey design critical in fostering reliable data collection.""}]",knowledge/php/limesurvey,1.0,train
"[{""from"": ""human"", ""value"": ""How does descriptive analysis of survey data lead to actionable insights?""}, {""from"": ""gpt"", ""value"": ""Descriptive analysis of survey data leads to actionable insights by summarizing key metrics that highlight trends and patterns. By collating information on response distributions, averages, and demographic breakdowns, organizations can identify areas needing attention or improvement. This preliminary analysis serves as a foundational step in decision-making processes, allowing stakeholders to prioritize actions based on clear evidence derived from the data.""}]",knowledge/php/limesurvey,1.0,train
"[{""from"": ""human"", ""value"": ""What technical knowledge might be required for effective use of LimeSurvey?""}, {""from"": ""gpt"", ""value"": ""Effective use of LimeSurvey may require some technical knowledge, such as familiarity with survey design principles, understanding data privacy regulations, and basic statistical concepts for analyzing results. Users should also be comfortable with navigating the LimeSurvey interface and customizing surveys, and may benefit from knowledge of programming languages like HTML or CSS if they wish to utilize advanced visual customizations.""}]",knowledge/php/limesurvey,1.0,train
"[{""from"": ""human"", ""value"": ""How can organizations create effective marketing strategies using data from LimeSurvey?""}, {""from"": ""gpt"", ""value"": ""Organizations can create effective marketing strategies using data from LimeSurvey by conducting customer satisfaction surveys, identifying target demographics, and understanding market trends through survey analysis. By leveraging the insights gathered, organizations can tailor their marketing messages, optimize customer engagement plans, and launch promotional campaigns that resonate with their audience preferences, leading to improved reach and conversion rates.""}]",knowledge/php/limesurvey,1.0,train
"[{""from"": ""human"", ""value"": ""How does feedback collection affect relationship building with participants?""}, {""from"": ""gpt"", ""value"": ""Feedback collection affects relationship building with participants by showing that their opinions are valued and taken seriously. When organizations follow up on feedback\u2014by communicating how participant responses have influenced changes or decisions\u2014they foster trust and strengthen connections with their audience. This reciprocal relationship encourages ongoing engagement and loyalty as participants feel their insights contribute to meaningful improvements.""}]",knowledge/php/limesurvey,1.0,train
"[{""from"": ""human"", ""value"": ""What are some ways to improve participant retention through the survey process?""}, {""from"": ""gpt"", ""value"": ""Ways to improve participant retention through the survey process include:\n1. Engaging Design: Create aesthetically appealing surveys that maintain participant interest.\n2. Regular Communication: Keep participants informed about their responses' impact on projects or products.\n3. Easy-to-Complete Surveys: Ensure brevity and clarity throughout the survey to reduce fatigue.\n4. Follow-ups: Send reminder emails to motivate completion.\n5. Incentivizatio]""}]",knowledge/php/limesurvey,1.0,train
