conversations,source,score,split
"[{""from"": ""human"", ""value"": ""What is the purpose of the session cookie in website functionality?""}, {""from"": ""gpt"", ""value"": ""The session cookie is essential for identifying and maintaining the current user during their interaction with the website. It allows the website to associate the session ID with the user account upon login, enabling the service to provide a personalized experience. If a user does not have an account, the cookie does not relate to any personal data. For administrative users, the session cookie&apos;s association remains until they log out or the session times out, which typically happens after a 24-hour period.""}]",knowledge/php/limesurvey,1.0,train
"[{""from"": ""human"", ""value"": ""How does the YII_CSRF_TOKEN cookie enhance web application security?""}, {""from"": ""gpt"", ""value"": ""The YII_CSRF_TOKEN cookie provides protection against cross-site request forgery (CSRF) attacks, which are designed to exploit user sessions to send unauthorized requests. This cookie contains a unique, random security token generated for each user session. Its value is updated automatically after every request, effectively making it difficult for attackers to predict the token. Since the CSRF token automatically expires after 24 hours, it adds an additional layer of security, ensuring that even if a token is compromised, it has a limited lifespan.""}]",knowledge/php/limesurvey,1.0,train
"[{""from"": ""human"", ""value"": ""What is the function of the survey status cookie in LimeSurvey?""}, {""from"": ""gpt"", ""value"": ""The survey status cookie, such as LS_21157_STATUS, is used to prevent users from submitting the same survey multiple times. This cookie is optional and is enabled on a per-survey basis. By remembering that a user has completed a specific survey, the cookie ensures that the user does not receive duplicate prompts to complete the survey again. To maintain user privacy and system integrity, this cookie expires after one year.""}]",knowledge/php/limesurvey,1.0,train
"[{""from"": ""human"", ""value"": ""What happens to the session cookie when an admin user logs out?""}, {""from"": ""gpt"", ""value"": ""When an admin user logs out, the association between their session cookie and their user account is removed. This action clears any identification maintained by the cookie, ensuring that their session cannot be accessed once they have logged out. If the session expires naturally, the same removal of the user association occurs. This design is crucial for maintaining security and privacy, particularly in administrative roles within a web application.""}]",knowledge/php/limesurvey,1.0,train
"[{""from"": ""human"", ""value"": ""How long do session cookies typically last, and what is their significance?""}, {""from"": ""gpt"", ""value"": ""Session cookies typically have a default expiration period of 24 hours. This duration is significant as it balances user convenience with security. It allows users to remain logged in and maintain their session while providing an automatic end to the session after a set timeframe. This precaution mitigates risks associated with prolonged sessions, such as unauthorized access if a user forgets to log out, especially on shared or public computers.""}]",knowledge/php/limesurvey,1.0,train
"[{""from"": ""human"", ""value"": ""Are there any limitations on the cookies set by custom plugins in LimeSurvey?""}, {""from"": ""gpt"", ""value"": ""Yes, while custom plugins in LimeSurvey can set additional cookies, the details and functionalities of these cookies depend on the plugin developer documentation. This means that custom cookies can vary significantly based on their intended use and implementation in the context of a specific survey or user interaction. Developers need to adhere to best practices in cookie management to ensure user data privacy and security.""}]",knowledge/php/limesurvey,1.0,train
"[{""from"": ""human"", ""value"": ""Can session cookies be associated with user data if the user does not have an account?""}, {""from"": ""gpt"", ""value"": ""No, if the user does not have an account, the session cookie is not associated with any user data. This design feature ensures that non-registered users do not have their interactions tracked or linked to personal information, thus maintaining confidentiality and privacy.""}]",knowledge/php/limesurvey,1.0,train
"[{""from"": ""human"", ""value"": ""What are the implications of having the survey status cookie expire after one year?""}, {""from"": ""gpt"", ""value"": ""The implication of the survey status cookie expiring after one year is that users may be prompted to complete the survey again after this period if they revisit it later. This expiration policy strikes a balance allowing users to remain conclusively marked as having completed the survey while also giving them the opportunity to retake it after a significant time. From a data integrity perspective, it allows for the collection of new responses as user perspectives may change over time.""}]",knowledge/php/limesurvey,1.0,train
"[{""from"": ""human"", ""value"": ""What is the expiration policy for the YII_CSRF_TOKEN cookie?""}, {""from"": ""gpt"", ""value"": ""The YII_CSRF_TOKEN cookie automatically expires after 24 hours. This policy is a vital aspect of application security; it ensures that any potential threat posed by a stolen token is minimized, as the token\u2019s validity is limited to a short period. By changing the token value after each request and with its expiration mechanism, it secures the user session against CSRF attacks effectively.""}]",knowledge/php/limesurvey,1.0,train
"[{""from"": ""human"", ""value"": ""How can the session cookie affect the user experience on a website?""}, {""from"": ""gpt"", ""value"": ""The session cookie significantly enhances user experience on a website by allowing users to stay logged in during their session. This cookie helps maintain the context of their interactions, enabling features such as remembering user-specific preferences, selection history, and completing multi-step processes without losing state. Without the session cookie, users would have to log in again repeatedly, which could lead to frustration and a poor user experience.""}]",knowledge/php/limesurvey,1.0,train
"[{""from"": ""human"", ""value"": ""What might be some challenges when developing plugins that set additional cookies in LimeSurvey?""}, {""from"": ""gpt"", ""value"": ""When developing plugins that set additional cookies in LimeSurvey, some challenges may include ensuring compliance with privacy regulations, managing user consent for cookie storage, and ensuring cookies do not conflict with the core application's cookie management system. Also, developers need to ensure that their cookies have clear purposes, are easy to understand, and maintain user privacy while providing helpful functionality for survey management.""}]",knowledge/php/limesurvey,1.0,train
"[{""from"": ""human"", ""value"": ""How does the lifecycle of a cookie typically work in web applications?""}, {""from"": ""gpt"", ""value"": ""The lifecycle of a cookie in web applications generally involves several stages:\n1. **Creation**: A cookie is created on the server side, typically during user authentication or interaction events, and sent to the user's browser.\n2. **Storage**: The user's browser stores the cookie until it expires or is deleted by the user or server.\n3. **Transmission**: On each subsequent request to the server, the browser sends the cookie back to the server, allowing the server to recall the user's session and preferences.\n4. **Expiration**: Cookies may have a designated expiration time, after which they are automatically deleted, or they can be session cookies that expire once the user closes their browser.\n5. **Deletion**: Cookies can be deleted explicitly either via server commands or by user action, providing control over user data and preferences.\nEach stage of this lifecycle requires careful management to ensure security and privacy.""}]",knowledge/php/limesurvey,1.0,train
"[{""from"": ""human"", ""value"": ""What is the downside of not using CSRF protection tokens in web applications?""}, {""from"": ""gpt"", ""value"": ""Not using CSRF protection tokens in web applications can expose them to serious vulnerabilities. Attackers can exploit this vulnerability to execute unauthorized actions on behalf of authenticated users, such as submitting forms or changing settings without the user's consent. This can lead to data manipulation, loss, or unauthorized access to sensitive information. Therefore, implementing CSRF protection tokens, like the YII_CSRF_TOKEN, is crucial in maintaining the integrity and security of web applications.""}]",knowledge/php/limesurvey,1.0,train
"[{""from"": ""human"", ""value"": ""What kind of data is typically stored in a session cookie?""}, {""from"": ""gpt"", ""value"": ""A session cookie typically stores a session identifier (session ID) that links the user's current session to a specific user account (if authenticated). It might also store information about user preferences or states for the duration of their session, enabling functionality such as shopping cart contents or user-specific settings. The cookie itself does not usually store sensitive data like passwords or personal identifiable information (PII), as doing so could pose a security risk.""}]",knowledge/php/limesurvey,1.0,train
"[{""from"": ""human"", ""value"": ""How important is cookie expiration time in the context of user privacy?""}, {""from"": ""gpt"", ""value"": ""Cookie expiration time is critical in the context of user privacy. It dictates how long a cookie can persist, balancing usability with security. Short-lived cookies minimize the risk of session hijacking, as they reduce the window of opportunity for attackers to exploit a stolen cookie. Implementing appropriate expiration policies is a fundamental aspect of protecting user data, ensuring that stored information does not lead to unintended tracking or data retention beyond necessary limits.""}]",knowledge/php/limesurvey,1.0,train
"[{""from"": ""human"", ""value"": ""What recommendations can be made for managing custom cookies in web applications?""}, {""from"": ""gpt"", ""value"": ""When managing custom cookies in web applications, the following recommendations can help ensure best practices are followed:\n1. **Compliance**: Ensure that custom cookies comply with relevant privacy regulations, such as GDPR, including obtaining user consent.\n2. **Clear Purpose**: Assign a clear purpose to each cookie to make it easy for users to understand why the cookie is set.\n3. **Secure Storage**: Use secure attributes (like HttpOnly and Secure) to protect cookies from unauthorized access.\n4. **Expiration Policies**: Set reasonable expiration times for cookies to minimize data retention.\n5. **Regular Review**: Regularly review cookie usage and relevance to avoid unnecessary data collection.\nBy following these guidelines, developers can manage custom cookies while prioritizing user privacy and data protection.""}]",knowledge/php/limesurvey,1.0,train
"[{""from"": ""human"", ""value"": ""What can lead to the reconsideration of cookie expiration policies?""}, {""from"": ""gpt"", ""value"": ""Cookie expiration policies may be reconsidered due to various factors such as changes in user behavior, privacy regulations, or evolving security practices. For instance, if the data collected from persistent cookies leads to privacy concerns or if regulations require stricter controls on user data retention, organizations may need to shorten expiration times. Additionally, adapting to user expectations and preferences regarding data usage and tracking can prompt a review of existing cookie policies, leading to adopting more user-friendly approaches.""}]",knowledge/php/limesurvey,1.0,train
"[{""from"": ""human"", ""value"": ""How can the quality of cookies set by third-party plugins be assured?""}, {""from"": ""gpt"", ""value"": ""To assure quality in cookies set by third-party plugins, developers should implement several practices: \n1. **Code Review**: Ensure that plugin code is adequately reviewed for best coding standards and security practices.\n2. **Testing**: Perform extensive testing to analyze the behavior of cookie interactions within multiple environments to uncover potential issues.\n3. **Documentation**: Encourage thorough documentation regarding cookie usage to guide developers and end-users on their functionalities.\n4. **User Feedback**: Gather user feedback to understand the practical impact of the cookies on user experience and adjust implementation accordingly.\n5. **Versioning Control**: Maintain version control on plugin updates to track changes and roll back if serious issues arise. Ensuring strong communication between plugin developers and the main application is necessary to guarantee the quality of third-party cookies.""}]",knowledge/php/limesurvey,1.0,train
"[{""from"": ""human"", ""value"": ""What are the potential risks associated with improper handling of cookies in web applications?""}, {""from"": ""gpt"", ""value"": ""Improper handling of cookies in web applications can lead to significant risks, including:\n1. **Security Vulnerabilities**: Failing to implement secure cookie attributes can expose cookies to theft or manipulation by attackers, potentially allowing for session hijacking and unauthorized access.\n2. **Data Privacy Breaches**: Cookies that retain sensitive user data beyond their intended lifespan can violate user privacy rights and lead to legal repercussions.\n3. **User Tracking Concerns**: Overly persistent cookies can lead to unwanted tracking of user behavior over time, generating distrust in the application and leaking user information.\n4. **Compliance Issues**: Non-compliance with privacy regulations may result in fines or sanctions, damaging an organization's reputation.\n5. **Poor User Experience**: Unmanaged cookies may lead to performance issues or unexpected application behavior, affecting user satisfaction.\nAddressing these risks through proper cookie management is crucial for ensuring the safety and integrity of web applications.""}]",knowledge/php/limesurvey,1.0,train
"[{""from"": ""human"", ""value"": ""What actions should developers take to prevent security vulnerabilities related to cookies?""}, {""from"": ""gpt"", ""value"": ""To prevent security vulnerabilities related to cookies, developers should take the following actions:\n1. **Set Secure Flags**: Use the Secure attribute to ensure that cookies are only transmitted over HTTPS connections.\n2. **Use HttpOnly Attribute**: Apply the HttpOnly flag to cookies to prevent client-side scripts from accessing them.\n3. **Implement SameSite Attribute**: Enable the SameSite attribute to help prevent CSRF attacks by controlling how cookies are sent through cross-origin requests.\n4. **Regular Audits**: Conduct regular audits of cookie implementation to identify and mitigate potential security risks.\n5. **User Session Management**: Implement short session durations with automatic timeouts to reduce the lifespan of cookies and limit exposure risk.\nBy integrating these practices, developers can enhance the overall security posture of their web applications significantly.""}]",knowledge/php/limesurvey,1.0,train
"[{""from"": ""human"", ""value"": ""What factors should be considered when setting a long expiration time for cookies?""}, {""from"": ""gpt"", ""value"": ""When setting a long expiration time for cookies, several factors should be carefully considered:\n1. **User Privacy**: Longer expiration times carry a higher risk of user tracking and potential data breaches, necessitating transparency and user consent.\n2. **Security Risks**: Prolonged lifecycle increases the risk of cookie theft or hijacking, urging the implementation of secure attributes.\n3. **User Behavior Changes**: User preferences and behaviors may shift over time; a long expiration may lead to the collection of outdated data.\n4. **Regulatory Compliance**: Ensure alignment with privacy laws and regulations that may enforce stricter cookie retention policies.\n5. **Impact on Performance**: A significant number of long-lived cookies may lead to bloated user profiles and potentially impact performance; thus, it\u2019s vital to periodically review cookie relevance.\nBy carefully weighing these factors, developers can implement more effective cookie management strategies.""}]",knowledge/php/limesurvey,1.0,train
