conversations,source,score,split
"[{""from"": ""human"", ""value"": ""What should you do before exporting a complex survey in LimeSurvey?""}, {""from"": ""gpt"", ""value"": ""Before exporting a complex survey in LimeSurvey, it is recommended to back up your work. This ensures that all data and settings associated with the survey are preserved. In addition, you may wish to export the survey for further editing in spreadsheet software or for offline distribution, where printed copies can be filled out by respondents.""}]",knowledge/php/limesurvey,1.0,train
"[{""from"": ""human"", ""value"": ""What are the two primary ways to export a survey in LimeSurvey?""}, {""from"": ""gpt"", ""value"": ""The two primary ways to export a survey in LimeSurvey include exporting the survey structure and exporting the complete survey archive. The survey structure can be exported as an XML file (.lss), which contains all the groups, questions, and conditions. The survey archive option creates a comprehensive backup, including responses and participant data, in a .zip file.""}]",knowledge/php/limesurvey,1.0,train
"[{""from"": ""human"", ""value"": ""What types of export options are available under the 'Display/Export' menu in LimeSurvey?""}, {""from"": ""gpt"", ""value"": ""The export options available under the 'Display/Export' menu in LimeSurvey include:\n1. Survey structure (.lss) - exports all survey components in XML format.\n2. Survey archive (.lsa) - a comprehensive backup including responses.\n3. queXML format (*.xml) - for offline surveys, but may have limitations on question types.\n4. queXML PDF export - allows for PDF creation within the software.\n5. Tab-separated-values format (*.txt) - for bulk editing in spreadsheet software.\n6. Printable survey (*.html) - generates a survey in HTML format suitable for printing.""}]",knowledge/php/limesurvey,1.0,train
"[{""from"": ""human"", ""value"": ""What is the purpose of exporting the survey structure (.lss) in LimeSurvey?""}, {""from"": ""gpt"", ""value"": ""Exporting the survey structure as a .lss file serves the purpose of creating a backup of the survey's design, including groups, questions, answers, and conditions. This XML file can later be utilized for importing the survey into another LimeSurvey instance. However, it is important to note that this file does not include any collected response data.""}]",knowledge/php/limesurvey,1.0,train
"[{""from"": ""human"", ""value"": ""How does the survey archive (.lsa) export function differ from the survey structure (.lss) export?""}, {""from"": ""gpt"", ""value"": ""The survey archive (.lsa) export function differs from the survey structure (.lss) export in terms of data inclusion. The .lsa export creates a complete backup that includes not only the survey structure but also all collected responses and participant data. This makes it ideal for archiving purposes, allowing users to re-import the survey and its data fully into LimeSurvey, while the .lss file only contains the structural data.""}]",knowledge/php/limesurvey,1.0,train
"[{""from"": ""human"", ""value"": ""What limitations are associated with exporting a questionnaire in queXML format?""}, {""from"": ""gpt"", ""value"": ""Exporting a questionnaire in queXML format has several limitations. Notably, it cannot export conditions or all types of questions supported by LimeSurvey. It is primarily designed for creating printable PDFs of questionnaires, but if a survey contains unsupported conditions or question types, those will not be included in the export, potentially leading to incomplete surveys when printed or processed.""}]",knowledge/php/limesurvey,1.0,train
"[{""from"": ""human"", ""value"": ""Can you describe the advantages of using the queXML PDF export option in LimeSurvey?""}, {""from"": ""gpt"", ""value"": ""The queXML PDF export option in LimeSurvey offers multiple advantages. First, it allows survey administrators to customize the PDF document before exporting, enhancing control over the final output. Additionally, it simplifies the process of creating printable surveys suitable for respondents, ensuring clarity and usability. Furthermore, this method integrates the queXML capabilities, facilitating easier processing of filled-out questionnaires with compatible software, like queXF.""}]",knowledge/php/limesurvey,1.0,train
"[{""from"": ""human"", ""value"": ""What features does the tab-separated-values format export provide for survey editing?""}, {""from"": ""gpt"", ""value"": ""The tab-separated-values format export provides a suite of features that simplify survey editing, particularly in spreadsheet software. It allows for bulk editing capabilities such as find-replace functions, reordering of survey items, and testing functionalities (like temporarily disabling mandatory criteria). This format eliminates the reliance on SGQA codes, making it easier to manage large surveys efficiently.""}]",knowledge/php/limesurvey,1.0,train
"[{""from"": ""human"", ""value"": ""What are the potential uses of exporting a printable survey in LimeSurvey?""}, {""from"": ""gpt"", ""value"": ""Exporting a printable survey in LimeSurvey is useful in various contexts. It allows for the distribution of surveys to participants who may not have internet access, facilitating offline data collection. The printed surveys can be used to collect responses physically, which can later be entered into LimeSurvey through the data entry function. Additionally, this export enables a quick review or presentation of the survey's structure before online deployment.""}]",knowledge/php/limesurvey,1.0,train
"[{""from"": ""human"", ""value"": ""What considerations should you keep in mind when exporting a printable survey in LimeSurvey?""}, {""from"": ""gpt"", ""value"": ""When exporting a printable survey in LimeSurvey, it is essential to consider that the output will not include any dynamic logic or ExpressionScript functionalities. The survey will be a static version without branching paths or validations, which may lead to incomplete data collection if participants encounter conditions not represented in the printable format. It's crucial to ensure that respondents understand how to fill out the printed survey accurately.""}]",knowledge/php/limesurvey,1.0,train
"[{""from"": ""human"", ""value"": ""How can survey creators prepare for exporting an archive of their survey in LimeSurvey?""}, {""from"": ""gpt"", ""value"": ""Survey creators can prepare for exporting an archive of their survey in LimeSurvey by reviewing the survey for any last-minute changes or content adjustments. They should confirm that all participant settings are configured correctly and ensure that the response data they want included is collected beforehand. This concludes preparing to zip the survey structure, responses, and participant data together for a comprehensive backup, which will facilitate easy restoration or later analysis of the survey.""}]",knowledge/php/limesurvey,1.0,train
"[{""from"": ""human"", ""value"": ""What steps should you take if your survey uses a custom template before exporting it?""}, {""from"": ""gpt"", ""value"": ""If your survey utilizes a custom template before exporting, it is critical to export that template separately. Although the survey itself can be imported on a new server, any custom template referenced will not transfer automatically. To ensure everything works perfectly, go to the template editor on the original server, export the template as a zip file, and then import this template on the new server after completing the survey export.""}]",knowledge/php/limesurvey,1.0,train
"[{""from"": ""human"", ""value"": ""What does the queXML format support for question types when exporting?""}, {""from"": ""gpt"", ""value"": ""The queXML format supports various question types when exporting surveys in LimeSurvey, including:\n1. Arrays - Various choices and formats (5 point, 10 point, yes/uncertain/no options).\n2. Mask questions - Including date and gender drop-down lists, numerical inputs, and yes/no radio buttons.\n3. Multiple choice questions - Options such as multiple options checkboxes.\n4. Single choice questions - Drop-down lists and radio buttons.\n5. Text questions - Various formats from short to long text fields.""}]",knowledge/php/limesurvey,1.0,train
"[{""from"": ""human"", ""value"": ""Can you explain how to download and utilize the exported .zip files from the export options?""}, {""from"": ""gpt"", ""value"": ""To download and utilize exported .zip files from the export options in LimeSurvey, follow these steps:\n1. Choose the desired export option from the 'Display/Export' menu (e.g., Survey archive, queXML format).\n2. Click to initiate the export, and the system will compile the survey and download it as a .zip file.\n3. Once downloaded, extract the .zip file using a file extraction tool.\n4. Inside the extracted folder, access relevant files such as XML structure files or PDFs for further use, whether for backup, offline collection, or assessment.""}]",knowledge/php/limesurvey,1.0,train
"[{""from"": ""human"", ""value"": ""What precautions should be taken when exporting survey response data related to file upload questions?""}, {""from"": ""gpt"", ""value"": ""When exporting survey response data related to file upload questions, it is important to be aware that this data is currently not exported by LimeSurvey. Therefore, creators should ensure that alternative methods of storing or backing up responses are in place, such as manual backups of uploaded files or ensuring aligned data management practices. This oversight will prevent valuable response data from being lost during the export process.""}]",knowledge/php/limesurvey,1.0,train
"[{""from"": ""human"", ""value"": ""What is the typical workflow for a survey creator using LimeSurvey to export their completed survey?""}, {""from"": ""gpt"", ""value"": ""The typical workflow for a survey creator using LimeSurvey to export a completed survey involves several steps:\n1. Preparation: Review the survey's structure, ensuring that all questions, logic, and settings are correctly configured.\n2. Back-up: Perform a backup of the current survey to retain existing configurations and data.\n3. Choose Export Option: Navigate to the 'Display/Export' menu and select the desired export format based on needs (e.g., .lss for structure, .lsa for archive).\n4. Execute Export: Click to initiate the export, leading to the generation of the .zip or .xml file.\n5. Download & Review: Download the exported file and review its contents to ensure it meets the intended backup or transfer requirements.""}]",knowledge/php/limesurvey,1.0,train
"[{""from"": ""human"", ""value"": ""What additional resources should survey creators refer to when utilizing the export features in LimeSurvey?""}, {""from"": ""gpt"", ""value"": ""Survey creators utilizing export features in LimeSurvey should refer to the official LimeSurvey documentation, particularly the sections detailing specific export formats (queXML, tab-separated-values, and printable formats) to understand their functionalities, limitations, and best practices. Additionally, exploring community forums, tutorials, and guides related to survey exports can provide further insights and tips to enhance the survey management process.""}]",knowledge/php/limesurvey,1.0,train
