conversations,source,score,split
"[{""from"": ""human"", ""value"": ""What are the main steps to test a survey in LimeSurvey?""}, {""from"": ""gpt"", ""value"": ""To test a survey in LimeSurvey, you should follow these main steps:\n1. **Preview the Survey**: Use the 'Preview' feature, which allows you to interact with the survey as a respondent would. This helps identify any issues in the flow or questions.\n2. **Test Questions**: Answer the questions to ensure they function as expected (e.g., branching logic, validation rules).\n3. **Check Accessibility**: Make sure the survey is accessible across different devices and browsers.\n4. **Gather Feedback**: If possible, invite a few users to test it and provide feedback on usability and clarity.\n5. **Review Results**: After running initial tests, analyze the results to confirm that data is being collected correctly.""}]",knowledge/php/limesurvey,1.0,train
"[{""from"": ""human"", ""value"": ""How can I activate a survey in LimeSurvey?""}, {""from"": ""gpt"", ""value"": ""To activate a survey in LimeSurvey, follow these steps:\n1. **Login to LimeSurvey Admin Panel**: Access your LimeSurvey instance and login with appropriate credentials.\n2. **Select the Survey**: Navigate to 'Surveys' and select the survey you want to activate from your list of created surveys.\n3. **Activate the Survey**: Locate the 'Activate this survey' button on the survey management page and click it. This may also involve setting a start/end date or enabling other conditions for survey participation.\n4. **Notify Participants**: After activation, you can distribute the survey link to potential participants.""}]",knowledge/php/limesurvey,1.0,train
"[{""from"": ""human"", ""value"": ""What considerations should I keep in mind when running a survey safely?""}, {""from"": ""gpt"", ""value"": ""When running a survey safely in LimeSurvey, consider the following:\n1. **Data Privacy**: Only collect data that is essential and ensure it complies with applicable data protection regulations like GDPR. Implement an informed consent statement visible to respondents.\n2. **Secure Access**: Use strong passwords and administrative controls to restrict access to sensitive survey data.\n3. **Test for Vulnerabilities**: Conduct security testing on your survey links to prevent vulnerabilities such as SQL injection or cross-site scripting (XSS).\n4. **Anonymity**: Offer respondents the option to submit their responses anonymously if their feedback should not be traceable.""}]",knowledge/php/limesurvey,1.0,train
"[{""from"": ""human"", ""value"": ""How can I browse survey results in LimeSurvey?""}, {""from"": ""gpt"", ""value"": ""To browse survey results in LimeSurvey:\n1. **Navigate to Results**: In the LimeSurvey admin panel, click on the 'Responses & Statistics' section.\n2. **Select 'Browse Responses'**: From this section, click on 'Responses summary' to view the collected data.\n3. **Filter Data**: Utilize available filtering options to narrow down results based on specific criteria if needed. \n4. **Export Results**: You can also choose to export data to analyze further in software like Excel or statistical tools.""}]",knowledge/php/limesurvey,1.0,train
"[{""from"": ""human"", ""value"": ""What are the steps to close a survey in LimeSurvey?""}, {""from"": ""gpt"", ""value"": ""To close a survey in LimeSurvey, follow these steps:\n1. **Access the Survey Dashboard**: Log into the LimeSurvey admin panel and navigate to the survey you wish to close.\n2. **Select 'Close Survey' Option**: You should find an option labeled 'Close this survey' on the survey management page. Click it to restrict any further responses.\n3. **Confirmation**: Follow any confirmation prompts required to ensure the survey is indeed closed.\n4. **Analyze Final Results**: After closing, you can review and analyze the complete dataset prior to any export or deletion processes.""}]",knowledge/php/limesurvey,1.0,train
"[{""from"": ""human"", ""value"": ""Can you explain how to change an active survey in LimeSurvey?""}, {""from"": ""gpt"", ""value"": ""To change an active survey in LimeSurvey:\n1. **Open Survey Management**: First, log in to the LimeSurvey admin panel and select the survey.\n2. **Edit the Survey**: Click on the 'Edit' option which allows you to modify questions, settings, or survey logic.\n3. **Save Changes**: Once you have made the necessary adjustments, make sure to save your changes. \n4. **Update Active Status**: Depending on changes, you might need to reactivate the survey or inform users about modifications.""}]",knowledge/php/limesurvey,1.0,train
"[{""from"": ""human"", ""value"": ""What does iterating a survey entail in LimeSurvey?""}, {""from"": ""gpt"", ""value"": ""Iterating a survey in LimeSurvey involves refining and adjusting your survey based on previous results or feedback. This includes:\n1. **Reviewing Responses**: Analyze collected data to identify areas of improvement in question clarity or relevance.\n2. **Adjusting Content**: Modify questions or answer choices to ensure they achieve the desired response quality.\n3. **Testing New Changes**: Before officially launching the updated survey, use the 'Preview' feature to test new questions or structures.\n4. **Re-activating**: Once changes are satisfactory and tested, re-activate the survey to collect new responses.""}]",knowledge/php/limesurvey,1.0,train
"[{""from"": ""human"", ""value"": ""How can data entry be managed in LimeSurvey?""}, {""from"": ""gpt"", ""value"": ""Data entry in LimeSurvey can be managed effectively by following these steps:\n1. **Manual Data Entry**: For surveys that require participant input directly on the platform, you can input responses manually using the 'Data Entry' function from the admin panel.\n2. **Data Importing**: Import existing data through CSV or other compatible formats to pre-load responses into your surveys.\n3. **Audit Trail**: Keep an audit trail of responses entered and adjust as necessary to maintain data accuracy.\n4. **Review Entries**: Regularly review entered data to spot any inconsistencies or issues that may arise during collection.""}]",knowledge/php/limesurvey,1.0,train
"[{""from"": ""human"", ""value"": ""What statistics can I generate on survey data in LimeSurvey?""}, {""from"": ""gpt"", ""value"": ""LimeSurvey offers a variety of statistical analysis functionalities that can include:\n1. **Descriptive Statistics**: Generate summary statistics such as mean, median, mode, and standard deviation for quantitative questions.\n2. **Frequency Distribution**: View how often each response option was selected for categorical questions.\n3. **Cross-tabulation**: Analyze relationships between different questions using tables that display the frequency of responses in relation to one another.\n4. **Export Options**: Finally, results can be exported to tools like Excel for more detailed statistical analysis or reporting.""}]",knowledge/php/limesurvey,1.0,train
"[{""from"": ""human"", ""value"": ""How do I export results from LimeSurvey?""}, {""from"": ""gpt"", ""value"": ""To export results from LimeSurvey:\n1. **Access the Statistics Section**: In your survey's management dashboard, navigate to 'Responses & Statistics'.\n2. **Select Export Options**: Choose the desired export format (e.g., CSV, PDF) by clicking on the export option.\n3. **Configure Export Settings**: Adjust any settings related to exported data, such as including all responses or filtered subsets.\n4. **Download File**: Once the export is configured, you can download the file containing your survey results.""}]",knowledge/php/limesurvey,1.0,train
"[{""from"": ""human"", ""value"": ""What is the purpose of exporting a survey structure in LimeSurvey?""}, {""from"": ""gpt"", ""value"": ""Exporting a survey structure in LimeSurvey allows you to create a backup or share your survey design with others. The main purposes include:\n1. **Backup**: Safeguarding your survey against potential loss by creating an external copy of the survey structure.\n2. **Collaboration**: Sharing survey designs among team members or stakeholders for collaborative editing and reviews.\n3. **Editing in Bulk**: Making structural changes offline and then re-importing changes back into LimeSurvey when needed.\n4. **Template Creation**: Developing reusable templates for future surveys based on existing structures, making the survey development process much more efficient.""}]",knowledge/php/limesurvey,1.0,train
"[{""from"": ""human"", ""value"": ""Can you explain the Tab Separated Value survey structure export option?""}, {""from"": ""gpt"", ""value"": ""The Tab Separated Value (TSV) survey structure export option in LimeSurvey enables users to export survey question and answer data in a plain text format where columns are separated by tabs. This is particularly useful for:\n1. **Interoperability**: TSV format is widely supported, allowing for easy import into programs like Excel or other data processing tools.\n2. **Simplicity**: The simplicity of the TSV format makes it easy to read and manually adjust if necessary.\n3. **Data Portability**: It enables the transfer of survey structures between different LimeSurvey instances or for backup purposes.\n4. **Customization**: Users can edit or refine their survey structure more freely outside the LimeSurvey interface.""}]",knowledge/php/limesurvey,1.0,train
"[{""from"": ""human"", ""value"": ""How does the QueXML PDF export work in LimeSurvey?""}, {""from"": ""gpt"", ""value"": ""The QueXML PDF export feature in LimeSurvey allows users to export their survey contents to a PDF format utilizing the QueXML standard. This process is beneficial as it:\n1. **Ensures Formatting**: Maintains the layout and formatting of survey questions, which is essential for printed materials.\n2. **Creates Professional Documents**: Produces professional-looking survey documentation suitable for distribution to stakeholders or for offline use.\n3. **Customizable**: Users can customize the layout and contents of the PDF to align with their branding.\n4. **Standard Compliance**: QueXML is a standardized format that supports various data structures, ensuring compatibility with other applications and systems.""}]",knowledge/php/limesurvey,1.0,train
"[{""from"": ""human"", ""value"": ""What is the Quick-translation feature in LimeSurvey?""}, {""from"": ""gpt"", ""value"": ""The Quick-translation feature in LimeSurvey facilitates the translation of surveys into different languages. Its primary benefits include:\n1. **Efficiency**: Provides a streamlined process for translating survey content, minimizing time spent on manual translations for each question.\n2. **Language Support**: Enables multi-language support directly within a single survey.\n3. **User-Friendly Interface**: The interface typically allows users to view original and translated versions side-by-side, making it easier to ensure accuracy.\n4. **Customization**: Users can fine-tune translations based on cultural or regional nuances to better cater to diverse respondent groups.""}]",knowledge/php/limesurvey,1.0,train
