conversations,source,score,split
"[{""from"": ""human"", ""value"": ""What are the main steps to add questions in LimeSurvey?""}, {""from"": ""gpt"", ""value"": ""The main steps to add questions in LimeSurvey involve:\n1. **Creating Question Groups**: Before adding questions, ensure that you have created appropriate question groups. This can be done via the LimeSurvey interface under the survey structure menu.\n2. **Accessing Question Group**: Navigate to the specific question group where you want to add questions.\n3. **Adding Questions**: You can add questions either through the survey structure menu or by using the 'add question' quick action button found in the question group view. \n4. **Providing Details**: For each question, you'll need to provide a question code, the actual question text, and optional help text, along with various general options. \nEach of these steps ensures that the questions are organized, easily identifiable, and adequately designed for survey participants.""}]",knowledge/php/limesurvey,1.0,train
"[{""from"": ""human"", ""value"": ""What is a question code in LimeSurvey and why is it important?""}, {""from"": ""gpt"", ""value"": ""A question code in LimeSurvey represents the ID, number, or code for a specific question used for quick identification. Its importance lies in several factors:\n1. **Unique Identification**: The question code must be unique across the same survey, which helps in managing questions efficiently. \n2. **Data Export**: When exporting data to analytics tools like SPSS or R, the question code becomes the value label, affecting data representation and analysis. \n3. **Assessment Features**: Unique codes are especially critical if you wish to use LimeSurvey's assessments feature or ExpressionScript for logical conditions in your surveys. \n4. **Legacy Support**: LimeSurvey supports legacy code values, but to avoid confusion, the system color-codes questions with duplicate codes in the Show Logic feature to prompt users for adjustments.""}]",knowledge/php/limesurvey,1.0,train
"[{""from"": ""human"", ""value"": ""What types of question settings can be changed in the General options tab?""}, {""from"": ""gpt"", ""value"": ""In LimeSurvey's General options tab, several key settings can be adjusted:\n1. **Question Type**: This determines what type of response the survey permits (e.g., multiple choice, text response).\n2. **Question Group**: Users can change the category under which the question falls by selecting from a dropdown list.\n3. **Validation**: This allows for the use of regular expressions to validate answers provided by respondents.\n4. **Mandatory Setting**: Users can set questions as mandatory, ensuring survey participants must answer before proceeding.\n5. **Condition**: Advanced logic can be applied via an ExpressionScript equation, displaying the question only if certain conditions are met.\n6. **Encryption**: Some question types allow for response data to be saved encrypted, enhancing security.\n7. **Save as Default and Clear Default Values**: These settings allow users to manage default question settings for new questions. \nEach of these settings plays a crucial role in collecting quality data tailored to the survey's goals.""}]",knowledge/php/limesurvey,1.0,train
"[{""from"": ""human"", ""value"": ""Can you explain how to import a question into a survey in LimeSurvey?""}, {""from"": ""gpt"", ""value"": ""To import a question into a survey in LimeSurvey, follow these steps:\n1. **Navigate to Structure Tab**: Open your survey and click on the 'Structure' tab.\n2. **Go to Create Question Page**: From the Create Question page, locate the 'Import a question' option at the top of the page.\n3. **Upload File**: Click 'Browse' to select the .lsq file (LimeSurvey question-type format) you wish to import.\n4. **Select Destination Group**: Choose the question group where you want to add the imported question.\n5. **Rename Option**: Decide whether to automatically rename the question code if it already exists. This is crucial to avoid conflicts but might lead to issues with advanced functionalities.\n6. **Resource Links**: Choose whether to convert resource links, often required for creating advanced question types. \n7. **Click Import**: Finally, press the 'Import' button. A summary will then be shown, confirming the successful import of the question. \nFollowing these steps accurately will ensure that questions are imported correctly into your survey infrastructure.""}]",knowledge/php/limesurvey,1.0,train
"[{""from"": ""human"", ""value"": ""What are the placeholders available for inserting participant information in questions?""}, {""from"": ""gpt"", ""value"": ""LimeSurvey allows the insertion of participant-specific information into questions using the following placeholders:\n1. **{TOKEN:FIRSTNAME}**: Inserts the participant's first name.\n2. **{TOKEN:LASTNAME}**: Inserts the participant's last name.\n3. **{TOKEN:EMAIL}**: Inserts the email address of the participant.\n4. **{TOKEN:ATTRIBUTE_1}**: Inserts the value from the first attribute field in the survey participant's table.\n5. **{TOKEN:ATTRIBUTE_2}**: Inserts the value from the second attribute field in the survey participant's table.\n\nTo utilize these placeholders, you simply type them exactly as listed in the question text, allowing for personalized and dynamic survey experiences. For example, a question could be phrased as: 'Hello {TOKEN:FIRSTNAME}. We sent an email to you using this address {TOKEN:EMAIL}.' This creates a more engaging interaction by addressing respondents by name and referencing their personal details.""}]",knowledge/php/limesurvey,1.0,train
"[{""from"": ""human"", ""value"": ""How can JavaScript be used for question customization in LimeSurvey?""}, {""from"": ""gpt"", ""value"": ""JavaScript can enhance question customization in LimeSurvey by allowing dynamic content changes based on user input. Here\u2019s how you can effectively use JavaScript in your questions:\n1. **Enable JavaScript**: Ensure that JavaScript usage is permitted within the global settings of your LimeSurvey installation. Disabling XSS filters may be necessary but consider the security implications.\n2. **Setting Up Your Question**: You can refer to participant information within your question text. For instance:\n```php\nHello {TOKEN:FIRSTNAME}. We sent an email to you using this address {TOKEN:EMAIL}. Is this correct?\nWhat do you as a {TOKEN:ATTRIBUTE_1} think about your\n<script type='text/javascript'>\n   var job='{TOKEN:ATTRIBUTE_1}';\n   if (job=='worker') {\n      document.write ('bosses');\n   } else {\n      document.write('workers');\n   }\n</script>?  \n```\n3. **Dynamic Manipulation**: The JavaScript code allows you to dynamically display content based on participant attributes. In this case, the response can vary based on the 'job' attribute.\n4. **Considerations**: Exercise caution when using JavaScript due to security risks. Ensure to document any changes made.""}]",knowledge/php/limesurvey,1.0,train
"[{""from"": ""human"", ""value"": ""What is the purpose of the LimeReplacementFields wizard in LimeSurvey?""}, {""from"": ""gpt"", ""value"": ""The LimeReplacementFields wizard provides users with an intuitive way to insert previous question or answer codes into current questions within the FCKeditor (WYSIWYG HTML editor).\n1. **Efficient Insertion**: By clicking on the 'lime between brackets' icon, users can easily select previous questions from a list, facilitating quick data insertion without needing to remember specific question codes.\n2. **Dynamic Responses**: This allows survey administrators to create tailored questions by referring to prior answers, making surveys more interactive and engaging.\n3. **User-Friendly**: Limiting the view to answers only from previous pages means respondents can see only relevant options, improving clarity and reducing confusion. \n4. **Important Note**: When deleting a reference to a {name} tag, users must select all characters from the opening bracket to the closing bracket and press delete; otherwise, the reference may reappear. \nOverall, the LimeReplacementFields wizard streamlines the process of creating dynamic survey questions, enhance user interaction and data relevance.""}]",knowledge/php/limesurvey,1.0,train
"[{""from"": ""human"", ""value"": ""How can CSS be utilized to style questions in LimeSurvey?""}, {""from"": ""gpt"", ""value"": ""In LimeSurvey, CSS can be applied to customize the layout and design of survey questions through the theme editor. Here\u2019s a quick guide:\n1. **Access Theme Editor**: Open the theme editor in LimeSurvey, where you can modify existing styles or create new CSS stylesheets.\n2. **Targeting Elements**: Write CSS rules to target specific elements of your survey questions. This may include adjusting font sizes, colors, padding, and margins of question text and input fields.\n   ```css\n   .question-class {\n       font-size: 16px;\n       color: #333;\n   }\n   .question-text {\n       margin-bottom: 10px;\n   }\n   ```\n3. **Preview Changes**: Use the built-in preview in the theme editor to see how your CSS styles affect the survey's appearance before finalizing and saving changes.\n4. **Considerations for Responsiveness**: When styling, make sure to consider how the survey will appear on different devices (desktop, tablet, mobile) to ensure a consistent user experience.\nBy utilizing CSS in the theme editor, survey administrators can ensure their questions are visually appealing and aligned with branding or aesthetic preferences.""}]",knowledge/php/limesurvey,1.0,train
