conversations,source,score,split
"[{""from"": ""human"", ""value"": ""What are the steps to create a question group in LimeSurvey?""}, {""from"": ""gpt"", ""value"": ""Creating a question group in LimeSurvey involves the following steps:\n\n1. **Access the Survey Structure**: Navigate to the survey structure tab of your survey.\n2. **Add Question Group**: Click on the '+Add question group' button to initiate the process.\n3. **Fill Required Fields**: An 'Add question group' panel will open, where you need to fill out the required fields, including:\n   - **Title**: Enter a name for the question group.\n   - **Description**: This is optional, but you can provide explanatory notes that will appear with the survey.\n   - **Randomization Group**: If you want the questions to be randomized, enter a unique string here.\n   - **Relevance Equation**: Specify conditions to make the group visible only under certain circumstances.\n4. **Finalize the Group**: After entering the necessary information, save or confirm your entries to complete the creation of the question group.\n\nThis process helps in organizing your survey efficiently, keeping related questions together.""}]",knowledge/php/limesurvey,1.0,train
"[{""from"": ""human"", ""value"": ""What is the purpose of the randomization group in LimeSurvey question groups?""}, {""from"": ""gpt"", ""value"": ""The randomization group in LimeSurvey serves the purpose of allowing specific question groups to appear in a randomized order during the survey. When you enter a string in the 'Randomization group' field for a question group, you must ensure that all related groups share the same string. This way, when the survey is presented to participants, the questions within those groups will be randomly switched, enhancing the randomness of the response data. It is important to note that only questions within the same group are randomized and that this feature can help reduce response bias in surveys.""}]",knowledge/php/limesurvey,1.0,train
"[{""from"": ""human"", ""value"": ""How does the relevance equation work in LimeSurvey for question groups?""}, {""from"": ""gpt"", ""value"": ""The relevance equation in LimeSurvey allows for conditional display of question groups based on responses given earlier in the survey. By using an expression, you can set specific conditions that determine when a question group should be visible to respondents. For instance, if you ask how many children a respondent has (let's say the question is named 'numKids'), you can utilize a relevance equation like 'numKids == 1' to ensure that a follow-up question group only appears if the respondent indicates they have one child.\n\nThis feature is particularly useful for creating dynamic surveys that adapt to participant responses, making the survey experience more personalized and relevant. It can also help manage complex surveys where only certain segments apply to specific demographics.""}]",knowledge/php/limesurvey,1.0,train
"[{""from"": ""human"", ""value"": ""Can you provide a code snippet showing how to implement a simple relevance equation in LimeSurvey?""}, {""from"": ""gpt"", ""value"": ""Certainly! In LimeSurvey, relevance equations are created using the ExpressionScript syntax. Here\u2019s a simple example:\n\nLet's assume you have a question (Q1) asking for the number of children with the question code 'numKids'. To only show a question group (Group B) if a participant indicates they have one child, you would set the relevance equation for Group B as follows:\n\n```plaintext\n(numKids == 1)\n```\n\nThis equation means that Group B will only be displayed if the respondent's answer to 'numKids' equals 1. In the LimeSurvey interface, when setting up the group, you would enter this expression in the 'Relevance equation' field, ensuring that the survey dynamically adjusts to the participant's input.""}]",knowledge/php/limesurvey,1.0,train
"[{""from"": ""human"", ""value"": ""What are the main features available in the question group toolbar of LimeSurvey?""}, {""from"": ""gpt"", ""value"": ""The question group toolbar in LimeSurvey provides essential functionalities to manage and interact with your survey groups effectively. The main features available include:\n\n1. **Display/Export**: This allows you to export the entire survey in various formats.\n2. **Survey Participants**: Redirects you to the survey participants table, providing oversight of who is taking part in the survey.\n3. **Responses**: Offers access to the responses table, visible only if the survey is active, allowing you to review submitted answers.\n4. **Import a Group**: Lets you add new question groups by importing .lsg files that were previously exported, allowing for reuse of content in different surveys.\n\nThese features aim to simplify your survey management experience, making it easier to create, modify, and analyze survey data.""}]",knowledge/php/limesurvey,1.0,train
"[{""from"": ""human"", ""value"": ""How can a user preview a question group in LimeSurvey?""}, {""from"": ""gpt"", ""value"": ""To preview a question group in LimeSurvey, users can follow these steps:\n1. **Access the Survey Structure**: Navigate to the 'Structure' tab of the survey.\n2. **Select Question Group**: Click on the desired question group you wish to preview.\n3. **Preview Option**: Look for the 'preview question group' button, which will allow you to view how that specific group will appear to respondents.\n\nAdditionally, users have options to preview the question group from different sections like the question group panel or the question panel itself. This feature allows survey creators to see how the questions will be presented with respect to the relevance conditions and formatting settings before fully deploying the survey.""}]",knowledge/php/limesurvey,1.0,train
"[{""from"": ""human"", ""value"": ""What should be noted when using relevance equations in LimeSurvey?""}, {""from"": ""gpt"", ""value"": ""When using relevance equations in LimeSurvey, it's important to keep the following considerations in mind:\n1. **Syntax Awareness**: Proper syntax is crucial to avoid errors. Common mistakes can lead to the equation failing to function correctly, so always double-check the expression you enter.\n2. **Testing**: After setting relevance equations, thoroughly test the survey to ensure that the correct groups and questions display or hide as intended based on participant responses.\n3. **Dynamic Content**: Remember that relevance equations can change the flow of your survey, which means respondents might experience different paths depending on their answers.\n4. **Check Logic**: LimeSurvey provides tools for checking the logic of your question groups, which can help identify potential errors in your relevance equations. Using this feature can prevent critical oversight.\nBy being mindful of these factors, users can effectively leverage relevance equations to enhance the customization and responsiveness of their surveys.""}]",knowledge/php/limesurvey,1.0,train
"[{""from"": ""human"", ""value"": ""What options do you have for reordering question groups in LimeSurvey?""}, {""from"": ""gpt"", ""value"": ""In LimeSurvey, you have the option to reorder question groups directly within the survey structure. The method typically includes:\n1. **Drag and Drop Interface**: Simply drag the question group to your desired position within the survey structure panel. This intuitive method allows for quick adjustments to the order in which groups appear to respondents.\n2. **Group Reordering Feature**: Use the specific group reordering functionality available in the survey settings to precisely arrange the sequence of question groups.\n\nThis ability to reorder question groups is essential for structuring the flow of your survey effectively, as it ensures that questions are presented in a logical sequence.""}]",knowledge/php/limesurvey,1.0,train
"[{""from"": ""human"", ""value"": ""Can you give an example of how question groups might be customized using relevance equations in LimeSurvey?""}, {""from"": ""gpt"", ""value"": ""Certainly! An example of customizing question groups using relevance equations in LimeSurvey could be a survey aimed at understanding family dynamics. \n\nImagine you have the following situation:\n- A question (Q1) asks the respondent how many children they have, and if they respond with '1', you'd want to show them a specific follow-up group (Group A) asking about their experience with that child. \n- For respondents with '2 or more', you'd want to display a different follow-up group (Group B) with questions pertaining to having multiple children.\n\nThe relevance equations for the groups would be:\n- For Group A: `(numKids == 1)`  \n- For Group B: `(numKids > 1)`  \n\nThese equations ensure that depending on the response to the initial question regarding the number of children, the relevant set of questions is presented, tailoring the survey experience based on the respondent's situation.""}]",knowledge/php/limesurvey,1.0,train
"[{""from"": ""human"", ""value"": ""What are some potential issues when using complex relevance equations in LimeSurvey?""}, {""from"": ""gpt"", ""value"": ""When utilizing complex relevance equations in LimeSurvey, potential issues may arise, such as:\n1. **Syntax Errors**: Complex equations increase the likelihood of introducing syntax errors, which can lead to questions or groups not showing as intended. Debugging these errors can sometimes be challenging.\n2. **Performance Impact**: If too many conditions or overly complex expressions are used, they might slow down the survey's performance, particularly for respondents on slower connections or devices.\n3. **Logic Confusion**: Respondents may become confused if they encounter unexpected question appearances or disappearances based on prior responses, potentially compromising the quality of the data collected.\n4. **Testing Difficulty**: As complexity grows, testing each possible path within the survey becomes more cumbersome. It\u2019s crucial to plan tests carefully to ensure each condition is checked.\n5. **Maintenance Challenges**: Overly complicated equations can make future updates or changes more difficult, as understanding the logic behind them may require substantial time. \n\nTo mitigate these issues, consider simplifying expressions when possible, and documenting complex logic clearly for future reference.""}]",knowledge/php/limesurvey,1.0,train
