conversations,source,score,split
"[{""from"": ""human"", ""value"": ""What is the significance of the GNU General Public License (GPL) for software?""}, {""from"": ""gpt"", ""value"": ""The GNU General Public License (GPL) is a widely used free software license that guarantees end users the freedom to run, study, share, and modify the software. The significance of GPL lies in its emphasis on user freedom and software collaboration. Under the GPL, software developers must ensure that any modified versions of the code remain free and open for use by others. This fosters a community-driven approach to software development, where improvements can be shared, and it prohibits proprietary modifications that could restrict user rights.""}]",knowledge/php/limesurvey,1.0,train
"[{""from"": ""human"", ""value"": ""What conditions does the GPL impose on software distribution?""}, {""from"": ""gpt"", ""value"": ""The GPL imposes several key conditions on software distribution to ensure that the software remains free and open:\n1. **Source Code Availability**: The source code must be made available to the users when the software is distributed. This allows users to study and modify the software.\n2. **Same License for Derivative Works**: Any derivative work must also be distributed under the same GPL license, ensuring that modified versions remain free.\n3. **No Warranty Disclaimer**: The software is provided 'as is', without any warranty. Users must acknowledge that there is no guarantee of merchantability or fitness for a particular purpose.\n4. **Attribution to Original Author**: When redistributing, proper credit must be given to the original authors of the software.""}]",knowledge/php/limesurvey,1.0,train
"[{""from"": ""human"", ""value"": ""Can a developer distribute their software under the GPL and still charge a fee?""}, {""from"": ""gpt"", ""value"": ""Yes, a developer can distribute their software under the GPL and still charge a fee for it. The GPL allows for commercial distribution, meaning developers can sell copies of the software. However, they must adhere to the terms of the GPL, which requires them to provide access to the source code and keep the same license for any derived works. Users who receive the software for a fee still retain their rights to modify and redistribute it.""}]",knowledge/php/limesurvey,1.0,train
"[{""from"": ""human"", ""value"": ""What does it mean for software to be distributed without any warranty under the GPL?""}, {""from"": ""gpt"", ""value"": ""When software is distributed without any warranty under the GPL, it means that the developers do not take responsibility for any issues that may arise from using the software. Users are made aware that they are using the software at their own risk, and they cannot hold the developers liable for problems such as bugs, data loss, or security vulnerabilities. This disclaimer protects the developers and ensures that users understand the potential limitations of the software.""}]",knowledge/php/limesurvey,1.0,train
"[{""from"": ""human"", ""value"": ""Where can one find more details about the GNU General Public License?""}, {""from"": ""gpt"", ""value"": ""More details about the GNU General Public License can be found on the official GNU website at the following URL: http://www.gnu.org/licenses/gpl.html. This site provides the text of the GPL, information about its principles, historical context, and FAQs to help users understand their rights and obligations under the license.""}]",knowledge/php/limesurvey,1.0,train
"[{""from"": ""human"", ""value"": ""What implications does the GPL have on collaboration in software development?""}, {""from"": ""gpt"", ""value"": ""The implications of the GPL on collaboration in software development are significant:\n1. **Encourages Sharing**: By legally requiring share-alike terms, the GPL encourages developers to share their changes and improvements with the community. This leads to faster innovation and better software.\n2. **Community Engagement**: The GPL fosters a collaborative environment where developers can contribute to a project, leading to diverse contributions from various individuals and organizations.\n3. **Protection of Freedom**: It ensures that every user can access the source code, which promotes transparency and user empowerment. As long as developers follow the GPL, they can work together without fearing proprietary claims that restrict access.\n4. **Innovation through Feedback**: Open collaboration allows for peer reviews and collective problem-solving, resulting in higher quality software and more robust security through community scrutiny.""}]",knowledge/php/limesurvey,1.0,train
"[{""from"": ""human"", ""value"": ""What are the two versions of the GPL mentioned in the document?""}, {""from"": ""gpt"", ""value"": ""The document mentions GNU General Public License Version 2 and later versions as published by the Free Software Foundation. Version 2 was a significant update to the GPL that included more explicit protection for users' freedoms, while later versions, including Version 3, have added further protections against hardware restrictions and certain legal issues.""}]",knowledge/php/limesurvey,1.0,train
"[{""from"": ""human"", ""value"": ""How does the GPL influence the commercialization of software?""}, {""from"": ""gpt"", ""value"": ""The GPL influences the commercialization of software by allowing developers to sell the software while ensuring it remains free and open-source. This duality enables businesses to create revenue around support, customization, and consulting services rather than through proprietary license sales. Companies can sell software products under the GPL, but they must also provide access to the source code and allow users to modify it. This fosters a competitive environment where proprietary software may struggle due to transparency and community-driven improvements in GPL-licensed software.""}]",knowledge/php/limesurvey,1.0,train
"[{""from"": ""human"", ""value"": ""What does 'FITNESS FOR A PARTICULAR PURPOSE' mean in the context of the GPL?""}, {""from"": ""gpt"", ""value"": ""'FITNESS FOR A PARTICULAR PURPOSE' in the context of the GPL refers to a common legal term that implies the software is not guaranteed to meet any specific needs or requirements of the user. This clause is a standard part of the 'no warranty' disclaimer that protects the developers from liability if the software fails to perform as expected, lacks necessary features, or has unforeseen flaws. Users are advised to evaluate and test the software to determine its suitability for their own purposes.""}]",knowledge/php/limesurvey,1.0,train
"[{""from"": ""human"", ""value"": ""How do the terms of the GPL serve to protect user freedoms?""}, {""from"": ""gpt"", ""value"": ""The terms of the GPL serve to protect user freedoms by legally guaranteeing certain rights that users have when using, modifying, and distributing software. This includes:\n1. **Freedom to Run**: Users can run the program as they wish, for any purpose.\n2. **Freedom to Study and Modify**: Users can study how the program works and change it to make it do what they want, requiring access to the source code.\n3. **Freedom to Redistribute**: Users can redistribute copies of the original program, ensuring they share their freedoms with others.\n4. **Freedom to Distribute Modified Versions**: Users can distribute copies of modified versions, which allows improvements to be shared within the community. By enforcing these freedoms through legal terms, the GPL fosters an open-source ecosystem where user rights are upheld.""}]",knowledge/php/limesurvey,1.0,train
"[{""from"": ""human"", ""value"": ""Why is user awareness important when using GPL licensed software?""}, {""from"": ""gpt"", ""value"": ""User awareness is crucial when using GPL licensed software because it ensures that users understand their rights and obligations under the license. This knowledge helps users take full advantage of the freedoms granted by the GPL, such as modifying the software or using it for commercial purposes. Awareness also encourages users to properly attribute original authors and comply with the GPL's requirements when redistributing the software. Furthermore, informed users are more likely to contribute positively to the community by sharing improvements and adhering to the principles of open-source collaboration.""}]",knowledge/php/limesurvey,1.0,train
