conversations,source,score,split
"[{""from"": ""human"", ""value"": ""What is the purpose of the user groups functionality in LimeSurvey?""}, {""from"": ""gpt"", ""value"": ""The user groups functionality in LimeSurvey allows for the organization of users into individual groups for administrative purposes. Although it provides a way to manage groups of administration users, it currently lacks real permission management, meaning that its use is more for convenience than for enforcing specific access control or restrictions. Groups are mainly a textual or organizational tool rather than a security feature.""}]",knowledge/php/limesurvey,1.0,train
"[{""from"": ""human"", ""value"": ""How can a user group be created in LimeSurvey?""}, {""from"": ""gpt"", ""value"": ""To create a user group in LimeSurvey, follow these steps: 1. Navigate to the '''Configuration''' dialog and click on '''Create/edit user groups'''. 2. Click on the '''Add new user group''' button located in the upper-left corner of the user group management page. 3. Enter the 'name' and 'description' of the new user group. 4. Click '''Save''' to create the group. After creation, you can add users to this group by selecting them from a dropdown list and clicking the '''Add user''' button. This organized structure helps in managing user permissions collectively.""}]",knowledge/php/limesurvey,1.0,train
"[{""from"": ""human"", ""value"": ""What details are shown in the user groups list?""}, {""from"": ""gpt"", ""value"": ""The user groups list in LimeSurvey provides several details for each user group, including: 1. **User group ID**: A unique identifier assigned to each user group. 2. **Name**: The name of the user group. 3. **Description**: A brief description of the group. 4. **Owner**: The user who created the group; this cannot be changed without deleting and recreating the group. 5. **Members**: The number of users in the group. 6. **Action options**: A set of actions available for each group, such as viewing users, editing the user group, emailing the group, and deleting the group.""}]",knowledge/php/limesurvey,1.0,train
"[{""from"": ""human"", ""value"": ""What functionalities can a user group admin perform in LimeSurvey?""}, {""from"": ""gpt"", ""value"": ""A user group admin in LimeSurvey can perform several key functionalities: 1. **Create and edit user groups**: Admins can create new groups, edit their names and descriptions, and organize users into these groups. 2. **Manage group membership**: They can add or remove users from the group. 3. **Email group members**: Admins can send mass emails to group members, which includes setting a subject, composing a message, and optionally receiving a copy. 4. **Grant survey permissions**: User groups can be assigned specific permissions for surveys, like editing survey questions or viewing responses, ensuring that group members have the necessary access.""}]",knowledge/php/limesurvey,1.0,train
"[{""from"": ""human"", ""value"": ""Can you explain the process of granting survey permissions to a user group?""}, {""from"": ""gpt"", ""value"": ""To grant survey permissions to a user group in LimeSurvey, follow these steps: 1. **Access the settings for the survey**: Open the survey for which you want to manage permissions. 2. **Go to Survey permissions**: Click on the '''Survey permissions''' section in the settings menu. 3. **Select the user group**: Choose the user group you want to grant permissions to. 4. **Choose permissions**: In the permissions matrix, specify the exact permissions you want the group members to have (e.g., editing questions, viewing responses). 5. **Expand the view**: Use the double-right arrowhead to get a more detailed view of all permissions options. 6. **Save changes**: Click the '''Save''' button to apply the permissions to the user group. Note that any changes to group membership after permissions are set won't automatically update permissions for new members.""}]",knowledge/php/limesurvey,1.0,train
"[{""from"": ""human"", ""value"": ""What limitations exist regarding changes to user groups after permissions are granted?""}, {""from"": ""gpt"", ""value"": ""There are several limitations to be aware of in relation to user group changes after permissions have been granted in LimeSurvey: 1. **Membership Changes**: Adding new members to a user group after it has been granted permissions does not automatically give those members the same survey permissions as existing members. To extend permissions to new members, the user group must be re-granted permissions. 2. **Deleting Users**: If a user is removed from a user group, they do not lose their user group survey permissions. The only way to completely remove a user's permissions is to delete their account from the survey permissions table. 3. **Experimental Functionality**: Since the user group functionalities are still considered experimental, users may encounter inconsistencies which should be reported for improvement.""}]",knowledge/php/limesurvey,1.0,train
"[{""from"": ""human"", ""value"": ""What is the process to send mass emails to user group members in LimeSurvey?""}, {""from"": ""gpt"", ""value"": ""To send mass emails to user group members in LimeSurvey, follow these steps: 1. **Log in to LimeSurvey**: Ensure you have administrative access. 2. **Go to user groups list**: Navigate to the user groups section. 3. **Select the email action**: Click the green mail icon associated with the user group you want to contact. 4. **Compose your email**: Enter the subject of the email and type your message in the provided text box. 5. **Send a copy**: Optionally, tick the box for 'Send me a copy' to receive a copy of the email at your registered email address. 6. **Click Send**: After composing the message, click on the '''Send''' button to deliver the email to all members of the selected user group.""}]",knowledge/php/limesurvey,1.0,train
"[{""from"": ""human"", ""value"": ""What actions can be performed in the user groups list?""}, {""from"": ""gpt"", ""value"": ""In the user groups list of LimeSurvey, various actions can be performed for each user group. Specifically: 1. **View Users**: Allows viewing the members within a specific user group. 2. **Edit User Group**: Admins can modify the name and description of the group. 3. **Email User Group**: The ability to send emails to all members of the user group. 4. **Delete User Group**: Admin can delete a user group entirely from the system. Each of these actions assists in managing user groups effectively and allows for adjustments as needed.""}]",knowledge/php/limesurvey,1.0,train
"[{""from"": ""human"", ""value"": ""How can a user group be deleted in LimeSurvey?""}, {""from"": ""gpt"", ""value"": ""To delete a user group in LimeSurvey, locate the group in the user groups list and follow these steps: 1. **Find the user group**: Scroll through the user groups list to locate the group you want to delete. 2. **Click the delete icon**: Click the red wastebin button next to the user group. 3. **Confirm deletion**: A confirmation prompt will appear asking if you really want to delete the group. Click OK to confirm the deletion. Keep in mind that deleting a user group does not automatically remove the permissions that were granted to its members.""}]",knowledge/php/limesurvey,1.0,train
"[{""from"": ""human"", ""value"": ""What should be done if a user needs to be removed from survey permissions after leaving a user group?""}, {""from"": ""gpt"", ""value"": ""If a user needs to be removed from survey permissions after leaving a user group in LimeSurvey, you must follow these steps: 1. **Log in**: Access LimeSurvey as an administrator or a user with sufficient permissions. 2. **Go to Survey Permissions**: Navigate to the '''Survey permissions''' page from the survey settings. 3. **Find the user**: Look for the specific user in the list of survey permissions. 4. **Delete the user**: Remove the user from the permissions table to revoke their access rights. This is necessary because simply removing them from the user group does not automatically retract their permissions.""}]",knowledge/php/limesurvey,1.0,train
"[{""from"": ""human"", ""value"": ""Can you summarize the benefits and limitations of using user groups in LimeSurvey?""}, {""from"": ""gpt"", ""value"": ""User groups in LimeSurvey offer several benefits, including: 1. **Organizational Convenience**: They provide a way to manage users within the administration interface, making it easier to conduct administrative tasks collectively. 2. **Mass Action Capability**: Admins can apply actions, like setting permissions or sending emails, to all members at once, thereby streamlining administration. 3. **Centralized Management**: Rather than managing permissions for individual users, groups allow batch actions that reduce time and complexity. However, there are limitations, such as: 1. **Lack of Real Permissions**: Currently, the groups don't inherently bind permissions, limiting their effectiveness. 2. **Manual Updates Required**: Any changes in group membership do not cascade to permissions automatically, requiring manual intervention to update access rights as needed. 3. **Experimental Functionality**: The implementation is still in testing, which may produce inconsistencies and requires user vigilance. Thus, while user groups help in organizing administrative tasks, their limitations need to be taken into account.""}]",knowledge/php/limesurvey,1.0,train
