conversations,source,score,split
"[{""from"": ""human"", ""value"": ""What steps are involved in creating a new menu in LimeSurvey?""}, {""from"": ""gpt"", ""value"": ""To create a new menu in LimeSurvey, follow these steps:\n1. Navigate to the menu configuration by going to **Configuration -> Settings -> Menu configuration**.\n2. Look for the green button labeled **+ New** at the upper left corner of the window and click on it.\n3. In the new window that appears, you will find options to set up your menu:\n   - **Parent**: Select whether this menu will be a sub-menu under an existing menu.\n   - **Survey**: Choose the survey for which the menu will be applicable, or use the default setting for 'All surveys'.\n   - **Ordering**: Assign an order to your menu if needed, particularly when multiple menus share the same position.\n   - **Title**: Input the title of your menu.\n   - **Description**: Optionally provide a brief description for other administrators.\n   - **Position**: Decide on the menu's location: Sidemenu, Collapsed menu, Top bar, or Bottom bar.\n4. After filling out the required fields, save the changes to create your menu.""}]",knowledge/php/limesurvey,1.0,train
"[{""from"": ""human"", ""value"": ""How can existing menus be edited in LimeSurvey?""}, {""from"": ""gpt"", ""value"": ""To edit existing menus in LimeSurvey, follow these steps:\n1. Access the Menu Configuration panel where all the existing survey menus are listed.\n2. Locate the menu you wish to edit, and find the green button in the **Action** column corresponding to that menu.\n3. Click on this green button, and a window will pop up allowing you to modify the menu's details, such as the title, description, ordering, and position.\n4. After making the necessary changes, ensure you save the configurations to update the menu.""}]",knowledge/php/limesurvey,1.0,train
"[{""from"": ""human"", ""value"": ""What actions can be performed in the Survey Menu Configuration panel?""}, {""from"": ""gpt"", ""value"": ""In the Survey Menu Configuration panel, users can perform the following actions:\n- **Create a menu**: Initiate the creation of a new menu.\n- **Edit a menu**: Modify the details of an existing menu.\n- **Delete a menu**: Remove a selected menu along with its entries.\n- **Reset to default values**: Revert all menus to their original default settings. This will erase all custom menus.""}]",knowledge/php/limesurvey,1.0,train
"[{""from"": ""human"", ""value"": ""What happens when you delete a menu in LimeSurvey?""}, {""from"": ""gpt"", ""value"": ""When you delete a menu in LimeSurvey, the corresponding menu entries are also deleted permanently. To delete a menu:\n1. Find the red trash button in the **Action** column for the menu you want to remove.\n2. Click on the button and confirm the action by selecting **Delete now**. It is important to be cautious when performing this action, as it will erase all custom data related to that menu.""}]",knowledge/php/limesurvey,1.0,train
"[{""from"": ""human"", ""value"": ""How can you reset your survey menus to default values?""}, {""from"": ""gpt"", ""value"": ""To reset your survey menus to the default values in LimeSurvey, do the following:\n1. Go to the Menu Configuration panel where your menus are displayed.\n2. Click the **Reset** button located in the upper right part of the window. \n3. You will be prompted to confirm this action; be aware that all custom menus will be lost if you proceed with the reset. It's advisable to back up the configuration before performing this action.""}]",knowledge/php/limesurvey,1.0,train
"[{""from"": ""human"", ""value"": ""What should you do to back up your survey menus in LimeSurvey?""}, {""from"": ""gpt"", ""value"": ""To back up your survey menus in LimeSurvey, it is recommended to create a complete database backup of your LimeSurvey instance. Follow these steps:\n1. Access your LimeSurvey administration panel and navigate to the **Backup entire database** option.\n2. Initiate the backup process, ensuring you capture all configurations and data.\n3. Additionally, check for updates in the future as a dedicated option to directly facilitate backup of only survey menus may be introduced.""}]",knowledge/php/limesurvey,1.0,train
"[{""from"": ""human"", ""value"": ""What are the different position options available when creating a menu?""}, {""from"": ""gpt"", ""value"": ""When creating a menu in LimeSurvey, you can choose from four positioning options:\n- **Sidemenu**: Places the menu on the left side of the window.\n- **Collapsed menu**: Displays only the icons of the menu entries, minimizing space usage.\n- **Top bar**: Positions the menu in a bar at the upper part of the window.\n- **Bottom bar**: Places the menu in a bar at the lower part of the window.\nChoosing the right position helps enhance user navigation experience.""}]",knowledge/php/limesurvey,1.0,train
"[{""from"": ""human"", ""value"": ""Can you give an example of how to change the default collapsed menu to a new side menu?""}, {""from"": ""gpt"", ""value"": ""To change the default collapsed menu to a new side menu in LimeSurvey, follow these steps:\n1. Go to the **Menu Configuration panel**.\n2. Edit the existing **main menu** by changing its position from 'collapsed menu' to 'sidemenu'.\n3. Adjust the **position of the quick menu** from 'collapsed' to 'sidemenu'.\n4. Upon saving these changes, the side menu of the survey will reflect the new configuration, providing a more visible and accessible menu for users.""}]",knowledge/php/limesurvey,1.0,train
"[{""from"": ""human"", ""value"": ""What considerations should be made when creating a new menu entry in LimeSurvey?""}, {""from"": ""gpt"", ""value"": ""When creating a new menu entry in LimeSurvey, consider the following:\n1. **Hierarchy and Parent Menu**: Ensure you choose the appropriate parent menu, especially if it is a sub-menu.\n2. **Ordering**: Assign an appropriate order to maintain logical navigation; use numbers that align with existing entries.\n3. **Descriptive Title**: Use clear and concise titles for easy identification by administrators and users.\n4. **Important Links**: Add links corresponding to essential features like 'list questions' or 'list question groups' to facilitate quick access.\n5. **User Engagement**: Think about how the menu layout will affect user interaction and access to information.""}]",knowledge/php/limesurvey,1.0,train
"[{""from"": ""human"", ""value"": ""How do menu entries relate to the overall menu structure in LimeSurvey?""}, {""from"": ""gpt"", ""value"": ""In LimeSurvey, menu entries serve as the individual components or links within a menu structure. Each entry can lead users to specific functions or pages, improving navigation efficiency. The relationship is as follows:\n1. **Parent-Child Structure**: Menus can have submenus (child) organized under them, establishing a hierarchy that categorizes functions.\n2. **Visibility and Access**: Proper structuring determines which entries are visible to users based on their menu's position and can affect overall accessibility of features.\n3. **Organizational Clarity**: Thoughtful arrangement of menu entries within the parent menu helps users quickly locate necessary tools or data, promoting a smooth user experience.""}]",knowledge/php/limesurvey,1.0,train
"[{""from"": ""human"", ""value"": ""What is the importance of the description field when creating a new menu?""}, {""from"": ""gpt"", ""value"": ""The description field when creating a new menu in LimeSurvey serves several important purposes:\n1. **Clarity for Administrators**: It provides a succinct summary of what the menu encompasses, aiding other administrators in understanding its purpose and content.\n2. **Future Reference**: As configurations change over time, having a description can help clarify past decisions and the context of the menu's creation.\n3. **User Guidance**: Helping end-users understand the usage or features available in that menu without having to click through options.\n4. **Operational Efficiency**: The description can help in faster decision-making when changing or adjusting menu configurations because it reduces ambiguity.""}]",knowledge/php/limesurvey,1.0,train
"[{""from"": ""human"", ""value"": ""How is the order of menus important in configuration?""}, {""from"": ""gpt"", ""value"": ""The order of menus in LimeSurvey configuration is crucial for enhancing user navigation and experience. Here are some key reasons:\n1. **Logical Flow**: A well-ordered menu structure reflects a logical flow for users, allowing them to locate functions intuitively.\n2. **Prioritization**: Order allows for the prioritization of important features or options that users need frequent access to, promoting efficiency.\n3. **Avoid Clutter**: Proper ordering helps prevent clutter by organizing similar items together rather than randomly mixing them, which can confuse users.\n4. **Usability**: Overall user experience is improved when menus are arranged in a way that aligns with user expectations and mental models of how they navigate systems.""}]",knowledge/php/limesurvey,1.0,train
"[{""from"": ""human"", ""value"": ""What guidelines should be followed when editing existing menu entries?""}, {""from"": ""gpt"", ""value"": ""When editing existing menu entries in LimeSurvey, consider these guidelines:\n1. **Preserve Functionality**: Ensure that any changes do not remove essential links or functionalities that users rely on.\n2. **Maintain Clarity**: Keep titles and descriptions clear and concise, ensuring that they continue to accurately reflect the purpose of the menu entry.\n3. **Review Impact on Order**: Changing an entry might affect the overall order; assess how changes fit within the navigation scheme.\n4. **Validation Post-Edit**: After making edits, check the menu structure to confirm that everything works as expected and that links lead to the correct places.""}]",knowledge/php/limesurvey,1.0,train
"[{""from"": ""human"", ""value"": ""What errors should be avoided when configuring survey menus in LimeSurvey?""}, {""from"": ""gpt"", ""value"": ""When configuring survey menus in LimeSurvey, avoid the following errors:\n1. **Ambiguous Titles**: Titles should not be vague or overly complex; clear titles enhance understandability.\n2. **Ignoring Parent Structure**: Failing to properly set up parent-child relationships can lead to confusion and misnavigation.\n3. **Overloading Menus**: Avoid crowding a single menu with too many entries; this can overwhelm users and hinder usability.\n4. **Neglecting Descriptions**: Failing to use the description field can result in unclear configurations, making future edits more challenging.""}]",knowledge/php/limesurvey,1.0,train
"[{""from"": ""human"", ""value"": ""How can the visual layout of menus impact user experience?""}, {""from"": ""gpt"", ""value"": ""The visual layout of menus in LimeSurvey significantly impacts user experience in various ways:\n1. **Navigation Efficiency**: A well-structured and visually appealing layout makes it easier for users to find what they need without excessive searching.\n2. **Accessibility**: Proper visualization aids in accessibility; users with disabilities benefit from clear layouts that conform to best practices.\n3. **Cognitive Load**: Reducing clutter and presenting information in a digestible format can lower cognitive load, helping users retain and process information better.\n4. **Aesthetic Appeal**: A visually attractive layout encourages user engagement and reflects professionalism, fostering a positive impression of the survey platform.""}]",knowledge/php/limesurvey,1.0,train
"[{""from"": ""human"", ""value"": ""What are the different types of menu actions available in LimeSurvey?""}, {""from"": ""gpt"", ""value"": ""In LimeSurvey's Menu Configuration, the different types of actions available include:\n- **Create a Menu**: Allows users to add a new menu to the configuration.\n- **Edit a Menu**: Provides the capability to modify existing menu configurations.\n- **Delete a Menu**: Enables permanent removal of a selected menu and its entries.\n- **Reset to Default Values**: This action restores all menus to their original settings, potentially impacting customized configurations.""}]",knowledge/php/limesurvey,1.0,train
"[{""from"": ""human"", ""value"": ""How does LimeSurvey treat menu hierarchy?""}, {""from"": ""gpt"", ""value"": ""In LimeSurvey, the menu hierarchy is treated as a parent-child relationship where:\n1. **Parent Menus**: These act as containers for sub-menus (children), organizing the overall navigation structure.\n2. **Child Menus**: Child menus provide further subdivision of functionalities or options under a parent menu. This nesting can help streamline user navigation.\n3. **Logical Grouping**: Proper hierarchy enables logical grouping of related functionalities, improving usability and reducing cognitive strain for users.""}]",knowledge/php/limesurvey,1.0,train
"[{""from"": ""human"", ""value"": ""What is the significance of the menu configuration panel?""}, {""from"": ""gpt"", ""value"": ""The menu configuration panel in LimeSurvey is vital for several reasons:\n1. **Central Control**: It serves as the central hub for managing all survey menus and entries, allowing for organization and configuration in one place.\n2. **User Management**: Administrators can tailor the menu experience based on user groups, improving usability and relevance.\n3. **Customization**: It enables customization of the survey environment, allowing for adjustments based on the specific needs of the organization or survey objectives.""}]",knowledge/php/limesurvey,1.0,train
"[{""from"": ""human"", ""value"": ""What is meant by 'menu entries' in the context of LimeSurvey?""}, {""from"": ""gpt"", ""value"": ""In the context of LimeSurvey, 'menu entries' refer to the individual items or links that populate a menu. Each entry directs users to specific functions or pages within the survey platform. They can range from actions like creating a new question, accessing survey settings, to various tools and features available to administrators and users in their navigation through the survey.""}]",knowledge/php/limesurvey,1.0,train
"[{""from"": ""human"", ""value"": ""How can the changes in menu positions affect user experience?""}, {""from"": ""gpt"", ""value"": ""Changes in menu positions in LimeSurvey can significantly affect user experience by:\n1. **Changing Accessibility**: Moving menus can either facilitate or hinder users' access to crucial functions depending on where they are placed.\n2. **Breaking Familiarity**: Users accustomed to the location of specific functions may become disoriented with significant rearrangements.\n3. **Improving Efficiency**: Strategically moving menus to more visible or ergonomic locations can enhance navigation speed and efficiency, leading to a smoother workflow.""}]",knowledge/php/limesurvey,1.0,train
"[{""from"": ""human"", ""value"": ""What precautions should be taken before resetting menus to default values?""}, {""from"": ""gpt"", ""value"": ""Before resetting menus to default values in LimeSurvey, it is crucial to take the following precautions:\n1. **Backup Configuration**: Always back up the survey configuration to prevent loss of custom menus and entries.\n2. **Inform Stakeholders**: Notify other team members or stakeholders about impending changes to avoid confusion and ensure transparency.\n3. **Check Customizations**: Review all customizations to identify if they are critical for current operations before proceeding with the reset.""}]",knowledge/php/limesurvey,1.0,train
"[{""from"": ""human"", ""value"": ""What are the benefits of using descriptions for menu entries?""}, {""from"": ""gpt"", ""value"": ""Using descriptions for menu entries in LimeSurvey provides several benefits:\n1. **Enhanced Clarity**: Descriptions can clarify the purpose of each menu entry, helping users make informed decisions.\n2. **Support Future Editing**: They provide context for future administrators when modifications are needed.\n3. **User Guidance**: Descriptive text serves to guide end-users through the functionalities available to them, improving overall navigation.""}]",knowledge/php/limesurvey,1.0,train
"[{""from"": ""human"", ""value"": ""How can creating a new side menu improve the user interface?""}, {""from"": ""gpt"", ""value"": ""Creating a new side menu can significantly improve the user interface in several ways:\n1. **Increased Visibility**: Side menus can provide quick access to important functions without having to navigate through multiple layers.\n2. **Space Efficiency**: A side menu layout can minimize clutter in the central working area, enhancing the focus on tasks at hand.\n3. **Enhanced User Engagement**: By logically organizing features in a side menu, users are more likely to explore and engage with various functionalities, leading to more efficient survey management.""}]",knowledge/php/limesurvey,1.0,train
"[{""from"": ""human"", ""value"": ""What is necessary to ensure effective navigation with menus in LimeSurvey?""}, {""from"": ""gpt"", ""value"": ""To ensure effective navigation with menus in LimeSurvey, the following aspects are necessary:\n1. **Logical Structure**: Organize menus in a logical hierarchy with clear parent-child relationships to streamline the navigation process.\n2. **Clear Labels**: Use descriptive and straightforward titles for menu entries that accurately convey their functions.\n3. **Consistent Layout**: Maintain a consistent layout across menus to help users develop familiarity and efficiency in navigating the platform.\n4. **User-catering Design**: Design menus with the target users in mind, considering their needs and preferences, which can facilitate a more intuitive user experience.""}]",knowledge/php/limesurvey,1.0,train
"[{""from"": ""human"", ""value"": ""What type of feedback can be solicited from users regarding menu configurations?""}, {""from"": ""gpt"", ""value"": ""Feedback from users regarding menu configurations can include:\n1. **Usability**: Insights about how easy or difficult users find it to navigate through the menus.\n2. **Accessibility**: Suggestions on visibility and access to important features and whether they encounter any barriers.\n3. **Organization**: Users can provide feedback on the arrangement of menu entries and whether they logically group similar functionalities.\n4. **Functionality Requests**: Users can request additional entries or modifications based on their experiences, potentially leading to improved configurations.""}]",knowledge/php/limesurvey,1.0,train
