conversations,source,score,split
"[{""from"": ""human"", ""value"": ""What is the purpose of the presentation and navigation settings in LimeSurvey?""}, {""from"": ""gpt"", ""value"": ""The presentation and navigation settings in LimeSurvey allow administrators to customize how the survey is presented to participants. This includes settings for showing question numbers, enabling a progress bar, and providing statistics upon survey completion. These options influence both the user experience and how respondents interact with the survey, potentially improving engagement and clarity. Additionally, administrators can manage navigation features, such as jumping between question groups, and control the visibility of elements like the welcome screen, on-screen keyboard, and the ability to print answers.""}]",knowledge/php/limesurvey,1.0,train
"[{""from"": ""human"", ""value"": ""How can a survey administrator access the presentation panel?""}, {""from"": ""gpt"", ""value"": ""To access the presentation panel in LimeSurvey, a survey administrator must navigate to the home page of the survey. Under the 'Settings' tab, they should select 'Presentation'. This access point allows them to modify various presentation and navigation-related settings, impacting how the survey is displayed to respondents.""}]",knowledge/php/limesurvey,1.0,train
"[{""from"": ""human"", ""value"": ""What is the effect of the 'Navigation Delay' setting?""}, {""from"": ""gpt"", ""value"": ""The 'Navigation Delay' setting in LimeSurvey determines the time in seconds before the previous, next, and submit buttons become enabled for respondents. The default value for this option is '0' seconds, meaning buttons are available immediately. If a different value is specified, it will create a pause that might affect how quickly participants can navigate through the survey, which could be useful for controlling the pace of responses.""}]",knowledge/php/limesurvey,1.0,train
"[{""from"": ""human"", ""value"": ""Explain the different options available for 'Show Question Index / Allow Jumping'.""}, {""from"": ""gpt"", ""value"": ""The 'Show Question Index / Allow Jumping' option has three selectable states: \n1. **Disabled**: No index will be shown in the survey, and respondents cannot jump to different question groups.\n2. **Incremental**: An index menu shows question groups incrementally; respondents can only jump back to groups they have previously accessed.\n3. **Full**: An index is fully functional, allowing respondents to jump between any question groups freely. This flexibility can enhance navigation and improve the respondent experience.""}]",knowledge/php/limesurvey,1.0,train
"[{""from"": ""human"", ""value"": ""What happens when the global settings override the survey settings?""}, {""from"": ""gpt"", ""value"": ""When global settings override survey settings in LimeSurvey, it means that certain configurable options in an individual survey may become unselectable or locked based on the global configurations set by a super-administrator. For example, if the global setting deactivates the 'Show \""No answer\""' option for all surveys, individual administrators cannot enable it on the local survey level. This hierarchy ensures that certain standards or restrictions can be uniformly applied across all surveys managed within the installation.""}]",knowledge/php/limesurvey,1.0,train
"[{""from"": ""human"", ""value"": ""Can you provide an example of how to enable 'Show Question Number and/or Code'?""}, {""from"": ""gpt"", ""value"": ""To enable the 'Show Question Number and/or Code' option in LimeSurvey, administrators would follow these steps:\n1. Access the 'Presentation' settings from the survey's home page.\n2. Locate the 'Show Question Number and/or Code' section.\n3. Select the desired option:\n   - **Both**: Show both the question number and question code.\n   - **Number Only**: Show only the question number.\n   - **Code Only**: Show only the question code.\n   - **None**: Show neither.\nBy setting this appropriately, respondents will see the relevant identifiers next to each survey question, promoting clarity and reference during answering.""}]",knowledge/php/limesurvey,1.0,train
"[{""from"": ""human"", ""value"": ""Describe the options available for 'Show Progress Bar'.""}, {""from"": ""gpt"", ""value"": ""The 'Show Progress Bar' option in LimeSurvey allows survey administrators to inform participants about their progression through the survey. When enabled, a visual progress bar indicates how much of the survey has been completed relative to the total number of questions. This can motivate respondents to finish the survey as they can see their advancement. Conversely, if turned off, survey participants will not have any visual cue regarding their completion state, which may lead to decreased engagement levels during longer surveys.""}]",knowledge/php/limesurvey,1.0,train
"[{""from"": ""human"", ""value"": ""How can the 'Allow Backward Navigation' feature affect a survey's usability?""}, {""from"": ""gpt"", ""value"": ""Enabling the 'Allow Backward Navigation' feature in LimeSurvey allows participants to navigate back to previous questions and modify their answers. This can significantly enhance usability, as respondents may change their minds, revisit earlier questions for clarification, or correct mistakes made during their responses. However, it can also introduce complexity, making it critical for survey designers to ensure the flow and integrity of the survey data are maintained.""}]",knowledge/php/limesurvey,1.0,train
"[{""from"": ""human"", ""value"": ""What is the role of the 'Show 'There Are X Questions In This Survey' option?""}, {""from"": ""gpt"", ""value"": ""'Show 'There Are X Questions In This Survey' is an option that provides participants with visibility of the total number of questions in the survey. By enabling this setting, respondents can gauge the length and expected time commitment of the survey, which may improve their willingness to complete it. It helps in managing respondents' expectations regarding the duration and reveals how far into the survey they are, potentially impacting their engagement levels.""}]",knowledge/php/limesurvey,1.0,train
"[{""from"": ""human"", ""value"": ""Can you explain the significance of the 'Public Statistics' option?""}, {""from"": ""gpt"", ""value"": ""The 'Public Statistics' option in LimeSurvey allows for the display of current survey statistics to participants once they complete the survey. This feature can enhance transparency and encourage participant engagement, as they can see how their responses contribute to the overall results. It may also foster a sense of community or contribution among the respondents, knowing they are part of a larger dataset. However, it is important for survey administrators to consider privacy concerns and ensure that sensitive data is not disclosed in these statistics.""}]",knowledge/php/limesurvey,1.0,train
"[{""from"": ""human"", ""value"": ""What considerations should be made when using 'Show Graphs in Public Statistics'?""}, {""from"": ""gpt"", ""value"": ""When using the 'Show Graphs in Public Statistics' feature in LimeSurvey, administrators should consider various factors including:\n1. **Data Sensitivity**: Ensure that the visualized data does not expose sensitive information that could identify individual respondents.\n2. **Clarity**: The graphs should effectively communicate data insights and be easily understandable by participants.\n3. **Requirement for Statistics Option**: This feature is contingent on the 'Public Statistics' option being enabled, which means both features should be used in tandem to provide a cohesive experience.\n4. **Design and Layout**: Graphs should fit well within the overall survey design and maintain a professional appearance.\nBy paying attention to these considerations, survey administrators can effectively leverage graphical representations of data without compromising on integrity or privacy.""}]",knowledge/php/limesurvey,1.0,train
"[{""from"": ""human"", ""value"": ""How does 'Automatically Load URL When Survey Complete' improve user experience?""}, {""from"": ""gpt"", ""value"": ""The 'Automatically Load URL When Survey Complete' feature improves user experience by providing a seamless transition at the end of the survey. When enabled, this option allows administrators to redirect participants to a specified URL after completion, which can be beneficial for directing them to thank-you pages, additional information, or related surveys. This function minimizes the need for users to navigate away manually, enhancing the overall survey experience and potentially increasing participant satisfaction.""}]",knowledge/php/limesurvey,1.0,train
