conversations,source,score,split
"[{""from"": ""human"", ""value"": ""What is the purpose of the dual scale question type in LimeSurvey?""}, {""from"": ""gpt"", ""value"": ""The dual scale question type in LimeSurvey serves to provide respondents with two distinct scales of answer options for each sub-question. This allows for a more nuanced approach to data collection, where respondents can evaluate items based on two different criteria simultaneously. For example, one scale might measure satisfaction, while the other measures importance. This feature enhances the richness of the data collected, making it valuable for analyzing respondents' perceptions and priorities.""}]",knowledge/php/limesurvey,1.0,train
"[{""from"": ""human"", ""value"": ""Can you explain how answers are recorded in the dual scale question type?""}, {""from"": ""gpt"", ""value"": ""In the dual scale question type, answers are stored separately for each scale in the response table. This means that each sub-question's option selected by the respondent is recorded independently for both scales, allowing for detailed analysis of their responses. For example, if a respondent selects 'Agree' on scale one and 'Neutral' on scale two for a particular sub-question, each selection is logged in the database, thus permitting comparison and statistical analysis between the two scales.""}]",knowledge/php/limesurvey,1.0,train
"[{""from"": ""human"", ""value"": ""What options can be configured for the display settings of the dual scale question type?""}, {""from"": ""gpt"", ""value"": ""In the display settings for the dual scale question type, several options can be configured:\n1. **Answer Width**: Adjusts how wide the answer options are displayed to improve readability.\n2. **Hide Tip**: Allows the survey designer to hide tips that are typically displayed alongside questions.\n3. **Random Order**: The possible answers can be randomized each time the survey is taken, minimizing bias in responses.\n4. **Repeat Headers**: This option allows headers for the scales to be repeated for each set of sub-questions to maintain clarity.\n5. **Question Theme**: You can customize the visual theme of the question to align with survey branding.\nThese display options enhance the user experience by tailoring how questions are presented to participants.""}]",knowledge/php/limesurvey,1.0,train
"[{""from"": ""human"", ""value"": ""How does the dual scale question type utilize dropdown boxes?""}, {""from"": ""gpt"", ""value"": ""The dual scale question type can utilize dropdown boxes by setting a special question attribute that allows for this functionality. When enabled, each scale's answer options are presented in a dropdown format, which can simplify the interface, especially for questions with multiple sub-questions. Respondents can select their answers from a dropdown list, allowing for a cleaner design and potentially improved user interaction, especially in cases where space is limited.""}]",knowledge/php/limesurvey,1.0,train
"[{""from"": ""human"", ""value"": ""What are some general options available for configuring a dual scale question type?""}, {""from"": ""gpt"", ""value"": ""Some of the general options available for configuring a dual scale question type include:\n1. **Mandatory**: Marking the question as required ensures respondents cannot skip it.\n2. **Relevance**: This allows the question to be conditionally displayed based on prior answers, enhancing survey flow and respondent engagement.\nThese options help tailor the question to the survey's needs and improve response quality.""}]",knowledge/php/limesurvey,1.0,train
"[{""from"": ""human"", ""value"": ""What is the significance of the 'min_answers' and 'max_answers' logic options?""}, {""from"": ""gpt"", ""value"": ""The 'min_answers' and 'max_answers' logic options in the dual scale question type allow survey creators to enforce constraints on how many options respondents can select. \n- **Min Answers**: This setting specifies the minimum number of options a respondent must select. This ensures that participants engage sufficiently with the question before submitting their responses.\n- **Max Answers**: This option delineates the maximum selections a respondent can make, preventing them from choosing too many responses that may dilute the quality of the feedback. \nThese controls are essential for gathering meaningful data while also streamlining the survey experience.""}]",knowledge/php/limesurvey,1.0,train
"[{""from"": ""human"", ""value"": ""How can the 'scale_export' feature be beneficial in data analysis?""}, {""from"": ""gpt"", ""value"": ""The 'scale_export' feature in LimeSurvey allows for the export of survey results in a format that preserves the integrity of the dual scale responses. This is beneficial for data analysis because it enables researchers and analysts to easily interpret the relationships between the two scales. By maintaining the connection between the answers across both scales, researchers can apply more sophisticated statistical analyses, such as correlation or regression analyses, to derive insights into respondents' attitudes and perceptions.""}]",knowledge/php/limesurvey,1.0,train
"[{""from"": ""human"", ""value"": ""What is the role of the 'Public_statistics' option in the dual scale question type?""}, {""from"": ""gpt"", ""value"": ""The 'Public_statistics' option in the dual scale question type determines whether the collected statistics from this question are made publicly available. This feature is important for surveys that seek to share results transparently with respondents or stakeholders. By enabling public statistics, the survey creator allows users to view aggregate data and insights derived from responses, enhancing trust and engagement in the survey process.""}]",knowledge/php/limesurvey,1.0,train
"[{""from"": ""human"", ""value"": ""Can you describe how the question theme can affect user experience in the dual scale question?""}, {""from"": ""gpt"", ""value"": ""The question theme impacts the user experience significantly in the dual scale question by influencing visual appeal, readability, and overall engagement. A well-designed theme that aligns with the survey's branding can create a more pleasant, professional appearance, which may encourage participation. Factors like font size, colors, spacing, and graphics are all integral to usability; for example, a clean and accessible theme makes it easier for respondents to navigate the survey and understand the questions being presented.""}]",knowledge/php/limesurvey,1.0,train
"[{""from"": ""human"", ""value"": ""How does the 'Printable_survey_relevance_help' option enhance the survey experience?""}, {""from"": ""gpt"", ""value"": ""The 'Printable_survey_relevance_help' option enhances the survey experience by providing respondents with supplementary information or guidance in a printable format. This can be particularly useful in settings where respondents may prefer physical copies of surveys or require additional assistance in understanding the relevance of certain questions. By including help elements in a printer-friendly format, survey creators can ensure that respondents have access to necessary context and resources to aid their completion of the survey effectively, facilitating better engagement and higher quality data.""}]",knowledge/php/limesurvey,1.0,train
"[{""from"": ""human"", ""value"": ""What types of charts can be utilized to display dual scale question results?""}, {""from"": ""gpt"", ""value"": ""To display results from dual scale questions, various chart types can be employed:\n1. **Bar Charts**: Useful for comparing frequencies of responses across the two scales and can easily represent categorical data.\n2. **Pie Charts**: Effective in showcasing the proportion of each response, although they are generally less useful for dual comparisons.\n3. **Stacked Bar Charts**: These offer a practical way to visualize how responses correlate across the two scales, making patterns more discernible.\n4. **Line Charts**: Useful for tracking changes in responses over time or across different groups.\nBy selecting appropriate chart types, researchers can reveal insights into participant perceptions and effectively communicate findings to stakeholders.""}]",knowledge/php/limesurvey,1.0,train
