conversations,source,score,split
"[{""from"": ""human"", ""value"": ""What is the short description of the 5-point array question type in LimeSurvey?""}, {""from"": ""gpt"", ""value"": ""The 5-point array question type in LimeSurvey is an array type that comes prefilled with answer choices, utilizing a scale from 1 to 5. If a question is not marked as mandatory, a \""No answer\"" option is automatically included for respondents. This question type is useful for collecting rated responses with an easy-to-understand scale.""}]",knowledge/php/limesurvey,1.0,train
"[{""from"": ""human"", ""value"": ""What should a user do if they require scales other than 5 points for their survey?""}, {""from"": ""gpt"", ""value"": ""If users need to implement scales other than 5 points for their surveys in LimeSurvey, they should utilize the general array question type instead of the specifically defined 5-point array format. The general array question type provides greater flexibility, allowing for a broader range of scale options tailored to the survey's needs.""}]",knowledge/php/limesurvey,1.0,train
"[{""from"": ""human"", ""value"": ""What are some of the general options available for the 5-point array question in LimeSurvey?""}, {""from"": ""gpt"", ""value"": ""The general options available for the 5-point array question type in LimeSurvey include:\n1. **Mandatory**: Arrangements for making responses mandatory or optional.\n2. **Relevance**: Options for displaying questions based on the respondent's prior answers, enhancing survey logic.""}]",knowledge/php/limesurvey,1.0,train
"[{""from"": ""human"", ""value"": ""Can you explain the display options for the 5-point array question type in LimeSurvey?""}, {""from"": ""gpt"", ""value"": ""The display options for the 5-point array question type in LimeSurvey allow adjustments to how the question is presented to respondents. Key options include:\n1. **Answer Width**: Control the width of the answer selections to make them more accessible.\n2. **Hide Tip**: Option to conceal helper tips that may be displayed alongside the question.\n3. **Random Order**: Determine whether the answer choices should be shown in a randomized sequence, which can help mitigate response bias.\n4. **Question Theme**: Choose various themes to change the visual styling of the question.\n5. **Hidden**: Specify if the question should be hidden from respondents.\n6. **CSS Class**: For advanced users, allow customization of the question's display through designated CSS classes.\n7. **Printable Survey Relevance Help**: Provide hints about how relevance works directly in printed surveys.""}]",knowledge/php/limesurvey,1.0,train
"[{""from"": ""human"", ""value"": ""What are the logic options associated with the 5-point array question type?""}, {""from"": ""gpt"", ""value"": ""The logic options associated with the 5-point array question type in LimeSurvey include:\n1. **Min/Max Answers**: Define the minimum and maximum number of responses a participant must select.\n2. **Array Filter Exclude**: Option to exclude certain responses based on prior answers in the survey.\n3. **Array Filter Style**: Different styles for how filtered options are displayed to participants.\n4. **Exclusive Option**: Allows respondents to select only one option among multiple choices by limiting selections.\n5. **Random Group**: Randomly group sets of questions for varied presentation.\n6. **Validation Options**: Enable validations for answers, such as error messages if conditions aren\u2019t met.""}]",knowledge/php/limesurvey,1.0,train
"[{""from"": ""human"", ""value"": ""What are some of the statistical features available for the 5-point array question type in LimeSurvey?""}, {""from"": ""gpt"", ""value"": ""The 5-point array question type in LimeSurvey has several statistical features:\n1. **Public Statistics**: Control whether the results are visible to the public.\n2. **Display Chart**: Option to visualize results through various chart types, enabling easier interpretation of the data.\n3. **Chart Type**: Users can select the format of the chart displayed for survey results, facilitating diverse reporting options.""}]",knowledge/php/limesurvey,1.0,train
"[{""from"": ""human"", ""value"": ""What is the significance of the 'No answer' option in the 5-point array question type?""}, {""from"": ""gpt"", ""value"": ""The 'No answer' option in the 5-point array question type offers respondents a way to opt-out of answering if they do not feel comfortable providing a response or if the question does not apply to them. This ensures that survey results remain relevant and reflects genuine participant input, rather than forcing inappropriate or uninformed responses.""}]",knowledge/php/limesurvey,1.0,train
"[{""from"": ""human"", ""value"": ""How does the 5-point array question type handle non-mandatory questions?""}, {""from"": ""gpt"", ""value"": ""For non-mandatory questions using the 5-point array question type, LimeSurvey automatically adds a 'No answer' option. This feature acknowledges that not all questions may be applicable or comfortable for every respondent, allowing them to skip the question without impacting their overall submission.""}]",knowledge/php/limesurvey,1.0,train
"[{""from"": ""human"", ""value"": ""Can you provide an example scenario where a 5-point array question type is effectively utilized?""}, {""from"": ""gpt"", ""value"": ""An example scenario for the effective use of a 5-point array question type is in evaluating customer satisfaction within a service industry. A survey could ask respondents to rate various aspects of their experience (such as staff professionalism, service speed, and overall satisfaction) on a scale from 1 (Very Unsatisfied) to 5 (Very Satisfied). This format allows for a concise summary of opinions across multiple dimensions, facilitating targeted improvements.""}]",knowledge/php/limesurvey,1.0,train
"[{""from"": ""human"", ""value"": ""What are the implications of using logic options like 'Random Group' in the 5-point array question?""}, {""from"": ""gpt"", ""value"": ""Using logic options like 'Random Group' in the 5-point array question can lead to several advantages:\n1. **Minimized Bias**: Randomly illustrating questions can reduce potential biases that follow fixed order displaying.\n2. **Enhanced Focus**: Respondents may engage differently with questions presented in a non-linear sequence, prompting more thoughtful responses.\n3. **Comprehensive Insights**: This method can yield a more balanced distribution of responses across all questions, enhancing the validity of overall conclusions drawn from survey data.""}]",knowledge/php/limesurvey,1.0,train
"[{""from"": ""human"", ""value"": ""What are the key considerations when choosing to implement an array question type in a survey?""}, {""from"": ""gpt"", ""value"": ""When implementing an array question type in a survey, several key considerations should be kept in mind:\n1. **Clarity**: Ensure questions are clear and unambiguous to avoid confusion among respondents.\n2. **Scale Appropriateness**: Select a scale that aligns well with the survey objectives and the nature of the questions being asked.\n3. **Respondent Experience**: Consider how the array format may affect respondent experience and engagement; overly complex arrays can lead to frustration.\n4. **Data Interpretation**: Be mindful of how array responses will be analyzed post-collection and ensure adequate statistical tools are available to facilitate this.""}]",knowledge/php/limesurvey,1.0,train
"[{""from"": ""human"", ""value"": ""What to include in the header of an array question type in LimeSurvey?""}, {""from"": ""gpt"", ""value"": ""The header of an array question type in LimeSurvey should include:\n1. **Descriptive Title**: A clear, concise title that indicates the focus of the question.\n2. **Instructions or Context**: Brief instructions or context that guide the respondent on how to interpret the ratings. For example, providing definitions for each point on the scale defines what a '1' versus a '5' means.\n3. **Relevance/Purpose**: Explaining the relevance or purpose of the question can enhance the respondent's understanding and engagement, thereby promoting more thoughtful responses.""}]",knowledge/php/limesurvey,1.0,train
"[{""from"": ""human"", ""value"": ""What is the advantage of using a hidden question in a survey?""}, {""from"": ""gpt"", ""value"": ""Using a hidden question in a survey comes with several advantages:\n1. **Data Collection**: It allows for collecting data without influencing participant responses. This is particularly useful for gathering meta-information or controlling flow without drawing direct attention.\n2. **Conditional Logic**: Hidden questions enable advanced survey logic where subsequent questions can depend on prior hidden responses.\n3. **Minimizing Response Bias**: It reduces biases by preventing respondents from becoming fixated on the hidden questions, fostering more natural answering in visible queries.""}]",knowledge/php/limesurvey,1.0,train
"[{""from"": ""human"", ""value"": ""How can one utilize CSS Classes in the context of LimeSurvey's array questions?""}, {""from"": ""gpt"", ""value"": ""In the context of LimeSurvey's array questions, CSS Classes can be utilized to customize the visual presentation of the question. By defining specific styles associated with a CSS class:\n1. **Styling Options**: Users can control font sizes, colors, background, padding, and margin to enhance readability and accessibility.\n2. **Responsive Design**: Custom CSS can ensure that the layout adapts well to different screen sizes, improving the interface on mobile devices.\n3. **Branding**: Incorporating brand colors and fonts into the survey presents a cohesive corporate identity, enhancing the overall participant experience.""}]",knowledge/php/limesurvey,1.0,train
"[{""from"": ""human"", ""value"": ""How does LimeSurvey ensure the reliability of the array question type?""}, {""from"": ""gpt"", ""value"": ""LimeSurvey ensures the reliability of the array question type through several means:\n1. **Validation Features**: Including minimum and maximum answer validations ensures that responses meet predetermined criteria, enhancing data consistency.\n2. **Logical Structure**: By supporting logical rules and conditions, LimeSurvey can adapt questions based on previous answers, minimizing irrelevant input.\n3. **User Testing**: The platform\u2019s design and features undergo regular updates and user testing, promoting continuous improvement in reliability and user experiences.""}]",knowledge/php/limesurvey,1.0,train
"[{""from"": ""human"", ""value"": ""What are the benefits of using display charts with array questions?""}, {""from"": ""gpt"", ""value"": ""Using display charts with array questions provides several benefits:\n1. **Visual Interpretation**: Charts transform complex data sets into easily digestible visuals, aiding in quick comprehension of results.\n2. **Trend Analysis**: Visual representations facilitate spotting trends, patterns, or shifts in responses over time.\n3. **Effective Communication**: Charts serve as effective communicative tools, allowing stakeholders to present survey findings in a compelling manner, often leading to deeper insights and discussions about the implications of the data.""}]",knowledge/php/limesurvey,1.0,train
"[{""from"": ""human"", ""value"": ""Can you illustrate how to implement a basic 5-point array question in LimeSurvey?""}, {""from"": ""gpt"", ""value"": ""To implement a basic 5-point array question in LimeSurvey, follow these steps:\n1. **Create a New Question**: Log into your LimeSurvey admin panel and navigate to create a new question in your survey.\n2. **Select Question Type**: Choose the 'Array' question type with an answer scale that specifies responses from 1 to 5.\n3. **Set Question Text**: Input the question text, e.g., \""Please rate your level of satisfaction with our service.\""\n4. **Define Answer Options**: Add answer options corresponding to the array choices, labeling each point on the 1-5 scale such as 'Very Unsatisfied', 'Unsatisfied', 'Neutral', 'Satisfied', 'Very Satisfied'.\n5. **Configure Options**: Configure additional settings such as mandatory response, relevance, and potential display options.\n6. **Save and Preview**: Save the question, then preview your survey to ensure the 5-point array question displays correctly.""}]",knowledge/php/limesurvey,1.0,train
"[{""from"": ""human"", ""value"": ""What are the resources available in LimeSurvey for understanding how to set up array questions?""}, {""from"": ""gpt"", ""value"": ""LimeSurvey provides various resources to help users set up array questions:\n1. **Documentation**: Detailed guides available on the LimeSurvey website, covering various question types, including array questions.\n2. **Community Forums**: The LimeSurvey community forums can be used for discussions, troubleshooting, and sharing best practices related to array questions.\n3. **Tutorials and Videos**: Online tutorials and video demonstrations can guide users through the process of creating and customizing array questions in an engaging format, helping beginner users grasp the concepts quickly.""}]",knowledge/php/limesurvey,1.0,train
"[{""from"": ""human"", ""value"": ""How does LimeSurvey categorize different question types?""}, {""from"": ""gpt"", ""value"": ""LimeSurvey categorizes different question types based on their structure and functionality. Categories include:\n1. **Standard Questions**: These include common types like multiple choice, text input, and rating scale. \n2. **Array-Style Questions**: A sub-category where questions are formatted like arrays to collect consistent responses across multiple items, like the 5-point array question.\n3. **Custom/Advanced Questions**: These allow for more complex interactions using JavaScript or custom code for unique survey needs.\nThis categorization helps users easily navigate question selection and applies the appropriate type based on their survey goals.""}]",knowledge/php/limesurvey,1.0,train
"[{""from"": ""human"", ""value"": ""In what scenarios would one prefer using an array question over other question types?""}, {""from"": ""gpt"", ""value"": ""One would prefer using an array question over other question types in scenarios such as:\n1. **Rating Multiple Items**: When needing to evaluate several aspects of a single subject, like customer satisfaction on different service elements in a cohesive format.\n2. **Efficient Data Collection**: When aiming to gather opinions on many items without redundant questions, saving time for both respondents and researchers.\n3. **Comparison Across Topics**: To allow side-by-side comparison, facilitating responses that easier identify patterns or divergences in the data.""}]",knowledge/php/limesurvey,1.0,train
