conversations,source,score,split
"[{""from"": ""human"", ""value"": ""What is the purpose of the 'Multiple Short Text' question type in LimeSurvey?""}, {""from"": ""gpt"", ""value"": ""The 'Multiple Short Text' question type in LimeSurvey is designed to collect multiple text entries from respondents under a single question. It allows users to define a primary question and then provide several text boxes for answers by adding labels, with each additional text box corresponding to a specific label. This format is useful when the survey requires more than one short textual response from participants, enabling richer qualitative data collection. For example, respondents can provide multiple suggestions or comments for different aspects of a topic under one overarching question.""}]",knowledge/php/limesurvey,1.0,train
"[{""from"": ""human"", ""value"": ""How can a user add more text boxes for answers in the 'Multiple Short Text' question type?""}, {""from"": ""gpt"", ""value"": ""Users can add more text boxes for answers in the 'Multiple Short Text' question type by defining the main question and then utilizing the 'Answers' feature within LimeSurvey. Each answer entry corresponds to a label for a new text box. For example, when creating a survey question asking for different aspects of an event (like organization, location, and food), the user first enters the main question and then adds 'Answers' for each aspect, which creates distinct text input fields for respondents to fill.""}]",knowledge/php/limesurvey,1.0,train
"[{""from"": ""human"", ""value"": ""What are some general options available for configuring questions in LimeSurvey?""}, {""from"": ""gpt"", ""value"": ""In LimeSurvey, several general options are available for configuring questions, including:\n1. **Mandatory**: This option allows the survey creator to set a question as required or optional for respondents. If mandatory, users must provide an answer before submission.\n2. **Relevance**: This feature is used to set conditions that determine whether a question will be displayed to a respondent based on their previous answers.\n3. **Validation Options**: Options like 'preg_validation' allow for input validation patterns on responses to ensure quality data collection.\nThese options help enhance user engagement and data quality while facilitating a tailored survey experience.""}]",knowledge/php/limesurvey,1.0,train
"[{""from"": ""human"", ""value"": ""How does the 'Display' section affect the representation of questions in LimeSurvey?""}, {""from"": ""gpt"", ""value"": ""The 'Display' section in LimeSurvey affects how questions are presented visually to respondents. It includes various configuration options such as:\n1. **Prefix and Suffix**: Allows adding custom text before or after the question or answer fields, which can provide supplementary instructions or context.\n2. **Text Input Width**: Defines the width of the text input boxes, enabling survey designers to create a more visually appealing layout.\n3. **Label Column Width**: Adjusts the width of the label that precedes the input box, fine-tuning the overall design and ensuring optimal space utilization on-screen.\n4. **Question Theme**: Provides options to apply different themes or visual styles to the question, enhancing user experience.\n5. **Hide Tip**: A setting that can hide tooltip help, making the survey cleaner but potentially less informative.\nOverall, the 'Display' section allows for the customization of aesthetics and usability of survey questions.""}]",knowledge/php/limesurvey,1.0,train
"[{""from"": ""human"", ""value"": ""What input-related settings are available for the 'Multiple Short Text' question type?""}, {""from"": ""gpt"", ""value"": ""In the 'Multiple Short Text' question type, several input-related settings are available to manage user responses:\n1. **Maximum Characters**: This setting limits the number of characters that respondents can enter in each text box, which helps ensure concise answers.\n2. **Numbers Only**: When activated, this option restricts input to numeric values only, useful for questions that require quantitative responses.\n3. **Page Break**: This setting, when applied, can divide questions over multiple pages to enhance survey flow and experience.\nThese input settings help create structured data collection and improve the quality of responses received from participants.""}]",knowledge/php/limesurvey,1.0,train
"[{""from"": ""human"", ""value"": ""How can logic be applied to questions in LimeSurvey?""}, {""from"": ""gpt"", ""value"": ""Logic in LimeSurvey can be applied through various settings that control the behavior of questions based on respondents' inputs. Some logical settings include:\n1. **Min Answers**: Defines the minimum number of responses required for specific questions to ensure that participants provide sufficient input.\n2. **Max Answers**: Sets a cap on the number of answers that can be given, helping to control verbosity and manage response data effectively.\n3. **Array Filter**: Allows conditional filtering or restriction of choices based on previous answers, which helps in creating a relevant survey flow for respondents.\n4. **Exclusive Option**: This feature allows only one choice to be selected from a set of options, enforcing singularity in responses where applicable.\nUtilizing these logical constructs enables survey creators to build dynamic and adaptive surveys that respond to participant input efficiently.""}]",knowledge/php/limesurvey,1.0,train
"[{""from"": ""human"", ""value"": ""What statistical options can be configured for the 'Multiple Short Text' question type?""}, {""from"": ""gpt"", ""value"": ""For the 'Multiple Short Text' question type in LimeSurvey, several statistical options can be defined for analyzing responses:\n1. **Display Chart**: This setting, when enabled, allows the results of the question to be visually represented in a chart format, facilitating easier interpretation of data.\n2. **Chart Type**: Users can specify the type of chart (e.g., bar, pie) in which the results will be displayed, offering flexibility in how data is presented.\nThese statistical configurations enhance the analysis capabilities of survey outcomes, allowing users to derive insights from the collected responses effectively.""}]",knowledge/php/limesurvey,1.0,train
"[{""from"": ""human"", ""value"": ""Are there specific considerations when using the 'Multiple Short Text' question type?""}, {""from"": ""gpt"", ""value"": ""Yes, when using the 'Multiple Short Text' question type, consider the following:\n1. **Clarity of Question**: Ensure the primary question is clear and concise so that respondents can provide meaningful text entries.\n2. **Limit Answer Length**: Use the maximum character setting judiciously to avoid overly lengthy responses that may deter completion.\n3. **Response Labels**: Provide intuitive labels for each text box to guide respondents effectively.\n4. **Page Layout**: Consider how the layout of multiple text boxes impacts respondents' engagement and response rates, as an overly cluttered interface can lead to frustration.\n5. **Testing the Survey**: Always test the survey flow to ensure that the newly added question types behave as expected and provide good user experience.\nThese considerations help maximize the effectiveness of the 'Multiple Short Text' question type while ensuring quality data collection.""}]",knowledge/php/limesurvey,1.0,train
