conversations,source,score,split
"[{""from"": ""human"", ""value"": ""What information is displayed in the 'Response summary' table of LimeSurvey?""}, {""from"": ""gpt"", ""value"": ""The 'Response summary' table in LimeSurvey displays several key metrics regarding survey responses:\n1. **Full responses** - This indicates the number of surveys that have been completely submitted by respondents, which is counted when they click the \""Submit\"" button on the last page of the survey.\n2. **Incomplete responses** - This metric accounts for the number of surveys that respondents started but did not complete. Incomplete responses are those that do not have a submission date.\n3. **Total responses** - This is the aggregation of both complete (full) responses and incomplete responses, giving an overall count of the engagement with the survey.""}]",knowledge/php/limesurvey,1.0,train
"[{""from"": ""human"", ""value"": ""What does the note regarding incomplete responses indicate?""}, {""from"": ""gpt"", ""value"": ""The note on incomplete responses in LimeSurvey informs users that these are records without a submission date. Such occurrences can arise from several scenarios:\n1. A participant may have used the 'resume later' function to save their progress and finish later.\n2. An operator may manually enter responses using the data entry functionality without submitting them.\n3. A participant might simply leave the survey before completion, resulting in no submission. This note is important for understanding the nature of data collected and handling incomplete responses effectively.""}]",knowledge/php/limesurvey,1.0,train
"[{""from"": ""human"", ""value"": ""What participant-related data is summarized when the survey participants option is used in LimeSurvey?""}, {""from"": ""gpt"", ""value"": ""When using the survey participants option in LimeSurvey, the summary of participant-related data displayed below the 'Response summary' includes:\n1. **Total invitations sent** - This shows how many invitations were sent out to participants from the survey participants table.\n2. **Total surveys completed** - It indicates the number of surveys completed by the participants who were allocated token codes.\n3. **Total with no unique token** - This displays how many participants do not have an assigned token code.\n4. **Total records** - It represents the total number of participants recorded in the survey participants table. This data helps assess not just responses, but overall participant engagement.""}]",knowledge/php/limesurvey,1.0,train
"[{""from"": ""human"", ""value"": ""What toolbar options are available in the Responses summary section of LimeSurvey?""}, {""from"": ""gpt"", ""value"": ""In the Responses summary section of LimeSurvey, the following toolbar options are available at the top:\n1. **Summary** - Redirects to the main responses and statistics summary page.\n2. **Responses** - Takes users to the detailed survey response table.\n3. **Data entry** - Allows manual input of responses into the survey response table, particularly useful for offline collected responses.\n4. **Statistics** - Offers access to both simple and complex statistical analyses, with options to export data to external formats.\n   - **Statistics - simple mode** - Generates simple graphs and charts using built-in functions.\n   - **Statistics - expert mode** - Enables selection of specific data for display; if the built-in features are insufficient, it allows for exporting data for use in specialized statistical software.\n5. **Timing statistics** - When enabled, this option provides insights into the total time respondents spent on the survey, broken down by question group and individual questions.\n6. **Export responses** - Used for exporting survey responses for further use or analysis outside of LimeSurvey.\n7. **Import responses** - Allows users to import responses from other surveys.\n8. **View saved but not submitted responses** - Lets users see responses saved during an unfinished session, if applicable.\n9. **Iterate survey** - Launches the same survey for the same participants to analyze trends.\n10. **Batch deletion** - Facilitates bulk deletion of survey answers.""}]",knowledge/php/limesurvey,1.0,train
"[{""from"": ""human"", ""value"": ""How do the simple and expert modes of statistics differ in LimeSurvey?""}, {""from"": ""gpt"", ""value"": ""The simple and expert modes available in LimeSurvey for statistics provide different levels of analysis and data presentation:\n1. **Simple Mode**: This mode utilizes the built-in statistics function to generate basic graphs and charts quickly. It is designed for users who require straightforward visual representations of the survey results without involving complex queries or manipulations. This mode is typically user-friendly and accessible to non-expert users.\n2. **Expert Mode**: This mode provides a much greater level of control over data display. Users can select specific datasets and customize how they want the statistics to be displayed. For cases where the built-in expert mode doesn\u2019t meet the specific analytic needs, data can be exported into other formats (like CSV or Excel) for further analysis using specialized statistical software. This mode caters to advanced users who need detailed analysis capabilities or wish to perform additional data manipulations.""}]",knowledge/php/limesurvey,1.0,train
"[{""from"": ""human"", ""value"": ""What statistics can be accessed when the timing statistics option is enabled?""}, {""from"": ""gpt"", ""value"": ""When the timing statistics option is enabled in LimeSurvey, users can access various time-related metrics that provide insights into respondent behavior, including:\n1. **Total time spent**: This statistic shows the overall amount of time respondents took to complete the entire survey.\n2. **Time per question group**: This breaks down the average time participants spent answering each group of questions, offering insights into which sections may be more time-consuming or challenging.\n3. **Time per question**: Gives a detailed view of how long respondents took on individual questions. This can highlight questions that may be too complex or require more thought from participants. These insights are valuable for improving future surveys and understanding participant engagement.""}]",knowledge/php/limesurvey,1.0,train
"[{""from"": ""human"", ""value"": ""Can you explain the purpose of the 'Data entry' option in LimeSurvey?""}, {""from"": ""gpt"", ""value"": ""The 'Data entry' option in LimeSurvey serves a crucial purpose for surveys that may have been conducted offline or when responses are manually collected. This functionality allows users to input responses directly into the survey response table without requiring the official survey interface. This is particularly beneficial in scenarios where a survey cannot be accessed online or when data has been collected via in-person interviews or paper forms. Essentially, this option helps maintain an organized collection of responses while ensuring that they can be tracked and analyzed alongside other response data, providing a complete dataset for analysis.""}]",knowledge/php/limesurvey,1.0,train
"[{""from"": ""human"", ""value"": ""What does the 'Iterate survey' option accomplish in LimeSurvey?""}, {""from"": ""gpt"", ""value"": ""The 'Iterate survey' option in LimeSurvey is used to launch the same survey to the same set of participants for further analysis. This can be particularly useful for observing trends over time, assessing changes in responses between iterations, or conducting follow-up surveys. By allowing repeated engagements with the same audience, researchers can gather longitudinal data that helps identify patterns or shifts in attitudes and opinions. This feature supports ongoing analysis and can be instrumental in drawing accurate conclusions from participant behaviors over multiple survey attempts.""}]",knowledge/php/limesurvey,1.0,train
"[{""from"": ""human"", ""value"": ""How does the 'Batch deletion' function work in LimeSurvey?""}, {""from"": ""gpt"", ""value"": ""The 'Batch deletion' function in LimeSurvey allows administrators to delete multiple survey responses at once rather than needing to remove them one at a time. This is particularly useful when a large number of responses must be removed due to errors in data collection, redundancy, or compliance reasons. It streamlines the cleanup process and enhances efficiency, especially when managing extensive response datasets. Users can typically select multiple entries in the response management interface and apply the deletion action, ensuring that only selected responses are removed efficiently. It's a vital tool for maintaining precise and manageable survey data.""}]",knowledge/php/limesurvey,1.0,train
"[{""from"": ""human"", ""value"": ""What is the importance of having a detailed 'Responses summary' in LimeSurvey?""}, {""from"": ""gpt"", ""value"": ""Having a detailed 'Responses summary' in LimeSurvey is crucial for several reasons:\n1. **Data Overview**: It provides a clear and concise overview of engagement metrics, allowing researchers to quickly assess the overall response landscape, including completion rates and survey participation.\n2. **Informed Decision-Making**: The summary statistics help survey administrators make data-driven decisions regarding survey modifications, participant engagement strategies, and the evaluation of the survey's effectiveness.\n3. **Identifying Challenges**: With metrics on incomplete responses and timing statistics, administrators can identify which areas of the survey may be problematic and require adjustments, whether through question restructuring or improving participant instructions.\n4. **Reporting and Presentation**: A well-summarized response section enables effective communication of findings to stakeholders, providing essential insights in a digestible format. It also aids in generating reports that reflect the study outcomes with clarity and precision.\n5. **Temporal Analysis**: The summary can support longitudinal studies by comparing current data with past surveys, facilitating trend analysis over time.""}]",knowledge/php/limesurvey,1.0,train
"[{""from"": ""human"", ""value"": ""What types of responses does LimeSurvey track and how are they categorized?""}, {""from"": ""gpt"", ""value"": ""LimeSurvey tracks several types of responses, categorized primarily into:\n1. **Full responses**: These are complete submissions from respondents who have finished the survey, clicking the 'Submit' button and providing usable data.\n2. **Incomplete responses**: These include surveys that respondents did not complete. There are no submission dates attached to these records, indicating that the data from these surveys may be partial or unusable.\n3. **Total responses**: This metric aggregates both full and incomplete responses, offering a comprehensive view of total engagement with the survey.\nIn addition, when using the survey participants option, further categorization includes:\n4. **Total invitations sent**: The number of survey invitations dispatched to participants.\n5. **Total surveys completed**: Indicating the number of successful completions by participants who were allocated token codes.\n6. **Total with no unique token**: Reflecting participants without assigned token codes, which may affect data tracking and identity management.""}]",knowledge/php/limesurvey,1.0,train
"[{""from"": ""human"", ""value"": ""What are the potential actions available after accessing the 'Responses & statistics' button in LimeSurvey?""}, {""from"": ""gpt"", ""value"": ""After accessing the 'Responses & statistics' button in LimeSurvey, users can perform several actions related to survey data and analysis:\n1. **View Summary**: Immediately access the summary page displaying key metrics on survey responses.\n2. **Check Responses**: Redirect to the response table for detailed insights into every survey entry.\n3. **Enter Data**: Use the data entry option to input responses manually when surveys are collected offline.\n4. **Analyze Statistics**: Access simple and expert modes for statistical analysis of survey results, exporting data as needed for further use.\n5. **Review Timing Statistics**: If enabled, view time-related statistics that reveal how long respondents took for each part of the survey.\n6. **Export and Import Responses**: Utilize options to export responses for external analysis or import responses from other surveys into the current one.\n7. **View Incomplete Responses**: Check items that were saved but not submitted to understand respondent behavior better.\n8. **Iterate Survey**: Launch the survey again for the same participants, observing any changes or trends.\n9. **Batch Deletion**: Efficiently delete multiple survey entries from the database as required.""}]",knowledge/php/limesurvey,1.0,train
"[{""from"": ""human"", ""value"": ""Why is the summary of survey participants-related data important in LimeSurvey?""}, {""from"": ""gpt"", ""value"": ""The summary of survey participants-related data in LimeSurvey is important for the following reasons:\n1. **Understanding Engagement**: It provides insights into how many participants were invited versus those who completed the survey, illustrating overall engagement levels.\n2. **Effective Management**: By showing the total with and without tokens, survey administrators can manage participant tracking more effectively, ensuring that they can follow up appropriately.\n3. **Data Integrity**: Understanding which participants completed their surveys and which did not is crucial for validating the integrity of the data collected, especially when managing token-based surveys.\n4. **Statistical Analysis**: Summarized participant data allows for more robust statistical analysis regarding completion rates and potential biases, contributing to more accurate survey results.\n5. **Future Planning**: It aids in planning future surveys by providing data on how participants interacted with the current survey, informing strategies for improving response rates and engagement in upcoming iterations.""}]",knowledge/php/limesurvey,1.0,train
