conversations,source,score,split
"[{""from"": ""human"", ""value"": ""What is the main purpose of the 'Short description' question type in LimeSurvey?""}, {""from"": ""gpt"", ""value"": ""The 'Short description' question type in LimeSurvey is designed to collect a single line of text input from respondents. It allows for a brief response that can be useful for capturing succinct data entries, such as names, titles, or any other concise information that does not require extensive elaboration. This type contributes to both qualitative and quantitative data collection in surveys.""}]",knowledge/php/limesurvey,1.0,train
"[{""from"": ""human"", ""value"": ""How do database character limits differ between MySQL, PostgreSQL, and MSSQL when using the 'Short description' question type?""}, {""from"": ""gpt"", ""value"": ""In LimeSurvey, the character limit for the 'Short description' question type varies by database system. On a MySQL database, there is no maximum limit on the number of characters that can be entered; users can input unlimited text. On both PostgreSQL and MSSQL databases, the maximum number of characters permitted is constrained to 255. This difference in limits is important for survey designers to consider based on their database choice.""}]",knowledge/php/limesurvey,1.0,train
"[{""from"": ""human"", ""value"": ""What should a survey designer inform the user about if a question map is set to mandatory?""}, {""from"": ""gpt"", ""value"": ""If a question map is mandatory in LimeSurvey, a survey designer should inform the user that they are required to adjust the red point on the map or to enter specific latitude and longitude coordinates in the text box. Simply relying on the default map option and pressing the \""NEXT\"" button will not suffice. It is advisable to clearly communicate this requirement in the question text to avoid any confusion during the survey process.""}]",knowledge/php/limesurvey,1.0,train
"[{""from"": ""human"", ""value"": ""Can you provide the different display options available for the 'Short description' question type?""}, {""from"": ""gpt"", ""value"": ""The display options available for the 'Short description' question type in LimeSurvey include: **Prefix**: This allows the addition of a prefix before the text input box. **Suffix**: Similar to prefix, this option adds a suffix after the input field. **Number of Display Rows**: Restricts the number of rows shown in the input area. **Hide Tip**: Option to hide a tip typically shown under the question. **Text Input Width**: Sets the width of the text input field. **Input Box Size**: Determines the overall size of the input box. **Question Theme**: Allows the application of a theme to the question display. **Hidden**: Option to keep the question hidden from the respondent. **CSS Class**: To apply custom styling via CSS classes.""}]",knowledge/php/limesurvey,1.0,train
"[{""from"": ""human"", ""value"": ""What are the functions of the 'Location' category in the LimeSurvey question types?""}, {""from"": ""gpt"", ""value"": ""The 'Location' category in LimeSurvey allows users to create map-related questions where respondents pinpoint specific geographic locations on either OpenStreetMap or Google Maps. Key functions include: \n1. **Map Service**: Specifies the map service to be used.\n2. **Default Coordinates**: Sets default coordinates for the map display.\n3. **Postal Code, City, State, Country Fields**: Store additional geographic data in the database alongside the selected map location.\n4. **Map Zoom Level and Dimensions**: Customize the zoom level and dimensions of the map displayed within the survey. \nThis categorization enhances location-based data collection and allows for the integration of relevant geographic information.""}]",knowledge/php/limesurvey,1.0,train
"[{""from"": ""human"", ""value"": ""How should developers handle validation logic for map-related questions in LimeSurvey?""}, {""from"": ""gpt"", ""value"": ""Developers can handle validation logic for map-related questions using various properties and configurations available in LimeSurvey. They can utilize the **em_validation_q** property to enforce specific validations that respondents must meet before progressing in the survey. Tips for implementation include:\n1. ### Mandatory Validation: For mandatory map questions, ensure that the survey does not allow progression unless the respondent has adjusted the map to a specified location.\n2. ### Error Messaging: Provide clear and instructive error messages through the **em_validation_q_tip** settings that inform users why their input is insufficient.\n3. ### Testing: Test the validation logic on multiple devices to ensure the map functionality is consistent and reliable for all users.\nThrough careful setup of validation rules, developers can create a seamless user experience that ensures data quality.""}]",knowledge/php/limesurvey,1.0,train
"[{""from"": ""human"", ""value"": ""What is the role of the 'Timer' category in LimeSurvey question types?""}, {""from"": ""gpt"", ""value"": ""The 'Timer' category in LimeSurvey serves to manage the timing constraints imposed on respondents while answering survey questions. The key functionalities of this category include:\n1. **Time Limit**: Establishes a maximum time limit for responding to questions within a survey.\n2. **Action on Timeout**: Developers can specify actions to take once the time limit is reached, such as moving to the next question or displaying a warning.\n3. **Countdown Message**: Displays a message during the countdown, informing users how much time they have left.\n4. **Warning Systems**: Settings to alert respondents before the time runs out, enhancing awareness and allowing them to manage their time effectively.\n5. **Message Styles**: Customizes how warning messages appear, allowing for brand consistency and user comfort.\nBy managing time effectively, developers can control the pace of survey completion and improve data collection reliability.""}]",knowledge/php/limesurvey,1.0,train
"[{""from"": ""human"", ""value"": ""How can location-related data enhance survey responses?""}, {""from"": ""gpt"", ""value"": ""Location-related data significantly enhances survey responses by enabling richer context and insights from the gathered data. Key benefits include:\n1. **Geographic Segmentation**: Helps in segmenting responses based on geographic regions, allowing for targeted analysis by area.\n2. **Contextual Analysis**: Allows researchers to correlate responses with specific regional factors, cultural elements, or demographic information that can affect survey results.\n3. **Data Enrichment**: Collects additional data such as postal codes, cities, and states which can be vital for analysis of trends based on location.\n4. **Customized Reports**: Facilitates the creation of location-specific reports that highlight trends, issues, or preferences prevalent in specific areas.\n5. **Local Decision Making**: Provides local organizations with insights to make data-driven decisions relevant to the areas surveyed.\nWhen implemented effectively, location data can lead to more insightful analysis and better decision-making driven by survey results.""}]",knowledge/php/limesurvey,1.0,train
"[{""from"": ""human"", ""value"": ""What are some community resources that LimeSurvey users can utilize for customization?""}, {""from"": ""gpt"", ""value"": ""LimeSurvey users looking to customize their survey experiences can leverage community resources such as:\n1. **Forums**: Participating in the LimeSurvey forums allows users to share ideas, ask questions, and discover custom scripts contributed by other members, like the geographical determination script linked in the documentation.\n2. **Documentation and Guides**: Official LimeSurvey documentation provides comprehensive guides on customizations and available features.\n3. **Search Function**: Using the search function on the LimeSurvey site can reveal a plethora of threads and topics related to user-defined customizations, with specific keywords such as \""maps\"" returning relevant customization resources.\n4. **Professional Partners**: Engaging one of the official partners for professional support and bespoke solutions tailored to specific needs.\nBy tapping into these community-driven resources, users can enhance their survey capabilities significantly.""}]",knowledge/php/limesurvey,1.0,train
"[{""from"": ""human"", ""value"": ""What is the significance of the 'General options' section in the LimeSurvey question types?""}, {""from"": ""gpt"", ""value"": ""The 'General options' section in LimeSurvey question types plays a critical role in defining and configuring how questions behave and are treated within surveys. Key aspects of this section include:\n1. **Mandatory Questions**: By setting questions as mandatory, survey designers can ensure that respondents provide necessary inputs before moving forward.\n2. **Relevance**: Developers can apply rules for question relevance, allowing certain questions to appear only based on previous responses.\n3. **Validation**: Integrates validation mechanisms that ensure responses conform to predefined formats or constraints, thus enhancing data integrity.\n4. **User Guidance**: This section can include recommendations for users, clarifying expectations or instructions as part of the question presentation.\nBy thoughtfully configuring general options, survey creators can streamline the survey-taking experience and ensure high-quality, reliable data collection.""}]",knowledge/php/limesurvey,1.0,train
