conversations,source,score,split
"[{""from"": ""human"", ""value"": ""What is the purpose of conditions in LimeSurvey?""}, {""from"": ""gpt"", ""value"": ""In LimeSurvey, conditions are used to control the visibility of survey questions based on the answers given by respondents. By setting conditions, you can create a logical flow in your survey, ensuring that only relevant questions are presented to the user depending on their previous answers. This enhances the user experience and enables more efficient data collection.""}]",knowledge/php/limesurvey,1.0,train
"[{""from"": ""human"", ""value"": ""How do you access the conditions feature in LimeSurvey?""}, {""from"": ""gpt"", ""value"": ""To access the conditions feature in LimeSurvey, you need to navigate to a specific question in your survey. Click on the question you wish to apply conditions to and look for the 'Set conditions' button in the question toolbar. Once you click this button, you enter the conditions designer panel where you can define, copy, and manage your conditions for that question.""}]",knowledge/php/limesurvey,1.0,train
"[{""from"": ""human"", ""value"": ""What are the two types of branching logic supported in LimeSurvey?""}, {""from"": ""gpt"", ""value"": ""LimeSurvey supports two types of branching logic: 'Hide/Show Branching Logic' and 'Jump Branching Logic.' 'Hide/Show Branching Logic' enables questions to be displayed only if specified conditions are met, whereas 'Jump Branching Logic' would typically involve skipping certain questions altogether. However, LimeSurvey does not implement Jump Branching Logic directly, as you can achieve similar functionality by applying the same visibility condition to multiple questions.""}]",knowledge/php/limesurvey,1.0,train
"[{""from"": ""human"", ""value"": ""Can you explain the difference between Hide/Show Branching and Jump Branching in LimeSurvey?""}, {""from"": ""gpt"", ""value"": ""Hide/Show Branching logic in LimeSurvey allows certain questions to be displayed based on conditions tied to previous answers, which allows for a flexible survey experience. For example, a question may only show if a prior question meets certain criteria. On the other hand, Jump Branching logic would involve skipping questions entirely, leading the respondent to later parts of the survey without displaying the intermediate questions. LimeSurvey does not directly implement jump logic but allows similar effects through careful condition settings.""}]",knowledge/php/limesurvey,1.0,train
"[{""from"": ""human"", ""value"": ""What conditions can be set in LimeSurvey?""}, {""from"": ""gpt"", ""value"": ""In LimeSurvey, conditions can be based on answers to previous questions, constant values, and participants' profile data, among others. You can define a condition that compares these values to determine when to show or hide specific survey questions. Supported comparison operators include equality checks, greater or lesser comparisons, and even regular expressions for advanced matching.""}]",knowledge/php/limesurvey,1.0,train
"[{""from"": ""human"", ""value"": ""What types of questions can be used as eligible question-entries in LimeSurvey's condition editor?""}, {""from"": ""gpt"", ""value"": ""Eligible question-entries for conditions in LimeSurvey's condition editor include simple questions such as text questions, radio buttons, or dropdown lists. Additionally, specific rows in Array questions can be evaluated, excluding Array dual-scale and Array multiple flexible questions. Constant values and participants' profile data can also be included in conditions, but ensure that the survey\u2019s participant settings allow such data to be shown.""}]",knowledge/php/limesurvey,1.0,train
"[{""from"": ""human"", ""value"": ""What operators are supported for comparison in LimeSurvey conditions?""}, {""from"": ""gpt"", ""value"": ""LimeSurvey supports various operators for comparisons in conditions, including basic operators such as 'equals' and 'not equals,' as well as 'greater than' and 'less than.' Advanced conditions can leverage regular expressions for pattern matching. When working with numeric fields, LimeSurvey will evaluate comparisons based on numeric order, which differs from comparisons on text fields that may follow string order.""}]",knowledge/php/limesurvey,1.0,train
"[{""from"": ""human"", ""value"": ""How can you combine conditions in LimeSurvey?""}, {""from"": ""gpt"", ""value"": ""In LimeSurvey, conditions can be combined using logical operators such as 'AND' and 'OR.' When conditions share the same tested value, they are automatically treated as ORed conditions, while conditions with different tested values are ANDed together. This allows complex survey logic to be constructed, enabling surveys to react dynamically based on respondent input.""}]",knowledge/php/limesurvey,1.0,train
"[{""from"": ""human"", ""value"": ""Describe the process of setting a simple condition in LimeSurvey.""}, {""from"": ""gpt"", ""value"": ""To set a simple condition in LimeSurvey, follow these steps:\n1. Select the question you want to apply the condition to.\n2. Click on the 'Set conditions' button in the question toolbar.\n3. In the conditions designer, define your condition by selecting a tested value (like an answer to a previous question), a comparison operator (such as equals or greater than), and a comparison value (the answer or constant value you want to use).\n4. Save your condition to apply it to the question, which will now show or hide based on the defined parameters.""}]",knowledge/php/limesurvey,1.0,train
"[{""from"": ""human"", ""value"": ""What are the rules for ordering elementary conditions in LimeSurvey?""}, {""from"": ""gpt"", ""value"": ""In LimeSurvey, the order of defining elementary conditions does not matter as the system automatically reorders them based on its internal logic when evaluating conditions. However, you must keep in mind two important rules: first, conditions that share the same tested value are ORed together, while conditions with different tested values are ANDed together. This allows you to create logical flows without worrying about the sequence in which you input them.""}]",knowledge/php/limesurvey,1.0,train
"[{""from"": ""human"", ""value"": ""How can scenarios help when using multiple conditions?""}, {""from"": ""gpt"", ""value"": ""Scenarios in LimeSurvey serve as a way to create logical groups of conditions that can be evaluated independently. Each scenario allows you to collect several conditions that can be ORed together. This means that if any one of the conditions within a scenario is met, that branch of the survey can proceed. Scenarios simplify the management of complex conditional logic, ensuring that related conditions are treated cohesively.""}]",knowledge/php/limesurvey,1.0,train
"[{""from"": ""human"", ""value"": ""What are the considerations when setting conditions in LimeSurvey?""}, {""from"": ""gpt"", ""value"": ""When setting conditions in LimeSurvey, consider the following:\n1. A question with a condition will only display if that condition is met. \n2. Conditions can only consider questions that appear before the current question.\n3. Changing the order of questions may not trigger warnings about broken conditions since conditions rely on previous questions.\n4. After a survey is activated, conditions can still be modified, but this should be done cautiously as there is no consistency check.""}]",knowledge/php/limesurvey,1.0,train
"[{""from"": ""human"", ""value"": ""How do you copy conditions between questions in LimeSurvey?""}, {""from"": ""gpt"", ""value"": ""To copy conditions in LimeSurvey, first select the question that has the conditions you want to copy. Use the 'Copy conditions' feature to select which conditions you want to copy. Then, choose the target question where you want those conditions applied. The conditions will be transferred, avoiding the need to manually recreate them. Be mindful that conditions can only reference previous questions in the survey.""}]",knowledge/php/limesurvey,1.0,train
"[{""from"": ""human"", ""value"": ""What steps can be taken to reset all conditions in LimeSurvey?""}, {""from"": ""gpt"", ""value"": ""To reset all conditions in LimeSurvey, navigate to one of the survey-related settings. Look for the 'Tools' option on the top toolbar and select 'Reset conditions.' Confirm your choice on the following page, and all conditions will be deleted. This allows you to start fresh with your conditional logic.""}]",knowledge/php/limesurvey,1.0,train
"[{""from"": ""human"", ""value"": ""What should you watch out for when designing a survey with chained conditions?""}, {""from"": ""gpt"", ""value"": ""When designing a survey with chained conditions, it's important to anticipate how the presentation of questions can affect visibility. If a question has conditions, it may not display even if a previous question was answered. Make sure to verify that all necessary questions are visible based on the user\u2019s responses, particularly if one hidden question influences another. Testing the survey for different combinations of responses helps ensure a coherent flow.""}]",knowledge/php/limesurvey,1.0,train
"[{""from"": ""human"", ""value"": ""What limitations exist regarding setting conditions for 'Other' options in multiple choice questions?""}, {""from"": ""gpt"", ""value"": ""In LimeSurvey, while 'Other' options can be included in multiple choice questions, conditions cannot be set based on these 'Other' inputs directly. This is due to the absence of a specific field recording the 'Other' response separately. To work around this limitation, it is advisable to create a regular answer option labeled 'Other' and include an additional text question that can gather further input upon selection.""}]",knowledge/php/limesurvey,1.0,train
"[{""from"": ""human"", ""value"": ""Explain how to use date values when comparing conditions for Date question types.""}, {""from"": ""gpt"", ""value"": ""When setting conditions for Date question types in LimeSurvey, it's crucial to use the internal representation of date values, formatted as YYYY-MM-DD. This ensures that comparisons are accurate and the logic functions as intended. Any other date format may lead to unexpected results or errors in evaluation.""}]",knowledge/php/limesurvey,1.0,train
"[{""from"": ""human"", ""value"": ""What is an important consideration when setting multiple choice questions based on checked options?""}, {""from"": ""gpt"", ""value"": ""When setting conditions based on multiple choice questions, particularly using the 'Group of checkboxes' flavor, be aware that conditions on each checkbox will be treated as ORed. If using 'Single checkbox' entries, conditions can be treated independently and may be combined using AND logic. Careful planning of which flavor you are using is essential for the correct visibility of subsequent questions based on respondent selections.""}]",knowledge/php/limesurvey,1.0,train
"[{""from"": ""human"", ""value"": ""What actions can you perform on the overview of existing conditions in LimeSurvey?""}, {""from"": ""gpt"", ""value"": ""In the overview of existing conditions within LimeSurvey, you can perform several actions:\n1. Quick-add conditions to expedite the addition process.\n2. Renumber scenarios sequentially if multiple scenarios exist.\n3. Delete all existing conditions to reset the logic.\n4. For each condition, you can delete or edit them as necessary, allowing for fine-tuning of the survey logic.""}]",knowledge/php/limesurvey,1.0,train
"[{""from"": ""human"", ""value"": ""What is the suggested method for complex boolean expression using conditions in LimeSurvey?""}, {""from"": ""gpt"", ""value"": ""To create complex boolean expressions using conditions in LimeSurvey, you cannot use parentheses directly to group conditions. Instead, you should craft your conditions manually by constructing combinations, such that every combination of conditions is represented individually. For example, if you have conditions that need to be evaluated under different combinations of ANDs and ORs, you would define them separately, ensuring all logical paths are accounted for.""}]",knowledge/php/limesurvey,1.0,train
"[{""from"": ""human"", ""value"": ""How does LimeSurvey determine the logical operator to be applied between conditions?""}, {""from"": ""gpt"", ""value"": ""LimeSurvey automatically determines which logical operator (AND or OR) to apply between conditions based on the context of the conditions. It follows two key rules: conditions with the same tested value are ORed together, while those with different tested values are ANDed. This is based on Boolean algebra principles, allowing for intuitive grouping of related conditions.""}]",knowledge/php/limesurvey,1.0,train
"[{""from"": ""human"", ""value"": ""In what scenarios should the condition for a 'no answer' value be applied?""}, {""from"": ""gpt"", ""value"": ""The 'no answer' predefined answer condition should be applied in situations where you want to show or hide questions based on whether a prior question was presented but left unanswered. This can help tailor the survey experience by addressing respondents who may have skipped questions, making sure they still receive relevant follow-up questions.""}]",knowledge/php/limesurvey,1.0,train
"[{""from"": ""human"", ""value"": ""What is a scenario in the context of conditions in LimeSurvey?""}, {""from"": ""gpt"", ""value"": ""A scenario in LimeSurvey is a logical grouping of conditions, where the conditions can be evaluated independently. The complex condition resulting from a combination of several scenarios will only be met if at least one scenario is met. This allows for more intricate survey logic by managing how multiple conditions interact with each other, providing flexibility in structuring surveys.""}]",knowledge/php/limesurvey,1.0,train
"[{""from"": ""human"", ""value"": ""What considerations apply to the progress bar functionality in LimeSurvey when using many conditions?""}, {""from"": ""gpt"", ""value"": ""If a survey incorporates numerous conditions that might cause many questions to be skipped, this can interfere with the accuracy of the progress bar, which may appear to jump unexpectedly. To mitigate this, it\u2019s advised to sequence your questions carefully to minimize the number of skips, therefore preserving the accuracy of the progress representation as users navigate through the survey.""}]",knowledge/php/limesurvey,1.0,train
"[{""from"": ""human"", ""value"": ""What should you be cautious about when modifying conditions after survey activation?""}, {""from"": ""gpt"", ""value"": ""If you modify conditions after activating a LimeSurvey, proceed with caution since there\u2019s no consistency check. Changes might lead to unexpected survey behavior or completely hide questions, which can adversely affect data collection. Always double-check how modifications impact the flow of the survey.""}]",knowledge/php/limesurvey,1.0,train
"[{""from"": ""human"", ""value"": ""How can you enhance the complexity and dynamic behavior of a survey through conditions?""}, {""from"": ""gpt"", ""value"": ""To enhance the complexity and dynamic behavior of a survey in LimeSurvey, you can effectively use the conditions feature by setting up multiple, intricate conditions using various logical operators. Carefully crafting these conditions based on respondent inputs ensures that survey questions are relevant and tailored to individual responses, thus improving data accuracy and respondent engagement.""}]",knowledge/php/limesurvey,1.0,train
"[{""from"": ""human"", ""value"": ""Can conditions in LimeSurvey help in gathering user profile data? If yes, how?""}, {""from"": ""gpt"", ""value"": ""Yes, conditions in LimeSurvey can gather user profile data by leveraging participant attributes as part of the condition logic. You can create conditions that refer to stored participant information (assuming 'Anonymized responses' is set to 'NO'), allowing you to tailor questions based on demographic or behavioral data, thus personalizing the survey experience.""}]",knowledge/php/limesurvey,1.0,train
"[{""from"": ""human"", ""value"": ""What example demonstrates the use of a constant comparison value in an elementary condition?""}, {""from"": ""gpt"", ""value"": ""An example of using a constant comparison value in an elementary condition could be: 'Show Question A if the answer to Question B is greater than 18'. Here, the condition checks if the input value for Question B surpasses the constant value of '18', thereby displaying Question A only to respondents who meet this numerical criterion.""}]",knowledge/php/limesurvey,1.0,train
"[{""from"": ""human"", ""value"": ""Describe the format that must be used when setting a constant date comparison in conditions.""}, {""from"": ""gpt"", ""value"": ""When setting a constant date comparison in conditions within LimeSurvey, you must use the internal date representation format of YYYY-MM-DD. This structure ensures that the system correctly interprets the date for any comparison being made in relation to survey responses, thus preventing erroneous evaluations.""}]",knowledge/php/limesurvey,1.0,train
"[{""from"": ""human"", ""value"": ""How should you handle the case where conditions are set on a question that itself has its own conditions?""}, {""from"": ""gpt"", ""value"": ""When setting conditions on a question that already has its own conditions, it is essential to be aware of the potential for confusion and unintended consequences in the survey flow. Test the survey thoroughly to ensure that conditions interact correctly, and modify previous conditions as necessary to align views. It is crucial to maintain a clear logical pathway throughout the survey.""}]",knowledge/php/limesurvey,1.0,train
"[{""from"": ""human"", ""value"": ""What logic rules can you apply when creating multiple options questions with conditions?""}, {""from"": ""gpt"", ""value"": ""When creating conditions for multiple options questions, consider these rules: \n1. If using a 'Group of checkboxes,' conditions applied are treated as ORed, meaning any selected option can trigger the display of dependent questions.\n2. If using 'Single checkbox' entries, each option can invoke conditions independently, allowing for AND evaluations, which means that multiple selected checkboxes must be checked for a dependent question to appear.""}]",knowledge/php/limesurvey,1.0,train
"[{""from"": ""human"", ""value"": ""What warning should users be aware of regarding conditions based on the 'no answer' option?""}, {""from"": ""gpt"", ""value"": ""When setting conditions based on the 'no answer' predefined answer option, it is critical to remember that this only applies when the question was visible and presented to respondents. Thus, 'no answer' conditions affect only those questions that have been shown but not answered, meaning mandatory questions cannot utilize this logic without additional handling of skipped questions.""}]",knowledge/php/limesurvey,1.0,train
"[{""from"": ""human"", ""value"": ""How do you confirm that conditions are saved properly after editing them in LimeSurvey?""}, {""from"": ""gpt"", ""value"": ""To confirm that conditions are saved properly after editing, you should use the 'Save and close' option within the conditions designer panel. Make sure to revisit the conditions overview post-save to verify they appear correctly in the list, reflecting the intended logic. Additionally, conducting a test run of the survey can help confirm that conditions behave as expected.""}]",knowledge/php/limesurvey,1.0,train
"[{""from"": ""human"", ""value"": ""What approach would you use to set conditions without using the built-in 'Other' option in LimeSurvey?""}, {""from"": ""gpt"", ""value"": ""Instead of relying on LimeSurvey's built-in 'Other' option, it is recommended to create a specific answer choice labeled 'Other' and add an accompanying text question that appears if that option is picked. This way, you can effectively gather specific input without being hindered by the limitations of the built-in feature.""}]",knowledge/php/limesurvey,1.0,train
"[{""from"": ""human"", ""value"": ""Can conditions in LimeSurvey influence the survey\u2019s progress bar functionality?""}, {""from"": ""gpt"", ""value"": ""Yes, conditions can impact the survey's progress bar functionality if many questions are skipped based on those conditions. A carefully constructed sequence of conditional questions can ensure that the progress bar accurately reflects the respondent\u2019s progression through the survey by minimizing jumps or abrupt skips of question sets.""}]",knowledge/php/limesurvey,1.0,train
"[{""from"": ""human"", ""value"": ""What is the importance of testing a survey with many conditions?""}, {""from"": ""gpt"", ""value"": ""Testing a survey with many conditions is vital to ensure that the logic behaves as intended across various response combinations. This helps identify any unintended consequences of conditions, such as skipped questions or incorrect visibility. By simulating different paths a respondent might take through the survey, you can ensure a smooth user experience and optimize data collection.""}]",knowledge/php/limesurvey,1.0,train
"[{""from"": ""human"", ""value"": ""When using scenarios in conditions, what does a scenario number signify?""}, {""from"": ""gpt"", ""value"": ""A scenario number in LimeSurvey represents an identifier for a specific group of conditions. It allows different sets of conditions to be organized and evaluated separately, using OR logic between them. This number is not essential to the evaluation process itself but can be used for structuring scenarios and potentially for printing surveys if needed.""}]",knowledge/php/limesurvey,1.0,train
"[{""from"": ""human"", ""value"": ""How can conditions configured in one question affect others in the survey?""}, {""from"": ""gpt"", ""value"": ""Conditions configured in one question can affect others in a survey through the visibility and logic paths created by those conditions. If a key question is hidden based on a condition, any additional questions that rely on its response will also be impacted, potentially leading to incomplete data collection or a less coherent respondent experience.""}]",knowledge/php/limesurvey,1.0,train
"[{""from"": ""human"", ""value"": ""What are the steps to follow when managing multiple conditional logic in a large survey?""}, {""from"": ""gpt"", ""value"": ""Managing multiple conditional logic in a large survey requires careful planning and organization. Key steps to follow include:\n1. Documenting each condition and its expected impact on subsequent questions.\n2. Frequently testing the survey to ensure all conditions work as intended.\n3. Grouping conditions logically where possible to simplify comprehension and oversight.\n4. Iteratively refining conditions based on insights gathered from user testing to enhance clarity and user flows.""}]",knowledge/php/limesurvey,1.0,train
"[{""from"": ""human"", ""value"": ""What is the primary function of the conditions designer in LimeSurvey?""}, {""from"": ""gpt"", ""value"": ""The primary function of the conditions designer in LimeSurvey is to facilitate the creation, editing, and management of conditions applied to survey questions. It provides a visual interface for users to define logic governing question visibility based on respondent answers, enabling the setup of complex survey flows without needing to delve deeply into coding or scripting.""}]",knowledge/php/limesurvey,1.0,train
"[{""from"": ""human"", ""value"": ""How do you ensure that conditions are cohesive and do not conflict with each other?""}, {""from"": ""gpt"", ""value"": ""To ensure that conditions are cohesive and do not conflict, maintain thorough documentation of each condition's purpose and how it interacts with others. Use a methodical approach to testing, examining the survey\u2019s flow under multiple response scenarios. After making adjustments, revisit conditions to ensure they contribute positively to the survey logic and do not create any logical contradictions.""}]",knowledge/php/limesurvey,1.0,train
"[{""from"": ""human"", ""value"": ""What should be taken into account regarding the order of questions when setting conditions?""}, {""from"": ""gpt"", ""value"": ""When setting conditions, always account for the order of questions in your survey. Since conditions can only apply to preceding questions, any reordering done after conditions are set could create broken logic chains if the later questions rely on earlier ones for visibility. Design your survey structure efficiently to minimize these issues, establishing a clear logic before applying conditions.""}]",knowledge/php/limesurvey,1.0,train
"[{""from"": ""human"", ""value"": ""Explain how LimeSurvey's logical branching contributes to effective data collection.""}, {""from"": ""gpt"", ""value"": ""LimeSurvey\u2019s logical branching significantly enhances data collection by presenting only relevant questions to respondents, which reduces survey fatigue and leads to more accurate responses. By skipping unnecessary questions based on prior answers, the survey remains engaging, and respondents are more likely to commit to completing the survey entirely\u2014this ultimately contributes to higher quality data and better insights from the responses.""}]",knowledge/php/limesurvey,1.0,train
