conversations,source,score,split
"[{""from"": ""human"", ""value"": ""What might happen if a necessary condition is inadvertently omitted?""}, {""from"": ""gpt"", ""value"": ""If a necessary condition is inadvertently omitted in LimeSurvey, it could lead to unintended question visibility, causing irrelevant questions to be shown or crucial questions to be hidden. This might frustrate respondents, skew the data collected, or even result in incomplete responses. Therefore, meticulous attention to detail is crucial during the condition setup phase.""}]",knowledge/php/limesurvey,1.0,train
"[{""from"": ""human"", ""value"": ""What is a but a common pitfall when managing conditions in large surveys?""}, {""from"": ""gpt"", ""value"": ""A common pitfall when managing conditions in large surveys is creating overly complex or intertwined conditions that can become difficult to track and manage. When conditions are not clearly understood or documented, it may be challenging to foresee how they will interact, leading to greater risk of logical errors. Keeping conditions simple, clear, and well-documented helps mitigate this issue, enhancing survey maintainability.""}]",knowledge/php/limesurvey,1.0,train
"[{""from"": ""human"", ""value"": ""How does LimeSurvey\u2019s condition functionality compare with traditional survey methods?""}, {""from"": ""gpt"", ""value"": ""LimeSurvey\u2019s condition functionality offers a more dynamic and responsive approach compared to traditional survey methods, which often present all questions in a linear manner. By using conditions, LimeSurvey tailors the questionnaire to each respondent based on their individual answers, thereby creating a personalized experience. This contrasts significantly with static surveys where all questions are present, irrespective of their relevance to the respondent.""}]",knowledge/php/limesurvey,1.0,train
"[{""from"": ""human"", ""value"": ""How critical is it to consider respondent experience while designing conditions?""}, {""from"": ""gpt"", ""value"": ""Considering the respondent experience is critical when designing conditions in LimeSurvey, as it directly influences their engagement and willingness to complete the survey. If conditions are designed poorly and lead to confusion or unintended question visibility, it can frustrate respondents and lead to drop-offs or inaccurate answers. A thoughtful design focuses on relevancy, clarity, and ease of navigation for the user.""}]",knowledge/php/limesurvey,1.0,train
"[{""from"": ""human"", ""value"": ""How can using float types in conditions benefit numeric comparisons?""}, {""from"": ""gpt"", ""value"": ""Using float types in conditions when performing numeric comparisons allows for greater precision in evaluating answers. This becomes particularly important for data that requires nuanced evaluation, such as measuring satisfaction ratings on a scale. By using appropriate data types, you can ensure that calculations and comparisons reflect the expected behavior accurately, leading to more reliable survey results.""}]",knowledge/php/limesurvey,1.0,train
"[{""from"": ""human"", ""value"": ""When using LimeSurvey, what should you do if a question does not respond as expected to set conditions?""}, {""from"": ""gpt"", ""value"": ""If a question does not respond as expected to the set conditions in LimeSurvey, first verify that the conditions are correctly defined and aligned with the intended logic. Check that the referenced questions appear before the current question in the survey flow. Testing the survey thoroughly and considering how different answer combinations impact question visibility may help pinpoint issues. Adjust the conditions or question order as necessary, and validate after changes.""}]",knowledge/php/limesurvey,1.0,train
"[{""from"": ""human"", ""value"": ""What should you do before finalizing the survey with conditions?""}, {""from"": ""gpt"", ""value"": ""Before finalizing the survey with conditions, you should conduct extensive testing to ensure that all conditions function correctly across a wide range of scenarios. Review the logic to confirm there are no unintended skips or visibility issues, ensuring the flow is coherent and user-friendly. Moreover, it's helpful to gather feedback from test users to understand their experience, making adjustments based on this feedback to enhance the survey's clarity and functionality.""}]",knowledge/php/limesurvey,1.0,train
