conversations,source,score,split
"[{""from"": ""human"", ""value"": ""What is LimeSurvey and what are its primary functions?""}, {""from"": ""gpt"", ""value"": ""LimeSurvey is a free, open-source online survey application written in PHP and distributed under the GNU General Public License 2. It allows users to create and publish online surveys, collect responses, analyze results, and export data to other applications. Its primary functions include creating surveys, managing response data, generating statistics, and providing hosting options through the LimeSurvey Community Edition or LimeSurvey Cloud.""}]",knowledge/php/limesurvey,1.0,train
"[{""from"": ""human"", ""value"": ""How do I create a free LimeSurvey account?""}, {""from"": ""gpt"", ""value"": ""To create a free LimeSurvey account, follow these steps:\n1. Go to the LimeSurvey website and click on the 'Sign Up For Free' button.\n2. Alternatively, select 'Pricing' to view options.\n3. When on the 'Pricing' page, click 'Register Now' in the 'FREE' option box.\n4. Fill out the registration form with your chosen username, email, and password.\n5. Check your email for an activation link and click on it to activate your account.""}]",knowledge/php/limesurvey,1.0,train
"[{""from"": ""human"", ""value"": ""What steps should I take to set up my survey site in LimeSurvey?""}, {""from"": ""gpt"", ""value"": ""To set up your survey site in LimeSurvey, follow these steps:\n1. Log in to your LimeSurvey account.\n2. Click on 'Create survey site'.\n3. Enter a name for your site.\n4. Select a domain name from the dropdown menu.\n5. Choose a server location from the options available.\n6. Click 'Save & Set Up LimeSurvey Site'.\nThis process might take up to 20 seconds, after which you can access your survey site by clicking 'View Survey Site'.""}]",knowledge/php/limesurvey,1.0,train
"[{""from"": ""human"", ""value"": ""What options do I have for customizing my LimeSurvey application?""}, {""from"": ""gpt"", ""value"": ""In LimeSurvey, you can customize your application through the following options found in the 'Configuration' section under the toolbar:\n1. **Settings**: Customize general application settings, home page settings, and global settings applicable to the entire LimeSurvey application.\n2. **Users**: Manage survey participants and administrator accounts.\n3. **Advanced Settings**: Adjust settings related to themes, data integrity checks, and backups among others.""}]",knowledge/php/limesurvey,1.0,train
"[{""from"": ""human"", ""value"": ""How can I activate or stop a survey in LimeSurvey?""}, {""from"": ""gpt"", ""value"": ""To activate a survey in LimeSurvey, follow these steps:\n1. Ensure that you have at least one question group and one question added to your survey.\n2. Go to the 'Settings' tab in the left menu and click on 'Overview'.\n3. Click 'Activate this survey' on the toolbar.\n4. Review the general survey settings and make any necessary adjustments.\n5. Once satisfied, click 'Save & activate survey'.\nTo stop a survey, navigate to the 'Overview' tab and select 'Stop this survey' from the toolbar.""}]",knowledge/php/limesurvey,1.0,train
"[{""from"": ""human"", ""value"": ""What is the purpose of subquestions in LimeSurvey?""}, {""from"": ""gpt"", ""value"": ""Subquestions in LimeSurvey are used to provide additional layers of detail within certain question types, particularly in array-type questions. They allow respondents to answer multiple related questions in a compact format, making it easier to capture detailed feedback within a singular section. For example, if you're gathering feedback on services and each service is a subquestion, respondents can evaluate each service in one integrated view.""}]",knowledge/php/limesurvey,1.0,train
"[{""from"": ""human"", ""value"": ""How can I add answers and subquestions to a question in LimeSurvey?""}, {""from"": ""gpt"", ""value"": ""To add subquestions and answers in LimeSurvey, follow these steps:\n1. Navigate to the question you want to modify in your survey's structure.\n2. Click on 'Edit subquestions' to input your desired subquestions, using the 'green plus sign' under the 'Actions' column to add more as needed.\n3. For answers, click 'Edit answer options' and type in your desired answers, adding more options as you did for subquestions.\n4. After making these changes, preview the question to ensure everything appears as intended.""}]",knowledge/php/limesurvey,1.0,train
"[{""from"": ""human"", ""value"": ""Describe the steps to create a question group within a LimeSurvey survey?""}, {""from"": ""gpt"", ""value"": ""To create a question group in LimeSurvey, follow these steps:\n1. Open the survey you wish to add a question group to.\n2. Select the 'Structure' tab from the menu on the left.\n3. Click on the 'Add question group' button.\n4. You will now be prompted to enter a title and optional description for the group.\n5. You may also specify randomization and relevance options if needed.\n6. After entering the necessary information, click 'Save' to add the question group to your survey.""}]",knowledge/php/limesurvey,1.0,train
"[{""from"": ""human"", ""value"": ""What functionalities are available in the LimeSurvey toolbar?""}, {""from"": ""gpt"", ""value"": ""The LimeSurvey toolbar contains several functionalities including:\n1. **Tutorials**: Offers access to beginner tours to understand LimeSurvey features.\n2. **Configuration**: Adjust settings, manage users, and customize surveys.\n3. **Surveys**: Options to create, import, copy, or list surveys.\n4. **Response Balance**: Shows how many responses are remaining based on your subscription.\n5. **Storage**: View how much storage space is available.\n6. **Username management**: View preferences and log out.\n7. **Notifications**: View updates related to your LimeSurvey application.""}]",knowledge/php/limesurvey,1.0,train
"[{""from"": ""human"", ""value"": ""What happens when a survey in LimeSurvey is activated?""}, {""from"": ""gpt"", ""value"": ""When a survey in LimeSurvey is activated, it becomes available for respondents to access. However, several restrictions apply post-activation: you cannot add or delete question groups or alter existing questions. Additionally, survey settings such as anonymizing responses and saving IP addresses can be configured before activation. Once the survey is live, you can start sharing its URL for respondents to submit their answers.""}]",knowledge/php/limesurvey,1.0,train
"[{""from"": ""human"", ""value"": ""How can I export survey results in LimeSurvey?""}, {""from"": ""gpt"", ""value"": ""To export survey results in LimeSurvey, you need to:\n1. Access the survey you wish to analyze.\n2. Click on 'Responses' located on the toolbar, then select 'Responses & Statistics'.\n3. This will direct you to the 'Browse Responses' page, where you can click 'Export' from the top toolbar.\n4. Choose your desired format (e.g., CSV, XLS, etc.).\n5. After setting any necessary filters, click 'Export' located in the upper-right side of the window to download your results.""}]",knowledge/php/limesurvey,1.0,train
"[{""from"": ""human"", ""value"": ""What is the significance of the 'Date Format' option in survey creation?""}, {""from"": ""gpt"", ""value"": ""The 'Date Format' option in survey creation is crucial because it determines how date inputs from respondents will be recorded and displayed. Different regions have various conventions for date representations (e.g., MM/DD/YYYY in the US vs DD/MM/YYYY in Europe). Selecting the format that respondents recognize is vital for data integrity and ensures that participants do not face confusion when providing their input.""}]",knowledge/php/limesurvey,1.0,train
"[{""from"": ""human"", ""value"": ""Explain how to create a new survey in LimeSurvey.""}, {""from"": ""gpt"", ""value"": ""To create a new survey in LimeSurvey, perform the following steps:\n1. Click on the 'Create survey' box on your LimeSurvey homepage.\n2. On the 'Create survey' page, fill the required fields such as 'Survey Title' and 'Basic Language'.\n3. Optionally, enable 'Sample Question' to add a question group with examples.\n4. Set the 'End URL' if you want to redirect users after completion.\n5. Fill in the 'Date Format', 'Decimal Format', and any other optional descriptions or messages.\n6. Click 'Save' to save the new survey.""}]",knowledge/php/limesurvey,1.0,train
"[{""from"": ""human"", ""value"": ""How can you manage question order in a LimeSurvey survey?""}, {""from"": ""gpt"", ""value"": ""To manage question order within a LimeSurvey survey, follow these steps:\n1. Access the 'Structure' tab from the left menu after selecting your survey.\n2. Find the question or question group you wish to move.\n3. Click the three-line icon next to the question/group and drag it to the desired position.\n4. Reorganizing this way allows for easy rearrangement without having to edit each question individually, streamlining the process when dealing with numerous questions.""}]",knowledge/php/limesurvey,1.0,train
"[{""from"": ""human"", ""value"": ""What steps are necessary for managing subquestions in LimeSurvey?""}, {""from"": ""gpt"", ""value"": ""To manage subquestions in LimeSurvey, take the following steps:\n1. Go to the question where you want to add subquestions.\n2. Click on 'Edit subquestions' within the question's editing interface.\n3. Input the subquestions into the provided text box and use the 'green plus sign' to add more subquestions as needed.\n4. Save your changes once all subquestions have been added to ensure they are stored in the survey.""}]",knowledge/php/limesurvey,1.0,train
"[{""from"": ""human"", ""value"": ""What are the different pricing options offered by LimeSurvey?""}, {""from"": ""gpt"", ""value"": ""LimeSurvey offers the following pricing options: \n1. **Free**: A basic plan suitable for limited response data and features.\n2. **Basic**: A mid-tier plan that offers increased response limits and additional features.\n3. **Expert**: A higher tier plan intended for users with advanced requirements.\n4. **Enterprise**: Designed for comprehensive control and support options suited for larger organizations.""}]",knowledge/php/limesurvey,1.0,train
"[{""from"": ""human"", ""value"": ""How can I receive updates and news from LimeSurvey after creating an account?""}, {""from"": ""gpt"", ""value"": ""After creating your LimeSurvey account, you can receive updates and news by opting into the LimeSurvey newsletter during the registration process. This will allow you to stay informed about tips, service discounts, and important updates. If you wish to unsubscribe later, you can do so at any time using the link provided in the newsletters.""}]",knowledge/php/limesurvey,1.0,train
"[{""from"": ""human"", ""value"": ""What functionality does the 'Backup Entire Database' option provide?""}, {""from"": ""gpt"", ""value"": ""The 'Backup Entire Database' option in LimeSurvey allows users to create a backup of all survey data stored in the database. This is critical for data security, especially before performing major upgrades or transferring the LimeSurvey application to another server. Backing up regularly protects against data loss and ensures that you can restore previous versions of surveys as necessary.""}]",knowledge/php/limesurvey,1.0,train
"[{""from"": ""human"", ""value"": ""How can users interact with the LimeSurvey community?""}, {""from"": ""gpt"", ""value"": ""Users can interact with the LimeSurvey community through various platforms such as:\n1. **Forums**: For Q&A and support from other users as well as LimeSurvey team members.\n2. **Discord**: For real-time communication and assistance, join the LimeSurvey community chat on Discord.\n3. **Community Chat**: By participating in discussions and sharing experiences or solutions to common issues.""}]",knowledge/php/limesurvey,1.0,train
"[{""from"": ""human"", ""value"": ""What are the advanced features available in LimeSurvey for experienced users?""}, {""from"": ""gpt"", ""value"": ""Advanced users can take advantage of features such as:\n1. **Custom themes**: Allows users to create and apply custom aesthetic themes to surveys.\n2. **Complex logic**: Offer advanced settings for incorporating logic into surveys, including relevance equations.\n3. **Integration capabilities**: Ability to export data for use in different statistical software tools such as SPSS or R.\n4. **Advanced statistics**: Access to more detailed statistical reporting options including filters for specific data analysis scenarios.""}]",knowledge/php/limesurvey,1.0,train
"[{""from"": ""human"", ""value"": ""How are responses limited based on the subscription plan in LimeSurvey?""}, {""from"": ""gpt"", ""value"": ""The response limit in LimeSurvey is dictated by the chosen subscription plan. For example, users on the free plan are limited to 25 responses per month. As the plans escalate from Basic to Expert and Enterprise, the number of allowed responses increases significantly. Users can purchase additional responses or upgrade their subscription for greater limits when necessary.""}]",knowledge/php/limesurvey,1.0,train
"[{""from"": ""human"", ""value"": ""Describe the importance of the 'Preview question' button in LimeSurvey.""}, {""from"": ""gpt"", ""value"": ""The 'Preview question' button in LimeSurvey is crucial as it allows users to view how a question will appear to survey respondents before it goes live. This functionality helps ensure that questions are clearly understood, properly formatted, and function correctly. By utilizing the preview feature, users can identify and correct issues early, thus enhancing the user experience for those participating in the survey.""}]",knowledge/php/limesurvey,1.0,train
"[{""from"": ""human"", ""value"": ""How do you handle merged responses and their statistics in LimeSurvey?""}, {""from"": ""gpt"", ""value"": ""In LimeSurvey, managing merged responses involves collecting data from multiple survey results and analyzing them as a single dataset to derive insights. Users can do this by utilizing the 'Export' functions available in the Responses section, allowing them to combine data across different surveys or versions. The statistics for merged responses can then be generated based on the consolidated dataset, providing a more comprehensive overview.""}]",knowledge/php/limesurvey,1.0,train
"[{""from"": ""human"", ""value"": ""What are the steps to set the 'Decimal Format' in a survey?""}, {""from"": ""gpt"", ""value"": ""To set the 'Decimal Format' in a LimeSurvey survey, you should follow these steps:\n1. While creating or editing a survey, locate the 'Decimal Format' option on the 'Create survey' page.\n2. Select either the dot (.) or comma (,) format, depending on the regional preferences where the survey is being conducted.\n3. Ensure that the selected format aligns with the expected inputs from survey respondents to avoid confusion.""}]",knowledge/php/limesurvey,1.0,train
"[{""from"": ""human"", ""value"": ""How can one access the LimeSurvey manual for detailed guidance?""}, {""from"": ""gpt"", ""value"": ""To access the LimeSurvey manual for detailed guidance, visit the LimeSurvey website and navigate to the manual section, or directly access the URL: https://manual.limesurvey.org. The manual contains thorough documentation on LimeSurvey's capabilities, features, and instructions on how to maximize the use of the application.""}]",knowledge/php/limesurvey,1.0,train
"[{""from"": ""human"", ""value"": ""What resources does LimeSurvey provide for troubleshooting and community support?""}, {""from"": ""gpt"", ""value"": ""LimeSurvey provides various resources for troubleshooting and community support including:\n1. **Online Forums**: A community-driven forum for users to ask questions and share solutions.\n2. **Discord Community**: A platform for real-time discussions with fellow users and support from the LimeSurvey team.\n3. **Documentation**: Detailed manuals and guides for users to learn about all aspects of the application.\n4. **FAQs**: Commonly asked questions with answers to assist new users quickly.""}]",knowledge/php/limesurvey,1.0,train
"[{""from"": ""human"", ""value"": ""What should be done if a user wants to modify their survey after activation?""}, {""from"": ""gpt"", ""value"": ""Once a survey is activated in LimeSurvey, users cannot modify or delete existing question groups or questions. To address necessary changes, users can deactivate the survey first. This allows them to edit questions and restructure the survey as needed. After making the modifications, users can then reactivate the survey, allowing them to share the updated version with participants.""}]",knowledge/php/limesurvey,1.0,train
"[{""from"": ""human"", ""value"": ""How are statistics displayed for surveys in LimeSurvey?""}, {""from"": ""gpt"", ""value"": ""Statistics for surveys in LimeSurvey are displayed after accessing the 'Statistics' button located in the Responses tab. A new window will present a set of graphs that visually represent the survey data. Users have options to export these visualizations as images for reports. Additionally, users can engage expert mode for more advanced statistical filters and choose how statistics are presented (HTML, Excel, PDF format).""}]",knowledge/php/limesurvey,1.0,train
"[{""from"": ""human"", ""value"": ""What are the best practices for creating effective online surveys with LimeSurvey?""}, {""from"": ""gpt"", ""value"": ""Best practices for creating effective online surveys with LimeSurvey include:\n1. **Define Clear Objectives:** Be clear about what you want to learn from the survey to formulate effective questions.\n2. **Keep it Short:** Shorter surveys tend to have higher completion rates. Avoid unnecessary questions.\n3. **Use Simple Language:** Ensure questions are easy to understand\n4. **Pilot Testing:** Previewing and testing surveys before launch helps identify potential issues with question clarity or technical aspects.\n5. **Incorporate Logic:** Utilize relevance equations for dynamic question presentation based on respondent answers.""}]",knowledge/php/limesurvey,1.0,train
"[{""from"": ""human"", ""value"": ""How can themes be managed in LimeSurvey?""}, {""from"": ""gpt"", ""value"": ""Themes in LimeSurvey can be managed by accessing the 'Theme editor' located in the 'Advanced Settings.' Here, users have options to add, edit, or delete survey themes. Users can select specific themes for individual surveys or apply custom themes based on their preferences, enhancing the aesthetic and user experience of surveys.""}]",knowledge/php/limesurvey,1.0,train
"[{""from"": ""human"", ""value"": ""What functionalities are offered in the 'Manage Survey Administrators' section?""}, {""from"": ""gpt"", ""value"": ""In the 'Manage Survey Administrators' section, users can perform the following tasks:\n1. **Add New Administrators:** Allow other users access to specific surveys for management and oversight.\n2. **Edit Administrator Roles:** Modify permissions for existing administrators to determine their access levels and capabilities within the survey management system.\n3. **Remove Administrators:** Delete access for individuals who no longer require management capabilities for certain surveys.""}]",knowledge/php/limesurvey,1.0,train
"[{""from"": ""human"", ""value"": ""Describe the process of importing a new survey in LimeSurvey.""}, {""from"": ""gpt"", ""value"": ""To import a new survey in LimeSurvey:\n1. Navigate to the toolbar and select the 'Surveys' section.\n2. Click on 'Import a New Survey'.\n3. Choose the survey file you wish to import, ensuring it is in the appropriate format compatible with LimeSurvey.\n4. Follow the on-screen instructions to complete the import process, which will add the survey data into your LimeSurvey instance.""}]",knowledge/php/limesurvey,1.0,train
"[{""from"": ""human"", ""value"": ""What does the 'Response Balance' feature indicate in LimeSurvey?""}, {""from"": ""gpt"", ""value"": ""The 'Response Balance' feature in LimeSurvey indicates the number of responses remaining for a user's subscription tier. Users with free accounts are restricted to a specific number of responses (e.g., 25 responses per month). This feature helps users monitor their response limit and prompts them to consider upgrading if they need more capacity for their survey data.""}]",knowledge/php/limesurvey,1.0,train
"[{""from"": ""human"", ""value"": ""What tools does LimeSurvey offer for exporting responses and statistics?""}, {""from"": ""gpt"", ""value"": ""LimeSurvey offers tools for exporting responses and statistics through the 'Responses' section in the top toolbar. Users can choose options for exporting data in various formats including CSV and Excel or directly for use in statistical software like SPSS and R. Additionally, charts can be exported as images for reports, providing flexibility in how data analysis is conducted.""}]",knowledge/php/limesurvey,1.0,train
"[{""from"": ""human"", ""value"": ""Can I modify the date format used in my LimeSurvey after the survey has been created?""}, {""from"": ""gpt"", ""value"": ""Yes, you can modify the date format in LimeSurvey even after the survey has been created. To do so, navigate to the survey settings and locate the date format option. Adjust it accordingly to match the expected input from your respondents. However, keep in mind that changes might not retroactively apply to already submitted responses, as those would retain the format in which they were recorded.""}]",knowledge/php/limesurvey,1.0,train
"[{""from"": ""human"", ""value"": ""What is the significance of 'Mandatory' setting for questions in LimeSurvey?""}, {""from"": ""gpt"", ""value"": ""The 'Mandatory' setting in LimeSurvey is significant because it allows administrators to require respondents to answer specific questions before moving on to the next question. This ensures that crucial data is collected and helps in preventing incomplete submissions, which can skew the results of the survey analysis. It is particularly useful for essential questions where data is critical for the survey's objectives.""}]",knowledge/php/limesurvey,1.0,train
"[{""from"": ""human"", ""value"": ""How can a user manage survey responses efficiently in LimeSurvey?""}, {""from"": ""gpt"", ""value"": ""To manage survey responses efficiently in LimeSurvey, users can:\n1. **Utilize Filtering**: Use filters to sort and segment responses based on specific criteria.\n2. **Backup Data**: Regularly back up data to prevent loss.\n3. **Export Options**: Make use of the export functions to analyze responses in preferred statistical software.\n4. **Statistical Tools**: Access in-built tools for visualizing and interpreting response data directly within the platform.""}]",knowledge/php/limesurvey,1.0,train
"[{""from"": ""human"", ""value"": ""What features can be found under 'Central Participant Databases' in LimeSurvey?""}, {""from"": ""gpt"", ""value"": ""The 'Central Participant Databases' feature in LimeSurvey allows administrators to manage and store information about survey respondents in a centralized database. This includes functionalities such as:\n1. **Data Management**: Easily store, edit, and query participant information across multiple surveys.\n2. **Integration**: Enables integration with participant token management, ensuring that respondents can be tracked across different surveys.""}]",knowledge/php/limesurvey,1.0,train
"[{""from"": ""human"", ""value"": ""What should users keep in mind when choosing the 'Username' for their LimeSurvey account?""}, {""from"": ""gpt"", ""value"": ""When choosing a 'Username' for their LimeSurvey account, users should keep the following in mind:\n1. **Readability**: Choose a username that is easy to read and remember.\n2. **Private Information**: Avoid using personal information that could compromise privacy.\n3. **Access Consistency**: Ensure the username is intuitive for recalling account access in the future.""}]",knowledge/php/limesurvey,1.0,train
"[{""from"": ""human"", ""value"": ""What are the best approaches for structuring a survey in LimeSurvey?""}, {""from"": ""gpt"", ""value"": ""Best approaches for structuring a survey in LimeSurvey include:\n1. **Clear Title and Objectives**: Start with a clear and concise title to reflect the survey\u2019s purpose.\n2. **Logical Grouping**: Organize questions into related groups to provide a coherent flow of topics.\n3. **Use of Logic**: Implement conditions to control question visibility based on previous answers.\n4. **Test Functionality**: Continuously test the survey structure to ensure that navigation is logical and intuitive.""}]",knowledge/php/limesurvey,1.0,train
"[{""from"": ""human"", ""value"": ""How can survey responses be made anonymous in LimeSurvey?""}, {""from"": ""gpt"", ""value"": ""To make survey responses anonymous in LimeSurvey, follow these steps:\n1. Navigate to the survey settings before activation.\n2. Locate the 'Anonymized Responses' option and enable it.\n3. Ensure that the settings are applied so that no personally identifiable information is linked to the responses.\n4. Note that once a survey is activated with this setting, the responses cannot be traced back to individual participants.""}]",knowledge/php/limesurvey,1.0,train
