conversations,source,score,split
"[{""from"": ""human"", ""value"": ""What is the primary purpose of LimeSurvey?""}, {""from"": ""gpt"", ""value"": ""The primary purpose of LimeSurvey is to facilitate the creation, distribution, and analysis of online surveys. It allows users to gather responses to specific questions, analyze the data through various statistical methods, and export results for further examination. The tool aims to provide an intuitive interface for both survey creators and respondents, enabling effective collection of qualitative and quantitative data.""}]",knowledge/php/limesurvey,1.0,train
"[{""from"": ""human"", ""value"": ""How do you access the statistics feature in LimeSurvey?""}, {""from"": ""gpt"", ""value"": ""To access the statistics feature in LimeSurvey, follow these steps:\n1. Ensure that your survey is activated.\n2. Navigate to the \\u201cResponses and Statistics\\u201d section by clicking on the \\u201cResponses\\u201d menu.\n3. Once in the Responses menu, select \\u201cStatistics\\u201d located on the top toolbar. \nThis will direct you to the statistics display page where you can begin analyzing the collected survey data.""}]",knowledge/php/limesurvey,1.0,train
"[{""from"": ""human"", ""value"": ""What are the two modes available for displaying LimeSurvey statistics?""}, {""from"": ""gpt"", ""value"": ""LimeSurvey offers two modes for displaying statistics: \n1. **Expert Mode**: This mode provides advanced features allowing users to filter data and access detailed summaries and statistical outputs. It presents a comprehensive view of the survey data and offers export options in formats like Excel and CSV.\n2. **Simple Mode**: This mode simplifies the statistics display by offering basic bar chart statistics that can be quickly exported. It is tailored for users who require straightforward presentations of survey results without the complexity of the expert mode.""}]",knowledge/php/limesurvey,1.0,train
"[{""from"": ""human"", ""value"": ""What functionalities are available in the 'expert mode' of LimeSurvey statistics?""}, {""from"": ""gpt"", ""value"": ""In the 'Expert Mode' of LimeSurvey statistics, users have access to a range of features, including:\n1. **Data Filtering**: Users can apply general and response filters to analyze specific subsets of data based on characteristics like response completion and participant languages.\n2. **Response Summaries**: For each question, users can select checkboxes to obtain a summary of responses, along with detailed statistics for each question.\n3. **Export Options**: The data can be exported into different formats, including Excel and CSV, which allows for further analysis in statistical software.\n4. **Graphs and Visuals**: Users can generate various charts (e.g., bar charts, pie charts) to better visualize the survey data, although some question types may not support graphing.""}]",knowledge/php/limesurvey,1.0,train
"[{""from"": ""human"", ""value"": ""What are the two types of filters available in LimeSurvey's statistics?""}, {""from"": ""gpt"", ""value"": ""LimeSurvey statistics offer two types of filters:\n1. **General Filters**: These filters allow users to apply broad selections that affect the dataset as a whole, such as filtering complete or incomplete responses and segmenting responses based on language used.\n2. **Response Filters**: These filters enable targeting specific responses based on factors associated with individual questions. Users can filter responses by selecting specific answers, searching for text, or specifying numerical values to refine results accordingly.""}]",knowledge/php/limesurvey,1.0,train
"[{""from"": ""human"", ""value"": ""How can one filter data by response in LimeSurvey's expert statistics?""}, {""from"": ""gpt"", ""value"": ""To filter data by response in LimeSurvey's expert statistics, you can follow these steps:\n1. Navigate to the statistics page in expert mode.\n2. For each question, you will see a list of responses. Click on one or more responses you want to filter by.\n3. If necessary, hold the CTRL key to select multiple responses from the same question.\n4. Once you have selected the desired responses, click on the \\u201cView statistics\\u201d button to generate results based on your filtered criteria.\nThis method allows you to focus your analysis on specific segments of your response data, providing a tailored understanding of survey results.""}]",knowledge/php/limesurvey,1.0,train
"[{""from"": ""human"", ""value"": ""What types of charting capabilities does LimeSurvey offer in the statistics export?""}, {""from"": ""gpt"", ""value"": ""In LimeSurvey, the charting capabilities available in the statistics export include various types of graphs. Depending on the question type, the following charts can be generated:\n1. **Pie Charts**: Available for single choice questions, visually representing the proportionate distribution of responses.\n2. **Bar Charts**: Suitable for multiple choice questions and can display counts or percentages of each option chosen by respondents.\n3. **Radar Charts**: Useful for displaying multivariate data for qualitative assessments.\n4. **Line Charts**: Good for representing data points in a continuous manner, often used for tracking changes over a period.\n5. **Doughnut Charts**: Similar to pie charts but with a hole in the center, allowing for visual representation with clear label display.\nHowever, it is important to note that some question types, like numerical input questions, do not support graphical representations and will instead display summary statistics in tabular form.""}]",knowledge/php/limesurvey,1.0,train
"[{""from"": ""human"", ""value"": ""What should one be cautious about when using response filters in LimeSurvey?""}, {""from"": ""gpt"", ""value"": ""When using response filters in LimeSurvey, there are a few important considerations:\n1. **Filtering on the Same Question**: It is advised not to apply criteria on the same question from which you are generating summary statistics. This can lead to a misleading understanding of the data, as the output will only reflect responses that match the filter criteria.\n2. **Selecting Multiple Responses**: When selecting multiple entries for a question, make sure to hold down the CTRL key for proper selection. Conversely, if you need to deselect an entry, clicking the respective highlighted answer while pressing the CTRL key will clear that selection.\n3. **Check Criteria Before Viewing**: Always review the filters you have applied before clicking \\u201cView statistics\\u201d to ensure that the data being displayed aligns with your analytical needs.""}]",knowledge/php/limesurvey,1.0,train
"[{""from"": ""human"", ""value"": ""What are incomplete responses in LimeSurvey statistics?""}, {""from"": ""gpt"", ""value"": ""Incomplete responses in LimeSurvey statistics refer to survey entries where participants began answering questions but did not finish the survey. Specifically, an incomplete response occurs if:\n- The participant navigates to the next page but does not click the final submission button, thus not reaching the survey's end page.\n- As a result, these entries do not have a corresponding submission date stored in the responses table. However, a new data set is created for this entry, which can be identified and analyzed as part of overall survey statistics.""}]",knowledge/php/limesurvey,1.0,train
"[{""from"": ""human"", ""value"": ""What options are available for exporting LimeSurvey statistics?""}, {""from"": ""gpt"", ""value"": ""LimeSurvey statistics can be exported in three different formats:\n1. **HTML**: This is the default format, displaying the statistics directly in the LimeSurvey interface, allowing for immediate review.\n2. **PDF**: When selected, a pop-up prompts the user to save the statistics as a PDF file, which can be shared or printed for reporting purposes.\n3. **Excel**: This option enables users to export filtered data into an Excel file format, facilitating more advanced data manipulation and analysis using spreadsheet software or statistical tools such as SPSS or R.""}]",knowledge/php/limesurvey,1.0,train
"[{""from"": ""human"", ""value"": ""How does LimeSurvey handle public statistics?""}, {""from"": ""gpt"", ""value"": ""LimeSurvey allows for the display of public statistics to survey participants once they have completed the survey. To enable this feature, two key settings need to be configured:\n1. The public statistics option must be activated under the Presentation tab of the survey settings, which is turned off by default.\n2. For questions to be displayed in public statistics, each question must be individually set to show in public statistics through the Statistics tab of the question settings.\nOnce enabled, participants will see a link to view survey statistics after completing the survey, providing them insights into survey results while maintaining anonymity.""}]",knowledge/php/limesurvey,1.0,train
"[{""from"": ""human"", ""value"": ""What type of graphs can be displayed in public statistics?""}, {""from"": ""gpt"", ""value"": ""In LimeSurvey's public statistics, only bar charts can be displayed. This limitation ensures clarity in the presentation of data accessible to survey participants. When public statistics are enabled and questions are set to display their statistics, respondents will see visual representations of the aggregated data based on their input, contributing to transparent insights about the survey's outcomes.""}]",knowledge/php/limesurvey,1.0,train
"[{""from"": ""human"", ""value"": ""What is the alternative if a custom logo is needed in the PDF of LimeSurvey statistics?""}, {""from"": ""gpt"", ""value"": ""To embed a custom logo in the statistics PDF generated by LimeSurvey, the user must place a file named \""statistics.jpg\"" into the \""images\"" folder of the admin theme currently being used. This is important to ensure that the logo is correctly included in the exported PDF. Additionally, the desired admin theme can be set within the Global Settings of LimeSurvey. Ensuring that the logo file is appropriately named and located will allow for successful integration into the PDF output.""}]",knowledge/php/limesurvey,1.0,train
"[{""from"": ""human"", ""value"": ""What is a potential solution if the font appears wrong when exporting statistics?""}, {""from"": ""gpt"", ""value"": ""If the font appears incorrect when exporting statistics in LimeSurvey, especially for languages like Chinese that require specific character sets, a potential solution is to set a different TTF font file in the configuration. This can be done by modifying the $chartfontfile setting in the config.php file. It is advisable to check config-defaults.php for the correct settings. For example, the FireFlySung font, which supports Chinese characters, can be downloaded and configured as needed, ensuring that all necessary characters are rendered properly in the exported output.""}]",knowledge/php/limesurvey,1.0,train
"[{""from"": ""human"", ""value"": ""What specific statistical information can be drawn from a 5-point choice question type?""}, {""from"": ""gpt"", ""value"": ""In a 5-point choice question type, the statistical information presented in the 'Sum' column aggregates participant responses to evaluate sentiment toward a particular item or question. The results are often interpreted as follows:\n1. The percentage of participants who 'DISLIKE' the item as the sum of responses '1' and '2'.\n2. The percentage of participants who 'LIKE' the item represented by '4' and '5' responses.\n3. The percentage with a 'NEUTRAL' opinion for responses categorized as '3'.\nThis aggregation allows survey administrators to assess overall sentiment effectively and gauge the level of agreement or disagreement among respondents.""}]",knowledge/php/limesurvey,1.0,train
"[{""from"": ""human"", ""value"": ""What insights do pie charts provide in survey results as visual representations?""}, {""from"": ""gpt"", ""value"": ""Pie charts provide insights into the distribution of responses for single-choice questions in survey results. By visually segmenting the data, they help to represent each response's proportion relative to the overall dataset. This allows viewers to quickly identify which options are favored or less preferred among respondents and facilitates a clear understanding of the overall sentiment. The use of pie charts is particularly effective in presentations and reports where comprehensibility is key, aiding in decision-making based on survey outcomes.""}]",knowledge/php/limesurvey,1.0,train
"[{""from"": ""human"", ""value"": ""How can one switch from simple mode to expert mode in LimeSurvey statistics?""}, {""from"": ""gpt"", ""value"": ""To switch from simple mode to expert mode in LimeSurvey statistics, locate the \u201cExpert mode\u201d button situated in the upper-right part of the screen while you are in simple mode. Clicking this button will redirect you to the expert mode, where you can access more advanced features including data filtering, detailed summaries, and export functionalities. This flexibility allows users to choose the level of detail they require for their statistical analysis.""}]",knowledge/php/limesurvey,1.0,train
"[{""from"": ""human"", ""value"": ""Explain the structure of the statistics page when in expert mode.""}, {""from"": ""gpt"", ""value"": ""When accessed in expert mode, the statistics page in LimeSurvey is structured to provide users with comprehensive tools for data analysis. The layout typically includes:\n1. **Questions and Response Selection**: A section where users can check the boxes for questions they want to analyze. It might include options to view summaries for all available fields.\n2. **Filtering Options**: Areas dedicated to applying general and response filters that allow for narrowing down the dataset based on completion status, demographics, or specific answers.\n3. **Results Table**: After applying filters and selecting questions, users can view the results displayed in a tabular format, showing counts and percentages for each selected question.\n4. **Export Buttons**: Options to export the results in different formats such as HTML, PDF, and Excel, providing flexibility for reporting or further analysis.\n5. **Graph Displays**: Various charts and graphs that visually represent the data, dependent on the settings applied during the analysis.""}]",knowledge/php/limesurvey,1.0,train
"[{""from"": ""human"", ""value"": ""What is the significance of enabling 'Show graphs' option in LimeSurvey statistics?""}, {""from"": ""gpt"", ""value"": ""Enabling the 'Show graphs' option in LimeSurvey statistics holds significance as it allows users to visualize data representation effectively. When this option is activated, the statistics output will include relevant charts that correspond to the filtered responses and selected questions, enhancing understanding through visual summaries. This is particularly helpful for presentations and reporting, as graphs can quickly convey trends and sentiments that might be less apparent in raw numerical data. However, it is important to note that the option is disabled by default, requiring deliberate activation by the user.""}]",knowledge/php/limesurvey,1.0,train
"[{""from"": ""human"", ""value"": ""What role does users' language play in filtering survey responses?""}, {""from"": ""gpt"", ""value"": ""The users' language plays a crucial role in filtering survey responses in LimeSurvey as it allows for segmentation based on the demographic language choice of participants. This capability ensures that results can be analyzed in the context of the respondents' language, thereby offering insights into potential language-related trends or differences in answers. Language-based filtering is particularly useful when surveys are administered in multiple languages, facilitating targeted analysis that helps understand diverse respondent perspectives.""}]",knowledge/php/limesurvey,1.0,train
"[{""from"": ""human"", ""value"": ""How can the appearance of the public statistics page be modified?""}, {""from"": ""gpt"", ""value"": ""The appearance of the public statistics page in LimeSurvey can be modified by accessing the template.css file and searching for the identifier \u201c#statsContainer\u201d. Adjustments can be made in this CSS file to customize the visual layout and design of the page. However, it is important to note that there is currently no template available for editing within the LimeSurvey theme editor, meaning that any changes must be done directly within the CSS code.""}]",knowledge/php/limesurvey,1.0,train
"[{""from"": ""human"", ""value"": ""What challenges exist when exporting Excel statistics that users might face?""}, {""from"": ""gpt"", ""value"": ""When exporting statistics from LimeSurvey to Excel, users may encounter several challenges, such as:\n1. **Compatibility Issues**: Depending on the version of Excel or the CSV format used during export, there can be compatibility issues that prevent correct opening or formatting of the data in Excel.\n2. **Data Complexity**: If extensive filtering or sorting is applied before export, the resulting data set may become complex or large, making it harder to manage once in Excel.\n3. **Loss of Graphs**: It is crucial to note that Excel exports do not contain graphs, which may lead users to miss the visual representation of data unless they manually recreate the charts in Excel.\n4. **Formatting Errors**: Special characters or formatting settings may not carry over well during the export process, requiring users to review and adjust the output manually after opening in Excel.""}]",knowledge/php/limesurvey,1.0,train
"[{""from"": ""human"", ""value"": ""How can users view detailed statistics for specific questions using LimeSurvey?""}, {""from"": ""gpt"", ""value"": ""To view detailed statistics for specific questions in LimeSurvey, users should:\n1. Access the statistics page either in expert mode or simple mode.\n2. Check the checkbox next to each question of interest to include them in the summary.\n3. If desired, enable the \\u201cView summary of all available fields\\u201d option to analyze all questions at once.\n4. Click on the \\u201cView statistics\\u201d button to generate a detailed results table that breaks down responses for each selected question, including counts and percentage summaries.\nThis detailed view enables users to analyze responses systematically and derive insights effectively from the data collected.""}]",knowledge/php/limesurvey,1.0,train
"[{""from"": ""human"", ""value"": ""What happens if a user submits a survey without answering all questions?""}, {""from"": ""gpt"", ""value"": ""If a user submits a survey without answering all questions, the outcome largely depends on how the survey was configured by the administrator regarding question requirements. If questions are marked as non-mandatory, the user may submit the survey with unanswered questions, which will be recorded as 'no answer' in the response table. However, if questions are mandatory, the user will typically be prompted to answer those questions before submission. Consequently, the lack of answers will lead to incomplete response records, potentially impacting the quality and analysis of the collected data.""}]",knowledge/php/limesurvey,1.0,train
"[{""from"": ""human"", ""value"": ""How can responses that contain no answers be identified in LimeSurvey?""}, {""from"": ""gpt"", ""value"": ""Responses that contain no answers in LimeSurvey can be identified through the response summary and analysis tools within the statistics feature. When analyzing the data:\n1. Examine individual question statistics where 'no answer' is recorded as an empty string in the database. \n2. The default display will show counts for each response category, including those marked as 'no answer'.\n3. It's important to note that empty responses will not apply in cases where the question type does not support string values (such as date or numerical questions); these may result in NULL values instead.\nTracking these 'no answer' responses helps survey administrators understand participant engagement and areas where questions might require adjustment for better clarity.""}]",knowledge/php/limesurvey,1.0,train
"[{""from"": ""human"", ""value"": ""How does LimeSurvey calculate the percentage in the 'Sum' column for survey questions?""}, {""from"": ""gpt"", ""value"": ""In LimeSurvey, the percentage calculation in the 'Sum' column for survey questions is based on the total number of responses provided for that specific question. The percentage is computed by considering the counts of responses within defined categories (for example, 1-5 in a Likert scale) and representing their share relative to the total responses received. For instance, if 20 respondents rated a question, with 10 choosing '1', 5 choosing '2', and so forth, the calculations would reflect these proportions: \n- The percentage for '1' would be calculated as (count for 1 / total responses) * 100% for the overall total.\nThis breakdown allows administrators to interpret sentiment and trends efficiently while making informed decisions based on the aggregate data.""}]",knowledge/php/limesurvey,1.0,train
"[{""from"": ""human"", ""value"": ""What advice can be given when dealing with non-completed responses during survey analysis?""}, {""from"": ""gpt"", ""value"": ""When dealing with non-completed responses during survey analysis, here are some key pieces of advice:\n1. **Identification**: First, clearly identify which responses are categorized as non-completed in your data. These are typically entries where participants started but did not finish the survey by clicking the submit button.\n2. **Contextual Analysis**: Look for trends among non-completed responses. Analyzing whether a specific demographic or question type has higher rates of non-completion can provide insights into potential issues with the survey design.\n3. **Survey Feedback**: Consider implementing follow-up questions to gauge why participants did not complete the survey. Feedback from users can help improve future surveys, targeting common pain points.\n4. **Statistical Handling**: In your final analysis, decide how these non-completed responses will be treated. For example, will they be excluded from overall metrics, or will their intent be captured in a way that offers insights into participant behavior?\nBy carefully addressing non-completed responses, survey administrators can glean valuable insights into the effectiveness and usability of their surveys.""}]",knowledge/php/limesurvey,1.0,train
"[{""from"": ""human"", ""value"": ""How can LimeSurvey help assess the performance of individual survey questions?""}, {""from"": ""gpt"", ""value"": ""LimeSurvey provides tools and methodologies that help assess the performance of individual survey questions through various means:\n1. **Statistical Analysis Tools**: By leveraging the statistics features, users can view how often each question received responses, and analyze the distribution of responses across different options.\n2. **Response Trends**: Users can observe the patterns of responses for each question. For instance, if a majority selects one option consistently, it may indicate clarity or importance of that question.\n3. **Incomplete Response Metrics**: Measuring how many participants left specific questions unanswered provides insights into question relevance or complexity. High rates of non-answering can suggest a need for rewording or reshaping the question for clarity.\n4. **Feedback and Qualitative Data**: Incorporating open-ended questions allows participants to provide comments or suggestions, which can be analyzed qualitatively to assess the effectiveness and comprehension of individual survey items.\nThrough these techniques, LimeSurvey enables administrators to make informed decisions based on empirical data and participant feedback, ensuring that survey questions are effective and relevant.""}]",knowledge/php/limesurvey,1.0,train
"[{""from"": ""human"", ""value"": ""What procedures can be implemented to improve response rates in LimeSurvey?""}, {""from"": ""gpt"", ""value"": ""To improve response rates in LimeSurvey surveys, consider implementing the following procedures:\n1. **Clear Instructions**: Provide clear, concise instructions at the beginning of the survey to inform participants about the purpose and estimated time to complete.\n2. **Engaging Design**: Utilize LimeSurvey's customization options to create an engaging design and user-friendly interface, encouraging participants to take part.\n3. **Shorten Survey Length**: Aim to keep surveys concise. Reducing the number of questions can help keep participants engaged and less likely to abandon it.\n4. **Offer Incentives**: Providing small incentives, like a chance to win a gift card or other recognitions, can motivate more respondents to complete the survey.\n5. **Timely Reminders**: Sending reminders to users who have not yet completed their responses can help maximize participation rates.\n6. **Pilot Testing**: Conducting pilot tests of the survey with a small group can help identify potential barriers to completion and optimize the survey accordingly.\nBy using these strategies, users can significantly enhance survey response rates, ensuring more comprehensive and reliable data collection.""}]",knowledge/php/limesurvey,1.0,train
