conversations,source,score,split
"[{""from"": ""human"", ""value"": ""How can user feedback be integrated into future surveys in LimeSurvey?""}, {""from"": ""gpt"", ""value"": ""User feedback can be integrated into future surveys in LimeSurvey through several key strategies:\n1. **Post-Survey Evaluation**: After participants complete a survey, include an optional feedback question asking about their experience. This can highlight areas for improvement.\n2. **Analyzing Feedback**: Regularly analyze qualitative feedback and comments collected from open-ended questions to understand user perceptions and areas needing attention.\n3. **Continuous Improvement**: Use insights derived from feedback to refine question phrasing, adjust design/template features, or modify structure based on what participants find most engaging or confusing.\n4. **Iterative Testing**: Before rolling out a new survey, beta test it with a small population to gather feedback on clarity, relevance, and engagement, applying adjustments accordingly.\n5. **Survey Metrics**: Keep track of metrics such as response rates, completion rates, and dropout points, using this data to inform decisions about future surveys.\nBy incorporating user feedback into the development process of future surveys, LimeSurvey enables continual enhancement of survey designs, ultimately leading to better engagement and data quality.""}]",knowledge/php/limesurvey,1.0,train
"[{""from"": ""human"", ""value"": ""Explain the role of general filters in LimeSurvey statistics.""}, {""from"": ""gpt"", ""value"": ""General filters in LimeSurvey statistics serve a critical role in enabling survey administrators to perform macro-level analysis of survey data. They allow users to apply broad, overarching criteria to filter collected responses before detailed analysis. This can include:\n1. **Data Selection Controls**: General filters let users choose between different types of responses (e.g., complete, incomplete, and all records).\n2. **Language Filters**: If multiple languages are used in the survey, general filters facilitate segmentation of data based on the language respondents used to complete the survey.\n3. **Overall Trends**: By applying general filters, administrators can identify broad patterns or trends within the dataset, which can form the basis for deeper analysis.\n4. **Efficiency and Clarity**: These filters streamline the data analysis process by allowing users to focus on specific aspects of the responses, which increases the efficiency of drawing insights and makes the data interpretation more manageable.\nOverall, general filters enhance the analytical capabilities within LimeSurvey, offering flexibility and precision in the examination of survey results.""}]",knowledge/php/limesurvey,1.0,train
"[{""from"": ""human"", ""value"": ""What steps can be taken to ensure effective survey designs in LimeSurvey?""}, {""from"": ""gpt"", ""value"": ""To ensure effective survey designs in LimeSurvey, administrators can follow these steps:\n1. **Clear Objectives**: Define clear and measurable objectives for the survey to guide question creation and ensure that every question serves a specific purpose.\n2. **Relevant Questions**: Include questions that are relevant to the survey topic. Avoid superfluous questions that could lead to respondent fatigue.\n3. **User-Friendly Layout**: Use LimeSurvey's design tools to create an intuitive layout that enhances user experience and engagement.\n4. **Pilot Testing**: Conduct pilot tests on a small segment to identify potential issues and gather initial feedback to refine the survey before broader deployment.\n5. **Optimized Question Formats**: Choose appropriate question types (multiple-choice, open-ended, etc.) that best capture the needed data and suit the respondent demographic.\n6. **Logical Flow**: Arrange questions in a logical sequence that follows a natural flow, making it easy for respondents to answer.\n7. **Feedback Mechanisms**: After the survey, consider incorporating feedback elements to gain insights into the user experience and improve future surveys.\nBy integrating these steps into the survey design process within LimeSurvey, users can create effective surveys that yield valuable and actionable data.""}]",knowledge/php/limesurvey,1.0,train
"[{""from"": ""human"", ""value"": ""How does LimeSurvey support exportation of survey data?""}, {""from"": ""gpt"", ""value"": ""LimeSurvey supports the exportation of survey data in various ways to facilitate analysis and reporting. These include:\n1. **Format Versatility**: Users can export data in widely-used formats such as HTML for immediate viewing, PDF for sharing or printing documentations, and Excel for further data manipulation or statistical analysis.\n2. **Filtered Data Exports**: Users can apply different filters before exporting, ensuring that only the relevant data collected according to specific criteria is included in the export files.\n3. **Graphical Exports**: While Excel exports do not include graphs, users can save charts and visuals directly from the statistics interface, ensuring that visual representations of data can accompany the statistical datasets provided.\n4. **Custom Reporting**: The flexibility of options in LimeSurvey allows for the creation of tailored reports that align with the needs of stakeholders or decision-makers.\nOverall, the exportation features in LimeSurvey streamline data transition from survey collection to analysis, making it a comprehensive tool for researchers and organizations.""}]",knowledge/php/limesurvey,1.0,train
"[{""from"": ""human"", ""value"": ""What considerations should be addressed concerning the type of questions used in LimeSurvey surveys?""}, {""from"": ""gpt"", ""value"": ""When designing surveys in LimeSurvey, several considerations related to the types of questions utilized should be taken into account:\n1. **Relevance and Clarity**: Questions should be relevant to the survey objectives, ensuring clarity in phrasing to minimize respondent confusion.\n2. **Question Types**: Choose between open-ended or closed questions based on the required depth of responses. While closed questions provide quantifiable data, open-ended questions allow for richer qualitative insights.\n3. **Pilot Testing**: Test different question types during the pilot phase to analyze how they perform in capturing the targeted data.\n4. **Avoid Leading Questions**: Ensure questions are neutral and do not lead respondents to a specific answer which could bias the results.\n5. **Complexity of Questions**: Be cautious of overcomplicated questions that may lead to respondent frustration or disengagement. Keep them straightforward and easy to answer.\nBy addressing these considerations, survey developers can enhance the overall effectiveness and insightfulness of their survey questions within LimeSurvey.""}]",knowledge/php/limesurvey,1.0,train
"[{""from"": ""human"", ""value"": ""In what way does LimeSurvey ensure participant privacy during survey administration?""}, {""from"": ""gpt"", ""value"": ""LimeSurvey ensures participant privacy in various ways during survey administration, which include:\n1. **Anonymity Options**: Administrators can choose to design surveys that do not collect personal identifying information, ensuring that responses remain anonymous.\n2. **Data Encryption**: LimeSurvey can be configured to encrypt response data, providing an added layer of security against unauthorized access.\n3. **Limited Access Control**: Survey data access can be restricted to specific users or roles, ensuring sensitive information is only available to authorized personnel.\n4. **Clear Privacy Policies**: Administrators can communicate a clear privacy policy to participants, informing them how their data will be used, stored, and protected.\n5. **GDPR Compliance**: LimeSurvey provides features that help organizations comply with GDPR and other data protection regulations, emphasizing the importance of participant consent and data rights.\nThrough these measures, LimeSurvey fosters a secure and respectful environment for survey participants, helping to build trust and encourage responses.""}]",knowledge/php/limesurvey,1.0,train
"[{""from"": ""human"", ""value"": ""What features does LimeSurvey provide for analyzing open-ended responses?""}, {""from"": ""gpt"", ""value"": ""LimeSurvey provides several features for analyzing open-ended responses, which include:\n1. **Textual Analysis Tools**: Users can employ various textual analysis techniques to evaluate qualitative data and extract themes or trends from open-ended questions.\n2. **Exporting and Importing Data**: Open-ended responses can be exported for use in specialized qualitative analysis software, enabling deeper examination and coding of qualitative data.\n3. **Coding Options**: Users can categorize or code responses manually or use automated coding features that assist in grouping similar responses for comparative analysis.\n4. **Reporting Features**: LimeSurvey allows for the generation of summaries showcasing key themes or insights drawn from open-ended responses, making it easier for stakeholders to review findings.\n5. **Feedback Summaries**: The platform facilitates summarization of open-text feedback, helping to deliver concise insights alongside quantitative data presented in survey reports.\nBy incorporating these analytical features, LimeSurvey enhances its capability to derive insights from open-ended responses, complementing quantitative findings with qualitative depth.""}]",knowledge/php/limesurvey,1.0,train
"[{""from"": ""human"", ""value"": ""How can survey administrators utilize LimeSurvey for longitudinal studies?""}, {""from"": ""gpt"", ""value"": ""Survey administrators can utilize LimeSurvey for longitudinal studies through various functionalities that facilitate tracking changes over time, including:\n1. **Consistent Survey Design**: Administrators can maintain a consistent survey format across different time points, ensuring comparability of data.\n2. **Participant Tracking**: Use of unique identifiers or participant codes allows for tracking the same individuals across multiple survey administrations.\n3. **Data Management**: LimeSurvey enables the storage of multiple responses from the same participants, making it easy to analyze changes in perceptions or behaviors over time.\n4. **Reminders and Follow-ups**: Administrators can send reminders to participants to encourage ongoing engagement and ensure completion at different intervals.\n5. **Comprehensive Reporting**: The software provides tools for aggregating and comparing longitudinal data, assisting administrators in analyzing trends and patterns effectively.\nBy leveraging these capabilities, LimeSurvey supports researchers in conducting longitudinal studies with valuable insights into shifts and developments within populations.""}]",knowledge/php/limesurvey,1.0,train
"[{""from"": ""human"", ""value"": ""What potential issues might arise when conducting cross-cultural surveys using LimeSurvey?""}, {""from"": ""gpt"", ""value"": ""When conducting cross-cultural surveys using LimeSurvey, several potential issues may arise, including:\n1. **Language Barriers**: Differences in language can lead to misinterpretations of questions and responses, necessitating careful translation and cultural adaptation of survey content.\n2. **Cultural Sensitivity**: Certain topics or questions may be perceived differently across cultures, making it essential to ensure that the survey respects cultural norms and values.\n3. **Question Format Variability**: Preferences for question types can vary significantly among cultures, which may affect participants' understanding and comfort with the survey format.\n4. **Sampling and Reach**: Ensuring a representative sample across diverse cultural groups can be challenging, requiring targeted outreach and engagement strategies to reach intended populations.\n5. **Technological Accessibility**: Access to technology varies among cultures, potentially affecting the ability of respondents to complete online surveys, which LimeSurvey primarily facilitates.\nBy being aware of these issues, survey administrators can design and implement surveys in a way that minimizes cultural biases and improves data quality across different populations.""}]",knowledge/php/limesurvey,1.0,train
"[{""from"": ""human"", ""value"": ""What methodologies can be employed to effectively analyze large volumes of survey data within LimeSurvey?""}, {""from"": ""gpt"", ""value"": ""To effectively analyze large volumes of survey data within LimeSurvey, consider employing the following methodologies:\n1. **Automated Reporting**: Utilize the built-in reporting and statistical features of LimeSurvey to automate the analysis of large datasets, reducing time and manual effort significantly.\n2. **Data Filtering**: Apply general and response filters to break down large datasets into manageable subsets, focusing on specific demographics or response categories that are most relevant to the analysis.\n3. **Visualization Tools**: Use LimeSurvey's graphing capabilities to visualize trends and distributions within the data, making it easier to identify patterns and insights within large volumes of responses.\n4. **Export for Further Analysis**: When datasets become too large, export them to specialized statistical software like SPSS, R, or Python for advanced statistical analysis and visualization techniques beyond LimeSurvey\u2019s scope.\n5. **Iterative Analysis**: Implement a process of iterative analysis, reviewing data at multiple stages of collection to identify trends or unexpected patterns early, which can help guide further inquiries and adjustments as needed.\nBy applying these methodologies, survey administrators can efficiently analyze and derive insights from large volumes of survey data captured in LimeSurvey.""}]",knowledge/php/limesurvey,1.0,train
"[{""from"": ""human"", ""value"": ""How does LimeSurvey support the integration of multimedia elements in surveys?""}, {""from"": ""gpt"", ""value"": ""LimeSurvey supports the integration of multimedia elements within surveys through several functionalities, which include:\n1. **File Upload Questions**: Administrators can include file upload questions that enable participants to submit video, audio, or image files as part of their responses.\n2. **Embedding Media**: Surveys can incorporate embedded media such as videos or audio clips directly into questions, engaging participants and providing context or instructions as needed.\n3. **Customizable HTML Content**: Users can customize survey questions and instructions using HTML, facilitating the inclusion of multimedia links, images, or other interactive elements to enhance respondent experience.\n4. **Responsive Design**: Given that surveys are accessible on various devices, LimeSurvey's responsive design ensures that multimedia elements are displayed correctly across platforms, enhancing usability.\nBy leveraging these multimedia integration capabilities, LimeSurvey enables survey developers to create rich and engaging surveys that can enhance participant interaction and data quality.""}]",knowledge/php/limesurvey,1.0,train
"[{""from"": ""human"", ""value"": ""What best practices should be followed for maintaining survey validity in LimeSurvey?""}, {""from"": ""gpt"", ""value"": ""To maintain survey validity in LimeSurvey, survey creators should adhere to the following best practices:\n1. **Clear Objectives & Hypotheses**: Formulate explicit objectives that drive the development of survey questions, ensuring that each question aligns with the overarching goals.\n2. **Pilot Testing**: Conduct pilot tests to identify biases, unclear wording, or invalid questions before full deployment, allowing for refinements that improve question clarity.\n3. **Randomization Techniques**: Consider using randomization methods for question order and answer choices to minimize response bias and enhance the reliability of data collected.\n4. **Diverse Sampling**: Ensure the sample population is diverse and representative of the target demographic to bolster the generalizability of findings beyond individual responses.\n5. **Regular Updates**: Revisit and update survey instruments periodically to reflect changes in the subject matter and ensure ongoing relevance and validity of the questions posed.\nBy consistently applying these best practices, survey administrators can enhance the validity and reliability of the data collected in LimeSurvey.""}]",knowledge/php/limesurvey,1.0,train
