conversations,source,score,split
"[{""from"": ""human"", ""value"": ""What is the purpose of the survey participants functionality in LimeSurvey?""}, {""from"": ""gpt"", ""value"": ""The purpose of the survey participants functionality in LimeSurvey is to manage the participation of individuals in a survey effectively. It allows the survey administrator to invite participants, track their responses, and ensure that each participant can only take the survey once. Key features include the ability to import participant lists, generate unique token codes, send email invitations and reminders, track responses, and restrict access to the survey based on token usage. This functionality is crucial for maintaining the integrity and security of the survey data collected.""}]",knowledge/php/limesurvey,1.0,train
"[{""from"": ""human"", ""value"": ""How can you initialize a survey participants table in LimeSurvey?""}, {""from"": ""gpt"", ""value"": ""To initialize a survey participants table in LimeSurvey, navigate to the following path: '''Settings''' > '''Survey menu''' > '''Survey participants'''. This action sets up a table that will manage your survey participants. After initializing, the survey will switch to closed-access mode, meaning only participants who enter a unique and unused token will have access to the survey. A confirmation window will pop up, indicating successful creation of the survey participants table.""}]",knowledge/php/limesurvey,1.0,train
"[{""from"": ""human"", ""value"": ""What features do you have in the survey participant summary?""}, {""from"": ""gpt"", ""value"": ""The survey participant summary includes several key features:\n1. **Total records**: Displays the number of survey participants present in the survey participants table.\n2. **Total with no unique token**: Shows the number of participants who do not have an assigned token code.\n3. **Total invitations sent**: Indicates how many invitations have been sent to participants via the survey participants table.\n4. **Total opted out**: Lists the number of survey participants who have chosen to opt-out of the survey.\n5. **Total screened out**: Reflects the number of participants excluded based on specific criteria.\n6. **Total surveys completed**: Counts the number of surveys that have been completed by participants using their allocated token codes.\nThese metrics help administrators manage and analyze participant data effectively.""}]",knowledge/php/limesurvey,1.0,train
"[{""from"": ""human"", ""value"": ""How do you manage attributes in the survey participants table?""}, {""from"": ""gpt"", ""value"": ""Managing attributes in the survey participants table involves adding and editing additional fields that store custom participant data. This can be accomplished by accessing the '''Manage attributes''' option. Here\u2019s how to do it:\n1. Type the number of new attribute fields you want to add and click on the '''Add fields''' button.\n2. In the attributes management section, you will find options to specify the attribute field name, field description, mandatory status, and whether to show the field during registration.\n3. After entering the necessary information, click the '''Save''' button to apply changes.\nThis process allows survey administrators to tailor the participant table to meet specific data collection needs.""}]",knowledge/php/limesurvey,1.0,train
"[{""from"": ""human"", ""value"": ""Describe the process of importing participants from a CSV file in LimeSurvey?""}, {""from"": ""gpt"", ""value"": ""To import participants from a CSV file in LimeSurvey, follow these steps:\n1. Navigate to the import function under the survey participants table and select the '''Choose the CSV file to upload''' option.\n2. Ensure that your CSV file adheres to the required format: the first line must contain field names such as 'firstname', 'lastname', and 'email'. Other optional fields include 'emailstatus', 'token', 'language', etc.\n3. Select the character set used in your CSV file and the separator (either comma or semicolon).\n4. Options are available to filter out blank and invalid email addresses, display attribute warnings, filter duplicates, and define which fields to identify duplicates.\n5. After configuring the import settings, click the '''Upload''' button to begin the import process.\nIf there are issues importing, ensure the CSV format is valid, especially if it was edited in Excel which may alter the separator.""}]",knowledge/php/limesurvey,1.0,train
"[{""from"": ""human"", ""value"": ""What are the common troubleshooting steps for import errors in LimeSurvey?""}, {""from"": ""gpt"", ""value"": ""Common troubleshooting steps for import errors in LimeSurvey include:\n1. **CSV Format Check**: Ensure that the CSV file adheres to the standard format. The first line should contain the correct field names, and there should be no empty values in mandatory fields.\n2. **Separator Verification**: Check whether the separator is a comma or semicolon. If using Excel to save the file, verify the separator by opening it in a text editor.\n3. **Review Duplicate Records**: Ensure that the 'Filter duplicate records' option is properly set to identify duplicates based on predefined criteria.\n4. **Attribute Warnings**: Enable 'Display attribute warnings' to receive notifications during the import process about any issues with the attributes.\n5. **Error Notification**: Review any error messages that appear during the import and address them accordingly.\nUtilizing these checks can usually resolve issues encountered during participant data import.""}]",knowledge/php/limesurvey,1.0,train
"[{""from"": ""human"", ""value"": ""Explain the function of generating tokens in LimeSurvey?""}, {""from"": ""gpt"", ""value"": ""Generating tokens in LimeSurvey serves the function of creating unique invitation codes for participants listed in the survey participants table who do not already have a token. The process involves the following:\n1. **Access the Generate Tokens Function**: Administrators can navigate to the tokens management tools and select the option to generate tokens for individuals lacking a token.\n2. **Token Allocation**: Each participant will be assigned a unique token code, which is crucial for validating their access to the survey. Tokens help ensure that each person can only complete the survey once.\n3. **Security and Tracking**: Generated tokens provide a layer of security, controlling access and enabling the tracking of who has participated.\n4. **Bulk Generation**: This function allows for the rapid allocation of tokens to numerous participants in one action, streamlining the participant management process.\nBy creating these tokens, LimeSurvey helps maintain the integrity of the survey process.""}]",knowledge/php/limesurvey,1.0,train
"[{""from"": ""human"", ""value"": ""How can you filter the survey participants table in LimeSurvey?""}, {""from"": ""gpt"", ""value"": ""To filter the survey participants table in LimeSurvey, follow these steps:\n1. **Select Filter Column**: Choose the column by which you want to filter participants, such as 'Email status,' 'Invitation sent,' or any other relevant field.\n2. **Input Filter Criteria**: Enter the specific string or value you wish to filter for in the text box below the selected column. For instance, you can type in 'OK' in the email status column to see only those participants with valid email addresses.\n3. **Utilize Operators**: You can use comparison operators like >, <, >=, <=, = to define your filter more precisely.\n4. **Clear Filters**: To return to the full list of participants, you can clear the filter inputs as necessary.\nThis filtering process aids the survey administrator in managing participant data efficiently, ensuring quick access to relevant groups of participants.""}]",knowledge/php/limesurvey,1.0,train
"[{""from"": ""human"", ""value"": ""What does the function 'Send email reminders' do in LimeSurvey?""}, {""from"": ""gpt"", ""value"": ""The 'Send email reminders' function in LimeSurvey is designed to send bulk email reminders to participants who have not yet responded to the survey but have received their initial invitation. Key aspects of this function include:\n1. **Bulk Processing**: Administrators can select multiple participants to remind, saving time compared to individually sending emails.\n2. **Bypass Options**: Options are available to skip participants with failing email addresses or those who have recently been sent a reminder, ensuring that reminders are sent efficiently and appropriately.\n3. **Max Reminders Control**: Administrators can limit the number of reminders sent to any given participant to prevent overwhelming them with repeated requests.\n4. **Timestamp Control**: The function can also take into account any specified time frames for when reminders can be sent.\nThis assists in maximizing survey response rates by ensuring participants are nudged to complete the survey.""}]",knowledge/php/limesurvey,1.0,train
"[{""from"": ""human"", ""value"": ""Can a survey using tokens ensure anonymous responses, and how?""}, {""from"": ""gpt"", ""value"": ""Yes, a survey using tokens can ensure anonymous responses. The anonymity of responses is determined during the survey creation process. Here\u2019s how it works:\n1. **Token Use**: Tokens can be issued to participants to manage their access to the survey, allowing the administrator to track whether they participated.\n2. **Anonymity Assurance**: If the survey is set up as anonymous (tracked), there is no foreign key relationship linking the participant tokens with their answers after the completion of the survey. Thus, respondent identities are not connected to their responses.\n3. **Settings Adjustment**: Survey administrators can choose to enable or disable anonymous responses via the participant settings. When anonymous responses are selected, the written answers cannot be traced back to the individual token used.\nBy properly configuring the settings when creating the survey, LimeSurvey can facilitate the gathering of both identified and anonymous data.""}]",knowledge/php/limesurvey,1.0,train
"[{""from"": ""human"", ""value"": ""What are the steps involved in deleting a survey participants table in LimeSurvey?""}, {""from"": ""gpt"", ""value"": ""To delete a survey participants table in LimeSurvey, follow these steps:\n1. **Display Participants**: Navigate to the '''Display participants''' option within the survey participants management section to view the current table.\n2. **Locate Delete Button**: Find the '''Delete participants table''' button in the upper-right part of the screen.\n3. **Confirmation Prompt**: A confirmation window will pop up requesting your approval to proceed with the deletion.\n4. **Backup Consideration**: It is important to note that deleting the table does not remove it entirely from the LimeSurvey installation. A backup will be created, which can be accessed with system administrator rights.\n5. **Permanent Deletion**: If complete removal is required, use the 'check data integrity' option found in the '''Configuration''' dialog to ensure the table is completely deleted from the system.\nThese steps ensure that participant information is either maintained for future use or completely removed as necessary.""}]",knowledge/php/limesurvey,1.0,train
"[{""from"": ""human"", ""value"": ""What is the process of creating a dummy participant in LimeSurvey?""}, {""from"": ""gpt"", ""value"": ""Creating a dummy participant in LimeSurvey can be done by following these steps:\n1. **Access Create Dummy Participants Option**: Navigate to the '''Create dummy participants''' function within the survey participants management tools.\n2. **Specify Number of Participants**: Input the desired number of dummy participants you want to add to the survey participants table. This number will determine how many dummy tokens are created.\n3. **Field Completion**: Fill out any additional fields necessary for the dummy participants, similar to how regular participants are added.\n4. **Submit Creation**: After entering the required information, click the '''Save''' button located in the upper-right part of the screen.\n5. **Verification**: To check if dummy participants have been successfully added, revisit the survey participants table.\nDummy participants are useful for situations where tokens need to be distributed manually rather than through email.""}]",knowledge/php/limesurvey,1.0,train
"[{""from"": ""human"", ""value"": ""How can you manage public registration for surveys in LimeSurvey?""}, {""from"": ""gpt"", ""value"": ""To manage public registration for surveys in LimeSurvey, follow these steps:\n1. **Initialize Participants Table**: First, initialize your survey participants table by navigating to '''Settings''' > '''Survey menu''' > '''Survey participants'''.\n2. **Allow Public Registration**: In the main survey setup, enable the option for '''Allow public registration'''. This configuration lets individuals access the survey URL and register without needing a pre-assigned token.\n3. **Token Generation**: When a public participant provides a valid email, an entry is created in the survey participants table, and they are sent a unique token code automatically.\n4. **Adjust Settings**: This public registration option can be changed at any time from the participant settings within the survey.\nBy using public registration, LimeSurvey enhances accessibility, enabling more participants to engage with the survey.""}]",knowledge/php/limesurvey,1.0,train
"[{""from"": ""human"", ""value"": ""In what ways can admins use email templates in LimeSurvey?""}, {""from"": ""gpt"", ""value"": ""Admins can use email templates in LimeSurvey for the following purposes:\n1. **Customized Invitations**: Create unique invitation emails that are sent to participants, enhancing engagement by personalizing the communication.\n2. **Reminder Emails**: Utilize templates for sending reminder messages to participants who have yet to respond, encouraging them to complete the survey.\n3. **Confirmation Emails**: Send confirmation emails to participants upon completion of the survey, thanking them for their contribution.\n4. **Custom Placeholders**: Use specific placeholders within the email templates that allow dynamic content to be inserted, such as participant names, survey details, and tokens.\n5. **Manage through Admin Settings**: Admins can edit and manage these email templates directly through the LimeSurvey interface, allowing for real-time updates to communication strategies.\nBy utilizing email templates, survey administrators can streamline communication and maintain a professional appearance.""}]",knowledge/php/limesurvey,1.0,train
"[{""from"": ""human"", ""value"": ""What role does the Bounce Processing feature serve in LimeSurvey?""}, {""from"": ""gpt"", ""value"": ""The Bounce Processing feature in LimeSurvey plays a critical role in managing email delivery issues. It involves the following:\n1. **Tracking Email Delivery**: When invitations or reminders are sent, each email contains custom headers that include the survey ID and token ID. If an email bounces back, this process helps identify the associated participant.\n2. **Marking Invalid Addresses**: The system automatically parses bounced emails to determine invalid email addresses, which are then marked in the survey participants table. This prevents future invitations from being sent to these addresses.\n3. **Improving Email List Quality**: By consistently managing and updating participant email addresses based on bounce data, the overall quality of the email list is enhanced.\n4. **Settings Configuration**: Admins can configure bounce processing settings to use global or custom configurations for tracking bounces effectively.\nThis functionality ensures that administrators maintain accurate participant records and improve communication effectiveness.""}]",knowledge/php/limesurvey,1.0,train
"[{""from"": ""human"", ""value"": ""Can a survey participants table be reactivated in LimeSurvey after being deleted?""}, {""from"": ""gpt"", ""value"": ""Yes, a survey participants table that has been deleted in LimeSurvey can be reactivated. The process is as follows:\n1. **Backup Creation**: When the survey participants table is deleted, LimeSurvey automatically creates a backup of the table.\n2. **Reactivate Option**: The reactivation feature allows administrators to restore the previously deleted participants table for future use in another survey.\n3. **Accessing the Backup**: To utilize the backup, administrators must have system rights to access and restore the deleted data.\n4. **Flexibility**: This capability ensures that if a table is mistakenly deleted or if there is a need to reuse a specific setup, it can be retrieved without losing the data permanently.\nReactivating tables helps maintain flexibility in managing survey participants effectively.""}]",knowledge/php/limesurvey,1.0,train
"[{""from"": ""human"", ""value"": ""What are 'invitation status' options in the survey participants export functionality?""}, {""from"": ""gpt"", ""value"": ""The 'invitation status' options in the survey participants export functionality allow administrators to filter and export participant data based on their invitation history. The available options include:\n1. **All**: Exports all participants from the survey participants table, regardless of their invitation status.\n2. **Invited**: Only exports those participants who have been sent an invitation email.\n3. **Not Invited**: Exports participants who have not yet received an invitation.\nThese options provide flexibility in managing participant data, enabling administrators to focus on specific groups within the participant list based on their interaction with the survey.""}]",knowledge/php/limesurvey,1.0,train
"[{""from"": ""human"", ""value"": ""What happens when you delete a survey participants table in LimeSurvey?""}, {""from"": ""gpt"", ""value"": ""When a survey participants table is deleted in LimeSurvey, the following occurs:\n1. **Backup Creation**: LimeSurvey automatically creates a backup of the survey participants table before deletion. This ensures that participant data is not lost permanently.\n2. **Not Removal from System**: The deletion does not remove the table entirely from the LimeSurvey installation, allowing administrators with appropriate rights to restore it as needed.\n3. **Confirmation Prompt**: A confirmation window will appear, requiring administrative verification to proceed with the deletion process.\n4. **Finality of Deletion**: If complete removal is necessary, additional steps must be taken through the 'check data integrity' option found under the configuration settings.\nThis procedure ensures a safeguard against unintended data loss and provides recovery options when needed.""}]",knowledge/php/limesurvey,1.0,train
"[{""from"": ""human"", ""value"": ""How can you handle invalid email addresses in the survey participation process?""}, {""from"": ""gpt"", ""value"": ""Handling invalid email addresses during the survey participation process in LimeSurvey involves several strategies:\n1. **Email Status Tracking**: Maintain an 'Email status' field within the survey participants table that flags any addresses which may not be valid, such as 'user unknown' or 'mailbox quota exceeded'.\n2. **Validation on Import**: Implement settings during the import process to check the structural validity of email addresses before they are entered into the database, ensuring only properly formatted email addresses are accepted.\n3. **Bypass Options in Email Sending**: When sending invitations or reminders, use the option to bypass tokens with failing email addresses, thus skipping any entries flagged as problematic during the email invitation process.\n4. **Regular Updates**: Administrators should regularly review and update participant email addresses to maintain a clean contact list and ensure effective communication.\nBy employing these practices, LimeSurvey helps ensure that survey invitations are sent successfully and reduces the occurrences of email delivery failures.""}]",knowledge/php/limesurvey,1.0,train
"[{""from"": ""human"", ""value"": ""What options are available for managing survey invitations from the survey participants table?""}, {""from"": ""gpt"", ""value"": ""The options available for managing survey invitations from the survey participants table in LimeSurvey include:\n1. **Send Email Invitation**: This option allows administrators to send bulk email invitations to all participants who have not yet received one.\n2. **Send Email Reminder**: Administrators can also send bulk email reminders to those participants who have received an invitation but have not yet responded to the survey.\n3. **Resending Invitations**: If there are new email addresses added or if invitations need to be resent, admins can adjust the invitation status and send emails only to those whom previously did not receive one or whose email addresses were corrected.\nThese management functions streamline participant communication, encouraging higher response rates to surveys.""}]",knowledge/php/limesurvey,1.0,train
"[{""from"": ""human"", ""value"": ""Can you detail the attributes of each participant entry in the survey participants table?""}, {""from"": ""gpt"", ""value"": ""Each participant entry in the survey participants table contains the following key attributes:\n1. **ID**: A unique integer automatically assigned to each participant.\n2. **Completed?**: A flag to indicate whether the participant has completed the survey; this may disable any further invitations or reminders.\n3. **First Name**: The first name of the participant.\n4. **Last Name**: The last name of the participant.\n5. **Token**: The unique invitation code assigned to the participant.\n6. **Language**: The default language selected for the survey by the respective participant.\n7. **Email**: The participant\u2019s email address for communication purposes.\n8. **Email Status**: Tracks the validity of the email address (e.g., valid, invalid).\n9. **Invitation Sent?**: Records the date when the invitation email was dispatched.\n10. **Reminder Sent?**: Records the date when reminder emails were sent.\n11. **Uses Left**: Indicates how many times the token can still be utilized.\n12. **Valid From** & **Until**: Defines the date/time range within which the token can be activated.\nThese attributes provide a comprehensive view and control of participant data, facilitating effective survey management.""}]",knowledge/php/limesurvey,1.0,train
"[{""from"": ""human"", ""value"": ""What considerations should be made for creating email templates in LimeSurvey?""}, {""from"": ""gpt"", ""value"": ""When creating email templates in LimeSurvey, the following considerations should be made:\n1. **Use of Placeholders**: Incorporate dynamic placeholders that can personalize email content, such as participant name, survey title, and unique token.\n2. **Subject and Content Clarity**: The email subject line and content must clearly state the purpose of the email (invitation, reminder, etc.) and provide necessary instructions for completion.\n3. **Design and Formatting**: Ensure the template is designed to be visually appealing and easy to read, keeping elements like images and fonts consistent with your branding.\n4. **Testing Templates**: Send test emails to verify that all links and placeholders work as expected before sending them to actual participants.\n5. **Accessibility**: Check that templates are accessible for all participants, including compatibility with various email clients and mobile devices.\n6. **Legal Compliance**: Ensure that email communications comply with relevant legal requirements, such as including an unsubscribe option if necessary.\nBy addressing these points, administrators can enhance participant engagement and improve survey response rates.""}]",knowledge/php/limesurvey,1.0,train
"[{""from"": ""human"", ""value"": ""How do import functions differ between CSV files and LDAP queries in LimeSurvey?""}, {""from"": ""gpt"", ""value"": ""The import functions for CSV files and LDAP queries differ primarily in their data source and configuration requirements:\n1. **CSV Import**: This process involves uploading participant information from a standard CSV file. The CSV must follow specific formatting rules, including field names in the first row. Administrators can customize the import process with options such as filtering invalid addresses, handling duplicates, and defining CSV delimiters.\n2. **LDAP Import**: This function retrieves participant data from an LDAP directory, requiring a proper configuration of LDAP queries within the LimeSurvey setup. It is aimed at users familiar with LDAP handling and typically includes options for filtering duplicates based on predefined criteria.\n3. **Complexity**: CSV imports tend to be simpler and more straightforward as they only require a file upload, while LDAP imports demand a deeper understanding of directory structures and queries.\n4. **Use Cases**: CSV imports are flexible and can be used for any list, while LDAP queries are ideal for organizations that manage users centrally through directory services, allowing for more dynamic participant management.\nBy recognizing these differences, administrators can select the appropriate import method based on their organizational needs and technical familiarity.""}]",knowledge/php/limesurvey,1.0,train
