conversations,source,score,split
"[{""from"": ""human"", ""value"": ""What can be edited in the survey text elements panel?""}, {""from"": ""gpt"", ""value"": ""In the survey text elements panel, you can edit the following components: the title of the survey, the survey description, the welcome and end messages, the end URL of your survey, and the format of the decimal mark and date. To make these changes, you can click the 'Settings' tab and select 'Text elements'.""}]",knowledge/php/limesurvey,1.0,train
"[{""from"": ""human"", ""value"": ""How can I assign an alias to my survey in LimeSurvey?""}, {""from"": ""gpt"", ""value"": ""To assign an alias to your survey in LimeSurvey, navigate to the survey text elements panel. In the field labeled 'Survey Alias', input the alias you wish to use. The alias allows participants to access the survey using a friendly URL, which can vary by language. After setting the alias, you can share the short, friendly URL found in the survey summary.""}]",knowledge/php/limesurvey,1.0,train
"[{""from"": ""human"", ""value"": ""What is the purpose of the End URL in the survey settings?""}, {""from"": ""gpt"", ""value"": ""The End URL in the survey settings is used to redirect users to another page once they have completed the survey. To use this feature, you need to type the desired URL into the End URL field and enable the 'automatically load URL' option located under the Presentation & navigation tab. This allows for a seamless transition for participants after they submit their responses.""}]",knowledge/php/limesurvey,1.0,train
"[{""from"": ""human"", ""value"": ""What options are available for the decimal mark setting?""}, {""from"": ""gpt"", ""value"": ""In LimeSurvey, you have two options available for the decimal mark setting: dot (.) and comma (,). You should choose the one that is appropriate for the geographical area where your study is conducted. For example, in the US, the decimal mark is typically a dot (.), whereas many European countries, like Germany, use a comma (,) as the decimal mark.""}]",knowledge/php/limesurvey,1.0,train
"[{""from"": ""human"", ""value"": ""How can the date format affect the survey responses?""}, {""from"": ""gpt"", ""value"": ""The date format setting is significant because it ensures that the timestamps recorded with the survey participants' answers are formatted correctly. LimeSurvey provides a drop-down list of various date formats. It's essential to select the date format that aligns with the demographics of your survey participants. For example, a survey aimed at a US audience may use mm-dd-yyyy format, while one targeting a UK audience would likely use dd-mm-yyyy.""}]",knowledge/php/limesurvey,1.0,train
"[{""from"": ""human"", ""value"": ""What type of message can be added for participants at the start of the survey?""}, {""from"": ""gpt"", ""value"": ""You can add a welcome message that greets participants when they access your survey link. This message serves to set the tone and encourage participation. It can be customized to make participants feel valued and provide any preliminary instructions they may need.""}]",knowledge/php/limesurvey,1.0,train
"[{""from"": ""human"", ""value"": ""What happens to the end message if the End URL is activated?""}, {""from"": ""gpt"", ""value"": ""If the End URL field is set to automatically load upon survey completion, the end message you have typed will not be displayed to participants. This is important to consider when designing the survey flow; if the goal is to redirect participants somewhere else, the end message may become redundant.""}]",knowledge/php/limesurvey,1.0,train
"[{""from"": ""human"", ""value"": ""How does LimeSurvey handle multilingual surveys?""}, {""from"": ""gpt"", ""value"": ""For multilingual surveys in LimeSurvey, each language will have its corresponding tab on the languages toolbar. These tabs will be displayed after the base language. This allows survey administrators to provide tailored text elements, such as titles, descriptions, welcome and end messages, for each supported language, enhancing the accessibility and inclusiveness of the survey.""}]",knowledge/php/limesurvey,1.0,train
"[{""from"": ""human"", ""value"": ""Can you illustrate how to display the summary URL once the alias is set?""}, {""from"": ""gpt"", ""value"": ""Certainly! After successfully setting an alias for your survey in LimeSurvey, you can locate the friendly URL in the survey summary section. This summary will typically present a section labeled 'Survey Links' or 'Summary URL', followed by the friendly URL that consists of your alias. For example, if your alias is 'CustomerFeedback', the friendly URL could look like 'www.yoursurveyplatform.com/survey/CustomerFeedback'. This is the link you will distribute to participants.""}]",knowledge/php/limesurvey,1.0,train
"[{""from"": ""human"", ""value"": ""Is it possible to have different aliases for different languages in a LimeSurvey?""}, {""from"": ""gpt"", ""value"": ""Yes, in LimeSurvey, you can assign different aliases for each language supported by your survey. This feature is particularly useful for making the survey more relatable to participants from various language backgrounds, allowing you to maintain a friendly and recognizable URL structure across multiple languages.""}]",knowledge/php/limesurvey,1.0,train
"[{""from"": ""human"", ""value"": ""What considerations should be made when selecting a date format?""}, {""from"": ""gpt"", ""value"": ""When selecting a date format for your survey, consider the following factors: \n1. **Target Audience**: Depending on where your respondents are located, certain date formats may be more familiar (e.g., US participants might prefer mm-dd-yyyy, while UK participants might favor dd-mm-yyyy).\n2. **Consistency**: Make sure that the date format is consistent throughout the survey to avoid confusion.\n3. **Data Recording**: Since timestamps will be recorded with the answers, the chosen format should be easily interpretable to ensure accurate data entry and analysis.""}]",knowledge/php/limesurvey,1.0,train
"[{""from"": ""human"", ""value"": ""What options does LimeSurvey provide for customizing messages using HTML?""}, {""from"": ""gpt"", ""value"": ""LimeSurvey allows for enhanced customization of welcome and end messages, as well as the survey description, via an HTML editor. If enabled in the global settings, this HTML editor lets you format messages with rich text features, such as bold, italics, lists, and links, giving you greater flexibility to tailor your survey communications and make them visually appealing to participants.""}]",knowledge/php/limesurvey,1.0,train
"[{""from"": ""human"", ""value"": ""What details can be included in the survey description field?""}, {""from"": ""gpt"", ""value"": ""In the survey description field, you can include any relevant details that provide context for your survey and inform participants about its purpose. This may involve explaining the research objectives, confidentiality assurances, how the data will be used, and instructions on how to navigate the survey. An informative description can help increase participant engagement and completion rates.""}]",knowledge/php/limesurvey,1.0,train
"[{""from"": ""human"", ""value"": ""Explain how the End URL feature enhances the survey experience.""}, {""from"": ""gpt"", ""value"": ""The End URL feature enhances the survey experience by allowing survey administrators to redirect participants to a specific webpage once they complete the survey. This could be a thank you page, a follow-up survey, or any informative content related to the survey topic. By using the End URL, administrators can continue the participant's journey, providing additional resources or information which can improve the overall experience and retain engagement after survey completion.""}]",knowledge/php/limesurvey,1.0,train
"[{""from"": ""human"", ""value"": ""Are there any visual aids available in the survey text elements panel?""}, {""from"": ""gpt"", ""value"": ""Yes, in the survey text elements panel, there are visual aids provided, such as screenshots that illustrate where to find specific settings and how they function. These images guide users through the process of accessing and adjusting the text elements, making it easier to understand and navigate the settings.""}]",knowledge/php/limesurvey,1.0,train
"[{""from"": ""human"", ""value"": ""How can user feedback be integrated into the survey text elements?""}, {""from"": ""gpt"", ""value"": ""While the survey text elements themselves do not directly accept user feedback, it is essential to monitor participant responses and reactions to the text elements such as welcome messages and descriptions. Based on feedback, survey creators can make iterative improvements to enhance clarity, relevance, and engagement. Analyzing participant engagement can inform changes to the text elements for future surveys.""}]",knowledge/php/limesurvey,1.0,train
"[{""from"": ""human"", ""value"": ""Why is it important to specify a URL description in the End URL?""}, {""from"": ""gpt"", ""value"": ""Specifying a URL description in the End URL field is important because it provides clarity for survey administrators regarding the purpose of a redirect. If participants are sent to a non-related webpage upon survey completion, the description helps remind administrators about the content and context of the URL. This can avoid confusion and assist in managing the flow of participant experiences after completing the survey.""}]",knowledge/php/limesurvey,1.0,train
"[{""from"": ""human"", ""value"": ""What does the hint box about using the HTML editor suggest?""}, {""from"": ""gpt"", ""value"": ""The hint box suggests that if enabled in the global settings, users can utilize the HTML editor to customize their welcome and end messages, as well as the survey description. This implies that the HTML editor provides more advanced formatting options, allowing survey creators to enhance the aesthetic and functional quality of their text elements. It encourages users to take advantage of this tool to better engage participants.""}]",knowledge/php/limesurvey,1.0,train
"[{""from"": ""human"", ""value"": ""What role does the survey description play in participant engagement?""}, {""from"": ""gpt"", ""value"": ""The survey description plays a crucial role in participant engagement as it sets expectations regarding the survey\u2019s purpose and the importance of their responses. A well-written survey description can inform participants about what to expect, how their data will be utilized, and why their feedback matters. This transparency fosters trust and can motivate participants to complete the survey.""}]",knowledge/php/limesurvey,1.0,train
"[{""from"": ""human"", ""value"": ""How can LimeSurvey accommodate users from different regional preferences?""}, {""from"": ""gpt"", ""value"": ""LimeSurvey accommodates users from different regional preferences through customizable options in the survey settings. Administrators can adjust the date format and decimal mark according to the preferences common in particular geographies. This feature helps ensure that respondents find the survey comprehensible and relevant, thereby improving response quality and data accuracy.""}]",knowledge/php/limesurvey,1.0,train
"[{""from"": ""human"", ""value"": ""What is the significance of having different aliases for multilingual surveys?""}, {""from"": ""gpt"", ""value"": ""Having different aliases for multilingual surveys is significant as it enhances user accessibility and comfort. A friendly and appropriate alias for each language can lead to a more personalized experience for participants, making them more likely to engage with the survey. This is particularly beneficial for surveys targeting diverse language speakers, as it fosters inclusivity and understanding.""}]",knowledge/php/limesurvey,1.0,train
"[{""from"": ""human"", ""value"": ""How can you ensure that your survey's welcome message is effective?""}, {""from"": ""gpt"", ""value"": ""To ensure that your survey's welcome message is effective, keep the following considerations in mind: \n1. **Clarity**: Make the message clear and concise while stating the purpose of the survey.\n2. **Tone**: Utilize a friendly and inviting tone that resonates with the target audience.\n3. **Instructions**: Include any necessary instructions or prompts that guide participants on what to expect or how to participate.\n4. **Personalization**: If applicable, personalize messages to build rapport with the respondents.\nBy incorporating these elements, the welcome message can significantly enhance participant engagement and completion rates.""}]",knowledge/php/limesurvey,1.0,train
"[{""from"": ""human"", ""value"": ""What distinction should one consider between welcome and end messages?""}, {""from"": ""gpt"", ""value"": ""The distinction between welcome and end messages lies primarily in their purpose and timing within the survey experience. A welcome message greets participants and sets the tone for the survey before they begin, often reassuring them about the survey\u2019s purpose and the importance of their input. In contrast, an end message expresses gratitude to participants for their time and feedback after they complete the survey. It might also provide directions on what to do next, such as redirecting them to an End URL, or further contact information regarding the survey.""}]",knowledge/php/limesurvey,1.0,train
"[{""from"": ""human"", ""value"": ""How can survey administrators use URL descriptions effectively?""}, {""from"": ""gpt"", ""value"": ""Survey administrators can use URL descriptions effectively by providing context about the destination URL that participants will be redirected to after completing the survey. For example, if the End URL takes participants to a feedback or information page, the description might clarify that the page contains additional resources related to the survey topic or thanks them for their participation. This can enhance transparency and improve the user experience as participants will have a better understanding of what to expect after submitting their responses.""}]",knowledge/php/limesurvey,1.0,train
"[{""from"": ""human"", ""value"": ""How does the date format choice influence data analysis?""}, {""from"": ""gpt"", ""value"": ""The date format choice directly influences data analysis as it affects how timestamps are interpreted and recorded alongside survey responses. Selecting the appropriate format ensures that data is consistently represented, which makes it easier to analyze trends over time. For instance, if some participants are using mm-dd-yyyy while others are using dd-mm-yyyy, it could lead to misinterpretations in datasets unless this discrepancy is addressed. Thus, using a uniform and suitable date format enhances the validity and utility of the collected data.""}]",knowledge/php/limesurvey,1.0,train
"[{""from"": ""human"", ""value"": ""Can the end URL be customized for different languages?""}, {""from"": ""gpt"", ""value"": ""Yes, in LimeSurvey, the end URL can indeed be customized for different languages. This allows the survey administrator to provide relevant links that are appropriate for various language speakers. For example, the end URL for English-speaking respondents could redirect them to a particular site, while a different URL could be designated for Spanish-speaking users to ensure that they receive content tailored to their language and cultural context.""}]",knowledge/php/limesurvey,1.0,train
"[{""from"": ""human"", ""value"": ""What practices can survey creators employ to enhance message clarity?""}, {""from"": ""gpt"", ""value"": ""Survey creators can enhance message clarity by employing several best practices: \n1. **Use Simple Language**: Avoid jargon and complex wording to ensure comprehension across diverse participant backgrounds.\n2. **Be Concise**: Keep messages direct and to the point, eliminating unnecessary fluff.\n3. **Utilize Bullet Points**: When providing instructions or multiple pieces of information, format them as bullet points to improve readability.\n4. **Test Readability**: Utilize reading assessment tools to ensure that the language level is appropriate for the expected audience.\nBy integrating these practices, survey creators can cultivate clearer and more effective communications.""}]",knowledge/php/limesurvey,1.0,train
"[{""from"": ""human"", ""value"": ""How does the use of alias impact survey sharing?""}, {""from"": ""gpt"", ""value"": ""The use of an alias significantly impacts survey sharing by simplifying the URL participants use to access the survey. Instead of a long, complex URL, a concise and meaningful alias provides a memorable link that is easier to share via social media, email, or print. This facilitates wider distribution and encourages participation, as a friendly URL can make it seem more approachable and less intimidating for potential respondents.""}]",knowledge/php/limesurvey,1.0,train
"[{""from"": ""human"", ""value"": ""What flexibility does LimeSurvey offer in terms of customizing survey elements?""}, {""from"": ""gpt"", ""value"": ""LimeSurvey offers substantial flexibility in customizing survey elements, allowing administrators to tailor various aspects according to their research needs. This includes customizing title, description, and messages in different languages, configuring the End URL, and personalizing how data formats such as dates and decimals are presented. Additionally, the inclusion of an HTML editor for welcome and end messages empowers creators to format text with rich features, enhancing participant engagement and satisfaction.""}]",knowledge/php/limesurvey,1.0,train
"[{""from"": ""human"", ""value"": ""Can the welcome message be enhanced using HTML?""}, {""from"": ""gpt"", ""value"": ""Yes, the welcome message can be enhanced using HTML if the HTML editor is enabled in global settings. This allows survey creators to format the welcome message with rich text features, such as style variations (bold, italics), lists, and links. By utilizing these capabilities, the welcome message becomes more visually engaging and can better communicate vital information to participants.""}]",knowledge/php/limesurvey,1.0,train
"[{""from"": ""human"", ""value"": ""What guidelines should be followed to create effective survey descriptions?""}, {""from"": ""gpt"", ""value"": ""To create effective survey descriptions, consider the following guidelines: \n1. **Be Transparent**: Clearly state the purpose of the survey and how responses will be used.\n2. **Conciseness**: Keep the description brief yet informative\u2014avoid overwhelming participants with too much information.\n3. **Provide Context**: Explain why the survey is being conducted and how participants' responses will contribute to the research goals.\n4. **Include Contact Information**: Offer a means for participants to ask questions or express concerns, which builds trust and could increase participation rates.""}]",knowledge/php/limesurvey,1.0,train
"[{""from"": ""human"", ""value"": ""How can the multilingual aspect of surveys affect response rates?""}, {""from"": ""gpt"", ""value"": ""The multilingual aspect of surveys can significantly affect response rates by catering to a diverse audience and ensuring all participants can comfortably engage with the survey. By providing a survey in multiple languages, survey administrators are removing a potential barrier to participation. Participants are more likely to respond when they can read and understand questions in their native language, which enhances clarity, improves the quality of responses, and leads to higher overall engagement.""}]",knowledge/php/limesurvey,1.0,train
"[{""from"": ""human"", ""value"": ""What is the importance of a clear End URL description?""}, {""from"": ""gpt"", ""value"": ""A clear End URL description is important as it informs participants about what to expect after completing the survey. It serves to set the context regarding the page they will be redirected to, reassures them about the relevance of the page, and can mitigate any confusion that may arise from the transition. By maintaining clarity in communication, survey administrators enhance the overall user experience and ensure smoother navigation for participants.""}]",knowledge/php/limesurvey,1.0,train
"[{""from"": ""human"", ""value"": ""What methods can be used to streamline the process of setting up survey text elements?""}, {""from"": ""gpt"", ""value"": ""To streamline the process of setting up survey text elements, administrators can use the following methods: \n1. **Templates**: Create and use templates for common survey components, such as descriptions and welcome messages, to ensure consistency and save time.\n2. **Predefined Formats**: Utilize predefined settings for date formats and decimal marks that align with target demographics, reducing the need for individual adjustments.\n3. **Collaboration Tools**: Implement collaboration tools within the company to allow multiple stakeholders to contribute to and review text components before finalization.\nBy adopting these practices, survey creators can minimize setup time while maintaining high-quality content.""}]",knowledge/php/limesurvey,1.0,train
"[{""from"": ""human"", ""value"": ""What are some typical customizations that can enhance participant engagement?""}, {""from"": ""gpt"", ""value"": ""To enhance participant engagement, survey creators can implement several typical customizations, such as: \n1. **Personalized Messages**: Tailor welcome and end messages to make them relatable to the audience.\n2. **Visual Branding**: Include logos or color schemes that align with the organization\u2019s branding to foster a sense of familiarity.\n3. **Interactive Elements**: Utilize survey design features like images, videos, or interactive question types to maintain interest and make the survey experience more engaging.\n4. **Clear Navigation**: Simplify navigation by ensuring that participants know where they are in the survey and how far they have to go.\nThese customizations can lead to increased satisfaction and higher response rates.""}]",knowledge/php/limesurvey,1.0,train
"[{""from"": ""human"", ""value"": ""How does specifying the decimal mark contribute to data accuracy?""}, {""from"": ""gpt"", ""value"": ""Specifying the decimal mark contributes to data accuracy by ensuring that numerical responses are recorded in a format that is consistent with the conventions understood by your respondents. For example, using a comma decimal mark in countries that primarily use this format prevents misunderstandings in response interpretation. This is particularly vital in surveys collecting financial or statistical data, as discrepancies in interpretation could lead to erroneous conclusions during data analysis.""}]",knowledge/php/limesurvey,1.0,train
"[{""from"": ""human"", ""value"": ""In what ways can the survey settings influence participant perception?""}, {""from"": ""gpt"", ""value"": ""The survey settings significantly influence participant perception in several ways: \n1. **Professional Appearance**: Well-structured settings contribute to a professional appearance and credibility of the survey, making participants more likely to trust it.\n2. **Ease of Use**: Intuitive settings, including clear instructions and friendly URLs, enhance usability, making participants feel more comfortable and willing to complete the survey.\n3. **Personal Touch**: Customizing messages to meet participants\u2019 cultural and regional expectations can foster a sense of belonging and appreciation.\nBy carefully designing survey settings, administrators can positively affect how participants perceive and engage with the survey.""}]",knowledge/php/limesurvey,1.0,train
"[{""from"": ""human"", ""value"": ""What are the steps to follow for creating a multilingual survey in LimeSurvey?""}, {""from"": ""gpt"", ""value"": ""To create a multilingual survey in LimeSurvey, follow these steps: \n1. **Survey Settings**: Begin by creating your survey and navigating to the survey settings tab.\n2. **Set Base Language**: Choose the base language for the survey, which will serve as the primary version.\n3. **Add Languages**: Under the languages tab, add additional languages you want to include.\n4. **Customize Text Elements**: For each language, customize your text elements such as titles, descriptions, welcome messages, and aliases. Each language will have its corresponding tab.\n5. **Testing**: Conduct tests for each language version to ensure that all elements are functioning properly and that translations are accurate.\n6. **Launch**: Once thoroughly tested, launch your multilingual survey and promote it to the target audience.\nBy following these steps, you can ensure that your survey reaches a wider audience and creates an inclusive environment.""}]",knowledge/php/limesurvey,1.0,train
