conversations,source,score,split
"[{""from"": ""human"", ""value"": ""What customization features does LimeSurvey provide for enhancing user interaction?""}, {""from"": ""gpt"", ""value"": ""LimeSurvey provides various customization features for enhancing user interaction, including: \n1. **HTML Editor**: Enables the use of an HTML editor for customizing text elements such as start and end messages, allowing for formatted and visually appealing messages.\n2. **Variable Aliases**: The ability to set user-friendly aliases for surveys, which aids in sharing and memorability.\n3. **Multilingual Support**: Options for customizing language-specific settings including titles, messages, and URLs to cater to a broader audience.\n4. **Interactive Elements**: Use of various question types (e.g., multiple choice, drop-downs) that promote engagement and prevent survey fatigue.\n5. **Conditional Logic**: Features that allow dynamic question presentation based on previous answers to provide a tailored experience to respondents.\nThese features collectively create a more engaging and user-friendly survey environment.""}]",knowledge/php/limesurvey,1.0,train
"[{""from"": ""human"", ""value"": ""How can survey designers ensure that language translations remain accurate?""}, {""from"": ""gpt"", ""value"": ""Survey designers can ensure that language translations remain accurate by implementing the following practices: \n1. **Professional Translators**: Engage professional translators who are familiar with the subject matter and cultural nuances.\n2. **Back-Translation**: Use back-translation methods where a translated text is retranslated into the original language by a different translator to identify discrepancies.\n3. **Participant Testing**: Pilot the survey with native speakers who can provide feedback on the clarity and appropriateness of translations.\n4. **Utilize Glossaries**: Develop glossaries of key terms and phrases to maintain consistency across languages. \n5. **Ongoing Review**: Regularly review and update translations based on participant feedback and changing standards. \nBy following these methods, survey designers can create reliable multilingual surveys that resonate with a diverse audience.""}]",knowledge/php/limesurvey,1.0,train
"[{""from"": ""human"", ""value"": ""What tools does LimeSurvey provide to enhance user experience throughout the survey?""}, {""from"": ""gpt"", ""value"": ""LimeSurvey provides a range of tools to enhance user experience throughout the survey, including: \n1. **Customizable Templates**: Administrators can use customizable templates to ensure a coherent look and feel aligned with branding.\n2. **Skip Logic**: Use of skip logic to navigate participants based on previous answers to maintain relevance and engagement.\n3. **Progress Indicators**: The inclusion of progress indicators to inform participants about their completion status can help reduce drop-off rates.\n4. **Mobile Optimization**: LimeSurvey's responsive design ensures that surveys are accessible and usable on various devices, enhancing participant interaction.\n5. **Real-Time Feedback**: Tools to gather immediate feedback based on survey responses to make real-time adjustments in ongoing studies.\nThese tools create a more engaging, efficient, and user-friendly survey experience.""}]",knowledge/php/limesurvey,1.0,train
"[{""from"": ""human"", ""value"": ""What are some potential pitfalls in managing multilingual surveys?""}, {""from"": ""gpt"", ""value"": ""When managing multilingual surveys, some potential pitfalls include: \n1. **Inconsistent Translations**: Failing to maintain consistent terminology across languages can lead to confusion and distrust among respondents.\n2. **Cultural Misunderstandings**: Neglecting cultural nuances that impact question wording or interpretations may alienate participants.\n3. **Technical Errors**: Issues in transferring settings and customizations accurately across languages can lead to discrepancies in user experience.\n4. **Overcomplicating Design**: Adding too many languages can complicate survey navigation and increase drop-out rates if not handled properly.\n5. **Insufficient Testing**: Skipping over testing for each language version may result in undiscovered errors affecting response quality. \nBy being aware of these pitfalls, survey designers can implement strategies to mitigate potential issues and enhance overall survey effectiveness.""}]",knowledge/php/limesurvey,1.0,train
"[{""from"": ""human"", ""value"": ""How can message personalization impact survey response rates?""}, {""from"": ""gpt"", ""value"": ""Message personalization can significantly impact survey response rates by enhancing participant connection and engagement. When respondents see messages tailored to their interests, demographics, or previous interactions, they are more likely to feel valued and understood, which increases their willingness to participate. Personalized messages can also create a sense of relevance and urgency, prompting immediate action, thus improving overall response rates.""}]",knowledge/php/limesurvey,1.0,train
"[{""from"": ""human"", ""value"": ""What role does the HTML editor play in message formatting?""}, {""from"": ""gpt"", ""value"": ""The HTML editor plays a crucial role in message formatting by enabling survey creators to enhance the visual appeal and functionality of their messages. With the HTML editor, creators can easily apply various formatting options such as text styles (bold, italics), lists, links, and even embed images if supported. This allows messages to be engaging and clear, which can help improve participant comprehension and retention of critical information.""}]",knowledge/php/limesurvey,1.0,train
"[{""from"": ""human"", ""value"": ""Can the setup for the decimal mark be influenced by regional standards?""}, {""from"": ""gpt"", ""value"": ""Yes, the setup for the decimal mark in LimeSurvey can be heavily influenced by regional standards. Different cultures and countries utilize distinct conventions for numerical representations. For instance, while the United States predominantly uses a dot (.) as the decimal mark, many European countries, like Germany, prefer using a comma (,). By adjusting the decimal mark according to the regional standard where the survey is conducted, survey creators enhance comprehension and accuracy of numerical responses.""}]",knowledge/php/limesurvey,1.0,train
"[{""from"": ""human"", ""value"": ""What key features should be included in a user-friendly survey interface?""}, {""from"": ""gpt"", ""value"": ""A user-friendly survey interface should include the following key features: \n1. **Clear Instructions**: Provide brief and straightforward instructions to guide users through the survey process.\n2. **Responsive Design**: Ensure that the survey is easily accessible and functional across various devices, including smartphones, tablets, and desktops.\n3. **Progress Bar**: Include a progress bar to help participants gauge how much of the survey they have completed and how much is left.\n4. **Easy Navigation**: Implement intuitive navigation that allows users to move forward or backward easily without losing their responses.\n5. **Visual Appeal**: Use consistent fonts, colors, and designs that are visually appealing and enhance overall clarity.\nBy incorporating these features, survey interfaces can promote a positive experience and encourage higher response rates.""}]",knowledge/php/limesurvey,1.0,train
"[{""from"": ""human"", ""value"": ""What combination of factors influences the effectiveness of survey messages?""}, {""from"": ""gpt"", ""value"": ""The effectiveness of survey messages is influenced by a combination of factors including: \n1. **Clarity and Conciseness**: Messages should be easy to read and get to the point without unnecessary information.\n2. **Relevance**: Tailoring content to the specific audience and context can increase the importance of the message.\n3. **Tone**: The tone should be friendly and encouraging, which helps convey approachability and increases willingness to participate.\n4. **Format**: Utilizing formatting tools like bullet points, lists, and headings improves readability and engagement.\n5. **Cultural Sensitivity**: Being mindful of cultural contexts and preferences can greatly enhance trust and receptiveness among participants.\nBy strategically combining these factors, survey creators can boost engagement and encourage higher completion rates.""}]",knowledge/php/limesurvey,1.0,train
"[{""from"": ""human"", ""value"": ""What advice can you provide for ensuring clarity in multilingual surveys?""}, {""from"": ""gpt"", ""value"": ""To ensure clarity in multilingual surveys, consider the following advice: \n1. **Professional Translation**: Use certified professionals familiar with both the source and target languages to ensure accuracy and cultural appropriateness of translations.\n2. **Simple Language**: Write questions and messages in simple, plain language to prevent misunderstandings across different cultures.\n3. **Short Sentences**: Keep sentences relatively short and straightforward to avoid confusion, particularly in translations.\n4. **Consistency across Languages**: Maintain uniformity in terminology and phrasing to avoid variable interpretations.\n5. **Comprehensive Testing**: Conduct extensive testing with native speakers from different regions to verify clarity and comprehension before launching the survey.\nBy implementing these practices, you can enhance clarity and overall participant understanding in your multilingual surveys.""}]",knowledge/php/limesurvey,1.0,train
"[{""from"": ""human"", ""value"": ""How can you use feedback to improve the survey text elements?""}, {""from"": ""gpt"", ""value"": ""Feedback can be effectively used to improve survey text elements by following these steps: \n1. **Collect Participant Feedback**: Utilize post-survey feedback tools, such as follow-up questions or rating scales, to gather insights on clarity and relevance.\n2. **Analyze Patterns**: Look for patterns and common suggestions in feedback to identify areas needing improvement.\n3. **Iterate on Content**: Based on insights gained, refine the text elements to address potential issues or enhance engagement, ensuring to test changes in future surveys.\n4. **Consult Stakeholders**: Involve team members or stakeholders in reviewing text elements to get diverse perspectives, which may highlight overlooked areas.\nBy actively utilizing feedback, survey designers can continually enhance the quality and effectiveness of their survey text elements.""}]",knowledge/php/limesurvey,1.0,train
"[{""from"": ""human"", ""value"": ""What is the role of visual aids in survey text elements?""}, {""from"": ""gpt"", ""value"": ""Visual aids in survey text elements play a crucial role in enhancing understanding and engagement among participants. They can clarify complex information, provide context, and break up large blocks of text, making surveys more visually appealing. For example, images, icons, or charts can support textual information, helping to explain instructions or showcase data effectively. Additionally, visual aids can draw attention to key messages or instructions, improving participant retention and satisfaction with the survey experience.""}]",knowledge/php/limesurvey,1.0,train
"[{""from"": ""human"", ""value"": ""Why is it essential to maintain a consistent style throughout all language versions of a multilingual survey?""}, {""from"": ""gpt"", ""value"": ""It's essential to maintain a consistent style throughout all language versions of a multilingual survey to ensure that participants have a coherent and unified experience regardless of language. Consistency in terminology, tone, formatting, and overall presentation helps to establish trust and credibility. When participants can navigate the survey seamlessly across different languages without encountering discrepancies, it enhances their overall satisfaction and willingness to complete it. Additionally, a consistent style aids in data comparability and analysis post-survey.""}]",knowledge/php/limesurvey,1.0,train
"[{""from"": ""human"", ""value"": ""What is the benefit of using progress indicators in surveys?""}, {""from"": ""gpt"", ""value"": ""The benefit of using progress indicators in surveys lies in their ability to enhance participant engagement and reduce drop-off rates. By showing respondents where they are in the survey process, progress indicators help manage expectations and encourage completion. They provide reassurance that the survey is manageable and inform participants how many questions remain, which can motivate them to push through to the end. Clear progress indicators instill a sense of accomplishment as participants see their progress accumulate.""}]",knowledge/php/limesurvey,1.0,train
"[{""from"": ""human"", ""value"": ""How can survey creators utilize conditional logic to improve survey quality?""}, {""from"": ""gpt"", ""value"": ""Survey creators can utilize conditional logic to improve survey quality by tailoring the questions presented to respondents based on their previous answers. This targeted approach ensures that participants only see relevant questions, making the survey experience more engaging and less overwhelming. For instance, if a respondent indicates they have never used a particular service, conditional logic can skip questions related to that service, thereby enhancing the survey's relevance and increasing the quality of responses. Ultimately, this leads to a more meaningful data collection process.""}]",knowledge/php/limesurvey,1.0,train
"[{""from"": ""human"", ""value"": ""What issues might arise from not properly testing multilingual surveys?""}, {""from"": ""gpt"", ""value"": ""If multilingual surveys are not properly tested, several issues may arise, including: \n1. **Translation Errors**: Incorrect translations can lead to misunderstandings and bias in responses, affecting data quality.  \n2. **Technical Glitches**: Issues with formatting, navigation, or links may occur, leading to a confusing experience for participants.  \n3. **Cultural Mismatches**: Question wording or contexts may not resonate well with participants from different cultural backgrounds, which can alienate users.  \n4. **Inconsistent Experiences**: Discrepancies in how questions are presented across languages could frustrate users and lower engagement rates.  \nBy conducting thorough testing prior to launch, survey designers can identify and rectify these potential issues, ensuring a smooth, inclusive experience.""}]",knowledge/php/limesurvey,1.0,train
"[{""from"": ""human"", ""value"": ""How important is it to address participant concerns during a survey?""}, {""from"": ""gpt"", ""value"": ""Addressing participant concerns during a survey is critically important as it builds trust and confidence in the survey process. Participants are more likely to engage when they feel that their privacy is protected, their feedback is valued, and they have clear channels for addressing questions or issues. Addressing concerns also helps mitigate dropout rates, as people are less likely to exit the survey if they know they can seek clarification or assistance. Additionally, being responsive to participant concerns can enhance the overall perception of the research quality and the organization conducting it.""}]",knowledge/php/limesurvey,1.0,train
"[{""from"": ""human"", ""value"": ""What are some strategies for improving survey design based on user feedback?""}, {""from"": ""gpt"", ""value"": ""Some strategies for improving survey design based on user feedback include: \n1. **Identify Key Areas for Improvement**: Segment feedback into categories (e.g., clarity, navigation, content) to pinpoint specific aspects needing enhancement.\n2. **Prototype Testing**: Before finalizing, launch a prototype of the revised survey to a small audience, gathering feedback for further refinements.\n3. **Engage Stakeholders**: Involve different stakeholders in review sessions to generate diverse insights and creative ideas for improvement.\n4. **Iterative Design**: Continuously incorporate feedback into the design process, ensuring the survey evolves based on participant experiences.\n5. **Documentation**: Keep a detailed record of feedback and changes made to improve future design processes and decisions.""}]",knowledge/php/limesurvey,1.0,train
"[{""from"": ""human"", ""value"": ""How does effective navigation impact participant completion rates?""}, {""from"": ""gpt"", ""value"": ""Effective navigation significantly impacts participant completion rates by reducing frustration and enhancing user experience. When participants can easily move forward and backward in a survey without losing their inputs, they are more likely to complete the process rather than abandoning it due to confusion or difficulty. Clear and intuitive navigation, such as clearly labeled buttons and a logical question flow, allows respondents to feel in control of their survey experience, which ultimately leads to higher completion rates.""}]",knowledge/php/limesurvey,1.0,train
"[{""from"": ""human"", ""value"": ""What considerations should be made when designing for mobile surveys?""}, {""from"": ""gpt"", ""value"": ""When designing for mobile surveys, several considerations should be made:\n1. **Responsive Design**: Ensure that the survey layout adjusts seamlessly to different screen sizes, maintaining usability across devices.\n2. **Simple Navigation**: Implement large buttons and touch-friendly interfaces that make it easy for respondents to interact with the survey on mobile devices.\n3. **Minimal Text**: Limit the amount of text on each screen to prevent overwhelming users and provide concise instructions.\n4. **Testing**: Perform testing on various mobile devices to ensure compatibility and a consistent experience.\n5. **Loading Speeds**: Optimize images and reduce the complexity of the survey to enhance loading speeds, as mobile users may have varying internet connections.\nBy focusing on these considerations, survey designers can create an effective and user-friendly experience for mobile survey respondents.""}]",knowledge/php/limesurvey,1.0,train
"[{""from"": ""human"", ""value"": ""What elements contribute to a visually appealing survey design?""}, {""from"": ""gpt"", ""value"": ""Elements that contribute to a visually appealing survey design include: \n1. **Consistent Color Scheme**: Implementing a cohesive color palette that aligns with branding helps to create visual harmony. \n2. **Readable Fonts**: Choosing easy-to-read fonts that are appropriately sized enhances the overall clarity of the survey. \n3. **Imagery**: Using relevant images and graphics can provide context and make the survey more engaging. \n4. **Whitespace**: Providing adequate spacing between sections, questions, and text elements can prevent overcrowding and improve readability. \n5. **Structured Layout**: Organizing the survey into clearly defined sections with headings or groupings facilitates navigation and understanding. \nBy integrating these elements, survey designers can create appealing interfaces that encourage participation and enhance the user experience.""}]",knowledge/php/limesurvey,1.0,train
"[{""from"": ""human"", ""value"": ""What strategies can enhance participant satisfaction during surveys?""}, {""from"": ""gpt"", ""value"": ""Strategies to enhance participant satisfaction during surveys include: \n1. **Personalized Engagement**: Tailoring messages and questions to reflect the respondent's demographics can foster a sense of relevance.\n2. **Appreciation Acknowledgements**: Expressing gratitude for participants\u2019 time can positively influence their experience and encourage them to complete the survey.\n3. **Clear Benefits Communication**: Clearly stating how participants' input will be utilized or its impact can motivate engagement.\n4. **Feedback Opportunities**: Providing options for participants to give feedback on the survey process itself can help them feel valued and included.\n5. **Follow-Up Communication**: Following up with participants, whether to share results or express gratitude, can further enhance their satisfaction and likelihood of future participation.\nBy implementing these strategies, survey creators can boost overall satisfaction and response rates.""}]",knowledge/php/limesurvey,1.0,train
"[{""from"": ""human"", ""value"": ""How can survey designers incorporate best practices for data protection?""}, {""from"": ""gpt"", ""value"": ""Survey designers can incorporate best practices for data protection by: \n1. **Anonymizing Responses**: Ensuring that participant responses are collected anonymously can maintain confidentiality and encourage honest feedback.\n2. **Clear Privacy Policies**: Providing transparent information about how data will be used and stored reinforces trust with participants.\n3. **Data Security Measures**: Implementing robust cybersecurity protocols to protect collected data from unauthorized access.\n4. **Minimal Data Collection**: Collecting only necessary information to achieve research goals while avoiding excess data collection that could compromise privacy.\n5. **Compliance with Regulations**: Ensuring that the survey design complies with relevant data protection regulations, such as GDPR, to uphold participant rights.\nBy following these best practices, survey designers can safeguard participant information while fostering an environment of trust.""}]",knowledge/php/limesurvey,1.0,train
"[{""from"": ""human"", ""value"": ""What are the advantages of conducting surveys with LimeSurvey?""}, {""from"": ""gpt"", ""value"": ""Conducting surveys with LimeSurvey offers several advantages: \n1. **User-Friendly Interface**: LimeSurvey provides a customizable and intuitive interface that makes survey creation accessible, even for those without technical expertise.\n2. **Variety of Question Types**: Users can choose from numerous question types to tailor their surveys to their specific research goals.\n3. **Multilingual Support**: LimeSurvey supports multilingual surveys, which allows for broader reach and inclusion of diverse participant demographics.\n4. **Robust Data Collection and Analysis Tools**: Built-in tools facilitate effective data collection and analysis, making it easier to interpret results.\n5. **Secure and Compliant**: LimeSurvey emphasizes data security and compliance with regulations, which builds participant trust.\nBy leveraging these benefits, administrators can efficiently gather valuable insights while ensuring participant satisfaction and data protection.""}]",knowledge/php/limesurvey,1.0,train
"[{""from"": ""human"", ""value"": ""How does offering a variety of question types impact survey results?""}, {""from"": ""gpt"", ""value"": ""Offering a variety of question types impacts survey results by engaging respondents in different ways and accommodating diverse preferences for answering questions. This can lead to more comprehensive data collection, as various question formats (such as open-ended, multiple-choice, or rating scales) allow respondents to express their thoughts more accurately. A well-structured mix of question types can reduce respondent fatigue and boredom, making them more likely to complete the survey and providing richer, more nuanced insights into their opinions and experiences.""}]",knowledge/php/limesurvey,1.0,train
"[{""from"": ""human"", ""value"": ""How can LimeSurvey assist in improving the overall quality of survey data?""}, {""from"": ""gpt"", ""value"": ""LimeSurvey assists in improving the overall quality of survey data through several mechanisms: \n1. **Enhanced Customization**: By allowing detailed customization of survey elements, creators can tailor surveys to their target audience, which boosts clarity and relevance of questions.\n2. **Conditional Logic**: This feature enables the inclusion of only relevant questions based on previous answers, streamlining the survey process and reducing irrelevant response noise.\n3. **Data Validation**: LimeSurvey includes tools for validating responses to ensure they meet expected criteria before submission, enhancing data reliability.\n4. **Comprehensive Reporting Tools**: It provides robust reporting capabilities that help analyze and visualize results effectively, allowing users to derive meaningful insights from collected data.\n5. **Participant Feedback Mechanisms**: After a survey, LimeSurvey can incorporate participant feedback on the survey experience itself, which helps in refining future surveys for better quality data collection.\nBy utilizing these features, survey designers can foster higher response quality and richer datasets.""}]",knowledge/php/limesurvey,1.0,train
