conversations,source,score,split
"[{""from"": ""human"", ""value"": ""What is the primary purpose of the Components module in GrapesJS?""}, {""from"": ""gpt"", ""value"": ""The primary purpose of the Components module in GrapesJS is to manage components within the canvas environment of a web builder framework. This module enables users to create, customize, and manipulate various HTML elements directly in the editor. It provides functionality for instantiating components, listening to specific events associated with these components, and utilizing an API to interact with the components as needed. Essentially, it allows users to build complex HTML structures without writing code.""}]",knowledge/js/grapesjs/api,1.0,train
"[{""from"": ""human"", ""value"": ""How do you initialize the editor with component options?""}, {""from"": ""gpt"", ""value"": ""To initialize the GrapesJS editor with component options, you need to use the `grapesjs.init` method and pass a configuration object that includes the `domComponents` settings. Here's an example of how to do this:\n\n```javascript\nconst editor = grapesjs.init({\n  domComponents: {\n    // Specify options for components here\n  }\n});\n```\n\nIn this code snippet, the `domComponents` property within the configuration object can be customized to cater to specific requirements for components within the editor.""}]",knowledge/js/grapesjs/api,1.0,train
"[{""from"": ""human"", ""value"": ""What are some of the available events for components in GrapesJS?""}, {""from"": ""gpt"", ""value"": ""GrapesJS has a variety of available events for components that allow developers to listen to specific actions. Some of the key events include:\n\n- `component:create`: Triggered when a component is created but not yet mounted in the canvas.\n- `component:mount`: When a component is mounted to the canvas.\n- `component:add`: Triggered when a new component is added.\n- `component:remove`: Fired when a component is removed.\n- `component:update`: Triggered when a component is updated (e.g., repositioned or styled).\n- `component:selected` and `component:deselected`: Triggered when a component is selected or deselected.\n- `component:drag:start`, `component:drag`, `component:drag:end`: Events for monitoring the drag actions of components.\n\nThese events facilitate the handling of component lifecycle actions effectively within the GrapesJS framework.""}]",knowledge/js/grapesjs/api,1.0,train
"[{""from"": ""human"", ""value"": ""Can you provide an example of how to listen to the component:create event?""}, {""from"": ""gpt"", ""value"": ""Certainly! You can listen to the `component:create` event by using the `editor.on` method after initializing the editor. Below is an example demonstrating how this is done:\n\n```javascript\n// Initialize the editor\nconst editor = grapesjs.init({\n  domComponents: {\n    // options\n  }\n});\n\n// Listen to the component:create event\neditor.on('component:create', (model) => {\n  console.log('A new component has been created:', model);\n});\n```\n\nIn this example, each time a component is created, a message will be logged to the console, displaying the created component's model.""}]",knowledge/js/grapesjs/api,1.0,train
"[{""from"": ""human"", ""value"": ""What does the getWrapper method do?""}, {""from"": ""gpt"", ""value"": ""The `getWrapper` method is part of the Components API in GrapesJS. It returns the root component inside the canvas, similar to the `<body>` tag in an HTML document. This root component acts as a container for all other components within the editor. \n\n### Example usage:\n```javascript\n// Get the root wrapper component\nvar wrapper = editor.Components.getWrapper();\n// Change the background of the wrapper\nwrapper.set('style', { 'background-color': 'red' });\nwrapper.set('attributes', { 'title': 'Hello!' });\n```\n\nIn this snippet, the background color of the wrapper is changed to red, and an attribute is added. The wrapper itself does not differ from any other component model in terms of how it is managed.""}]",knowledge/js/grapesjs/api,1.0,train
"[{""from"": ""human"", ""value"": ""How can you add a new component using the addComponent method?""}, {""from"": ""gpt"", ""value"": ""To add a new component using the `addComponent` method in GrapesJS, you can call this method on a container component, such as the wrapper or another parent component you want to add the new component to. Below is an example demonstrating this:\n\n```javascript\n// Get the wrapper component\nvar wrapper = editor.Components.getWrapper();\n// Add a new component (e.g., a div with specific styles)\nvar newComponent = wrapper.addComponent({\n  tagName: 'div',\n  removable: true,\n  draggable: true,\n  content: 'This is a new component!',\n  style: { color: 'blue' },\n  attributes: { title: 'example' }\n});\nconsole.log('New component added:', newComponent);\n```\n\nIn this example, a new div component is added to the wrapper with properties like `removable`, `draggable`, and some content and styles. The result is logged in the console.""}]",knowledge/js/grapesjs/api,1.0,train
"[{""from"": ""human"", ""value"": ""What does the clear method do in the Components module?""}, {""from"": ""gpt"", ""value"": ""The `clear` method in the GrapesJS Components module is used to remove all components from the canvas. Calling this method will completely clear the workspace, deleting all existing components and their configurations. \n\n### Example usage:\n```javascript\n// Clear all components from the editor\neditor.Components.clear();\n```\n\nIn this example, when the `clear` method is invoked, all components previously added to the editor will be removed, effectively resetting the canvas to an empty state.""}]",knowledge/js/grapesjs/api,1.0,train
"[{""from"": ""human"", ""value"": ""How do you add a new component type using the addType method?""}, {""from"": ""gpt"", ""value"": ""To add a new component type in GrapesJS, you use the `addType` method provided by the Components API. This allows you to define a new type of component with its corresponding methods. Below is an example of how to do this:\n\n```javascript\n// Define the new component type\neditor.Components.addType('my-custom-type', {\n  model: {\n    defaults: {\n      tagName: 'div',\n      attributes: { class: 'my-custom-class' },\n      content: 'Custom Component Content',\n    },\n  },\n  view: {\n    // Custom view logic can be added here\n  }\n});\n```\n\nIn this example, a new component type called 'my-custom-type' is defined with its default properties. The `model` section allows for default values, while the `view` section can contain custom rendering logic for that type.""}]",knowledge/js/grapesjs/api,1.0,train
"[{""from"": ""human"", ""value"": ""What is the significance of the isComponent method?""}, {""from"": ""gpt"", ""value"": ""The `isComponent` method in the GrapesJS Components module checks whether a given object is a recognized component within the editor. This is important for validating components, especially when you need to ensure that an object being manipulated or tested is indeed a component, which helps maintain the integrity of operations you perform on components.\n\n### Example usage:\n```javascript\nconst isComp = editor.Components.isComponent(editor.getSelected()); // Returns true if selected is a component\nconst isNotComp = editor.Components.isComponent({}); // Returns false since it's not a component\n```\n\nIn this example, the method checks if the selected editor element is a component and will return a boolean value accordingly.""}]",knowledge/js/grapesjs/api,1.0,train
"[{""from"": ""human"", ""value"": ""How can you detach a symbol instance from the main symbol in GrapesJS?""}, {""from"": ""gpt"", ""value"": ""To detach a symbol instance from its main symbol in GrapesJS, you can use the `detachSymbol` method within the Components module. This will convert the instance back into a regular component, thereby breaking its link to the main symbol.\n\n### Example usage:\n```javascript\nconst cmpInstance = editor.getSelected(); // Get the selected component instance\n// Detach the symbol instance\neditor.Components.detachSymbol(cmpInstance);\n```\n\nIn this example, the `detachSymbol` method is used to detach the selected component instance from its main symbol, thus allowing further modifications to be made to the detached component independently of the original symbol.""}]",knowledge/js/grapesjs/api,1.0,train
"[{""from"": ""human"", ""value"": ""Can you explain the canMove method and how to use it?""}, {""from"": ""gpt"", ""value"": ""The `canMove` method in GrapesJS checks whether a specific component can be moved inside another component. This method is significant when dealing with nested structures, as it ensures that movement is valid according to the predefined rules of the components involved.\n\n### Parameters:\n- `target` (Component): The target component that is supposed to receive the source component.\n- `source` (Component | String): This can be another component, a component definition, or an HTML string representing the component.\n- `index` (optional, Number): The index at which the source should be inserted, if not specified, the method checks for appending the source to the target.\n\n### Example usage:\n```javascript\nconst rootComponent = editor.getWrapper();\nconst someComponent = editor.getSelected();\n// Check if someComponent can be moved into rootComponent\nconst movementCheck = editor.Components.canMove(rootComponent, someComponent);\nconsole.log(movementCheck);\n```\n\nIn this example, the `canMove` method checks if `someComponent` can be positioned inside the `rootComponent`. The result will contain an object providing details about the outcome, such as whether the move is valid and, if it\u2019s not, the reason for the failure.""}]",knowledge/js/grapesjs/api,1.0,train
"[{""from"": ""human"", ""value"": ""How do you retrieve information on the symbol associated with a component?""}, {""from"": ""gpt"", ""value"": ""To retrieve information about the symbol associated with a component in GrapesJS, you can use the `getSymbolInfo` method. This will provide details regarding whether the component is a symbol, if it's the main symbol, and if it's an instance of a symbol. \n\n### Example usage:\n```javascript\nconst symbolInfo = editor.Components.getSymbolInfo(editor.getSelected());\nconsole.log(symbolInfo);\n// Outputs an object containing details about the symbol status\n```\n\nIn this example, by calling `getSymbolInfo` on the selected editor component, you receive an object that details the symbol state of that component.""}]",knowledge/js/grapesjs/api,1.0,train
"[{""from"": ""human"", ""value"": ""What is the difference between component:mount and component:add events?""}, {""from"": ""gpt"", ""value"": ""The `component:mount` and `component:add` events in GrapesJS serve different purposes concerning component lifecycle management:\n\n- `component:mount`: This event is triggered when a component is mounted to an element and rendered in the canvas. It signifies that the component's visual representation is now part of the user interface, allowing for any further visual modifications or interactions.\n\n- `component:add`: This event is fired when a new component is added to the editor. It occurs before the component is actually mounted on the canvas and usually indicates that the model for the component exists within the editor, but it may not yet be visible.\n\nIn essence, `component:add` occurs when the component is created and added to the models, whereas `component:mount` occurs once that component is fully rendered in the canvas, ready for user interaction.""}]",knowledge/js/grapesjs/api,1.0,train
"[{""from"": ""human"", ""value"": ""Can you describe what component:type:add event represents?""}, {""from"": ""gpt"", ""value"": ""The `component:type:add` event in GrapesJS is triggered whenever a new component type is added to the editor. This event allows developers to hook into the process and perform specific actions or adjustments whenever a new type of component becomes available in the editor.\n\n### Example use case:\n```javascript\neditor.on('component:type:add', (newType) => {\n  console.log('A new component type has been added:', newType);\n});\n```\nIn this example, a listener is set up for the `component:type:add` event. When a new component type is added, it logs the new type to the console, giving developers the opportunity to interact or respond accordingly.""}]",knowledge/js/grapesjs/api,1.0,train
"[{""from"": ""human"", ""value"": ""What happens when the component:remove event is triggered?""}, {""from"": ""gpt"", ""value"": ""When the `component:remove` event is triggered in GrapesJS, it indicates that a component is being removed from the editor. This event notifies any listeners about this action, allowing them to perform necessary clean-up tasks, logging, or custom behavior right before a component is deleted from the canvas.\n\n### Example usage:\n```javascript\neditor.on('component:remove', (model) => {\n  console.log('Component removed:', model);\n});\n```\nIn this example, whenever a component is removed, details about it will be output to the console, which can help in tracking component removals and performing any additional required actions.""}]",knowledge/js/grapesjs/api,1.0,train
"[{""from"": ""human"", ""value"": ""How are the component:update and component:update:{propertyName} events different?""}, {""from"": ""gpt"", ""value"": ""The `component:update` and `component:update:{propertyName}` events in GrapesJS serve to notify listeners about changes to components but differ in terms of specificity:\n\n- `component:update`: This event is triggered whenever a general update occurs on a component, such as movement, styling, or other property changes. It passes the model of the updated component to the listener, enabling global handling of updates regardless of what specific property was affected.\n\n- `component:update:{propertyName}`: This event is more specific and occurs when a particular property of a component is changed. It provides the model along with the specific property that was updated, allowing developers to react to precise changes without responding to all updates.\n\n### Example usage:\n```javascript\neditor.on('component:update', (model) => {\n  console.log('Component updated:', model);\n});\n\neditor.on('component:update:style', (model) => {\n  console.log('Component style updated:', model);\n});\n```\nIn this example, the first listener captures all types of updates while the second listens specifically for style updates.""}]",knowledge/js/grapesjs/api,1.0,train
"[{""from"": ""human"", ""value"": ""How would you handle the component:selected and component:deselected events?""}, {""from"": ""gpt"", ""value"": ""To handle the `component:selected` and `component:deselected` events in GrapesJS, you can set up listeners that respond to changes in the selection state of components within the editor. \n\n### Example usage:\n```javascript\neditor.on('component:selected', (model) => {\n  console.log('Component selected:', model);\n});\n\neditor.on('component:deselected', (model) => {\n  console.log('Component deselected:', model);\n});\n```\nIn this example, the first listener logs details about the selected component, while the second logs information when a component gets deselected. This allows developers to perform any actions necessary when components enter or leave a selected state, such as updating UI elements or component-specific properties.""}]",knowledge/js/grapesjs/api,1.0,train
"[{""from"": ""human"", ""value"": ""Can you explain the difference between the getTypes and addType methods?""}, {""from"": ""gpt"", ""value"": ""The `getTypes` and `addType` methods in GrapesJS serve different purposes in managing component types within the editor:\n\n- `getTypes`: This method returns an array of all the existing component types defined in the editor. It allows developers to retrieve and inspect all component types that have been registered, which can help in understanding the configurations available in the editor.\n\n- `addType`: This method is used to define and add a new component type to the editor. It allows developers to register a new type with specific properties and methods, enabling the creation of custom components that can be used within the GrapesJS editor.\n\n### Example usage:\n```javascript\n// Retrieve all component types\nconst types = editor.Components.getTypes();\nconsole.log('Available component types:', types);\n\n// Add a new component type\neditor.Components.addType('my-custom-component', { model: { /* ... */ }, view: { /* ... */ } });\n```""}]",knowledge/js/grapesjs/api,1.0,train
"[{""from"": ""human"", ""value"": ""How can you implement custom methods in a new component type?""}, {""from"": ""gpt"", ""value"": ""To implement custom methods in a new component type in GrapesJS, you can define these methods within the `methods` property when using the `addType` method. This property allows you to specify functions that will be associated with the component type. Below is an example illustrating how to do this:\n\n### Example usage:\n```javascript\neditor.Components.addType('custom-type', {\n  model: {\n    defaults: {\n      tagName: 'div',\n      content: 'This is a custom component',\n    },\n    myCustomMethod() {\n      console.log('This method can be called on the custom component');\n    }\n  },\n  view: {\n    // Define your custom view methods if needed\n  }\n});\n```\nIn this example, a new component type 'custom-type' is created with a custom method called `myCustomMethod`. When an instance of this component is created, you can call `myCustomMethod` to execute custom behavior associated with it.""}]",knowledge/js/grapesjs/api,1.0,train
"[{""from"": ""human"", ""value"": ""How can you remove a specific component type?""}, {""from"": ""gpt"", ""value"": ""To remove a specific component type in GrapesJS, you can use the `removeType` method provided by the Components API. This method allows you to specify the ID of the component type you want to eliminate from the editor. Below is an example illustrating how to do this:\n\n### Example usage:\n```javascript\n// Remove a component type\nconst removedType = editor.Components.removeType('my-custom-type');\nconsole.log('Removed component type:', removedType);\n``` \nIn this example, the `removeType` method is called with the ID of the component type to be removed. The removed type is stored in the `removedType` variable for reference.""}]",knowledge/js/grapesjs/api,1.0,train
"[{""from"": ""human"", ""value"": ""What does the component:resize event signify?""}, {""from"": ""gpt"", ""value"": ""The `component:resize` event in GrapesJS signifies that a component's dimensions have been changed, whether it has been resized manually by the user or programmatically through code. This event allows developers to react to changes in the sizing of components, which can be essential for maintaining layout integrity or triggering updates that depend on component sizes.\n\n### Example usage:\n```javascript\neditor.on('component:resize', (model) => {\n  console.log('The component has been resized:', model);\n});\n```\nIn this example, a listener is established for the `component:resize` event, logging the resized component to the console whenever this event is triggered.""}]",knowledge/js/grapesjs/api,1.0,train
"[{""from"": ""human"", ""value"": ""What is the purpose of the wrapper in GrapesJS components?""}, {""from"": ""gpt"", ""value"": ""The purpose of the wrapper in GrapesJS components is to serve as the root container for all components within the canvas. It acts similarly to the `<body>` element in an HTML document by encapsulating all nested elements and providing a structure for the layout. The wrapper allows developers to efficiently manage styles, attributes, and child components while maintaining a logical hierarchy of elements. By manipulating the wrapper, you can apply global styles or manage configurations that affect the overall structure of the editor's content.""}]",knowledge/js/grapesjs/api,1.0,train
"[{""from"": ""human"", ""value"": ""Can you summarize the key functionalities of the GrapesJS Components module?""}, {""from"": ""gpt"", ""value"": ""The key functionalities of the GrapesJS Components module include the following:\n- **Component Management**: Allowing users to create, modify, and delete components dynamically within the editor's canvas.\n- **Event Listening**: Providing various events to monitor lifecycle changes of components such as creation, addition, removal, selection, and updates.\n- **Custom Types**: Enabling the addition of custom component types with defined properties and methods for specific functionalities.\n- **Manipulation Methods**: Including methods for managing wrapper elements and nested components, adding children, removing components, and managing symbols.\n- **Integration with Other Modules**: Facilitating interactions with other modules within GrapesJS for a complete design-building experience. \nIn essence, these functionalities empower developers and users to create highly flexible and customizable web templates without needing code writing.""}]",knowledge/js/grapesjs/api,1.0,train
"[{""from"": ""human"", ""value"": ""How do you handle events related to dragging components?""}, {""from"": ""gpt"", ""value"": ""Handling events related to dragging components in GrapesJS involves setting up listeners for several specific events: `component:drag:start`, `component:drag`, and `component:drag:end`. These events allow you to monitor the dragging process and respond to user actions accordingly. Below is an example of how to handle these events:\n\n### Example usage:\n```javascript\neditor.on('component:drag:start', (dragInfo) => {\n  console.log('Drag started with component:', dragInfo.target);\n});\n\neditor.on('component:drag', (dragInfo) => {\n  console.log('Dragging component:', dragInfo.target);\n});\n\neditor.on('component:drag:end', (dragInfo) => {\n  console.log('Drag ended with component:', dragInfo.target);\n});\n```\nIn this example, listeners are set for each drag-related event, allowing for logging of the component's state during the drag process.""}]",knowledge/js/grapesjs/api,1.0,train
"[{""from"": ""human"", ""value"": ""What are the implications of using the clear method in a live editor?""}, {""from"": ""gpt"", ""value"": ""Using the `clear` method in a live editor context has significant implications. When invoked, this method removes all components from the canvas, effectively resetting the workspace. This can lead to the following consequences:\n- **Data Loss**: All unsaved changes to components will be lost, which can frustrate users if they are not made aware beforehand.\n- **UI Cleanup**: It provides a quick way to clear out the editor for a fresh start, useful during development or adjustments in design strategies.\n- **User Experience**: If users are working on a project, calling `clear` without prompt might result in confusion or loss of work, hence it should be executed with caution and ideally with confirmation dialogs.\nGiven these implications, it's prudent to handle the `clear` method carefully, ensuring that users are aware of its consequences and providing save mechanisms to avoid unintentional data loss.""}]",knowledge/js/grapesjs/api,1.0,train
"[{""from"": ""human"", ""value"": ""Can you explain how nested components are managed in GrapesJS?""}, {""from"": ""gpt"", ""value"": ""In GrapesJS, nested components are managed through the hierarchical structure of the components API. Each component can have one or more child components nested within it, allowing for a tree-like representation of the UI structure. Here\u2019s how nested components are handled:\n1. **Adding Children**: You can add child components to a parent by accessing the parent\u2019s `getComponents()` method, which provides a collection to manage its children. \n   ```javascript\n   const parentComponent = editor.Components.getWrapper();\n   const child = parentComponent.getComponents().add({ tagName: 'span', content: 'Nested Component' });\n   ```\n2. **Accessing Child Components**: Each component has a `components` property that holds its children, allowing you to traverse the structure and manipulate deeply nested components.\n3. **Removing Children**: You can remove a child component from the parent using the `remove` method provided by the collection returned from `getComponents()`. \n   ```javascript\n   parentComponent.getComponents().remove(child);\n   ```\n4. **Iterating through Nested Structures**: Developers can loop through child components and apply changes or gather information, using methods on the collection returned-by `getComponents()` for flexible management.\nIn summary, the management of nested components in GrapesJS provides a powerful mechanism to construct complex designs while maintaining an organization that is easy to manipulate programmatically.""}]",knowledge/js/grapesjs/api,1.0,train
