conversations,source,score,split
"[{""from"": ""human"", ""value"": ""What is the purpose of the `panels` configuration in the GrapesJS editor initialization?""}, {""from"": ""gpt"", ""value"": ""The `panels` configuration in the GrapesJS editor initialization allows developers to customize the initial state of the editor's panel module. By passing a configuration object during the `grapesjs.init` call, developers can define the properties and appearance of the panels that will be available to users immediately upon the editor's launch. This customization provides guidance and ensures that the editor is tailored to meet specific user needs and functionalities.""}]",knowledge/js/grapesjs/api,1.0,train
"[{""from"": ""human"", ""value"": ""How do you instantiate the panel manager in GrapesJS?""}, {""from"": ""gpt"", ""value"": ""To instantiate the panel manager in GrapesJS, you first need to initialize the editor using the `grapesjs.init` method. After the editor is instantiated, you can access the panel manager via the editor's `Panels` API. Here is how you can do it:\n\n```javascript\nconst editor = grapesjs.init({\n  panels: {\n    // options\n  }\n});\n\nconst panelManager = editor.Panels;\n```\n\nOnce you have the `panelManager`, you can use various methods to manage panels and buttons within the editor.""}]",knowledge/js/grapesjs/api,1.0,train
"[{""from"": ""human"", ""value"": ""What does the `getPanels` method return in the panel manager?""}, {""from"": ""gpt"", ""value"": ""The `getPanels` method in the panel manager returns a collection of all the panels that have been defined in the editor. It provides developers with access to the current set of panels, allowing them to interact with, retrieve information, or manipulate those panels as needed. The returned value is a **Collection** object which represents all the panels present at the time of the method call.""}]",knowledge/js/grapesjs/api,1.0,train
"[{""from"": ""human"", ""value"": ""Can you give an example of how to add a new panel using the `addPanel` method?""}, {""from"": ""gpt"", ""value"": ""Certainly! You can add a new panel to the collection using the `addPanel` method of the panel manager. Here's an example of how to do this:\n\n```javascript\nconst newPanel = panelManager.addPanel({\n  id: 'myNewPanel',\n  visible: true,\n  buttons: [...],\n});\n```\n\nIn this snippet, a new panel is created with an `id`, its visibility is set to `true`, and an array of buttons can be passed as part of the panel configuration. The method returns the newly added panel, which is useful if you need to reference it later.""}]",knowledge/js/grapesjs/api,1.0,train
"[{""from"": ""human"", ""value"": ""How can you remove a panel using the `removePanel` method?""}, {""from"": ""gpt"", ""value"": ""To remove a panel from the collection, you can use the `removePanel` method. This method can accept either a panel instance or the ID of the panel. Here is how you can do it:\n\n```javascript\n// Remove by panel instance\nconst somePanel = panelManager.getPanel('somePanel');\nconst removedPanel = panelManager.removePanel(somePanel);\n\n// Or remove by panel ID\nconst removedPanelById = panelManager.removePanel('myNewPanel');\n```\n\nIn both cases, the method returns the removed panel, allowing you to keep track of it for any subsequent operations.""}]",knowledge/js/grapesjs/api,1.0,train
"[{""from"": ""human"", ""value"": ""What is the purpose of the `getPanel` method?""}, {""from"": ""gpt"", ""value"": ""The `getPanel` method is used to retrieve a specific panel from the panel manager by its ID. This method allows developers to access and interact with a specific panel after the editor has been initialized. Here\u2019s a simple example of how to use it:\n\n```javascript\nconst myPanel = panelManager.getPanel('myPanel');\n```\n\nIn this case, the method attempts to find and return the panel object associated with the `myPanel` ID. If no panel with that ID exists, the method returns `null`.""}]",knowledge/js/grapesjs/api,1.0,train
"[{""from"": ""human"", ""value"": ""What does the `addButton` method do in the panel manager?""}, {""from"": ""gpt"", ""value"": ""The `addButton` method in the panel manager is used to add a button to a specific panel by specifying the panel's ID and the button's properties. You can create a button as either an object or an instance of the `Button`. Here\u2019s an example:\n\n```javascript\nconst newButton = panelManager.addButton('myNewPanel', {\n  id: 'myNewButton',\n  className: 'someClass',\n  command: 'someCommand',\n  attributes: { title: 'Some title' },\n  active: false,\n});\n```\n\nIn this example, we add a button specified with various properties such as `id`, `className`, commands, attributes, and its active state. Upon successful addition, the method returns the newly created button, allowing for further manipulation if needed.""}]",knowledge/js/grapesjs/api,1.0,train
"[{""from"": ""human"", ""value"": ""How do you remove a button from a panel using `removeButton`?""}, {""from"": ""gpt"", ""value"": ""To remove a button from a specific panel, you can use the `removeButton` method, which requires the ID of the panel and either the button object or the button ID. Here\u2019s an example:\n\n```javascript\nconst removedButton = panelManager.removeButton('myNewPanel', 'myNewButton');\n```\n\nIn this snippet, the `removeButton` method removes the button with the ID `myNewButton` from the panel with the ID `myNewPanel`. The method returns the removed button, allowing you to verify that the button has been successfully removed.""}]",knowledge/js/grapesjs/api,1.0,train
"[{""from"": ""human"", ""value"": ""Can you provide an example of using the `getButton` method?""}, {""from"": ""gpt"", ""value"": ""Certainly! The `getButton` method is used to retrieve a button from a specific panel by its ID. It requires both the panel ID and the button ID as parameters. Here's how you can use it:\n\n```javascript\nconst button = panelManager.getButton('myPanel', 'myButton');\n```\n\nIn this example, the method attempts to get the button identified by `myButton` from the panel `myPanel`. If the button exists, it returns the button object; otherwise, it returns `null`.""}]",knowledge/js/grapesjs/api,1.0,train
"[{""from"": ""human"", ""value"": ""What types of parameters are accepted by the `addPanel` method?""}, {""from"": ""gpt"", ""value"": ""The `addPanel` method accepts a single parameter which can be an object or an instance of the `Panel`. This parameter should contain the necessary properties to define the panel, such as `id` (a string representing the panel's ID), `visible` (a boolean indicating whether the panel is visible), and `buttons` (an array of buttons to associate with the panel). Here\u2019s an example:\n\n```javascript\nconst newPanel = panelManager.addPanel({\n  id: 'myNewPanel',\n  visible: true,\n  buttons: [...],\n});\n```\n\nIn this example, an object is created with the properties required to define the new panel.""}]",knowledge/js/grapesjs/api,1.0,train
"[{""from"": ""human"", ""value"": ""What value does `getPanelsEl` return?""}, {""from"": ""gpt"", ""value"": ""The `getPanelsEl` method returns the HTML element that contains the panels. This method is useful for accessing the actual DOM representation of the panels in the GrapesJS editor. It allows developers to manipulate the panel elements directly within the HTML structure of the editor interface.""}]",knowledge/js/grapesjs/api,1.0,train
"[{""from"": ""human"", ""value"": ""What is the expected return value of the `addButton` method?""}, {""from"": ""gpt"", ""value"": ""The `addButton` method returns the button that has been added to the specified panel. If the button was created using an object and added successfully, it returns a `Button` instance corresponding to the provided configuration. If the addition fails or if the panel ID does not exist, it may return `null`. Here\u2019s an example demonstrating the return value:\n\n```javascript\nconst newButton = panelManager.addButton('myNewPanel', {\n  id: 'myNewButton',\n  className: 'someClass',\n  command: 'someCommand',\n  attributes: { title: 'Some title' },\n  active: false,\n});\n```\n\nIn this case, `newButton` will contain the `Button` object which can then be used for further interactions.""}]",knowledge/js/grapesjs/api,1.0,train
"[{""from"": ""human"", ""value"": ""How can one access the panel manager methods after initializing the editor?""}, {""from"": ""gpt"", ""value"": ""After initializing the GrapesJS editor, you can access the panel manager methods by first obtaining the panel manager instance from the initialized editor object. The following example demonstrates this:\n\n```javascript\nconst editor = grapesjs.init({\n  panels: {\n    // options\n  }\n});\n\nconst panelManager = editor.Panels;\n```\n\nOnce you have the `panelManager`, you can call various methods such as `addPanel`, `removePanel`, `getPanels`, and others directly to manage panels and buttons.""}]",knowledge/js/grapesjs/api,1.0,train
"[{""from"": ""human"", ""value"": ""What is the difference between `removePanel` and `removeButton` methods?""}, {""from"": ""gpt"", ""value"": ""The `removePanel` and `removeButton` methods serve different purposes in the context of managing components within the GrapesJS editor:\n\n- **removePanel**: This method is used to remove a panel from the collection by either specifying a panel instance or its ID. It effectively deletes the full panel along with any buttons it may contain.\n\n- **removeButton**: This method is specifically for removing a button from a given panel based on either the button's instance or its ID. It only affects the button, leaving the associated panel intact.\n\nHere are examples of both methods:\n\n```javascript\n// Remove a panel\nconst removedPanel = panelManager.removePanel('myPanel');\n\n// Remove a button\nconst removedButton = panelManager.removeButton('myPanel', 'myButton');\n```""}]",knowledge/js/grapesjs/api,1.0,train
"[{""from"": ""human"", ""value"": ""Can you explain the implications of adding a button with a command using an object format?""}, {""from"": ""gpt"", ""value"": ""Adding a button with a command defined as an object format (with `run` and `stop` methods) provides greater flexibility in defining the behavior associated with that button. This allows for more complex interactions and better control over what happens when the button is activated or deactivated. Here\u2019s an example:\n\n```javascript\nconst newButton = panelManager.addButton('myNewPanel', {\n  id: 'myNewButton',\n  className: 'someClass',\n  command: {\n    run: function(editor) {\n      // logic to execute on button click\n    },\n    stop: function(editor) {\n      // logic to execute on button stop\n    }\n  },\n});\n```\n\nBy implementing the command as an object with both `run` and `stop` methods, you can ensure that certain logic is executed depending on the state of the button or the editor, such as starting and stopping certain functionalities, toggling UI states, or interacting with other components.""}]",knowledge/js/grapesjs/api,1.0,train
"[{""from"": ""human"", ""value"": ""What strategies can be used to manage the visibility of panels upon initialization?""}, {""from"": ""gpt"", ""value"": ""To manage the visibility of panels upon initialization in GrapesJS, you can customize your panel definitions within the `panels` configuration object during the editor initialization. Here are some strategies:\n\n1. **Set `visible` Property**: Define the `visible` property for each panel when adding them to ensure they are displayed or hidden based on your application requirements.\n   ```javascript\n   const editor = grapesjs.init({\n     panels: {\n       myPanel: { visible: false }, // initially hidden\n     }\n   });\n   ```\n\n2. **Dynamic Visibility Control**: Use methods such as `panelManager.addPanel()` to add panels dynamically and control their visibility through application logic. \n\n3. **Event Listeners**: Attach event listeners to ensure that panels can be shown or hidden based on user actions or specific events in the application.\n\n4. **Configuration Options**: Load different panel configurations based on user roles or application states to determine which panels should be displayed.""}]",knowledge/js/grapesjs/api,1.0,train
"[{""from"": ""human"", ""value"": ""How does the `getPanels` method improve developer's interaction with the GrapesJS panels?""}, {""from"": ""gpt"", ""value"": ""The `getPanels` method significantly enhances a developer's interaction with the GrapesJS panels by providing a convenient way to access the entire collection of panels that have been created. This allows developers to:\n\n1. **Iterate Through Panels**: Quickly loop through all panels to apply changes or queries to each one, simplifying management and interaction with multiple UI components.\n\n2. **Dynamic Updates**: Implement functionality to dynamically update the interface based on panel properties, visibility, or add/remove panels without the need for individual queries.\n\n3. **Streamline Logic**: Organize logic around the collection of panels, making it easier to maintain and scale the application.\n\n4. **Integration with Other Features**: Use the collection of panels to integrate with other features or APIs of GrapesJS, enhancing the modular nature of the editor.\n\nOverall, the `getPanels` method acts as a powerful tool for managing and interacting with the UI components efficiently.""}]",knowledge/js/grapesjs/api,1.0,train
"[{""from"": ""human"", ""value"": ""What considerations should developers make when adding multiple panels at once?""}, {""from"": ""gpt"", ""value"": ""When adding multiple panels at once in GrapesJS, developers should consider several best practices to ensure maintainability, performance, and user experience:\n\n1. **Batch Addition**: If possible, create panels in a batch to reduce the number of DOM manipulations. This will enhance performance, especially when dealing with a large number of panels.\n   ```javascript\n   const panels = [{ id: 'panel1', visible: true, buttons: [...] }, { id: 'panel2', visible: false, buttons: [...] }];\n   panels.forEach(panelConfig => panelManager.addPanel(panelConfig));\n   ```\n\n2. **Consistent IDs**: Ensure that all panel IDs are unique and follow a naming convention to avoid duplication that can cause logic errors during retrieval and manipulation.\n\n3. **Pre-define Properties**: Define common properties for all panels, such as attributes or styles, to ensure a consistent look and feel across the interface.\n\n4. **Visibility Management**: Plan the visibility of panels logically to avoid overwhelming the user with too many visible options at once, enhancing user experience.\n\n5. **Testing**: After adding multiple panels, test the overall performance and UI responsiveness to ensure that it meets user expectations and doesn't degrade performance.""}]",knowledge/js/grapesjs/api,1.0,train
"[{""from"": ""human"", ""value"": ""What best practices should be followed when designing buttons within the panels?""}, {""from"": ""gpt"", ""value"": ""When designing buttons within the panels of the GrapesJS editor, developers should adhere to the following best practices to ensure a user-friendly and efficient experience:\n\n1. **Clear Labeling**: Ensure buttons have clear and descriptive labels that convey their purpose. Avoid using jargon or ambiguous terms that may confuse users.\n   ```javascript\n   const newButton = panelManager.addButton('myPanel', {\n     id: 'myButton',\n     className: 'btn-save',\n     command: 'saveCommand',\n     attributes: { title: 'Save changes' },\n   });\n   ```\n\n2. **Consistent Design**: Maintain a consistent design across buttons for size, color, and font to create a cohesive look and improve usability.\n\n3. **Feedback Mechanism**: Implement visual feedback for actions taken via buttons, such as disabling a button after it is clicked, or changing its appearance to indicate it is active.\n\n4. **Accessibility Considerations**: Make sure buttons are accessible with keyboard navigation and include proper ARIA roles to enhance usability for all users.\n\n5. **Logical Grouping**: Group related buttons together within panels to create a more intuitive interface, reducing the cognitive load on users.""}]",knowledge/js/grapesjs/api,1.0,train
"[{""from"": ""human"", ""value"": ""Why is it important to handle panel visibility effectively?""}, {""from"": ""gpt"", ""value"": ""Handling panel visibility effectively in the GrapesJS editor is crucial for several reasons:\n\n1. **User Experience**: Clear visibility and intuitive organization of panels prevent user confusion and streamline the workflow. Users should be able to find the tools they need without unnecessary clutter.\n\n2. **Performance**: Limiting the number of visible panels reduces the overhead in rendering, improving the performance of the editor, especially when multiple user interactions are happening simultaneously.\n\n3. **Focused Workflow**: Controlling panel visibility helps maintain a user's focus on current tasks, leading to increased productivity by presenting only the relevant tools at any given time.\n\n4. **Contextual Relevance**: Panels can be displayed contextually based on user actions or selections, making the interface dynamic and responsive to user needs, enhancing overall engagement.\n\n5. **Scalability**: Effective visibility management allows for a cleaner, more organized UI, which is essential as the application scales with more features or panels. This helps maintain usability without sacrificing functionality.""}]",knowledge/js/grapesjs/api,1.0,train
"[{""from"": ""human"", ""value"": ""Can you summarize the process of adding a new button to a panel?""}, {""from"": ""gpt"", ""value"": ""Adding a new button to a panel in GrapesJS involves a few straightforward steps:\n\n1. **Access the Panel Manager**: First, ensure that you have access to the panel manager by obtaining it from the initialized editor instance:\n   ```javascript\n   const panelManager = editor.Panels;\n   ```\n\n2. **Define Button Properties**: Create an object containing the properties for the button, including an ID, class name, command to execute, and any attributes needed for additional context.\n   ```javascript\n   const buttonConfig = {\n     id: 'myNewButton',\n     className: 'someClass',\n     command: 'someCommand',\n     attributes: { title: 'Some title' },\n     active: false,\n   };\n   ```\n\n3. **Add the Button to a Panel**: Use the `addButton` method of the panel manager to insert the button into the desired panel by its ID, passing the defined button properties:\n   ```javascript\n   const newButton = panelManager.addButton('myPanel', buttonConfig);\n   ```\n\n4. **Verify the Addition**: Check the returned value to confirm that the button was added successfully, allowing for subsequent interactions with it as required.\n   ```javascript\n   console.log(newButton); // logs the added button instance\n   ```\n\nFollowing these steps ensures the button is properly integrated into the relevant panel, ready for use within the editor.""}]",knowledge/js/grapesjs/api,1.0,train
"[{""from"": ""human"", ""value"": ""What would happen if you tried to add a button to a non-existent panel?""}, {""from"": ""gpt"", ""value"": ""If you attempt to add a button to a non-existent panel in GrapesJS, the `addButton` method would likely return `null`, indicating that the operation was unsuccessful. This can happen if you specify an invalid panel ID that does not correspond to any existing panel. To prevent this, it's good practice to check if the panel exists before attempting to add a button. Here\u2019s a simple way to handle this:\n\n```javascript\nconst panelId = 'myNonExistentPanel';\nconst existingPanel = panelManager.getPanel(panelId);\n\nif (existingPanel) {\n  panelManager.addButton(panelId, {\n    id: 'myButton',\n    className: 'someClass',\n    command: 'commandFunction',\n  });\n} else {\n  console.error('Panel does not exist');\n}\n``` \nIn this example, before adding a button, we check if the panel exists using `getPanel`. This prevents potential issues related to trying to manipulate a panel that does not exist within the editor.""}]",knowledge/js/grapesjs/api,1.0,train
"[{""from"": ""human"", ""value"": ""How can the API methods of the panel manager contribute to an efficient UI design?""}, {""from"": ""gpt"", ""value"": ""The API methods of the panel manager in GrapesJS contribute to efficient UI design through several key aspects:\n\n1. **Dynamic Management**: Methods like `addPanel` and `removePanel` enable developers to dynamically modify the UI based on user interactions or application state, leading to a more responsive and context-aware interface.\n\n2. **Modular Design**: By encapsulating panel management operations within the panel manager, it allows for maintaining a modular design. Developers can separate panel-related logic from other parts of the application, enhancing maintainability.\n\n3. **Reusability**: The ability to add and remove panels and buttons makes it easier to create reusable UI components. Panels can be predefined and invoked when necessary without duplicating code or logic.\n\n4. **Improved User Experience**: Rapidly adding or removing UI elements based on user actions can significantly enhance usability, allowing the interface to adapt to user needs at runtime without abrupt transitions or reloads.\n\n5. **Streamlined Logic**: Developers can use the various methods to organize and streamline their code, allowing for clearer logic in the user interface management, making it easier to understand and troubleshoot.""}]",knowledge/js/grapesjs/api,1.0,train
"[{""from"": ""human"", ""value"": ""What advantage does using the `getPanelsEl` method provide when working with panels in GrapesJS?""}, {""from"": ""gpt"", ""value"": ""Using the `getPanelsEl` method provides several advantages when working with panels in GrapesJS:\n\n1. **Direct DOM Access**: This method returns the HTML element that represents the panels, allowing developers to directly interact with the DOM. This can be useful for dynamic updates or customizations that may not be easily achievable through the API alone.\n\n2. **Customization Opportunities**: Direct access enables developers to apply custom styles or manipulate panel elements based on specific conditions or events, leading to a more tailored interface.\n\n3. **Performance Optimization**: By working directly with the panels' elements, developers can implement optimizations, such as showing/hiding panels or changing their structure, without invoking additional overhead from API calls, improving performance in complex interfaces.\n\n4. **Event Binding**: Developers can easily attach or manage event listeners on panel elements through this method, enabling a more responsive application where the UI reacts promptly to user interactions.""}]",knowledge/js/grapesjs/api,1.0,train
"[{""from"": ""human"", ""value"": ""How can understanding the panel manager API ensure better code quality in projects using GrapesJS?""}, {""from"": ""gpt"", ""value"": ""Understanding the panel manager API in projects utilizing GrapesJS is crucial for ensuring better code quality for several reasons:\n\n1. **Consistency**: Familiarity with the API allows developers to create consistent functionalities across panels and buttons, ensuring users have a similar experience regardless of the panel context.\n\n2. **Maintainability**: Well-understood API methods promote cleaner, more organized code, making it easier to maintain and update as the application evolves. This means that other developers can quickly understand and modify the code as needed.\n\n3. **Error Reduction**: By leveraging the API effectively, developers can reduce the incidence of bugs and unexpected behaviors. Understanding expected inputs and return values can help in proactively managing potential issues.\n\n4. **Efficiency**: Efficient use of the API methods can lead to better performance and responsiveness in the application, which is vital in delivering a smooth user experience. This could involve optimizing the way panels are rendered or manipulated based on user actions.\n\n5. **Enhanced Collaboration**: With a clear grasp of the API, development teams can collaborate more effectively, as everyone is on the same page regarding how to interact with the panel manager, leading to a more cohesive codebase.""}]",knowledge/js/grapesjs/api,1.0,train
