conversations,source,score,split
"[{""from"": ""human"", ""value"": ""What is the purpose of the Parser module in GrapesJS?""}, {""from"": ""gpt"", ""value"": ""The Parser module in GrapesJS serves to convert HTML and CSS strings into structured objects that can be utilized within the GrapesJS framework. By parsing these input strings, the module allows developers to manage and manipulate the editor\u2019s content programmatically, ensuring that the HTML and CSS adhere to specific format standards and can be further processed by other components in GrapesJS.""}]",knowledge/js/grapesjs/api,1.0,train
"[{""from"": ""human"", ""value"": ""How can you initialize the Parser module with custom options?""}, {""from"": ""gpt"", ""value"": ""To initialize the Parser module with custom options in GrapesJS, you can pass a configuration object during the editor initialization. Here\u2019s an example of how to do that:\n\n```javascript\nconst editor = grapesjs.init({\n  parser: {\n    // options\n  }\n});\n```\nYou can specify desired options within the `parser` key to customize the behavior of the module as per your requirements.""}]",knowledge/js/grapesjs/api,1.0,train
"[{""from"": ""human"", ""value"": ""What events are available in the Parser module?""}, {""from"": ""gpt"", ""value"": ""The Parser module in GrapesJS exposes a couple of important events:\n1. **parse:html** - This event is triggered when HTML parsing occurs. It passes an object containing the input and output of the parsing operation.\n2. **parse:css** - This event is triggered during CSS parsing with similar behavior, passing the input and output object.\nThese events allow developers to hook into the parsing process and respond accordingly if needed.""}]",knowledge/js/grapesjs/api,1.0,train
"[{""from"": ""human"", ""value"": ""How do you access the Parser instance after initializing the editor?""}, {""from"": ""gpt"", ""value"": ""After instantiating the GrapesJS editor, you can access the Parser instance using the following code:\n\n```javascript\nconst { Parser } = editor;\n```\nThis destructuring assignment retrieves the Parser module from the editor instance, allowing you to subsequently use its parsing methods.""}]",knowledge/js/grapesjs/api,1.0,train
"[{""from"": ""human"", ""value"": ""What is the return type of the `parseHtml` method?""}, {""from"": ""gpt"", ""value"": ""The `parseHtml` method of the Parser module returns an object containing the result of the parsing process. This object typically includes properties such as `html` and `css`, which represent the parsed HTML content and associated CSS definitions, respectively. The actual signature of the return value is:\n\n```javascript\n{ html: ..., css: ... }\n```""}]",knowledge/js/grapesjs/api,1.0,train
"[{""from"": ""human"", ""value"": ""What parameters does the `parseHtml` method accept?""}, {""from"": ""gpt"", ""value"": ""The `parseHtml` method accepts two parameters:\n1. **input**: A **String** that contains the HTML string to be parsed.\n2. **options**: An optional **Object** that can include the following properties:\n   - `htmlType`: A **String** representing the HTML mime type to parse (optional, default is `text/html`).\n   - `allowScripts`: A **Boolean** that determines whether to allow `<script>` tags. Default is `false`.\n   - `allowUnsafeAttr`: A **Boolean** that allows unsafe HTML attributes, such as inline event handlers. Default is `false`.\nThese parameters allow developers to control how the HTML parsing occurs based on their specific needs.""}]",knowledge/js/grapesjs/api,1.0,train
"[{""from"": ""human"", ""value"": ""Can you provide an example of using the `parseHtml` method?""}, {""from"": ""gpt"", ""value"": ""Certainly! Here\u2019s an example of using the `parseHtml` method to parse an HTML string:\n\n```javascript\nconst resHtml = Parser.parseHtml(`<table><div>Hi</div></table>`, {\n  htmlType: 'text/html', // This will default to text/html\n});\n// The result will correct any HTML errors and return valid HTML\n```\nIn this case, the parsing will automatically fix any syntax issues, so the returned HTML may look correctly formatted as `<div>Hi</div><table></table>`. Another example:\n```javascript\nconst resXml = Parser.parseHtml(`<table><div>Hi</div></table>`, {\n  htmlType: 'application/xml',\n});\n// This will keep the original format valid for XML interpretation\n```""}]",knowledge/js/grapesjs/api,1.0,train
"[{""from"": ""human"", ""value"": ""What is the `parseCss` method used for?""}, {""from"": ""gpt"", ""value"": ""The `parseCss` method is used to parse a CSS string and convert it into an array of valid definition objects for CSS rules. This is helpful when you want to manage and work with CSS styles programmatically in your GrapesJS application.""}]",knowledge/js/grapesjs/api,1.0,train
"[{""from"": ""human"", ""value"": ""Could you give an example of how to use the `parseCss` method?""}, {""from"": ""gpt"", ""value"": ""Sure! Here\u2019s a simple example of using the `parseCss` method to parse a CSS string:\n\n```javascript\nconst res = Parser.parseCss('.cls { color: red };');\n// This will return an array containing the parsed CSS rule\n// e.g., [{ selector: '.cls', declarations: [{ property: 'color', value: 'red' }] }]\n```\nIn this example, the `parseCss` method takes a CSS string as input and outputs an array of objects representing the parsed CSS rules, which can be further utilized within the editor.""}]",knowledge/js/grapesjs/api,1.0,train
"[{""from"": ""human"", ""value"": ""What are the possible options that can be passed to the `parseHtml` method?""}, {""from"": ""gpt"", ""value"": ""The possible options that can be passed to the `parseHtml` method include:\n1. **htmlType**: This option specifies the HTML MIME type to parse. It can be set to values like `text/html` for standard HTML parsing or `application/xml` for XML parsing.\n2. **allowScripts**: A boolean value that determines whether to allow `<script>` tags in the parsed HTML. If set to `true`, script tags will be processed.\n3. **allowUnsafeAttr**: A boolean value indicating whether unsafe HTML attributes such as inline event handlers (e.g., `onClick`) are permissible. Setting this to `true` allows such attributes to be parsed as part of the input.""}]",knowledge/js/grapesjs/api,1.0,train
"[{""from"": ""human"", ""value"": ""What happens when an invalid HTML is parsed using `parseHtml`?""}, {""from"": ""gpt"", ""value"": ""When an invalid HTML is parsed using the `parseHtml` method with the `htmlType` set to `text/html`, the Parser module attempts to automatically correct syntax errors and produce a valid HTML representation. For instance, if the input contains malformed tags or structures, the method will adjust them to ensure that the output is syntactically correct. However, if the `htmlType` is set to `application/xml`, the parsing will enforce strict XML rules, and invalid formats will not be altered, potentially resulting in parsing failures.""}]",knowledge/js/grapesjs/api,1.0,train
"[{""from"": ""human"", ""value"": ""What is returned when you parse a CSS string using `parseCss`?""}, {""from"": ""gpt"", ""value"": ""When you parse a CSS string using the `parseCss` method, it returns an array of objects where each object represents a valid CSS rule. Each rule object contains details such as the selector and a list of declarations (properties and their values). For example, parsing a string like `'.cls { color: red }'` may yield an output like:\n\n```javascript\n[{\n  selector: '.cls',\n  declarations: [{ property: 'color', value: 'red' }]\n}]\n```""}]",knowledge/js/grapesjs/api,1.0,train
"[{""from"": ""human"", ""value"": ""What is the significance of the `allowUnsafeAttr` option in `parseHtml`?""}, {""from"": ""gpt"", ""value"": ""The `allowUnsafeAttr` option in the `parseHtml` method is significant because it controls whether the parser will permit potentially unsafe HTML attributes, such as inline event handlers (e.g., `onClick`, `onLoad`). If set to `true`, it allows these attributes to be included in the parsed output, which can be useful in scenarios where such attributes are necessary for the functionality of scripts or components. However, enabling this option can introduce security risks since it may lead to Cross-Site Scripting (XSS) vulnerabilities if user-generated content is processed, thus it should be used with caution.""}]",knowledge/js/grapesjs/api,1.0,train
"[{""from"": ""human"", ""value"": ""How does `htmlType` affect the parsing behavior of `parseHtml`?""}, {""from"": ""gpt"", ""value"": ""The `htmlType` option in the `parseHtml` method affects how the HTML string is interpreted during the parsing process. There are two main values that can be set for `htmlType`:\n1. **text/html**: When set to this type, the parser will correct any syntax errors in the HTML, leading to a standardized and valid output regardless of the initial input's format. \n2. **application/xml**: Setting this type enforces strict XML rules. This means that malformed HTML will not be corrected, and the output will preserve the original input format, which can result in errors if the HTML is invalid from an XML perspective. Choosing the appropriate `htmlType` is crucial depending on the intended structure of the parsed result.""}]",knowledge/js/grapesjs/api,1.0,train
"[{""from"": ""human"", ""value"": ""Can you explain the relationship between the Parser module and other components in GrapesJS?""}, {""from"": ""gpt"", ""value"": ""The Parser module in GrapesJS acts as a bridge between unstructured HTML/CSS input and the structured representation used within the editor. When developers input raw HTML and CSS, the Parser processes these strings and converts them into formats that are manageable by other components such as the component manager and style manager. This ensures that the data handled is compatible with the internal structures and functionalities of GrapesJS, enabling seamless manipulation, rendering, and interaction with the parsed content. Essentially, the Parser ensures data integrity as it transitions input into editable components.""}]",knowledge/js/grapesjs/api,1.0,train
"[{""from"": ""human"", ""value"": ""What additional features can you implement by utilizing the events available in the Parser module?""}, {""from"": ""gpt"", ""value"": ""By leveraging the available events in the Parser module (`parse:html` and `parse:css`), developers can implement features such as:\n1. **Custom Event Handling**: You can attach listeners to these events to perform custom actions or logging whenever HTML or CSS is parsed.\n2. **Validation**: After parsing, you can validate the output by inspecting the data being passed to ensure it meets your expected criteria or standards.\n3. **Feedback Mechanisms**: Use events to update the user interface or display notifications to users regarding the success or failure of the parsing process, helping improve user experience.\n4. **Integration with Other Tools**: You can connect the parsing process with other tools or services, automating workflows by taking actions when parsing events occur, which can enhance the capabilities of your GrapesJS project.""}]",knowledge/js/grapesjs/api,1.0,train
"[{""from"": ""human"", ""value"": ""How could you handle invalid inputs when using the Parser module?""}, {""from"": ""gpt"", ""value"": ""Handling invalid inputs in the Parser module involves several cautions:\n1. **Input Validation**: Before invoking the parsing methods, validate the format of the input strings. This can be done using regex or other validators to ensure they adhere to HTML/CSS standards.\n2. **Error Handling**: Implement try/catch blocks around parsing calls to gracefully handle exceptions and provide feedback if the parsing fails. This can prevent application crashes due to malformed inputs.\n3. **Fallback Mechanisms**: You can create fallback routines that handle parsing results that are not as expected, either reverting to a default state or prompting the user for corrected input.\n4. **Testing**: Thoroughly test the Parser methods with a variety of inputs to assess their behavior with valid, invalid, and edge cases, ensuring robustness in real-time applications.""}]",knowledge/js/grapesjs/api,1.0,train
"[{""from"": ""human"", ""value"": ""What is the importance of correctly structured HTML and CSS in GrapesJS?""}, {""from"": ""gpt"", ""value"": ""Correctly structured HTML and CSS are crucial in GrapesJS as they impact the rendering and behavior of user-generated content in the editor. Proper structure ensures:\n1. **Interoperability**: Well-formed HTML and CSS are more likely to work across different browsers and components without issues.\n2. **Component Functionality**: Components built within GrapesJS rely on structured data to function properly. Incorrect syntax may lead to misbehavior or failure to render correctly.\n3. **User Experience**: Users benefit from a seamless experience when the content displayed is valid and behaves as expected. Invalid markup may hinder usability and satisfaction.\n4. **Maintainability**: Cleaner structured code is easier to maintain and update, which is essential for long-term project success.""}]",knowledge/js/grapesjs/api,1.0,train
"[{""from"": ""human"", ""value"": ""How can the Parser module contribute to the overall architecture of a web application built on GrapesJS?""}, {""from"": ""gpt"", ""value"": ""The Parser module contributes significantly to the architecture of a web application built on GrapesJS by:\n1. **Data Transformation**: It acts as a transformation layer, converting user input (HTML/CSS) into structured data that integrates smoothly with other components of the application.\n2. **Modularity**: By providing clear interfaces for parsing, the Parser supports a modular architecture that allows different parts of the application to function independently yet cohesively.\n3. **Extensibility**: Developers can extend the Parser\u2019s functionality and configure it to meet specific project needs, fostering a highly customizable application environment.\n4. **Error Management**: By standardizing how HTML and CSS are parsed and handled, it simplifies debugging and enhances error management strategies within the overall application framework.""}]",knowledge/js/grapesjs/api,1.0,train
"[{""from"": ""human"", ""value"": ""How would you demonstrate the practical use of the `getConfig` method in the Parser module?""}, {""from"": ""gpt"", ""value"": ""To demonstrate the practical use of the `getConfig` method in the Parser module, you would first retrieve the Parser instance and then call the `getConfig` method to access the current configuration settings. Here\u2019s a sample code snippet to illustrate:\n\n```javascript\nconst { Parser } = editor;\n\n// Get the current configuration object of the parser\nconst config = Parser.getConfig();\nconsole.log(config);\n// This will log the current configuration settings to the console\n``` \nThis simple demonstration shows how one can access and review the current parsing options, which can be essential for debugging or modifying the parsing behavior.""}]",knowledge/js/grapesjs/api,1.0,train
"[{""from"": ""human"", ""value"": ""What types of applications are best suited for utilizing the GrapesJS Parser module?""}, {""from"": ""gpt"", ""value"": ""Applications best suited for utilizing the GrapesJS Parser module include:\n1. **Website Builders**: Tools that allow users to create and edit websites visually, where direct manipulation of HTML/CSS is required.\n2. **Content Management Systems (CMS)**: Systems where users need to input raw HTML and CSS that must be processed before being stored or rendered.\n3. **Email Template Designers**: Applications that involve creating responsive HTML emails from user inputs, as such input often needs parsing to ensure valid structures.\n4. **Prototype and Mockup Tools**: Where designers can input code directly to see how components will render, requiring robust HTML/CSS processing.\nIn general, any application that involves user interaction with raw markup will benefit from the functionality provided by the Parser module.""}]",knowledge/js/grapesjs/api,1.0,train
"[{""from"": ""human"", ""value"": ""Could you explain how the Parser module ensures data integrity when managing HTML and CSS?""}, {""from"": ""gpt"", ""value"": ""The Parser module ensures data integrity when managing HTML and CSS by:\n1. **Syntax Correction**: By correcting syntax errors in HTML as they are parsed, the module prevents the accumulation of malformed code that could lead to runtime errors or unexpected behavior.\n2. **Standardization**: By converting diverse and sometimes inconsistent user inputs into standardized objects, the Parser ensures consistency in how HTML and CSS are handled, enabling greater reliability in subsequent operations.\n3. **Strict Parsing Options**: For applications where safety is critical, the ability to enable strict parsing options (like not allowing unsafe attributes) helps prevent security vulnerabilities.\n4. **Detailed feedback**: by providing structured output, users and developers can see exactly how their inputs are transformed, which aids debugging and troubleshooting efforts.""}]",knowledge/js/grapesjs/api,1.0,train
"[{""from"": ""human"", ""value"": ""How does the GrapesJS Parser module enhance the developer experience?""}, {""from"": ""gpt"", ""value"": ""The GrapesJS Parser module enhances the developer experience in several ways:\n1. **Simplified API**: It provides a straightforward API for parsing HTML and CSS, reducing the complexity that developers have to handle compared to manual parsing approaches.\n2. **Event Hooks**: The inclusion of events like `parse:html` and `parse:css` allows developers to integrate custom functionalities and respond dynamically to parsing actions, improving extensibility.\n3. **Robust Handling of Input**: With built-in error correction and validation mechanisms, developers spend less time dealing with malformed input, as the Parser normalizes and ensures the integrity of the data before it\u2019s used.\n4. **Enhanced Debugging Tools**: By making the parsing process visible through events and output objects, developers have better insights into the parsing flow, facilitating troubleshooting and refinements.""}]",knowledge/js/grapesjs/api,1.0,train
"[{""from"": ""human"", ""value"": ""What best practices should be followed when configuring the Parser module in GrapesJS?""}, {""from"": ""gpt"", ""value"": ""When configuring the Parser module in GrapesJS, best practices include:\n1. **Understand Your Input**: Always assess the type of HTML/CSS you expect from users and configure the parsing options accordingly to avoid unnecessary parsing errors.\n2. **Strict Configuration on Security**: If handling user-generated content, consider enabling strict options like `allowScripts: false` and `allowUnsafeAttr: false` to mitigate security risks, especially XSS vulnerabilities.\n3. **Test with Varied Inputs**: Conduct thorough testing with diverse input scenarios to ensure robustness. Include edge cases to validate behavior under different conditions.\n4. **Maintain Configuration Consistency**: Document and maintain the parsing options consistently throughout your application to minimize changes that may lead to bugs in the future.\n5. **Listen to Events**: Utilize available events effectively to monitor parsing actions and implement responses that can enhance user feedback and system integrity.""}]",knowledge/js/grapesjs/api,1.0,train
"[{""from"": ""human"", ""value"": ""What should a developer know before changing the configuration of the Parser module?""}, {""from"": ""gpt"", ""value"": ""Before changing the configuration of the Parser module, a developer should know:\n1. **Understanding Defaults**: Familiarize themselves with the default settings to assess how their changes will impact existing functionality.\n2. **Security Commitments**: Be aware of the security implications of enabling or disabling options, particularly relating to script execution and unsafe attributes.\n3. **Testing and Validation**: Changes should be thoroughly tested to validate that new settings do not introduce errors or vulnerabilities in processing user input.\n4. **Functionality Scope**: Understand the broader scope of how these configurations interact with other components in GrapesJS to avoid unintended side effects.\n5. **Performance Considerations**: Modify settings with consideration for performance impacts, especially in applications expecting high volumes of data or simultaneous user interactions.""}]",knowledge/js/grapesjs/api,1.0,train
"[{""from"": ""human"", ""value"": ""How can plugin developers use the Parser module to enhance their own plugins within GrapesJS?""}, {""from"": ""gpt"", ""value"": ""Plugin developers can utilize the Parser module in their own plugins within GrapesJS to enhance functionality by:\n1. **Custom Parsing Logic**: Integrate specific parsing logic that processes user inputs uniquely, allowing finer control over how HTML/CSS is managed within the plugin.\n2. **Interoperability**: Leverage the standardized output from the Parser to ensure compatibility and easy integration with other notable APIs, components, or plugins in the GrapesJS ecosystem.\n3. **Event-Driven Updates**: Utilize the `parse:html` and `parse:css` events to trigger updates or other actions in their plugins whenever new content is parsed, facilitating real-time data handling or UI updates.\n4. **Enhanced User Feedback**: Provide better user feedback by chaining validations or transformations based on the parsed results, improving the overall user experience.""}]",knowledge/js/grapesjs/api,1.0,train
"[{""from"": ""human"", ""value"": ""What future improvements could be made to the GrapesJS Parser module?""}, {""from"": ""gpt"", ""value"": ""Future improvements for the GrapesJS Parser module could include:\n1. **Enhanced Error Reporting**: Providing more granular error messages and diagnostics when parsing fails, enabling developers to understand problems without digging deep.\n2. **Parser Adaptations for Modern Standards**: Regular updates to support the latest HTML/CSS standards and features, ensuring that the parser remains robust and future-proof.\n3. **Integration with AI Tools**: Allow integration with AI-based tools for smart suggestions on fixing common parsing issues or formatting errors.\n4. **Performance Optimization**: Exploring ways to improve performance for parsing large strings or datasets effectively, perhaps by implementing streaming parse options.\n5. **User-Customizable Options**: Offering more user-friendly configuration options that allow less experienced developers to customize behavior with minimal understanding of the underlying code.""}]",knowledge/js/grapesjs/api,1.0,train
"[{""from"": ""human"", ""value"": ""Can you describe how to effectively debug issues related to parsing in GrapesJS?""}, {""from"": ""gpt"", ""value"": ""Effectively debugging parsing issues in GrapesJS involves several steps:\n1. **Console Logging**: Use console.log statements to log inputs and outputs around parsing calls, enabling visibility into what data is being fed into the parser and what results are produced.\n2. **Error Handling Mechanisms**: Employ try-catch blocks to catch and isolate errors from parsing methods, which can then provide meaningful messages to aid in diagnosing issues.\n3. **Test Various Inputs**: Perform tests using a variety of different input cases, including edge cases that may expose flaws in the parser, to assess how well the parsing logic handles diverse scenarios.\n4. **Utilize Events**: Listen for the `parse:html` and `parse:css` events to monitor parsing activity, which can reveal clues to problems as they happen in real time.\n5. **Review Configuration Settings**: Regularly review and test any changes in configuration settings, ensuring that they align with expected behavior and do not compromise parsing integrity.""}]",knowledge/js/grapesjs/api,1.0,train
"[{""from"": ""human"", ""value"": ""How can you ensure that your application remains secure when utilizing the Parser module?""}, {""from"": ""gpt"", ""value"": ""To ensure that your application remains secure while using the Parser module, follow these practices:\n1. **Restrict Unsafe Options**: Always set options like `allowScripts` and `allowUnsafeAttr` to `false` to mitigate the risk of XSS vulnerabilities from user input.\n2. **Input Sanitization**: Implement additional input sanitization steps before parsing to clean up any potentially dangerous data before it reaches the parser.\n3. **Comprehensive Testing**: Conduct thorough tests focusing on security implications to identify and rectify vulnerabilities that may arise from changes in input handling.\n4. **Security Audits**: Regularly audit your codebase and dependencies for security concerns, especially around user input and template parsing.\n5. **Monitor External Threats**: Stay updated on the latest security threats related to HTML/CSS parsing and adapt your parsing strategies accordingly.""}]",knowledge/js/grapesjs/api,1.0,train
