conversations,source,score,split
"[{""from"": ""human"", ""value"": ""What are the key properties defined in the Property class and what are their functions?""}, {""from"": ""gpt"", ""value"": ""The Property class contains several key properties that define its characteristics and behavior. Here are the main properties:\n\n1. **id**: This is a string that acts as a unique identifier for the property, such as `my-property-id`.\n2. **property**: This string represents the related CSS property name, for example, `text-align`.\n3. **default**: This string holds the default value of the property that is typically set during the property creation.\n4. **label**: A string used to provide a user-friendly label for the property in the UI, such as `Text Align`.\n5. **onChange**: This is an optional function callback triggered when the property value changes. It receives an object containing the property, its old value (from), and its new value (to).\n   ```js\n   onChange: ({ property, from, to }) => {\n       console.log(`Changed property`, property.getName(), { from, to });\n   }\n   ```\nThese properties encapsulate the fundamental attributes needed to manage CSS properties within the framework.""}]",knowledge/js/grapesjs/api,1.0,train
"[{""from"": ""human"", ""value"": ""Can you explain how the getId method works in the Property class?""}, {""from"": ""gpt"", ""value"": ""The `getId` method in the Property class is a simple accessor that retrieves the unique identifier (id) of the property instance. When you call this method, it returns a string which represents the `id` of the Property.\n\nHere is an example of how this method might be defined:\n\n```javascript\ngetId() {\n    return this.id;\n}\n```\n\n**Usage Example**:\n```javascript\nconst myProperty = new Property({ id: 'my-property-id' });\nconsole.log(myProperty.getId()); // Outputs: 'my-property-id'\n```\nThis method is useful for identifying or referencing this specific property instance within the codebase or UI.""}]",knowledge/js/grapesjs/api,1.0,train
"[{""from"": ""human"", ""value"": ""What does the getType method do in the Property class?""}, {""from"": ""gpt"", ""value"": ""The `getType` method in the Property class is designed to retrieve the type of the property. The type is typically assigned during the property's creation and depends on its value, determining which specific Property class to use. The default type is `base`.\n\nHere is an illustrative implementation of the getType method:\n\n```javascript\ngetType() {\n    return this.type;\n}\n```\n\n**Usage Example**:\n```javascript\nconst myProperty = new Property({ id: 'my-property-id', type: 'color' });\nconsole.log(myProperty.getType()); // Outputs: 'color'\n```\n\nThe `getType` method helps in dynamically determining property behavior and capabilities based on its defined type.""}]",knowledge/js/grapesjs/api,1.0,train
"[{""from"": ""human"", ""value"": ""Describe how to use the getValue method and its parameters.""}, {""from"": ""gpt"", ""value"": ""The `getValue` method in the Property class retrieves the current value of the property. It can optionally take parameters to modify its behavior. The method signature is typically as follows:\n\n```javascript\ngetValue(opts = {}) {\n    // Method implementation\n}\n```\n\n### Parameters:\n- **opts (Object)**: An optional object that can include the following keys:\n    - **opts.noDefault (Boolean)**: If set to `true`, the method avoids returning the default value of the property.\n\n### Returns:\n- **String**: It returns the current value of the property.\n\n### Usage Example:\n```javascript\nconst myProperty = new Property({ id: 'my-property-id', default: 'initial-value' });\nconsole.log(myProperty.getValue()); // Outputs: 'initial-value'\n// When using opts to avoid the default value\nconsole.log(myProperty.getValue({ noDefault: true })); // May output an alternative value if set\n```\n\nThe ability to control the output based on options makes `getValue` flexible and adaptable in different contexts.""}]",knowledge/js/grapesjs/api,1.0,train
"[{""from"": ""human"", ""value"": ""How does the hasValue method operate? What parameters does it accept?""}, {""from"": ""gpt"", ""value"": ""The `hasValue` method in the Property class checks whether the property has an assigned value. This method returns a boolean indicating whether a valid value exists for the property. The typical method implementation might look like this:\n\n```javascript\nhasValue(opts = {}) {\n    // Implementation to check value\n}\n```\n\n### Parameters:\n- **opts (Object)**: This optional object can include:\n    - **opts.noParent (Boolean)**: If set to `true`, the method ignores any value that may originate from a parent target (i.e., another CSS rule).\n\n### Returns:\n- **Boolean**: Returns `true` if the property has a value (not null or undefined), otherwise `false`.\n\n### Usage Example:\n```javascript\nconst myProperty = new Property({ id: 'my-property-id', value: 'some-value' });\nconsole.log(myProperty.hasValue()); // Outputs: true\nconsole.log(myProperty.hasValue({ noParent: true })); // Outputs based on conditions\n```\n\nThis method is essential for determining whether a particular property should be applied or rendered based on the presence of a value.""}]",knowledge/js/grapesjs/api,1.0,train
"[{""from"": ""human"", ""value"": ""Explain the purpose and functionality of the clear method in the Property class.""}, {""from"": ""gpt"", ""value"": ""The `clear` method in the Property class serves to remove the current value of the property effectively. When this method is called, it not only clears the value of the property for that instance but also propagates this change to the selected targets (e.g., influencing the related CSS property in the document).\n\n### Parameters:\n- **opts (Object)**: This optional object can contain:\n    - **opts.noTarget (Boolean)**: If set to `true`, this indicates that the change should not be propagated to selected targets.\n\n### Functionality:\nThe method is commonly implemented as follows:\n```javascript\nclear(opts = {}) {\n    this.value = null;\n    if (!opts.noTarget) {\n        // Logic to propagate the clear to targets\n    }\n}\n```\n\n### Usage Example:\n```javascript\nconst myProperty = new Property({ id: 'my-property-id', value: 'some-value' });\nmyProperty.clear(); // The value is cleared\nconsole.log(myProperty.getValue()); // Outputs: null\n```\n\nClearing the value is important for managing state, especially in dynamic UIs where user actions may result in property resets.""}]",knowledge/js/grapesjs/api,1.0,train
"[{""from"": ""human"", ""value"": ""What is the significance of the isFull method in the Property class?""}, {""from"": ""gpt"", ""value"": ""The `isFull` method in the Property class indicates whether the property is considered full-width within the user interface. This is significant for determining how the property will be displayed or interacted with in the UI context.\n\n### Returns:\n- **Boolean**: The method typically returns `true` if the property is marked as full-width; otherwise, it returns `false`.\n\n### Implementation Example:\n```javascript\nisFull() {\n    return this.fullWidth;\n}\n```\n\n### Usage Example:\n```javascript\nconst myProperty = new Property({ id: 'my-property-id', fullWidth: true });\nconsole.log(myProperty.isFull()); // Outputs: true\n```\n\nThis method plays a crucial role in UI layouts, as properties that are full-width may stretch to occupy more space, affecting design and usability.""}]",knowledge/js/grapesjs/api,1.0,train
"[{""from"": ""human"", ""value"": ""How do parameters affect the getStyle method in the Property class?""}, {""from"": ""gpt"", ""value"": ""The `getStyle` method in the Property class retrieves the CSS style object associated with the property. The method can accept parameters that modify the output format of the property name.\n\n### Parameters:\n- **opts (Object)**: This optional object may include:\n    - **opts.camelCase (Boolean)**: If set to `true`, the method should return the property name in camelCase format (e.g., `textAlign` instead of `text-align`).\n\n### Implementation Example:\n```javascript\ngetStyle(opts = {}) {\n    let style = {};\n    const propName = opts.camelCase ? this.property.replace(/-([a-z])/g, g => g[1].toUpperCase()) : this.property;\n    style[propName] = this.value;\n    return style;\n}\n```\n\n### Usage Example:\n```javascript\nconst myProperty = new Property({ property: 'text-align', value: 'center' });\nconsole.log(myProperty.getStyle()); // Outputs: { 'text-align': 'center' }\nconsole.log(myProperty.getStyle({ camelCase: true })); // Outputs: { textAlign: 'center' }\n```\n\nThis demonstrates the flexibility of the `getStyle` method, allowing developers to adapt the CSS property format based on their needs.""}]",knowledge/js/grapesjs/api,1.0,train
"[{""from"": ""human"", ""value"": ""What is the function of the canClear method in the Property class?""}, {""from"": ""gpt"", ""value"": ""The `canClear` method in the Property class determines whether the current value of the property can be cleared. It checks if the value originates directly from the selected target and thus authorizes the clearing operation.\n\n### Returns:\n- **Boolean**: The method returns `true` if the property can be cleared (i.e., the value comes directly from the selected target); otherwise, it returns `false`.\n\n### Implementation Example:\n```javascript\ncanClear() {\n    return this.valueOrigin === 'target'; // Conditional logic\n}\n```\n\n### Usage Example:\n```javascript\nconst myProperty = new Property({ id: 'my-property-id', valueOrigin: 'target' });\nconsole.log(myProperty.canClear()); // Outputs: true\n```\n\nThe `canClear` method is important in preventing unintended side effects when trying to clear properties originating from other sources.""}]",knowledge/js/grapesjs/api,1.0,train
"[{""from"": ""human"", ""value"": ""Explain the purpose of the getParent method in the Property class.""}, {""from"": ""gpt"", ""value"": ""The `getParent` method in the Property class is designed to return the parent property of the current instance, especially if the current property is a sub-property. This is useful for hierarchical property management, where properties can consist of nested or related attributes.\n\n### Returns:\n- **Property | null**: It returns the parent Property instance if available; otherwise, it returns `null` if the current property has no parent.\n\n### Implementation Example:\n```javascript\ngetParent() {\n    return this.parent || null;\n}\n```\n\n### Usage Example:\n```javascript\nconst parentProperty = new Property({ id: 'parent-property' });\nconst childProperty = new Property({ parent: parentProperty });\nconsole.log(childProperty.getParent()); // Outputs: parentProperty instance\n```\n\nThis method is crucial in maintaining the relationship between properties, especially in complex UI settings where properties may inherit behavior or values from parent properties.""}]",knowledge/js/grapesjs/api,1.0,train
"[{""from"": ""human"", ""value"": ""What does the getDefaultValue method return?""}, {""from"": ""gpt"", ""value"": ""The `getDefaultValue` method in the Property class returns the predefined default value for that property. It is useful for reference or when resetting properties to their initial state.\n\n### Returns:\n- **String**: It outputs the default value of the property as a string.\n\n### Implementation Example:\n```javascript\ngetDefaultValue() {\n    return this.default;\n}\n```\n\n### Usage Example:\n```javascript\nconst myProperty = new Property({ id: 'my-property-id', default: 'initial-value' });\nconsole.log(myProperty.getDefaultValue()); // Outputs: 'initial-value'\n```\n\nThis method provides a straightforward way to retrieve the original intended setting for the property, facilitating both user interactions and programmatic resets.""}]",knowledge/js/grapesjs/api,1.0,train
"[{""from"": ""human"", ""value"": ""How can the update functionality be demonstrated using the upValue method?""}, {""from"": ""gpt"", ""value"": ""The `upValue` method in the Property class is used to update the current value of the property. This method not only changes the assign value but also ensures that the change is propagated to selected targets (like updating CSS rules) if configured to do so.\n\n### Parameters:\n- **value (String)**: This is the new value that you want to assign to the property.\n- **opts (Object)**: This optional object can include:\n    - **opts.partial (Boolean)**: If `true`, the update will be considered incomplete, meaning it won't be recorded in the UndoManager.\n    - **opts.noTarget (Boolean)**: If `true`, the change will not be propagated to selected targets.\n\n### Implementation Example:\n```javascript\nupValue(value, opts = {}) {\n    this.value = value;\n    if (!opts.noTarget) {\n        // Logic to propagate the value to targets\n    }\n}\n```\n\n### Usage Example:\n```javascript\nconst myProperty = new Property({ id: 'my-property-id', value: 'old-value' });\nmyProperty.upValue('new-value'); // Updates the value\nconsole.log(myProperty.getValue()); // Outputs: 'new-value'\n```\n\nThis method demonstrates how properties can be dynamically updated in response to user interactions or application logic, keeping the UI in sync with underlying data.""}]",knowledge/js/grapesjs/api,1.0,train
"[{""from"": ""human"", ""value"": ""What role does the isVisible method play in the Property class?""}, {""from"": ""gpt"", ""value"": ""The `isVisible` method in the Property class checks whether the property is currently visible in the user interface. This method is vital for improving user experience by showing or hiding properties based on certain criteria, such as user input or application state.\n\n### Returns:\n- **Boolean**: It returns `true` if the property is visible; otherwise, it returns `false`.\n\n### Implementation Example:\n```javascript\nisVisible() {\n    return this.visible;\n}\n```\n\n### Usage Example:\n```javascript\nconst myProperty = new Property({ id: 'my-property-id', visible: true });\nconsole.log(myProperty.isVisible()); // Outputs: true\n```\n\nThis method is generally utilized when dynamically rendering UI components, allowing for responsive layouts and interactions.""}]",knowledge/js/grapesjs/api,1.0,train
"[{""from"": ""human"", ""value"": ""How does the hasValueParent method operate within the Property class?""}, {""from"": ""gpt"", ""value"": ""The `hasValueParent` method in the Property class indicates whether the current property value originates from a parent target, such as another CSS rule. This is particularly useful for properties that apply styles based on inheritance in stylesheets.\n\n### Returns:\n- **Boolean**: It returns `true` if the current value is derived from a parent target; otherwise, it returns `false`.\n\n### Implementation Example:\n```javascript\nhasValueParent() {\n    return this.isInheritedFromParent;\n}\n```\n\n### Usage Example:\n```javascript\nconst myProperty = new Property({ id: 'my-property-id', isInheritedFromParent: true });\nconsole.log(myProperty.hasValueParent()); // Outputs: true\n```\n\nThis method aids in diagnosing property values that may be subject to changes in parent properties, ensuring that styling remains consistent across nested structures.""}]",knowledge/js/grapesjs/api,1.0,train
"[{""from"": ""human"", ""value"": ""Can you clarify the role of the onChange property in the Property class?""}, {""from"": ""gpt"", ""value"": ""The `onChange` property in the Property class is a function that acts as a callback whenever the property's value changes. It allows developers to define custom behaviors or operations triggered by property updates, enhancing the responsive dynamic interaction in applications.\n\n### Example of onChange Functionality:\n```javascript\nonChange: ({ property, from, to }) => {\n    console.log(`Changed property`, property.getName(), { from, to });\n}\n```\n\nThis example showcases how the `onChange` callback can log the details of the property change to the console, referring to the property name and its previous and new values.\n\n### Importance:\nThe onChange property is crucial for ensuring that related components and states are in sync with user actions and changes made to properties. It supports reactive programming paradigms and enhances the overall user experience.""}]",knowledge/js/grapesjs/api,1.0,train
"[{""from"": ""human"", ""value"": ""How can methods like getLabel and getName be utilized in the Property class?""}, {""from"": ""gpt"", ""value"": ""The `getLabel` and `getName` methods in the Property class serve distinct purposes when it comes to accessing information about the properties.\n\n### getLabel Method:\nThe `getLabel` method retrieves the user-friendly label associated with the property, tailored for display in user interfaces. Its implementation may optionally accept parameters to accommodate localization.\n\n#### Example:\n```javascript\ngetLabel(opts = {}) {\n    return opts.locale ? localizedLabels[this.labelKey] : this.label;\n}\n```\n\n### getName Method:\nThe `getName` method, on the other hand, returns the CSS property name associated with the property instance, providing a direct reference for programmatic operations or styling.\n\n#### Example:\n```javascript\ngetName() {\n    return this.property;\n}\n```\n\n### Usage Example:\n```javascript\nconst myProperty = new Property({ label: 'Text Align', property: 'text-align' });\nconsole.log(myProperty.getLabel()); // Outputs: 'Text Align'\nconsole.log(myProperty.getName()); // Outputs: 'text-align'\n```\n\nThese methods enable developers to extract essential metadata from property instances, aiding in customization and UI representation.""}]",knowledge/js/grapesjs/api,1.0,train
"[{""from"": ""human"", ""value"": ""What are the implications of having a noDefault parameter in methods like getValue?""}, {""from"": ""gpt"", ""value"": ""Having a `noDefault` parameter in methods like `getValue` introduces an important conditional behavior that allows developers to control whether the default value should be included in the response.\n\n### Usage Implications:\n1. **Flexibility**: By allowing the option to avoid the default value, developers gain greater flexibility in conditional logic, enabling them to handle situations where the default may not be desired.\n2. **Clarity**: It clarifies the state of the property, ensuring that any operations or checks can be based on the actual assigned value instead of default states.\n3. **Conditional Rendering**: In UI scenarios, excluding default values can alter visual representation or components dynamically, by allowing for cleaner checks and balances when updating UI elements based on user input or configuration values.\n\n### Example Implementation:\n```javascript\ngetValue(opts = {}) {\n    if (opts.noDefault && this.value === this.default) {\n        return null; // Or some alternative logic\n    }\n    return this.value;\n}\n```\n\n### Example Usage:\n```javascript\nconst myProperty = new Property({ id: 'my-property-id', value: 'default-value', default: 'default-value' });\nconsole.log(myProperty.getValue({ noDefault: true })); // Outputs null, or alters behavior based on logic\n```\n\nThis approach enhances the method's responsiveness to context and ensures that developers have the tools necessary to manage property values effectively.""}]",knowledge/js/grapesjs/api,1.0,train
"[{""from"": ""human"", ""value"": ""How can you check if a property is visually visible using isVisible?""}, {""from"": ""gpt"", ""value"": ""To check whether a property is visually visible in the UI, you can utilize the `isVisible` method within the Property class. This method returns a boolean value indicating the visibility status of that property.\n\n### Implementation Example:\n```javascript\nisVisible() {\n    return this.visible;\n}\n```\n\n### Usage Example:\n```javascript\nconst myProperty = new Property({ id: 'my-property-id', visible: false });\nconsole.log(myProperty.isVisible()); // Outputs: false\n\nmyProperty.visible = true; // Changing visibility\nconsole.log(myProperty.isVisible()); // Outputs: true\n```\n\n### Significance:\nThe `isVisible` method is pivotal for toggling UI elements that depend on property visibility, allowing for cleaner UI experiences and interactions. By employing this method, developers can effectively manage and control how properties are represented in user interfaces.""}]",knowledge/js/grapesjs/api,1.0,train
"[{""from"": ""human"", ""value"": ""Can you elaborate on the method behavior concerning propagation of changes in methods like clear and upValue?""}, {""from"": ""gpt"", ""value"": ""In the Property class, both `clear` and `upValue` methods include functionality for propagating changes to selected targets, which are critical for maintaining UI and style consistency across properties.\n\n### clear Method Behavior:\nThe `clear` method serves to remove or reset the property value, and it can propagate this change to other components or targets:\n```javascript\nclear(opts = {}) {\n    this.value = null;\n    if (!opts.noTarget) {\n        // Logic to notify or update selected targets\n    }\n}\n```\n\n### upValue Method Behavior:\nSimilarly, the `upValue` method not only updates the property's value but also propagates this new value to selected targets, ensuring that style changes reflect throughout the application:\n```javascript\nupValue(value, opts = {}) {\n    this.value = value;\n    if (!opts.noTarget) {\n        // Logic to notify or update selected targets\n    }\n}\n```\n\n### Parameters Impact:\nBoth methods include parameters that dictate whether this propagation should occur:\n- **opts.noTarget** (Boolean): When set to `true`, the change will not be sent to designated targets, allowing for finer control over when updates are made.\n\n### Significance:\nThis propagation feature is crucial for reactive programming models to ensure synchronization between state changes and visual representation. It allows a flow of updates that keeps the user interface in step with data model changes, enhancing overall user experience.""}]",knowledge/js/grapesjs/api,1.0,train
"[{""from"": ""human"", ""value"": ""How does the use of opts in various methods enhance the Property class\u2019s capabilities?""}, {""from"": ""gpt"", ""value"": ""The use of `opts` as an optional parameter in various methods of the Property class enhances its capabilities significantly by adding flexibility and context-specific control to the methods.\n\n### Enhancements Provided by opts:\n1. **Customization**: By allowing optional properties, developers can customize the behavior of methods based on specific scenarios, leading to more precise control over how properties are handled.\n2. **Conditional Logic**: Options such as `noDefault` or `noTarget` enable conditional logic, allowing methods to behave differently depending on the arguments provided. For example, avoiding default values or preventing propagation of changes.\n3. **Improved Readability**: Including options improves the readability of function signatures as it centralizes the configuration for that method in an explicit way, making it clearer how the method will behave based on its inputs.\n4. **Extensibility**: The design allows for easy future expansions where adding new parameters can be done without affecting the existing method structure, hence improving maintainability.\n\n### Practical Example:\n```javascript\ngetValue(opts = {}) {\n    if (opts.noDefault && this.value === this.default) {\n        return null;\n    }\n    return this.value;\n}\n```\nThis implementation shows how the use of `opts` can adjust the method's return behavior based on input, enhancing overall functionality.\n\n### Conclusion:\nIn summary, the use of `opts` in the Property class methods significantly enhances the capability, flexibility, and maintainability of property management while simplifying developers' interaction with the object.""}]",knowledge/js/grapesjs/api,1.0,train
