conversations,source,score,split
"[{""from"": ""human"", ""value"": ""What is the purpose of GrapesJS APIs?""}, {""from"": ""gpt"", ""value"": ""The purpose of GrapesJS APIs is to allow developers to extend the basic functionality of the GrapesJS framework within their editors. By using these APIs, developers can customize and enhance the features of the editor, making it more suitable for their specific use cases. Additionally, developers can create plugins, which are reusable extensions that can be shared with others, further expanding the capabilities of GrapesJS.""}]",knowledge/js/grapesjs/api,1.0,train
"[{""from"": ""human"", ""value"": ""How can developers utilize GrapesJS APIs in their projects?""}, {""from"": ""gpt"", ""value"": ""Developers can utilize GrapesJS APIs by integrating them directly into their projects that utilize the GrapesJS framework. This typically involves the following steps:\n1. **Access the Documentation**: Start by reviewing the API reference documentation to understand the available methods, properties, and usage examples.\n2. **Implement API Calls**: Use the provided APIs in your JavaScript code to interact with various components of GrapesJS, like models, views, or plugins.\n3. **Create Plugins**: Based on the APIs, developers can create plugins to encapsulate specific functionalities and expose those functionalities for reuse across different projects or share them with the community.\n4. **Test and Debug**: Ensure thorough testing of the implemented features to confirm they work seamlessly within the GrapesJS ecosystem.\nBy following these guidelines, developers can effectively leverage the power of GrapesJS APIs to enhance their applications.""}]",knowledge/js/grapesjs/api,1.0,train
"[{""from"": ""human"", ""value"": ""What is the significance of creating plugins using GrapesJS APIs?""}, {""from"": ""gpt"", ""value"": ""Creating plugins using GrapesJS APIs is significant because it allows developers to encapsulate specific functionalities, making them reusable across various projects. Here are some key points:\n1. **Reusability**: Plugins can be shared with other developers or within the community, promoting collaboration and knowledge sharing.\n2. **Modularity**: By structuring code into plugins, developers can maintain cleaner codebases, separating different functionalities into distinct modules.\n3. **Ease of Use**: End-users can easily incorporate plugins into their projects without needing deep knowledge of the underlying code, enhancing the overall user experience.\n4. **Extensibility**: As the base GrapesJS framework evolves, plugins can be updated or adapted to maintain compatibility and incorporate new features, enhancing longevity and support.\n5. **Community Contribution**: Developers can contribute to the broader development of GrapesJS, enriching the ecosystem with diverse tools and features.""}]",knowledge/js/grapesjs/api,1.0,train
"[{""from"": ""human"", ""value"": ""In what ways can the GrapesJS APIs enhance the basic functionality of the framework?""}, {""from"": ""gpt"", ""value"": ""GrapesJS APIs can enhance the basic functionality of the framework in multiple ways, such as:\n1. **Custom Element Creation**: Developers can create their own custom elements or modify existing ones to suit specific design requirements, thus providing greater flexibility in template creation.\n2. **Event Handling**: APIs can facilitate the handling of events to respond to user interactions dynamically, thereby improving the interactivity of the application.\n3. **State Management**: Through APIs, developers can manage the application state more effectively, ensuring that changes are reflected across all components without the need for excessive manual updates.\n4. **Integration with External Services**: APIs allow seamless integration with external libraries, services, or frameworks, enhancing the functionality by bringing in additional tools that can interact with GrapesJS.\n5. **Customization Options**: By exposing various configuration options and functionalities, APIs enable developers to tailor the editor experience to better fit their application's needs, improving both usability and performance.""}]",knowledge/js/grapesjs/api,1.0,train
"[{""from"": ""human"", ""value"": ""What is the process to get started with creating plugins in GrapesJS?""}, {""from"": ""gpt"", ""value"": ""To get started with creating plugins in GrapesJS, follow these steps:\n1. **Understand the Framework**: Familiarize yourself with the GrapesJS framework, its core concepts, and how it manages components, models, and views.\n2. **Review API Documentation**: Access the API reference documentation to explore the available methods and learn how to interact with the framework.\n3. **Set up Your Development Environment**: Initiate a new project that uses GrapesJS or set up a development environment where you can test your plugin.\n4. **Define Plugin Structure**: Organize your plugin's codebase, usually following a specified structure for better maintainability and readability.\n5. **Implement Plugin Logic**: Use GrapesJS APIs to implement the desired functionality within your plugin. This can include custom commands, components, or event listeners.\n6. **Integrate and Test**: Integrate your plugin with a GrapesJS instance, and thoroughly test it for functionality and user experience.\n7. **Documentation and Distribution**: Document your plugin's usage instructions and publish it for others to utilize, whether on platforms like npm or in the GrapesJS community.""}]",knowledge/js/grapesjs/api,1.0,train
"[{""from"": ""human"", ""value"": ""What types of functionalities can be added by extending GrapesJS with APIs?""}, {""from"": ""gpt"", ""value"": ""By extending GrapesJS with APIs, developers can add a variety of functionalities, such as:\n1. **Custom UI Components**: Build unique user interface components tailored to specific application needs that are not part of the default GrapesJS offerings.\n2. **Improved User Interactions**: Create enhanced interaction patterns, such as drag-and-drop functionality, that provide a more intuitive editing experience for users.\n3. **Data Persistence**: Implement functionality for saving user-generated content either locally using browser storage or externally through an API, ensuring that users can manage their templates effectively.\n4. **Integration with Third-party Libraries**: Connect your application to various third-party libraries, frameworks, or services, expanding the utility of the editor beyond the core GrapesJS features.\n5. **Conditional Logic**: Introduce conditional features within the editor, allowing users to create dynamic templates that can adapt to different scenarios or user inputs.\n6. **Advanced Styling Options**: Offer additional styling capabilities that let users customize their components beyond the default options available within GrapesJS.""}]",knowledge/js/grapesjs/api,1.0,train
