conversations,source,score,split
"[{""from"": ""human"", ""value"": ""What are the main properties of a Selector in GrapesJS?""}, {""from"": ""gpt"", ""value"": ""The main properties of a Selector in GrapesJS include:\n\n- **name (String)**: This is the name of the selector, for example, 'my-class'.\n- **label (String)**: This represents the label for the selector, such as 'My Class'.\n- **type (Number, optional)**: This denotes the type of the selector; it can be either `1` for class or `2` for id.\n- **active (Boolean, optional)**: If this property is set to false, the selector will not be selectable by the Style Manager.\n- **private (Boolean, optional)**: When set to true, the selector cannot be seen by the Style Manager, but it will still be rendered in the canvas and included in the export code.\n- **protected (Boolean, optional)**: If this property is true, the selector cannot be removed from the attached component.""}]",knowledge/js/grapesjs/api,1.0,train
"[{""from"": ""human"", ""value"": ""How does the `toString` method of a Selector work?""}, {""from"": ""gpt"", ""value"": ""The `toString` method of a Selector in GrapesJS converts the selector into a string format suitable for CSS usage. For example, if a selector object has a name property with the value 'my-selector' and type `2` (indicating it's an id), calling `selector.toString()` will return '#my-selector'. The method uses the type of selector to determine the appropriate CSS syntax.\n\nHere is how you can use the `toString` method:\n```javascript\n// Given such selector: { name: 'my-selector', type: 2 }\nconsole.log(selector.toString());\n// -> `#my-selector`\n```""}]",knowledge/js/grapesjs/api,1.0,train
"[{""from"": ""human"", ""value"": ""Can you provide a code example demonstrating the `getName` method?""}, {""from"": ""gpt"", ""value"": ""Certainly! The `getName` method retrieves the name of the selector. Here's a complete example:\n\n```javascript\n// Define a selector with a name and label\nlet selector = {\n    name: 'my-selector',\n    label: 'My selector',\n    getName: function() {\n        return this.name;\n    }\n};\n\n// Call getName to get the selector name\nconsole.log(selector.getName());\n// -> `my-selector`\n```  \nIn this example, `getName` accesses the `name` property of the selector object and returns it.""}]",knowledge/js/grapesjs/api,1.0,train
"[{""from"": ""human"", ""value"": ""What does the `setLabel` method do in a Selector and how is it used?""}, {""from"": ""gpt"", ""value"": ""The `setLabel` method is used to update the label of a Selector in GrapesJS. It takes one parameter, which is the new label string that you wish to set. \n\nHere is an example of how to use the `setLabel` method:\n\n```javascript\n// Create a selector object with a name and label\nlet selector = {\n    name: 'my-selector',\n    label: 'My selector',\n    setLabel: function(label) {\n        this.label = label;\n    },\n    getLabel: function() {\n        return this.label;\n    }\n};\n\n// Update the label\nselector.setLabel('New Label');\nconsole.log(selector.getLabel());\n// -> `New Label`\n```  \nIn this example:\n1. We define a selector with a name and an initial label.\n2. We update the label using the `setLabel` method.\n3. Finally, we retrieve the new label with `getLabel`, demonstrating that the label has been successfully updated.""}]",knowledge/js/grapesjs/api,1.0,train
"[{""from"": ""human"", ""value"": ""What is the purpose of the `getActive` and `setActive` methods in a Selector?""}, {""from"": ""gpt"", ""value"": ""The `getActive` and `setActive` methods in a Selector are used to manage the active state of the selector. \n\n- **getActive**: This method returns the current active state of the selector as a boolean value. If the selector is active, it will return true; otherwise, it will return false.\n- **setActive**: This method accepts a boolean parameter `value`, which sets the active state of the selector. \n\nHere is how they might be implemented and used:\n\n```javascript\n// Define a selector object with name and active properties\nlet selector = {\n    name: 'my-selector',\n    active: true,\n    getActive: function() {\n        return this.active;\n    },\n    setActive: function(value) {\n        this.active = value;\n    }\n};\n\n// Check the current active state\nconsole.log(selector.getActive());\n// -> `true`\n\n// Update the active state\nselector.setActive(false);\nconsole.log(selector.getActive());\n// -> `false`\n```  \nIn this example, you can see how the active state is retrieved and updated through the `getActive` and `setActive` methods.""}]",knowledge/js/grapesjs/api,1.0,train
"[{""from"": ""human"", ""value"": ""How would you implement a Selector with the ability to toggle its active state?""}, {""from"": ""gpt"", ""value"": ""To implement a Selector with the ability to toggle its active state, you can create a method that changes the state between active or inactive based on its current value. Below is a full code example demonstrating this:\n\n```javascript\n// Define a selector object with initial properties\nlet selector = {\n    name: 'my-selector',\n    active: true,\n    toggleActive: function() {\n        this.active = !this.active;\n    },\n    getActive: function() {\n        return this.active;\n    }\n};\n\n// Initial active state\nconsole.log(selector.getActive());\n// -> `true`\n\n// Toggle active state\nselector.toggleActive();\nconsole.log(selector.getActive());\n// -> `false`\n\n// Toggle active state again\nselector.toggleActive();\nconsole.log(selector.getActive());\n// -> `true`\n```  \nIn this example:\n1. A simple selector object is defined with an `active` property and a `toggleActive` method.\n2. The `toggleActive` method negates the current value of the `active` property, effectively switching it between `true` and `false`.\n3. The state is logged before and after each toggle.""}]",knowledge/js/grapesjs/api,1.0,train
"[{""from"": ""human"", ""value"": ""Can you explain the importance of the `protected` property in a Selector?""}, {""from"": ""gpt"", ""value"": ""The `protected` property in a Selector is important for ensuring the integrity and stability of certain elements within the framework. When `protected` is set to true, it prevents the selector from being removed from any attached component, providing a level of protection that can be crucial in certain scenarios:\n\n1. **Preventing Accidental Deletion**: By marking a selector as protected, you help ensure that important components are not accidentally deleted during manipulation of the DOM or style management.\n2. **Maintaining Integrity**: If certain styles or functionalities depend on the presence of the selector, protecting it helps maintain the intended design and behavior of the application.\n3. **User Experience**: For users utilizing the Style Manager, the protected property can prevent confusion and errors when they attempt to modify the styles of key components that should not be deleted.\n\nBelow is a basic example of how you might define a protected selector:\n```javascript\nlet selector = {\n    name: 'my-protected-selector',\n    protected: true,\n};\n\n// Attempt to remove the protected selector\nif (!selector.protected) {\n    // Removal code here\n} else {\n    console.log('This selector is protected and cannot be removed.');\n}\n```  \nIn this example, the `protected` property is checked before removing the selector, ensuring that it remains intact.""}]",knowledge/js/grapesjs/api,1.0,train
"[{""from"": ""human"", ""value"": ""What data types are acceptable for the `name`, `label`, and `type` properties of a Selector?""}, {""from"": ""gpt"", ""value"": ""In GrapesJS, the acceptable data types for the properties of a Selector are as follows:\n- **name (String)**: The name of the selector must be a string. It represents the identifier for the selector, such as 'my-class'.\n- **label (String)**: Similar to the name, the label must also be a string. It provides a human-readable label for the selector, such as 'My Class'.\n- **type (Number, optional)**: This property can be a number; it typically indicates the type of selector (either `1` for class or `2` for id).\n\nFor more context, here's how you can verify the types in a simple JavaScript snippet:\n```javascript\nfunction createSelector(name, label, type) {\n    if (typeof name !== 'string' || typeof label !== 'string') {\n        throw new TypeError('Name and label must be strings.');\n    }\n    if (type !== undefined && typeof type !== 'number') {\n        throw new TypeError('Type must be a number.');\n    }\n    return {\n        name,\n        label,\n        type\n    };\n}\n\n// Example usage\nconst mySelector = createSelector('my-selector', 'My Selector', 1);\nconsole.log(mySelector);\n```""}]",knowledge/js/grapesjs/api,1.0,train
"[{""from"": ""human"", ""value"": ""How should the `private` property be used in the context of a Selector?""}, {""from"": ""gpt"", ""value"": ""The `private` property in a Selector serves to hide the selector from the Style Manager while still allowing it to function within the canvas and be included in the export code. This property can be particularly useful when you want to manage styles programmatically but do not want users to interfere with them directly through the Style Manager.\n\nHere\u2019s how you might define and use the `private` property in a Selector:\n\n```javascript\nlet selector = {\n    name: 'my-private-selector',\n    private: true,\n};\n\n// Checking the private property\nif (selector.private) {\n    console.log('This selector is private and not visible in the Style Manager.');\n} else {\n    console.log('This selector is visible in the Style Manager.');\n}\n```  \nIn this snippet, we define a selector with the `private` property set to `true`. It demonstrates how this property can be a decision point in allowing or restricting visibility in the Style Manager. Utilizing the `private` property this way can help maintain a clean interface for the user while keeping certain important styling rules intact.""}]",knowledge/js/grapesjs/api,1.0,train
"[{""from"": ""human"", ""value"": ""Can you summarize the functionalities offered by a Selector object in GrapesJS?""}, {""from"": ""gpt"", ""value"": ""A Selector object in GrapesJS offers several functionalities aimed at managing and manipulating style selectors effectively. Here\u2019s a summary of its key functionalities:\n\n1. **Property Management**: Allows setting and getting properties such as `name`, `label`, `active`, `private`, and `protected`, which help define the selector\u2019s characteristics and behavior within the framework.\n2. **State Management**: Provides methods like `getActive` and `setActive` to control the active state of the selector, determining whether it is selectable by the Style Manager.\n3. **Label Manipulation**: The `getLabel` and `setLabel` methods facilitate retrieving and changing the label associated with the selector, enhancing user interaction and understandability.\n4. **String Representation**: The `toString` method gives a simple string format of the selector, translating it into valid CSS syntax, aiding in debugging and style management.\n5. **Protection Mechanisms**: The `protected` and `private` properties ensure control over selector visibility and removability, maintaining structural integrity within the application.\n\nOverall, a Selector object serves as a crucial component in the style management system of GrapesJS, enabling developers to create structured and maintainable design templates.""}]",knowledge/js/grapesjs/api,1.0,train
