conversations,source,score,split
"[{""from"": ""human"", ""value"": ""What are the properties of a State in the context provided?""}, {""from"": ""gpt"", ""value"": ""The properties of a State include:\n1. **name**: A string representing the name of the state, such as 'hover' or 'nth-of-type(2n)'. This property allows developers to identify the state programmatically.\n2. **label**: A string representing the label of the state. Examples include 'Hover' or 'Even/Odd'. The label provides a human-readable version of the state name, making it easier to understand its purpose.""}]",knowledge/js/grapesjs/api,1.0,train
"[{""from"": ""human"", ""value"": ""What is the purpose of the getName method?""}, {""from"": ""gpt"", ""value"": ""The `getName` method is designed to retrieve the name of the state object. This method returns a string that represents the name, allowing the caller to access this property programmatically. It's useful for situations where the name needs to be used in further logic or functionality, such as adding to classes or setting styles dynamically.""}]",knowledge/js/grapesjs/api,1.0,train
"[{""from"": ""human"", ""value"": ""What does the getLabel method return when the label is not provided?""}, {""from"": ""gpt"", ""value"": ""When the label is not provided, the `getLabel` method will return the name of the state. This is a fallback mechanism that ensures a human-readable identifier is always available, even if the specific label for that state wasn't set. Essentially, it guarantees that the method always returns a meaningful string, either the designated label or the state name itself.""}]",knowledge/js/grapesjs/api,1.0,train
"[{""from"": ""human"", ""value"": ""Can you give an example of how the State properties can be utilized in code?""}, {""from"": ""gpt"", ""value"": ""Certainly! Below is an example of how the State properties can be utilized in JavaScript code:\n\n```javascript\nclass State {\n    constructor(name, label) {\n        this.name = name;\n        this.label = label || name; // Default to name if label isn't provided\n    }\n\n    getName() {\n        return this.name;\n    }\n\n    getLabel() {\n        return this.label;\n    }\n}\n\n// Example usage:\nconst hoverState = new State('hover', 'Hover');\nconsole.log(hoverState.getName()); // Outputs: hover\nconsole.log(hoverState.getLabel()); // Outputs: Hover\n\nconst evenState = new State('even'); // No label provided\nconsole.log(evenState.getName()); // Outputs: even\nconsole.log(evenState.getLabel()); // Outputs: even (because label was not provided) \n```""}]",knowledge/js/grapesjs/api,1.0,train
"[{""from"": ""human"", ""value"": ""What is the significance of using a fallback return value in the getLabel method?""}, {""from"": ""gpt"", ""value"": ""Using a fallback return value in the `getLabel` method is significant because it ensures that the method always provides a meaningful output. If a specific label is not provided, returning the state name prevents potential null or undefined values which could lead to issues when the label is accessed or displayed in user interfaces. This design choice enhances code robustness and helps maintain clear communication of state information to developers and users. Moreover, it enables consistency across different states\u2014ensuring that every state has a representative label, even if it's just the name itself.""}]",knowledge/js/grapesjs/api,1.0,train
"[{""from"": ""human"", ""value"": ""How would you modify the State class to include a description property?""}, {""from"": ""gpt"", ""value"": ""To modify the State class to include a `description` property, you can add an additional parameter in the constructor and a corresponding method for retrieving it. Here\u2019s how you might implement this:\n\n```javascript\nclass State {\n    constructor(name, label, description) {\n        this.name = name;\n        this.label = label || name; // Default to name if label isn't provided\n        this.description = description || 'No description available'; // Default description\n    }\n\n    getName() {\n        return this.name;\n    }\n\n    getLabel() {\n        return this.label;\n    }\n\n    getDescription() {\n        return this.description;\n    }\n}\n\n// Example usage:\nconst hoverState = new State('hover', 'Hover', 'Indicates the element is hovered over.');\nconsole.log(hoverState.getDescription()); // Outputs: Indicates the element is hovered over.\n\nconst evenState = new State('even'); // No label or description provided\nconsole.log(evenState.getDescription()); // Outputs: No description available\n```""}]",knowledge/js/grapesjs/api,1.0,train
"[{""from"": ""human"", ""value"": ""What advantages does using descriptive labels and states provide in application development?""}, {""from"": ""gpt"", ""value"": ""Using descriptive labels and states provides several advantages in application development:\n1. **Clarity**: Descriptive labels make it easier for developers and designers to understand what each state represents, leading to clearer communication and collaboration.\n2. **Maintainability**: Code with clear state names and labels is easier to maintain, as future developers can quickly grasp the purpose of each state without needing extensive documentation.\n3. **User Experience**: Clearly defined states can also enhance user experience; for instance, using a label like 'Hover' indicates interactive elements, guiding users in their interactions with the application.\n4. **Debugging**: Familiar and intuitive labels help during debugging processes, allowing developers to quickly identify issues related to specific states.\n5. **Consistency**: Using a standard naming and labeling convention promotes uniformity across the codebase, thereby reducing the chance of errors and improving code quality.""}]",knowledge/js/grapesjs/api,1.0,train
"[{""from"": ""human"", ""value"": ""What type of data does the 'label' property in a State contain?""}, {""from"": ""gpt"", ""value"": ""The 'label' property in a State contains a string value. This string serves as a human-readable identifier for the state, allowing for easier understanding and reference in user interfaces or documentation that require clear naming conventions.""}]",knowledge/js/grapesjs/api,1.0,train
"[{""from"": ""human"", ""value"": ""In what scenarios would you choose to implement a state with complex labels like 'nth-of-type(2n)'?""}, {""from"": ""gpt"", ""value"": ""Implementing a state with complex labels like 'nth-of-type(2n)' might be chosen in scenarios where specificity in styling is required, particularly in CSS or DOM manipulations. Here are a few situations where this could be applicable:\n1. **Dynamic Styling**: When you need different styles based on item position within a collection (like alternating row colors in a table), using 'nth-of-type' allows you to easily target elements without added classes.\n2. **Responsiveness**: For responsive designs, states based on element position can help adapt the layout dynamically based on the viewport size.\n3. **Automation**: This label can facilitate automation processes where scripts might need to modify styles or classes of elements based on their order or type.\n4. **Library Development**: If you're building a component library where states need to adhere to complex CSS rules, leveraging such labels enables greater flexibility and control over how components behave.""}]",knowledge/js/grapesjs/api,1.0,train
"[{""from"": ""human"", ""value"": ""Can the State class be extended to handle additional properties? If yes, how?""}, {""from"": ""gpt"", ""value"": ""Yes, the State class can be extended to handle additional properties through inheritance in JavaScript. This can be achieved by creating a subclass that adds more functionality. Here is an example of extending the State class to include a priority property:\n\n```javascript\nclass ExtendedState extends State {\n    constructor(name, label, description, priority) {\n        super(name, label, description); // Call the parent class constructor\n        this.priority = priority; // New property for priority\n    }\n\n    getPriority() {\n        return this.priority;\n    }\n}\n\n// Example usage:\nconst importantState = new ExtendedState('important', 'Important State', 'This state has a high priority.', 1);\nconsole.log(importantState.getPriority()); // Outputs: 1\n```""}]",knowledge/js/grapesjs/api,1.0,train
"[{""from"": ""human"", ""value"": ""What considerations should be made when designing a system with various states?""}, {""from"": ""gpt"", ""value"": ""When designing a system with various states, consider the following:\n1. **Clarity of Purpose**: Ensure each state has a clear purpose and can be easily understood by both developers and users.\n2. **Consistency**: Maintain consistency in naming conventions and expected behaviors across all states to avoid confusion.\n3. **Performance**: Evaluate the performance implications of having multiple states, especially if they involve significant computations or modifications to the DOM.\n4. **Scalability**: Design the state management system to scale easily if new states need to be introduced later, preferably through a modular approach.\n5. **Testing**: Implement robust testing strategies to ensure all state behaviors work as expected, both individually and in combination.\n6. **User Experience**: Understand how states will affect the overall user experience and ensure transitions are smooth and intuitive.""}]",knowledge/js/grapesjs/api,1.0,train
