conversations,source,score,split
"[{""from"": ""human"", ""value"": ""What is the purpose of the UndoManager module in GrapesJS?""}, {""from"": ""gpt"", ""value"": ""The UndoManager module in GrapesJS is designed to manage the stack of changes applied to the canvas. It allows users to track changes made during editing sessions and provides methods to undo and redo those changes, facilitating a more controlled and user-friendly editing experience. This is particularly useful in visual editors where users may need to revert or reapply modifications to their content.""}]",knowledge/js/grapesjs/api,1.0,train
"[{""from"": ""human"", ""value"": ""How do you initialize the UndoManager in GrapesJS?""}, {""from"": ""gpt"", ""value"": ""To initialize the UndoManager in GrapesJS, you first need to instantiate the editor and then access the UndoManager module through the editor instance. Here's how you can do it:\n\n```javascript\nconst editor = grapesjs.init({\n   // initialization options\n});\nconst um = editor.UndoManager;\n```  This gives you access to all methods provided by the UndoManager to manage the changes made in the canvas.""}]",knowledge/js/grapesjs/api,1.0,train
"[{""from"": ""human"", ""value"": ""Can you explain the usage of `add` method in the UndoManager?""}, {""from"": ""gpt"", ""value"": ""The `add` method in the UndoManager is used to track a specific entity, such as a Model or a Collection. This means that any changes to the added entity will be recorded in the undo stack, allowing users to revert or redo changes later.\n\n### Syntax\n```javascript\num.add(entity);\n```\n\n### Parameters\n- `entity` **(Model | Collection)**: The entity that you want to track.\n\n### Example\n```javascript\num.add(someModelOrCollection);\n```\n\nThis method returns `this`, allowing for method chaining.""}]",knowledge/js/grapesjs/api,1.0,train
"[{""from"": ""human"", ""value"": ""What does the `remove` method do in UndoManager?""}, {""from"": ""gpt"", ""value"": ""The `remove` method in the UndoManager is utilized to stop tracking a specific entity that was previously added. This means that any modifications to that entity will no longer be part of the undo stack, effectively untracking it.\n\n### Syntax\n```javascript\num.remove(entity);\n```\n\n### Parameters\n- `entity` **(Model | Collection)**: The entity to be removed from tracking.\n\n### Example\n```javascript\num.remove(someModelOrCollection);\n```\n\nAfter executing this method, the specified entity will no longer be monitored by the UndoManager.""}]",knowledge/js/grapesjs/api,1.0,train
"[{""from"": ""human"", ""value"": ""Describe the `undo` method and its optional parameter.""}, {""from"": ""gpt"", ""value"": ""The `undo` method allows users to revert the last change made on the canvas. This is useful for recovering from mistakes during editing.\n\n### Syntax\n```javascript\num.undo(all = true);\n```\n\n### Parameters\n- `all` **(optional, default `true`)**: This parameter specifies whether to undo all changes up to and including the last one. If set to `false`, only the last change will be undone, allowing for more granular control over the undo action.\n\n### Example\n```javascript\num.undo(); // This will undo the last change\n```""}]",knowledge/js/grapesjs/api,1.0,train
"[{""from"": ""human"", ""value"": ""How does the `skip` method work in UndoManager?""}, {""from"": ""gpt"", ""value"": ""The `skip` method in the UndoManager is used to execute a callback function while temporarily stopping the tracking of changes. This is beneficial when you want to perform some operations without affecting the undo/redo stack.\n\n### Syntax\n```javascript\num.skip(callback);\n```\n\n### Parameters\n- `callback` **[Function]**: The function to execute while tracking is paused.\n\n### Example\n```javascript\num.skip(() => {\n   // Do stuff without tracking changes\n});\n```\n\nDuring the execution of the callback, any changes made will not be recorded in the undo stack, allowing for actions that should not be undoable.""}]",knowledge/js/grapesjs/api,1.0,train
"[{""from"": ""human"", ""value"": ""What is the purpose of the `clear` method in UndoManager?""}, {""from"": ""gpt"", ""value"": ""The `clear` method in the UndoManager is used to empty the stack of changes that have been recorded. This means that once the method is called, all previously tracked changes will be removed from the UndoManager, and the user will not be able to undo any actions that took place before the clearing.\n\n### Syntax\n```javascript\num.clear();\n```\n\n### Example\n```javascript\num.clear(); // This will clear all recorded changes\n```""}]",knowledge/js/grapesjs/api,1.0,train
"[{""from"": ""human"", ""value"": ""How can you check if there are any available undo actions using UndoManager?""}, {""from"": ""gpt"", ""value"": ""To check if there are any available undo actions in the UndoManager, you can use the `hasUndo` method, which returns a boolean indicating whether there is an action to undo. This is particularly useful in UI contexts where you need to enable or disable undo buttons based on available actions.\n\n### Syntax\n```javascript\num.hasUndo();\n```\n\n### Example\n```javascript\nif (um.hasUndo()) {\n   console.log('Undo is available.');\n} else {\n   console.log('No actions to undo.');\n}\n```""}]",knowledge/js/grapesjs/api,1.0,train
"[{""from"": ""human"", ""value"": ""Can you explain how the `getStack` method works in UndoManager?""}, {""from"": ""gpt"", ""value"": ""The `getStack` method retrieves the current stack of changes that have been recorded by the UndoManager. This allows you to inspect the changes that can be undone or redone, making it a powerful tool for debugging or understanding the sequence of changes.\n\n### Syntax\n```javascript\nconst stack = um.getStack();\n```\n\n### Example\n```javascript\nconst stack = um.getStack();\nstack.each(item => {\n   console.log(item); // process each item in the stack\n});\n```\n\nThis method returns a Collection of the stored changes, which can be iterated over to analyze or display the change history.""}]",knowledge/js/grapesjs/api,1.0,train
"[{""from"": ""human"", ""value"": ""What is the significance of the `hasRedo` method?""}, {""from"": ""gpt"", ""value"": ""The `hasRedo` method in the UndoManager is significant because it allows you to determine if there are any actions available to redo. This is essential for enabling or disabling redo buttons in the user interface, ensuring a responsive experience for users navigating through their editing history.\n\n### Syntax\n```javascript\num.hasRedo();\n```\n\n### Example\n```javascript\nif (um.hasRedo()) {\n   console.log('Redo is available.');\n} else {\n   console.log('No actions to redo.');\n}\n```""}]",knowledge/js/grapesjs/api,1.0,train
"[{""from"": ""human"", ""value"": ""Can you give an example of how to use the `stop` method in the UndoManager?""}, {""from"": ""gpt"", ""value"": ""The `stop` method is used to temporarily suspend tracking changes. This can be useful when you want to make bulk changes without recording each individual change in the undo stack. Here's an example of how to use it:\n\n### Example\n```javascript\num.stop(); // Stops tracking changes\n// Perform multiple operations\num.start(); // Resumes tracking changes\n```  By stopping the tracking, you can prevent cluttering the undo stack with intermediary changes.""}]",knowledge/js/grapesjs/api,1.0,train
"[{""from"": ""human"", ""value"": ""What happens when you call the `removeAll` method on the UndoManager?""}, {""from"": ""gpt"", ""value"": ""When you call the `removeAll` method on the UndoManager, it removes all entities that are currently being tracked. This stops tracking all actions related to those entities, and they will no longer be included in the undo or redo operations.\n\n### Syntax\n```javascript\num.removeAll();\n```\n\n### Example\n```javascript\num.removeAll(); // This will stop tracking all entities\n```""}]",knowledge/js/grapesjs/api,1.0,train
"[{""from"": ""human"", ""value"": ""How do you check if an entity is registered with UndoManager?""}, {""from"": ""gpt"", ""value"": ""To check if an entity (Model or Collection) is registered with the UndoManager, you can use the `isRegistered` method. This method checks if the specified entity is currently tracked in the stack.\n\n### Syntax\n```javascript\nconst isRegistered = um.isRegistered(entity);\n```\n\n### Parameters\n- `entity` **(Model | Collection)**: The entity you want to check.\n\n### Example\n```javascript\nconst registeredStatus = um.isRegistered(someModelOrCollection);\nif (registeredStatus) {\n   console.log('Entity is registered.');\n} else {\n   console.log('Entity is not registered.');\n}\n```""}]",knowledge/js/grapesjs/api,1.0,train
"[{""from"": ""human"", ""value"": ""What does the `redoAll` method accomplish in the UndoManager?""}, {""from"": ""gpt"", ""value"": ""The `redoAll` method in the UndoManager is used to redo all changes that have been undone. This essentially re-applies all of the changes that were previously reverted, restoring the canvas to its latest state prior to the undo actions.\n\n### Syntax\n```javascript\num.redoAll();\n```\n\n### Example\n```javascript\num.redoAll(); // This will redo all previously undone changes\n```""}]",knowledge/js/grapesjs/api,1.0,train
"[{""from"": ""human"", ""value"": ""What can you do with the `getConfig` method in the UndoManager?""}, {""from"": ""gpt"", ""value"": ""The `getConfig` method in the UndoManager retrieves the configuration object associated with the undo manager. This allows users to access any customizable parameters that define how the undo manager behaves.""}]",knowledge/js/grapesjs/api,1.0,train
"[{""from"": ""human"", ""value"": ""Can you provide a code snippet showing how to add an entity to UndoManager and then remove it?""}, {""from"": ""gpt"", ""value"": ""Sure! Below is a simple code snippet demonstrating how to add an entity to the UndoManager and subsequently remove it:\n\n```javascript\nconst editor = grapesjs.init();\nconst um = editor.UndoManager;\n\n// Assume someModelOrCollection is an existing Model or Collection\num.add(someModelOrCollection); // Add an entity to track\n\n// Later on, if you want to stop tracking it:\num.remove(someModelOrCollection); // Remove the entity from tracking\n```""}]",knowledge/js/grapesjs/api,1.0,train
"[{""from"": ""human"", ""value"": ""What would happen if you call `clear` on the UndoManager without any changes having been made?""}, {""from"": ""gpt"", ""value"": ""If you call the `clear` method on the UndoManager without any changes having been made, it will simply have no effect. The stack will remain empty as there are no recorded changes to remove. It\u2019s a safe operation that does not cause any errors.""}]",knowledge/js/grapesjs/api,1.0,train
"[{""from"": ""human"", ""value"": ""How to correctly use `start` and `stop` methods around a batch of changes?""}, {""from"": ""gpt"", ""value"": ""To correctly use the `start` and `stop` methods around a batch of changes in the UndoManager, you would stop tracking before making multiple changes and then start tracking again afterward. This way, you prevent individual changes from cluttering the undo stack. Here's an example:\n\n```javascript\num.stop(); // Temporarily stop tracking\n\n// Perform multiple changes here, e.g.:\nsomeModelOrCollection.set(...);\n\num.start(); // Resume tracking changes\n```""}]",knowledge/js/grapesjs/api,1.0,train
"[{""from"": ""human"", ""value"": ""What are some best practices to consider while using UndoManager?""}, {""from"": ""gpt"", ""value"": ""When using UndoManager effectively, consider the following best practices:\n1. **Clear Redundant Changes**: Use methods like `removeAll` to clear unnecessary tracked changes which could overwhelm the stack.\n2. **Batch Changes**: Use the `start` and `stop` methods to batch multiple changes into one undoable action, keeping the stack manageable.\n3. **Use `skip` Wisely**: If certain operations should not be undoable, utilize the `skip` method to prevent them from being recorded.\n4. **Check Availability**: Always check with `hasUndo` and `hasRedo` before calling undo/redo actions to avoid unnecessary errors or exceptions.\n5. **Implement Robust Error Handling**: Ensure to handle scenarios where undo or redo actions cannot be performed gracefully.""}]",knowledge/js/grapesjs/api,1.0,train
"[{""from"": ""human"", ""value"": ""Explain the difference between `undo`, `undoAll`, `redo`, and `redoAll` methods.""}, {""from"": ""gpt"", ""value"": ""The `undo` and `redo` methods in the UndoManager operate on a last-in-first-out basis, allowing users to revert the last change or reapply it, respectively. Specifically:  \n- **`undo`**: Reverts only the most recent change, optionally depending on the `all` parameter. \n- **`undoAll`**: Completely undoes all changes back to the initial state, clearing the entire stack of actions made.  \n- **`redo`**: Reapplies the last change that was undone. It also accepts an `all` parameter to define the scope of the redo. \n- **`redoAll`**: Reapplies all changes that were undone in one go, restoring the state to just before the last complete undo action was executed.""}]",knowledge/js/grapesjs/api,1.0,train
"[{""from"": ""human"", ""value"": ""How can you use `um.getStack()` in a practical scenario?""}, {""from"": ""gpt"", ""value"": ""You can use `um.getStack()` in practical scenarios to analyze the history of changes, for instance, displaying actions for an undo/redo interface. You can iterate over the returned collection to show which actions can be undone or redone. Here's a practical scenario:\n\n```javascript\nconst stack = um.getStack();\nstack.each(item => {\n   console.log(item); // Each item in the stack can be processed or displayed in the UI\n});\n```\n\nThis snippet can help a developer create an undo/redo history view in the application.""}]",knowledge/js/grapesjs/api,1.0,train
"[{""from"": ""human"", ""value"": ""Can you provide an example usage of the `skip` method for temporary context?""}, {""from"": ""gpt"", ""value"": ""Certainly! A common use case for the `skip` method is when you want to perform certain operations without the changes being recorded. Here's an example:\n\n```javascript\num.skip(() => {\n   // Making changes that should not be tracked\n   someModelOrCollection.set({ name: 'Temporary Change' });\n   someModelOrCollection.add({ type: 'newComponent' });\n});\n// Outside of the callback, changes are tracked again\n``` \nIn this case, any changes made inside the `skip` callback will not be included in the undo/redo stack.""}]",knowledge/js/grapesjs/api,1.0,train
"[{""from"": ""human"", ""value"": ""How do you approach handling errors related to tracking in the UndoManager?""}, {""from"": ""gpt"", ""value"": ""Handling errors related to tracking in the UndoManager involves several best practices: 1. **Pre-check States**: Before performing undo or redo actions, use `hasUndo` and `hasRedo` to verify appropriate states are available, preventing operations on empty stacks. 2. **Error Catching/Handling**: Surround critical operations with try/catch blocks to capture any unexpected issues. 3. **User Notifications**: Inform users through the UI if their action cannot be completed due to lack of history, ensuring a better user experience.""}]",knowledge/js/grapesjs/api,1.0,train
"[{""from"": ""human"", ""value"": ""In what scenarios would the `removeAll` method be particularly useful?""}, {""from"": ""gpt"", ""value"": ""The `removeAll` method would be particularly useful in scenarios such as: 1. **Resetting Context**: When reloading a segment of the application and wanting to clear the existing state of tracked changes. 2. **Undo Stack Management**: To clear out tracked changes after certain operations are finalized to simplify the undo history after a bulk update. 3. **Initial State Restoration**: Useful during the initialization of components where prior changes are no longer relevant.""}]",knowledge/js/grapesjs/api,1.0,train
"[{""from"": ""human"", ""value"": ""How would you implement a feature to allow 'undo' and 'redo' actions in a user interface using UndoManager?""}, {""from"": ""gpt"", ""value"": ""To implement 'undo' and 'redo' actions in a user interface using the UndoManager, follow these steps:\n1. **Setup Event Listeners**: Attach buttons or keyboard shortcuts to invoke `um.undo()` and `um.redo()`. \n   \n```javascript\ndocument.getElementById('undoBtn').addEventListener('click', () => {\n   if (um.hasUndo()) um.undo();\n});\n\ndocument.getElementById('redoBtn').addEventListener('click', () => {\n   if (um.hasRedo()) um.redo();\n});\n```  \n2. **Visual Feedback**: Update the state of buttons (enabled/disabled) based on the availability of undo/redo actions using `hasUndo` and `hasRedo`.  \n3. **Apply Changes**: Whenever a change occurs, ensure to add it with `um.add()` before proceed to alter it.""}]",knowledge/js/grapesjs/api,1.0,train
"[{""from"": ""human"", ""value"": ""What are the key benefits of using UndoManager in a web application?""}, {""from"": ""gpt"", ""value"": ""The key benefits of using the UndoManager in a web application include: 1. **User Control**: It empowers users to reverse mistakes and experiment freely without the fear of losing work. 2. **Enhanced Usability**: Provides a familiar and expected behavior (undo/redo), improving overall user experience. 3. **Change Management**: Enables structured handling of changes, making it easier to maintain application state. 4. **Improved Debugging**: As it keeps track of changes, developers can analyze actions, troubleshoot issues, and improve the editing interface effectively.""}]",knowledge/js/grapesjs/api,1.0,train
